source,rank,headline,link,collected_at_iso
India Today,22,Are Taylor Swift and Travis Kelce getting married on July 4? Here's the truth,https://www.indiatoday.in/entertainment/music/story/are-taylor-swift-and-travis-kelce-getting-married-on-july-4-heres-the-truth-2934230-2026-06-25,2026-06-25T14:32:58+00:00
India Today,23,14-year-old girl selected for international space mission ‘ShakthiSAT’,https://www.indiatoday.in/education-today/news/story/mahima-rajput-shakthisat-moon-mission-class-10-student-2934235-2026-06-25,2026-06-25T14:32:58+00:00
India Today,24,"UP man marries mother-in-law, video of court ceremony goes viral",https://www.indiatoday.in/trending-news/story/up-son-in-law-marries-mother-in-law-video-of-kanpur-court-ceremony-goes-viral-2923459-2026-06-08,2026-06-25T14:32:58+00:00
India Today,25,"Video: Railway cop tied up, thrashed to death in Odisha over alleged harassment",https://www.indiatoday.in/india/story/odisha-grp-constable-soumya-ranjan-swain-lynched-by-mob-in-khordha-2908273-2026-05-07,2026-06-25T14:32:58+00:00
India Today,26,"Nagpur college student rapes, impregnates stepmother; arrested",https://www.indiatoday.in/india/story/nagpur-student-arrested-for-alleged-rape-of-stepmother-after-complaint-2908170-2026-05-07,2026-06-25T14:32:58+00:00
TOI ETimes,1,Indian women’s saree ramp walk near Eiffel Tower sparks debate online: Celebration of culture or social media cringe?,https://timesofindia.indiatimes.com/articleshow/131454770.cms,2026-06-25T14:32:58+00:00
TOI ETimes,2,Meet Rounak Adhikary: Ashneer Grover once told him ‘Tu Baith Jaa Yaar’ and cut off his pitch mid-sentence; now he's living every startup founder's dream,https://timesofindia.indiatimes.com/articleshow/131419890.cms,2026-06-25T14:32:58+00:00
TOI ETimes,3,Hyderabad-based Amazon employee shares what not to say at work,https://timesofindia.indiatimes.com/articleshow/130726842.cms,2026-06-25T14:32:58+00:00
TOI ETimes,4,Salad topper recalled over salmonella risk,https://timesofindia.indiatimes.com/articleshow/130458722.cms,2026-06-25T14:32:58+00:00
TOI ETimes,5,Rebel Wilson weight loss: How she lost 36 kgs without extreme dieting - Ozempic or lifestyle?,https://timesofindia.indiatimes.com/articleshow/130457577.cms,2026-06-25T14:32:58+00:00
TOI ETimes,6,Dhanush and the team of 'Om' honour Mammootty for Padma Bhushan,https://timesofindia.indiatimes.com/articleshow/131995340.cms,2026-06-25T14:32:58+00:00
TOI ETimes,7,"Big B, Shabana Azmi's co-star now runs a Rs 120 crore poultry business",https://timesofindia.indiatimes.com/articleshow/131994549.cms,2026-06-25T14:32:58+00:00
TOI ETimes,8,'Welcome to the Jungle' day 1 box office prediction,https://timesofindia.indiatimes.com/articleshow/131991214.cms,2026-06-25T14:32:58+00:00
TOI ETimes,9,"'Ranbir Kapoor's Ramayana will beat Dhurandhar's records,' says film exhibitor",https://timesofindia.indiatimes.com/articleshow/131992911.cms,2026-06-25T14:32:58+00:00
TOI ETimes,10,Alka Yagnik addresses health concerns after wheel chair video goes viral,https://timesofindia.indiatimes.com/articleshow/131988062.cms,2026-06-25T14:32:58+00:00
TOI ETimes,11,"Shobhaa De has a blunt take on 'Cocktail 2', but Saba's comment grabs attention",https://timesofindia.indiatimes.com/articleshow/131989408.cms,2026-06-25T14:32:58+00:00
TOI ETimes,12,"'Spat paan on Amitabh Bachchan's shirt,' Bindu says the actor thought of quitting Bollywood: 'His films were flopping, Allahabad ka ticket wapas katwana padega'",https://timesofindia.indiatimes.com/articleshow/131996122.cms,2026-06-25T14:32:58+00:00
TOI ETimes,13,"‘Listen to me, I have a story to tell,’ Vikram Bhatt compares audience connection to a child and mother",https://timesofindia.indiatimes.com/articleshow/131996128.cms,2026-06-25T14:32:58+00:00
TOI ETimes,14,Divya Dutta on Bollywood vs Regional Cinema: 'You cannot generalize an entire industry',https://timesofindia.indiatimes.com/articleshow/131994116.cms,2026-06-25T14:32:58+00:00
TOI ETimes,15,"'Gut wrenching, painful': 26/11 survivor Rajita Bagga’s emotional reaction to ‘Dhurandhar’ resurfaces as Rajkummar Rao starrer ‘Prahaar’ teaser drops",https://timesofindia.indiatimes.com/articleshow/131993621.cms,2026-06-25T14:32:58+00:00
TOI ETimes,16,'Cocktail 2' BO Day 7 [LIVE]: Shahid's film eyes Rs 80 cr mark,https://timesofindia.indiatimes.com/articleshow/131987910.cms,2026-06-25T14:32:58+00:00
TOI ETimes,17,Diljit's Main Vaapas Aaunga crosses Rs 51 cr worldwide on Day 13,https://timesofindia.indiatimes.com/articleshow/131979995.cms,2026-06-25T14:32:58+00:00
TOI ETimes,18,Shahid's 'Cocktail 2' crosses Rs 100 cr worldwide on Day 6,https://timesofindia.indiatimes.com/articleshow/131979848.cms,2026-06-25T14:32:58+00:00
TOI ETimes,19,'Cocktail 2' BO Day 6 [LIVE]: Eyes Rs 75 crore before 'Welcome to the Jungle' arrives,https://timesofindia.indiatimes.com/articleshow/131960677.cms,2026-06-25T14:32:58+00:00
TOI ETimes,20,Diljit's Main Vaapas Aaunga crosses Rs 48 cr globally on Day 12,https://timesofindia.indiatimes.com/articleshow/131952404.cms,2026-06-25T14:32:58+00:00
TOI ETimes,21,'Cocktail 2' BO Day 5: Shahid starrer hits Rs 95 cr worldwide,https://timesofindia.indiatimes.com/articleshow/131952358.cms,2026-06-25T14:32:58+00:00
TOI ETimes,22,Animal Preview: Ranbir Kapoor and Sandeep Reddy Vanga are set to shake up the box office hierarchy,https://timesofindia.indiatimes.com/articleshow/105615612.cms,2026-06-25T14:32:58+00:00
TOI ETimes,23,Tu Jhoothi Main Makkaar,https://timesofindia.indiatimes.com/articleshow/98272134.cms,2026-06-25T14:32:58+00:00
TOI ETimes,24,Asit Modi Pays Tribute: TMKOC creator mourns Arvind,https://timesofindia.indiatimes.com/articleshow/131989633.cms,2026-06-25T14:32:58+00:00
TOI ETimes,25,Gurmeet Choudhary embraces village life in Manali,https://timesofindia.indiatimes.com/articleshow/131989334.cms,2026-06-25T14:32:58+00:00
TOI ETimes,26,Charu emotional as she opens up about battling loneliness,https://timesofindia.indiatimes.com/articleshow/131987942.cms,2026-06-25T14:32:58+00:00
TOI ETimes,27,Lock Upp 2: Yogesh Rawat and Akanksha Chaudhary join new season,https://timesofindia.indiatimes.com/articleshow/131986584.cms,2026-06-25T14:32:58+00:00
TOI ETimes,28,Pankaj Bhadouria to undergo 12 chemo sessions,https://timesofindia.indiatimes.com/articleshow/131987587.cms,2026-06-25T14:32:58+00:00
TOI ETimes,29,Sudha Chandran’s inspiring comeback: actor recalls losing leg,https://timesofindia.indiatimes.com/articleshow/131993836.cms,2026-06-25T14:32:58+00:00
TOI ETimes,30,Smita on motherhood: says work made her miss key moments,https://timesofindia.indiatimes.com/articleshow/131990949.cms,2026-06-25T14:32:58+00:00
TOI ETimes,31,Mumbai vs Navi Mumbai: Where does your ₹2 crore buy a better home?,https://timesofindia.indiatimes.com/articleshow/131994348.cms,2026-06-25T14:32:58+00:00
TOI ETimes,32,"Nafisa Ali’s 11,000-ft Rohtang trek amid stage 4 cancer battle is inspiring travellers; here’s why this Himalayan journey deserves a spot on your bucket list",https://timesofindia.indiatimes.com/articleshow/131992011.cms,2026-06-25T14:32:58+00:00
TOI ETimes,33,What is water manifestation? 7 viral affirmations people are using to make their mornings magical,https://timesofindia.indiatimes.com/articleshow/131988631.cms,2026-06-25T14:32:58+00:00
TOI ETimes,34,Inside the White House: Kai Trump's 'unprecedented' tour of 'her house' sparks fierce backlash online,https://timesofindia.indiatimes.com/articleshow/131995980.cms,2026-06-25T14:32:58+00:00
TOI ETimes,35,'Absolutely diabolical': Why are people calling China's Natasha dolls 'racist' and raising arms online,https://timesofindia.indiatimes.com/articleshow/131994653.cms,2026-06-25T14:32:58+00:00
TOI ETimes,36,“You cannot imprison the truth”: Greta Thunberg’s fiery message for Pakistan after Mahrang Baloch gets life sentence,https://timesofindia.indiatimes.com/articleshow/131990631.cms,2026-06-25T14:32:58+00:00
TOI ETimes,37,"₹15,000 a night in Rishikesh? Indian traveller skips Uttarakhand, books Sri Lanka instead: ‘Better value, cleaner air’",https://timesofindia.indiatimes.com/articleshow/131988566.cms,2026-06-25T14:32:58+00:00
TOI ETimes,38,AI-househelp: Indians are training robots to take on household chores,https://timesofindia.indiatimes.com/articleshow/131983340.cms,2026-06-25T14:32:58+00:00
TOI ETimes,39,'Nobody will throw you out': Korean traveller gets unexpected welcome at Jaipur royal wedding,https://timesofindia.indiatimes.com/articleshow/131987045.cms,2026-06-25T14:32:58+00:00
TOI ETimes,40,Clive Davis passes away at 94; stars pay tribute,https://timesofindia.indiatimes.com/articleshow/131920176.cms,2026-06-25T14:32:58+00:00
TOI ETimes,41,Travis Kelce dances on Taylor Swift’s remix ‘Opalite’,https://timesofindia.indiatimes.com/articleshow/131887405.cms,2026-06-25T14:32:58+00:00
TOI ETimes,42,Sharon Osbourne reveals an 'unexpected' hospital visit,https://timesofindia.indiatimes.com/articleshow/131870582.cms,2026-06-25T14:32:58+00:00
TOI ETimes,43,Katy Perry playfully calls out exes during concert,https://timesofindia.indiatimes.com/articleshow/131886283.cms,2026-06-25T14:32:58+00:00
TOI ETimes,44,Madonna’s Unusual Dating Rules: Singer recalls bathtub-based romances; shares rare love-life update,https://timesofindia.indiatimes.com/articleshow/131857955.cms,2026-06-25T14:32:58+00:00
TOI ETimes,45,"Jelly Roll addresses Bunnie Xo divorce, denies cheating rumours",https://timesofindia.indiatimes.com/articleshow/131853982.cms,2026-06-25T14:32:58+00:00
TOI ETimes,46,Beyond Ebooks: The charm of bookstores endures,https://timesofindia.indiatimes.com/articleshow/101098088.cms,2026-06-25T14:32:58+00:00
TOI ETimes,47,It’s a curtain call: Sania Mirza bids adieu to tennis with ‘happy tears’,https://timesofindia.indiatimes.com/articleshow/98440670.cms,2026-06-25T14:32:58+00:00
TOI ETimes,48,A magical makeover for 17th Century stepwell: From neglected ruins to a glorious piece of history,https://timesofindia.indiatimes.com/articleshow/96557955.cms,2026-06-25T14:32:58+00:00
TOI ETimes,49,The city comes alive with Christmas fervour,https://timesofindia.indiatimes.com/articleshow/96406573.cms,2026-06-25T14:32:58+00:00
TOI ETimes,50,#BringRioHome: Pet parents launch search to find their kidnapped cat,https://timesofindia.indiatimes.com/articleshow/96334809.cms,2026-06-25T14:32:58+00:00
TOI ETimes,51,"Anupam Kher shares mantra for a happy 41-year marriage with Kirron Kher, reacts to Gen Z dating terms like situationship, benching - EXCLUSIVE",https://timesofindia.indiatimes.com/articleshow/131228920.cms,2026-06-25T14:32:58+00:00
TOI ETimes,52,Anupam Kher opens up on challenging himself at 71 and returning to theatre after doing 550 films: 'I don't take myself seriously' - Exclusive,https://timesofindia.indiatimes.com/articleshow/131115309.cms,2026-06-25T14:32:58+00:00
TOI ETimes,53,"Horror needs the stage to conspire with you, says Gopal Datt",https://timesofindia.indiatimes.com/articleshow/130598133.cms,2026-06-25T14:32:58+00:00
TOI ETimes,54,"Theatre is magic, and it’s time audiences felt it again: Gopal Datt",https://timesofindia.indiatimes.com/articleshow/130595267.cms,2026-06-25T14:32:58+00:00
TOI ETimes,55,Adil Hussain’s 'Mercy' release date OUT: Film's first look to be attached with Ranveer Singh's 'Dhurandhar: The Revenge',https://timesofindia.indiatimes.com/articleshow/129843424.cms,2026-06-25T14:32:58+00:00
TOI ETimes,56,It’s the best time to be doing theatre: Juhi Babbar Soni,https://timesofindia.indiatimes.com/articleshow/129826631.cms,2026-06-25T14:32:58+00:00
TOI ETimes,57,Raj Kundra and Shilpa Shetty's 15th Wedding Anniversary,https://timesofindia.indiatimes.com/articleshow/115563990.cms,2026-06-25T14:32:58+00:00
TOI ETimes,58,​Bigg Boss winners list from season 1 to 17​,https://timesofindia.indiatimes.com/articleshow/114277426.cms,2026-06-25T14:32:58+00:00
TOI ETimes,59,​Discover the bird with a prehistoric roar​,https://timesofindia.indiatimes.com/articleshow/114244474.cms,2026-06-25T14:32:58+00:00
TOI ETimes,60,Dia Mirza's ethnic wear,https://timesofindia.indiatimes.com/articleshow/114243410.cms,2026-06-25T14:32:58+00:00
TOI ETimes,61,​Incredible facts about ants you won’t believe​,https://timesofindia.indiatimes.com/articleshow/114243248.cms,2026-06-25T14:32:58+00:00
TOI ETimes,62,'Bigg Boss Marathi 5' nears grand finale​,https://timesofindia.indiatimes.com/articleshow/113936459.cms,2026-06-25T14:32:58+00:00
TOI ETimes,63,Peacocks spotted on Mumbai's busy Pedder Road after monsoon rains; videos go viral,https://timesofindia.indiatimes.com/articleshow/131986625.cms,2026-06-25T14:32:58+00:00
TOI ETimes,64,"‘Same person, different reality’: Bihar man's US vs Bihar comparison goes viral",https://timesofindia.indiatimes.com/articleshow/131984364.cms,2026-06-25T14:32:58+00:00
TOI ETimes,65,Real-time evolution alert: Tiny Scottish wrens are doubling in size!,https://timesofindia.indiatimes.com/articleshow/131982146.cms,2026-06-25T14:32:58+00:00
TOI ETimes,66,Shreyas Iyer’s latest bio change has everyone asking the same question: What is his ‘Second D.O.B’?,https://timesofindia.indiatimes.com/articleshow/131990395.cms,2026-06-25T14:32:58+00:00
TOI ETimes,67,Who is Mahrang Baloch? The Pakistani activist who has been sentenced to life in prison,https://timesofindia.indiatimes.com/articleshow/131981651.cms,2026-06-25T14:32:58+00:00
TOI ETimes,68,Chef Vikas Khanna's newest summer drink is a love letter to jamun and it's named after Mrunal Thakur,https://timesofindia.indiatimes.com/articleshow/131981469.cms,2026-06-25T14:32:58+00:00
TOI ETimes,69,Fruits gone to waste even before they reach the market? Scientists design a special clay to slow down the rot,https://timesofindia.indiatimes.com/articleshow/131980565.cms,2026-06-25T14:32:58+00:00
TOI ETimes,70,Earthquake rocks Venezuela: Footage from airport in Maiquetía captures moments of panic as travellers scramble to escape,https://timesofindia.indiatimes.com/articleshow/131980450.cms,2026-06-25T14:32:58+00:00
TOI ETimes,71,Salmonella in apples and kiwi? Major UK supermarkets recall fruit products over potential contamination,https://timesofindia.indiatimes.com/articleshow/131960134.cms,2026-06-25T14:32:58+00:00
TOI ETimes,72,'JEE teachers are leftovers': IIT-BHU alum's post over credibility of coaching centres has the internet divided,https://timesofindia.indiatimes.com/articleshow/131975000.cms,2026-06-25T14:32:58+00:00
TOI ETimes,73,'Noida walo dhyaan se khao': Viral video of vegetables being washed in muddy pond has internet guessing just how healthy the food is,https://timesofindia.indiatimes.com/articleshow/131973765.cms,2026-06-25T14:32:58+00:00
TOI ETimes,74,Earthquake in Northern California: How severe is a 5.6 magnitude of earthquake,https://timesofindia.indiatimes.com/articleshow/131973458.cms,2026-06-25T14:32:58+00:00
TOI ETimes,75,'Don't you dare leave India': Zerodha's Nithin Kamath shares one golden advice he gives to youngsters and why,https://timesofindia.indiatimes.com/articleshow/131971231.cms,2026-06-25T14:32:58+00:00
TOI ETimes,76,"'Triggered by an educated Indian woman': MAGA influencer Laura Loomer supports Usha Vance, calls out 'woke' people who want her to convert",https://timesofindia.indiatimes.com/articleshow/131967507.cms,2026-06-25T14:32:58+00:00
TOI ETimes,77,Want to do everything in life? This is what Psychology says about your brain,https://timesofindia.indiatimes.com/articleshow/131964627.cms,2026-06-25T14:32:58+00:00
TOI ETimes,78,The viral 'One Wish Willow' trend explained: Why the internet is obsessed with a ‘cursed’ wish box from a horror movie,https://timesofindia.indiatimes.com/articleshow/131963333.cms,2026-06-25T14:32:58+00:00
TOI ETimes,79,"‘Rider holding my family hostage, I might die’: Zomato chatbot experiment goes viral, message shocks users",https://timesofindia.indiatimes.com/articleshow/131962473.cms,2026-06-25T14:32:58+00:00
TOI ETimes,80,Strawberry Moon to peak on June 29: Best time and place to watch the year's ‘sweetest’ full moon,https://timesofindia.indiatimes.com/articleshow/131959547.cms,2026-06-25T14:32:58+00:00
TOI ETimes,81,"Lost town beneath the water: How an extreme drought in Iraq unveiled a 3,400-year-old city frozen in time",https://timesofindia.indiatimes.com/articleshow/131956344.cms,2026-06-25T14:32:58+00:00
TOI ETimes,82,"‘Main 6 baje office se nikalta tha, log poochte the: Itni jaldi?’: Indian-origin man compares work culture in India and the US",https://timesofindia.indiatimes.com/articleshow/131954677.cms,2026-06-25T14:32:58+00:00
TOI ETimes,83,"""A bad relationship can cost your life"": Engaged in February, wedding planned for November: Pune's Ketan Agarwal case leaves social media shocked and worried",https://timesofindia.indiatimes.com/articleshow/131953696.cms,2026-06-25T14:32:58+00:00
TOI ETimes,84,"Plastic in frozen food? MorningStar Farms recalls nuggets, sausage patties for possible plastic contamination",https://timesofindia.indiatimes.com/articleshow/131929652.cms,2026-06-25T14:32:58+00:00
TOI ETimes,85,Dozens of UK schools shut doors due to ‘extreme’ temperature: How to protect children amidst rare red heat warnings,https://timesofindia.indiatimes.com/articleshow/131925252.cms,2026-06-25T14:32:58+00:00
TOI ETimes,86,'Say sorry for abusing India': Indian woman confronts Bangladeshi waiter for making anti-India remarks at Italian restaurant,https://timesofindia.indiatimes.com/articleshow/131945779.cms,2026-06-25T14:32:58+00:00
TOI ETimes,87,Who was Sushruta? Ancient Indian 'Father of Plastic Surgery' honoured at Royal College of Surgeons of Edinburgh in Scotland,https://timesofindia.indiatimes.com/articleshow/131944155.cms,2026-06-25T14:32:58+00:00
TOI ETimes,88,'I grew up in a stable Hindu household': Usha Vance reveals why she didn't convert to Christianity like her husband JD Vance,https://timesofindia.indiatimes.com/articleshow/131941629.cms,2026-06-25T14:32:58+00:00
TOI ETimes,89,"In 1979, the income tax officer who left his job to turn remote Arunachal villages into living libraries: Uncle Moosa’s quiet reading revolution",https://timesofindia.indiatimes.com/articleshow/131941474.cms,2026-06-25T14:32:58+00:00
TOI ETimes,90,“We were living on autopilot”: NRI couple’s American dream t...,https://timesofindia.indiatimes.com/articleshow/131924979.cms,2026-06-25T14:32:58+00:00
TOI ETimes,91,‘I barely needed cash’: Foreigner says India's payment syste...,https://timesofindia.indiatimes.com/articleshow/131784242.cms,2026-06-25T14:32:58+00:00
TOI ETimes,92,'They abuse and harass men...': Viral video claims three wom...,https://timesofindia.indiatimes.com/articleshow/131905638.cms,2026-06-25T14:32:58+00:00
TOI ETimes,93,'Biggest challenge': Couple who left Canada for India says r...,https://timesofindia.indiatimes.com/articleshow/131859520.cms,2026-06-25T14:32:58+00:00
TOI ETimes,94,Sleep habits of the world's richest: How many hours do Elon ...,https://timesofindia.indiatimes.com/articleshow/131810020.cms,2026-06-25T14:32:58+00:00
TOI ETimes,95,"Happy Father's Day 2026: 55+ emotional quotes, wishes, and m...",https://timesofindia.indiatimes.com/articleshow/131790604.cms,2026-06-25T14:32:58+00:00
TOI ETimes,96,"'Koi bhi country jao, 5-6 saal bahar niklo': Woman's blunt a...",https://timesofindia.indiatimes.com/articleshow/131815418.cms,2026-06-25T14:32:58+00:00
TOI ETimes,97,"Happy Eid-ul-Adha 2026: Top 150 Eid Mubarak Wishes, Messages...",https://timesofindia.indiatimes.com/articleshow/131330005.cms,2026-06-25T14:32:58+00:00
TOI ETimes,98,Meet Fabrice Bellard: The French engineer whose code powers ...,https://timesofindia.indiatimes.com/articleshow/131602101.cms,2026-06-25T14:32:58+00:00
TOI ETimes,99,Who is Himanshu Jangra? The man behind the ₹370 Biryani rema...,https://timesofindia.indiatimes.com/articleshow/131601165.cms,2026-06-25T14:32:58+00:00
TOI ETimes,100,Eid Al-Adha 2026 date: Is Bakrid on May 27 or 28? Here’s wha...,https://timesofindia.indiatimes.com/articleshow/131323748.cms,2026-06-25T14:32:58+00:00
TOI ETimes,101,"Happy Eid-ul-Adha 2026: Best Eid Mubarak Wishes, Greetings C...",https://timesofindia.indiatimes.com/articleshow/131351050.cms,2026-06-25T14:32:58+00:00
TOI ETimes,102,"'Make sure she dies soon': Devotee leaves shocking wish for aunt on ₹20 note in Andhra Temple donation box, leaves netizens horrified",https://timesofindia.indiatimes.com/articleshow/131939278.cms,2026-06-25T14:32:58+00:00
TOI ETimes,103,"'I'm freaked out now': Man claims Bumble date tracked down his house after 20 missed calls, left creepy letter asking for an 'explanation'",https://timesofindia.indiatimes.com/articleshow/131937446.cms,2026-06-25T14:32:58+00:00
TOI ETimes,104,'I have ₹52 crore but feel like an outsider': US-based Indian’s return-to-India plan goes viral,https://timesofindia.indiatimes.com/articleshow/131934740.cms,2026-06-25T14:32:58+00:00
TOI ETimes,105,₹15-20 crore from Netflix? Viral post on Samay Raina's 'India's Got Latent' earnings leaves internet stunned,https://timesofindia.indiatimes.com/articleshow/131931120.cms,2026-06-25T14:32:58+00:00
TOI ETimes,106,₹66 LPA at Amazon vs ₹65 LPA at Salesforce: Why this Bengaluru engineer's career dilemma is getting so much attention,https://timesofindia.indiatimes.com/articleshow/131929042.cms,2026-06-25T14:32:58+00:00
TOI ETimes,107,"Who is Avinash Agarwal, the 'Indian Trump' who became the breakout star of Samay Raina’s India's Got Latent Season 2",https://timesofindia.indiatimes.com/articleshow/131927792.cms,2026-06-25T14:32:58+00:00
TOI ETimes,108,Lakadong turmeric: The story of India’s ‘Golden Spice’ from Meghalaya that reached the global stage with G7 gift,https://timesofindia.indiatimes.com/articleshow/131927720.cms,2026-06-25T14:32:58+00:00
TOI ETimes,109,"This day, that year (June 23): From Battle of Plassey, French Revolution, Brexit, to Reddit’s invention, Meghan Markle’s rise, and Britney Spears' fight for freedom",https://timesofindia.indiatimes.com/articleshow/131924886.cms,2026-06-25T14:32:58+00:00
TOI ETimes,110,"‘Be a little problematic at work, tension lene ka nahi, dene ka': Mumbai creator's viral advice has employees saying, ‘She's not wrong’",https://timesofindia.indiatimes.com/articleshow/131923113.cms,2026-06-25T14:32:58+00:00
TOI ETimes,111,Rare red heat warning issued: UK braces for hottest June day on record as temperatures near 40°C,https://timesofindia.indiatimes.com/articleshow/131922999.cms,2026-06-25T14:32:58+00:00
TOI ETimes,112,'Aisa karna risky hai': Paragliding pilot's mid-air stunt to gift a woman leaves has internet debating about safety and professionalism,https://timesofindia.indiatimes.com/articleshow/131946290.cms,2026-06-25T14:32:58+00:00
TOI ETimes,113,'Proud moment for India': Kunal Shah's appointment as Global head of WhatsApp has Indians celebrating online,https://timesofindia.indiatimes.com/articleshow/131917489.cms,2026-06-25T14:32:58+00:00
TOI ETimes,114,"'Snatched mobile, began beating': Bengaluru auto driver extorted two boys visiting city for first time, demanded ₹3,000 in shocking encounter",https://timesofindia.indiatimes.com/articleshow/131916646.cms,2026-06-25T14:32:58+00:00
TOI ETimes,115,'Scarier to stay': Indian-origin techie at Google reveals why she took the 'risk' to leave job,https://timesofindia.indiatimes.com/articleshow/131914369.cms,2026-06-25T14:32:58+00:00
TOI ETimes,116,"'Monday 11 hours, Tuesday 9 hours, Wednesday 10 hours...': Tesla employee's 54-hour workweek has netizens questioning work-life balance",https://timesofindia.indiatimes.com/articleshow/131911588.cms,2026-06-25T14:32:58+00:00
TOI ETimes,117,He quit his OpenAI job to move back to India: Shyamal Anadkat defines it as 'once in a generation opportunity',https://timesofindia.indiatimes.com/articleshow/131909680.cms,2026-06-25T14:32:58+00:00
TOI ETimes,118,Indian man forced to remove Ganesha idol from home by realtor for shocking reason: 'We felt uncomfortable',https://timesofindia.indiatimes.com/articleshow/131908815.cms,2026-06-25T14:32:58+00:00
TOI ETimes,119,UK heatwave: Why government is warning people not to enter water bodies even as temperatures rise,https://timesofindia.indiatimes.com/articleshow/131907612.cms,2026-06-25T14:32:58+00:00
TOI ETimes,120,"She applied for a job and forgot about it; 6 years later, she got an unexpected update",https://timesofindia.indiatimes.com/articleshow/131904754.cms,2026-06-25T14:32:58+00:00
TOI ETimes,121,"‘Alive’ even after thousands of years? Scientists find signs of life on a 5,300-year-old ‘Ice Man’",https://timesofindia.indiatimes.com/articleshow/131903608.cms,2026-06-25T14:32:58+00:00
TOI ETimes,122,This is the world's most expensive coffee and it is made with poop!,https://timesofindia.indiatimes.com/articleshow/131904036.cms,2026-06-25T14:32:58+00:00
TOI ETimes,123,‘Take a picture of…’: Sister boards late-night cab to Gurgaon; driver's remark to worried brother gets everyone talking,https://timesofindia.indiatimes.com/articleshow/131903399.cms,2026-06-25T14:32:58+00:00
TOI ETimes,124,Mumbai woman says employees should be ‘problematic’ at work; her reasons are going viral,https://timesofindia.indiatimes.com/articleshow/131901673.cms,2026-06-25T14:32:58+00:00
TOI ETimes,125,Indian woman walks home barefoot at 4:30 am in France; what happened next shocks the internet,https://timesofindia.indiatimes.com/articleshow/131900875.cms,2026-06-25T14:32:58+00:00
TOI ETimes,126,Antarctica’s 50-year warning: Scientists say the next few years will shape the future of the West Antarctic Ice Sheet,https://timesofindia.indiatimes.com/articleshow/131899706.cms,2026-06-25T14:32:58+00:00
