source,rank,headline,link,collected_at_iso
TOI ETimes,103,India just made space history—and what this private rocket carried inside will leave you stunned!,https://timesofindia.indiatimes.com/articleshow/132495645.cms,2026-07-23T06:29:28+00:00
TOI ETimes,104,First-time flyer wanted a selfie before boarding; stranger's kind gesture at Delhi airport goes viral,https://timesofindia.indiatimes.com/articleshow/132496147.cms,2026-07-23T06:29:28+00:00
TOI ETimes,105,Planning to eat at the World Cup final? This single snack bill will empty your wallet!,https://timesofindia.indiatimes.com/articleshow/132495435.cms,2026-07-23T06:29:28+00:00
TOI ETimes,106,"Gurgaon man says private jobs transformed middle-class lives, claims salaries can rise from ₹10,000 to ₹1.5 lakh",https://timesofindia.indiatimes.com/articleshow/132491597.cms,2026-07-23T06:29:28+00:00
TOI ETimes,107,Manchester wasn't always called Manchester: The story behind its name,https://timesofindia.indiatimes.com/articleshow/132491467.cms,2026-07-23T06:29:28+00:00
TOI ETimes,108,"Delhi Uber driver from Bihar earns ₹80,000 from rent but still drives 12 hours a day; the reason has touched the internet",https://timesofindia.indiatimes.com/articleshow/132490802.cms,2026-07-23T06:29:28+00:00
TOI ETimes,109,Could infectious microbes on Mars become more dangerous? New research reveals a surprising risk for future astronauts,https://timesofindia.indiatimes.com/articleshow/132490785.cms,2026-07-23T06:29:28+00:00
TOI ETimes,110,'Tumhe pata hai abroad ki sabse khatarnak chiz kya hai?': Indian woman in US says one mistake is holding back thousands of students abroad,https://timesofindia.indiatimes.com/articleshow/132489943.cms,2026-07-23T06:29:28+00:00
TOI ETimes,111,Bukayo Saka net worth: Inside the Arsenal star's fortune who scored hat-trick for England at FIFA World Cup 2026,https://timesofindia.indiatimes.com/articleshow/132489330.cms,2026-07-23T06:29:28+00:00
TOI ETimes,112,Who is Sakshi Jha? Bihar teacher's 'Man-Hater' audition on India's Got Latent has everyone talking,https://timesofindia.indiatimes.com/articleshow/132481542.cms,2026-07-23T06:29:28+00:00
TOI ETimes,113,The morning routine Sachin Tendulkar still refuses to skip,https://timesofindia.indiatimes.com/articleshow/132479662.cms,2026-07-23T06:29:28+00:00
TOI ETimes,114,The lost British Raj recipe that found a place in Bengali cuisine,https://timesofindia.indiatimes.com/articleshow/132479374.cms,2026-07-23T06:29:28+00:00
TOI ETimes,115,Spotted in London! Anushka Sharma makes a rare public appearance with this surprising companion,https://timesofindia.indiatimes.com/articleshow/132478783.cms,2026-07-23T06:29:28+00:00
TOI ETimes,116,Who is Joan Monfort? The photographer behind Lionel Messi and Lamine Yamal’s iconic viral photoshoot,https://timesofindia.indiatimes.com/articleshow/132478381.cms,2026-07-23T06:29:28+00:00
TOI ETimes,117,"'Aise hi ₹40,000-45,000 aa jaata hai': Father of three quit his Gurgaon job to drive an auto and says it's the best decision he made",https://timesofindia.indiatimes.com/articleshow/132477858.cms,2026-07-23T06:29:28+00:00
TOI ETimes,118,"Meet Begum Samru: India's only Catholic queen who converted from Islam, rescued Mughal ruler Shah Alam II from attacks",https://timesofindia.indiatimes.com/articleshow/132476322.cms,2026-07-23T06:29:28+00:00
TOI ETimes,119,"'Yeh humare desh ke jawan hain, this is Indian Army': Woman's EV dies midway, Army jawan pushes her car and refuses to leave until she's safe",https://timesofindia.indiatimes.com/articleshow/132475186.cms,2026-07-23T06:29:28+00:00
TOI ETimes,120,"'Leave office at 6 pm or 9:30 pm, it's the same': Noida woman's hilarious traffic rant strikes a chord with commuters",https://timesofindia.indiatimes.com/articleshow/132473390.cms,2026-07-23T06:29:28+00:00
TOI ETimes,121,"The tragic life of Sarah Baartman: The woman exploited for her body as the ‘Hottentot Venus’ and displayed even after death, finally came home 192 years later",https://timesofindia.indiatimes.com/articleshow/132467622.cms,2026-07-23T06:29:28+00:00
TOI ETimes,122,NRI reveals 5 things nobody warned her about working in India. The internet is divided,https://timesofindia.indiatimes.com/articleshow/132464834.cms,2026-07-23T06:29:28+00:00
TOI ETimes,123,‘It couldn't have waited till Monday?’: Woman claims husband was fired during Hawaii vacation,https://timesofindia.indiatimes.com/articleshow/132462273.cms,2026-07-23T06:29:28+00:00
TOI ETimes,124,Is bottle gourd juice poisonous? Here’s the truth,https://timesofindia.indiatimes.com/articleshow/132461831.cms,2026-07-23T06:29:28+00:00
TOI ETimes,125,Why do pirates wear eye patches? The surprising truth,https://timesofindia.indiatimes.com/articleshow/132459505.cms,2026-07-23T06:29:28+00:00
TOI ETimes,126,"'Heartbreaking to see': Indian woman spots Kurkure packet floating in Singapore, internet can't agree on who's to blame",https://timesofindia.indiatimes.com/articleshow/132458757.cms,2026-07-23T06:29:28+00:00
TOI ETimes,127,"Pakistani man claims he's Indian after trying to hug Chinese comedian on stage, but one question exposes him",https://timesofindia.indiatimes.com/articleshow/132456597.cms,2026-07-23T06:29:28+00:00
TOI ETimes,128,"'It's a death trap': Ceiling crashes inside Noida apartment, viral visuals leave residents shaken",https://timesofindia.indiatimes.com/articleshow/132456131.cms,2026-07-23T06:29:28+00:00
TOI ETimes,129,"'Lappu Sa Sachin' fame Mithilesh Bhati joins protest at Jantar Mantar, extends support to Sonam Wangchuk",https://timesofindia.indiatimes.com/articleshow/132452515.cms,2026-07-23T06:29:28+00:00
TOI ETimes,130,"'Fabergé' Martagon Lily: Flower linked to Imperial Russian royalty, which remained hidden in a shoebox, could be worth ₹2.72 crore",https://timesofindia.indiatimes.com/articleshow/132451988.cms,2026-07-23T06:29:28+00:00
TOI ETimes,131,Woman says she was fired just 3 hours after telling her manager she was pregnant: ‘I feel so betrayed and stupid’,https://timesofindia.indiatimes.com/articleshow/132451551.cms,2026-07-23T06:29:28+00:00
TOI ETimes,132,"PM Modi gifted Bihar's popular 'Thekua' to a Slovak leader, and his reaction went viral instantly.",https://timesofindia.indiatimes.com/articleshow/132447940.cms,2026-07-23T06:29:28+00:00
TOI ETimes,133,Sachin Tendulkar reveals why he has always made his own tea before matches,https://timesofindia.indiatimes.com/articleshow/132447856.cms,2026-07-23T06:29:28+00:00
TOI ETimes,134,How a hidden shift in the Atlantic could rewire the seasons,https://timesofindia.indiatimes.com/articleshow/132447633.cms,2026-07-23T06:29:28+00:00
TOI ETimes,135,"Indian techie in Paris says Europe's 'problems' are what many Indians wish they had, sparks debate",https://timesofindia.indiatimes.com/articleshow/132445847.cms,2026-07-23T06:29:28+00:00
TOI ETimes,136,Two restaurants just put Brazilian fine dining on top of the world,https://timesofindia.indiatimes.com/articleshow/132444178.cms,2026-07-23T06:29:28+00:00
TOI ETimes,137,Gordon Ramsay joins the chaos after Uber Eats pulls Argentine food from the App,https://timesofindia.indiatimes.com/articleshow/132442803.cms,2026-07-23T06:29:28+00:00
TOI ETimes,138,Bihar: 'Snake lady' rescues 10-foot king cobra from home; villagers left stunned,https://timesofindia.indiatimes.com/articleshow/132435058.cms,2026-07-23T06:29:28+00:00
TOI ETimes,139,"'India, this is unbelievable': American woman stunned by Mumbai's free home blood test service that costs 10 times more in the US",https://timesofindia.indiatimes.com/articleshow/132436306.cms,2026-07-23T06:29:28+00:00
TOI ETimes,140,Did Argentina really suffer from the 'Curse of Tilcara'? Viral post revives football's most fascinating superstition,https://timesofindia.indiatimes.com/articleshow/132433680.cms,2026-07-23T06:29:28+00:00
TOI ETimes,141,Do you enjoy eating alone at restaurants? Psychology says it may be a sign of emotional strength — not loneliness,https://timesofindia.indiatimes.com/articleshow/132433372.cms,2026-07-23T06:29:28+00:00
TOI ETimes,142,‘I made ₹10 lakh a month but paid ₹5 lakh in taxes’: Indian entrepreneur who left Canada after 18 months shares why he returned,https://timesofindia.indiatimes.com/articleshow/132432475.cms,2026-07-23T06:29:28+00:00
TOI ETimes,143,Gus the dinosaur sells for a record $50 million in New York: What makes this 67-million-year-old T. Rex so valuable?,https://timesofindia.indiatimes.com/articleshow/132431848.cms,2026-07-23T06:29:28+00:00
TOI ETimes,144,"Did the first human civilisation discover electricity? 2,000-year-old 'Baghdad Battery' jar was developed long before Volta invented the battery",https://timesofindia.indiatimes.com/articleshow/132429570.cms,2026-07-23T06:29:28+00:00
TOI ETimes,145,"Railway attendant earning ₹14,000 pays ₹5,000 fine after AC coach passengers steal towels, bedsheets",https://timesofindia.indiatimes.com/articleshow/132428687.cms,2026-07-23T06:29:28+00:00
TOI ETimes,146,"England loses to Argentina in World Cup semi-final: Heir to the throne, Prince William, reacts to Three Lions’ ‘gutting’ loss",https://timesofindia.indiatimes.com/articleshow/132427930.cms,2026-07-23T06:29:28+00:00
TOI ETimes,147,"Daylight Saving Time: House votes to make DST permanent — what changes, for which states, and what remains the same?",https://timesofindia.indiatimes.com/articleshow/132427513.cms,2026-07-23T06:29:28+00:00
TOI ETimes,148,"75+ Jagannath Rath Yatra Wishes, Messages, Quotes, GIFs, and Greetings for 2026",https://timesofindia.indiatimes.com/articleshow/132390881.cms,2026-07-23T06:29:28+00:00
TOI ETimes,149,"Haldiram's opens first UK store in London, viral videos show huge queues outside Leicester Square outlet for chole bhature, bhujia and sweets",https://timesofindia.indiatimes.com/articleshow/132424799.cms,2026-07-23T06:29:28+00:00
TOI ETimes,150,Forget dating apps! This supermarket's pink shopping baskets are helping single people find love,https://timesofindia.indiatimes.com/articleshow/132419291.cms,2026-07-23T06:29:28+00:00
TOI ETimes,151,‘Confidential Photos’ found in Blinkit order? Woman says she thought it was blackmail before discovering the truth,https://timesofindia.indiatimes.com/articleshow/132416982.cms,2026-07-23T06:29:28+00:00
TOI ETimes,152,"Meet the 95 year old Nonno, who follows a secret band exercise routine to stay put and keep going at nearly a century",https://timesofindia.indiatimes.com/articleshow/132415981.cms,2026-07-23T06:29:28+00:00
TOI ETimes,153,Scientists discover uranium-eating bacteria that could help clean up radioactive mine water,https://timesofindia.indiatimes.com/articleshow/132407702.cms,2026-07-23T06:29:28+00:00
TOI ETimes,154,"Rare Corpse flowers 'Odora and Odorysseus' bloom simultaneously for only 48 hours, and they are the stinkiest celebrities at Huntington",https://timesofindia.indiatimes.com/articleshow/132409101.cms,2026-07-23T06:29:28+00:00
TOI ETimes,155,McDonald’s launches new Caesar sauce: All you need to know about the new menu items,https://timesofindia.indiatimes.com/articleshow/132406787.cms,2026-07-23T06:29:28+00:00
TOI ETimes,156,Perseid meteor shower 2026: ‘The shooting stars’ return under an Earthshine Moon — when and how to watch,https://timesofindia.indiatimes.com/articleshow/132405835.cms,2026-07-23T06:29:28+00:00
TOI ETimes,157,"‘Madam, cow ke liye parcel order kiya apne?’: Woman's Zomato order for three stray cows leaves delivery rider smiling",https://timesofindia.indiatimes.com/articleshow/132405697.cms,2026-07-23T06:29:28+00:00
TOI ETimes,158,₹40 lakh salary in Bengaluru vs a simpler mountain life: IIT Kanpur alumnus's viral post sparks debate,https://timesofindia.indiatimes.com/articleshow/132398635.cms,2026-07-23T06:29:28+00:00
TOI ETimes,159,Mohd Zeeshan Ayyub,https://timesofindia.indiatimes.com/articleshow/132550232.cms,2026-07-23T06:29:28+00:00
TOI ETimes,160,South OTT releases this week,https://timesofindia.indiatimes.com/articleshow/132570346.cms,2026-07-23T06:29:28+00:00
TOI ETimes,161,Archana Puran Singh,https://timesofindia.indiatimes.com/articleshow/132533384.cms,2026-07-23T06:29:28+00:00
TOI ETimes,162,Shah Rukh Khan,https://timesofindia.indiatimes.com/articleshow/132474838.cms,2026-07-23T06:29:28+00:00
TOI ETimes,163,Millie Bobby Brown,https://timesofindia.indiatimes.com/articleshow/132555785.cms,2026-07-23T06:29:28+00:00
TOI ETimes,164,Friedrich Nietzsche Quote,https://timesofindia.indiatimes.com/articleshow/132520463.cms,2026-07-23T06:29:28+00:00
TOI ETimes,165,Welcome To The Jungle Box Office Collection,https://timesofindia.indiatimes.com/articleshow/132503735.cms,2026-07-23T06:29:28+00:00
TOI ETimes,166,Ashoka Chakra Recipients,https://timesofindia.indiatimes.com/articleshow/132567921.cms,2026-07-23T06:29:28+00:00
TOI ETimes,167,CIA Sites Drone Attacks,https://timesofindia.indiatimes.com/articleshow/132570629.cms,2026-07-23T06:29:28+00:00
TOI ETimes,168,Mutual Consent Divorce,https://timesofindia.indiatimes.com/articleshow/132572661.cms,2026-07-23T06:29:28+00:00
TOI ETimes,169,Gaia Sausage Dwarf Galaxy,https://timesofindia.indiatimes.com/articleshow/132567707.cms,2026-07-23T06:29:28+00:00
TOI ETimes,170,Kevda Fossil Assam,https://timesofindia.indiatimes.com/articleshow/132563006.cms,2026-07-23T06:29:28+00:00
TOI ETimes,171,One Piece Luffy,https://timesofindia.indiatimes.com/articleshow/132563538.cms,2026-07-23T06:29:28+00:00
TOI ETimes,172,Captions For Instagram Posts,https://timesofindia.indiatimes.com/articleshow/130895681.cms,2026-07-23T06:29:28+00:00
TOI ETimes,173,Hazaribag man drowns while fishing in lake,https://timesofindia.indiatimes.com/articleshow/130060093.cms,2026-07-23T06:29:28+00:00
TOI ETimes,174,"""Behen Darr Gayi!"": Fans relive ‘Bhagam Bhag’ era after watching Akshay Kumar's 'Bhooth Bangla' trailer",https://timesofindia.indiatimes.com/articleshow/130060027.cms,2026-07-23T06:29:28+00:00
TOI ETimes,175,MBOSE HSLC result 2026 to release tomorrow: Check details here,https://timesofindia.indiatimes.com/articleshow/130059814.cms,2026-07-23T06:29:28+00:00
TOI ETimes,176,"Iran war risk: JPMorgan CEO Jamie Dimon warns of oil shocks, sticky inflation and higher interest rates",https://timesofindia.indiatimes.com/articleshow/130059993.cms,2026-07-23T06:29:28+00:00
TOI ETimes,177,Make your clutch last longer with these easy driving tips,https://timesofindia.indiatimes.com/articleshow/130052232.cms,2026-07-23T06:29:28+00:00
TOI ETimes,178,“Three-against-one situation”: El Rubius opens up on being “targeted” in MrBeast’s viral $1M challenge,https://timesofindia.indiatimes.com/articleshow/130054402.cms,2026-07-23T06:29:28+00:00
TOI ETimes,179,Bihar BTSC lab assistant notification released for 1091 posts at btsc.bihar.gov.in; apply here,https://timesofindia.indiatimes.com/articleshow/130059322.cms,2026-07-23T06:29:28+00:00
TOI ETimes,180,IPL craze costs techie Rs 1.46 lakh in fake RCB vs CSK ticket scam,https://timesofindia.indiatimes.com/articleshow/130059549.cms,2026-07-23T06:29:28+00:00
TOI ETimes,181,Raising “robot-proof” kids: Why creativity and curiosity matter more than ever,https://timesofindia.indiatimes.com/articleshow/130057342.cms,2026-07-23T06:29:28+00:00
TOI ETimes,182,Inside ‘Satguru Sharan’: Exploring Saif Ali Khan and Kareena Kapoor Khan’s Rs 100 crore Bandra home,https://timesofindia.indiatimes.com/articleshow/130059584.cms,2026-07-23T06:29:28+00:00
TOI ETimes,183,How selling Alaska in 1867 was a costly mistake for Russia,https://timesofindia.indiatimes.com/articleshow/130057081.cms,2026-07-23T06:29:28+00:00
TOI ETimes,184,'Hera Pheri 3 is coming': Paresh Rawal dismisses delay reports and reveals he will 'start shooting soon',https://timesofindia.indiatimes.com/articleshow/130059421.cms,2026-07-23T06:29:28+00:00
TOI ETimes,185,"US-Iran War: A daring rescue Hollywood blockbuster is on its way. Till then, pick your favourite from these 10 films on bringing someone home against all odds",https://timesofindia.indiatimes.com/articleshow/130059208.cms,2026-07-23T06:29:28+00:00
TOI ETimes,186,"Kolkata team unveils fan mural at Rash Behari Avenue, celebrating city’s first love",https://timesofindia.indiatimes.com/articleshow/130059554.cms,2026-07-23T06:29:28+00:00
TOI ETimes,187,How US spread a lie to rescue a pilot of a jet shot down in Iran,https://timesofindia.indiatimes.com/articleshow/130058641.cms,2026-07-23T06:29:28+00:00
TOI ETimes,188,"Netflix unveils ‘VOID’, an AI model that can change a movie plot",https://timesofindia.indiatimes.com/articleshow/130058880.cms,2026-07-23T06:29:28+00:00
TOI ETimes,189,"AI data centers are causing 'stress' not just to tech companies, but also private insurers",https://timesofindia.indiatimes.com/articleshow/130058967.cms,2026-07-23T06:29:28+00:00
TOI ETimes,190,"""Trans women are....."": Clavicular’s viral moment with trans women sparks fresh conversation on internet culture",https://timesofindia.indiatimes.com/articleshow/130053479.cms,2026-07-23T06:29:28+00:00
TOI Viral News,1,"Watch: Hardeep Singh Puri reunites with old friend from Delhi University, video melts hearts",https://timesofindia.indiatimes.com/articleshow/108418522.cms,2026-07-23T06:29:28+00:00
TOI Viral News,2,Narayana Murthy and daughter Akshata enjoy 'Corner House' ice cream in Bengaluru,https://timesofindia.indiatimes.com/articleshow/107659138.cms,2026-07-23T06:29:28+00:00
TOI Viral News,3,Taylor Swift cheers boyfriend Travis Kelce at the Super Bowl,https://timesofindia.indiatimes.com/articleshow/107613344.cms,2026-07-23T06:29:28+00:00
TOI Viral News,4,'He Nitished me' to 'Paltu Chacha': Nitish Kumar's 'swing politics' sparks humour fest,https://timesofindia.indiatimes.com/articleshow/107236114.cms,2026-07-23T06:29:28+00:00
TOI Viral News,5,"Flyer hits IndiGo Pilot announcing flight delay due to dense fog conditions, video goes viral",https://timesofindia.indiatimes.com/articleshow/106851189.cms,2026-07-23T06:29:28+00:00
TOI Viral News,6,"New Zealand's youngest MP performs native 'war cry' in Parliament, video goes viral",https://timesofindia.indiatimes.com/articleshow/106572179.cms,2026-07-23T06:29:28+00:00
TOI Viral News,7,"NASA unveils stunning image of 'evil eye' galaxy, sparking internet awe",https://timesofindia.indiatimes.com/articleshow/105570940.cms,2026-07-23T06:29:28+00:00
TOI Viral News,8,Millennials bemoan lackluster Black Friday deals in social media uproar,https://timesofindia.indiatimes.com/articleshow/105475777.cms,2026-07-23T06:29:28+00:00
TOI Viral News,9,'At least they'll not lose to India in semis': Memes erupt with Pakistan all but out of World Cup,https://timesofindia.indiatimes.com/articleshow/105122539.cms,2026-07-23T06:29:28+00:00
TOI Viral News,10,Brazilian influencer Vanessa Mancini dies at 41 from massive heart attack,https://timesofindia.indiatimes.com/articleshow/105110853.cms,2026-07-23T06:29:28+00:00
TOI Viral News,11,Memes erupt as Angelo Mathews becomes first international cricketer to be timed out,https://timesofindia.indiatimes.com/articleshow/105016656.cms,2026-07-23T06:29:28+00:00
TOI Viral News,12,Mia Khalifa posts Amy Schumer's heated exchange with Asia Jackson over Israel-Palestine conflict,https://timesofindia.indiatimes.com/articleshow/104947696.cms,2026-07-23T06:29:28+00:00
TOI Viral News,13,Fans troll Pakistan as Proteas beat Kiwis to keep Pak's semi-final hopes alive,https://timesofindia.indiatimes.com/articleshow/104912338.cms,2026-07-23T06:29:28+00:00
TOI Viral News,14,Mark Zuckerberg and family's Halloween transformation into Hogwarts icons warms hearts,https://timesofindia.indiatimes.com/articleshow/104888586.cms,2026-07-23T06:29:28+00:00
TOI Viral News,15,'Bore hone ka chance-ich nahi' as auto driver sings & entertains people stuck in Andheri traffic,https://timesofindia.indiatimes.com/articleshow/104886091.cms,2026-07-23T06:29:28+00:00
TOI Viral News,16,Escaped monkey 'Momo' captured after it drinks beer and runs riot in Indianapolis,https://timesofindia.indiatimes.com/articleshow/104208644.cms,2026-07-23T06:29:28+00:00
TOI Viral News,17,"Animal smuggling: Otter, rat and 28 turtles cause chaos on Bangkok to Taipei flight",https://timesofindia.indiatimes.com/articleshow/104208771.cms,2026-07-23T06:29:28+00:00
TOI Viral News,18,Alligator ally oops! Phillies fan denied entry with emotional support gator,https://timesofindia.indiatimes.com/articleshow/104043227.cms,2026-07-23T06:29:28+00:00
TOI Viral News,19,'Qualified for Karachi station': Pakistan's exit from Asia Cup sparks memefest,https://timesofindia.indiatimes.com/articleshow/103687163.cms,2026-07-23T06:29:28+00:00
TOI Viral News,20,"'Racist bigots': Arabic restaurant in US refuses to serve cops in uniform, faces fury",https://timesofindia.indiatimes.com/articleshow/103285144.cms,2026-07-23T06:29:28+00:00
TOI Viral News,21,Watch: Pakistani wedding in UK descends into mass brawl as guests hurl chairs at each other,https://timesofindia.indiatimes.com/articleshow/103245258.cms,2026-07-23T06:29:28+00:00
TOI Viral News,22,Memes abuzz as Neeraj Chopra makes history with first gold for India in World Championship,https://timesofindia.indiatimes.com/articleshow/103138499.cms,2026-07-23T06:29:28+00:00
TOI Viral News,23,Boyfriend held in murder of Instagram influencer Beauty Couch in Georgia,https://timesofindia.indiatimes.com/articleshow/103125550.cms,2026-07-23T06:29:28+00:00
TOI Viral News,24,Why internet is suddenly talking about Donald Trump’s weight,https://timesofindia.indiatimes.com/articleshow/103058329.cms,2026-07-23T06:29:28+00:00
TOI Viral News,25,'Don is back': Trump's mug shot triggers memefest,https://timesofindia.indiatimes.com/articleshow/103047943.cms,2026-07-23T06:29:28+00:00
TOI Viral News,26,"Hurricane Hilary unleashes fury on Southern California, visuals viral",https://timesofindia.indiatimes.com/articleshow/102906246.cms,2026-07-23T06:29:28+00:00
TOI Viral News,27,'Shameless': Prakash Raj blasted by netizens for mocking India's moon mission,https://timesofindia.indiatimes.com/articleshow/102902284.cms,2026-07-23T06:29:28+00:00
TOI Viral News,28,'Me during WFH': Photo of Selena Gomez wrapped in 'shawl' stirs memefest,https://timesofindia.indiatimes.com/articleshow/102799584.cms,2026-07-23T06:29:28+00:00
TOI Viral News,29,'Mission impossible': Memes erupt as people find it hard to return to office after long weekend,https://timesofindia.indiatimes.com/articleshow/102768800.cms,2026-07-23T06:29:28+00:00
TOI Viral News,30,‘Paisa hi paisa hoga’: Memes erupt as Indian creators receive massive payout from Twitter,https://timesofindia.indiatimes.com/articleshow/102576219.cms,2026-07-23T06:29:28+00:00
TOI Viral News,31,CJP founder Abhijeet Dipke to PM Modi: 'Tell the country why Dharmendra Pradhan is so important to you after so many student deaths',https://timesofindia.indiatimes.com/articleshow/132551364.cms,2026-07-23T06:29:28+00:00
TOI Viral News,32,Shambhu border sealed as farmers head to Delhi to oppose India-US trade deal,https://timesofindia.indiatimes.com/articleshow/132527122.cms,2026-07-23T06:29:28+00:00
TOI Viral News,33,Udhayanidhi Stalin condemns Tamil rapper Arivu's arrest over anti-NEET remarks,https://timesofindia.indiatimes.com/articleshow/132533369.cms,2026-07-23T06:29:28+00:00
TOI Viral News,34,CJP's 'Sansad Chalo': Young woman injured in police action on ventilator at RML Hospital; sit-in enters day 2,https://timesofindia.indiatimes.com/articleshow/132532063.cms,2026-07-23T06:29:28+00:00
TOI Viral News,35,Commonwealth Games 2026,https://timesofindia.indiatimes.com/articleshow/132570828.cms,2026-07-23T06:29:28+00:00
TOI Viral News,36,India Vs Zimbabwe,https://timesofindia.indiatimes.com/articleshow/132571482.cms,2026-07-23T06:29:28+00:00
TOI Viral News,37,Balochistan Bus Attack,https://timesofindia.indiatimes.com/articleshow/132571265.cms,2026-07-23T06:29:28+00:00
TOI Viral News,38,Dinoblade Release Date,https://timesofindia.indiatimes.com/articleshow/132570789.cms,2026-07-23T06:29:28+00:00
TOI Viral News,39,Ferran Torres Mural Vandalised,https://timesofindia.indiatimes.com/articleshow/132571851.cms,2026-07-23T06:29:28+00:00
TOI Viral News,40,Commonwealth Games Opening Ceremony,https://timesofindia.indiatimes.com/articleshow/132553501.cms,2026-07-23T06:29:28+00:00
TOI Viral News,41,Hyderabad Crew Member Rape,https://timesofindia.indiatimes.com/articleshow/132567177.cms,2026-07-23T06:29:28+00:00
TOI Viral News,42,US Strikes Iran,https://timesofindia.indiatimes.com/articleshow/132571636.cms,2026-07-23T06:29:28+00:00
TOI Viral News,43,Jantar Mantar Protest,https://timesofindia.indiatimes.com/articleshow/132571801.cms,2026-07-23T06:29:28+00:00
TOI Viral News,44,Delhi Metro Closed,https://timesofindia.indiatimes.com/articleshow/132570432.cms,2026-07-23T06:29:28+00:00
TOI Viral News,45,Mumbai Exortion Racket,https://timesofindia.indiatimes.com/articleshow/132523120.cms,2026-07-23T06:29:28+00:00
TOI Viral News,46,Deepak Kumar Arrest,https://timesofindia.indiatimes.com/articleshow/132561805.cms,2026-07-23T06:29:28+00:00
TOI Viral News,47,US Iran Conflict,https://timesofindia.indiatimes.com/articleshow/132572658.cms,2026-07-23T06:29:28+00:00
TOI Viral News,48,Caleb Williams Net Worth,https://timesofindia.indiatimes.com/articleshow/132558755.cms,2026-07-23T06:29:28+00:00
TOI Viral News,49,Abhijeet Dipke education background,https://timesofindia.indiatimes.com/articleshow/132553278.cms,2026-07-23T06:29:28+00:00
TOI Viral News,50,Vijeta Dahiya Education Background,https://timesofindia.indiatimes.com/articleshow/132555280.cms,2026-07-23T06:29:28+00:00
TOI Viral News,51,Mohd Zeeshan Ayyub,https://timesofindia.indiatimes.com/articleshow/132550232.cms,2026-07-23T06:29:28+00:00
TOI Viral News,52,South OTT releases this week,https://timesofindia.indiatimes.com/articleshow/132570346.cms,2026-07-23T06:29:28+00:00
