source,rank,headline,link,collected_at_iso
Indian Express,1,Trending in India,https://indianexpress.com/section/trending/trending-in-india/,2026-04-29T22:56:58+00:00
Indian Express,2,This is Serious,https://indianexpress.com/section/trending/this-is-serious/,2026-04-29T22:56:58+00:00
Indian Express,3,Top 10 most valuable companies in India 2026,https://indianexpress.com/article/trending/top-10-listing/top-10-most-valuable-companies-in-india-in-2026-infosys-tcs-reliance-industries-10662698/,2026-04-29T22:56:58+00:00
Indian Express,4,Twitch streamer hit by car,https://indianexpress.com/article/trending/trending-globally/twitch-streamer-hmbl-zay-hit-by-car-indiana-highway-charity-walk-viral-video-10662611/,2026-04-29T22:56:58+00:00
Indian Express,5,Bihar Anganwadi worker IV drip video,https://indianexpress.com/article/trending/trending-in-india/bihar-katihar-anganwadi-worker-iv-drip-viral-video-sparks-outrage-10662384/,2026-04-29T22:56:58+00:00
Indian Express,6,Mumbai birthday reel fire incident,https://indianexpress.com/article/trending/trending-in-india/mumbai-man-set-goregaon-road-on-fire-for-33-birthday-viral-video-arrested-10661882/,2026-04-29T22:56:58+00:00
Indian Express,7,Sandeep Jethwani clarified that the figure was separate from personal assets such as the family home or vehicle,https://indianexpress.com/article/trending/trending-in-india/rs-40-crore-retirement-corpus-india-dezerv-co-founder-sandeep-jethwani-10661779/,2026-04-29T22:56:58+00:00
Indian Express,8,Shashi Tharoor peacock video,https://indianexpress.com/article/trending/trending-in-india/shashi-tharoor-peacock-video-viral-twinning-instagram-shiv-bhakt-10661667/,2026-04-29T22:56:58+00:00
Indian Express,9,The incident unfolded on Saturday in Shirur,https://indianexpress.com/article/trending/trending-in-india/pregnant-woman-delivers-baby-road-pune-doctor-use-sarees-10661651/,2026-04-29T22:56:58+00:00
Indian Express,10,Top 10 wealthiest countries by GDP per capita in 2026,https://indianexpress.com/article/trending/top-10-listing/top-10-wealthiest-countries-by-gdp-per-capita-in-2026-india-rank-10660644/,2026-04-29T22:56:58+00:00
Indian Express,11,Indian baraat New York Fifth Avenue,https://indianexpress.com/article/trending/trending-in-india/indian-baraat-bride-groom-shut-down-5th-avenue-new-york-viral-video-10660610/,2026-04-29T22:56:58+00:00
Indian Express,12,baby born on Delta flight,https://indianexpress.com/article/trending/trending-globally/baby-born-delta-flight-oregon-mid-air-delivery-paramedics-shoelace-10660299/,2026-04-29T22:56:58+00:00
Indian Express,13,Virat Kohli viral video IPL 2026,https://indianexpress.com/article/trending/trending-in-india/virat-kohli-little-fan-crying-viral-video-dc-vs-rcb-ipl-2026-10660026/,2026-04-29T22:56:58+00:00
Indian Express,14,Ashneer Grover reacts to Sridhar Vembu's X post,https://indianexpress.com/article/trending/trending-in-india/ashneer-grover-sridhar-vembu-us-nris-to-return-post-10659917/,2026-04-29T22:56:58+00:00
Indian Express,15,PM Modi football Gangtok,https://indianexpress.com/article/trending/trending-in-india/pm-modi-gangtok-football-viral-video-sikkim-statehood-day-olympics-10659795/,2026-04-29T22:56:58+00:00
Indian Express,16,Rihanna cowhide dior bag,https://indianexpress.com/article/trending/trending-in-india/rihanna-mumbai-visit-feeds-cow-dior-cowhide-bag-antilia-ambani-event-10659651/,2026-04-29T22:56:58+00:00
Indian Express,17,The now-viral video shows a casually dressed presenter reading Bouman’s introduction from a phone,https://indianexpress.com/article/trending/trending-globally/google-scientist-on-unprofessional-keynote-intro-of-black-hole-researcher-katie-bouman-10659491/,2026-04-29T22:56:58+00:00
Indian Express,18,Mahabalipuram beach littering,https://indianexpress.com/article/trending/trending-in-india/foreign-tourist-slams-indians-over-littering-in-public-spaces-10658584/,2026-04-29T22:56:58+00:00
Indian Express,19,"Prachi Nigam, Class 10 UP board topper who got trolled for facial hair, scores 91.2 per cent in Class 12",https://indianexpress.com/article/trending/trending-in-india/prachi-nigam-up-board-class-12-result-facial-hair-10658197/,2026-04-29T22:56:58+00:00
Indian Express,20,"The video claimed that while Trump projects strength publicly, he is not taken seriously behind the scenes and is often ridiculed",https://indianexpress.com/article/trending/trending-globally/iran-mocks-trump-with-lego-style-diss-track-after-white-house-dinner-scare-10658163/,2026-04-29T22:56:58+00:00
Indian Express,21,"When his first daughter was born, he took only two days off before returning to work",https://indianexpress.com/article/trending/trending-globally/ceo-ron-schneidermann-regrets-choosing-startup-grind-over-his-daughters-birth-10657647/,2026-04-29T22:56:58+00:00
Indian Express,22,The rescue operation reportedly took nearly two hours,https://indianexpress.com/article/trending/trending-in-india/rajasthan-man-stuck-milk-can-rescue-viral-video-10656959/,2026-04-29T22:56:58+00:00
Indian Express,23,Rihanna learns Bharatnatyam,https://indianexpress.com/article/trending/trending-in-india/rihanna-bharatanatyam-mudras-tamil-nadu-influencer-fenty-beauty-10656941/,2026-04-29T22:56:58+00:00
Indian Express,24,The accident unfolded on the Steel Max bungee-style attraction at the Seville Fair,https://indianexpress.com/article/trending/trending-globally/slingshot-ride-cable-snaps-at-spain-fair-sends-capsule-free-falling-10656484/,2026-04-29T22:56:58+00:00
Indian Express,25,"The US millionaire had amassed several hunting trophies over decades, including elephants and lions",https://indianexpress.com/article/trending/trending-globally/us-millionaire-dies-after-elephant-attack-during-hunt-in-gabon-rainforest-10656471/,2026-04-29T22:56:58+00:00
Indian Express,26,US man moves to Bengaluru,https://indianexpress.com/article/trending/trending-in-india/american-youtuber-move-to-bengaluru-goes-viral-for-busting-myths-about-india-10655753/,2026-04-29T22:56:58+00:00
Indian Express,27,Raj Shamani podcast python viral video,https://indianexpress.com/article/trending/trending-in-india/raj-shamani-figuring-out-podcast-500-episode-paul-rosolie-burmese-python-viral-video-10655710/,2026-04-29T22:56:58+00:00
LiveMint,1,"Jannik Sinner storms into Madrid Open semifinals, beating Rafael Jodar",https://www.livemint.com/us/trending/jannik-sinner-storms-into-madrid-open-semifinals-crushing-teen-sensation-rafael-jodar-s-dream-run-11777482782147.html,2026-04-29T22:56:58+00:00
LiveMint,2,Chelsea's Mykhailo Mudryk appeals four-year FA drugs ban at CAS,https://www.livemint.com/us/trending/mykhailo-mudryk-appeals-four-year-fa-drugs-ban-at-cas-chelseas-winger-hopes-for-early-return-11777480017651.html,2026-04-29T22:56:58+00:00
LiveMint,3,Justin Simmons retires: Denver Broncos All-Pro safety ends NFL career,https://www.livemint.com/us/trending/justin-simmons-retires-four-time-all-pro-safety-ends-nfl-career-with-denver-broncos-11777474772792.html,2026-04-29T22:56:58+00:00
LiveMint,4,Kirsten Storms faces restraining order filed by ex-husband Brandon Barash,https://www.livemint.com/us/trending/kirsten-storms-faces-emergency-restraining-order-as-ex-husband-brandon-barash-raises-alarming-claims-in-court-11777405092046.html,2026-04-29T22:56:58+00:00
LiveMint,5,"Over 20 years later, ‘Friends’ brings in $20 Million a year: Lisa Kudrow reveals",https://www.livemint.com/us/trending/over-20-years-later-friends-brings-in-20-million-a-year-lisa-kudrow-shares-insights-11777400523739.html,2026-04-29T22:56:58+00:00
LiveMint,6,Kimmel responds to Trump’s firing demand with sharp message to Melania,https://www.livemint.com/us/trending/jimmy-kimmel-hits-back-after-expectant-widow-joke-tells-melania-to-address-trump-s-hateful-and-violent-rhetoric-11777382628899.html,2026-04-29T22:56:58+00:00
LiveMint,7,"Trump brings up White House shooting, Putin war in Charles meet — Lip reader",https://www.livemint.com/us/trending/trump-mentions-white-house-dinner-shooting-says-putin-wants-war-during-king-charles-visit-to-white-house-lip-reader-11777380974134.html,2026-04-29T22:56:58+00:00
LiveMint,8,"Harry Styles-Zoë Kravitz Ring: A Look at the Rumoured $350,000 Sparkler",https://www.livemint.com/us/trending/harry-styles-zo-kravitz-engagement-ring-a-closer-look-at-the-rumoured-350-000-sparkler-11777318122710.html,2026-04-29T22:56:58+00:00
LiveMint,9,Chelsea 1-0 Leeds: Enzo Fernandez header sends Blues to 2026 FA Cup final,https://www.livemint.com/us/trending/chelsea-1-0-leeds-enzo-fernandez-header-sends-blues-to-2026-fa-cup-final-manchester-city-11777230733431.html,2026-04-29T22:56:58+00:00
LiveMint,10,Deion Sanders shows strong support for Diego Pavia after 2026 NFL draft snub,https://www.livemint.com/us/trending/deion-sanders-diego-pavia-undrafted-2026-nfl-draft-snub-11777213593804.html,2026-04-29T22:56:58+00:00
LiveMint,11,Luxury vs struggle: Former Iranian diplomat’s son exposes harsh reality gap,https://www.livemint.com/us/trending/private-jets-parties-scantily-clad-women-former-iranian-diplomat-s-son-exposes-countrys-deep-inequality-11777220729337.html,2026-04-29T22:56:58+00:00
LiveMint,12,Lawrence Taylor medical emergency: Giants legend hospitalized in New Jersey,https://www.livemint.com/us/trending/lawrence-taylor-medical-emergency-new-york-giants-legend-hospitalized-in-new-jersey-nfl-11777058394793.html,2026-04-29T22:56:58+00:00
LiveMint,13,Carlos Alcaraz withdraws from Roland Garros 2026; check details,https://www.livemint.com/us/trending/carlos-alcaraz-withdraws-roland-garros-2026-french-open-defending-champion-misses-title-defense-wrist-injury-tennis-11777049401197.html,2026-04-29T22:56:58+00:00
LiveMint,14,Fact you may not know: This war lasted shorter than your commute to office,https://www.livemint.com/us/trending/fact-you-probably-dont-know-this-battle-between-two-countries-lasted-shorter-than-your-commute-to-office-11777041884176.html,2026-04-29T22:56:58+00:00
LiveMint,15,David Wilcock harassed by 'cyber-stalkers'? Corey Goode drops shocking claims,https://www.livemint.com/us/trending/ufo-expert-david-wilcock-harassed-by-cyber-stalkers-corey-goode-drops-shocking-claims-after-his-death-11776888810059.html,2026-04-29T22:56:58+00:00
LiveMint,16,"David Wilcock death: Friend shares final moments, reveals he was ‘misunderstood'",https://www.livemint.com/us/trending/david-wilcock-death-best-friend-shares-final-moments-reveals-he-was-excited-about-the-future-11776886359815.html,2026-04-29T22:56:58+00:00
LiveMint,17,Padres sign Lucas Giolito: Veteran pitcher joins San Diego rotation,https://www.livemint.com/us/trending/padres-sign-lucas-giolito-to-one-year-deal-veteran-pitcher-joins-san-diego-rotation-amid-injury-woes-mlb-baseball-11776879659418.html,2026-04-29T22:56:58+00:00
LiveMint,18,FIFA World Cup tickets: Last-minute sales reopen just 50 days before kick-off,https://www.livemint.com/us/trending/fifa-world-cup-tickets-last-minute-sales-reopen-for-all-104-matches-just-50-days-before-kick-off-football-2026-11776873249712.html,2026-04-29T22:56:58+00:00
LiveMint,19,Jude Bellingham reveals why he bought stake in The Hundred's Birmingham Phoenix,https://www.livemint.com/us/trending/jude-bellingham-birmingham-phoenix-the-hundred-investment-reason-cricket-real-madrid-11776867634181.html,2026-04-29T22:56:58+00:00
LiveMint,20,Mark to Market,https://www.livemint.com/market/mark-to-market,2026-04-29T22:56:58+00:00
LiveMint,21,Ask Mint Money,https://www.livemint.com/money/ask-mint-money,2026-04-29T22:56:58+00:00
LiveMint,22,IPL 2026 Schedule,https://www.livemint.com/sports/cricket-news/ipl-schedule,2026-04-29T22:56:58+00:00
LiveMint,23,Orange Cap in IPL 2026,https://www.livemint.com/sports/cricket-news/ipl-orange-cap,2026-04-29T22:56:58+00:00
LiveMint,24,Purple Cap in IPL 2026,https://www.livemint.com/sports/cricket-news/ipl-purple-cap,2026-04-29T22:56:58+00:00
LiveMint,25,IPL 2026 Points Table,https://www.livemint.com/sports/cricket-news/ipl-points-table,2026-04-29T22:56:58+00:00
LiveMint,26,IFSC Code Finder,https://www.livemint.com/ifsc-code,2026-04-29T22:56:58+00:00
LiveMint,27,Income Tax Calculator,https://www.livemint.com/tools-calculators/income-tax-calculator,2026-04-29T22:56:58+00:00
LiveMint,28,Gold Rate Today,https://www.livemint.com/gold-prices,2026-04-29T22:56:58+00:00
LiveMint,29,Gold Rate in Delhi,https://www.livemint.com/gold-prices/delhi,2026-04-29T22:56:58+00:00
LiveMint,30,Gold Rate Hyderabad,https://www.livemint.com/gold-prices/hyderabad,2026-04-29T22:56:58+00:00
LiveMint,31,Silver Rate Today,https://www.livemint.com/silver-prices,2026-04-29T22:56:58+00:00
LiveMint,32,Silver Rate in Delhi,https://www.livemint.com/silver-prices/delhi,2026-04-29T22:56:58+00:00
LiveMint,33,Silver Rate in Bangalore,https://www.livemint.com/silver-prices/bangalore,2026-04-29T22:56:58+00:00
LiveMint,34,US Stock Market,https://www.livemint.com/market/us-market,2026-04-29T22:56:58+00:00
LiveMint,35,Terms of Use,https://www.livemint.com/terms-of-use,2026-04-29T22:56:58+00:00
LiveMint,36,Code of ethics,https://www.livemint.com/code-of-ethics,2026-04-29T22:56:58+00:00
LiveMint,37,Stock Market Today,https://www.livemint.com/market/stock-market-news/stock-market-sensex-nifty-50-live-updates-gift-nifty-20-april-2026-us-iran-war-crude-oil-prices-gold-rate-today-silver-11776651995951.html,2026-04-29T22:56:58+00:00
LiveMint,38,MCX Gold Rate,https://www.livemint.com/market/market-stats/commodity-mcx-gold-price,2026-04-29T22:56:58+00:00
LiveMint,39,MCX Silver Price,https://www.livemint.com/market/market-stats/commodity-mcx-silver-price,2026-04-29T22:56:58+00:00
LiveMint,40,Gold Price in Mumbai,https://www.livemint.com/gold-prices/mumbai,2026-04-29T22:56:58+00:00
LiveMint,41,Gold Price in Chennai,https://www.livemint.com/gold-prices/chennai,2026-04-29T22:56:58+00:00
LiveMint,42,Gold Price in Kolkata,https://www.livemint.com/gold-prices/kolkata,2026-04-29T22:56:58+00:00
LiveMint,43,Silver Price in Mumbai,https://www.livemint.com/silver-prices/mumbai,2026-04-29T22:56:58+00:00
LiveMint,44,Silver Price in Chennai,https://www.livemint.com/silver-prices/chennai,2026-04-29T22:56:58+00:00
LiveMint,45,Silver Price in Hyderabad,https://www.livemint.com/silver-prices/hyderabad,2026-04-29T22:56:58+00:00
LiveMint,46,Silver Price in Kolkata,https://www.livemint.com/silver-prices/kolkata,2026-04-29T22:56:58+00:00
LiveMint,47,Latest News Today,https://www.livemint.com/news,2026-04-29T22:56:58+00:00
LiveMint,48,US News Today,https://www.livemint.com/news/us-news,2026-04-29T22:56:58+00:00
LiveMint,49,Top Company Leader,https://www.livemint.com/companies/people,2026-04-29T22:56:58+00:00
LiveMint,50,personal loan emi calculator,https://www.livemint.com/loans/personal-loan-emi-calculator,2026-04-29T22:56:58+00:00
LiveMint,51,Personal Loan Interest Rate,https://www.livemint.com/loans/personal-loan-interest-rates,2026-04-29T22:56:58+00:00
LiveMint,52,Personal Loan Eligibility,https://www.livemint.com/loans/personal-loan-eligibility,2026-04-29T22:56:58+00:00
LiveMint,53,Instant Personal Loan,https://www.livemint.com/loans/instant-personal-loan,2026-04-29T22:56:58+00:00
LiveMint,54,Home Loan EMI Calculator,https://www.livemint.com/tools-calculators/home-loan-emi-calculator,2026-04-29T22:56:58+00:00
LiveMint,55,Car Loan EMI,https://www.livemint.com/tools-calculators/car-loan-calculator,2026-04-29T22:56:58+00:00
India Today,1,"Manager asks employee to work during sick leave, their conversation is a hard read",https://www.indiatoday.in/trending-news/story/manager-asks-employee-to-work-during-sick-leave-their-conversation-is-a-hard-read-2903390-2026-04-29,2026-04-29T22:56:58+00:00
India Today,2,"YouTuber Lakhan Rawat catches cook spitting on utensils, shares CCTV footage",https://www.indiatoday.in/trending-news/story/youtuber-lakhan-rawat-catches-cook-spitting-on-utensils-shares-cctv-footage-2903336-2026-04-29,2026-04-29T22:56:58+00:00
India Today,3,IndiGo pilot's in-flight announcement for kind passenger is pure feel-good content,https://www.indiatoday.in/trending-news/story/indigo-pilots-in-flight-announcement-for-kind-passenger-is-pure-feel-good-content-2903289-2026-04-29,2026-04-29T22:56:58+00:00
India Today,4,Delhi man offers water to food delivery rider. Her reply brings focus to privilege,https://www.indiatoday.in/trending-news/story/delhi-man-offers-water-to-food-delivery-rider-amid-heatwave-her-reply-brings-focus-to-privilege-2903225-2026-04-29,2026-04-29T22:56:58+00:00
India Today,5,Bengaluru man's big surprise for Rapido auto driver will make RCB fans cheer out loud,https://www.indiatoday.in/trending-news/story/bengaluru-mans-big-surprise-for-rapido-auto-driver-will-make-rcb-fans-cheer-out-loud-2903185-2026-04-29,2026-04-29T22:56:58+00:00
India Today,6,Mumbai man sets part of road on fire with petrol to shoot birthday reel,https://www.indiatoday.in/trending-news/story/mumbai-man-sets-part-of-road-on-fire-with-petrol-to-shoot-birthday-reel-2903121-2026-04-29,2026-04-29T22:56:58+00:00
India Today,7,Vinod Kambli's 'jinko life mein thoda kam mila hai' ice cream ad moves fans to tears,https://www.indiatoday.in/trending-news/story/vinod-kambli-jinko-life-mein-thoda-kam-mila-hai-ice-cream-ad-moves-fans-to-tears-2903142-2026-04-29,2026-04-29T22:56:58+00:00
India Today,8,"Kerala man's cinematic toy car video gets a nod of approval from Porsche, Audi",https://www.indiatoday.in/trending-news/story/kerala-mans-cinematic-toy-car-video-gets-a-nod-of-approval-from-porsche-audi-2903110-2026-04-29,2026-04-29T22:56:58+00:00
India Today,9,Bengaluru boy riding scooter in busy traffic exposes parenting negligence,https://www.indiatoday.in/trending-news/story/bengaluru-boy-riding-scooter-in-busy-traffic-exposes-parenting-negligence-video-viral-2903064-2026-04-29,2026-04-29T22:56:58+00:00
India Today,10,"Man shares how layoffs now lead to years-long struggle, internet collectively sighs",https://www.indiatoday.in/trending-news/story/man-shares-how-layoffs-now-lead-to-years-long-struggle-internet-collectively-sighs-2902841-2026-04-28,2026-04-29T22:56:58+00:00
India Today,11,"Mumbai woman accidentally leaves house unlocked, delivery man notices it. And then..",https://www.indiatoday.in/trending-news/story/mumbai-woman-accidentally-leaves-house-unlocked-delivery-man-notices-it-and-then-2902829-2026-04-28,2026-04-29T22:56:58+00:00
India Today,12,Street dog guards grave of Kerala woman who fed it daily. Video will break your heart,https://www.indiatoday.in/trending-news/story/street-dog-guards-grave-of-kerala-woman-who-fed-it-daily-video-will-break-your-heart-2902759-2026-04-28,2026-04-29T22:56:58+00:00
India Today,13,"Rapido driver struggles as phone crashes in extreme heat, video shows harsh reality",https://www.indiatoday.in/trending-news/story/rapido-driver-struggles-as-phone-crashes-in-extreme-heat-video-shows-harsh-reality-2902677-2026-04-28,2026-04-29T22:56:58+00:00
India Today,14,Shashi Tharoor found himself 'twinning with a handsome fellow'. Here's the video,https://www.indiatoday.in/trending-news/story/shashi-tharoor-found-himself-twinning-handsome-fellow-peacock-here-is-the-video-2902698-2026-04-28,2026-04-29T22:56:58+00:00
India Today,15,Hyderabad woman claims man engaged in obscene act in front of her during morning run,https://www.indiatoday.in/trending-news/story/hyderabad-woman-claims-man-engaged-in-obscene-act-in-front-of-her-during-morning-run-2902634-2026-04-28,2026-04-29T22:56:58+00:00
India Today,16,Bengaluru auto driver makes passenger clean up their mess before leaving. Watch,https://www.indiatoday.in/trending-news/story/bengaluru-auto-driver-makes-passenger-clean-up-their-mess-before-leaving-watch-2902591-2026-04-28,2026-04-29T22:56:58+00:00
India Today,17,"Little boy cries inconsolably, smashes cricket bat after failing to meet Virat Kohli",https://www.indiatoday.in/trending-news/story/virat-kohli-fan-video-little-boy-cries-inconsolably-smashes-cricket-bat-after-failing-to-meet-autograph-rcb-star-2902611-2026-04-28,2026-04-29T22:56:58+00:00
India Today,18,Man celebrates his 59th birthday by running 59 kms from Dehradun to Mussoorie,https://www.indiatoday.in/trending-news/story/man-celebrates-his-59th-birthday-by-running-59-kms-from-dehradun-to-mussoorie-2902566-2026-04-28,2026-04-29T22:56:58+00:00
India Today,19,Viral pic of six children on a scooter in Bengaluru draws police attention,https://www.indiatoday.in/trending-news/story/bengaluru-six-children-on-scooter-viral-pic-draws-police-attention-2902565-2026-04-28,2026-04-29T22:56:58+00:00
India Today,20,Guests grab wine bottles amid panic at White House press dinner. Videos are viral,https://www.indiatoday.in/trending-news/story/guests-grab-wine-bottles-amid-panic-at-white-house-press-dinner-videos-are-viral-2902345-2026-04-27,2026-04-29T22:56:58+00:00
India Today,21,"Mother of 4 welcomes triplets in rare normal delivery in MP's Satna, all stable",https://www.indiatoday.in/india/story/already-a-mother-of-4-mp-woman-delivers-triplets-all-stable-2903527-2026-04-30,2026-04-29T22:56:58+00:00
India Today,22,Don Colossus: 22-foot gold Trump statue sparks buzz and backlash,https://www.indiatoday.in/world/story/don-colossus-trump-golden-statue-sparks-buzz-and-backlash-2903526-2026-04-30,2026-04-29T22:56:58+00:00
India Today,23,"Deadly storm in UP’s Sultanpur kills 7, including two children; over 20 injured",https://www.indiatoday.in/india/story/deadly-storm-in-uttar-pradeshs-sultanpur-kills-7-including-two-children-over-20-injured-2903524-2026-04-30,2026-04-29T22:56:58+00:00
India Today,24,Kajol explains breaking her no-kissing policy after 30 years in The Trial,https://www.indiatoday.in/movies/celebrities/story/kajol-explains-breaking-her-no-kissing-policy-after-30-years-in-the-trial-2900777-2026-04-24,2026-04-29T22:56:58+00:00
India Today,25,How killer of IRS officer's daughter used deceit to rape friend's wife in Alwar,https://www.indiatoday.in/india/story/irs-daughter-rape-rahul-meena-alwar-case-husband-recounts-wedding-trip-return-to-house-and-alleged-deception-2900933-2026-04-24,2026-04-29T22:56:58+00:00
India Today,26,"Karisma Kapoor asks paps not to zoom in while clicking her on set, internet reacts",https://www.indiatoday.in/movies/celebrities/story/karisma-kapoor-asks-paparazzi-not-to-zoom-in-on-indias-best-dancer-5-set-2903021-2026-04-29,2026-04-29T22:56:58+00:00
India Today,27,Ranveer Allahbadia 'hard-launches' girlfriend Juhi Bhatt with pics from Masai Mara,https://www.indiatoday.in/entertainment/story/ranveer-allahbadia-confirms-relationship-with-juhi-bhatt-via-masai-mara-instagram-post-2902475-2026-04-28,2026-04-29T22:56:58+00:00
India Today,28,Dad should not touch my body: UP lawyer dies by suicide over childhood atrocities,https://www.indiatoday.in/india/story/up-lawyer-suicide-kanpur-advocate-priyanshu-srivastava-jump-off-fifth-floor-accused-father-childhood-atrocities-torture-2900950-2026-04-24,2026-04-29T22:56:58+00:00
TOI ETimes,1,Salad topper recalled over salmonella risk,https://timesofindia.indiatimes.com/articleshow/130458722.cms,2026-04-29T22:56:58+00:00
TOI ETimes,2,Rebel Wilson weight loss: How she lost 36 kgs without extreme dieting - Ozempic or lifestyle?,https://timesofindia.indiatimes.com/articleshow/130457577.cms,2026-04-29T22:56:58+00:00
TOI ETimes,3,Viral: India-Australia work-life comparison sparks debate on ‘hustle culture’,https://timesofindia.indiatimes.com/articleshow/130456543.cms,2026-04-29T22:56:58+00:00
TOI ETimes,4,What is the meaning of Indian summer in the UK?,https://timesofindia.indiatimes.com/articleshow/130436405.cms,2026-04-29T22:56:58+00:00
TOI ETimes,5,This sympathetic syndrome makes Fathers feel pregnant,https://timesofindia.indiatimes.com/articleshow/130451612.cms,2026-04-29T22:56:58+00:00
TOI ETimes,6,Quotes that will make you pick up a book even if you haven’t in years,https://timesofindia.indiatimes.com/articleshow/130456862.cms,2026-04-29T22:56:58+00:00
TOI ETimes,7,Shekhar Suman recalls nervous first shot with Rekha in Utsav,https://timesofindia.indiatimes.com/articleshow/130620174.cms,2026-04-29T22:56:58+00:00
TOI ETimes,8,Steven Tyler scores WIN in sexual assault of minor lawsuit,https://timesofindia.indiatimes.com/articleshow/130618564.cms,2026-04-29T22:56:58+00:00
TOI ETimes,9,Rob Reiner's autopsy report 'not complete'; son to remain in jail,https://timesofindia.indiatimes.com/articleshow/130617810.cms,2026-04-29T22:56:58+00:00
TOI ETimes,10,Rajesh Khanna’s live-in partner Anita recalls his low phase,https://timesofindia.indiatimes.com/articleshow/130617836.cms,2026-04-29T22:56:58+00:00
TOI ETimes,11,RK's live-in partner reacts after HC dismisses marriage plea,https://timesofindia.indiatimes.com/articleshow/130617491.cms,2026-04-29T22:56:58+00:00
TOI ETimes,12,Rahul Roy responds to viral reels: ‘I won’t do that again’,https://timesofindia.indiatimes.com/articleshow/130615445.cms,2026-04-29T22:56:58+00:00
TOI ETimes,13,"Lara Dutta recalls Deepika Padukone shooting Housefull with malaria, calls her ‘an absolute professional’: 'She was drained out'",https://timesofindia.indiatimes.com/articleshow/130614229.cms,2026-04-29T22:56:58+00:00
TOI ETimes,14,Rahul Roy’s viral reels with an Instagram user leave the internet divided; fans rally behind the Aashiqui star,https://timesofindia.indiatimes.com/articleshow/130612416.cms,2026-04-29T22:56:58+00:00
TOI ETimes,15,'Dhurandhar 2' BO day 42 [LIVE]: Ranveer Singh film on its way to shatter nine-year global record of 'Baahubali 2',https://timesofindia.indiatimes.com/articleshow/130600914.cms,2026-04-29T22:56:58+00:00
TOI ETimes,16,Ranveer's Dhurandhar 2 crosses Rs 1780 cr globally on Day 41,https://timesofindia.indiatimes.com/articleshow/130593211.cms,2026-04-29T22:56:58+00:00
TOI ETimes,17,'Bhooth Bangla' BO Day 12: Akshay's film nears Rs 200 cr globally,https://timesofindia.indiatimes.com/articleshow/130592993.cms,2026-04-29T22:56:58+00:00
