source,rank,headline,link,collected_at_iso
TOI ETimes,91,The green warrior: Man grew a 31-hectare forest on degraded ...,https://timesofindia.indiatimes.com/articleshow/130472357.cms,2026-05-15T22:54:00+00:00
TOI ETimes,92,She solved a 400-year-old problem that Newton and Kepler cou...,https://timesofindia.indiatimes.com/articleshow/130564119.cms,2026-05-15T22:54:00+00:00
TOI ETimes,93,British couple jailed in Iran: Who are Craig and Lindsay Foreman and why were they detained?,https://timesofindia.indiatimes.com/articleshow/131080554.cms,2026-05-15T22:54:00+00:00
TOI ETimes,94,Which city is known as the milk capital of India? The powerful story behind it,https://timesofindia.indiatimes.com/articleshow/131073011.cms,2026-05-15T22:54:00+00:00
TOI ETimes,95,"A newly discovered asteroid will pass within about 56,000 miles of Earth on Monday",https://timesofindia.indiatimes.com/articleshow/131072172.cms,2026-05-15T22:54:00+00:00
TOI ETimes,96,Did you waste money by paying off your home loan early?,https://timesofindia.indiatimes.com/articleshow/131070250.cms,2026-05-15T22:54:00+00:00
TOI ETimes,97,Woman claims she lives in Mumbai on ₹25K – the internet immediately starts arguing,https://timesofindia.indiatimes.com/articleshow/131066741.cms,2026-05-15T22:54:00+00:00
TOI ETimes,98,"‘It stays warm from the natural heat of your feet’: Influencer stuffs pasta inside her shoe, then casually eats it",https://timesofindia.indiatimes.com/articleshow/131066384.cms,2026-05-15T22:54:00+00:00
TOI ETimes,99,Viral ‘Sumit Sir’ classroom beating video takes shocking turn after student calls it a ‘skit’,https://timesofindia.indiatimes.com/articleshow/131064157.cms,2026-05-15T22:54:00+00:00
TOI ETimes,100,Cannes 2026: Watching Pan’s Labyrinth isn’t a choice for this generation. It’s defiance to make sense of a world gone mad,https://timesofindia.indiatimes.com/articleshow/131060921.cms,2026-05-15T22:54:00+00:00
TOI ETimes,101,Google India joins the 'Main Tera' trend: What is it and why are fans grooving to it on social media?,https://timesofindia.indiatimes.com/articleshow/131061592.cms,2026-05-15T22:54:00+00:00
TOI ETimes,102,"Working Indian couple failed to buy a flat in Bangalore, owns a 3BHK house in the UK",https://timesofindia.indiatimes.com/articleshow/131056509.cms,2026-05-15T22:54:00+00:00
TOI ETimes,103,Who was Seth Amar Chand Banthia? 'Mangal Pandey of Rajasthan' who fought the Revolt of 1857 without using arms,https://timesofindia.indiatimes.com/articleshow/131054958.cms,2026-05-15T22:54:00+00:00
TOI ETimes,104,"Radhakrishnan Pillai, author of Inside Chanakya's Mind, passes away: Timeless quotes of the author that will keep inspiring generations",https://timesofindia.indiatimes.com/articleshow/131054633.cms,2026-05-15T22:54:00+00:00
TOI ETimes,105,Brandon Clarke’s heartfelt message to schoolchildren goes viral as sports world mourns the ‘gentlest soul’,https://timesofindia.indiatimes.com/articleshow/131052659.cms,2026-05-15T22:54:00+00:00
TOI ETimes,106,"₹3.5 lakh fine for picking a fallen mango? THIS Singapore rule goes viral, leaves internet stunned and divided",https://timesofindia.indiatimes.com/articleshow/131046533.cms,2026-05-15T22:54:00+00:00
TOI ETimes,107,‘Only option is to leave’: German YouTuber with 2 million followers says he wants to abandon the country after 30 years,https://timesofindia.indiatimes.com/articleshow/131043379.cms,2026-05-15T22:54:00+00:00
TOI ETimes,108,What this delivery rider allegedly did outside a temple at 1 am has social media shocked and furious,https://timesofindia.indiatimes.com/articleshow/131044088.cms,2026-05-15T22:54:00+00:00
TOI ETimes,109,ISRO scientist Nandini Harinath’s saree from India’s Mars mission showcased at Smithsonian Museum in the US,https://timesofindia.indiatimes.com/articleshow/131043620.cms,2026-05-15T22:54:00+00:00
TOI ETimes,110,From freezer to oven: Woman’s absurd H₂O recipe reel blows up online; Ranveer Brar reacts with ‘I can make it better!’,https://timesofindia.indiatimes.com/articleshow/131041974.cms,2026-05-15T22:54:00+00:00
TOI ETimes,111,Peak humanity: Parisians form a human chain to save a drowning pup from the Seine River,https://timesofindia.indiatimes.com/articleshow/131038817.cms,2026-05-15T22:54:00+00:00
TOI ETimes,112,Meet Lauren Wasser: The 'Girl with Golden Legs' who lost both her limbs due to a tampon,https://timesofindia.indiatimes.com/articleshow/131037524.cms,2026-05-15T22:54:00+00:00
TOI ETimes,113,'Take it to Broadway': Exhibit featuring 3.5 million pages of Jeffrey Epstein files in New York has the internet celebrating,https://timesofindia.indiatimes.com/articleshow/131034125.cms,2026-05-15T22:54:00+00:00
TOI ETimes,114,"‘₹51,000 just to live alone’: Amazon employee’s Bengaluru expense breakdown shocks the internet",https://timesofindia.indiatimes.com/articleshow/131033320.cms,2026-05-15T22:54:00+00:00
TOI ETimes,115,Why has 'Mohan Weds Pooja' been trending at #1 on X: Netizens question origin of the viral phrase,https://timesofindia.indiatimes.com/articleshow/131030109.cms,2026-05-15T22:54:00+00:00
TOI ETimes,116,Meet Violet Jessop: 'Miss Unsinkable' who survived RMS Titanic and two more shipwrecks,https://timesofindia.indiatimes.com/articleshow/131028512.cms,2026-05-15T22:54:00+00:00
TOI ETimes,117,Cadbury set to launch brand new chocolate bar in UK: Twirl gets a makeover,https://timesofindia.indiatimes.com/articleshow/131027796.cms,2026-05-15T22:54:00+00:00
TOI ETimes,118,"'Saving has become harder than ever': Bengaluru couple's ₹1,30,000 monthly expense has netizens shocked",https://timesofindia.indiatimes.com/articleshow/131027451.cms,2026-05-15T22:54:00+00:00
TOI ETimes,119,"‘It feels like torture’: Indian woman’s work-from-home job interview experience shocks social media, reveals unusual webcam policy",https://timesofindia.indiatimes.com/articleshow/131017076.cms,2026-05-15T22:54:00+00:00
TOI ETimes,120,‘The most dangerous meal in India is the office lunch’: Viral post reveals chilling reality of office canteens,https://timesofindia.indiatimes.com/articleshow/131016746.cms,2026-05-15T22:54:00+00:00
TOI ETimes,121,Allyson Felix announces comeback: Inside the 11-time Olympic medallist’s battles on and off the track,https://timesofindia.indiatimes.com/articleshow/131014967.cms,2026-05-15T22:54:00+00:00
TOI ETimes,122,‘Trying to take advantage of me…’ German tourist’s viral Old Delhi story sparks huge debate online,https://timesofindia.indiatimes.com/articleshow/131014686.cms,2026-05-15T22:54:00+00:00
TOI ETimes,123,Harry Potter's Hogwarts Express chugs in this summer with the platform 9¾ entrance: When and where can you enjoy it with family and friends,https://timesofindia.indiatimes.com/articleshow/131010689.cms,2026-05-15T22:54:00+00:00
TOI ETimes,124,"8 extraordinary things about Michael Jackson that make him the King of Pop, especially for a new generation discovering him through Michael, the biopic",https://timesofindia.indiatimes.com/articleshow/131010534.cms,2026-05-15T22:54:00+00:00
TOI ETimes,125,‘Marwaris are India’s greatest business school’: Entrepreneur shares how sitting beside Marwari classmates inspired him to start his own business,https://timesofindia.indiatimes.com/articleshow/131009217.cms,2026-05-15T22:54:00+00:00
TOI ETimes,126,"Rs 6,300 for Uber, Rs 5,300 for three Dosas: Indian influencer reveals how US trip gave her financial anxiety",https://timesofindia.indiatimes.com/articleshow/131006669.cms,2026-05-15T22:54:00+00:00
TOI ETimes,127,Anil Kochhar: How much did the Indian-origin philanthropist spend to pay off student loans for 176 college graduates,https://timesofindia.indiatimes.com/articleshow/131006285.cms,2026-05-15T22:54:00+00:00
TOI ETimes,128,"America's first IVF baby opens up about the 'media circus' surrounding her birth, recalls this bizarre question about her body",https://timesofindia.indiatimes.com/articleshow/131004670.cms,2026-05-15T22:54:00+00:00
TOI ETimes,129,Indian influencer's visit to real-life Doreamon house and school sparks nostalgia among netizens: 'Goosebumps',https://timesofindia.indiatimes.com/articleshow/131003973.cms,2026-05-15T22:54:00+00:00
TOI ETimes,130,Costa Coffee and Sainsbury’s to open 14 more supermarket cafés in 2026: Here’s where the new cafés are coming,https://timesofindia.indiatimes.com/articleshow/131002458.cms,2026-05-15T22:54:00+00:00
TOI ETimes,131,Gwalior contractor duped out of Rs 1.23 lakh by woman posing as London tourist on Facebook: 'Claimed she wanted to visit India',https://timesofindia.indiatimes.com/articleshow/131002218.cms,2026-05-15T22:54:00+00:00
TOI ETimes,132,UK weather maps show 36 hours of May snow across England and Scotland: How to prepare for the sudden weather shift,https://timesofindia.indiatimes.com/articleshow/131001745.cms,2026-05-15T22:54:00+00:00
TOI ETimes,133,'Cultural colonisation 2.0': Pran Pratishta of first-ever Lord Ganesha idol in Latin America faces backlash online,https://timesofindia.indiatimes.com/articleshow/130992269.cms,2026-05-15T22:54:00+00:00
TOI ETimes,134,'Courage to come back home': Indian founder reveals how he left Rubrik.Inc's internship to create Rs100 crore startup in India,https://timesofindia.indiatimes.com/articleshow/130991555.cms,2026-05-15T22:54:00+00:00
TOI ETimes,135,'Peak feminism is having babies': Katie Miller faces backlash for Mother's Day wish asking women to embrace 'biological destiny',https://timesofindia.indiatimes.com/articleshow/130991453.cms,2026-05-15T22:54:00+00:00
TOI ETimes,136,'The epidemic was...': Turkish YouTuber Ruhi Cenet issues clarification after attending wedding post returning from hantavirus-stricken cruise,https://timesofindia.indiatimes.com/articleshow/130990277.cms,2026-05-15T22:54:00+00:00
TOI ETimes,137,‘No one asked for black money’: Amazon techie says buying a Bengaluru flat on two salaries was harder than buying a 3-BHK in the UK on one salary,https://timesofindia.indiatimes.com/articleshow/130989416.cms,2026-05-15T22:54:00+00:00
TOI ETimes,138,Are aliens real? US government's video of a star-shaped UFO raises worries of extraterrestrial existence,https://timesofindia.indiatimes.com/articleshow/130988779.cms,2026-05-15T22:54:00+00:00
TOI ETimes,139,'Unacceptable': Election of trans Tamil immigrant Q. Manivannan to Scottish parliament has netizens enraged,https://timesofindia.indiatimes.com/articleshow/130986902.cms,2026-05-15T22:54:00+00:00
TOI ETimes,140,"Happy Mother’s Day 2026: Images, Quotes, Wishes, Messages, Cards, Greetings, and GIFs",https://timesofindia.indiatimes.com/articleshow/130975354.cms,2026-05-15T22:54:00+00:00
TOI ETimes,141,‘Poisoned watermelon?’ 'Flying Beast' Gaurav Taneja’s bizarre foaming watermelon video leaves internet horrified,https://timesofindia.indiatimes.com/articleshow/130985727.cms,2026-05-15T22:54:00+00:00
TOI ETimes,142,Mother's Day quotes: 15 meaningful quotes by famous authors to touch mom's heart,https://timesofindia.indiatimes.com/articleshow/130981659.cms,2026-05-15T22:54:00+00:00
TOI ETimes,143,"105+ Happy Mother's Day Messages, Greetings Card, Wishes, and Quotes for 2026",https://timesofindia.indiatimes.com/articleshow/130981506.cms,2026-05-15T22:54:00+00:00
TOI ETimes,144,Mother's Day 2026: Hilarious memes and messages that will give your mom goosebumps,https://timesofindia.indiatimes.com/articleshow/130981140.cms,2026-05-15T22:54:00+00:00
TOI ETimes,145,‘Wait… this is the UK?’ Viral Punjabi street video sparks hilarious ‘reverse colonisation’ debate,https://timesofindia.indiatimes.com/articleshow/130980980.cms,2026-05-15T22:54:00+00:00
TOI ETimes,146,"Happy Mother’s Day 2026: Wishes, Messages, Quotes, Images, Greetings, Facebook & WhatsApp status",https://timesofindia.indiatimes.com/articleshow/130975305.cms,2026-05-15T22:54:00+00:00
TOI ETimes,147,"Storm hits IIT Kharagpur, students turn storm-fallen mangoes into achar inside hostel - internet says ‘sarv gun sampann’",https://timesofindia.indiatimes.com/articleshow/130977604.cms,2026-05-15T22:54:00+00:00
TOI ETimes,148,"Princess of Wales reveals her morning ritual, and it’s just like ours!",https://timesofindia.indiatimes.com/articleshow/130972701.cms,2026-05-15T22:54:00+00:00
TOI ETimes,149,Did you miss the shocking scene outside the Met Gala? ‘Urine’ bottles were reportedly planted in a protest plot targeting Jeff Bezos — here’s why,https://timesofindia.indiatimes.com/articleshow/130971979.cms,2026-05-15T22:54:00+00:00
TOI ETimes,150,AI turns 12 years of couple chats into wedding story; Anthropic employee’s project goes viral,https://timesofindia.indiatimes.com/articleshow/130971774.cms,2026-05-15T22:54:00+00:00
TOI ETimes,151,Dhurandhar 2 Ott,https://timesofindia.indiatimes.com/articleshow/131098814.cms,2026-05-15T22:54:00+00:00
TOI ETimes,152,Study Tips For Student,https://timesofindia.indiatimes.com/articleshow/131097116.cms,2026-05-15T22:54:00+00:00
TOI ETimes,153,The Summer I Turned Pretty Movie,https://timesofindia.indiatimes.com/articleshow/131089677.cms,2026-05-15T22:54:00+00:00
TOI ETimes,154,James McAvoy Quote,https://timesofindia.indiatimes.com/articleshow/131072092.cms,2026-05-15T22:54:00+00:00
TOI ETimes,155,Chef Vikas Khanna,https://timesofindia.indiatimes.com/articleshow/131114708.cms,2026-05-15T22:54:00+00:00
TOI ETimes,156,Bhooth Bangla Box Office Collection,https://timesofindia.indiatimes.com/articleshow/131052130.cms,2026-05-15T22:54:00+00:00
TOI ETimes,157,Puma VS Jaguar,https://timesofindia.indiatimes.com/articleshow/130963598.cms,2026-05-15T22:54:00+00:00
TOI ETimes,158,Europe Summer Flight,https://timesofindia.indiatimes.com/articleshow/131058040.cms,2026-05-15T22:54:00+00:00
TOI ETimes,159,Raja Shivaji Box Office Collection,https://timesofindia.indiatimes.com/articleshow/131053547.cms,2026-05-15T22:54:00+00:00
TOI ETimes,160,Highest Mountains in The World,https://timesofindia.indiatimes.com/articleshow/131030913.cms,2026-05-15T22:54:00+00:00
TOI ETimes,161,Cleanest Lakes In The US,https://timesofindia.indiatimes.com/articleshow/131019510.cms,2026-05-15T22:54:00+00:00
TOI ETimes,162,Attracts Snakes To Toilet,https://timesofindia.indiatimes.com/articleshow/130952013.cms,2026-05-15T22:54:00+00:00
TOI ETimes,163,Legal Document Property,https://timesofindia.indiatimes.com/articleshow/131086786.cms,2026-05-15T22:54:00+00:00
TOI ETimes,164,Claim Fixed Deposit After Death,https://timesofindia.indiatimes.com/articleshow/131091363.cms,2026-05-15T22:54:00+00:00
TOI ETimes,165,Ghost Of The Woods,https://timesofindia.indiatimes.com/articleshow/131035539.cms,2026-05-15T22:54:00+00:00
TOI ETimes,166,Captions For Instagram Posts,https://timesofindia.indiatimes.com/articleshow/130895681.cms,2026-05-15T22:54:00+00:00
TOI ETimes,167,Hazaribag man drowns while fishing in lake,https://timesofindia.indiatimes.com/articleshow/130060093.cms,2026-05-15T22:54:00+00:00
TOI ETimes,168,"""Behen Darr Gayi!"": Fans relive ‘Bhagam Bhag’ era after watching Akshay Kumar's 'Bhooth Bangla' trailer",https://timesofindia.indiatimes.com/articleshow/130060027.cms,2026-05-15T22:54:00+00:00
TOI ETimes,169,MBOSE HSLC result 2026 to release tomorrow: Check details here,https://timesofindia.indiatimes.com/articleshow/130059814.cms,2026-05-15T22:54:00+00:00
TOI ETimes,170,"Iran war risk: JPMorgan CEO Jamie Dimon warns of oil shocks, sticky inflation and higher interest rates",https://timesofindia.indiatimes.com/articleshow/130059993.cms,2026-05-15T22:54:00+00:00
TOI ETimes,171,Make your clutch last longer with these easy driving tips,https://timesofindia.indiatimes.com/articleshow/130052232.cms,2026-05-15T22:54:00+00:00
TOI ETimes,172,“Three-against-one situation”: El Rubius opens up on being “targeted” in MrBeast’s viral $1M challenge,https://timesofindia.indiatimes.com/articleshow/130054402.cms,2026-05-15T22:54:00+00:00
TOI ETimes,173,Bihar BTSC lab assistant notification released for 1091 posts at btsc.bihar.gov.in; apply here,https://timesofindia.indiatimes.com/articleshow/130059322.cms,2026-05-15T22:54:00+00:00
TOI ETimes,174,IPL craze costs techie Rs 1.46 lakh in fake RCB vs CSK ticket scam,https://timesofindia.indiatimes.com/articleshow/130059549.cms,2026-05-15T22:54:00+00:00
TOI ETimes,175,Raising “robot-proof” kids: Why creativity and curiosity matter more than ever,https://timesofindia.indiatimes.com/articleshow/130057342.cms,2026-05-15T22:54:00+00:00
TOI ETimes,176,Inside ‘Satguru Sharan’: Exploring Saif Ali Khan and Kareena Kapoor Khan’s Rs 100 crore Bandra home,https://timesofindia.indiatimes.com/articleshow/130059584.cms,2026-05-15T22:54:00+00:00
TOI ETimes,177,How selling Alaska in 1867 was a costly mistake for Russia,https://timesofindia.indiatimes.com/articleshow/130057081.cms,2026-05-15T22:54:00+00:00
TOI ETimes,178,'Hera Pheri 3 is coming': Paresh Rawal dismisses delay reports and reveals he will 'start shooting soon',https://timesofindia.indiatimes.com/articleshow/130059421.cms,2026-05-15T22:54:00+00:00
TOI ETimes,179,"US-Iran War: A daring rescue Hollywood blockbuster is on its way. Till then, pick your favourite from these 10 films on bringing someone home against all odds",https://timesofindia.indiatimes.com/articleshow/130059208.cms,2026-05-15T22:54:00+00:00
TOI ETimes,180,"Kolkata team unveils fan mural at Rash Behari Avenue, celebrating city’s first love",https://timesofindia.indiatimes.com/articleshow/130059554.cms,2026-05-15T22:54:00+00:00
TOI ETimes,181,How US spread a lie to rescue a pilot of a jet shot down in Iran,https://timesofindia.indiatimes.com/articleshow/130058641.cms,2026-05-15T22:54:00+00:00
TOI ETimes,182,"Netflix unveils ‘VOID’, an AI model that can change a movie plot",https://timesofindia.indiatimes.com/articleshow/130058880.cms,2026-05-15T22:54:00+00:00
TOI ETimes,183,"AI data centers are causing 'stress' not just to tech companies, but also private insurers",https://timesofindia.indiatimes.com/articleshow/130058967.cms,2026-05-15T22:54:00+00:00
TOI ETimes,184,"""Trans women are....."": Clavicular’s viral moment with trans women sparks fresh conversation on internet culture",https://timesofindia.indiatimes.com/articleshow/130053479.cms,2026-05-15T22:54:00+00:00
TOI Viral News,1,"Watch: Hardeep Singh Puri reunites with old friend from Delhi University, video melts hearts",https://timesofindia.indiatimes.com/articleshow/108418522.cms,2026-05-15T22:54:00+00:00
TOI Viral News,2,Narayana Murthy and daughter Akshata enjoy 'Corner House' ice cream in Bengaluru,https://timesofindia.indiatimes.com/articleshow/107659138.cms,2026-05-15T22:54:00+00:00
TOI Viral News,3,Taylor Swift cheers boyfriend Travis Kelce at the Super Bowl,https://timesofindia.indiatimes.com/articleshow/107613344.cms,2026-05-15T22:54:00+00:00
TOI Viral News,4,'He Nitished me' to 'Paltu Chacha': Nitish Kumar's 'swing politics' sparks humour fest,https://timesofindia.indiatimes.com/articleshow/107236114.cms,2026-05-15T22:54:00+00:00
TOI Viral News,5,"Flyer hits IndiGo Pilot announcing flight delay due to dense fog conditions, video goes viral",https://timesofindia.indiatimes.com/articleshow/106851189.cms,2026-05-15T22:54:00+00:00
TOI Viral News,6,"New Zealand's youngest MP performs native 'war cry' in Parliament, video goes viral",https://timesofindia.indiatimes.com/articleshow/106572179.cms,2026-05-15T22:54:00+00:00
TOI Viral News,7,"NASA unveils stunning image of 'evil eye' galaxy, sparking internet awe",https://timesofindia.indiatimes.com/articleshow/105570940.cms,2026-05-15T22:54:00+00:00
TOI Viral News,8,Millennials bemoan lackluster Black Friday deals in social media uproar,https://timesofindia.indiatimes.com/articleshow/105475777.cms,2026-05-15T22:54:00+00:00
TOI Viral News,9,'At least they'll not lose to India in semis': Memes erupt with Pakistan all but out of World Cup,https://timesofindia.indiatimes.com/articleshow/105122539.cms,2026-05-15T22:54:00+00:00
TOI Viral News,10,Brazilian influencer Vanessa Mancini dies at 41 from massive heart attack,https://timesofindia.indiatimes.com/articleshow/105110853.cms,2026-05-15T22:54:00+00:00
TOI Viral News,11,Memes erupt as Angelo Mathews becomes first international cricketer to be timed out,https://timesofindia.indiatimes.com/articleshow/105016656.cms,2026-05-15T22:54:00+00:00
TOI Viral News,12,Mia Khalifa posts Amy Schumer's heated exchange with Asia Jackson over Israel-Palestine conflict,https://timesofindia.indiatimes.com/articleshow/104947696.cms,2026-05-15T22:54:00+00:00
TOI Viral News,13,Fans troll Pakistan as Proteas beat Kiwis to keep Pak's semi-final hopes alive,https://timesofindia.indiatimes.com/articleshow/104912338.cms,2026-05-15T22:54:00+00:00
TOI Viral News,14,Mark Zuckerberg and family's Halloween transformation into Hogwarts icons warms hearts,https://timesofindia.indiatimes.com/articleshow/104888586.cms,2026-05-15T22:54:00+00:00
TOI Viral News,15,'Bore hone ka chance-ich nahi' as auto driver sings & entertains people stuck in Andheri traffic,https://timesofindia.indiatimes.com/articleshow/104886091.cms,2026-05-15T22:54:00+00:00
TOI Viral News,16,Escaped monkey 'Momo' captured after it drinks beer and runs riot in Indianapolis,https://timesofindia.indiatimes.com/articleshow/104208644.cms,2026-05-15T22:54:00+00:00
TOI Viral News,17,"Animal smuggling: Otter, rat and 28 turtles cause chaos on Bangkok to Taipei flight",https://timesofindia.indiatimes.com/articleshow/104208771.cms,2026-05-15T22:54:00+00:00
TOI Viral News,18,Alligator ally oops! Phillies fan denied entry with emotional support gator,https://timesofindia.indiatimes.com/articleshow/104043227.cms,2026-05-15T22:54:00+00:00
TOI Viral News,19,'Qualified for Karachi station': Pakistan's exit from Asia Cup sparks memefest,https://timesofindia.indiatimes.com/articleshow/103687163.cms,2026-05-15T22:54:00+00:00
TOI Viral News,20,"'Racist bigots': Arabic restaurant in US refuses to serve cops in uniform, faces fury",https://timesofindia.indiatimes.com/articleshow/103285144.cms,2026-05-15T22:54:00+00:00
TOI Viral News,21,Watch: Pakistani wedding in UK descends into mass brawl as guests hurl chairs at each other,https://timesofindia.indiatimes.com/articleshow/103245258.cms,2026-05-15T22:54:00+00:00
TOI Viral News,22,Memes abuzz as Neeraj Chopra makes history with first gold for India in World Championship,https://timesofindia.indiatimes.com/articleshow/103138499.cms,2026-05-15T22:54:00+00:00
TOI Viral News,23,Boyfriend held in murder of Instagram influencer Beauty Couch in Georgia,https://timesofindia.indiatimes.com/articleshow/103125550.cms,2026-05-15T22:54:00+00:00
TOI Viral News,24,Why internet is suddenly talking about Donald Trump’s weight,https://timesofindia.indiatimes.com/articleshow/103058329.cms,2026-05-15T22:54:00+00:00
TOI Viral News,25,'Don is back': Trump's mug shot triggers memefest,https://timesofindia.indiatimes.com/articleshow/103047943.cms,2026-05-15T22:54:00+00:00
TOI Viral News,26,"Hurricane Hilary unleashes fury on Southern California, visuals viral",https://timesofindia.indiatimes.com/articleshow/102906246.cms,2026-05-15T22:54:00+00:00
TOI Viral News,27,'Shameless': Prakash Raj blasted by netizens for mocking India's moon mission,https://timesofindia.indiatimes.com/articleshow/102902284.cms,2026-05-15T22:54:00+00:00
TOI Viral News,28,'Me during WFH': Photo of Selena Gomez wrapped in 'shawl' stirs memefest,https://timesofindia.indiatimes.com/articleshow/102799584.cms,2026-05-15T22:54:00+00:00
TOI Viral News,29,'Mission impossible': Memes erupt as people find it hard to return to office after long weekend,https://timesofindia.indiatimes.com/articleshow/102768800.cms,2026-05-15T22:54:00+00:00
TOI Viral News,30,‘Paisa hi paisa hoga’: Memes erupt as Indian creators receive massive payout from Twitter,https://timesofindia.indiatimes.com/articleshow/102576219.cms,2026-05-15T22:54:00+00:00
TOI Viral News,31,"Akhilesh Yadav's half-brother, husband of BJP leader Aparna Yadav, Prateek Yadav dies at 38",https://timesofindia.indiatimes.com/articleshow/131052690.cms,2026-05-15T22:54:00+00:00
TOI Viral News,32,"Blood clot in lungs caused Prateek Yadav’s death, reveals post-mortem report",https://timesofindia.indiatimes.com/articleshow/131063988.cms,2026-05-15T22:54:00+00:00
TOI Viral News,33,"'Nothing learnt from Nirbhaya incident': Woman dragged, gang-raped; disturbing details emerge",https://timesofindia.indiatimes.com/articleshow/131088095.cms,2026-05-15T22:54:00+00:00
TOI Viral News,34,Nearly 70 lakh women found ineligible under Ladki Bahin scheme after e-KYC drive,https://timesofindia.indiatimes.com/articleshow/131076657.cms,2026-05-15T22:54:00+00:00
TOI Viral News,35,Chud The Builder,https://timesofindia.indiatimes.com/articleshow/131105777.cms,2026-05-15T22:54:00+00:00
TOI Viral News,36,IPL 2026 Orange Cap,https://timesofindia.indiatimes.com/articleshow/131047966.cms,2026-05-15T22:54:00+00:00
TOI Viral News,37,Jannik Sinner and Laila Hasanovic Net Worth,https://timesofindia.indiatimes.com/articleshow/131079617.cms,2026-05-15T22:54:00+00:00
TOI Viral News,38,NFL Schedule Release 2026,https://timesofindia.indiatimes.com/articleshow/131120960.cms,2026-05-15T22:54:00+00:00
TOI Viral News,39,Ben Shelton and Trinity Rodman Combined Net Worth,https://timesofindia.indiatimes.com/articleshow/131064916.cms,2026-05-15T22:54:00+00:00
TOI Viral News,40,NFL Trade Rumor,https://timesofindia.indiatimes.com/articleshow/131116096.cms,2026-05-15T22:54:00+00:00
TOI Viral News,41,IPL Toss Today,https://timesofindia.indiatimes.com/articleshow/131119558.cms,2026-05-15T22:54:00+00:00
TOI Viral News,42,Floyd Mayweather vs Manny Pacquiao,https://timesofindia.indiatimes.com/articleshow/131118522.cms,2026-05-15T22:54:00+00:00
TOI Viral News,43,Petrol Diesel Price,https://timesofindia.indiatimes.com/articleshow/131118879.cms,2026-05-15T22:54:00+00:00
