source,rank,headline,link,collected_at_iso
Indian Express,1,Trending in India,https://indianexpress.com/section/trending/trending-in-india/,2026-05-17T13:20:21+00:00
Indian Express,2,This is Serious,https://indianexpress.com/section/trending/this-is-serious/,2026-05-17T13:20:21+00:00
Indian Express,3,"Despite the frightening sight, the three staff members can be seen fighting back",https://indianexpress.com/article/trending/trending-in-india/nashik-jewellery-store-robbery-staff-fight-back-cctv-viral-10694297/,2026-05-17T13:20:21+00:00
Indian Express,4,Elon Musk made the remarks while responding to a viral discussion on X about evolving trends in social media,https://indianexpress.com/article/trending/trending-globally/elon-musk-instagram-for-girls-backlash-x-post-10693959/,2026-05-17T13:20:21+00:00
Indian Express,5,Eyewitnesses can be seen running away from the location,https://indianexpress.com/article/trending/trending-globally/thailand-train-bus-collision-video-fire-viral-8-killed-10693753/,2026-05-17T13:20:21+00:00
Indian Express,6,Kerala village life video,https://indianexpress.com/article/trending/trending-in-india/kerala-man-working-9-5-in-london-shows-peaceful-village-life-back-home-viral-video-10692994/,2026-05-17T13:20:21+00:00
Indian Express,7,Ankur Warikoo courses business shutdown,https://indianexpress.com/article/trending/trending-in-india/ankur-warikoo-shuts-down-rs-100-crore-courses-business-ai-impact-10692916/,2026-05-17T13:20:21+00:00
Indian Express,8,Chilli's CEO Kevin Hochman morning routine,https://indianexpress.com/article/trending/trending-globally/chilis-ceo-kevin-hochman-morning-walk-best-business-ideas-expert-explain-morning-habits-of-ceos-10692564/,2026-05-17T13:20:21+00:00
Indian Express,9,Jwala Gutta breast milk donation,https://indianexpress.com/article/trending/trending-in-india/jwala-gutta-donated-60-litres-of-breast-milk-for-nicu-babies-in-hyderabad-chennai-10692402/,2026-05-17T13:20:21+00:00
Indian Express,10,Gujarat folk singer buried under cash,https://indianexpress.com/article/trending/trending-in-india/gujarat-bhajan-singer-gopal-sadhu-buried-under-pile-of-cash-during-dayro-event-viral-video-10692259/,2026-05-17T13:20:21+00:00
Indian Express,11,Nepal rhino fight video,https://indianexpress.com/article/trending/trending-in-india/2-rhinos-fight-in-nepal-near-chitwan-national-park-viral-video-stuns-tourists-10691404/,2026-05-17T13:20:21+00:00
Indian Express,12,"aviation, atf fuel price hike, maharashtra",https://indianexpress.com/article/trending/top-10-listing/top-10-most-polluted-airports-in-the-world-indian-airports-release-27-6-million-tonnes-of-co2-10691371/,2026-05-17T13:20:21+00:00
Indian Express,13,Mumbai family celebrates son's results with marksheet cake,https://indianexpress.com/article/trending/trending-in-india/mumbai-family-celebrates-son-55-percent-marks-with-with-marksheet-cake-10691225/,2026-05-17T13:20:21+00:00
Indian Express,14,viral mountain Maggi stall video,https://indianexpress.com/article/trending/trending-in-india/delhi-content-creator-sell-maggi-in-mountains-reveal-single-day-earnings-in-viral-video-10690878/,2026-05-17T13:20:21+00:00
Indian Express,15,Florida plane crash survivors,https://indianexpress.com/article/trending/trending-globally/florida-plane-crash-11-survivors-stranded-on-raft-for-5-hours-before-rescue-10690734/,2026-05-17T13:20:21+00:00
Indian Express,16,Scarlett Johansson work-life balance,https://indianexpress.com/article/trending/trending-globally/scarlett-johansson-says-work-life-balance-is-not-possible-despite-net-worth-of-165-million-dollars-10690596/,2026-05-17T13:20:21+00:00
Indian Express,17,Indian States with Highest Petrol Consumption,https://indianexpress.com/article/trending/top-10-listing/top-10-indian-states-in-petrol-consumption-up-beats-maharashtra-delhi-rank-10689576/,2026-05-17T13:20:21+00:00
Indian Express,18,Air India halwa puri meal,https://indianexpress.com/article/trending/trending-in-india/pune-woman-amused-after-air-india-serve-halwa-puri-channa-on-delhi-bali-flight-10689409/,2026-05-17T13:20:21+00:00
Indian Express,19,Nanhe Miyan Bareilly storm viral video,https://indianexpress.com/article/trending/trending-in-india/nanhe-miyan-lifted-50-metres-into-air-viral-video-bareilly-up-storm-10689210/,2026-05-17T13:20:21+00:00
Indian Express,20,China school baby doll exercise,https://indianexpress.com/article/trending/trending-globally/china-school-make-rebellious-students-carry-baby-dolls-to-teach-parenting-struggles-10688969/,2026-05-17T13:20:21+00:00
Indian Express,21,UP storm viral video,https://indianexpress.com/article/trending/trending-in-india/up-storm-viral-video-man-thrown-into-air-as-powerful-winds-lash-bareilly-10688840/,2026-05-17T13:20:21+00:00
Indian Express,22,Uber CEO Dara Khosrowshahi Delhi Metro ride,https://indianexpress.com/article/trending/trending-in-india/uber-ceo-dara-khosrowshahi-take-delhi-metro-ride-to-jor-bagh-call-it-fast-affordable-10688691/,2026-05-17T13:20:21+00:00
Indian Express,23,Top 10 countries with largest gold reserves in world,https://indianexpress.com/article/trending/top-10-listing/top-10-countries-with-largest-gold-reserves-in-the-world-10687821/,2026-05-17T13:20:21+00:00
Indian Express,24,Kaddu airport stray dog found,https://indianexpress.com/article/trending/trending-in-india/kaddu-delhi-airport-stray-dog-found-safe-in-dwarka-viral-video-10687797/,2026-05-17T13:20:21+00:00
Indian Express,25,viral underwater sunset video,https://indianexpress.com/article/trending/trending-globally/diver-leave-camera-underwater-in-maui-hawaii-capture-sea-creatures-in-viral-video-10687654/,2026-05-17T13:20:21+00:00
Indian Express,26,Vladimir Putin viral video,https://indianexpress.com/article/trending/trending-globally/russian-president-vladimir-putin-drives-former-school-teacher-to-kremlin-dinner-viral-video-10687494/,2026-05-17T13:20:21+00:00
Indian Express,27,DTC bus stop,https://indianexpress.com/article/trending/trending-in-india/delhi-traffic-police-dtc-bus-stop-blocked-by-car-viral-post-10687155/,2026-05-17T13:20:21+00:00
LiveMint,1,Joel Embiid ruled out for Philadelphia 76ers Game 2 vs Knicks due to injury,https://www.livemint.com/us/trending/joel-embiid-ruled-out-for-philadelphia-76ers-game-2-vs-new-york-knicks-due-to-injury-11778089872415.html,2026-05-17T13:20:21+00:00
LiveMint,2,"Carlos Correa injury: Astros place star player on IL, recall Shay Whitcomb",https://www.livemint.com/us/trending/carlos-correa-injury-houston-astros-place-star-player-with-season-ending-left-ankle-injury-on-il-shay-whitcomb-mlb-11778085652310.html,2026-05-17T13:20:21+00:00
LiveMint,3,Bayern Munich vs PSG: Who will win UCL clash? AI predictions and more,https://www.livemint.com/us/trending/bayern-munich-vs-psg-predictions-champions-league-semifinal-lineups-live-streaming-ucl-202526-11778071490090.html,2026-05-17T13:20:21+00:00
LiveMint,4,Are celebs really skipping Met Gala because Jeff Bezos is funding it?,https://www.livemint.com/us/trending/met-gala-are-meryl-streep-zendaya-really-skipping-the-event-because-jeff-bezos-is-funding-it-here-s-the-truth-11777924588506.html,2026-05-17T13:20:21+00:00
LiveMint,5,Met Gala 2026 LIVE Update: Rihanna shines bright like a diamond after Beyonce,https://www.livemint.com/us/trending/met-gala-2026-live-updates-red-carpet-11777915596931.html,2026-05-17T13:20:21+00:00
LiveMint,6,F1: Kimi Antonelli wins 2026 Miami Grand Prix 2026,https://www.livemint.com/us/trending/kimi-antonelli-wins-miami-grand-prix-2026-secures-third-consecutive-f1-win-in-thrilling-race-formula-1-race-11777833243419.html,2026-05-17T13:20:21+00:00
LiveMint,7,Messi steals spotlight at 2026 F1 Miami Grand Prix with Mercedes Paddock visit,https://www.livemint.com/us/trending/lionel-messi-steals-spotlight-at-2026-f1-miami-grand-prix-with-mercedes-paddock-visit-11777828759020.html,2026-05-17T13:20:21+00:00
LiveMint,8,Sinner becomes first man in history to win 5 consecutive ATP Masters 1000 titles,https://www.livemint.com/us/trending/jannik-sinner-becomes-first-man-in-history-to-win-five-consecutive-atp-masters-1000-titles-with-madrid-open-2026-win-11777824491199.html,2026-05-17T13:20:21+00:00
LiveMint,9,Sir Alex Ferguson taken to hospital before Manchester United vs Liverpool clash,https://www.livemint.com/us/trending/sir-alex-ferguson-hospitalized-before-manchester-united-vs-liverpool-clash-at-old-trafford-premier-league-11777821038054.html,2026-05-17T13:20:21+00:00
LiveMint,10,F1: New start time confirmed for Miami Grand Prix 2026 following weather concern,https://www.livemint.com/us/trending/f1-race-today-new-start-time-confirmed-for-miami-grand-prix-2026-following-weather-concerns-1-pm-formula-one-11777815611939.html,2026-05-17T13:20:21+00:00
LiveMint,11,Isack Hadjar disqualified from Miami GP qualifying after Antonelli claims pole,https://www.livemint.com/us/trending/isack-hadjar-disqualified-from-miami-gp-qualifying-over-floor-breach-after-kimi-antonelli-claims-pole-f1-formula-one-11777812192883.html,2026-05-17T13:20:21+00:00
LiveMint,12,F1 standings: Lando Norris wins 2026 Miami Grand Prix sprint; check details,https://www.livemint.com/us/trending/f1-standings-lando-norris-wins-2026-miami-grand-prix-sprint-mclaren-dominates-ahead-of-oscar-piastri-charles-leclerc-11777748165459.html,2026-05-17T13:20:21+00:00
LiveMint,13,Marta Kostyuk wins first WTA 1000 title at Madrid Open defeating Mirra Andreeva,https://www.livemint.com/us/trending/marta-kostyuk-wins-first-wta-1000-title-at-2026-mutua-madrid-open-defeating-mirra-andreeva-tennis-11777741831620.html,2026-05-17T13:20:21+00:00
LiveMint,14,Kofi Kingston and Xavier Woods mutually part ways with WWE; check details,https://www.livemint.com/us/trending/kofi-kingston-and-xavier-woods-mutually-part-ways-with-wwe-new-day-era-ends-after-two-decades-11777737655848.html,2026-05-17T13:20:21+00:00
LiveMint,15,Alex Zanardi death: Ex-F1 driver and Paralympic champion passes away at 59,https://www.livemint.com/us/trending/alex-zanardi-death-ex-f1-driver-and-paralympic-champion-passes-away-at-59-11777722809154.html,2026-05-17T13:20:21+00:00
LiveMint,16,Notre Dame lands four-star QB Wonderful Monds IV for 2027 Class,https://www.livemint.com/us/trending/notre-dame-lands-four-star-qb-wonderful-monds-iv-for-2027-class-future-quarterback-pipeline-gets-major-boost-11777663752062.html,2026-05-17T13:20:21+00:00
LiveMint,17,Las Vegas Raiders release LB Jamin Davis; check details,https://www.livemint.com/us/trending/las-vegas-raiders-release-lb-jamin-davis-nfl-11777648041021.html,2026-05-17T13:20:21+00:00
LiveMint,18,Jannik Sinner breaks Novak Djokovic's record after reaching Madrid Open final,https://www.livemint.com/us/trending/jannik-sinner-breaks-novak-djokovics-record-youngest-ever-to-reach-finals-at-all-atp-masters-1000-events-madrid-open-11777651008351.html,2026-05-17T13:20:21+00:00
LiveMint,19,"Miami Grand Prix 2026: Date, schedule, drivers and more details",https://www.livemint.com/us/trending/f1-miami-grand-prix-2026-date-schedule-drivers-and-more-details-as-formula-1-returns-to-south-florida-11777645272617.html,2026-05-17T13:20:21+00:00
LiveMint,20,Calais Campbell signs one-year deal to reunite with Baltimore Ravens,https://www.livemint.com/us/trending/calais-campbell-signs-one-year-deal-to-reunite-with-baltimore-ravens-for-19th-nfl-season-11777568784994.html,2026-05-17T13:20:21+00:00
LiveMint,21,John Wall named president of basketball operations at Howard University,https://www.livemint.com/us/trending/john-wall-named-president-of-basketball-operations-at-howard-university-nba-star-returns-to-dc-roots-college-basketball-11777563099390.html,2026-05-17T13:20:21+00:00
LiveMint,22,Alexander Blockx stuns Casper Ruud to reach Madrid Open semifinals,https://www.livemint.com/us/trending/alexander-blockx-stuns-casper-ruud-to-reach-madrid-open-semifinals-tennis-11777556320538.html,2026-05-17T13:20:21+00:00
LiveMint,23,Jayson Tatum surpasses Kobe Bryant for second-most playoff points before age 29,https://www.livemint.com/us/trending/jayson-tatum-surpasses-kobe-bryant-for-second-most-playoff-points-in-nba-history-before-age-29-11777553504237.html,2026-05-17T13:20:21+00:00
LiveMint,24,"Jannik Sinner storms into Madrid Open semifinals, beating Rafael Jodar",https://www.livemint.com/us/trending/jannik-sinner-storms-into-madrid-open-semifinals-crushing-teen-sensation-rafael-jodar-s-dream-run-11777482782147.html,2026-05-17T13:20:21+00:00
LiveMint,25,Chelsea's Mykhailo Mudryk appeals four-year FA drugs ban at CAS,https://www.livemint.com/us/trending/mykhailo-mudryk-appeals-four-year-fa-drugs-ban-at-cas-chelseas-winger-hopes-for-early-return-11777480017651.html,2026-05-17T13:20:21+00:00
LiveMint,26,Justin Simmons retires: Denver Broncos All-Pro safety ends NFL career,https://www.livemint.com/us/trending/justin-simmons-retires-four-time-all-pro-safety-ends-nfl-career-with-denver-broncos-11777474772792.html,2026-05-17T13:20:21+00:00
LiveMint,27,Kirsten Storms faces restraining order filed by ex-husband Brandon Barash,https://www.livemint.com/us/trending/kirsten-storms-faces-emergency-restraining-order-as-ex-husband-brandon-barash-raises-alarming-claims-in-court-11777405092046.html,2026-05-17T13:20:21+00:00
LiveMint,28,"Over 20 years later, ‘Friends’ brings in $20 Million a year: Lisa Kudrow reveals",https://www.livemint.com/us/trending/over-20-years-later-friends-brings-in-20-million-a-year-lisa-kudrow-shares-insights-11777400523739.html,2026-05-17T13:20:21+00:00
LiveMint,29,Kimmel responds to Trump’s firing demand with sharp message to Melania,https://www.livemint.com/us/trending/jimmy-kimmel-hits-back-after-expectant-widow-joke-tells-melania-to-address-trump-s-hateful-and-violent-rhetoric-11777382628899.html,2026-05-17T13:20:21+00:00
LiveMint,30,"Harry Styles-Zoë Kravitz Ring: A Look at the Rumoured $350,000 Sparkler",https://www.livemint.com/us/trending/harry-styles-zo-kravitz-engagement-ring-a-closer-look-at-the-rumoured-350-000-sparkler-11777318122710.html,2026-05-17T13:20:21+00:00
LiveMint,31,Chelsea 1-0 Leeds: Enzo Fernandez header sends Blues to 2026 FA Cup final,https://www.livemint.com/us/trending/chelsea-1-0-leeds-enzo-fernandez-header-sends-blues-to-2026-fa-cup-final-manchester-city-11777230733431.html,2026-05-17T13:20:21+00:00
LiveMint,32,Deion Sanders shows strong support for Diego Pavia after 2026 NFL draft snub,https://www.livemint.com/us/trending/deion-sanders-diego-pavia-undrafted-2026-nfl-draft-snub-11777213593804.html,2026-05-17T13:20:21+00:00
LiveMint,33,Luxury vs struggle: Former Iranian diplomat’s son exposes harsh reality gap,https://www.livemint.com/us/trending/private-jets-parties-scantily-clad-women-former-iranian-diplomat-s-son-exposes-countrys-deep-inequality-11777220729337.html,2026-05-17T13:20:21+00:00
LiveMint,34,Lawrence Taylor medical emergency: Giants legend hospitalized in New Jersey,https://www.livemint.com/us/trending/lawrence-taylor-medical-emergency-new-york-giants-legend-hospitalized-in-new-jersey-nfl-11777058394793.html,2026-05-17T13:20:21+00:00
LiveMint,35,Carlos Alcaraz withdraws from Roland Garros 2026; check details,https://www.livemint.com/us/trending/carlos-alcaraz-withdraws-roland-garros-2026-french-open-defending-champion-misses-title-defense-wrist-injury-tennis-11777049401197.html,2026-05-17T13:20:21+00:00
LiveMint,36,Fact you may not know: This war lasted shorter than your commute to office,https://www.livemint.com/us/trending/fact-you-probably-dont-know-this-battle-between-two-countries-lasted-shorter-than-your-commute-to-office-11777041884176.html,2026-05-17T13:20:21+00:00
LiveMint,37,David Wilcock harassed by 'cyber-stalkers'? Corey Goode drops shocking claims,https://www.livemint.com/us/trending/ufo-expert-david-wilcock-harassed-by-cyber-stalkers-corey-goode-drops-shocking-claims-after-his-death-11776888810059.html,2026-05-17T13:20:21+00:00
LiveMint,38,"David Wilcock death: Friend shares final moments, reveals he was ‘misunderstood'",https://www.livemint.com/us/trending/david-wilcock-death-best-friend-shares-final-moments-reveals-he-was-excited-about-the-future-11776886359815.html,2026-05-17T13:20:21+00:00
LiveMint,39,Padres sign Lucas Giolito: Veteran pitcher joins San Diego rotation,https://www.livemint.com/us/trending/padres-sign-lucas-giolito-to-one-year-deal-veteran-pitcher-joins-san-diego-rotation-amid-injury-woes-mlb-baseball-11776879659418.html,2026-05-17T13:20:21+00:00
LiveMint,40,Mark to Market,https://www.livemint.com/market/mark-to-market,2026-05-17T13:20:21+00:00
LiveMint,41,"Wall St Week Ahead-Nvidia, retailer reports to shed light on AI boom, consumer spending",https://www.livemint.com/market/wall-st-week-ahead-nvidia-retailer-reports-to-shed-light-on-ai-boom-consumer-spending-11779022918420.html,2026-05-17T13:20:21+00:00
LiveMint,42,Want a hot pre-IPO company in your portfolio? Proceed with caution,https://www.livemint.com/market/ipo/want-a-hot-pre-ipo-company-in-your-portfolio-proceed-with-caution-11779017628970.html,2026-05-17T13:20:21+00:00
LiveMint,43,Mint Explainer | Why power prices on Indian exchanges are crashing to zero despite record demand,https://www.livemint.com/market/commodities/india-power-prices-hit-zero-despite-record-demand-11779009289637.html,2026-05-17T13:20:21+00:00
LiveMint,44,Silver rate today: How are govt restrictions likely to impact silver prices?,https://www.livemint.com/market/commodities/silver-rate-today-how-are-govt-restrictions-likely-to-impact-silver-prices-11779009246223.html,2026-05-17T13:20:21+00:00
LiveMint,45,Reliance Jio IPO: How much-awaited IPO likely to impact Reliance share price?,https://www.livemint.com/market/stock-market-news/reliance-jio-ipo-how-much-awaited-ipo-likely-to-impact-reliance-share-price-11779005719985.html,2026-05-17T13:20:21+00:00
LiveMint,46,Mcap of nine of top 10 valued firms erodes by ₹3.12 lakh crore; Reliance biggest laggard,https://www.livemint.com/market/stock-market-news/mcap-of-nine-of-top-10-valued-firms-erodes-by-3-12-lakh-crore-reliance-biggest-laggard-11779003121488.html,2026-05-17T13:20:21+00:00
LiveMint,47,"Quote of the Day by Mother Teresa: 'If you judge people, you have no time to love them'",https://www.livemint.com/news/india/quote-of-the-day-by-mother-teresa-if-you-judge-people-you-have-no-time-to-love-them-11779020580593.html,2026-05-17T13:20:21+00:00
LiveMint,48,WHO declares international emergency over Ebola outbreak: Here are the precautions that you can take to stay safe,https://www.livemint.com/news/world/who-declares-international-emergency-over-ebola-outbreak-symptoms-precautions-vaccine-11779020398354.html,2026-05-17T13:20:21+00:00
LiveMint,49,"Ahead of Bakrid, buffalo with ‘Trump-like’ hair draws visitors in Bangladesh - Watch",https://www.livemint.com/news/trends/ahead-of-bakrid-buffalo-with-trump-like-hair-draws-visitors-in-bangladesh-watch-11779018667178.html,2026-05-17T13:20:21+00:00
LiveMint,50,"Reddit asks how to handle upcoming economic crisis in India: Social media responds, ‘Buy gold if you have INR’",https://www.livemint.com/news/trends/reddit-asks-how-to-handle-upcoming-economic-crisis-in-india-social-media-responds-buy-gold-if-you-have-inr-11779018784455.html,2026-05-17T13:20:21+00:00
LiveMint,51,"UAE's Barakah nuclear power plant under attack? Drone strike sparks fire on its perimeter, shaking Iran war ceasefire",https://www.livemint.com/news/world/uaes-barakah-nuclear-power-plant-under-attack-drone-strike-sparks-fire-on-its-perimeter-shaking-iran-war-ceasefire-11779017639324.html,2026-05-17T13:20:21+00:00
LiveMint,52,"‘Why haven't you dismissed him?’: Rahul Gandhi asks PM Modi, demands Dharmendra Pradhan’s removal over NEET paper leak",https://www.livemint.com/news/india/rahul-gandhi-asks-pm-modi-demands-dharmendra-pradhan-s-removal-over-neet-paper-leak-11779017233438.html,2026-05-17T13:20:21+00:00
LiveMint,53,How Amazon went from an AI also-ran to a real contender,https://www.livemint.com/companies/news/how-amazon-went-from-an-ai-also-ran-to-a-real-contender-11779016950063.html,2026-05-17T13:20:21+00:00
LiveMint,54,Realty group Sattva deepens premium hotel push amid travel boom,https://www.livemint.com/companies/news/realty-firm-sattva-group-hospitality-sector-india-real-estate-developer-11778991620842.html,2026-05-17T13:20:21+00:00
LiveMint,55,"Boos, shouts and a Google billionaire: What happened when Eric Schmidt tried to talk AI at a 2026 graduation",https://www.livemint.com/companies/people/boos-shouts-and-a-google-billionaire-what-happened-when-eric-schmidt-tried-to-talk-ai-at-a-2026-graduation-11779002588148.html,2026-05-17T13:20:21+00:00
LiveMint,56,"Indian Railway Finance Corp. plans ₹28k cr ECB round in FY27, says CMD Manoj Kumar Dubey",https://www.livemint.com/market/bonds/indian-railway-finance-corp-ecbs-rs-28-000-cr-cmd-manoj-kumar-dubey-bonds-11778841870654.html,2026-05-17T13:20:21+00:00
LiveMint,57,This tech job grew 729% in a year amid AI-related layoffs. Salaries now touch ₹1.7 crore,https://www.livemint.com/companies/news/this-tech-job-grew-729-per-cent-in-a-year-as-ai-killed-others-around-it-salaries-now-touch-rs-1-7-crore-11778982935222.html,2026-05-17T13:20:21+00:00
LiveMint,58,Venezuela Circulates Draft of Oil Law Regulations for Companies,https://www.livemint.com/companies/venezuela-circulates-draft-of-oil-law-regulations-for-companies-11778964942687.html,2026-05-17T13:20:21+00:00
LiveMint,59,Ask Mint Money,https://www.livemint.com/money/ask-mint-money,2026-05-17T13:20:21+00:00
LiveMint,60,Attention taxpayers! Excel utility for income-tax return forms ITR-1 and ITR-4 enabled — Here's all you need to know,https://www.livemint.com/money/personal-finance/attention-taxpayers-excel-utility-for-income-tax-return-forms-itr-1-and-itr-4-enabled-heres-all-you-need-to-know-11779016379725.html,2026-05-17T13:20:21+00:00
LiveMint,61,Wondering why your bank just reduced your credit card limit? These could be the reasons behind it,https://www.livemint.com/money/personal-finance/why-banks-reduce-your-credit-card-limit-reasons-explained-11779009379563.html,2026-05-17T13:20:21+00:00
LiveMint,62,"Retirement planning: Here's how much corpus a 27-years-old couple, living in Mumbai, will require by 60 years",https://www.livemint.com/money/personal-finance/retirement-planning-how-much-corpus-married-couple-27-years-live-mumbai-savings-require-by-60-years-long-term-investment-11779010153904.html,2026-05-17T13:20:21+00:00
LiveMint,63,Day-one newborn cover: what insurers don’t tell you,https://www.livemint.com/money/personal-finance/health-insurance-india-newborn-maternity-cover-policy-niva-bupa-star-health-icici-lombard-tata-aig-11778995549082.html,2026-05-17T13:20:21+00:00
LiveMint,64,Credit card blocked? Follow these 5 simple steps to unblock it quickly,https://www.livemint.com/money/personal-finance/credit-card-blocked-follow-these-5-simple-steps-to-unblock-it-quickly-11778785346916.html,2026-05-17T13:20:21+00:00
LiveMint,65,"Undisclosed cash, gold or investments? Pay up to 78% tax under income tax rules",https://www.livemint.com/money/personal-finance/undisclosed-cash-gold-or-investments-pay-up-to-78-tax-under-income-tax-rules-11778835764574.html,2026-05-17T13:20:21+00:00
LiveMint,66,"Redmi Turbo 5 vs OnePlus Nord 6: Which is the best gaming phone under ₹40,000?",https://www.livemint.com/technology/gadgets/redmi-turbo-5-vs-oneplus-nord-6-which-is-the-best-gaming-phone-under-rs-40000-11779010658911.html,2026-05-17T13:20:21+00:00
LiveMint,67,"Redmi Turbo 5 India launch soon: Expected specs, price, features and availability",https://www.livemint.com/technology/gadgets/redmi-turbo-5-india-launch-soon-expected-specs-price-features-and-availability-11779008456999.html,2026-05-17T13:20:21+00:00
LiveMint,68,"Google I/O 2026 kicks off next week: How to watch live-stream, full schedule and what to expect",https://www.livemint.com/technology/tech-news/google-i-o-2026-kicks-off-next-week-how-to-watch-live-stream-full-schedule-and-what-to-expect-11778997198228.html,2026-05-17T13:20:21+00:00
LiveMint,69,Instagram users want Instants gone: Why the new feature is sparking privacy fears and how to turn it off,https://www.livemint.com/technology/tech-news/instagram-users-want-instants-gone-why-the-new-feature-is-sparking-privacy-fears-and-how-to-turn-it-off-11778997542480.html,2026-05-17T13:20:21+00:00
LiveMint,70,Google reveals why it is slashing 15GB of free Google Drive storage down to 5GB for new users,https://www.livemint.com/technology/tech-news/google-reveals-why-it-is-slashing-15gb-of-free-google-drive-storage-down-to-5gb-for-new-users-11778989827520.html,2026-05-17T13:20:21+00:00
LiveMint,71,OnePlus suddenly pauses latest OxygenOS 16 update: here's what happened,https://www.livemint.com/technology/tech-news/oneplus-suddenly-pauses-latest-oxygenos-16-update-heres-what-happened-11778983537853.html,2026-05-17T13:20:21+00:00
LiveMint,72,IPL 2026 Schedule,https://www.livemint.com/sports/cricket-news/ipl-schedule,2026-05-17T13:20:21+00:00
LiveMint,73,Orange Cap in IPL 2026,https://www.livemint.com/sports/cricket-news/ipl-orange-cap,2026-05-17T13:20:21+00:00
LiveMint,74,Purple Cap in IPL 2026,https://www.livemint.com/sports/cricket-news/ipl-purple-cap,2026-05-17T13:20:21+00:00
LiveMint,75,IPL 2026 Points Table,https://www.livemint.com/sports/cricket-news/ipl-points-table,2026-05-17T13:20:21+00:00
LiveMint,76,IFSC Code Finder,https://www.livemint.com/ifsc-code,2026-05-17T13:20:21+00:00
LiveMint,77,Income Tax Calculator,https://www.livemint.com/tools-calculators/income-tax-calculator,2026-05-17T13:20:21+00:00
LiveMint,78,Gold Rate Today,https://www.livemint.com/gold-prices,2026-05-17T13:20:21+00:00
LiveMint,79,Gold Rate in Delhi,https://www.livemint.com/gold-prices/delhi,2026-05-17T13:20:21+00:00
LiveMint,80,Gold Rate Hyderabad,https://www.livemint.com/gold-prices/hyderabad,2026-05-17T13:20:21+00:00
