source,rank,headline,link,collected_at_iso
Indian Express,1,Trending in India,https://indianexpress.com/section/trending/trending-in-india/,2026-06-25T14:32:58+00:00
Indian Express,2,This is Serious,https://indianexpress.com/section/trending/this-is-serious/,2026-06-25T14:32:58+00:00
Indian Express,3,Hermes handbag investment,https://indianexpress.com/article/trending/trending-globally/dubai-woman-sold-her-wedding-jewellery-to-buy-hermes-birkin-bags-know-why-10757403/,2026-06-25T14:32:58+00:00
Indian Express,4,train passenger civic sense debate,https://indianexpress.com/article/trending/trending-in-india/train-passenger-civic-sense-debate-viral-post-10757368/,2026-06-25T14:32:58+00:00
Indian Express,5,Kerala Brazil fan stroke recovery,https://indianexpress.com/article/trending/trending-in-india/kerala-brazil-fan-stroke-recovery-world-cup-2026-10757269/,2026-06-25T14:32:58+00:00
Indian Express,6,Karnataka tourists swept Anand Mahindra Offers Help to Kolkata Violinist BGoa Baga Beach viral video,https://indianexpress.com/article/trending/trending-in-india/anand-mahindra-kolkata-violinist-bhagwan-mallick-support-10756904/,2026-06-25T14:32:58+00:00
Indian Express,7,Karnataka tourists swept away Goa Baga Beach viral video,https://indianexpress.com/article/trending/trending-in-india/baga-beach-viral-video-karnataka-tourist-swept-away-goa-waves-10756684/,2026-06-25T14:32:58+00:00
Indian Express,8,Lionel Messi replies to Kerala fan,https://indianexpress.com/article/trending/trending-in-india/lionel-messi-replies-to-kerala-fan-birthday-wish-in-spanish-viral-video-10756527/,2026-06-25T14:32:58+00:00
Indian Express,9,"Pant, who spent several seasons with Delhi Capitals and also led the side as captain, was previously signed by Lucknow Super Giants for a record Rs 27 crore",https://indianexpress.com/article/trending/trending-in-india/harsh-goenka-rishabh-pant-ipl-salary-debate-10756467/,2026-06-25T14:32:58+00:00
Indian Express,10,Maya elephant calf rescue story,https://indianexpress.com/article/trending/trending-in-india/maya-elephant-calf-rescue-story-kerala-survival-miracle-10755588/,2026-06-25T14:32:58+00:00
Indian Express,11,Labrador Mary viral sniffer dog,https://indianexpress.com/article/trending/trending-in-india/labrador-mary-helped-police-solve-up-girl-assault-case-10755415/,2026-06-25T14:32:58+00:00
Indian Express,12,Assam businessman arrested for birthday party on bridge,https://indianexpress.com/article/trending/trending-in-india/assam-businessman-arrested-wife-birthday-party-kumar-bhaskar-varma-setu-viral-video-10755239/,2026-06-25T14:32:58+00:00
Indian Express,13,Indian tourists racist abuse by Bangladeshi waiter,https://indianexpress.com/article/trending/trending-in-india/indian-women-confront-bangladeshi-waiter-anti-india-remarks-in-italy-viral-video-10755130/,2026-06-25T14:32:58+00:00
Indian Express,14,World's loudest person,https://indianexpress.com/article/trending/trending-globally/worlds-loudest-person-joseph-mcgrail-bateup-guinness-record-10754830/,2026-06-25T14:32:58+00:00
Indian Express,15,The New York City Police Department said on June 20 that no formal complaints had been filed regarding the incident,https://indianexpress.com/article/trending/trending-globally/jpmorgan-chase-angie-baez-fired-knicks-parade-video-10754816/,2026-06-25T14:32:58+00:00
Indian Express,16,Anas Abdul Latheef UAE success story,https://indianexpress.com/article/trending/trending-in-india/indian-expat-built-a-uae-tech-company-with-dh350-loan-from-his-mother-10753844/,2026-06-25T14:32:58+00:00
Indian Express,17,China humanoid robot asking for money,https://indianexpress.com/article/trending/trending-globally/china-humanoid-robot-asking-for-money-unitree-g1-video-viral-10753778/,2026-06-25T14:32:58+00:00
Indian Express,18,Mumbai salary vs hometown life,https://indianexpress.com/article/trending/trending-in-india/mumbai-salary-vs-hometown-life-techie-pay-cut-quality-of-life-10753639/,2026-06-25T14:32:58+00:00
Indian Express,19,"Lima named best city for food in 2026 report, Bengaluru hits #13 spot: Top 10 list",https://indianexpress.com/article/trending/top-10-listing/top-10-world-best-cities-food-2026-lima-bengaluru-13th-10750375/,2026-06-25T14:32:58+00:00
Indian Express,20,"QS rankings 2027: IIT-Delhi leads India list, one private university in top 10",https://indianexpress.com/article/trending/top-10-listing/india-top-10-qs-rankings-iit-delhi-one-private-university-10750365/,2026-06-25T14:32:58+00:00
Indian Express,21,Bhutan is Asia’s lone entry in top 10 for freshwater per person: Full list,https://indianexpress.com/article/trending/top-10-listing/bhutan-is-asias-lone-entry-in-top-10-for-freshwater-per-person-full-list-10749170/,2026-06-25T14:32:58+00:00
Indian Express,22,Ankur Warikoo Google rejection,https://indianexpress.com/article/trending/trending-in-india/rejected-by-17-companies-turned-down-by-google-ankur-warikoo-reveals-what-kept-him-motivated-10753319/,2026-06-25T14:32:58+00:00
Indian Express,23,Norway Viking Row celebration,https://indianexpress.com/article/trending/trending-globally/haaland-norway-viking-row-celebration-world-cup-senegal-win-10753150/,2026-06-25T14:32:58+00:00
Indian Express,24,Lionel Messi World Cup records,https://indianexpress.com/article/trending/trending-globally/lionel-messi-world-cup-records-argentina-austria-2026-fifa-world-cup-10753044/,2026-06-25T14:32:58+00:00
Indian Express,25,"Located about 43 km southwest of Guatemala City, Volcán de Fuego is considered Guatemala’s most active volcano",https://indianexpress.com/article/trending/trending-globally/guatemala-volcano-eruption-viral-video-tourists-scramble-to-safety-10752867/,2026-06-25T14:32:58+00:00
Indian Express,26,"Recalling his childhood, Gurindervir Singh said his father’s sporting background became his earliest source of inspiration.",https://indianexpress.com/article/trending/trending-in-india/alia-bhatt-interviews-gurindervir-singh-ahead-of-alpha-10752042/,2026-06-25T14:32:58+00:00
Indian Express,27,Shyamal Anadkat ex-OpenAI researcher returns to India,https://indianexpress.com/article/trending/trending-in-india/former-openai-researcher-shyamal-anadkat-returns-to-india-silicon-valley-10751905/,2026-06-25T14:32:58+00:00
LiveMint,1,"The wait is over: Rockstar announces GTA VI price, pre-orders starts tomorrow",https://www.livemint.com/us/trending/the-wait-is-over-rockstar-announces-gta-vi-price-pre-orders-starts-tomorrow-heres-how-you-can-order-11782318796865.html,2026-06-25T14:32:58+00:00
LiveMint,2,"Amazon Prime Day 2026: Best deals under $100 on Fitbit, Kindle and more",https://www.livemint.com/us/trending/amazon-prime-day-2026-best-deals-under-100-on-fitbit-kindle-and-more-11782217189437.html,2026-06-25T14:32:58+00:00
LiveMint,3,Why was Alex Freeman's goal allowed to stand after VAR review in USA vs Australi,https://www.livemint.com/us/trending/alex-freeman-goal-allowed-to-stand-after-var-review-in-usa-vs-australia-fifa-world-cup-2026-match-11781900874288.html,2026-06-25T14:32:58+00:00
LiveMint,4,Christian Pulisic injury update: Will USMNT star play in Australia FIFA WC game?,https://www.livemint.com/us/christian-pulisic-injury-update-will-usmnt-star-play-in-australia-fifa-world-cup-2026-clash-check-playing-xi-11781890065629.html,2026-06-25T14:32:58+00:00
LiveMint,5,"This former welder turned millionaire overnight, thanks to SpaceX IPO",https://www.livemint.com/us/trending/this-former-welder-turned-millionaire-overnight-thanks-to-spacex-ipo-here-is-how-much-shares-he-owns-11781439252428.html,2026-06-25T14:32:58+00:00
LiveMint,6,Tyra Banks files defamation lawsuit against Netflix,https://www.livemint.com/us/trending/tyra-banks-sues-netflix-over-america-s-next-top-model-docuseries-alleging-defamation-and-manipulation-11781380081367.html,2026-06-25T14:32:58+00:00
LiveMint,7,Morgan Wallen cancels second Pittsburgh show over severe weather,https://www.livemint.com/us/trending/morgan-wallen-cancels-second-pittsburgh-concert-as-severe-weather-threatens-area-11780773856814.html,2026-06-25T14:32:58+00:00
LiveMint,8,National Donut Day: Here are the places offering free donuts in the US today,https://www.livemint.com/us/trending/national-donut-day-2026-here-are-the-places-offering-free-donuts-in-the-us-today-11780582955435.html,2026-06-25T14:32:58+00:00
LiveMint,9,BTS lead diverse lineup for 2026 iHeartRadio Music Festival,https://www.livemint.com/us/trending/bts-cardi-b-headline-star-studded-2026-iheartradio-music-festival-lineup-in-las-vegas-11780433121103.html,2026-06-25T14:32:58+00:00
LiveMint,10,McDonald's joins FIFA World Cup 2026 fever with limited-edition menu,https://www.livemint.com/us/trending/mcdonalds-joins-fifa-world-cup-2026-fever-with-limited-edition-menu-collectable-cups-and-toys-11780414027281.html,2026-06-25T14:32:58+00:00
LiveMint,11,Tom Holland credits Zendaya for inspiring new Bero shandy flavours,https://www.livemint.com/news/trends/tom-holland-credits-zendaya-for-inspiring-new-bero-non-alcoholic-flavours-she-didn-t-love-the-beers-we-have-on-sale-11780341907920.html,2026-06-25T14:32:58+00:00
LiveMint,12,Bret Michaels becomes fifth act to quit Trump fair,https://www.livemint.com/us/trending/bret-michaels-becomes-fifth-performer-to-withdraw-from-trump-linked-great-american-state-fair-amid-backlash-11780059673299.html,2026-06-25T14:32:58+00:00
LiveMint,13,Mystery bidder pays more than $9 million to meet Warren Buffett,https://www.livemint.com/us/trending/mystery-bidder-pays-more-than-9-million-to-meet-warren-buffett-steph-and-ayesha-curry-over-lunch-11779026671945.html,2026-06-25T14:32:58+00:00
LiveMint,14,Joel Embiid ruled out for Philadelphia 76ers Game 2 vs Knicks due to injury,https://www.livemint.com/us/trending/joel-embiid-ruled-out-for-philadelphia-76ers-game-2-vs-new-york-knicks-due-to-injury-11778089872415.html,2026-06-25T14:32:58+00:00
LiveMint,15,"Carlos Correa injury: Astros place star player on IL, recall Shay Whitcomb",https://www.livemint.com/us/trending/carlos-correa-injury-houston-astros-place-star-player-with-season-ending-left-ankle-injury-on-il-shay-whitcomb-mlb-11778085652310.html,2026-06-25T14:32:58+00:00
LiveMint,16,Bayern Munich vs PSG: Who will win UCL clash? AI predictions and more,https://www.livemint.com/us/trending/bayern-munich-vs-psg-predictions-champions-league-semifinal-lineups-live-streaming-ucl-202526-11778071490090.html,2026-06-25T14:32:58+00:00
LiveMint,17,Are celebs really skipping Met Gala because Jeff Bezos is funding it?,https://www.livemint.com/us/trending/met-gala-are-meryl-streep-zendaya-really-skipping-the-event-because-jeff-bezos-is-funding-it-here-s-the-truth-11777924588506.html,2026-06-25T14:32:58+00:00
LiveMint,18,Met Gala 2026 LIVE Update: Rihanna shines bright like a diamond after Beyonce,https://www.livemint.com/us/trending/met-gala-2026-live-updates-red-carpet-11777915596931.html,2026-06-25T14:32:58+00:00
LiveMint,19,F1: Kimi Antonelli wins 2026 Miami Grand Prix 2026,https://www.livemint.com/us/trending/kimi-antonelli-wins-miami-grand-prix-2026-secures-third-consecutive-f1-win-in-thrilling-race-formula-1-race-11777833243419.html,2026-06-25T14:32:58+00:00
LiveMint,20,Messi steals spotlight at 2026 F1 Miami Grand Prix with Mercedes Paddock visit,https://www.livemint.com/us/trending/lionel-messi-steals-spotlight-at-2026-f1-miami-grand-prix-with-mercedes-paddock-visit-11777828759020.html,2026-06-25T14:32:58+00:00
LiveMint,21,Sinner becomes first man in history to win 5 consecutive ATP Masters 1000 titles,https://www.livemint.com/us/trending/jannik-sinner-becomes-first-man-in-history-to-win-five-consecutive-atp-masters-1000-titles-with-madrid-open-2026-win-11777824491199.html,2026-06-25T14:32:58+00:00
LiveMint,22,Sir Alex Ferguson taken to hospital before Manchester United vs Liverpool clash,https://www.livemint.com/us/trending/sir-alex-ferguson-hospitalized-before-manchester-united-vs-liverpool-clash-at-old-trafford-premier-league-11777821038054.html,2026-06-25T14:32:58+00:00
LiveMint,23,F1: New start time confirmed for Miami Grand Prix 2026 following weather concern,https://www.livemint.com/us/trending/f1-race-today-new-start-time-confirmed-for-miami-grand-prix-2026-following-weather-concerns-1-pm-formula-one-11777815611939.html,2026-06-25T14:32:58+00:00
LiveMint,24,Isack Hadjar disqualified from Miami GP qualifying after Antonelli claims pole,https://www.livemint.com/us/trending/isack-hadjar-disqualified-from-miami-gp-qualifying-over-floor-breach-after-kimi-antonelli-claims-pole-f1-formula-one-11777812192883.html,2026-06-25T14:32:58+00:00
LiveMint,25,F1 standings: Lando Norris wins 2026 Miami Grand Prix sprint; check details,https://www.livemint.com/us/trending/f1-standings-lando-norris-wins-2026-miami-grand-prix-sprint-mclaren-dominates-ahead-of-oscar-piastri-charles-leclerc-11777748165459.html,2026-06-25T14:32:58+00:00
LiveMint,26,Marta Kostyuk wins first WTA 1000 title at Madrid Open defeating Mirra Andreeva,https://www.livemint.com/us/trending/marta-kostyuk-wins-first-wta-1000-title-at-2026-mutua-madrid-open-defeating-mirra-andreeva-tennis-11777741831620.html,2026-06-25T14:32:58+00:00
LiveMint,27,Kofi Kingston and Xavier Woods mutually part ways with WWE; check details,https://www.livemint.com/us/trending/kofi-kingston-and-xavier-woods-mutually-part-ways-with-wwe-new-day-era-ends-after-two-decades-11777737655848.html,2026-06-25T14:32:58+00:00
LiveMint,28,Alex Zanardi death: Ex-F1 driver and Paralympic champion passes away at 59,https://www.livemint.com/us/trending/alex-zanardi-death-ex-f1-driver-and-paralympic-champion-passes-away-at-59-11777722809154.html,2026-06-25T14:32:58+00:00
LiveMint,29,Notre Dame lands four-star QB Wonderful Monds IV for 2027 Class,https://www.livemint.com/us/trending/notre-dame-lands-four-star-qb-wonderful-monds-iv-for-2027-class-future-quarterback-pipeline-gets-major-boost-11777663752062.html,2026-06-25T14:32:58+00:00
LiveMint,30,Las Vegas Raiders release LB Jamin Davis; check details,https://www.livemint.com/us/trending/las-vegas-raiders-release-lb-jamin-davis-nfl-11777648041021.html,2026-06-25T14:32:58+00:00
LiveMint,31,Jannik Sinner breaks Novak Djokovic's record after reaching Madrid Open final,https://www.livemint.com/us/trending/jannik-sinner-breaks-novak-djokovics-record-youngest-ever-to-reach-finals-at-all-atp-masters-1000-events-madrid-open-11777651008351.html,2026-06-25T14:32:58+00:00
LiveMint,32,"Miami Grand Prix 2026: Date, schedule, drivers and more details",https://www.livemint.com/us/trending/f1-miami-grand-prix-2026-date-schedule-drivers-and-more-details-as-formula-1-returns-to-south-florida-11777645272617.html,2026-06-25T14:32:58+00:00
LiveMint,33,Calais Campbell signs one-year deal to reunite with Baltimore Ravens,https://www.livemint.com/us/trending/calais-campbell-signs-one-year-deal-to-reunite-with-baltimore-ravens-for-19th-nfl-season-11777568784994.html,2026-06-25T14:32:58+00:00
LiveMint,34,John Wall named president of basketball operations at Howard University,https://www.livemint.com/us/trending/john-wall-named-president-of-basketball-operations-at-howard-university-nba-star-returns-to-dc-roots-college-basketball-11777563099390.html,2026-06-25T14:32:58+00:00
LiveMint,35,Alexander Blockx stuns Casper Ruud to reach Madrid Open semifinals,https://www.livemint.com/us/trending/alexander-blockx-stuns-casper-ruud-to-reach-madrid-open-semifinals-tennis-11777556320538.html,2026-06-25T14:32:58+00:00
LiveMint,36,Jayson Tatum surpasses Kobe Bryant for second-most playoff points before age 29,https://www.livemint.com/us/trending/jayson-tatum-surpasses-kobe-bryant-for-second-most-playoff-points-in-nba-history-before-age-29-11777553504237.html,2026-06-25T14:32:58+00:00
LiveMint,37,"Jannik Sinner storms into Madrid Open semifinals, beating Rafael Jodar",https://www.livemint.com/us/trending/jannik-sinner-storms-into-madrid-open-semifinals-crushing-teen-sensation-rafael-jodar-s-dream-run-11777482782147.html,2026-06-25T14:32:58+00:00
LiveMint,38,Chelsea's Mykhailo Mudryk appeals four-year FA drugs ban at CAS,https://www.livemint.com/us/trending/mykhailo-mudryk-appeals-four-year-fa-drugs-ban-at-cas-chelseas-winger-hopes-for-early-return-11777480017651.html,2026-06-25T14:32:58+00:00
LiveMint,39,Justin Simmons retires: Denver Broncos All-Pro safety ends NFL career,https://www.livemint.com/us/trending/justin-simmons-retires-four-time-all-pro-safety-ends-nfl-career-with-denver-broncos-11777474772792.html,2026-06-25T14:32:58+00:00
LiveMint,40,Mark to Market,https://www.livemint.com/market/mark-to-market,2026-06-25T14:32:58+00:00
LiveMint,41,Ask Mint Money,https://www.livemint.com/money/ask-mint-money,2026-06-25T14:32:58+00:00
LiveMint,42,FIFA World Cup,https://www.livemint.com/sports/football-news/fifa-world-cup,2026-06-25T14:32:58+00:00
LiveMint,43,FIFA 2026 Schedule,https://www.livemint.com/sports/football-news/fifa-world-cup-schedule,2026-06-25T14:32:58+00:00
LiveMint,44,FIFA Points Table,https://www.livemint.com/sports/football-news/fifa-world-cup-points-table,2026-06-25T14:32:58+00:00
LiveMint,45,IFSC Code Finder,https://www.livemint.com/ifsc-code,2026-06-25T14:32:58+00:00
LiveMint,46,Income Tax Calculator,https://www.livemint.com/tools-calculators/income-tax-calculator,2026-06-25T14:32:58+00:00
LiveMint,47,Gold Rate Today,https://www.livemint.com/gold-prices,2026-06-25T14:32:58+00:00
LiveMint,48,Gold Rate in Delhi,https://www.livemint.com/gold-prices/delhi,2026-06-25T14:32:58+00:00
LiveMint,49,Gold Rate Hyderabad,https://www.livemint.com/gold-prices/hyderabad,2026-06-25T14:32:58+00:00
LiveMint,50,Silver Rate Today,https://www.livemint.com/silver-prices,2026-06-25T14:32:58+00:00
LiveMint,51,Silver Rate in Delhi,https://www.livemint.com/silver-prices/delhi,2026-06-25T14:32:58+00:00
LiveMint,52,Silver Rate in Bangalore,https://www.livemint.com/silver-prices/bangalore,2026-06-25T14:32:58+00:00
LiveMint,53,US Stock Market,https://www.livemint.com/market/us-market,2026-06-25T14:32:58+00:00
LiveMint,54,Terms of Use,https://www.livemint.com/terms-of-use,2026-06-25T14:32:58+00:00
LiveMint,55,Code of ethics,https://www.livemint.com/code-of-ethics,2026-06-25T14:32:58+00:00
LiveMint,56,MCX Gold Rate,https://www.livemint.com/market/market-stats/commodity-mcx-gold-price,2026-06-25T14:32:58+00:00
LiveMint,57,MCX Silver Price,https://www.livemint.com/market/market-stats/commodity-mcx-silver-price,2026-06-25T14:32:58+00:00
LiveMint,58,Gold Price in Mumbai,https://www.livemint.com/gold-prices/mumbai,2026-06-25T14:32:58+00:00
LiveMint,59,Gold Price in Chennai,https://www.livemint.com/gold-prices/chennai,2026-06-25T14:32:58+00:00
LiveMint,60,Gold Price in Kolkata,https://www.livemint.com/gold-prices/kolkata,2026-06-25T14:32:58+00:00
LiveMint,61,Silver Price in Mumbai,https://www.livemint.com/silver-prices/mumbai,2026-06-25T14:32:58+00:00
LiveMint,62,Silver Price in Chennai,https://www.livemint.com/silver-prices/chennai,2026-06-25T14:32:58+00:00
LiveMint,63,Silver Price in Hyderabad,https://www.livemint.com/silver-prices/hyderabad,2026-06-25T14:32:58+00:00
LiveMint,64,Silver Price in Kolkata,https://www.livemint.com/silver-prices/kolkata,2026-06-25T14:32:58+00:00
LiveMint,65,Latest News Today,https://www.livemint.com/news,2026-06-25T14:32:58+00:00
LiveMint,66,US News Today,https://www.livemint.com/news/us-news,2026-06-25T14:32:58+00:00
LiveMint,67,Top Company Leader,https://www.livemint.com/companies/people,2026-06-25T14:32:58+00:00
LiveMint,68,personal loan emi calculator,https://www.livemint.com/loans/personal-loan-emi-calculator,2026-06-25T14:32:58+00:00
LiveMint,69,Personal Loan Interest Rate,https://www.livemint.com/loans/personal-loan-interest-rates,2026-06-25T14:32:58+00:00
LiveMint,70,Personal Loan Eligibility,https://www.livemint.com/loans/personal-loan-eligibility,2026-06-25T14:32:58+00:00
LiveMint,71,Instant Personal Loan,https://www.livemint.com/loans/instant-personal-loan,2026-06-25T14:32:58+00:00
LiveMint,72,Home Loan EMI Calculator,https://www.livemint.com/tools-calculators/home-loan-emi-calculator,2026-06-25T14:32:58+00:00
LiveMint,73,Car Loan EMI,https://www.livemint.com/tools-calculators/car-loan-calculator,2026-06-25T14:32:58+00:00
India Today,1,Kolkata woman shows tasty food students offer her in 'tuition teacher life' video,https://www.indiatoday.in/trending-news/story/kolkata-woman-shows-tasty-food-students-offer-her-in-tuition-teacher-life-video-2934172-2026-06-25,2026-06-25T14:32:58+00:00
India Today,2,UP man falls off balcony while leaning to grab ice cream from street vendor,https://www.indiatoday.in/trending-news/story/up-man-falls-off-balcony-while-leaning-to-grab-ice-cream-from-street-vendor-below-sonbhadra-cctv-video-2934103-2026-06-25,2026-06-25T14:32:58+00:00
India Today,3,Delhi woman driving Porsche has people calling her a desi baddie,https://www.indiatoday.in/trending-news/story/delhi-woman-driving-porsche-has-people-calling-her-a-desi-baddie-2934024-2026-06-25,2026-06-25T14:32:58+00:00
India Today,4,Forest guard pauses traffic for wild elephant in powerful coexistence lesson,https://www.indiatoday.in/trending-news/story/forest-guard-pauses-traffic-for-wild-elephant-in-powerful-coexistence-lesson-2933992-2026-06-25,2026-06-25T14:32:58+00:00
India Today,5,Bihar woman packs suitcase full of mangoes for daughter-in-law in Bengaluru,https://www.indiatoday.in/trending-news/story/bihar-woman-packs-suitcase-full-of-mangoes-for-daughter-in-law-in-bengaluru-video-meri-bahu-khaayegi-2933989-2026-06-25,2026-06-25T14:32:58+00:00
India Today,6,Peacocks step into south Mumbai's urban rush after monsoon arrival,https://www.indiatoday.in/trending-news/story/peacocks-step-into-south-mumbais-urban-rush-after-monsoon-arrival-2933886-2026-06-25,2026-06-25T14:32:58+00:00
India Today,7,"Man drops Rishikesh plan after Rs 15,000-a-night hotels, books Sri Lanka instead",https://www.indiatoday.in/trending-news/story/man-drops-rishikesh-plan-after-rs-15000-a-night-hotels-books-sri-lanka-instead-2933859-2026-06-25,2026-06-25T14:32:58+00:00
India Today,8,Indian musician visited 245 countries before social media made travel cool,https://www.indiatoday.in/trending-news/story/indian-musician-visited-245-countries-before-social-media-made-travel-cool-2933845-2026-06-25,2026-06-25T14:32:58+00:00
India Today,9,Why a Dubai woman sold her wedding gold to buy Hermes handbags,https://www.indiatoday.in/trending-news/story/why-a-dubai-woman-sold-her-wedding-gold-to-buy-hermes-handbags-protect-her-wealth-2933795-2026-06-25,2026-06-25T14:32:58+00:00
India Today,10,"Elephants, deer return to Tamil Nadu forests after massive restoration drive",https://www.indiatoday.in/trending-news/story/tamil-nadu-forest-restoration-viral-video-shows-elephants-deer-return-after-lantana-clearing-2933716-2026-06-25,2026-06-25T14:32:58+00:00
India Today,11,"Gurugram woman's Dubai 1BHK comes with marina views, Rs 2.6 lakh monthly rent",https://www.indiatoday.in/trending-news/story/gurugram-woman-dubai-1bhk-comes-with-marina-views-rs-26-lakh-monthly-rent-2933421-2026-06-24,2026-06-25T14:32:58+00:00
India Today,12,"Baby python found in railway engine in Mumbai, rescued in midnight operation",https://www.indiatoday.in/trending-news/story/baby-python-found-in-railway-engine-in-mumbai-rescued-in-midnight-operation-2933385-2026-06-24,2026-06-25T14:32:58+00:00
India Today,13,"Kolkata Zomato rider marks order delivered, walks away with packet, caught on camera",https://www.indiatoday.in/trending-news/story/kolkata-zomato-rider-marks-order-delivered-walks-away-with-packet-caught-on-camera-2933273-2026-06-24,2026-06-25T14:32:58+00:00
India Today,14,Indian-origin Google engineer quit her dream job at 23 to chase a bigger goal,https://www.indiatoday.in/trending-news/story/indian-origin-google-engineer-quit-her-dream-job-at-23-to-chase-a-bigger-goal-2933253-2026-06-24,2026-06-25T14:32:58+00:00
India Today,15,"Anand Mahindra moved by 80-year-old violinist playing on Kolkata streets, offers help",https://www.indiatoday.in/trending-news/story/anand-mahindra-moved-by-80-year-old-violinist-playing-on-kolkata-streets-offers-help-2933246-2026-06-24,2026-06-25T14:32:58+00:00
India Today,16,"After moving to US, Indian-origin man says one workplace habit shocked him",https://www.indiatoday.in/trending-news/story/after-moving-to-us-indian-origin-man-says-one-workplace-habit-shocked-him-2933174-2026-06-24,2026-06-25T14:32:58+00:00
India Today,17,"Bangladeshi waiter insults India in Italy, Indian women force him to apologise",https://www.indiatoday.in/trending-news/story/bangladeshi-waiter-insults-india-in-italy-indian-women-force-him-to-apologise-2933143-2026-06-24,2026-06-25T14:32:58+00:00
India Today,18,Bengaluru residents take truck rides back home after metro snag brings city to halt,https://www.indiatoday.in/trending-news/story/bengaluru-residents-take-truck-rides-back-home-after-metro-snag-brings-city-to-halt-2933140-2026-06-24,2026-06-25T14:32:58+00:00
India Today,19,"Abandoned elephant calf beats odds after rescue in Kerala, minister shares video",https://www.indiatoday.in/trending-news/story/kerala-abandoned-elephant-calf-beats-odds-maya-rescue-kirti-vardhan-singh-shares-video-2933064-2026-06-24,2026-06-25T14:32:58+00:00
India Today,20,"Delhi man finds househelp's 'resume' inside Blinkit order, discovers clever twist",https://www.indiatoday.in/trending-news/story/delhi-man-finds-instahelp-househelps-resume-inside-blinkit-order-discovers-clever-twist-2933040-2026-06-24,2026-06-25T14:32:58+00:00
India Today,21,Lock Upp 2 set decoded: Director Omung Kumar reveals its hidden meanings,https://www.indiatoday.in/entertainment/ott/story/netflix-lock-upp-sach-ya-sazaa-set-omung-kumar-swanky-jail-food-machine-twist-2934221-2026-06-25,2026-06-25T14:32:58+00:00
