source,rank,headline,link,collected_at_iso
India Today,17,Job candidate got Zoom call invite after interview. She never expected what came next,https://www.indiatoday.in/trending-news/story/job-candidate-got-zoom-call-invite-after-interview-she-never-expected-what-came-next-2928861-2026-06-18,2026-06-19T10:25:38+00:00
India Today,18,"British tourist expected one thing at Chennai's Marina Beach, saw another",https://www.indiatoday.in/trending-news/story/british-tourist-expected-one-thing-at-chennai-marina-beach-saw-another-viral-video-2928862-2026-06-18,2026-06-19T10:25:38+00:00
India Today,19,"At 194, Jonathan the tortoise is a Guinness World Records Icon",https://www.indiatoday.in/trending-news/story/at-194-jonathan-the-tortoise-is-a-guinness-world-records-icon-2928820-2026-06-18,2026-06-19T10:25:38+00:00
India Today,20,WhatsApp courts to parking wars: Bengaluru woman's post nails housing society life,https://www.indiatoday.in/trending-news/story/whatsapp-courts-to-parking-wars-bengaluru-womans-post-nails-housing-society-life-2928799-2026-06-18,2026-06-19T10:25:38+00:00
India Today,21,"Sensex ends 600 points lower, Nifty tops 24,000; IT stocks bleed",https://www.indiatoday.in/business/market/story/market-closing-sensex-ends-600-points-lower-nifty-tops-24000-it-stocks-bleed-tcs-infosys-hcltech-down-2929868-2026-06-19,2026-06-19T10:25:38+00:00
India Today,22,"Kerala Budget 2026-27 gives tourism Rs 325 crore, industry status push",https://www.indiatoday.in/india/story/kerala-tourism-budget-2026-27-rs-325-crore-heritage-eco-medical-travel-ptag-2929859-2026-06-19,2026-06-19T10:25:38+00:00
India Today,23,Skip college after Class 12? Saurabh Mukherjea says degrees are failing young Indians,https://www.indiatoday.in/education-today/news/story/graduate-unemployment-in-india-saurabh-mukherjea-says-university-doesnt-guarantee-job-2929744-2026-06-19,2026-06-19T10:25:38+00:00
India Today,24,UP man swept away by crocodile during mother-in-law's funeral rites at Saryu river,https://www.indiatoday.in/india/story/saryu-river-crocodile-attack-greater-noida-man-dragged-away-in-gonda-during-funeral-rites-2914826-2026-05-21,2026-06-19T10:25:38+00:00
India Today,25,"Coempt hits back: Human error, not software failure behind CBSE OSM mess",https://www.indiatoday.in/education-today/news/story/cbse-osm-row-whos-responsible-coempt-rejects-portal-glitch-tender-bias-and-hacking-claims-2929609-2026-06-19,2026-06-19T10:25:38+00:00
India Today,26,"Neeraj Chopra joins IOA's anti-doping drive, launches clean sport awareness campaign",https://www.indiatoday.in/sports/other-sports/story/neeraj-chopra-joins-anti-doping-fight-ioa-launches-clean-sport-campaign-2929790-2026-06-19,2026-06-19T10:25:38+00:00
TOI ETimes,1,Indian women’s saree ramp walk near Eiffel Tower sparks debate online: Celebration of culture or social media cringe?,https://timesofindia.indiatimes.com/articleshow/131454770.cms,2026-06-19T10:25:38+00:00
TOI ETimes,2,Meet Rounak Adhikary: Ashneer Grover once told him ‘Tu Baith Jaa Yaar’ and cut off his pitch mid-sentence; now he's living every startup founder's dream,https://timesofindia.indiatimes.com/articleshow/131419890.cms,2026-06-19T10:25:38+00:00
TOI ETimes,3,Hyderabad-based Amazon employee shares what not to say at work,https://timesofindia.indiatimes.com/articleshow/130726842.cms,2026-06-19T10:25:38+00:00
TOI ETimes,4,Salad topper recalled over salmonella risk,https://timesofindia.indiatimes.com/articleshow/130458722.cms,2026-06-19T10:25:38+00:00
TOI ETimes,5,Rebel Wilson weight loss: How she lost 36 kgs without extreme dieting - Ozempic or lifestyle?,https://timesofindia.indiatimes.com/articleshow/130457577.cms,2026-06-19T10:25:38+00:00
TOI ETimes,6,Shahid Kapoor questions 'A' certificate from CBFC for 'Cocktail 2',https://timesofindia.indiatimes.com/articleshow/131854290.cms,2026-06-19T10:25:38+00:00
TOI ETimes,7,"'Salman was emotionally drained after Baba Siddiqui's death,' says his Sikandar co-star",https://timesofindia.indiatimes.com/articleshow/131852891.cms,2026-06-19T10:25:38+00:00
TOI ETimes,8,Jamie Lynn Spears talks about daughter Maddie’s ATV crash,https://timesofindia.indiatimes.com/articleshow/131855330.cms,2026-06-19T10:25:38+00:00
TOI ETimes,9,Aamir Khan's production house to make documentary on President Murmu,https://timesofindia.indiatimes.com/articleshow/131855398.cms,2026-06-19T10:25:38+00:00
TOI ETimes,10,‘Batwara 1947’: Sunny Deol drama inspired by classic Lahore play,https://timesofindia.indiatimes.com/articleshow/131855261.cms,2026-06-19T10:25:38+00:00
TOI ETimes,11,Vijay Antony pens emotional note thanking Tiruppur Subramaniam,https://timesofindia.indiatimes.com/articleshow/131855034.cms,2026-06-19T10:25:38+00:00
TOI ETimes,12,"'The Kerala Story 2' faces new legal trouble, High court sends notice to producer Vipul Amrutlal Shah to remove 'Kerala' from the film's title",https://timesofindia.indiatimes.com/articleshow/131855799.cms,2026-06-19T10:25:38+00:00
TOI ETimes,13,Many film offers did not materialise due to practical challenges: Anjali Phougat,https://timesofindia.indiatimes.com/articleshow/131855208.cms,2026-06-19T10:25:38+00:00
TOI ETimes,14,Sharib Hashmi starts shooting for Rocket Reels series Double Life Husband,https://timesofindia.indiatimes.com/articleshow/131854833.cms,2026-06-19T10:25:38+00:00
TOI ETimes,15,Sidharth Malhotra and Tamannaah Bhatia's 'Vvan: Force of the Forest' gets 10-day additional shoot to strengthen its climax,https://timesofindia.indiatimes.com/articleshow/131854734.cms,2026-06-19T10:25:38+00:00
TOI ETimes,16,'Main Vaapas Aaunga' BO Day 7: Diljit's film crosses Rs 21 cr,https://timesofindia.indiatimes.com/articleshow/131847452.cms,2026-06-19T10:25:38+00:00
TOI ETimes,17,'Haunted 3D' BO Day 7: Mimoh's film crosses Rs 15 cr,https://timesofindia.indiatimes.com/articleshow/131844079.cms,2026-06-19T10:25:38+00:00
TOI ETimes,18,'Bharat Bhhagya...' BO Day 6: Kangana starrer crosses Rs 6 cr,https://timesofindia.indiatimes.com/articleshow/131815457.cms,2026-06-19T10:25:38+00:00
TOI ETimes,19,'Main Vaapas Aaunga' BO Day 6: Diljit film nears Rs 20 crore,https://timesofindia.indiatimes.com/articleshow/131815183.cms,2026-06-19T10:25:38+00:00
TOI ETimes,20,'Haunted 3D' BO Day 6: Mimoh's film beats 'Main Vaapas Aaunga',https://timesofindia.indiatimes.com/articleshow/131814962.cms,2026-06-19T10:25:38+00:00
TOI ETimes,21,‘Hai Jawani Toh Ishq Hona Hai’ crosses the Rs 70 cr mark globally,https://timesofindia.indiatimes.com/articleshow/131784184.cms,2026-06-19T10:25:38+00:00
TOI ETimes,22,Animal Preview: Ranbir Kapoor and Sandeep Reddy Vanga are set to shake up the box office hierarchy,https://timesofindia.indiatimes.com/articleshow/105615612.cms,2026-06-19T10:25:38+00:00
TOI ETimes,23,Tu Jhoothi Main Makkaar,https://timesofindia.indiatimes.com/articleshow/98272134.cms,2026-06-19T10:25:38+00:00
TOI ETimes,24,Father Alleges On-Set Harassment: TV shoots left Sanchita exhausted,https://timesofindia.indiatimes.com/articleshow/131810186.cms,2026-06-19T10:25:38+00:00
TOI ETimes,25,Mahhi dances with daughter on ‘Bole Chudiyan’; ex Jay reacts,https://timesofindia.indiatimes.com/articleshow/131805365.cms,2026-06-19T10:25:38+00:00
TOI ETimes,26,BB20: CJP critic-rapper Santy Sharma’s cryptic post fuels entry buzz,https://timesofindia.indiatimes.com/articleshow/131802086.cms,2026-06-19T10:25:38+00:00
TOI ETimes,27,Sanchita Ugale’s death: The Saajan Ghar director breaks silence,https://timesofindia.indiatimes.com/articleshow/131798531.cms,2026-06-19T10:25:38+00:00
TOI ETimes,28,Gauahar recalls carefree pre-parenthood,https://timesofindia.indiatimes.com/articleshow/131851747.cms,2026-06-19T10:25:38+00:00
TOI ETimes,29,Splitsvilla X6: Simran accuses Sachin of allegedly ‘touching her',https://timesofindia.indiatimes.com/articleshow/131850690.cms,2026-06-19T10:25:38+00:00
TOI ETimes,30,Harpal Singh On Japan Lessons: Chef praises discipline,https://timesofindia.indiatimes.com/articleshow/131851214.cms,2026-06-19T10:25:38+00:00
TOI ETimes,31,TV Actress Death Probe: Police examine Sanchita Ugale’s work worries,https://timesofindia.indiatimes.com/articleshow/131850915.cms,2026-06-19T10:25:38+00:00
TOI ETimes,32,Dev Joshi’s Parallel Path: Baalveer star studies diplomacy,https://timesofindia.indiatimes.com/articleshow/131850851.cms,2026-06-19T10:25:38+00:00
TOI ETimes,33,Shilpa Shinde hints at quitting TV? Actress lashes out at directors,https://timesofindia.indiatimes.com/articleshow/131849259.cms,2026-06-19T10:25:38+00:00
TOI ETimes,34,"Optical illusion personality test: Face, building, both, mask or labyrinth? What you see first reveals if you are sensitive, sorted, introvert, deep thinker or emotionally intelligent",https://timesofindia.indiatimes.com/articleshow/131855417.cms,2026-06-19T10:25:38+00:00
TOI ETimes,35,"""Kudiyon nu bahar na bhejo"": They questioned her father's parenting, gave taunts; now Rashdeep Kaur will represent India at the Commonwealth Games",https://timesofindia.indiatimes.com/articleshow/131851087.cms,2026-06-19T10:25:38+00:00
TOI ETimes,36,"Warren Buffett quote of the day: ""Someone is sitting in the shade today because someone planted a tree a long time ago;"" What the investing legend taught about patience, long-term thinking, wealth, and career growth",https://timesofindia.indiatimes.com/articleshow/131854249.cms,2026-06-19T10:25:38+00:00
TOI ETimes,37,Kylian Mbappé's home is as impressive as his game: Here are some art inspirations to take away,https://timesofindia.indiatimes.com/articleshow/131853815.cms,2026-06-19T10:25:38+00:00
TOI ETimes,38,World’s upcoming tallest skyscraper crosses the 100-floor mark: How Jeddah Tower is reshaping Saudi Arabia’s real estate market,https://timesofindia.indiatimes.com/articleshow/131851698.cms,2026-06-19T10:25:38+00:00
TOI ETimes,39,"Happy Father's Day 2026: 60+ wishes, messages, greetings, images, and cards to celebrate every father figure",https://timesofindia.indiatimes.com/articleshow/131849626.cms,2026-06-19T10:25:38+00:00
TOI ETimes,40,What is it like to use AI to file your income tax return? Bengaluru professional says it felt ‘like a CA sitting next to me’,https://timesofindia.indiatimes.com/articleshow/131847580.cms,2026-06-19T10:25:38+00:00
TOI ETimes,41,"Cuts grass in the US, owns an Audi, earns ₹10-15 lakh a month: Indian creator's viral claim sparks debate online",https://timesofindia.indiatimes.com/articleshow/131846031.cms,2026-06-19T10:25:38+00:00
TOI ETimes,42,Is Disney+ down? Angry Disney characters react to global login trouble,https://timesofindia.indiatimes.com/articleshow/131844431.cms,2026-06-19T10:25:38+00:00
TOI ETimes,43,'Please don't': Uber driver's shocking request to woman passenger to avoid a 5-star rating has the internet amazed,https://timesofindia.indiatimes.com/articleshow/131840792.cms,2026-06-19T10:25:38+00:00
TOI ETimes,44,Grammy Awards add 5 new categories; announce changes to Best New Artist,https://timesofindia.indiatimes.com/articleshow/131786435.cms,2026-06-19T10:25:38+00:00
TOI ETimes,45,Australian Crawl to reunite after 40 years apart,https://timesofindia.indiatimes.com/articleshow/131768047.cms,2026-06-19T10:25:38+00:00
TOI ETimes,46,Jelly Roll and Bunnie XO part ways after 10 years,https://timesofindia.indiatimes.com/articleshow/131765491.cms,2026-06-19T10:25:38+00:00
TOI ETimes,47,Netizens share reaction to North West as she turns 13,https://timesofindia.indiatimes.com/articleshow/131763140.cms,2026-06-19T10:25:38+00:00
TOI ETimes,48,Kim Kardashian marks North West’s 13th birthday with sweet note,https://timesofindia.indiatimes.com/articleshow/131761757.cms,2026-06-19T10:25:38+00:00
TOI ETimes,49,"Shakira celebrates 100th show, posts Sofia Vergara dances to 'Hips Don't Lie'",https://timesofindia.indiatimes.com/articleshow/131760282.cms,2026-06-19T10:25:38+00:00
TOI ETimes,50,Beyond Ebooks: The charm of bookstores endures,https://timesofindia.indiatimes.com/articleshow/101098088.cms,2026-06-19T10:25:38+00:00
TOI ETimes,51,It’s a curtain call: Sania Mirza bids adieu to tennis with ‘happy tears’,https://timesofindia.indiatimes.com/articleshow/98440670.cms,2026-06-19T10:25:38+00:00
TOI ETimes,52,A magical makeover for 17th Century stepwell: From neglected ruins to a glorious piece of history,https://timesofindia.indiatimes.com/articleshow/96557955.cms,2026-06-19T10:25:38+00:00
TOI ETimes,53,The city comes alive with Christmas fervour,https://timesofindia.indiatimes.com/articleshow/96406573.cms,2026-06-19T10:25:38+00:00
TOI ETimes,54,#BringRioHome: Pet parents launch search to find their kidnapped cat,https://timesofindia.indiatimes.com/articleshow/96334809.cms,2026-06-19T10:25:38+00:00
TOI ETimes,55,"Anupam Kher shares mantra for a happy 41-year marriage with Kirron Kher, reacts to Gen Z dating terms like situationship, benching - EXCLUSIVE",https://timesofindia.indiatimes.com/articleshow/131228920.cms,2026-06-19T10:25:38+00:00
TOI ETimes,56,Anupam Kher opens up on challenging himself at 71 and returning to theatre after doing 550 films: 'I don't take myself seriously' - Exclusive,https://timesofindia.indiatimes.com/articleshow/131115309.cms,2026-06-19T10:25:38+00:00
TOI ETimes,57,"Horror needs the stage to conspire with you, says Gopal Datt",https://timesofindia.indiatimes.com/articleshow/130598133.cms,2026-06-19T10:25:38+00:00
TOI ETimes,58,"Theatre is magic, and it’s time audiences felt it again: Gopal Datt",https://timesofindia.indiatimes.com/articleshow/130595267.cms,2026-06-19T10:25:38+00:00
TOI ETimes,59,Adil Hussain’s 'Mercy' release date OUT: Film's first look to be attached with Ranveer Singh's 'Dhurandhar: The Revenge',https://timesofindia.indiatimes.com/articleshow/129843424.cms,2026-06-19T10:25:38+00:00
TOI ETimes,60,It’s the best time to be doing theatre: Juhi Babbar Soni,https://timesofindia.indiatimes.com/articleshow/129826631.cms,2026-06-19T10:25:38+00:00
TOI ETimes,61,Raj Kundra and Shilpa Shetty's 15th Wedding Anniversary,https://timesofindia.indiatimes.com/articleshow/115563990.cms,2026-06-19T10:25:38+00:00
TOI ETimes,62,​Bigg Boss winners list from season 1 to 17​,https://timesofindia.indiatimes.com/articleshow/114277426.cms,2026-06-19T10:25:38+00:00
TOI ETimes,63,​Discover the bird with a prehistoric roar​,https://timesofindia.indiatimes.com/articleshow/114244474.cms,2026-06-19T10:25:38+00:00
TOI ETimes,64,Dia Mirza's ethnic wear,https://timesofindia.indiatimes.com/articleshow/114243410.cms,2026-06-19T10:25:38+00:00
TOI ETimes,65,​Incredible facts about ants you won’t believe​,https://timesofindia.indiatimes.com/articleshow/114243248.cms,2026-06-19T10:25:38+00:00
TOI ETimes,66,'Bigg Boss Marathi 5' nears grand finale​,https://timesofindia.indiatimes.com/articleshow/113936459.cms,2026-06-19T10:25:38+00:00
TOI ETimes,67,"Meet Nishtha Chauhan: Aerospace engineer who left her job to open Gujarat's first-ever millet café, now earns Rs 12 lakh monthly",https://timesofindia.indiatimes.com/articleshow/131838404.cms,2026-06-19T10:25:38+00:00
TOI ETimes,68,Meet Ginevra Giambruno: Italian PM Georgia Meloni's 9-year-old daughter with ex-partner Andrea Giambruno,https://timesofindia.indiatimes.com/articleshow/131836645.cms,2026-06-19T10:25:38+00:00
TOI ETimes,69,"FIFA World Cup 2026: From Ronaldo to Mbappe, why are footballers wearing pink boots on the pitch?",https://timesofindia.indiatimes.com/articleshow/131833278.cms,2026-06-19T10:25:38+00:00
TOI ETimes,70,"Meet the world-famous Robin Hood oak tree that died after nearly 1,000 years: Amazing facts about the legendary Major Oak",https://timesofindia.indiatimes.com/articleshow/131831736.cms,2026-06-19T10:25:38+00:00
TOI ETimes,71,"Why India's creator economy is built for the AI era of 2026: Nicole Junkermann, founder of NJF Holdings",https://timesofindia.indiatimes.com/articleshow/131831287.cms,2026-06-19T10:25:38+00:00
TOI ETimes,72,"'Would you believe it is India?': British tourist says Chennai's Marina beach is cleaner than English coast, says 'there's barely any rubbish'",https://timesofindia.indiatimes.com/articleshow/131831539.cms,2026-06-19T10:25:38+00:00
TOI ETimes,73,"5 Father’s Day gifts worth buying in the UK for Dad, Grandpa and Uncles",https://timesofindia.indiatimes.com/articleshow/131831218.cms,2026-06-19T10:25:38+00:00
TOI ETimes,74,"15-million-years old shark fossils discovered by Odisha teacher and students on a random field visit, locals called them 'Asura Hadda'",https://timesofindia.indiatimes.com/articleshow/131830542.cms,2026-06-19T10:25:38+00:00
TOI ETimes,75,'Comedy ke naam par galat-galat baatein aajkal chal rahin hain': Aniruddhacharya Maharaj reacts to the '₹370 biryani' controversy,https://timesofindia.indiatimes.com/articleshow/131827535.cms,2026-06-19T10:25:38+00:00
TOI ETimes,76,Is this one dish in the menu holding up the fate of McDonald’s fast-food empire,https://timesofindia.indiatimes.com/articleshow/131824032.cms,2026-06-19T10:25:38+00:00
TOI ETimes,77,India has optimised the order. It hasn't yet optimised how it treats the person behind it,https://timesofindia.indiatimes.com/articleshow/131818779.cms,2026-06-19T10:25:38+00:00
TOI ETimes,78,How long would Elon Musk's $1.26 trillion fortune last if he spent $1 million every day?,https://timesofindia.indiatimes.com/articleshow/131823561.cms,2026-06-19T10:25:38+00:00
TOI ETimes,79,Only at IIM Ahmedabad: Professor uses Ranveer Singh's 'Dhurandhar' to explain statistics,https://timesofindia.indiatimes.com/articleshow/131822733.cms,2026-06-19T10:25:38+00:00
TOI ETimes,80,Young Colombia fan left speechless after dad’s surprise World Cup reveal in viral father-son moment: ‘You’re coming too’,https://timesofindia.indiatimes.com/articleshow/131819868.cms,2026-06-19T10:25:38+00:00
TOI ETimes,81,‘People thought I was crazy’: Former Delhi Police officer quits government job and starts over in Australia,https://timesofindia.indiatimes.com/articleshow/131819702.cms,2026-06-19T10:25:38+00:00
TOI ETimes,82,8-year-old California boy dies during World Cup watch party; police suspect drowning,https://timesofindia.indiatimes.com/articleshow/131820808.cms,2026-06-19T10:25:38+00:00
TOI ETimes,83,Is Gen Z giving up on homeownership? Raj Shamani's viral post on ₹300 coffee sparks debate,https://timesofindia.indiatimes.com/articleshow/131819167.cms,2026-06-19T10:25:38+00:00
TOI ETimes,84,Australian tourist ‘molested’ after Indian man repeatedly asked him for a kiss: ‘Why do Indian guys always want you to kiss them?’,https://timesofindia.indiatimes.com/articleshow/131819670.cms,2026-06-19T10:25:38+00:00
TOI ETimes,85,Techie shares 5 secrets to land high-paying IT jobs in Germany: ‘It’s a numbers game’,https://timesofindia.indiatimes.com/articleshow/131818503.cms,2026-06-19T10:25:38+00:00
TOI ETimes,86,"Happy Father's Day 2026: 40+ emotional quotes, wishes, and messages to make your dad smile",https://timesofindia.indiatimes.com/articleshow/131790604.cms,2026-06-19T10:25:38+00:00
TOI ETimes,87,"‘Kiss me here, kiss me’: Local boy grabs Australian tourist’s hand and asks for a kiss; man says he was ‘getting molested by people younger’",https://timesofindia.indiatimes.com/articleshow/131816737.cms,2026-06-19T10:25:38+00:00
TOI ETimes,88,"'Koi bhi country jao, 5-6 saal bahar niklo': Woman's blunt advice to move abroad sparks internet debate",https://timesofindia.indiatimes.com/articleshow/131815418.cms,2026-06-19T10:25:38+00:00
TOI ETimes,89,The crescent moon joins THESE 3 planets in a beautiful sunset sky show tonight: Where can you watch this planet parade from?,https://timesofindia.indiatimes.com/articleshow/131815348.cms,2026-06-19T10:25:38+00:00
TOI ETimes,90,"Sleep habits of the world's richest: How many hours do Elon Musk, Jeff Bezos, Mark Zuckerberg and Jensen Huang sleep every day?",https://timesofindia.indiatimes.com/articleshow/131810020.cms,2026-06-19T10:25:38+00:00
TOI ETimes,91,"'Pistol le lo, goli maar do': Hathras ice cream vendor left shocked as man gives him gun, viral video leads to arrest",https://timesofindia.indiatimes.com/articleshow/131805269.cms,2026-06-19T10:25:38+00:00
TOI ETimes,92,Meet Harkha Bai: India's first female maritime trader whose ship 'Rahimi' caused the demise of Portuguese rule in India,https://timesofindia.indiatimes.com/articleshow/131804323.cms,2026-06-19T10:25:38+00:00
TOI ETimes,93,'Your gold is coming': Anand Mahindra praises Dhiraj Bommadevara who won double gold at the Archery World Cup for India after 20 years,https://timesofindia.indiatimes.com/articleshow/131802398.cms,2026-06-19T10:25:38+00:00
TOI ETimes,94,"Record-Breaking: 7-Year-old kid ‘Danger’ who conquered the 7,500-foot El Capitan cliff",https://timesofindia.indiatimes.com/articleshow/131800181.cms,2026-06-19T10:25:38+00:00
TOI ETimes,95,'You need to work for...': Perplexity CEO Aravind Srinivas s...,https://timesofindia.indiatimes.com/articleshow/131778303.cms,2026-06-19T10:25:38+00:00
TOI ETimes,96,Stanford students walk out of graduation ceremony as Sundar ...,https://timesofindia.indiatimes.com/articleshow/131731888.cms,2026-06-19T10:25:38+00:00
TOI ETimes,97,'I rushed to the border': Pakistani man realises dream of me...,https://timesofindia.indiatimes.com/articleshow/131718264.cms,2026-06-19T10:25:38+00:00
TOI ETimes,98,Sejal Pawar row: Medical students’ body criticises cadaver r...,https://timesofindia.indiatimes.com/articleshow/131714824.cms,2026-06-19T10:25:38+00:00
TOI ETimes,99,Meet Fabrice Bellard: The French engineer whose code powers ...,https://timesofindia.indiatimes.com/articleshow/131602101.cms,2026-06-19T10:25:38+00:00
TOI ETimes,100,"Amid Pranit More row, old video of Dr Sejal Pawar calling KE...",https://timesofindia.indiatimes.com/articleshow/131696575.cms,2026-06-19T10:25:38+00:00
TOI ETimes,101,"‘No toilet, no leave, constant pressure’: 25-year-old quits ...",https://timesofindia.indiatimes.com/articleshow/131182282.cms,2026-06-19T10:25:38+00:00
TOI ETimes,102,"Happy Eid-ul-Adha 2026: Top 150 Eid Mubarak Wishes, Messages...",https://timesofindia.indiatimes.com/articleshow/131330005.cms,2026-06-19T10:25:38+00:00
TOI ETimes,103,He sold his goats to buy tree seedlings and transformed barr...,https://timesofindia.indiatimes.com/articleshow/131195986.cms,2026-06-19T10:25:38+00:00
TOI ETimes,104,Indian restaurant owner living in Japan for 30 years breaks ...,https://timesofindia.indiatimes.com/articleshow/131166748.cms,2026-06-19T10:25:38+00:00
TOI ETimes,105,Anand Mahindra reveals the one quality that turned Elon Musk into the world's first trillionaire,https://timesofindia.indiatimes.com/articleshow/131798879.cms,2026-06-19T10:25:38+00:00
TOI ETimes,106,'₹450 for 1 litre of milk?': Indian doodhwala's reaction to US prices has the internet laughing,https://timesofindia.indiatimes.com/articleshow/131795260.cms,2026-06-19T10:25:38+00:00
TOI ETimes,107,"A driver thought a bald eagle was sleeping by the roadside, then he realised she was fighting for her life",https://timesofindia.indiatimes.com/articleshow/131795517.cms,2026-06-19T10:25:38+00:00
TOI ETimes,108,"Bengaluru techie planned to spend his first salary on himself. Then his father asked for Rs 5,000 and taught him a lesson he'll never forget",https://timesofindia.indiatimes.com/articleshow/131793422.cms,2026-06-19T10:25:38+00:00
TOI ETimes,109,"Barack Obama got ‘teary-eyed’: Meet Marian Robinson, Michelle Obama's mother",https://timesofindia.indiatimes.com/articleshow/131793781.cms,2026-06-19T10:25:38+00:00
TOI ETimes,110,"Asked for a raise, got fired, and was told 'broke manager's heart': Intern says they were treated like they had 'committed a crime'",https://timesofindia.indiatimes.com/articleshow/131789746.cms,2026-06-19T10:25:38+00:00
TOI ETimes,111,Startup founder reveals how she gets employees to office 5 days a week; internet erupts,https://timesofindia.indiatimes.com/articleshow/131789180.cms,2026-06-19T10:25:38+00:00
TOI ETimes,112,‘He never read a single book’: The 200-year-old story of the Cherokee man whose script was once feared as ‘black magic’,https://timesofindia.indiatimes.com/articleshow/131788881.cms,2026-06-19T10:25:38+00:00
TOI ETimes,113,"Planet parade June 2026: How and when to see the Moon, Venus, Jupiter, and Mercury dance across the night sky",https://timesofindia.indiatimes.com/articleshow/131787440.cms,2026-06-19T10:25:38+00:00
TOI ETimes,114,‘Still processing’: Ukrainian woman watches her first movie in India and is shocked by what happens inside the theater,https://timesofindia.indiatimes.com/articleshow/131787318.cms,2026-06-19T10:25:38+00:00
TOI ETimes,115,"₹76 lakh from one reel! Orry opens up on his income and says: ‘For ₹15-25 lakhs, you can buy me for…’",https://timesofindia.indiatimes.com/articleshow/131785660.cms,2026-06-19T10:25:38+00:00
TOI ETimes,116,"Fresh trouble for Himanshu Jangra, Pranit More as another FIR is registered in ₹370 Biryani controversy",https://timesofindia.indiatimes.com/articleshow/131785114.cms,2026-06-19T10:25:38+00:00
TOI ETimes,117,‘I barely needed cash’: Foreigner says India's payment system feels ahead of most of the world,https://timesofindia.indiatimes.com/articleshow/131784242.cms,2026-06-19T10:25:38+00:00
TOI ETimes,118,"Kylian Mbappé makes World Cup history: France star surpasses Lionel Messi, becomes Les Bleus’ all-time top scorer — what is his net worth?",https://timesofindia.indiatimes.com/articleshow/131784153.cms,2026-06-19T10:25:38+00:00
TOI ETimes,119,Eetha Teaser Leaked,https://timesofindia.indiatimes.com/articleshow/131847356.cms,2026-06-19T10:25:38+00:00
TOI ETimes,120,Friday OTT Release,https://timesofindia.indiatimes.com/articleshow/131827960.cms,2026-06-19T10:25:38+00:00
TOI ETimes,121,Rented Home Rules,https://timesofindia.indiatimes.com/articleshow/131752100.cms,2026-06-19T10:25:38+00:00
