source,rank,headline,link,collected_at_iso
India Today,3,Bengaluru couple shares 5 money rules they swear by as dual-income parents,https://www.indiatoday.in/trending-news/story/bengaluru-couple-shares-5-money-rules-they-swear-by-as-dual-income-parents-2953794-2026-07-22,2026-07-23T06:29:28+00:00
India Today,4,Mumbai doctor shares touching story of man who paid Rs 5 lakh for driver's surgery,https://www.indiatoday.in/trending-news/story/mumbai-doctor-shares-touching-story-of-man-who-paid-rs-5-lakh-for-drivers-surgery-2953694-2026-07-22,2026-07-23T06:29:28+00:00
India Today,5,Indian man claims he spent Rs 1 lakh to attend CJP protest in Delhi,https://www.indiatoday.in/trending-news/story/indian-man-claims-he-spent-rs-1-lakh-to-attend-cjp-protest-in-delhi-2953708-2026-07-22,2026-07-23T06:29:28+00:00
India Today,6,Indian grandparents welcome their Indo-Polish granddaughter with endless cuddles,https://www.indiatoday.in/trending-news/story/indian-grandparents-welcome-their-indo-polish-granddaughter-with-endless-cuddles-2953695-2026-07-22,2026-07-23T06:29:28+00:00
India Today,7,"Kolkata man claims ex-employer withheld Rs 10,000 salary, shares WhatsApp chats",https://www.indiatoday.in/trending-news/story/kolkata-man-claims-ex-employer-withheld-rs-10000-salary-shares-whatsapp-chats-2953688-2026-07-22,2026-07-23T06:29:28+00:00
India Today,8,"Australian politician stops mid-interview to yell at pet dog, internet doesn't approve",https://www.indiatoday.in/trending-news/story/australian-politician-stops-mid-interview-to-yell-at-pet-dog-internet-doesnt-approve-2953588-2026-07-22,2026-07-23T06:29:28+00:00
India Today,9,Techie reveals why taking long leaves feels normal in Canada but stressful in India,https://www.indiatoday.in/trending-news/story/techie-reveals-why-taking-long-leaves-feels-normal-in-canada-but-stressful-in-india-2953551-2026-07-22,2026-07-23T06:29:28+00:00
India Today,10,Traffic jam turns into office desk for man on bike. Work-life balance debate follows,https://www.indiatoday.in/trending-news/story/traffic-jam-turns-into-office-desk-for-man-on-bike-work-life-balance-debate-follows-2953517-2026-07-22,2026-07-23T06:29:28+00:00
India Today,11,Skyroot CEO recalls phone call that brought father to tears after Vikram-1 success,https://www.indiatoday.in/trending-news/story/skyroot-ceo-pawan-kumar-chandana-recalls-phone-call-that-brought-father-to-tears-after-vikram-1-success-2953520-2026-07-22,2026-07-23T06:29:28+00:00
India Today,12,Delhi boy throws stone at dog sleeping in CP. People noticed his parents' reaction,https://www.indiatoday.in/trending-news/story/delhi-boy-throws-stone-at-dog-sleeping-in-cp-people-noticed-his-parents-reaction-2953508-2026-07-22,2026-07-23T06:29:28+00:00
India Today,13,Man observes Indian passengers' behaviour at airports. Do you agree with his take?,https://www.indiatoday.in/trending-news/story/man-observes-indian-passengers-behaviour-at-airports-do-you-agree-with-his-take-2953490-2026-07-22,2026-07-23T06:29:28+00:00
India Today,14,Indian woman shows you why life in US comes with absolutely 'no princess treatment',https://www.indiatoday.in/trending-news/story/indian-woman-shows-you-why-life-in-us-comes-with-absolutely-no-princess-treatment-2953456-2026-07-22,2026-07-23T06:29:28+00:00
India Today,15,Mumbai man's 20 kg weight-loss challenge gets wholesome push from Erling Haaland,https://www.indiatoday.in/trending-news/story/mumbai-mans-20-kg-weight-loss-challenge-gets-wholesome-push-from-erling-haaland-2953438-2026-07-22,2026-07-23T06:29:28+00:00
India Today,16,Surat infant survives after doctors remove earring she swallowed in 45 minutes,https://www.indiatoday.in/trending-news/story/surat-infant-survives-after-doctors-remove-earring-she-swallowed-in-45-minutes-2953433-2026-07-22,2026-07-23T06:29:28+00:00
India Today,17,CJP appeals to supporters to stop sending food to protest sites as supplies pile up,https://www.indiatoday.in/trending-news/story/india-is-such-a-beautiful-country-cjp-overwhelmed-by-food-sent-for-protesters-2953373-2026-07-22,2026-07-23T06:29:28+00:00
India Today,18,Spanish pilot pranks Argentina fans with fake World Cup win announcement mid-flight,https://www.indiatoday.in/trending-news/story/spanish-pilot-pranks-argentina-fans-with-fake-world-cup-win-announcement-mid-flight-2953098-2026-07-21,2026-07-23T06:29:28+00:00
India Today,19,Techie shares why AI has become both a blessing and curse at his workplace,https://www.indiatoday.in/trending-news/story/techie-shares-why-ai-has-become-both-a-blessing-and-curse-at-his-workplace-2953007-2026-07-21,2026-07-23T06:29:28+00:00
India Today,20,"5-foot black cobra found in kitchen of Rajasthan juvenile home, rescued safely",https://www.indiatoday.in/trending-news/story/5-foot-black-cobra-found-in-kitchen-of-rajasthan-juvenile-home-rescued-safely-2952960-2026-07-21,2026-07-23T06:29:28+00:00
India Today,21,Who is Vimala Bathineni? Andhra scientist wins Danish fellowship worth Rs 3.6 crore,https://www.indiatoday.in/education-today/news/story/andhra-scientist-vimala-bathineni-wins-rs-36-crore-denmark-phd-fellowship-2954143-2026-07-23,2026-07-23T06:29:28+00:00
India Today,22,Jammu-Srinagar Highway shut again amid fresh rain in J&K; death toll reaches 23,https://www.indiatoday.in/india/story/jammu-srinagar-national-highway-closed-jammu-kashmir-rain-toll-23-ptag-2954104-2026-07-23,2026-07-23T06:29:28+00:00
India Today,23,"Maharashtra rain: Schools shut, hundreds stranded as heavy rain batters Palghar",https://www.indiatoday.in/india/story/palghar-floods-heavy-rain-strands-hundreds-in-dahanu-talasari-schools-shut-ptag-2954103-2026-07-23,2026-07-23T06:29:28+00:00
India Today,24,Meerut woman stabs sister-in-law to death over affair with her husband,https://www.indiatoday.in/india/story/meerut-for-killing-sister-in-law-brother-in-law-death-murder-2948541-2026-07-15,2026-07-23T06:29:28+00:00
India Today,25,UP bride halts wedding after groom's brother pulls her pallu. And then…,https://www.indiatoday.in/trending-news/story/up-bride-halts-wedding-after-grooms-brother-pulls-her-pallu-and-then-2944973-2026-07-10,2026-07-23T06:29:28+00:00
India Today,26,"Passenger occupies reserved seat, pulls emergency chain when confronted. Railways reacts",https://www.indiatoday.in/trending-news/story/passenger-occupies-reserved-seat-pulls-emergency-chain-when-confronted-railways-reacts-2917356-2026-05-26,2026-07-23T06:29:28+00:00
TOI ETimes,1,Indian women’s saree ramp walk near Eiffel Tower sparks debate online: Celebration of culture or social media cringe?,https://timesofindia.indiatimes.com/articleshow/131454770.cms,2026-07-23T06:29:28+00:00
TOI ETimes,2,Meet Rounak Adhikary: Ashneer Grover once told him ‘Tu Baith Jaa Yaar’ and cut off his pitch mid-sentence; now he's living every startup founder's dream,https://timesofindia.indiatimes.com/articleshow/131419890.cms,2026-07-23T06:29:28+00:00
TOI ETimes,3,Hyderabad-based Amazon employee shares what not to say at work,https://timesofindia.indiatimes.com/articleshow/130726842.cms,2026-07-23T06:29:28+00:00
TOI ETimes,4,Salad topper recalled over salmonella risk,https://timesofindia.indiatimes.com/articleshow/130458722.cms,2026-07-23T06:29:28+00:00
TOI ETimes,5,Rebel Wilson weight loss: How she lost 36 kgs without extreme dieting - Ozempic or lifestyle?,https://timesofindia.indiatimes.com/articleshow/130457577.cms,2026-07-23T06:29:28+00:00
TOI ETimes,6,"Amid backlash, R Madhavan reacts to Jantar Mantar student protest",https://timesofindia.indiatimes.com/articleshow/132573353.cms,2026-07-23T06:29:28+00:00
TOI ETimes,7,Ahan Shetty to step into the horror genre with Vikram Bhatt's '1920 Cold Winter',https://timesofindia.indiatimes.com/articleshow/132573237.cms,2026-07-23T06:29:28+00:00
TOI ETimes,8,Alia Bhatt on students' protest: 'Their courage humbles me',https://timesofindia.indiatimes.com/articleshow/132572653.cms,2026-07-23T06:29:28+00:00
TOI ETimes,9,"Trisha, Keerthy Suresh, Mamitha Baiju join fans for 'Jana Nayagan' FDFS",https://timesofindia.indiatimes.com/articleshow/132573037.cms,2026-07-23T06:29:28+00:00
TOI ETimes,10,Vikrant opens up on prejudice and facing bias in Bollywood amid National Award win,https://timesofindia.indiatimes.com/articleshow/132573084.cms,2026-07-23T06:29:28+00:00
TOI ETimes,11,"'Welcome to the Jungle gave actors a new lease of life': Kiran Kumar praises Akshay Kumar, credits Farida Jalal and shares joy over film's success",https://timesofindia.indiatimes.com/articleshow/132573165.cms,2026-07-23T06:29:28+00:00
TOI ETimes,12,"Vaani Kapoor to portray an adult star lookalike in 'Sarvagunn Sampann' as the long-delayed film finally gears up for its OTT premiere: 'At its heart, it’s about identity, the labels society places on us'",https://timesofindia.indiatimes.com/articleshow/132572997.cms,2026-07-23T06:29:28+00:00
TOI ETimes,13,'The Odyssey' crosses Rs 100 crore at Indian box office,https://timesofindia.indiatimes.com/articleshow/132569907.cms,2026-07-23T06:29:28+00:00
TOI ETimes,14,'Dhamaal 4' misses Rs 135 crore domestic mark by a mere Rs 50 lacs on Day 13,https://timesofindia.indiatimes.com/articleshow/132555850.cms,2026-07-23T06:29:28+00:00
TOI ETimes,15,'Spider-Man' eyes Rs 50 crore debut in India,https://timesofindia.indiatimes.com/articleshow/132550631.cms,2026-07-23T06:29:28+00:00
TOI ETimes,16,'The Odyssey' crosses Rs 90 crore mark at Indian box office on Day 5,https://timesofindia.indiatimes.com/articleshow/132548868.cms,2026-07-23T06:29:28+00:00
TOI ETimes,17,'Avengers: Doomsday' hits USD 16.5 million in advance ticket sales,https://timesofindia.indiatimes.com/articleshow/132548546.cms,2026-07-23T06:29:28+00:00
TOI ETimes,18,'Dhamaal 4' continues winning streak with Rs 174 crore worldwide gross,https://timesofindia.indiatimes.com/articleshow/132531593.cms,2026-07-23T06:29:28+00:00
TOI ETimes,19,Animal Preview: Ranbir Kapoor and Sandeep Reddy Vanga are set to shake up the box office hierarchy,https://timesofindia.indiatimes.com/articleshow/105615612.cms,2026-07-23T06:29:28+00:00
TOI ETimes,20,Tu Jhoothi Main Makkaar,https://timesofindia.indiatimes.com/articleshow/98272134.cms,2026-07-23T06:29:28+00:00
TOI ETimes,21,Rubina Dilaik takes an indirect dig at Ram Kapoor,https://timesofindia.indiatimes.com/articleshow/132554688.cms,2026-07-23T06:29:28+00:00
TOI ETimes,22,Arjun on Argentina’s FIFA World Cup 2026 final defeat,https://timesofindia.indiatimes.com/articleshow/132554224.cms,2026-07-23T06:29:28+00:00
TOI ETimes,23,Shoaib Ibrahim shares health update on Dipika & father,https://timesofindia.indiatimes.com/articleshow/132553727.cms,2026-07-23T06:29:28+00:00
TOI ETimes,24,Lock Upp 2: Vinny breaks silence on Dheeraj's chit controversy,https://timesofindia.indiatimes.com/articleshow/132552368.cms,2026-07-23T06:29:28+00:00
TOI ETimes,25,Yogesh Reacts To Eviction: Posts emotional Instagram video,https://timesofindia.indiatimes.com/articleshow/132551602.cms,2026-07-23T06:29:28+00:00
TOI ETimes,26,Sehban injured during the police lathi-charge at protest in Delhi,https://timesofindia.indiatimes.com/articleshow/132566186.cms,2026-07-23T06:29:28+00:00
TOI ETimes,27,Lock Upp 2 to revisit Shilpa-Vikas rivalry with his surprise entry,https://timesofindia.indiatimes.com/articleshow/132562831.cms,2026-07-23T06:29:28+00:00
TOI ETimes,28,Rubina on feeling hurt after discovering Abhinav’s kissing scenes,https://timesofindia.indiatimes.com/articleshow/132557559.cms,2026-07-23T06:29:28+00:00
TOI ETimes,29,Donal Bisht Masters Telugu: actor insists on real-time lines,https://timesofindia.indiatimes.com/articleshow/132561332.cms,2026-07-23T06:29:28+00:00
TOI ETimes,30,"5 things you should never share with your partner, even in the healthiest relationships",https://timesofindia.indiatimes.com/articleshow/132561895.cms,2026-07-23T06:29:28+00:00
TOI ETimes,31,National Vanilla Ice Cream Day: Why the world's favourite frozen dessert deserves a celebration,https://timesofindia.indiatimes.com/articleshow/132571022.cms,2026-07-23T06:29:28+00:00
TOI ETimes,32,"National Broadcasting Day: History, significance and why it continues to shape public life",https://timesofindia.indiatimes.com/articleshow/132570889.cms,2026-07-23T06:29:28+00:00
TOI ETimes,33,"Quote of the Day by Leo Tolstoy, ""If you make it a habit not to blame others, you will feel the growth of the ability love in...""",https://timesofindia.indiatimes.com/articleshow/132565978.cms,2026-07-23T06:29:28+00:00
TOI ETimes,34,Airline launches investigation after all 3 pilots fall ill on Hyderabad to London flight - one undergoes a 12-hour operation,https://timesofindia.indiatimes.com/articleshow/132571990.cms,2026-07-23T06:29:28+00:00
TOI ETimes,35,'Dil toot gaya' and 'they made me bali ka bakra': Vijeta Dahiya hits back at CJP and Abhijeet Dipke after being removed as spokesperson,https://timesofindia.indiatimes.com/articleshow/132571004.cms,2026-07-23T06:29:28+00:00
TOI ETimes,36,"Meet Devyn Dalton, the 34-year-old stuntwoman powering 'The Odyssey'",https://timesofindia.indiatimes.com/articleshow/132571009.cms,2026-07-23T06:29:28+00:00
TOI ETimes,37,Think before you type: 5 things you should never share with AI chatbots,https://timesofindia.indiatimes.com/articleshow/132563704.cms,2026-07-23T06:29:28+00:00
TOI ETimes,38,"Bengaluru couple’s 5 money rules go viral; their ‘spend on life, not image’ mantra strikes a chord",https://timesofindia.indiatimes.com/articleshow/132562769.cms,2026-07-23T06:29:28+00:00
TOI ETimes,39,"‘I was blocked’: Ex-employee claims ₹10,000 salary is still unpaid nearly a year after quitting",https://timesofindia.indiatimes.com/articleshow/132562382.cms,2026-07-23T06:29:28+00:00
TOI ETimes,40,"Jelly Roll’s daughter, Bailee Ann talks about father’s divorce",https://timesofindia.indiatimes.com/articleshow/132534139.cms,2026-07-23T06:29:28+00:00
TOI ETimes,41,Quote of the day by Bruce Springsteen,https://timesofindia.indiatimes.com/articleshow/132531597.cms,2026-07-23T06:29:28+00:00
TOI ETimes,42,Robbie Williams to headline Lytham Festival 2027,https://timesofindia.indiatimes.com/articleshow/132530897.cms,2026-07-23T06:29:28+00:00
TOI ETimes,43,"Liam Payne’s friend, Roger Nores, cleared of criminal charges",https://timesofindia.indiatimes.com/articleshow/132527911.cms,2026-07-23T06:29:28+00:00
TOI ETimes,44,Kelly Clarkson jokes about her and Taylor Swift's net worth differences,https://timesofindia.indiatimes.com/articleshow/132513145.cms,2026-07-23T06:29:28+00:00
TOI ETimes,45,"Shakira, Burna Boy gear up for FIFA World Cup halftime show",https://timesofindia.indiatimes.com/articleshow/132477583.cms,2026-07-23T06:29:28+00:00
TOI ETimes,46,Beyond Ebooks: The charm of bookstores endures,https://timesofindia.indiatimes.com/articleshow/101098088.cms,2026-07-23T06:29:28+00:00
TOI ETimes,47,It’s a curtain call: Sania Mirza bids adieu to tennis with ‘happy tears’,https://timesofindia.indiatimes.com/articleshow/98440670.cms,2026-07-23T06:29:28+00:00
TOI ETimes,48,A magical makeover for 17th Century stepwell: From neglected ruins to a glorious piece of history,https://timesofindia.indiatimes.com/articleshow/96557955.cms,2026-07-23T06:29:28+00:00
TOI ETimes,49,The city comes alive with Christmas fervour,https://timesofindia.indiatimes.com/articleshow/96406573.cms,2026-07-23T06:29:28+00:00
TOI ETimes,50,#BringRioHome: Pet parents launch search to find their kidnapped cat,https://timesofindia.indiatimes.com/articleshow/96334809.cms,2026-07-23T06:29:28+00:00
TOI ETimes,51,From Bharatanatyam to Bhangra: Over 300 artists present India's diverse dance traditions,https://timesofindia.indiatimes.com/articleshow/132208323.cms,2026-07-23T06:29:28+00:00
TOI ETimes,52,‘Social media puts pressure on women to be perfect moms’,https://timesofindia.indiatimes.com/articleshow/132198860.cms,2026-07-23T06:29:28+00:00
TOI ETimes,53,"Anupam Kher shares mantra for a happy 41-year marriage with Kirron Kher, reacts to Gen Z dating terms like situationship, benching - EXCLUSIVE",https://timesofindia.indiatimes.com/articleshow/131228920.cms,2026-07-23T06:29:28+00:00
TOI ETimes,54,Anupam Kher opens up on challenging himself at 71 and returning to theatre after doing 550 films: 'I don't take myself seriously' - Exclusive,https://timesofindia.indiatimes.com/articleshow/131115309.cms,2026-07-23T06:29:28+00:00
TOI ETimes,55,"Horror needs the stage to conspire with you, says Gopal Datt",https://timesofindia.indiatimes.com/articleshow/130598133.cms,2026-07-23T06:29:28+00:00
TOI ETimes,56,"Theatre is magic, and it’s time audiences felt it again: Gopal Datt",https://timesofindia.indiatimes.com/articleshow/130595267.cms,2026-07-23T06:29:28+00:00
TOI ETimes,57,Raj Kundra and Shilpa Shetty's 15th Wedding Anniversary,https://timesofindia.indiatimes.com/articleshow/115563990.cms,2026-07-23T06:29:28+00:00
TOI ETimes,58,​Bigg Boss winners list from season 1 to 17​,https://timesofindia.indiatimes.com/articleshow/114277426.cms,2026-07-23T06:29:28+00:00
TOI ETimes,59,​Discover the bird with a prehistoric roar​,https://timesofindia.indiatimes.com/articleshow/114244474.cms,2026-07-23T06:29:28+00:00
TOI ETimes,60,Dia Mirza's ethnic wear,https://timesofindia.indiatimes.com/articleshow/114243410.cms,2026-07-23T06:29:28+00:00
TOI ETimes,61,​Incredible facts about ants you won’t believe​,https://timesofindia.indiatimes.com/articleshow/114243248.cms,2026-07-23T06:29:28+00:00
TOI ETimes,62,'Bigg Boss Marathi 5' nears grand finale​,https://timesofindia.indiatimes.com/articleshow/113936459.cms,2026-07-23T06:29:28+00:00
TOI ETimes,63,‘He is my colleague’: Employer who funded driver’s ₹4.25 lakh surgery says 1 thing internet can’t stop praising,https://timesofindia.indiatimes.com/articleshow/132561333.cms,2026-07-23T06:29:28+00:00
TOI ETimes,64,'Aap Pakistan se ho na?' Woman says Uber driver's secret chat conversation left her stunned,https://timesofindia.indiatimes.com/articleshow/132559468.cms,2026-07-23T06:29:28+00:00
TOI ETimes,65,"$1.2 billion fintech CEO says bank rejected his home loan despite 800 CIBIL score: ""They can give loan to team members our company employs, but not me""",https://timesofindia.indiatimes.com/articleshow/132556813.cms,2026-07-23T06:29:28+00:00
TOI ETimes,66,'Indian students ke sabse zyada halat kharab hain yahan videshon mein': Indian man says students who live comfortably in India face this harsh reality after moving abroad,https://timesofindia.indiatimes.com/articleshow/132555669.cms,2026-07-23T06:29:28+00:00
TOI ETimes,67,A baby elephant’s mother rejected her at birth. Her keeper refused to leave her side for nearly a month,https://timesofindia.indiatimes.com/articleshow/132566072.cms,2026-07-23T06:29:28+00:00
TOI ETimes,68,Who decides what is great cinema and what isn’t?,https://timesofindia.indiatimes.com/articleshow/132554124.cms,2026-07-23T06:29:28+00:00
TOI ETimes,69,‘Scored 51 marks in Maths’: 5 things to learn from the IITian behind India's first privately developed rocket to reach orbit,https://timesofindia.indiatimes.com/articleshow/132553955.cms,2026-07-23T06:29:28+00:00
TOI ETimes,70,Australian woman gives birth to rare identical quadruplet girls after naturally conceived pregnancy,https://timesofindia.indiatimes.com/articleshow/132553892.cms,2026-07-23T06:29:28+00:00
TOI ETimes,71,"'Baby nahi pehle wife ko dekha': Viral video shows husband choosing to hug his wife before holding newborn baby, internet can't stop crying",https://timesofindia.indiatimes.com/articleshow/132552031.cms,2026-07-23T06:29:28+00:00
TOI ETimes,72,Human sacrifice older than Aztec era? Ancient pre-Aztec altar discovered in Mexico sheds new light on ritual killings,https://timesofindia.indiatimes.com/articleshow/132551149.cms,2026-07-23T06:29:28+00:00
TOI ETimes,73,"She gave up holidays, worked through grief and severe pain: Indian woman says she gave her ‘everything’ to first US job then company laid her off before confirming her role",https://timesofindia.indiatimes.com/articleshow/132550538.cms,2026-07-23T06:29:28+00:00
TOI ETimes,74,"Singaporean tourist asked, ‘Aap made in China?’ at Indian eatery; his calm reply wins hearts",https://timesofindia.indiatimes.com/articleshow/132548820.cms,2026-07-23T06:29:28+00:00
TOI ETimes,75,Woman offered to take a pay cut after struggling at work; her boss sent her on a paid getaway,https://timesofindia.indiatimes.com/articleshow/132542270.cms,2026-07-23T06:29:28+00:00
TOI ETimes,76,"Shabana Azmi claims she witnessed tear gas, students and young women being lathi-charged during Delhi's NEET-UG protest: 'I have never seen such controlled children'",https://timesofindia.indiatimes.com/articleshow/132540944.cms,2026-07-23T06:29:28+00:00
TOI ETimes,77,Who is Vijeta Dahiya? CJP spokesperson loses post after viral burger video,https://timesofindia.indiatimes.com/articleshow/132539463.cms,2026-07-23T06:29:28+00:00
TOI ETimes,78,Maggi and chole-kulche seller reveals ₹1.5 lakh monthly income; internet can’t stop reacting,https://timesofindia.indiatimes.com/articleshow/132538747.cms,2026-07-23T06:29:28+00:00
TOI ETimes,79,"Can billion-year-old stromatolite fossils, the first evidence of life on Earth, make Pithoragarh India's first UNESCO Global Geopark?",https://timesofindia.indiatimes.com/articleshow/132534829.cms,2026-07-23T06:29:28+00:00
TOI ETimes,80,"Pakistan’s ‘Cycle Ambulance’ is being mocked online, but the real reason behind it may surprise you",https://timesofindia.indiatimes.com/articleshow/132531962.cms,2026-07-23T06:29:28+00:00
TOI ETimes,81,NASA just found a hidden planet! Here’s what the Webb Telescope discovered,https://timesofindia.indiatimes.com/articleshow/132531863.cms,2026-07-23T06:29:28+00:00
TOI ETimes,82,Lucky 13th? IIT techie finally cracks Google job after 12 rejections — here’s how,https://timesofindia.indiatimes.com/articleshow/132531267.cms,2026-07-23T06:29:28+00:00
TOI ETimes,83,How much does it really cost to live in Hyderabad as a family of four? Couple breaks down their monthly Rs 1 lakh expense and it is shocking,https://timesofindia.indiatimes.com/articleshow/132529097.cms,2026-07-23T06:29:28+00:00
TOI ETimes,84,‘You were eating a burger while we were protesting?’ Viral video puts CJP spokesperson Vijeta Dahiya in spotlight,https://timesofindia.indiatimes.com/articleshow/132528438.cms,2026-07-23T06:29:28+00:00
TOI ETimes,85,‘It’s not about money’: NRI reveals the one big difference he noticed between India and Norway,https://timesofindia.indiatimes.com/articleshow/132526980.cms,2026-07-23T06:29:28+00:00
TOI ETimes,86,Meet Keyne Yamal: How Lamine Yamal's little half-brother became the unexpected star of the 2026 FIFA World Cup,https://timesofindia.indiatimes.com/articleshow/132524000.cms,2026-07-23T06:29:28+00:00
TOI ETimes,87,"Airbnb mystery solved after family finds decade-old photo of themselves on rental wall; ‘We were creeped out,’ say sisters after bizarre discovery",https://timesofindia.indiatimes.com/articleshow/132520261.cms,2026-07-23T06:29:28+00:00
TOI ETimes,88,"‘I have no house, no car, no big bank balance’: 35-year-old’s post on real success goes viral",https://timesofindia.indiatimes.com/articleshow/132517313.cms,2026-07-23T06:29:28+00:00
TOI ETimes,89,"Pharmacist offered ₹14,000 salary at hospital where cleaner earns ₹16,000; viral video sparks debate",https://timesofindia.indiatimes.com/articleshow/132516356.cms,2026-07-23T06:29:28+00:00
TOI ETimes,90,‘This place smelled so bad’: Creator’s viral Eiffel Tower video reveals a side of Paris tourists rarely show,https://timesofindia.indiatimes.com/articleshow/132515134.cms,2026-07-23T06:29:28+00:00
TOI ETimes,91,The most dangerous grave in the US is made up of lead and concrete: The Cold War disaster that left America with its only grave that can never be exhumed,https://timesofindia.indiatimes.com/articleshow/132512970.cms,2026-07-23T06:29:28+00:00
TOI ETimes,92,"Meet Gitanjali J Angmo: Sonam Wangchuk's wife, an educator a...",https://timesofindia.indiatimes.com/articleshow/132510602.cms,2026-07-23T06:29:28+00:00
TOI ETimes,93,The whiteboard habit that helped Indian-origin teen Vaibhav ...,https://timesofindia.indiatimes.com/articleshow/132509465.cms,2026-07-23T06:29:28+00:00
TOI ETimes,94,Meet Premchand Godha: The CA who managed Amitabh Bachchan's ...,https://timesofindia.indiatimes.com/articleshow/132482610.cms,2026-07-23T06:29:28+00:00
TOI ETimes,95,Indian woman gives a glimpse of her ‘middle-class home’ in t...,https://timesofindia.indiatimes.com/articleshow/132384378.cms,2026-07-23T06:29:28+00:00
TOI ETimes,96,"Ladakh struggled with water for years, then Sonam Wangchuk c...",https://timesofindia.indiatimes.com/articleshow/132023820.cms,2026-07-23T06:29:28+00:00
TOI ETimes,97,"Meet Purnima Devi Barman: Leader of Hargila Army, a 20,000-m...",https://timesofindia.indiatimes.com/articleshow/132067699.cms,2026-07-23T06:29:28+00:00
TOI ETimes,98,"Atacama Desert was the driest place in the world, until one ...",https://timesofindia.indiatimes.com/articleshow/132047381.cms,2026-07-23T06:29:28+00:00
TOI ETimes,99,Cristiano Ronaldo has one of the finest elite car collection...,https://timesofindia.indiatimes.com/articleshow/132032753.cms,2026-07-23T06:29:28+00:00
TOI ETimes,100,"'We accidentally started saving ₹30,000 a month': Corporate ...",https://timesofindia.indiatimes.com/articleshow/132192437.cms,2026-07-23T06:29:28+00:00
TOI ETimes,101,"Forget the muscular Pharaoh: 4,000-year-old mummies reveal Egyptian princesses trained with bows, daggers, and maces",https://timesofindia.indiatimes.com/articleshow/132508922.cms,2026-07-23T06:29:28+00:00
TOI ETimes,102,What scientists just found inside the meteorite that hit a New Jersey home is mind-blowing,https://timesofindia.indiatimes.com/articleshow/132501122.cms,2026-07-23T06:29:28+00:00
