source,rank,headline,link,collected_at_iso
LiveMint,81,Silver Rate Today,https://www.livemint.com/silver-prices,2026-05-17T13:20:21+00:00
LiveMint,82,Silver Rate in Delhi,https://www.livemint.com/silver-prices/delhi,2026-05-17T13:20:21+00:00
LiveMint,83,Silver Rate in Bangalore,https://www.livemint.com/silver-prices/bangalore,2026-05-17T13:20:21+00:00
LiveMint,84,US Stock Market,https://www.livemint.com/market/us-market,2026-05-17T13:20:21+00:00
LiveMint,85,Terms of Use,https://www.livemint.com/terms-of-use,2026-05-17T13:20:21+00:00
LiveMint,86,Code of ethics,https://www.livemint.com/code-of-ethics,2026-05-17T13:20:21+00:00
LiveMint,87,CBSE Class 12 Result 2026,https://www.livemint.com/education/cbse-class-12th-result-2026-live-results-to-be-out-at-cbseresults-nic-in-today-heres-how-to-check-score-11778633818664.html,2026-05-17T13:20:21+00:00
LiveMint,88,MCX Gold Rate,https://www.livemint.com/market/market-stats/commodity-mcx-gold-price,2026-05-17T13:20:21+00:00
LiveMint,89,MCX Silver Price,https://www.livemint.com/market/market-stats/commodity-mcx-silver-price,2026-05-17T13:20:21+00:00
LiveMint,90,Gold Price in Mumbai,https://www.livemint.com/gold-prices/mumbai,2026-05-17T13:20:21+00:00
LiveMint,91,Gold Price in Chennai,https://www.livemint.com/gold-prices/chennai,2026-05-17T13:20:21+00:00
LiveMint,92,Gold Price in Kolkata,https://www.livemint.com/gold-prices/kolkata,2026-05-17T13:20:21+00:00
LiveMint,93,Silver Price in Mumbai,https://www.livemint.com/silver-prices/mumbai,2026-05-17T13:20:21+00:00
LiveMint,94,Silver Price in Chennai,https://www.livemint.com/silver-prices/chennai,2026-05-17T13:20:21+00:00
LiveMint,95,Silver Price in Hyderabad,https://www.livemint.com/silver-prices/hyderabad,2026-05-17T13:20:21+00:00
LiveMint,96,Silver Price in Kolkata,https://www.livemint.com/silver-prices/kolkata,2026-05-17T13:20:21+00:00
LiveMint,97,Latest News Today,https://www.livemint.com/news,2026-05-17T13:20:21+00:00
LiveMint,98,US News Today,https://www.livemint.com/news/us-news,2026-05-17T13:20:21+00:00
LiveMint,99,Top Company Leader,https://www.livemint.com/companies/people,2026-05-17T13:20:21+00:00
LiveMint,100,personal loan emi calculator,https://www.livemint.com/loans/personal-loan-emi-calculator,2026-05-17T13:20:21+00:00
LiveMint,101,Personal Loan Interest Rate,https://www.livemint.com/loans/personal-loan-interest-rates,2026-05-17T13:20:21+00:00
LiveMint,102,Personal Loan Eligibility,https://www.livemint.com/loans/personal-loan-eligibility,2026-05-17T13:20:21+00:00
LiveMint,103,Instant Personal Loan,https://www.livemint.com/loans/instant-personal-loan,2026-05-17T13:20:21+00:00
LiveMint,104,Home Loan EMI Calculator,https://www.livemint.com/tools-calculators/home-loan-emi-calculator,2026-05-17T13:20:21+00:00
LiveMint,105,Car Loan EMI,https://www.livemint.com/tools-calculators/car-loan-calculator,2026-05-17T13:20:21+00:00
India Today,1,"Indian woman in Bangkok says fresh air, safety matter more than 10-minute delivery",https://www.indiatoday.in/trending-news/story/indian-woman-in-bangkok-says-fresh-air-safety-matter-more-than-10-minute-delivery-2913076-2026-05-17,2026-05-17T13:20:21+00:00
India Today,2,"Swiggy Instamart is right, this little girl in Maggi costume is too cute to miss",https://www.indiatoday.in/trending-news/story/swiggy-instamart-is-right-this-little-girl-in-maggi-costume-is-too-cute-to-miss-2913073-2026-05-17,2026-05-17T13:20:21+00:00
India Today,3,TTE's swift action to arrange medical help for sick toddler goes viral,https://www.indiatoday.in/trending-news/story/ttes-swift-action-to-arrange-medical-help-for-sick-toddler-at-bihar-station-goes-viral-2913054-2026-05-17,2026-05-17T13:20:21+00:00
India Today,4,Gurgaon man complains about Shatabdi passenger invading his seat space on train,https://www.indiatoday.in/trending-news/story/gurgaon-man-complains-about-shatabdi-passenger-invading-his-seat-space-on-train-2913013-2026-05-17,2026-05-17T13:20:21+00:00
India Today,5,"'Donald Trump' buffalo in Bangladesh draws selfies, crowds and laughs",https://www.indiatoday.in/trending-news/story/donald-trump-buffalo-in-bangladesh-draws-selfies-crowds-and-laughs-2913000-2026-05-17,2026-05-17T13:20:21+00:00
India Today,6,"Woman confronts elderly man urinating inside Delhi metro lift, authorities take action",https://www.indiatoday.in/trending-news/story/woman-confronts-elderly-man-urinating-inside-delhi-metro-lift-authorities-take-action-2912968-2026-05-17,2026-05-17T13:20:21+00:00
India Today,7,Hyderabad engineer says he's 'dead scared' to take loan amid IT layoffs,https://www.indiatoday.in/trending-news/story/hyderabad-engineer-says-hes-dead-scared-to-take-loan-amid-it-layoffs-2912954-2026-05-17,2026-05-17T13:20:21+00:00
India Today,8,Iran war turned his music school to rubble. He refused to let missiles have the last word,https://www.indiatoday.in/trending-news/story/us-iran-war-tehran-music-school-destroyed-hamidreza-afarideh-plays-in-rubble-2912879-2026-05-17,2026-05-17T13:20:21+00:00
India Today,9,Russian woman shares what surprised her most about travelling in India in viral video,https://www.indiatoday.in/trending-news/story/russian-woman-shares-what-surprised-her-most-about-travelling-in-india-in-viral-video-2912766-2026-05-16,2026-05-17T13:20:21+00:00
India Today,10,"Bengaluru woman says landlord suddenly asked her to move out, then confessed this",https://www.indiatoday.in/trending-news/story/bengaluru-woman-says-landlord-suddenly-asked-her-to-move-out-then-confessed-this-2912753-2026-05-16,2026-05-17T13:20:21+00:00
India Today,11,"Employee ditches email, asks for leave from bosses with Netflix-style documentary",https://www.indiatoday.in/trending-news/story/australian-employee-ditches-email-asks-for-leave-from-bosses-with-netflix-style-documentary-2912739-2026-05-16,2026-05-17T13:20:21+00:00
India Today,12,"Man takes 84-year-old grandmother on her first flight, peak wholesome content ahead",https://www.indiatoday.in/trending-news/story/man-takes-84-year-old-grandmother-on-her-first-flight-peak-wholesome-content-ahead-2912706-2026-05-16,2026-05-17T13:20:21+00:00
India Today,13,"IIT Varanasi student surprises father with brand new phone, his reaction goes viral",https://www.indiatoday.in/trending-news/story/iit-varanasi-student-surprises-father-with-brand-new-phone-his-reaction-goes-viral-2912679-2026-05-16,2026-05-17T13:20:21+00:00
India Today,14,"Company rejects candidate over 'bizarre' distance policy, internet is still processing",https://www.indiatoday.in/trending-news/story/company-rejects-candidate-over-bizarre-distance-policy-internet-is-still-processing-2912640-2026-05-16,2026-05-17T13:20:21+00:00
India Today,15,"British couple travels around India with their newborn baby, shares honest thoughts",https://www.indiatoday.in/trending-news/story/british-couple-travels-around-india-with-their-newborn-baby-shares-honest-thoughts-2912624-2026-05-16,2026-05-17T13:20:21+00:00
India Today,16,"Man meets ex-manager after 16 years, asks him one question that leaves him speechless",https://www.indiatoday.in/trending-news/story/man-meets-ex-manager-after-16-years-asks-him-one-question-that-leaves-him-speechless-2912342-2026-05-15,2026-05-17T13:20:21+00:00
India Today,17,'India's only ape' species uses bridge to cross rail tracks in Assam. Watch,https://www.indiatoday.in/trending-news/story/indias-only-ape-species-uses-bridge-to-cross-rail-tracks-in-assam-watch-2912395-2026-05-15,2026-05-17T13:20:21+00:00
India Today,18,NRI's reply to American colleague's 'Does India have elections' question is viral,https://www.indiatoday.in/trending-news/story/nris-reply-to-american-colleagues-does-india-have-elections-question-is-viral-2912288-2026-05-15,2026-05-17T13:20:21+00:00
India Today,19,Maharashtra family shows off daughter's 90% in Class 12 with Bhagam Bhag dance,https://www.indiatoday.in/trending-news/story/maharashtra-family-shows-off-daughters-90-in-class-12-with-bhagam-bhag-dance-2912279-2026-05-15,2026-05-17T13:20:21+00:00
India Today,20,"CBSE Class 12 student gets 57.4%, father smashes laptop, makes him sleep on floor",https://www.indiatoday.in/trending-news/story/cbse-class-12-student-gets-574-father-smashes-laptop-makes-him-sleep-on-floor-2912207-2026-05-15,2026-05-17T13:20:21+00:00
India Today,21,"Elderly Gujarat woman killed by son's friend, tea saucer helps cops arrest him",https://www.indiatoday.in/india/story/junagadh-murder-case-gujarat-man-kills-friends-mother-crime-news-2913084-2026-05-17,2026-05-17T13:20:21+00:00
India Today,22,17 Nigerian trainee cops killed in jihadist attack on military school,https://www.indiatoday.in/world/story/nigeria-17-police-killed-jihadist-attack-military-training-school-2913079-2026-05-17,2026-05-17T13:20:21+00:00
India Today,23,"Bangladesh tighten grip in Sylhet Test, Pakistan struggle despite Babar Azam resistance",https://www.indiatoday.in/sports/cricket/story/bangladesh-vs-pakistan-2nd-test-day-2-sylhet-babar-azam-2913075-2026-05-17,2026-05-17T13:20:21+00:00
India Today,24,Live: BJP's Shobha Surendran leads against Congress's Ramesh Pisharody,https://www.indiatoday.in/elections/assembly/story/palakkad-assembly-election-results-2026-live-updates-vote-counting-candidates-leading-trailing-2906007-2026-05-03,2026-05-17T13:20:21+00:00
India Today,25,Vetri prophecy? How Vijay and his father's first film predicted TVK's historic win,https://www.indiatoday.in/movies/regional-cinema/story/the-vetri-prophecy-how-vijay-and-his-fathers-1st-film-predicted-tvks-historic-win-2907917-2026-05-07,2026-05-17T13:20:21+00:00
India Today,26,"Anil Kumar Singh (BJP) Candidate from NALHATI Constituency, Anil Kumar Singh Political Career, Age, Education, Election Result 2026 - India Today",https://www.indiatoday.in/elections/assembly/west-bengal/candidate-anil-kumar-singh-8778,2026-05-17T13:20:21+00:00
TOI ETimes,1,Hyderabad-based Amazon employee shares what not to say at work,https://timesofindia.indiatimes.com/articleshow/130726842.cms,2026-05-17T13:20:21+00:00
TOI ETimes,2,Salad topper recalled over salmonella risk,https://timesofindia.indiatimes.com/articleshow/130458722.cms,2026-05-17T13:20:21+00:00
TOI ETimes,3,Rebel Wilson weight loss: How she lost 36 kgs without extreme dieting - Ozempic or lifestyle?,https://timesofindia.indiatimes.com/articleshow/130457577.cms,2026-05-17T13:20:21+00:00
TOI ETimes,4,Viral: India-Australia work-life comparison sparks debate on ‘hustle culture’,https://timesofindia.indiatimes.com/articleshow/130456543.cms,2026-05-17T13:20:21+00:00
TOI ETimes,5,What is the meaning of Indian summer in the UK?,https://timesofindia.indiatimes.com/articleshow/130436405.cms,2026-05-17T13:20:21+00:00
TOI ETimes,6,This sympathetic syndrome makes Fathers feel pregnant,https://timesofindia.indiatimes.com/articleshow/130451612.cms,2026-05-17T13:20:21+00:00
TOI ETimes,7,Tamil film producer K Rajan dies by suicide at the age of 85,https://timesofindia.indiatimes.com/articleshow/131154921.cms,2026-05-17T13:20:21+00:00
TOI ETimes,8,John Cena recalls his debut in the film industry,https://timesofindia.indiatimes.com/articleshow/131154714.cms,2026-05-17T13:20:21+00:00
TOI ETimes,9,RJ Mahvash defends Samay and Ranveer for India’s Got Latent,https://timesofindia.indiatimes.com/articleshow/131154413.cms,2026-05-17T13:20:21+00:00
TOI ETimes,10,RJ Mahvash finally clarifies dating rumours with Chahal,https://timesofindia.indiatimes.com/articleshow/131153911.cms,2026-05-17T13:20:21+00:00
TOI ETimes,11,'Peddi': Jagapathi's fierce and rugged FIRST LOOK as Appalasoori out,https://timesofindia.indiatimes.com/articleshow/131153857.cms,2026-05-17T13:20:21+00:00
TOI ETimes,12,Aarti’s mother Sujatha Vijayakumar on Ravi Mohan’s explosive claims,https://timesofindia.indiatimes.com/articleshow/131153769.cms,2026-05-17T13:20:21+00:00
TOI ETimes,13,Tamil film producer K Rajan dies by suicide at the age of 85 in Chennai,https://timesofindia.indiatimes.com/articleshow/131154924.cms,2026-05-17T13:20:21+00:00
TOI ETimes,14,‘Social media is full of hate’: Soni Razdan slams trolls for mocking Alia Bhatt’s viral Cannes 2026 red carpet clip,https://timesofindia.indiatimes.com/articleshow/131154422.cms,2026-05-17T13:20:21+00:00
TOI ETimes,15,Aamir Khan's daughter Ira Khan is helped by husband Nupur Shikhare cut 29th birthday cake to save her beautiful mehendi - Watch,https://timesofindia.indiatimes.com/articleshow/131154381.cms,2026-05-17T13:20:21+00:00
TOI ETimes,16,'Raja Shivaji' BO Day 16: Riteish starrer eyes Rs 100 cr mark,https://timesofindia.indiatimes.com/articleshow/131147830.cms,2026-05-17T13:20:21+00:00
TOI ETimes,17,'Pati Patni Aur Woh Do' BO Day 2: Film fails to cross Rs 10 cr mark,https://timesofindia.indiatimes.com/articleshow/131147651.cms,2026-05-17T13:20:21+00:00
TOI ETimes,18,Bhooth Bangla BO Day 29: Film narrowly misses Rs 250 cr mark,https://timesofindia.indiatimes.com/articleshow/131130426.cms,2026-05-17T13:20:21+00:00
TOI ETimes,19,'Raja Shivaji' BO day 15: Film inching towards100 cr mark,https://timesofindia.indiatimes.com/articleshow/131130205.cms,2026-05-17T13:20:21+00:00
TOI ETimes,20,'Pati Patni Aur Woh Do' BO Day 1: Film earns Rs 3.85 cr,https://timesofindia.indiatimes.com/articleshow/131129986.cms,2026-05-17T13:20:21+00:00
TOI ETimes,21,'Raja Shivaji' becomes second-highest grossing Marathi film,https://timesofindia.indiatimes.com/articleshow/131106085.cms,2026-05-17T13:20:21+00:00
TOI ETimes,22,Animal Preview: Ranbir Kapoor and Sandeep Reddy Vanga are set to shake up the box office hierarchy,https://timesofindia.indiatimes.com/articleshow/105615612.cms,2026-05-17T13:20:21+00:00
TOI ETimes,23,Tu Jhoothi Main Makkaar,https://timesofindia.indiatimes.com/articleshow/98272134.cms,2026-05-17T13:20:21+00:00
TOI ETimes,24,Ruhaanika Joins KKK 15: Treats show as ‘crash course in courage’,https://timesofindia.indiatimes.com/articleshow/131122936.cms,2026-05-17T13:20:21+00:00
TOI ETimes,25,Shehnaaz sparks dating buzz: RCB outings fuel Devdutt Padikkal rumours,https://timesofindia.indiatimes.com/articleshow/131120365.cms,2026-05-17T13:20:21+00:00
TOI ETimes,26,Parag slams talk of injections and fasting as cause of wife Shefali's death,https://timesofindia.indiatimes.com/articleshow/131116202.cms,2026-05-17T13:20:21+00:00
TOI ETimes,27,Rubina on motherhood Bias: says new moms are sidelined,https://timesofindia.indiatimes.com/articleshow/131113349.cms,2026-05-17T13:20:21+00:00
TOI ETimes,28,Vivek On First Pregnancy Reaction: Actor recalls initial nervousness,https://timesofindia.indiatimes.com/articleshow/131153384.cms,2026-05-17T13:20:21+00:00
TOI ETimes,29,Vishal on wife Deepakshi: The person who didn’t let me give up,https://timesofindia.indiatimes.com/articleshow/131152397.cms,2026-05-17T13:20:21+00:00
TOI ETimes,30,Aanchal On Roadies And Fame: TV actor recalls winning Season 8,https://timesofindia.indiatimes.com/articleshow/131151293.cms,2026-05-17T13:20:21+00:00
TOI ETimes,31,'Indian Idol': Chintu recalls the time when his grandmother Asha Bhosle,https://timesofindia.indiatimes.com/articleshow/131147733.cms,2026-05-17T13:20:21+00:00
TOI ETimes,32,"Just to survive, I stand in government ration lines’: Man quit toxic IT job for mental peace; now struggles to afford food and basic needs",https://timesofindia.indiatimes.com/articleshow/131151511.cms,2026-05-17T13:20:21+00:00
TOI ETimes,33,‘Wouldn’t it be amazing if we worked together one day?’: Mother’s manifestation later became reality for Amazon employee,https://timesofindia.indiatimes.com/articleshow/131151442.cms,2026-05-17T13:20:21+00:00
TOI ETimes,34,"‘I don’t know Pakistan’: Chinese child tells Pakistani tourists; internet reacts, ‘They share a master-servant relationship’",https://timesofindia.indiatimes.com/articleshow/131150892.cms,2026-05-17T13:20:21+00:00
TOI ETimes,35,"‘My dream took just 22 years, but her first flight took 84’: Grandmother’s journey with grandson leaves internet emotional",https://timesofindia.indiatimes.com/articleshow/131150797.cms,2026-05-17T13:20:21+00:00
TOI ETimes,36,5 side hustles in 2026 that people are quietly getting rich from right now,https://timesofindia.indiatimes.com/articleshow/131150089.cms,2026-05-17T13:20:21+00:00
TOI ETimes,37,Jermaine Jackson to pay $6.5 million to sexual assault accuser,https://timesofindia.indiatimes.com/articleshow/131131891.cms,2026-05-17T13:20:21+00:00
TOI ETimes,38,Steve Kerr shares surprising Taylor Swift story,https://timesofindia.indiatimes.com/articleshow/131131884.cms,2026-05-17T13:20:21+00:00
TOI ETimes,39,Beatles' biopic star Harris Dickinson marries singer Rose Gray in an intimate ceremony,https://timesofindia.indiatimes.com/articleshow/131131003.cms,2026-05-17T13:20:21+00:00
TOI ETimes,40,Drake reveals his father is battling cancer,https://timesofindia.indiatimes.com/articleshow/131122186.cms,2026-05-17T13:20:21+00:00
TOI ETimes,41,Kanye India Gig Cancelled: Organisers call off May 2026 show; full refunds promised,https://timesofindia.indiatimes.com/articleshow/131118520.cms,2026-05-17T13:20:21+00:00
TOI ETimes,42,"Eurovision: Israel's Noam Bettan qualifies for finals, amid controversial exit of 5 countries from music festival",https://timesofindia.indiatimes.com/articleshow/131060187.cms,2026-05-17T13:20:21+00:00
TOI ETimes,43,Beyond Ebooks: The charm of bookstores endures,https://timesofindia.indiatimes.com/articleshow/101098088.cms,2026-05-17T13:20:21+00:00
TOI ETimes,44,It’s a curtain call: Sania Mirza bids adieu to tennis with ‘happy tears’,https://timesofindia.indiatimes.com/articleshow/98440670.cms,2026-05-17T13:20:21+00:00
TOI ETimes,45,A magical makeover for 17th Century stepwell: From neglected ruins to a glorious piece of history,https://timesofindia.indiatimes.com/articleshow/96557955.cms,2026-05-17T13:20:21+00:00
TOI ETimes,46,The city comes alive with Christmas fervour,https://timesofindia.indiatimes.com/articleshow/96406573.cms,2026-05-17T13:20:21+00:00
TOI ETimes,47,#BringRioHome: Pet parents launch search to find their kidnapped cat,https://timesofindia.indiatimes.com/articleshow/96334809.cms,2026-05-17T13:20:21+00:00
TOI ETimes,48,Anupam Kher opens up on challenging himself at 71 and returning to theatre after doing 550 films: 'I don't take myself seriously' - Exclusive,https://timesofindia.indiatimes.com/articleshow/131115309.cms,2026-05-17T13:20:21+00:00
TOI ETimes,49,"Horror needs the stage to conspire with you, says Gopal Datt",https://timesofindia.indiatimes.com/articleshow/130598133.cms,2026-05-17T13:20:21+00:00
TOI ETimes,50,"Theatre is magic, and it’s time audiences felt it again: Gopal Datt",https://timesofindia.indiatimes.com/articleshow/130595267.cms,2026-05-17T13:20:21+00:00
TOI ETimes,51,Adil Hussain’s 'Mercy' release date OUT: Film's first look to be attached with Ranveer Singh's 'Dhurandhar: The Revenge',https://timesofindia.indiatimes.com/articleshow/129843424.cms,2026-05-17T13:20:21+00:00
TOI ETimes,52,It’s the best time to be doing theatre: Juhi Babbar Soni,https://timesofindia.indiatimes.com/articleshow/129826631.cms,2026-05-17T13:20:21+00:00
TOI ETimes,53,"Anu Malik steps into theatre with Anupam Kher’s play, Calls it his most exciting challenge yet",https://timesofindia.indiatimes.com/articleshow/129729335.cms,2026-05-17T13:20:21+00:00
TOI ETimes,54,Raj Kundra and Shilpa Shetty's 15th Wedding Anniversary,https://timesofindia.indiatimes.com/articleshow/115563990.cms,2026-05-17T13:20:21+00:00
TOI ETimes,55,​Bigg Boss winners list from season 1 to 17​,https://timesofindia.indiatimes.com/articleshow/114277426.cms,2026-05-17T13:20:21+00:00
TOI ETimes,56,​Discover the bird with a prehistoric roar​,https://timesofindia.indiatimes.com/articleshow/114244474.cms,2026-05-17T13:20:21+00:00
TOI ETimes,57,Dia Mirza's ethnic wear,https://timesofindia.indiatimes.com/articleshow/114243410.cms,2026-05-17T13:20:21+00:00
TOI ETimes,58,​Incredible facts about ants you won’t believe​,https://timesofindia.indiatimes.com/articleshow/114243248.cms,2026-05-17T13:20:21+00:00
TOI ETimes,59,'Bigg Boss Marathi 5' nears grand finale​,https://timesofindia.indiatimes.com/articleshow/113936459.cms,2026-05-17T13:20:21+00:00
TOI ETimes,60,Fish & chips prices soar in the UK,https://timesofindia.indiatimes.com/articleshow/131149435.cms,2026-05-17T13:20:21+00:00
TOI ETimes,61,Meta employees reportedly stuffed bags with snacks before layoffs hit - ‘felt like doomsday’,https://timesofindia.indiatimes.com/articleshow/131148770.cms,2026-05-17T13:20:21+00:00
TOI ETimes,62,Toilet looked ‘blocked’ until a king cobra suddenly rose from inside; viral resort video leaves internet horrified,https://timesofindia.indiatimes.com/articleshow/131148212.cms,2026-05-17T13:20:21+00:00
TOI ETimes,63,"AP x Swatch Royal Pop launch goes horribly wrong as crowds push, scream and storm stores",https://timesofindia.indiatimes.com/articleshow/131141784.cms,2026-05-17T13:20:21+00:00
TOI ETimes,64,Who is Ankur Warikoo? Indian founder going viral for shutting down Rs 100 crore online courses business,https://timesofindia.indiatimes.com/articleshow/131134946.cms,2026-05-17T13:20:21+00:00
TOI ETimes,65,Who are the Girmityas? Indian community honoured in Fiji for their contribution to the economy since 1879,https://timesofindia.indiatimes.com/articleshow/131134611.cms,2026-05-17T13:20:21+00:00
TOI ETimes,66,Who is Vijay Chokal-Ingam? Indian-American man who pretended to be a 'man of colour' to get admission in American medical college,https://timesofindia.indiatimes.com/articleshow/131134060.cms,2026-05-17T13:20:21+00:00
TOI ETimes,67,'Kids in India too locked in': American tech founder reveals why he could have 'never' made it as a student in India,https://timesofindia.indiatimes.com/articleshow/131133986.cms,2026-05-17T13:20:21+00:00
TOI ETimes,68,Gold ring worth lakhs slips into train toilet - Indian Railways staff pull off incredible recovery,https://timesofindia.indiatimes.com/articleshow/131130548.cms,2026-05-17T13:20:21+00:00
TOI ETimes,69,Oh deer! Wild Muntjac rescued after getting stuck on M&S escalator: Here’s what happened,https://timesofindia.indiatimes.com/articleshow/131130331.cms,2026-05-17T13:20:21+00:00
TOI ETimes,70,Why did Kate Middleton call herself ‘Catarina’? Royal’s Italy visit sparks attention,https://timesofindia.indiatimes.com/articleshow/131126041.cms,2026-05-17T13:20:21+00:00
TOI ETimes,71,Viral 'Mochi' hack: Is this rice paper really worth the hype?,https://timesofindia.indiatimes.com/articleshow/131120944.cms,2026-05-17T13:20:21+00:00
TOI ETimes,72,"‘Why do so many men hate women this much?’ CEO’s post on AI, sexism sparks furious debate",https://timesofindia.indiatimes.com/articleshow/131124331.cms,2026-05-17T13:20:21+00:00
TOI ETimes,73,"Indian man jumps onto railway track to pull out Indonesian woman’s ‘dupatta,’ wins praise online",https://timesofindia.indiatimes.com/articleshow/131122703.cms,2026-05-17T13:20:21+00:00
TOI ETimes,74,55 Years of love: Remembering Ken Harwood’s life on and off the screen,https://timesofindia.indiatimes.com/articleshow/131121346.cms,2026-05-17T13:20:21+00:00
TOI ETimes,75,"British couple travels across India with newborn, calls Indian Railways ‘Excellent’",https://timesofindia.indiatimes.com/articleshow/131121177.cms,2026-05-17T13:20:21+00:00
TOI ETimes,76,How a villager found Southeast Asia’s largest Dinosaur,https://timesofindia.indiatimes.com/articleshow/131120343.cms,2026-05-17T13:20:21+00:00
TOI ETimes,77,"Greenpeace report warns of ""Chemical Cocktail"" in traditional British meals",https://timesofindia.indiatimes.com/articleshow/131117860.cms,2026-05-17T13:20:21+00:00
TOI ETimes,78,‘I spend ₹96 lakh every year on employees who make zero money’: Indian CEO’s hiring logic sparks debate,https://timesofindia.indiatimes.com/articleshow/131115850.cms,2026-05-17T13:20:21+00:00
TOI ETimes,79,"'57% in Boards, so dad broke my laptop': Student’s viral Reddit post sparks debate on toxic parenting In India",https://timesofindia.indiatimes.com/articleshow/131111917.cms,2026-05-17T13:20:21+00:00
TOI ETimes,80,"'500 mai ho jata': Indian woman in US reveals how fixing a small leak cost her Rs22,000; says India is more affordable",https://timesofindia.indiatimes.com/articleshow/131109906.cms,2026-05-17T13:20:21+00:00
TOI ETimes,81,How a farmer and his brothers unearthed the Terracotta Army while digging a well,https://timesofindia.indiatimes.com/articleshow/131108754.cms,2026-05-17T13:20:21+00:00
TOI ETimes,82,Bermuda Triangle mystery *finally* solved? Scientists discover massive clue hidden beneath the Bermuda Islands,https://timesofindia.indiatimes.com/articleshow/131108424.cms,2026-05-17T13:20:21+00:00
TOI ETimes,83,'Safety and data privacy?': Pune woman reveals restaurant worker used QR Menu to find her number and harass her,https://timesofindia.indiatimes.com/articleshow/131108303.cms,2026-05-17T13:20:21+00:00
TOI ETimes,84,How did dinosaurs become so enormous? Giant new dinosaur found in Thailand could answer the frequently asked question,https://timesofindia.indiatimes.com/articleshow/131107204.cms,2026-05-17T13:20:21+00:00
TOI ETimes,85,From exile to economic powerhouse: Indians now contribute to 65% of Uganda's tax revenue despite being just 1%,https://timesofindia.indiatimes.com/articleshow/131107327.cms,2026-05-17T13:20:21+00:00
TOI ETimes,86,"Meet ‘Paper Boy Deep’, the newspaper delivery boy taking over internet by ‘storm’ with his flawless throws",https://timesofindia.indiatimes.com/articleshow/131105697.cms,2026-05-17T13:20:21+00:00
TOI ETimes,87,London’s oldest family Italian chain collapses after seven decades,https://timesofindia.indiatimes.com/articleshow/131102567.cms,2026-05-17T13:20:21+00:00
