source,rank,headline,link,collected_at_iso
Indian Express,1,Trending in India,https://indianexpress.com/section/trending/trending-in-india/,2026-04-14T15:13:57+00:00
Indian Express,2,This is Serious,https://indianexpress.com/section/trending/this-is-serious/,2026-04-14T15:13:57+00:00
Indian Express,3,Top 10 most educated countries in the world,https://indianexpress.com/article/trending/top-10-listing/top-10-most-educated-countries-in-the-world-2026-10636368/,2026-04-14T15:13:57+00:00
Indian Express,4,Hungary politician Zsolt Hegedus dance video,https://indianexpress.com/article/trending/trending-globally/hungary-election-celebrations-politician-zsolt-hegedus-dance-viral-video-10636279/,2026-04-14T15:13:57+00:00
Indian Express,5,Praful Hinge IPL debut parents reaction,https://indianexpress.com/article/trending/trending-in-india/praful-hinge-ipl-debut-3-wickets-first-over-srh-rr-parents-video-10635822/,2026-04-14T15:13:57+00:00
Indian Express,6,Pakistani traveller Mumbai airport layover,https://indianexpress.com/article/trending/trending-in-india/pakistani-traveller-10-hour-mumbai-airport-layover-experience-video-viral-10635610/,2026-04-14T15:13:57+00:00
Indian Express,7,Iran mocks US President Trump,https://indianexpress.com/article/trending/trending-globally/iran-strait-of-hormuz-trump-shah-rukh-khan-dialogue-viral-post-10635383/,2026-04-14T15:13:57+00:00
Indian Express,8,Praful Hinge IPL debut Instrgam followers,https://indianexpress.com/article/trending/trending-in-india/praful-hinge-4-wickets-srh-vs-rr-ipl-debut-instagram-followers-viral-video-10635334/,2026-04-14T15:13:57+00:00
Indian Express,9,"Vijay immediately got off the bicycle, and security personnel came running towards him within moments",https://indianexpress.com/article/trending/trending-in-india/tvk-chief-vijay-jumps-off-bicycle-during-kanyakumari-election-rally-man-throws-flower-ball-viral-video-10635332/,2026-04-14T15:13:57+00:00
Indian Express,10,Arijit Singh concert HCL Group 50 year-celebration,https://indianexpress.com/article/trending/trending-in-india/hcl-50th-anniversary-arijit-singh-concert-free-metro-10634721/,2026-04-14T15:13:57+00:00
Indian Express,11,Christina Koch dog reunion video goes viral after Artemis II mission,https://indianexpress.com/article/trending/trending-globally/christina-koch-dog-reunion-artemis-ii-viral-video-10634203/,2026-04-14T15:13:57+00:00
Indian Express,12,2/10 for Delhi: Netizens agree as Russian tourist’s safety ratings for Indian cities go viral,https://indianexpress.com/article/trending/trending-in-india/russian-tourist-safety-rating-india-delhi-viral-video-10634030/,2026-04-14T15:13:57+00:00
Indian Express,13,The viral video captures the critical moment when the athletes were sprinting at full speed,https://indianexpress.com/article/trending/trending-in-india/athletics-federation-slammed-after-man-walks-onto-running-track-in-delhi-during-200m-final-10633569/,2026-04-14T15:13:57+00:00
Indian Express,14,Asha Bhosle sand art tribute,https://indianexpress.com/article/trending/trending-in-india/asha-bhosle-death-tribute-sudarsan-pattnaik-sand-art-10633428/,2026-04-14T15:13:57+00:00
Indian Express,15,"CEO texted employee on wedding day, triggers backlash",https://indianexpress.com/article/trending/trending-globally/us-ceo-issues-public-apology-after-messaging-employee-on-his-wedding-day-10632972/,2026-04-14T15:13:57+00:00
Indian Express,16,Boss sends mangoes to his employee,https://indianexpress.com/article/trending/trending-in-india/london-boss-sends-surprise-gift-to-mumbai-woman-who-missed-good-quality-mangoes-10632704/,2026-04-14T15:13:57+00:00
Indian Express,17,Parakeet Bebe snorkelling video,https://indianexpress.com/article/trending/trending-globally/meet-bebe-world-first-snorkelling-parakeet-viral-bird-10632480/,2026-04-14T15:13:57+00:00
Indian Express,18,Digital arrest scam in UP,https://indianexpress.com/article/trending/trending-in-india/digital-arrest-scam-bareilly-student-saves-parents-10632297/,2026-04-14T15:13:57+00:00
Indian Express,19,She shared that lunchtime proved to be the toughest part due to steep prices.,https://indianexpress.com/article/trending/trending-in-india/bengaluru-500-day-challenge-budget-survival-10632231/,2026-04-14T15:13:57+00:00
Indian Express,20,Most Valuable Banks in India in 2026,https://indianexpress.com/article/trending/top-10-listing/top-10-most-valuable-banks-in-india-in-2026-10631398/,2026-04-14T15:13:57+00:00
Indian Express,21,Shantanu Naidu viral video,https://indianexpress.com/article/trending/trending-in-india/shantanu-naidu-viral-video-horse-cruelty-indian-weddings-baraat-10631327/,2026-04-14T15:13:57+00:00
Indian Express,22,Ichiro Suzuki statue broken bay,https://indianexpress.com/article/trending/trending-globally/watch-ichiro-suzuki-statue-reveal-broken-bat-seattle-mariners-video-10631296/,2026-04-14T15:13:57+00:00
Indian Express,23,Gen Z work culture,https://indianexpress.com/article/trending/trending-in-india/gen-z-work-culture-linkedin-post-workplace-boundaries-debate-overtime-pay-burnout-10631091/,2026-04-14T15:13:57+00:00
Indian Express,24,Kunal Kamra apology row,https://indianexpress.com/article/trending/trending-in-india/kunal-kamra-refuses-apology-maharashtra-privileges-committee-eknath-shinde-parody-song-10630923/,2026-04-14T15:13:57+00:00
Indian Express,25,Bangkok to India flight dirty video,https://indianexpress.com/article/trending/trending-in-india/bangkok-india-flight-dirty-video-indian-passenger-civic-sense-10630788/,2026-04-14T15:13:57+00:00
Indian Express,26,Top 10 most valuable power companies in the world,https://indianexpress.com/article/trending/top-10-listing/top-10-most-valuable-power-companies-in-the-world-2026-10629824/,2026-04-14T15:13:57+00:00
Indian Express,27,Kerala voting controversy,https://indianexpress.com/article/trending/trending-in-india/kerala-voting-controversy-thrissur-woman-bandaged-finger-indelible-ink-row-10629778/,2026-04-14T15:13:57+00:00
LiveMint,1,Jonathan Quick retirement: Rangers veteran goaltender to make final NHL start,https://www.livemint.com/us/trending/jonathan-quick-retirement-new-york-rangers-veteran-goaltender-to-make-final-nhl-start-against-florida-panthers-11776101712321.html,2026-04-14T15:13:57+00:00
LiveMint,2,"NFL Draft 2026: Dates, location, top prospects, order and other details",https://www.livemint.com/us/trending/nfl-draft-2026-dates-location-top-prospects-order-heres-everything-you-need-to-know-11776088776110.html,2026-04-14T15:13:57+00:00
LiveMint,3,Giannis Antetokounmpo and Bucks enter pivotal offseason as Doc Rivers steps down,https://www.livemint.com/us/trending/giannis-antetokounmpo-milwaukee-bucks-enter-pivotal-offseason-as-doc-rivers-steps-down-after-50-loss-season-nba-11776082651467.html,2026-04-14T15:13:57+00:00
LiveMint,4,Sinner beats Alcaraz in Monte Carlo Masters final to reclaim world No. 1 ranking,https://www.livemint.com/us/trending/jannik-sinner-beats-carlos-alcaraz-in-monte-carlo-masters-final-to-reclaim-world-no-1-ranking-11776019107875.html,2026-04-14T15:13:57+00:00
LiveMint,5,Dallas Cowboys safety Markquese Bell arrested on felony drug charge,https://www.livemint.com/us/trending/markquese-bell-arrested-on-felony-drug-charge-and-marijuana-possession-dallas-cowboys-safety-11775932691814.html,2026-04-14T15:13:57+00:00
LiveMint,6,Coachella 2026 kicks off with Sabrina Carpenter's performance,https://www.livemint.com/us/trending/coachella-2026-kicks-off-with-sabrina-carpenters-performance-from-justin-bieber-to-karol-g-check-weekend-schedule-11775875804562.html,2026-04-14T15:13:57+00:00
LiveMint,7,Apple Pay scam spreading fast in the US—Are you at risk?,https://www.livemint.com/us/trending/apple-pay-users-hit-by-scam-wave-across-the-us-here-s-how-victims-are-losing-their-money-11775768345740.html,2026-04-14T15:13:57+00:00
LiveMint,8,Afrika Bambaataa death: Hip-hop pioneer-DJ dies at 67 after cancer complications,https://www.livemint.com/us/trending/afrika-bambaataa-death-hip-hop-pioneer-and-dj-dies-at-67-after-cancer-complications-11775767596687.html,2026-04-14T15:13:57+00:00
LiveMint,9,"DOJ antitrust probe into NFL media rights: What it means for streaming, and more",https://www.livemint.com/us/trending/doj-antitrust-probe-into-nfl-media-rights-what-it-means-for-fans-streaming-and-tv-deals-11775760586179.html,2026-04-14T15:13:57+00:00
LiveMint,10,"Daniil Medvedev smashes racquet in shocking 6-0, 6-0 loss at Monte Carlo Masters",https://www.livemint.com/us/trending/daniil-medvedev-racquet-video-in-shocking-6-0-6-0-clay-defeat-to-matteo-berrettini-at-monte-carlo-masters-11775674478886.html,2026-04-14T15:13:57+00:00
LiveMint,11,"Konnor Griffin signs 9-year, $140 million contract extension with Pirates",https://www.livemint.com/us/trending/konnor-griffin-signs-record-9-year-140-million-contract-extension-with-pittsburgh-pirates-mlb-baseball-11775653782727.html,2026-04-14T15:13:57+00:00
LiveMint,12,JD Vance’s awkward moment: Trump sends call to voicemail during live rally,https://www.livemint.com/us/trending/jd-vance-s-awkward-moment-trump-sends-call-to-voicemail-during-live-rally-in-hungary-watch-11775589348677.html,2026-04-14T15:13:57+00:00
LiveMint,13,"Islanders fire Patrick Roy, hire Peter DeBoer as head coach amid playoff push",https://www.livemint.com/us/trending/patrick-roy-fired-by-new-york-islanders-hire-peter-deboer-as-head-coach-amid-playoff-push-nhl-hockey-11775415170584.html,2026-04-14T15:13:57+00:00
LiveMint,14,Geno Auriemma apologizes to South Carolina after outburst in women's Final Four,https://www.livemint.com/us/trending/geno-auriemma-apologizes-to-south-carolina-after-emotional-outburst-vs-dawn-staley-in-womens-final-four-11775394255637.html,2026-04-14T15:13:57+00:00
LiveMint,15,NCAA Final Four 2026: UConn vs Illinois and Michigan vs Arizona results,https://www.livemint.com/us/trending/ncaa-final-four-2026-results-what-happened-in-uconn-vs-illinois-and-michigan-vs-arizona-march-madness-semifinals-11775390782036.html,2026-04-14T15:13:57+00:00
LiveMint,16,NASA’s Artemis II astronauts face toilet problem; social media reacts with memes,https://www.livemint.com/us/trending/nasas-artemis-ii-astronauts-faces-toilet-problem-in-space-social-media-reacts-with-jokes-memes-blame-ice-for-this-to-11775363905958.html,2026-04-14T15:13:57+00:00
LiveMint,17,Man City thrash Liverpool 4-0 while Chelsea crush Port Vale 7-0 in FA Cup QFs,https://www.livemint.com/us/trending/manchester-city-vs-liverpool-4-0-chelsea-vs-port-vale-7-0-fa-cup-quarterfinals-11775328419465.html,2026-04-14T15:13:57+00:00
LiveMint,18,Juan Soto calf injury: Mets star to undergo MRI after early exit vs Giants,https://www.livemint.com/us/trending/juan-soto-calf-injury-new-york-mets-star-to-undergo-mri-after-early-exit-vs-san-francisco-giants-11775306968287.html,2026-04-14T15:13:57+00:00
LiveMint,19,New York teacher earning $90K turns to $55/hour side gig to repay student loans,https://www.livemint.com/us/trending/new-york-teacher-earning-90k-turns-to-55-hour-side-gig-to-repay-student-loans-11775314789062.html,2026-04-14T15:13:57+00:00
LiveMint,20,NCAA men's Final Four matchups: Schedule and key details,https://www.livemint.com/us/trending/uconn-vs-illinois-and-arizona-vs-michigan-2026-ncaa-mens-final-four-matchups-schedule-and-key-details-11775243799182.html,2026-04-14T15:13:57+00:00
LiveMint,21,Gennaro Gattuso steps down as Italy manager after 2026 World Cup qualifier,https://www.livemint.com/us/trending/gennaro-gattuso-steps-down-as-italy-manager-after-2026-world-cup-qualifier-heartbreak-11775221292115.html,2026-04-14T15:13:57+00:00
LiveMint,22,"Vanessa Trump frustrated with Tiger Woods’ behavior, puts him on notice",https://www.livemint.com/us/trending/vanessa-trump-frustrated-with-tiger-woods-behavior-puts-him-on-notice-stop-acting-like-a-teenager-grow-up-11775209989597.html,2026-04-14T15:13:57+00:00
LiveMint,23,What’s wrong with Tiger Woods? ‘Heartbreaking’ video leaves fans worried,https://www.livemint.com/us/trending/whats-wrong-with-tiger-woods-heartbreaking-video-after-dui-arrest-leaves-fans-worried-mental-health-is-real-11775191311157.html,2026-04-14T15:13:57+00:00
LiveMint,24,McDonald's drops new under $3 menu and $4 breakfast deal — Here’s what you get,https://www.livemint.com/us/trending/mcdonalds-drops-new-under-3-menu-and-4-breakfast-deal-here-s-what-you-can-get-11775157327207.html,2026-04-14T15:13:57+00:00
LiveMint,25,Rapper J. Cole joins China’s Nanjing Monkey Kings for pro basketball stint,https://www.livemint.com/us/trending/grammywinning-rapper-j-cole-joins-china-s-nanjing-monkey-kings-for-pro-basketball-stint-11775141367888.html,2026-04-14T15:13:57+00:00
LiveMint,26,April Fools’ Day 2026 deals: No-joke discounts from Dunkin' and more,https://www.livemint.com/us/trending/april-fools-day-2026-discounts-dunkin-checkers-rally-hooters-qdoba-artemis-ii-doughnut-11775054510320.html,2026-04-14T15:13:57+00:00
LiveMint,27,"Oracle employee, despite being laid off, remains positive: ‘It happens…'",https://www.livemint.com/us/trending/oracle-employee-despite-being-laid-off-remains-positive-it-happens-will-enjoy-sleeping-11775051244639.html,2026-04-14T15:13:57+00:00
LiveMint,28,Warren Buffett teams up with NBA star Stephen Curry for charity lunch auction,https://www.livemint.com/us/trending/warren-buffett-teams-up-with-nba-star-stephen-curry-for-charity-lunch-auction-berkshire-event-returns-in-2026-11774962320767.html,2026-04-14T15:13:57+00:00
LiveMint,29,Tiger Woods’ ex Kristin Smith breaks silence after ‘triggering’ DUI arrest,https://www.livemint.com/us/trending/tiger-woods-ex-kristin-smith-breaks-silence-after-triggering-dui-arrest-seeks-privacy-11774949316320.html,2026-04-14T15:13:57+00:00
LiveMint,30,"Sophie Turner injured, Tomb Raider series halts production temporarily",https://www.livemint.com/us/trending/sophie-turner-injured-tomb-raider-series-halts-production-temporarily-11774878671976.html,2026-04-14T15:13:57+00:00
LiveMint,31,Viral video of Kash Patel dancing? Here’s the truth behind the clip,https://www.livemint.com/us/trending/viral-video-of-kash-patel-dancing-here-s-the-truth-behind-the-clip-11774814955782.html,2026-04-14T15:13:57+00:00
LiveMint,32,"Arnold Schwarzenegger returns to gym—But this time, he’s coaching his son |Watch",https://www.livemint.com/us/trending/arnold-schwarzenegger-returns-to-gym-but-this-time-he-s-coaching-his-son-to-bodybuilding-glory-watch-11774816425352.html,2026-04-14T15:13:57+00:00
LiveMint,33,"Bachelorette star James McCoy Taylor arrested again, months after guilty plea",https://www.livemint.com/us/trending/bachelorette-star-james-mccoy-taylor-arrested-again-months-after-guilty-plea-11774189913536.html,2026-04-14T15:13:57+00:00
LiveMint,34,Comedian jokes about Jews’ expulsion: Social media reacts to viral video,https://www.livemint.com/us/trending/comedian-jokes-about-jews-expulsion-social-media-reacts-to-viral-video-using-antisemitic-talking-points-as-humor-11773998180773.html,2026-04-14T15:13:57+00:00
LiveMint,35,Who is Joseph Duggar? All about reality TV star arrested on abuse charges,https://www.livemint.com/us/trending/who-is-joseph-duggar-all-about-the-19-kids-and-counting-star-arrested-on-abuse-charges-11773894381944.html,2026-04-14T15:13:57+00:00
LiveMint,36,"St Patrick’s Day 2026: Date, history, meaning and traditions worldwide",https://www.livemint.com/us/trending/st-patrick-s-day-2026-date-history-meaning-and-traditions-worldwide-11773760629096.html,2026-04-14T15:13:57+00:00
LiveMint,37,Oscars 2026: What’s on the menu at official after-party for Hollywood A-listers?,https://www.livemint.com/us/trending/oscars-2026-what-s-on-the-menu-at-the-official-after-party-luxurious-food-desserts-and-drinks-for-hollywood-alisters-11773548247036.html,2026-04-14T15:13:57+00:00
LiveMint,38,"Meghan Markle: Harry’s wife faces backlash over $2,235 ticket for group photo",https://www.livemint.com/us/trending/meghan-markle-harry-s-wife-faces-backlash-over-2-235-vip-ticket-for-group-photo-she-s-a-nobody-who-tricked-a-prince-11773538916724.html,2026-04-14T15:13:57+00:00
LiveMint,39,Apple kicks off 50th anniversary with surprise performance by Alicia Keys in NY,https://www.livemint.com/us/trending/alicia-keys-turns-apples-grand-central-in-new-york-into-a-concert-venue-at-tech-giant-s-50th-anniversary-kickoff-11773508129097.html,2026-04-14T15:13:57+00:00
LiveMint,40,Mark to Market,https://www.livemint.com/market/mark-to-market,2026-04-14T15:13:57+00:00
LiveMint,41,Wall Street edges higher on fresh efforts to ease the Middle East conflict,https://www.livemint.com/market/stock-market-news/wall-street-edges-higher-on-fresh-efforts-to-ease-the-middle-east-conflict-11776174536466.html,2026-04-14T15:13:57+00:00
LiveMint,42,Anand Rathi Share and Stock Brokers announces ₹5 final dividend along with Q4 results,https://www.livemint.com/market/stock-market-news/anand-rathi-share-and-stock-brokers-announces-rs-5-final-dividend-along-with-q4-results-11776171469423.html,2026-04-14T15:13:57+00:00
LiveMint,43,PSU Banks vs Private Banks: What should investors pick this earnings season,https://www.livemint.com/market/stock-market-news/q4-results-2026-psu-banks-vs-private-banks-what-should-investors-pick-this-earnings-season-11775814531806.html,2026-04-14T15:13:57+00:00
LiveMint,44,"US stock market today: Dow, S&P 500 futures surge 0.4% as crude slips on hopes of renewed US-Iran talks",https://www.livemint.com/market/stock-market-news/us-stock-market-today-dow-s-p-500-futures-surge-0-4-as-crude-slips-on-hopes-of-renewed-us-iran-talks-11776163972463.html,2026-04-14T15:13:57+00:00
LiveMint,45,Crude oil prices retreat on hopes of renewed US-Iran talks; Brent slips to $96.5/bbl,https://www.livemint.com/market/stock-market-news/crude-oil-prices-retreat-on-hopes-of-renewed-us-iran-talks-brent-slips-to-965bbl-11776158986545.html,2026-04-14T15:13:57+00:00
LiveMint,46,"Buy the dips now; IT our big contra bet, positive on large private banks: Daulat Wealth's founder and CEO",https://www.livemint.com/market/stock-market-news/buy-the-dips-now-it-our-big-contra-bet-positive-on-large-private-banks-daulat-wealths-founder-and-ceo-11776161989138.html,2026-04-14T15:13:57+00:00
LiveMint,47,"Woman drops ₹70,000 ring at IPL stadium for reel, loses it, netizens say ‘moye moye’ - Video",https://www.livemint.com/news/trends/woman-drops-rs-70-000-ring-at-ipl-stadium-for-reel-loses-it-netizens-say-moye-moye-video-11776173899892.html,2026-04-14T15:13:57+00:00
LiveMint,48,"PM Modi, Donald Trump hold 40-min phone conversation; discuss Strait of Hormuz blockade",https://www.livemint.com/news/india/pm-narendra-modi-us-president-donald-trump-hold-40-min-phone-conversation-discuss-strait-of-hormuz-blockade-11776177441182.html,2026-04-14T15:13:57+00:00
LiveMint,49,"US-Iran talks likely to resume this week after failed talks, as blockade on Iranian ports escalates tensions: Report",https://www.livemint.com/news/usiran-talks-likely-to-resume-this-week-after-failed-talks-as-blockade-on-iranian-ports-escalates-tensions-report-11776176889669.html,2026-04-14T15:13:57+00:00
LiveMint,50,"High oil prices may hit India’s growth, but strong fundamentals offer a cushion: S&P",https://www.livemint.com/news/high-oil-prices-india-s-growth-strong-fundamentals-offer-a-cushion-s-p-oil-brent-banking-11776170577032.html,2026-04-14T15:13:57+00:00
LiveMint,51,Quote of the Day by Alan Alda: ‘Be brave enough to live life creatively’,https://www.livemint.com/news/us-news/quote-of-the-day-by-alan-alda-be-brave-enough-to-live-life-creatively-11776171647857.html,2026-04-14T15:13:57+00:00
LiveMint,52,Quote of the Day: Alfred Hitchcock on prioritising what matters — ‘Drama is life with the dull bits cut out’,https://www.livemint.com/news/trends/quote-of-the-day-alfred-hitchcock-on-prioritising-what-matters-drama-is-life-with-the-dull-bits-cut-out-11776176541822.html,2026-04-14T15:13:57+00:00
LiveMint,53,Salary Impact Tracker,https://www.livemint.com/tools-calculators/salary-impact-tracker,2026-04-14T15:13:57+00:00
LiveMint,54,Race for AI-developed drugs heats up: Wegovy-maker Novo Nordisk ties up with OpenAI after rival Eli Lilly seals deal,https://www.livemint.com/companies/news/race-for-ai-developed-drugs-heats-up-wegovy-maker-novo-nordisk-ties-up-with-openai-after-rival-eli-lilly-seals-deal-11776169265644.html,2026-04-14T15:13:57+00:00
LiveMint,55,Everstone invests $270 million in Apothecon Group for a significant stake,https://www.livemint.com/companies/news/everstone-capital-investment-apothecon-group-speciality-pharma-india-us-11776161043339.html,2026-04-14T15:13:57+00:00
LiveMint,56,AvenuesAI begins work on on-premise small language models amid growing data privacy demands,https://www.livemint.com/companies/news/avenuesai-begins-work-on-on-premise-small-language-models-amid-growing-data-privacy-demands-11776159418885.html,2026-04-14T15:13:57+00:00
LiveMint,57,Innomotics to deepen India play post acquisition of Siemens' motor biz,https://www.livemint.com/companies/news/innomotics-siemens-motor-business-india-manufacturing-sector-11776082361381.html,2026-04-14T15:13:57+00:00
LiveMint,58,"Mint Interview | Ignore the noise, focus on consumers, says Zydus Wellness CEO amidst stock rally",https://www.livemint.com/companies/india-zydus-wellness-ceo-tarun-arora-interview-stock-rally-product-launch-innovation-11776134279361.html,2026-04-14T15:13:57+00:00
LiveMint,59,Lululemon under probe by Texas Attorney General over 'forever chemicals' in activewear,https://www.livemint.com/companies/news/lululemon-under-probe-by-texas-attorney-general-over-forever-chemicals-in-activewear-11776151964923.html,2026-04-14T15:13:57+00:00
LiveMint,60,Ask Mint Money,https://www.livemint.com/money/ask-mint-money,2026-04-14T15:13:57+00:00
LiveMint,61,"RBI moots 1-hour pause on high-value UPI payments to curb fraud: Experts warn of potential friction, delayed settlements",https://www.livemint.com/money/personal-finance/rbi-moots-1-hour-pause-on-high-value-upi-payments-to-curb-fraud-experts-warn-of-potential-friction-delayed-settlements-11776171384253.html,2026-04-14T15:13:57+00:00
LiveMint,62,What US green card holders should know about exit tax and gifting rules,https://www.livemint.com/money/personal-finance/us-green-card-holders-us-tax-law-exit-tax-gifting-rules-11776164001022.html,2026-04-14T15:13:57+00:00
LiveMint,63,"Akshaya Tritiya 2026: Should you pre-book gold and silver jewellery? Prices, risks and 5 smart rules to follow",https://www.livemint.com/money/personal-finance/akshaya-tritiya-2026-should-you-pre-book-gold-and-silver-jewellery-prices-risks-and-5-smart-rules-to-follow-11776162231516.html,2026-04-14T15:13:57+00:00
LiveMint,64,"Avoid crisis on a rainy day: What is an emergency fund and how much you should save, explained",https://www.livemint.com/money/personal-finance/avoid-crisis-rainy-day-what-is-emergency-fund-how-much-you-should-save-explained-six-months-expenses-invest-liquidity-11776159383197.html,2026-04-14T15:13:57+00:00
LiveMint,65,What happens to MF and equity folio if investor dies without nominee? Impact of opting out of nomination explained,https://www.livemint.com/money/personal-finance/what-happens-to-mf-and-equity-folio-if-investor-dies-without-nominee-impact-of-opting-out-of-nomination-explained-11776154182887.html,2026-04-14T15:13:57+00:00
LiveMint,66,"Can both parents invest ₹3 lakh in child’s PPF account? PPF limit, guardian rules and tax compliance explained",https://www.livemint.com/money/personal-finance/can-both-parents-invest-3-lakh-in-child-s-ppf-account-ppf-limit-guardian-rules-and-tax-compliance-explained-11776153428632.html,2026-04-14T15:13:57+00:00
LiveMint,67,"Meta’s Muse Spark: Mark Zuckerberg's AI reset raises uncomfortable questions about jobs, data and its future",https://www.livemint.com/technology/meta-ai-reset-strategy-muse-spark-jobs-data-privacy-concerns-big-tech-shift-11776158094241.html,2026-04-14T15:13:57+00:00
LiveMint,68,"ASUS launches 2026 Zenbook and Vivobook series in India: Price, specs, features and pre-order details",https://www.livemint.com/technology/gadgets/asus-debuts-its-2026-zenbook-and-vivobook-series-in-india-price-specs-features-and-pre-order-details-11776160135634.html,2026-04-14T15:13:57+00:00
LiveMint,69,Who is Henry Shevlin? Google DeepMind hires ‘philosopher’ to work on human-AI relationships,https://www.livemint.com/technology/tech-news/who-is-henry-shevlin-google-deepmind-hires-philosopher-to-work-on-human-ai-relationships-11776147129735.html,2026-04-14T15:13:57+00:00
LiveMint,70,"Realme Narzo 100 Lite 5G with 6.8-inch 144Hz display and 7,000mAh battery launched, price starts at ₹13,999",https://www.livemint.com/technology/gadgets/realme-narzo-100-lite-5g-with-6-8-inch-144hz-display-and-7-000mah-battery-launched-price-starts-at-rs-13999-11776149673156.html,2026-04-14T15:13:57+00:00
LiveMint,71,Hackers breach Booking.com as Dutch travel giant warns users over stolen data,https://www.livemint.com/technology/tech-news/hackers-breach-booking-com-as-dutch-travel-giant-warns-users-over-stolen-data-11776138951940.html,2026-04-14T15:13:57+00:00
LiveMint,72,"OpenAI leaked memo slams Anthropic: ChatGPT maker accuses rival of ‘fear-based’ AI approach, reveals report",https://www.livemint.com/technology/tech-news/openai-leaked-memo-slams-anthropic-chatgpt-maker-accuses-rival-of-fear-based-ai-approach-reveals-report-11776136226214.html,2026-04-14T15:13:57+00:00
LiveMint,73,IPL 2026 Schedule,https://www.livemint.com/sports/cricket-news/ipl-schedule,2026-04-14T15:13:57+00:00
LiveMint,74,Orange Cap in IPL 2026,https://www.livemint.com/sports/cricket-news/ipl-orange-cap,2026-04-14T15:13:57+00:00
LiveMint,75,Purple Cap in IPL 2026,https://www.livemint.com/sports/cricket-news/ipl-purple-cap,2026-04-14T15:13:57+00:00
