source,rank,headline,link,collected_at_iso
TOI Viral News,100,"Kolkata team unveils fan mural at Rash Behari Avenue, celebrating city’s first love",https://timesofindia.indiatimes.com/articleshow/130059554.cms,2026-07-11T16:57:54+00:00
TOI Viral News,101,How US spread a lie to rescue a pilot of a jet shot down in Iran,https://timesofindia.indiatimes.com/articleshow/130058641.cms,2026-07-11T16:57:54+00:00
TOI Viral News,102,"Netflix unveils ‘VOID’, an AI model that can change a movie plot",https://timesofindia.indiatimes.com/articleshow/130058880.cms,2026-07-11T16:57:54+00:00
TOI Viral News,103,"AI data centers are causing 'stress' not just to tech companies, but also private insurers",https://timesofindia.indiatimes.com/articleshow/130058967.cms,2026-07-11T16:57:54+00:00
TOI Viral News,104,"""Trans women are....."": Clavicular’s viral moment with trans women sparks fresh conversation on internet culture",https://timesofindia.indiatimes.com/articleshow/130053479.cms,2026-07-11T16:57:54+00:00
NDTV,1,All India News,https://www.ndtv.com/india,2026-07-11T16:57:54+00:00
NDTV,2,"Pune Building Collapse Death Count Rises To 8, One Still Missing In Debris",https://www.ndtv.com/india-news/pune-building-collapse-death-count-rises-to-8-one-still-missing-in-debris-11759012,2026-07-11T16:57:54+00:00
NDTV,3,"Some Jumped Out, I Saw Him Get Stuck: Friend Of Man Killed In Vietnam Tragedy",https://www.ndtv.com/india-news/some-jumped-out-i-saw-him-get-stuck-friend-of-man-killed-in-vietnam-tragedy-11758960,2026-07-11T16:57:54+00:00
NDTV,4,Woman Filed Petition For Cheaper Cancer Drug. She Died Waiting For Verdict,https://www.ndtv.com/india-news/woman-filed-petition-for-cheaper-cancer-drug-she-died-waiting-for-verdict-11758949,2026-07-11T16:57:54+00:00
NDTV,5,"Lion Snatches Boy, 11, From Hill In Gujarat, Mauls Him To Death In Forest",https://www.ndtv.com/india-news/lion-snatches-boy-11-from-hill-in-gujarat-mauls-him-to-death-in-forest-11758805,2026-07-11T16:57:54+00:00
NDTV,6,"On Camera, ATM Dragged Out With Thar, Left Empty On Road Hours Later",https://www.ndtv.com/india-news/thar-robbery-crime-on-camera-thar-pulls-out-atm-with-rope-in-daring-odisha-heist-11758573,2026-07-11T16:57:54+00:00
NDTV,7,BPSC Issues Key Advisory For Assistant Prosecution Officer Exam Candidates,https://www.ndtv.com/education/bpsc-issues-key-advisory-for-assistant-prosecution-officer-exam-candidates-11758887,2026-07-11T16:57:54+00:00
NDTV,8,PM Narendra Modi Invites New Zealand Universities To Open Campuses In India,https://www.ndtv.com/education/pm-narendra-modi-invites-new-zealand-universities-to-open-campuses-in-india-11758743,2026-07-11T16:57:54+00:00
NDTV,9,"Delhi Offers Another Chance To Students Who Missed Class 10, 12 Admissions",https://www.ndtv.com/education/delhi-reopens-class-10-12-admissions-test-scheduled-on-august-1-check-important-dates-11758538,2026-07-11T16:57:54+00:00
NDTV,10,"Bihar Sacks 3,000 'Fake' Teachers, Orders Rs 1,400 Crore Salary Recovery",https://www.ndtv.com/education/bihar-sacks-over-3-000-fake-teachers-to-recover-rs-1-400-crore-in-salaries-with-interest-11758206,2026-07-11T16:57:54+00:00
NDTV,11,"Study Abroad: From Singapore To South Korea, Asia's Top 10 Universities",https://www.ndtv.com/education/study-abroad-which-are-asias-top-10-universities-from-singapore-to-south-korea-11757745,2026-07-11T16:57:54+00:00
NDTV,12,"July 11,2026 10:28 pm IST",https://www.ndtv.com/weather,2026-07-11T16:57:54+00:00
NDTV,13,Actor Rajpal Yadav,https://www.ndtv.com/entertainment/actor-rajpal-yadav-sentenced-to-3-month-jail-in-cheque-bounce-case-11753264,2026-07-11T16:57:54+00:00
NDTV,14,15 Indian Tourists Killed As Boat Overturns In Vietnam,https://www.ndtv.com/world-news/boat-with-indian-tourists-overturns-in-vietnam-rescue-ops-on-11757669,2026-07-11T16:57:54+00:00
NDTV,15,Taylor Swift-Travis Kelce's First Public Appearance As Newlyweds Goes Viral,https://www.ndtv.com/entertainment/taylor-swift-and-travis-kelces-first-public-appearance-as-newlyweds-goes-viral-11758064,2026-07-11T16:57:54+00:00
NDTV,16,Veteran Playback Singer S Janaki Dies At 88,https://www.ndtv.com/entertainment/veteran-playback-singer-s-janaki-dies-at-88-11758938,2026-07-11T16:57:54+00:00
NDTV,17,Diljit Dosanjh's Satluj Removed From ZEE5 Globally Days After India Ban,https://www.ndtv.com/entertainment/diljit-dosanjhs-satluj-removed-from-zee5-globally-days-after-india-ban-11757681,2026-07-11T16:57:54+00:00
NDTV,18,Why Christopher Nolan Chose Mumbai To Promote The Odyssey,https://www.ndtv.com/entertainment/why-christopher-nolan-chose-mumbai-to-promote-the-odyssey-wanted-to-do-this-for-years-11757391,2026-07-11T16:57:54+00:00
NDTV,19,SRK Buys Rs 37 Crore Delhi Home Where He Lived With Gauri After Marriage,https://www.ndtv.com/entertainment/shah-rukh-khan-buys-rs-37-crore-delhi-home-where-he-lived-with-gauri-khan-after-marriage-report-11757575,2026-07-11T16:57:54+00:00
NDTV,20,"Hema Malini Reveals Dharmendra's Last Wish, Opens Up About Her Bond With Sunny And Bobby Deol",https://www.ndtv.com/entertainment/hema-malini-reveals-dharmendras-last-wish-opens-up-about-her-bond-with-sunny-and-bobby-deol-11738487,2026-07-11T16:57:54+00:00
NDTV,21,"Yash And Kiara Advani's New Song Tabaahi From Toxic Sparks Mixed Reaction, Internet Says 'Zero Chemistry'",https://www.ndtv.com/entertainment/yash-and-kiara-advanis-new-song-tabaahi-from-toxic-sparks-mixed-reactions-internet-says-zero-chemistry-11744202,2026-07-11T16:57:54+00:00
NDTV,22,Indian Woman In Dubai Reveals The Emotional Cost Of Living Away From Family,https://www.ndtv.com/offbeat/indian-woman-in-dubai-reveals-the-hidden-emotional-cost-of-living-away-from-family-11756379,2026-07-11T16:57:54+00:00
NDTV,23,"Sunita Ahuja Breaks Down, Refuses To Eat On Lock Upp: 'Govinda Mana Kar Raha Tha Mat Ja'",https://www.ndtv.com/entertainment/sunita-ahuja-breaks-down-refuses-to-eat-at-lock-upp-govinda-mana-kar-raha-tha-mat-ja-11733537,2026-07-11T16:57:54+00:00
NDTV,24,Hyderabad Couple Goes Missing In Switzerland. They Took Crores From Investors,https://www.ndtv.com/india-news/hyderabad-couple-goes-missing-in-switzerland-they-took-crores-from-investors-11756650,2026-07-11T16:57:54+00:00
NDTV,25,Pooja Bhatt Reveals How Family Hid In A Pune Safe House After Mahesh Bhatt Flushed Osho's Mala,https://www.ndtv.com/entertainment/pooja-bhatt-reveals-how-family-hid-in-a-pune-safe-house-after-mahesh-bhatt-flushed-oshos-mala-11739146,2026-07-11T16:57:54+00:00
NDTV,26,Latest News Today,https://www.ndtv.com/latest,2026-07-11T16:57:54+00:00
NDTV,27,Education News India,https://www.ndtv.com/education,2026-07-11T16:57:54+00:00
NDTV,28,Latest Business News,https://www.ndtv.com/business-news,2026-07-11T16:57:54+00:00
NDTV,29,Delhi-NCR Monsoon Live Update,https://www.ndtv.com/india-news/weather-today-live-updates-delhi-ncr-rain-live-monsoon-update-monsoon-spell-continues-in-delhi-waterlogging-in-several-parts-11746704,2026-07-11T16:57:54+00:00
NDTV,30,US Strikes in Iran,https://www.ndtv.com/world-news/us-iran-war-live-updates-us-strikes-iran-after-tanker-attacks-in-hormuz-donald-trump-nato-israel-lebanon-hezbollah-ceasefire-11741497,2026-07-11T16:57:54+00:00
