source,rank,headline,link,collected_at_iso
Indian Express,1,Trending in India,https://indianexpress.com/section/trending/trending-in-india/,2026-04-21T09:26:46+00:00
Indian Express,2,This is Serious,https://indianexpress.com/section/trending/this-is-serious/,2026-04-21T09:26:46+00:00
Indian Express,3,Arunachal broom viral video,https://indianexpress.com/article/trending/trending-in-india/arunachal-pradesh-broom-viral-video-delhi-tenant-landlord-relationship-10647950/,2026-04-21T09:26:46+00:00
Indian Express,4,toddler cancer survivor flight celebration,https://indianexpress.com/article/trending/trending-globally/flight-passenger-celebrate-2-year-old-kid-cancer-recovery-pen-heartfelt-notes-on-napkins-10647650/,2026-04-21T09:26:46+00:00
Indian Express,5,Pakistani label uses AI-generated images of Alia Bhatt,https://indianexpress.com/article/trending/trending-in-india/pakistani-brand-uses-ai-images-of-alia-bhatt-to-promote-new-collection-faces-backlash-10647614/,2026-04-21T09:26:46+00:00
Indian Express,6,Brazilian fitness influencer death,https://indianexpress.com/article/trending/trending-globally/brazilian-influencer-mara-flavia-souza-araujo-drowns-at-ironman-texas-after-poignant-last-post-10647487/,2026-04-21T09:26:46+00:00
Indian Express,7,Whale sharks feed on plankton,https://indianexpress.com/article/trending/trending-globally/whale-shark-nudges-swimmer-in-viral-underwater-video-in-philippines-10646504/,2026-04-21T09:26:46+00:00
Indian Express,8,"The 73-year-old was seen trying paragliding in Bir Billing, Himachal Pradesh",https://indianexpress.com/article/trending/trending-in-india/73-year-old-woman-paragliding-bir-billing-viral-video-10646476/,2026-04-21T09:26:46+00:00
Indian Express,9,Brianna Avalos was celebrating her 10th wedding anniversary with her husband during the ride,https://indianexpress.com/article/trending/trending-globally/hot-air-balloon-makes-emergency-landing-at-california-house-backyard-10646384/,2026-04-21T09:26:46+00:00
Indian Express,10,A lunar crater in the foreground further appears in the video,https://indianexpress.com/article/trending/trending-globally/astronaut-reid-wiseman-earthset-iphone-video-artemis-ii-mission-10646139/,2026-04-21T09:26:46+00:00
Indian Express,11,Titanic lifejacket auction in the UK,https://indianexpress.com/article/trending/trending-globally/titanic-survivor-lifejacket-auction-10645985/,2026-04-21T09:26:46+00:00
Indian Express,12,"While preparing the snack, the vendor asked, “Aap pyaaz khaate hain (Do you eat onions)?”",https://indianexpress.com/article/trending/trending-in-india/pm-modi-jhalmuri-break-bengal-elections-2026-10645841/,2026-04-21T09:26:46+00:00
Indian Express,13,China funeral Mercedes burial incident,https://indianexpress.com/article/trending/trending-globally/china-funeral-mercedes-burial-incident-10645264/,2026-04-21T09:26:46+00:00
Indian Express,14,Sridhar Vembu on AI era,https://indianexpress.com/article/trending/trending-in-india/coding-isnt-enough-anymore-zohos-sridhar-vembu-reveals-the-one-skill-engineers-need-to-beat-ai-10645258/,2026-04-21T09:26:46+00:00
Indian Express,15,"Lenskart revises in-store style guide after ‘bindi, tilak’ row, allows all religious symbols",https://indianexpress.com/article/trending/trending-in-india/lenskart-revises-in-store-style-guide-after-bindi-tilak-row-allows-all-religious-symbols-10644982/,2026-04-21T09:26:46+00:00
Indian Express,16,"After causing extensive damage to the pitch, the man exited the cricket field",https://indianexpress.com/article/trending/trending-in-india/jalgaon-cricket-match-tractor-incident-pitch-destroyed-video-10644849/,2026-04-21T09:26:46+00:00
Indian Express,17,The two held a brief one-on-one meeting before joining the children for the event,https://indianexpress.com/article/trending/trending-globally/barack-obama-nyc-mayor-zohran-mamdani-sing-wheels-on-the-bus-nursery-rhyme-viral-video-10644616/,2026-04-21T09:26:46+00:00
Indian Express,18,Macron Meloni awkward hug video,https://indianexpress.com/article/trending/trending-globally/macron-meloni-awkward-kiss-video-paris-summit-strait-of-hormuz-10643664/,2026-04-21T09:26:46+00:00
Indian Express,19,Ahmedabad man Blinkit deliveries,https://indianexpress.com/article/trending/trending-in-india/ahmedabad-66-year-old-blinkit-delivery-partner-complete-10000-orders-to-travel-the-world-10643621/,2026-04-21T09:26:46+00:00
Indian Express,20,UP DM Asmita Lal langur video,https://indianexpress.com/article/trending/trending-in-india/up-dm-asmita-lal-langur-matru-viral-video-baghpat-government-meeting-10643438/,2026-04-21T09:26:46+00:00
Indian Express,21,Scorpions India tour cancelled,https://indianexpress.com/article/trending/trending-in-india/scorpions-india-tour-cancelled-medical-issues-ticket-refund-details-shillong-mumbai-bengaluru-10643268/,2026-04-21T09:26:46+00:00
Indian Express,22,Ice Spice slapped by fan at McDonald's,https://indianexpress.com/article/trending/trending-globally/rapper-ice-spice-slapped-by-fan-at-mcdonalds-hollywood-viral-video-lapd-report-10643040/,2026-04-21T09:26:46+00:00
Indian Express,23,Mamata Banerjee security scare 2026 West Bengal Assembly elections rally,https://indianexpress.com/article/trending/trending-in-india/mamata-banerjee-security-breach-jalpaiguri-2026-west-bengal-assembly-elections-rally-viral-video-10642852/,2026-04-21T09:26:46+00:00
Indian Express,24,China job market dating apps networking,https://indianexpress.com/article/trending/trending-globally/china-job-market-dating-apps-networking-trend-10641948/,2026-04-21T09:26:46+00:00
Indian Express,25,71-year-old Bengali man singing Khat viral video,https://indianexpress.com/article/trending/trending-in-india/71-year-old-man-singing-khat-viral-video-navjot-ahuja-reacts-10641874/,2026-04-21T09:26:46+00:00
Indian Express,26,CBSE Class 10 result 2026,https://indianexpress.com/article/trending/trending-in-india/visually-impaired-student-zainab-bilal-cbse-10th-results-success-95-percent-10641649/,2026-04-21T09:26:46+00:00
Indian Express,27,Bloomberg Billionaires Index Top 10 Richest Person List in the World: Gautam Adani is Asia’s richest person,https://indianexpress.com/article/trending/top-10-listing/bloomberg-billionaires-index-gautam-adani-overtakes-mukesh-ambani-worlds-top-10-richest-2026-10641401/,2026-04-21T09:26:46+00:00
LiveMint,1,Brandon Aubrey contract: Cowboys kicker agrees to record-setting extension,https://www.livemint.com/us/trending/brandon-aubrey-contract-dallas-cowboys-kicker-agrees-to-record-setting-four-year-28-million-extension-11776713548198.html,2026-04-21T09:26:46+00:00
LiveMint,2,Pep Guardiola gets emotional as Bernardo Silva set to leave Manchester City,https://www.livemint.com/us/trending/pep-guardiola-gets-emotional-as-bernardo-silva-set-to-leave-manchester-city-part-of-myself-is-leaving-too-11776628502818.html,2026-04-21T09:26:46+00:00
LiveMint,3,Cristiano Ronaldo powers Al Nassr into AFC Champions League Two semifinals,https://www.livemint.com/us/trending/cristiano-ronaldo-goal-al-nassr-into-afc-champions-league-two-semifinals-as-saudi-pro-league-title-race-heats-up-11776617844239.html,2026-04-21T09:26:46+00:00
LiveMint,4,"Nathalie Baye, Catch Me If You Can actor, dies at 77 after dementia diagnosis",https://www.livemint.com/us/trending/nathalie-baye-catch-me-if-you-can-actor-dies-at-77-after-dementia-diagnosis-11776543953895.html,2026-04-21T09:26:46+00:00
LiveMint,5,"John Cena opens up on living in car before success, growing up in debt",https://www.livemint.com/us/trending/john-cena-opens-up-on-living-in-car-before-success-growing-up-in-debt-11776532186627.html,2026-04-21T09:26:46+00:00
LiveMint,6,"US Influencer faces backlash after running over toddler, sharing incident online",https://www.livemint.com/us/trending/us-influencer-accidentally-runs-over-23-month-old-son-internet-questions-post-says-attention-is-the-new-currency-11776454890604.html,2026-04-21T09:26:46+00:00
LiveMint,7,Kyle Cooke and Meghan King spotted kissing after Page Six party in NYC,https://www.livemint.com/us/trending/kyle-cooke-and-meghan-king-spotted-kissing-after-page-six-party-in-nyc-11776445679672.html,2026-04-21T09:26:46+00:00
LiveMint,8,Garret Anderson dies at 53: What we know about Angels Legend’s sudden passing,https://www.livemint.com/us/trending/garret-anderson-dies-at-53-what-we-know-about-angels-legend-s-sudden-passing-11776444818255.html,2026-04-21T09:26:46+00:00
LiveMint,9,"Cher seeks conservatorship for son Allman, flags drug, financial troubles",https://www.livemint.com/us/trending/cher-seeks-conservatorship-for-son-elijah-blue-allman-flags-drug-financial-troubles-report-11776439352370.html,2026-04-21T09:26:46+00:00
LiveMint,10,Donald Trump breaks silence after viral $100 tip to DoorDash Grandma,https://www.livemint.com/us/trending/donald-trump-breaks-silence-after-viral-100-tip-to-doordash-grandma-on-mcdonald-delivery-11776388215903.html,2026-04-21T09:26:46+00:00
LiveMint,11,American Pie star Shannon Elizabeth joins OnlyFans: ‘This is the future',https://www.livemint.com/us/trending/shannon-elizabeth-of-american-pie-to-join-onlyfans-hollywood-controlled-my-career-11776371145744.html,2026-04-21T09:26:46+00:00
LiveMint,12,‘Most trolled person in the world’: Meghan Markle on facing online abuse,https://www.livemint.com/us/trending/most-trolled-person-in-the-world-meghan-markle-on-facing-online-abuse-for-a-decade-11776367137558.html,2026-04-21T09:26:46+00:00
LiveMint,13,"Alex Manninger, former Arsenal goalkeeper passes way at 48 in Salzburg train col",https://www.livemint.com/us/trending/alex-manninger-death-former-arsenal-goalkeeper-passes-way-at-48-in-salzburg-train-collision-11776354419788.html,2026-04-21T09:26:46+00:00
LiveMint,14,‘What the…?’ Jon Stewart reacts to Trump’s controversial Jesus-themed AI image,https://www.livemint.com/us/trending/comedian-jon-stewart-mocks-trump-s-jesus-meme-jokes-about-resembling-sick-man-in-viral-image-11776199220897.html,2026-04-21T09:26:46+00:00
LiveMint,15,"Yellowstone volcano near eruption? New study sparks buzz, scientists urge cautio",https://www.livemint.com/us/trending/is-yellowstone-volcano-near-eruption-new-study-sparks-buzz-scientists-urge-caution-11776196907903.html,2026-04-21T09:26:46+00:00
LiveMint,16,Jonathan Quick retirement: Rangers veteran goaltender to make final NHL start,https://www.livemint.com/us/trending/jonathan-quick-retirement-new-york-rangers-veteran-goaltender-to-make-final-nhl-start-against-florida-panthers-11776101712321.html,2026-04-21T09:26:46+00:00
LiveMint,17,"NFL Draft 2026: Dates, location, top prospects, order and other details",https://www.livemint.com/us/trending/nfl-draft-2026-dates-location-top-prospects-order-heres-everything-you-need-to-know-11776088776110.html,2026-04-21T09:26:46+00:00
LiveMint,18,Giannis Antetokounmpo and Bucks enter pivotal offseason as Doc Rivers steps down,https://www.livemint.com/us/trending/giannis-antetokounmpo-milwaukee-bucks-enter-pivotal-offseason-as-doc-rivers-steps-down-after-50-loss-season-nba-11776082651467.html,2026-04-21T09:26:46+00:00
LiveMint,19,Sinner beats Alcaraz in Monte Carlo Masters final to reclaim world No. 1 ranking,https://www.livemint.com/us/trending/jannik-sinner-beats-carlos-alcaraz-in-monte-carlo-masters-final-to-reclaim-world-no-1-ranking-11776019107875.html,2026-04-21T09:26:46+00:00
LiveMint,20,Mark to Market,https://www.livemint.com/market/mark-to-market,2026-04-21T09:26:46+00:00
LiveMint,21,Is the US stock market due for a deep correction amid stretched valuations and geopolitical risks?,https://www.livemint.com/market/stock-market-news/is-the-us-stock-market-due-for-a-deep-correction-amid-stretched-valuations-and-geopolitical-risks-11776760178506.html,2026-04-21T09:26:46+00:00
LiveMint,22,"Nestle Q4 Results 2026: Net profit rises 26% at ₹1,114 crore; declares final dividend of ₹5/share",https://www.livemint.com/market/stock-market-news/nestle-q4-results-2026-net-profit-rises-26-at-rs-1-114-crore-declares-final-dividend-of-rs-5share-11776761545319.html,2026-04-21T09:26:46+00:00
LiveMint,23,"Wipro share buyback: Should you participate or not in ₹15,000-crore offer? Experts weigh in",https://www.livemint.com/market/stock-market-news/wipro-share-buyback-should-you-participate-or-not-in-rs-15-000-crore-offer-experts-weigh-in-11776754646184.html,2026-04-21T09:26:46+00:00
LiveMint,24,Gold Price Outlook: Is the yellow metal still the most trusted asset for Indian households?,https://www.livemint.com/market/commodities/gold-price-outlook-is-the-yellow-metal-still-the-most-trusted-asset-for-indian-households-11776759713231.html,2026-04-21T09:26:46+00:00
LiveMint,25,"Sebi’s crackdown on options frenzy is bearing fruit, NSE data shows",https://www.livemint.com/market/sebis-crackdown-options-frenzy-bearing-fruit-nse-data-shows-high-risk-equity-options-segment-retail-investors-11776755742873.html,2026-04-21T09:26:46+00:00
LiveMint,26,Penny stock under Re 1 jumps over 8% after this acquisition update,https://www.livemint.com/market/stock-market-news/penny-stock-under-re-1-nhc-foods-share-price-jumps-8-after-this-acquisition-update-11776760234846.html,2026-04-21T09:26:46+00:00
LiveMint,27,Three Ships Including an Iranian Vessel Cross Hormuz Strait,https://www.livemint.com/news/three-ships-including-an-iranian-vessel-cross-hormuz-strait-11776763456886.html,2026-04-21T09:26:46+00:00
LiveMint,28,"‘Let’s call her Meg’: Piers Morgan’s rant on Prince Harry’s wife, Meghan Markle, takes shocking Jeffrey Epstein turn",https://www.livemint.com/news/world/lets-call-her-meg-piers-morgan-s-rant-on-prince-harry-s-wife-meghan-markle-takes-shocking-jeffrey-epstein-turn-11776762293652.html,2026-04-21T09:26:46+00:00
LiveMint,29,Mexico Teotihuacan pyramids shooting: Gunman shoots Canadian woman dead before killing himself; chilling video emerges,https://www.livemint.com/news/world/mexico-teotihuacan-pyramids-shooting-gunman-shoots-dead-canadian-woman-before-killing-himself-chilling-video-emerges-11776762061595.html,2026-04-21T09:26:46+00:00
LiveMint,30,"Japanese Proverb of the day: ‘Even monkeys fall from trees’; meaning, business lesson and why it still matters today",https://www.livemint.com/news/us-news/japanese-proverb-of-the-day-even-monkeys-fall-from-trees-meaning-business-lesson-and-why-it-still-matters-today-11776757774139.html,2026-04-21T09:26:46+00:00
LiveMint,31,Quote of the day by Netaji Subhas Chandra Bose: ‘Give me blood and I will give you…’,https://www.livemint.com/news/trends/quote-of-the-day-by-netaji-subhas-chandra-bose-give-me-blood-and-i-will-give-you-11776751215983.html,2026-04-21T09:26:46+00:00
LiveMint,32,Quote of the Day by Mark Twain on the politics of education: ‘A full belly is little worth where the mind…’,https://www.livemint.com/news/us-news/quote-of-the-day-21-april-2026-mark-twain-politics-education-11776752704403.html,2026-04-21T09:26:46+00:00
LiveMint,33,Salary Impact Tracker,https://www.livemint.com/tools-calculators/salary-impact-tracker,2026-04-21T09:26:46+00:00
LiveMint,34,Infra.Market founders take on debt to pump more cash into firm as IPO plans slow,https://www.livemint.com/companies/inframarket-silverline-homes-tiger-global-accel-india-nexus-venture-partners-ipo-delay-promoter-financing-11776750430398.html,2026-04-21T09:26:46+00:00
LiveMint,35,"Tea café chain Chaayos in talks to raise $50-70 million, appoints banker",https://www.livemint.com/companies/tea-caf-chaayos-fund-raise-tiger-global-elevation-capital-avendus-think-investments-11776738291131.html,2026-04-21T09:26:46+00:00
LiveMint,36,Suzlon eyes Europe comeback with next-gen wind turbines,https://www.livemint.com/companies/suzlon-eyes-europe-comeback-next-gen-wind-turbines-blue-sky-product-platform-11776752822916.html,2026-04-21T09:26:46+00:00
LiveMint,37,"South Korea's Krafton, Naver partner Mirae for ₹6,000 crore India fund to back growth-stage tech startups",https://www.livemint.com/technology/tech-news/south-korea-krafton-naver-mirae-6-000-crore-india-fund-growth-stage-tech-startups-unicorn-growth-fund-11776751712668.html,2026-04-21T09:26:46+00:00
LiveMint,38,"Beyond zero: Soft drink makers double down on 'functional' fizz, zero calories and local flavours",https://www.livemint.com/companies/news/zero-sugar-low-calories-functional-drinks-prebiotic-fibre-soft-drinks-industry-gut-health-local-flavours-11776745702530.html,2026-04-21T09:26:46+00:00
LiveMint,39,"PE firm EQT closes $15.6 billion Asia fund, largest in region amid fundraising slump",https://www.livemint.com/companies/eqt-bpea-ix-private-equity-asia-asia-pacific-fund-fundraising-slump-sovereign-wealth-funds-pension-funds-11776738056829.html,2026-04-21T09:26:46+00:00
LiveMint,40,Ask Mint Money,https://www.livemint.com/money/ask-mint-money,2026-04-21T09:26:46+00:00
LiveMint,41,Tax-exempt investment options in India — here are 5 EEE instruments for long-term savings,https://www.livemint.com/money/personal-finance/taxexempt-investment-options-in-india-here-are-5-eee-instruments-for-long-term-savings-11776750373333.html,2026-04-21T09:26:46+00:00
LiveMint,42,"US Social Security: April's last payment to be sent tomorrow, are you on the list?",https://www.livemint.com/money/personal-finance/us-social-security-aprils-last-payment-to-be-sent-tomorrow-are-you-on-the-list-11776758083090.html,2026-04-21T09:26:46+00:00
LiveMint,43,"8th Pay Commission: ₹69,000 minimum salary, 3.83 fitment factor; NC-JCM's 7 key demands explained",https://www.livemint.com/money/personal-finance/8th-pay-commission-69-000-minimum-salary-3-83-fitment-factor-nc-jcms-7-key-demands-explained-11776755149826.html,2026-04-21T09:26:46+00:00
LiveMint,44,Don’t apply for a visa before knowing this key cost difference,https://www.livemint.com/money/personal-finance/dont-apply-for-a-visa-before-knowing-this-key-cost-difference-11776750986315.html,2026-04-21T09:26:46+00:00
LiveMint,45,GSTR-3B March 2026 filing: Was the 20 April deadline extended? What happens if you miss due date?,https://www.livemint.com/money/personal-finance/gstr3b-march-2026-filing-was-the-20-april-deadline-extended-what-happens-if-you-miss-due-date-11776748230015.html,2026-04-21T09:26:46+00:00
LiveMint,46,Your mutual fund's new expense ratio has a maths problem,https://www.livemint.com/money/personal-finance/sebi-ter-reform-base-expense-ratio-mutual-fund-costs-brokerage-transaction-costs-amfi-data-expense-ratio-11776670960281.html,2026-04-21T09:26:46+00:00
LiveMint,47,The Rise of Apple’s New CEO: A Hardware Expert Takes Over in the AI Era,https://www.livemint.com/technology/the-rise-of-apple-s-new-ceo-a-hardware-expert-takes-over-in-the-ai-era-john-ternus-tim-cook-11776759131238.html,2026-04-21T09:26:46+00:00
LiveMint,48,"Redmi A7 and Redmi A7 Pro launched in India, price starts at ₹10,499",https://www.livemint.com/technology/gadgets/redmi-a7-and-redmi-a7-pro-launched-in-india-price-starts-at-rs-10999-11776756346861.html,2026-04-21T09:26:46+00:00
LiveMint,49,"iPhone 17 Pro Max vs iPhone 18 Pro Max: New colours, processor, camera and expected upgrades",https://www.livemint.com/technology/gadgets/iphone-17-pro-max-vs-iphone-18-pro-max-new-colours-processor-camera-and-expected-upgrades-11776748563372.html,2026-04-21T09:26:46+00:00
LiveMint,50,Google taps Sergey Brin to lead a specialized AI strike team to take on Anthropic's Claude: Report,https://www.livemint.com/technology/tech-news/google-taps-sergey-brin-to-lead-a-specialized-ai-strike-team-to-take-on-anthropics-claude-report-11776743898618.html,2026-04-21T09:26:46+00:00
LiveMint,51,Apple to soon let you unlock and start Tata car directly from your iPhone or Apple Watch: Report,https://www.livemint.com/technology/tech-news/apple-to-soon-let-you-unlock-and-start-tata-car-directly-from-your-iphone-or-apple-watch-report-11776736342956.html,2026-04-21T09:26:46+00:00
LiveMint,52,IPL 2026 Schedule,https://www.livemint.com/sports/cricket-news/ipl-schedule,2026-04-21T09:26:46+00:00
LiveMint,53,Orange Cap in IPL 2026,https://www.livemint.com/sports/cricket-news/ipl-orange-cap,2026-04-21T09:26:46+00:00
LiveMint,54,Purple Cap in IPL 2026,https://www.livemint.com/sports/cricket-news/ipl-purple-cap,2026-04-21T09:26:46+00:00
LiveMint,55,IPL 2026 Points Table,https://www.livemint.com/sports/cricket-news/ipl-points-table,2026-04-21T09:26:46+00:00
LiveMint,56,IFSC Code Finder,https://www.livemint.com/ifsc-code,2026-04-21T09:26:46+00:00
LiveMint,57,Income Tax Calculator,https://www.livemint.com/tools-calculators/income-tax-calculator,2026-04-21T09:26:46+00:00
LiveMint,58,Gold Rate Today,https://www.livemint.com/gold-prices,2026-04-21T09:26:46+00:00
LiveMint,59,Gold Rate in Delhi,https://www.livemint.com/gold-prices/delhi,2026-04-21T09:26:46+00:00
LiveMint,60,Gold Rate Hyderabad,https://www.livemint.com/gold-prices/hyderabad,2026-04-21T09:26:46+00:00
LiveMint,61,Silver Rate Today,https://www.livemint.com/silver-prices,2026-04-21T09:26:46+00:00
LiveMint,62,Silver Rate in Delhi,https://www.livemint.com/silver-prices/delhi,2026-04-21T09:26:46+00:00
LiveMint,63,Silver Rate in Bangalore,https://www.livemint.com/silver-prices/bangalore,2026-04-21T09:26:46+00:00
LiveMint,64,US Stock Market,https://www.livemint.com/market/us-market,2026-04-21T09:26:46+00:00
LiveMint,65,Terms of Use,https://www.livemint.com/terms-of-use,2026-04-21T09:26:46+00:00
LiveMint,66,Code of ethics,https://www.livemint.com/code-of-ethics,2026-04-21T09:26:46+00:00
LiveMint,67,Stock Market Today,https://www.livemint.com/market/stock-market-news/stock-market-sensex-nifty-50-live-updates-gift-nifty-20-april-2026-us-iran-war-crude-oil-prices-gold-rate-today-silver-11776651995951.html,2026-04-21T09:26:46+00:00
LiveMint,68,MCX Gold Rate,https://www.livemint.com/market/market-stats/commodity-mcx-gold-price,2026-04-21T09:26:46+00:00
LiveMint,69,MCX Silver Price,https://www.livemint.com/market/market-stats/commodity-mcx-silver-price,2026-04-21T09:26:46+00:00
LiveMint,70,Gold Price in Mumbai,https://www.livemint.com/gold-prices/mumbai,2026-04-21T09:26:46+00:00
LiveMint,71,Gold Price in Chennai,https://www.livemint.com/gold-prices/chennai,2026-04-21T09:26:46+00:00
LiveMint,72,Gold Price in Kolkata,https://www.livemint.com/gold-prices/kolkata,2026-04-21T09:26:46+00:00
LiveMint,73,Silver Price in Mumbai,https://www.livemint.com/silver-prices/mumbai,2026-04-21T09:26:46+00:00
LiveMint,74,Silver Price in Chennai,https://www.livemint.com/silver-prices/chennai,2026-04-21T09:26:46+00:00
LiveMint,75,Silver Price in Hyderabad,https://www.livemint.com/silver-prices/hyderabad,2026-04-21T09:26:46+00:00
LiveMint,76,Silver Price in Kolkata,https://www.livemint.com/silver-prices/kolkata,2026-04-21T09:26:46+00:00
LiveMint,77,Latest News Today,https://www.livemint.com/news,2026-04-21T09:26:46+00:00
LiveMint,78,US News Today,https://www.livemint.com/news/us-news,2026-04-21T09:26:46+00:00
LiveMint,79,Top Company Leader,https://www.livemint.com/companies/people,2026-04-21T09:26:46+00:00
LiveMint,80,personal loan emi calculator,https://www.livemint.com/loans/personal-loan-emi-calculator,2026-04-21T09:26:46+00:00
LiveMint,81,Personal Loan Interest Rate,https://www.livemint.com/loans/personal-loan-interest-rates,2026-04-21T09:26:46+00:00
LiveMint,82,Personal Loan Eligibility,https://www.livemint.com/loans/personal-loan-eligibility,2026-04-21T09:26:46+00:00
LiveMint,83,Instant Personal Loan,https://www.livemint.com/loans/instant-personal-loan,2026-04-21T09:26:46+00:00
LiveMint,84,Home Loan EMI Calculator,https://www.livemint.com/tools-calculators/home-loan-emi-calculator,2026-04-21T09:26:46+00:00
LiveMint,85,Car Loan EMI,https://www.livemint.com/tools-calculators/car-loan-calculator,2026-04-21T09:26:46+00:00
NDTV,1,All India News,https://www.ndtv.com/india,2026-04-21T09:26:46+00:00
NDTV,2,Time Stands Still For Family Of Pahalgam Man Who Died Fighting Terrorist,https://www.ndtv.com/india-news/pahalgam-terror-attack-jammu-kashmir-time-stands-still-for-family-of-horse-rider-who-died-fighting-terrorist-11386980,2026-04-21T09:26:46+00:00
NDTV,3,9 Reasons Delhi Judge Didn't Back Out From Arvind Kejriwal's Case,https://www.ndtv.com/india-news/9-reasons-delhi-high-court-judge-swarana-kanta-sharma-didnt-back-out-from-arvind-kejriwals-liquor-policy-case-11386960,2026-04-21T09:26:46+00:00
NDTV,4,"Caller Claims Lawrence Bishnoi Gang Ties, Threatens RTO Officer In Bengaluru",https://www.ndtv.com/india-news/caller-claims-lawrence-bishnoi-gang-ties-threatens-rto-officer-in-bengaluru-11386939,2026-04-21T09:26:46+00:00
NDTV,5,"Thieves Use Bohag Bihu Festive Attire For Thefts In Guwahati, Arrested",https://www.ndtv.com/india-news/man-in-mekhela-chador-among-3-arrested-for-theft-in-guwahati-during-bihu-11386683,2026-04-21T09:26:46+00:00
NDTV,6,"UP Teen Refused To Break-Up, Father Killed Her, Poured Acid On Face",https://www.ndtv.com/india-news/lucknow-man-kills-daughter-up-man-strangles-teen-daughter-pours-acid-on-face-over-her-relationship-11386645,2026-04-21T09:26:46+00:00
NDTV,7,Looking Beyond JEE? 5 State Entrance Exams For BTech With Top Placements,https://www.ndtv.com/education/looking-beyond-jee-5-state-entrance-exams-for-btech-with-top-placements-11387054,2026-04-21T09:26:46+00:00
NDTV,8,Who Qualified For JEE Advanced 2026? Category-Wise Cut-Off Explained,https://www.ndtv.com/education/jee-main-2026-result-declared-category-wise-cut-off-for-jee-advanced-out-over-96-000-qualify-in-general-category-11386885,2026-04-21T09:26:46+00:00
NDTV,9,Jammu and Kashmir Board Class 10 Result 2026 Out For Summer Zone,https://www.ndtv.com/education/jkbose-class-10th-result-2026-out-for-jammu-division-at-jkresults-nic-in-11386847,2026-04-21T09:26:46+00:00
NDTV,10,"Assam HS Class 12 Result Soon: Check Expected Date, Past Year Trends Here",https://www.ndtv.com/education/assam-ahsec-hs-class-12-result-soon-check-expected-date-past-year-trends-here-11386769,2026-04-21T09:26:46+00:00
