source,rank,headline,link,collected_at_iso
NDTV,8,"Delhi Schools Begin Non-Plan Admissions For Classes 6-9, Apply Now",https://www.ndtv.com/education/delhi-government-schools-begin-non-plan-admissions-for-classes-6-9-registration-opens-check-details-here-11294697,2026-04-01T07:21:27+00:00
NDTV,9,Jamia Millia Invites Applications For Free Civil Services Coaching Programme,https://www.ndtv.com/education/jamia-millia-islamia-invites-applications-for-free-civil-services-coaching-programme-heres-direct-link-to-apply-11294422,2026-04-01T07:21:27+00:00
NDTV,10,PSEB Punjab Board Class 5 And 8 Results 2026 To Be Declared Soon,https://www.ndtv.com/education/pseb-punjab-board-class-5-and-8-results-2026-to-be-declared-soon-11292931,2026-04-01T07:21:27+00:00
NDTV,11,"School Assembly News Headlines (March 31): Top National, World, Sports Updates",https://www.ndtv.com/education/school-assembly-news-headlines-march-31-top-national-world-sports-updates-11292037,2026-04-01T07:21:27+00:00
NDTV,12,Assembly Elections 2026,https://www.ndtv.com/elections,2026-04-01T07:21:27+00:00
NDTV,13,Where Is Iran's Supreme Leader Mojtaba Khamenei? Russian Envoy Reveals,https://www.ndtv.com/world-news/iran-war-news-where-is-irans-supreme-leader-mojtaba-khamenei-russian-envoy-reveals-11294594,2026-04-01T07:21:27+00:00
NDTV,14,"Premium Petrol Price Rises To Rs 160 Per Litre, Jet Fuel Hiked By 8.5%",https://www.ndtv.com/india-news/us-israel-iran-war-premium-petrol-xp100-price-hiked-by-rs-11-per-litre-jet-fuel-crosses-rs-2-lakh-per-kilolitre-11294307,2026-04-01T07:21:27+00:00
NDTV,15,"Trump Ready To Leave Iran Without Deal, Israel Vows To ""Crush Terror Regime""",https://www.ndtv.com/world-news/iran-war-news-trump-says-us-ready-to-leave-iran-without-deal-israel-indicate-other-plans-11294370,2026-04-01T07:21:27+00:00
NDTV,16,"""Maybe Two Weeks"": Trump Says US To Leave Iran ""Very Soon""",https://www.ndtv.com/world-news/iran-war-donald-trump-says-us-to-leave-iran-very-soon-11293956,2026-04-01T07:21:27+00:00
NDTV,17,"""2026 Got Crazy"": Internet Erupts After Claude Code Leak Rocks AI Industry",https://www.ndtv.com/feature/2026-just-got-crazy-internet-erupts-after-anthropics-claude-source-code-leak-shakes-ai-industry-11294628,2026-04-01T07:21:27+00:00
NDTV,18,"Iran Foreign Minister, President Appear In Public, Spell Out How War Can End",https://www.ndtv.com/world-news/iran-war-news-iran-foreign-minister-president-appear-in-public-spell-out-how-war-can-end-11294905,2026-04-01T07:21:27+00:00
NDTV,19,"On April Fools' Day, A Reality Check For US, Iran And The World",https://www.ndtv.com/opinion/on-april-fools-day-a-reality-check-for-us-iran-and-the-world-11294920,2026-04-01T07:21:27+00:00
NDTV,20,Amul's Response After User Complains About High-Protein Buttermilk,https://www.ndtv.com/food/amuls-response-after-user-complains-about-high-protein-buttermilk-11290105,2026-04-01T07:21:27+00:00
NDTV,21,Trump Says 'War Could End In 2 Weeks': How Long For Oil Supply To Normalise?,https://www.ndtv.com/world-news/us-iran-war-war-could-end-in-2-weeks-trump-how-long-for-strait-of-hormuz-bab-al-mandab-oil-supply-to-normalise-11295283,2026-04-01T07:21:27+00:00
NDTV,22,"Watch: 4,000 Kg Fake Ginger-Garlic Paste Busted In Hyderabad, Owner Arrested",https://www.ndtv.com/food/watch-4-032-kg-fake-ginger-garlic-paste-busted-in-hyderabad-items-worth-rs-22-lakh-seized-11294729,2026-04-01T07:21:27+00:00
NDTV,23,Sara Ali Khan Rents Out Mumbai Bungalow At Rs 4.14 Crore For School Activities,https://www.ndtv.com/entertainment/sara-ali-khan-rents-out-mumbai-bungalow-at-rs-4-14-crore-for-school-activities-11291903,2026-04-01T07:21:27+00:00
NDTV,24,Why OTP Alone Won't Work Anymore: RBI's New Digital Payment Rules Explained,https://www.ndtv.com/india-news/rbis-new-digital-payment-rules-from-april-1-what-changes-for-upi-cards-and-wallets-11294996,2026-04-01T07:21:27+00:00
NDTV,25,New DNA Analysis Suggests That Shroud Of Turin May Have Indian Origins,https://www.ndtv.com/feature/new-dna-analysis-suggests-that-shroud-of-turin-may-have-indian-origins-11292980,2026-04-01T07:21:27+00:00
NDTV,26,Strikes To Begin Today: Iran Warns Tech Firms Over US' Killing Of Leaders,https://www.ndtv.com/world-news/iran-war-news-if-you-kill-our-leaders-well-attack-us-firms-like-google-meta-iran-11292804,2026-04-01T07:21:27+00:00
NDTV,27,"Oracle Lays Off 12,000 Employees In India, Another Round Likely: Report",https://www.ndtv.com/india-news/oracle-lays-off-12-000-employees-in-india-another-round-likely-report-11293454,2026-04-01T07:21:27+00:00
NDTV,28,Watch: Danish Pandor Sings Dhurandhar 2 Song On Road Trip With Girlfriend Aahana Kumra,https://www.ndtv.com/entertainment/watch-danish-pandor-sings-dhurandhar-2-song-on-road-trip-with-girlfriend-aahana-kumra-11291179,2026-04-01T07:21:27+00:00
NDTV,29,'Where Were You When Iranians Were Dying?': Mandana Karimi Slams Boman Irani's Trump Roast,https://www.ndtv.com/entertainment/where-were-you-when-iranians-were-dying-mandana-karimi-slams-boman-iranis-trump-roast-11268557,2026-04-01T07:21:27+00:00
NDTV,30,"British National, Working With BCCI For IPL Matches, Found Dead At Mumbai Hotel",https://www.ndtv.com/india-news/british-national-working-with-bcci-for-ipl-matches-found-dead-at-mumbai-hotel-11290075,2026-04-01T07:21:27+00:00
NDTV,31,Video: Malaika Arora Visits Jain Temple In Rajasthan With Rumoured Boyfriend Harsh Mehta,https://www.ndtv.com/entertainment/video-malaika-arora-visits-jain-temple-in-rajasthan-with-rumoured-boyfriend-harsh-mehta-11285334,2026-04-01T07:21:27+00:00
NDTV,32,"Badshah's Relationship Timeline: From First Marriage, To Divorce, And Second Wedding",https://www.ndtv.com/entertainment/badshahs-relationship-timeline-from-first-marriage-to-divorce-and-second-wedding-11263882,2026-04-01T07:21:27+00:00
NDTV,33,Latest News Today,https://www.ndtv.com/latest,2026-04-01T07:21:27+00:00
NDTV,34,Education News India,https://www.ndtv.com/education,2026-04-01T07:21:27+00:00
NDTV,35,Latest Business News,https://www.ndtv.com/business-news,2026-04-01T07:21:27+00:00
NDTV,36,US Israel Iran War LIVE News,https://www.ndtv.com/world-news/us-israel-iran-war-live-updates-pakistan-to-hold-regional-meeting-on-ending-iran-war-middle-east-conflict-saudi-arabia-turkey-egypt-strait-of-hormuz-11281097,2026-04-01T07:21:27+00:00
NDTV,37,Stock Market LIVE Updates,https://www.ndtv.com/india-news/sensex-today-stock-market-live-updates-nifty-share-market-gift-nifty-signals-positive-opening-after-dow-rally-april-1-11294223,2026-04-01T07:21:27+00:00
