source,rank,headline,link,collected_at_iso
Indian Express,1,Trending in India,https://indianexpress.com/section/trending/trending-in-india/,2026-04-12T02:36:03+00:00
Indian Express,2,This is Serious,https://indianexpress.com/section/trending/this-is-serious/,2026-04-12T02:36:03+00:00
Indian Express,3,Most Valuable Banks in India in 2026,https://indianexpress.com/article/trending/top-10-listing/top-10-most-valuable-banks-in-india-in-2026-10631398/,2026-04-12T02:36:03+00:00
Indian Express,4,Shantanu Naidu viral video,https://indianexpress.com/article/trending/trending-in-india/shantanu-naidu-viral-video-horse-cruelty-indian-weddings-baraat-10631327/,2026-04-12T02:36:03+00:00
Indian Express,5,Ichiro Suzuki statue broken bay,https://indianexpress.com/article/trending/trending-globally/watch-ichiro-suzuki-statue-reveal-broken-bat-seattle-mariners-video-10631296/,2026-04-12T02:36:03+00:00
Indian Express,6,Gen Z work culture,https://indianexpress.com/article/trending/trending-in-india/gen-z-work-culture-linkedin-post-workplace-boundaries-debate-overtime-pay-burnout-10631091/,2026-04-12T02:36:03+00:00
Indian Express,7,Kunal Kamra apology row,https://indianexpress.com/article/trending/trending-in-india/kunal-kamra-refuses-apology-maharashtra-privileges-committee-eknath-shinde-parody-song-10630923/,2026-04-12T02:36:03+00:00
Indian Express,8,Bangkok to India flight dirty video,https://indianexpress.com/article/trending/trending-in-india/bangkok-india-flight-dirty-video-indian-passenger-civic-sense-10630788/,2026-04-12T02:36:03+00:00
Indian Express,9,Top 10 most valuable power companies in the world,https://indianexpress.com/article/trending/top-10-listing/top-10-most-valuable-power-companies-in-the-world-2026-10629824/,2026-04-12T02:36:03+00:00
Indian Express,10,Kerala voting controversy,https://indianexpress.com/article/trending/trending-in-india/kerala-voting-controversy-thrissur-woman-bandaged-finger-indelible-ink-row-10629778/,2026-04-12T02:36:03+00:00
Indian Express,11,Gurgaon founder firing employee,https://indianexpress.com/article/trending/trending-in-india/gurgaon-founder-fires-employee-over-text-no-notice-period-startup-work-culture-debate-10629584/,2026-04-12T02:36:03+00:00
Indian Express,12,Sanju Samson gifts phone to fan,https://indianexpress.com/article/trending/trending-in-india/sanju-samson-gifts-new-phone-fan-palakkad-kerala-ipl-2026-csk-10629238/,2026-04-12T02:36:03+00:00
Indian Express,13,Anant Ambani birthday,https://indianexpress.com/article/trending/trending-in-india/anant-ambani-31st-birthday-bandra-worli-sea-link-tribute-viral-video-10629005/,2026-04-12T02:36:03+00:00
Indian Express,14,Top 10 export countries in the world,https://indianexpress.com/article/trending/top-10-listing/top-10-export-countries-in-the-world-2025-26-10628094/,2026-04-12T02:36:03+00:00
Indian Express,15,KitKat chocolate heist,https://indianexpress.com/article/trending/trending-globally/kitkat-canada-chocolate-heist-convoy-security-viral-video-10628022/,2026-04-12T02:36:03+00:00
Indian Express,16,Narmada River milk ritual video,https://indianexpress.com/article/trending/trending-in-india/11000-litres-milk-poured-narmada-river-video-viral-religious-ritual-outrage-10627861/,2026-04-12T02:36:03+00:00
Indian Express,17,Hachiko Statue Tokyo viral video,https://indianexpress.com/article/trending/trending-globally/viral-video-tokyo-hachiko-statue-indian-tourists-queue-jumping-social-media-backlash-civic-sense-10627605/,2026-04-12T02:36:03+00:00
Indian Express,18,deaf Uber driver blind passenger,https://indianexpress.com/article/trending/trending-in-india/blind-passenger-deaf-uber-driver-viral-linkedin-post-aishwarya-pillai-10627371/,2026-04-12T02:36:03+00:00
Indian Express,19,Chennai company Audi cars employees,https://indianexpress.com/article/trending/trending-in-india/chennai-firm-handed-over-12-luxury-audi-cars-to-its-employees-10627247/,2026-04-12T02:36:03+00:00
Indian Express,20,Nepal viral video Indian tourists spitting,https://indianexpress.com/article/trending/trending-in-india/nepal-man-confronts-indian-tourists-spitting-clean-road-civic-sense-viral-video-10627172/,2026-04-12T02:36:03+00:00
Indian Express,21,The dog got trapped when the river’s water level suddenly increased,https://indianexpress.com/article/trending/trending-in-india/heroic-rafter-brave-gangas-rising-currents-to-save-dog-stranded-on-rock-viral-video-10626991/,2026-04-12T02:36:03+00:00
Indian Express,22,Gulmarg littering video,https://indianexpress.com/article/trending/trending-in-india/film-crew-sparks-fury-after-leaving-piles-of-trash-in-gulmarg-pristine-snow-10626390/,2026-04-12T02:36:03+00:00
Indian Express,23,Techie with backlog cracks FAANG offers,https://indianexpress.com/article/trending/trending-in-india/indian-techie-explains-how-he-landed-google-meta-offers-after-failing-in-college-exam-10626372/,2026-04-12T02:36:03+00:00
Indian Express,24,Phoebe Gates faces backlash over influencer pay dispute,https://indianexpress.com/article/trending/trending-globally/bill-gates-daughter-phoebe-gates-influencer-controversy-pay-dispute-10625524/,2026-04-12T02:36:03+00:00
Indian Express,25,Sridhar Vembu post,https://indianexpress.com/article/trending/trending-in-india/zoho-sridhar-vembu-urges-reverse-migration-to-villages-time-to-go-back-viral-post-10624899/,2026-04-12T02:36:03+00:00
Indian Express,26,Top 10 Countries to Live in the World in 2026,https://indianexpress.com/article/trending/top-10-listing/top-10-best-countries-to-live-in-the-world-in-2026-10624090/,2026-04-12T02:36:03+00:00
Indian Express,27,Nutella jar in space Artemis II livestream,https://indianexpress.com/article/trending/trending-globally/nutella-jar-viral-video-nasa-artemis-2-moon-mission-product-placement-10624062/,2026-04-12T02:36:03+00:00
LiveMint,1,Dallas Cowboys safety Markquese Bell arrested on felony drug charge,https://www.livemint.com/us/trending/markquese-bell-arrested-on-felony-drug-charge-and-marijuana-possession-dallas-cowboys-safety-11775932691814.html,2026-04-12T02:36:03+00:00
LiveMint,2,Coachella 2026 kicks off with Sabrina Carpenter's performance,https://www.livemint.com/us/trending/coachella-2026-kicks-off-with-sabrina-carpenters-performance-from-justin-bieber-to-karol-g-check-weekend-schedule-11775875804562.html,2026-04-12T02:36:03+00:00
LiveMint,3,Apple Pay scam spreading fast in the US—Are you at risk?,https://www.livemint.com/us/trending/apple-pay-users-hit-by-scam-wave-across-the-us-here-s-how-victims-are-losing-their-money-11775768345740.html,2026-04-12T02:36:03+00:00
LiveMint,4,Afrika Bambaataa death: Hip-hop pioneer-DJ dies at 67 after cancer complications,https://www.livemint.com/us/trending/afrika-bambaataa-death-hip-hop-pioneer-and-dj-dies-at-67-after-cancer-complications-11775767596687.html,2026-04-12T02:36:03+00:00
LiveMint,5,"DOJ antitrust probe into NFL media rights: What it means for streaming, and more",https://www.livemint.com/us/trending/doj-antitrust-probe-into-nfl-media-rights-what-it-means-for-fans-streaming-and-tv-deals-11775760586179.html,2026-04-12T02:36:03+00:00
LiveMint,6,"Daniil Medvedev smashes racquet in shocking 6-0, 6-0 loss at Monte Carlo Masters",https://www.livemint.com/us/trending/daniil-medvedev-racquet-video-in-shocking-6-0-6-0-clay-defeat-to-matteo-berrettini-at-monte-carlo-masters-11775674478886.html,2026-04-12T02:36:03+00:00
LiveMint,7,"Konnor Griffin signs 9-year, $140 million contract extension with Pirates",https://www.livemint.com/us/trending/konnor-griffin-signs-record-9-year-140-million-contract-extension-with-pittsburgh-pirates-mlb-baseball-11775653782727.html,2026-04-12T02:36:03+00:00
LiveMint,8,JD Vance’s awkward moment: Trump sends call to voicemail during live rally,https://www.livemint.com/us/trending/jd-vance-s-awkward-moment-trump-sends-call-to-voicemail-during-live-rally-in-hungary-watch-11775589348677.html,2026-04-12T02:36:03+00:00
LiveMint,9,"Islanders fire Patrick Roy, hire Peter DeBoer as head coach amid playoff push",https://www.livemint.com/us/trending/patrick-roy-fired-by-new-york-islanders-hire-peter-deboer-as-head-coach-amid-playoff-push-nhl-hockey-11775415170584.html,2026-04-12T02:36:03+00:00
LiveMint,10,Geno Auriemma apologizes to South Carolina after outburst in women's Final Four,https://www.livemint.com/us/trending/geno-auriemma-apologizes-to-south-carolina-after-emotional-outburst-vs-dawn-staley-in-womens-final-four-11775394255637.html,2026-04-12T02:36:03+00:00
LiveMint,11,NCAA Final Four 2026: UConn vs Illinois and Michigan vs Arizona results,https://www.livemint.com/us/trending/ncaa-final-four-2026-results-what-happened-in-uconn-vs-illinois-and-michigan-vs-arizona-march-madness-semifinals-11775390782036.html,2026-04-12T02:36:03+00:00
LiveMint,12,NASA’s Artemis II astronauts face toilet problem; social media reacts with memes,https://www.livemint.com/us/trending/nasas-artemis-ii-astronauts-faces-toilet-problem-in-space-social-media-reacts-with-jokes-memes-blame-ice-for-this-to-11775363905958.html,2026-04-12T02:36:03+00:00
LiveMint,13,Man City thrash Liverpool 4-0 while Chelsea crush Port Vale 7-0 in FA Cup QFs,https://www.livemint.com/us/trending/manchester-city-vs-liverpool-4-0-chelsea-vs-port-vale-7-0-fa-cup-quarterfinals-11775328419465.html,2026-04-12T02:36:03+00:00
LiveMint,14,Juan Soto calf injury: Mets star to undergo MRI after early exit vs Giants,https://www.livemint.com/us/trending/juan-soto-calf-injury-new-york-mets-star-to-undergo-mri-after-early-exit-vs-san-francisco-giants-11775306968287.html,2026-04-12T02:36:03+00:00
LiveMint,15,New York teacher earning $90K turns to $55/hour side gig to repay student loans,https://www.livemint.com/us/trending/new-york-teacher-earning-90k-turns-to-55-hour-side-gig-to-repay-student-loans-11775314789062.html,2026-04-12T02:36:03+00:00
LiveMint,16,NCAA men's Final Four matchups: Schedule and key details,https://www.livemint.com/us/trending/uconn-vs-illinois-and-arizona-vs-michigan-2026-ncaa-mens-final-four-matchups-schedule-and-key-details-11775243799182.html,2026-04-12T02:36:03+00:00
LiveMint,17,Gennaro Gattuso steps down as Italy manager after 2026 World Cup qualifier,https://www.livemint.com/us/trending/gennaro-gattuso-steps-down-as-italy-manager-after-2026-world-cup-qualifier-heartbreak-11775221292115.html,2026-04-12T02:36:03+00:00
LiveMint,18,"Vanessa Trump frustrated with Tiger Woods’ behavior, puts him on notice",https://www.livemint.com/us/trending/vanessa-trump-frustrated-with-tiger-woods-behavior-puts-him-on-notice-stop-acting-like-a-teenager-grow-up-11775209989597.html,2026-04-12T02:36:03+00:00
LiveMint,19,What’s wrong with Tiger Woods? ‘Heartbreaking’ video leaves fans worried,https://www.livemint.com/us/trending/whats-wrong-with-tiger-woods-heartbreaking-video-after-dui-arrest-leaves-fans-worried-mental-health-is-real-11775191311157.html,2026-04-12T02:36:03+00:00
LiveMint,20,McDonald's drops new under $3 menu and $4 breakfast deal — Here’s what you get,https://www.livemint.com/us/trending/mcdonalds-drops-new-under-3-menu-and-4-breakfast-deal-here-s-what-you-can-get-11775157327207.html,2026-04-12T02:36:03+00:00
LiveMint,21,Rapper J. Cole joins China’s Nanjing Monkey Kings for pro basketball stint,https://www.livemint.com/us/trending/grammywinning-rapper-j-cole-joins-china-s-nanjing-monkey-kings-for-pro-basketball-stint-11775141367888.html,2026-04-12T02:36:03+00:00
LiveMint,22,April Fools’ Day 2026 deals: No-joke discounts from Dunkin' and more,https://www.livemint.com/us/trending/april-fools-day-2026-discounts-dunkin-checkers-rally-hooters-qdoba-artemis-ii-doughnut-11775054510320.html,2026-04-12T02:36:03+00:00
LiveMint,23,"Oracle employee, despite being laid off, remains positive: ‘It happens…'",https://www.livemint.com/us/trending/oracle-employee-despite-being-laid-off-remains-positive-it-happens-will-enjoy-sleeping-11775051244639.html,2026-04-12T02:36:03+00:00
LiveMint,24,Warren Buffett teams up with NBA star Stephen Curry for charity lunch auction,https://www.livemint.com/us/trending/warren-buffett-teams-up-with-nba-star-stephen-curry-for-charity-lunch-auction-berkshire-event-returns-in-2026-11774962320767.html,2026-04-12T02:36:03+00:00
LiveMint,25,Tiger Woods’ ex Kristin Smith breaks silence after ‘triggering’ DUI arrest,https://www.livemint.com/us/trending/tiger-woods-ex-kristin-smith-breaks-silence-after-triggering-dui-arrest-seeks-privacy-11774949316320.html,2026-04-12T02:36:03+00:00
LiveMint,26,"Sophie Turner injured, Tomb Raider series halts production temporarily",https://www.livemint.com/us/trending/sophie-turner-injured-tomb-raider-series-halts-production-temporarily-11774878671976.html,2026-04-12T02:36:03+00:00
LiveMint,27,Viral video of Kash Patel dancing? Here’s the truth behind the clip,https://www.livemint.com/us/trending/viral-video-of-kash-patel-dancing-here-s-the-truth-behind-the-clip-11774814955782.html,2026-04-12T02:36:03+00:00
LiveMint,28,"Arnold Schwarzenegger returns to gym—But this time, he’s coaching his son |Watch",https://www.livemint.com/us/trending/arnold-schwarzenegger-returns-to-gym-but-this-time-he-s-coaching-his-son-to-bodybuilding-glory-watch-11774816425352.html,2026-04-12T02:36:03+00:00
LiveMint,29,"Bachelorette star James McCoy Taylor arrested again, months after guilty plea",https://www.livemint.com/us/trending/bachelorette-star-james-mccoy-taylor-arrested-again-months-after-guilty-plea-11774189913536.html,2026-04-12T02:36:03+00:00
LiveMint,30,Comedian jokes about Jews’ expulsion: Social media reacts to viral video,https://www.livemint.com/us/trending/comedian-jokes-about-jews-expulsion-social-media-reacts-to-viral-video-using-antisemitic-talking-points-as-humor-11773998180773.html,2026-04-12T02:36:03+00:00
LiveMint,31,Who is Joseph Duggar? All about reality TV star arrested on abuse charges,https://www.livemint.com/us/trending/who-is-joseph-duggar-all-about-the-19-kids-and-counting-star-arrested-on-abuse-charges-11773894381944.html,2026-04-12T02:36:03+00:00
LiveMint,32,"St Patrick’s Day 2026: Date, history, meaning and traditions worldwide",https://www.livemint.com/us/trending/st-patrick-s-day-2026-date-history-meaning-and-traditions-worldwide-11773760629096.html,2026-04-12T02:36:03+00:00
LiveMint,33,Oscars 2026: What’s on the menu at official after-party for Hollywood A-listers?,https://www.livemint.com/us/trending/oscars-2026-what-s-on-the-menu-at-the-official-after-party-luxurious-food-desserts-and-drinks-for-hollywood-alisters-11773548247036.html,2026-04-12T02:36:03+00:00
LiveMint,34,"Meghan Markle: Harry’s wife faces backlash over $2,235 ticket for group photo",https://www.livemint.com/us/trending/meghan-markle-harry-s-wife-faces-backlash-over-2-235-vip-ticket-for-group-photo-she-s-a-nobody-who-tricked-a-prince-11773538916724.html,2026-04-12T02:36:03+00:00
LiveMint,35,Apple kicks off 50th anniversary with surprise performance by Alicia Keys in NY,https://www.livemint.com/us/trending/alicia-keys-turns-apples-grand-central-in-new-york-into-a-concert-venue-at-tech-giant-s-50th-anniversary-kickoff-11773508129097.html,2026-04-12T02:36:03+00:00
LiveMint,36,"Marco Rubio large shoe size stuns Internet, social media points to ‘sycophancy'",https://www.livemint.com/us/trending/marco-rubio-large-shoe-size-stuns-internet-social-media-points-to-sycophancy-idol-worship-among-trump-officials-11773470692943.html,2026-04-12T02:36:03+00:00
LiveMint,37,Was Bill Clinton about to push Hillary into running traffic? Watch viral video,https://www.livemint.com/us/trending/did-bill-clinton-almost-push-hillary-into-running-traffic-social-media-reacts-to-viral-video-hes-was-so-close-11773280988605.html,2026-04-12T02:36:03+00:00
LiveMint,38,"Dr Dre net worth: Inside his earnings, brands, cars and real estate",https://www.livemint.com/us/trending/dr-dre-net-worth-how-did-the-new-billionaire-make-his-fortune-inside-his-earnings-cars-mansions-and-brands-11773167989493.html,2026-04-12T02:36:03+00:00
LiveMint,39,Nike launches Air Jordan 4 Retro ‘Imperial Purple’ sneakers: Details,https://www.livemint.com/us/trending/nike-launches-air-jordan-4-retro-imperial-purple-sneakers-how-much-do-they-cost-where-to-buy-online-11772907741201.html,2026-04-12T02:36:03+00:00
LiveMint,40,Mark to Market,https://www.livemint.com/market/mark-to-market,2026-04-12T02:36:03+00:00
LiveMint,41,"Q4 results FY26, US-Iran war to crude oil prices: Top five triggers that may dictate the Indian stock market this week",https://www.livemint.com/market/stock-market-news/q4-results-fy26-us-iran-war-to-crude-oil-prices-top-five-triggers-that-may-dictate-the-indian-stock-market-this-week-11775959681097.html,2026-04-12T02:36:03+00:00
LiveMint,42,The ‘real’ oil price is a lot higher than it looks,https://www.livemint.com/market/commodities/the-real-oil-price-is-a-lot-higher-than-it-looks-11775958035658.html,2026-04-12T02:36:03+00:00
LiveMint,43,"Stock market holiday: NSE, BSE to remain closed on this date next week; here's why",https://www.livemint.com/market/stock-market-news/stock-market-holiday-nse-bse-to-remain-closed-on-this-date-next-week-heres-why-11775902145011.html,2026-04-12T02:36:03+00:00
LiveMint,44,"Silver rate today, 11 April: Why you should buy the dip in white metal? Explained",https://www.livemint.com/market/commodities/silver-rate-today-11-april-why-you-should-buy-the-dip-explained-with-crude-oil-us-iran-war-us-fed-rate-cut-11775897222671.html,2026-04-12T02:36:03+00:00
LiveMint,45,Buy or sell: Sumeet Bagadia recommends three stocks to buy on Monday — 13 April 2026,https://www.livemint.com/market/stock-market-news/buy-or-sell-sumeet-bagadia-recommends-three-stocks-to-buy-on-monday-13-april-2026-11775891637752.html,2026-04-12T02:36:03+00:00
LiveMint,46,Why will climbing 25K not be easy for the Nifty 50 index? Explained with 5 reasons,https://www.livemint.com/market/stock-market-news/why-will-climbing-25k-not-be-easy-for-the-nifty-50-explained-with-5-reasons-11775888003734.html,2026-04-12T02:36:03+00:00
LiveMint,47,"LPG cylinder price on April 12: Check domestic and commercial gas rates in Delhi, Bengaluru, Mumbai, Kolkata today",https://www.livemint.com/news/india/lpg-cylinder-price-on-april-12-check-domestic-and-commercial-gas-rates-in-delhi-bengaluru-mumbai-kolkata-today-11775955845029.html,2026-04-12T02:36:03+00:00
LiveMint,48,"Katihar accident: At least 10 killed, dozens injured, ex-gratia announced by CMO, PM Modi — latest updates",https://www.livemint.com/news/india/katihar-accident-at-least-10-killed-dozens-injured-ex-gratia-announced-by-cmo-pm-modi-latest-updates-11775959382154.html,2026-04-12T02:36:03+00:00
LiveMint,49,Quote of the Day by Franz Kafka: ‘Guilt is never to be doubted’,https://www.livemint.com/news/us-news/quote-of-the-day-by-franz-kafka-guilt-is-never-to-be-doubted-11775956785467.html,2026-04-12T02:36:03+00:00
LiveMint,50,"Weather forecast today: IMD warns of 6-8°C spike in mercury, fresh Western Disturbance to bring rains from 15 April",https://www.livemint.com/news/india/weather-forecast-today-imd-warns-of-6-8-c-spike-in-mercury-fresh-western-disturbance-to-bring-rains-from-15-april-11775955296478.html,2026-04-12T02:36:03+00:00
LiveMint,51,Trump warns China of ‘big problems’ over reports of arms supply to Iran amid fragile ceasefire,https://www.livemint.com/news/world/trump-warns-china-of-big-problems-over-reports-of-arms-supply-to-iran-amid-fragile-ceasefire-11775953130524.html,2026-04-12T02:36:03+00:00
LiveMint,52,Have Iran & US concluded ceasefire talks in Pakistan? 15 hours and counting- What each side said,https://www.livemint.com/news/world/have-iran-and-us-concluded-ceasefire-talks-in-pakistan-15-hours-and-counting-what-each-side-said-11775951159392.html,2026-04-12T02:36:03+00:00
LiveMint,53,Salary Impact Tracker,https://www.livemint.com/tools-calculators/salary-impact-tracker,2026-04-12T02:36:03+00:00
LiveMint,54,How Oracle’s huge AI build-out is causing a cash crunch and layoffs,https://www.livemint.com/companies/news/oracle-layoffs-india-oracle-job-cuts-11775824138456.html,2026-04-12T02:36:03+00:00
LiveMint,55,Pilots' union calls for 48-hour strike at Lufthansa starting April 13,https://www.livemint.com/companies/news/pilots-union-calls-for-48-hour-strike-at-lufthansa-starting-april-13-11775923360776.html,2026-04-12T02:36:03+00:00
LiveMint,56,IBM to pay $17 million as settlement linked to anti-DEI probe — What was the tech major accused of?,https://www.livemint.com/companies/news/ibm-to-pay-17-million-as-settlement-linked-to-anti-dei-probe-what-was-the-tech-major-accused-of-11775878822522.html,2026-04-12T02:36:03+00:00
LiveMint,57,Kalshi wins reprieve from Arizona criminal case at CFTC’s urging,https://www.livemint.com/companies/news/kalshi-wins-reprieve-from-arizona-criminal-case-at-cftc-s-urging-11775878025828.html,2026-04-12T02:36:03+00:00
LiveMint,58,"Sam Altman's home hit by Molotov cocktail, OpenAI CEO shares rare family photo in first reaction — ‘We try to be…’",https://www.livemint.com/companies/people/sam-altmans-home-hit-by-molotov-cocktail-openai-ceo-shares-rare-family-photo-in-first-reaction-we-try-to-be-11775872359338.html,2026-04-12T02:36:03+00:00
LiveMint,59,RBI proposals for large NBFCs leaves Tata Sons as only unlisted one,https://www.livemint.com/companies/rbi-proposes-changes-to-nbfc-norms-upper-layer-list-not-revealed-yet-11775816636625.html,2026-04-12T02:36:03+00:00
LiveMint,60,Ask Mint Money,https://www.livemint.com/money/ask-mint-money,2026-04-12T02:36:03+00:00
LiveMint,61,Margin trading is growing fast. The risk is growing faster.,https://www.livemint.com/money/personal-finance/margin-trading-is-growing-fast-the-risk-is-growing-faster-11775898653526.html,2026-04-12T02:36:03+00:00
LiveMint,62,Why gold has not played its safe-haven role amid West Asia war,https://www.livemint.com/money/personal-finance/gold-west-asia-war-gold-etf-us-fed-rate-cuts-treasury-yields-crude-oil-prices-inflation-dollar-11775831305545.html,2026-04-12T02:36:03+00:00
LiveMint,63,"Bank FDs vs small savings schemes: Compare PPF, NSC, Sukanya Samriddhi and fixed deposit interest rates this year",https://www.livemint.com/money/personal-finance/bank-fd-small-savings-schemes-compare-ppf-nsc-sukanya-samriddhi-kisan-vikas-patra-fixed-deposit-interest-rates-year-2026-11775928366678.html,2026-04-12T02:36:03+00:00
LiveMint,64,"Provident Fund: Here's a stepwise guide for online and offline PF withdrawal, types, limits and rules",https://www.livemint.com/money/personal-finance/provident-fund-epfo-stepwise-guide-online-offline-pf-withdrawal-complete-partial-limits-rules-retirement-salary-pension-11775922064931.html,2026-04-12T02:36:03+00:00
LiveMint,65,"8th Pay Commission: FAQs about the fitment factor, likely salary hikes, payout for arrears and other details",https://www.livemint.com/money/personal-finance/8th-pay-commission-faqs-fitment-factor-salary-hikes-payout-arrears-timeline-implementation-govt-employees-and-pensioners-11775909765926.html,2026-04-12T02:36:03+00:00
LiveMint,66,Can you reverse wrong UPI transactions? Key things you must know if you send money to incorrect UPI ID,https://www.livemint.com/money/personal-finance/can-you-reverse-wrong-upi-transactions-key-things-you-must-know-if-you-send-money-to-incorrect-upi-id-11775906769409.html,2026-04-12T02:36:03+00:00
LiveMint,67,Anthropic brings Claude AI to Microsoft Word so you can chat with your documents,https://www.livemint.com/technology/tech-news/anthropic-brings-claude-ai-to-microsoft-word-so-you-can-chat-with-your-documents-11775892419940.html,2026-04-12T02:36:03+00:00
LiveMint,68,"Anthropic blocks OpenClaw's founder from accessing Claude AI, reverses decision in hours",https://www.livemint.com/technology/tech-news/anthropic-blocks-openclaws-founder-from-accessing-claude-ai-reverses-decision-in-hours-11775888501493.html,2026-04-12T02:36:03+00:00
LiveMint,69,Elon Musk's X is finally cracking down on engagement farming with big overhaul to its monetization program,https://www.livemint.com/technology/tech-news/elon-musks-x-is-finally-cracking-down-on-engagement-farming-with-big-overhaul-to-its-monetization-program-11775876168952.html,2026-04-12T02:36:03+00:00
LiveMint,70,"Pixel users report phones freezing on startup screen after latest Google update, company responds",https://www.livemint.com/technology/tech-news/pixel-users-report-phones-freezing-on-startup-screen-after-latest-google-update-company-responds-11775875036837.html,2026-04-12T02:36:03+00:00
LiveMint,71,"Mac users, update your ChatGPT app immediately: OpenAI issues urgent security warning",https://www.livemint.com/technology/tech-news/openai-says-it-faced-a-security-issue-forces-mandatory-update-for-all-mac-users-to-block-fake-chatgpt-apps-11775873495758.html,2026-04-12T02:36:03+00:00
LiveMint,72,"Vijay Sales Apple Days: Check out top offers on iPhone 17 Pro Max, iPhone 17, iPhone 16 and more",https://www.livemint.com/technology/tech-news/vijay-sales-apple-days-check-out-top-offers-on-iphone-17-pro-max-iphone-17-iphone-16-and-more-11775868830097.html,2026-04-12T02:36:03+00:00
LiveMint,73,IPL 2026 Schedule,https://www.livemint.com/sports/cricket-news/ipl-schedule,2026-04-12T02:36:03+00:00
LiveMint,74,Orange Cap in IPL 2026,https://www.livemint.com/sports/cricket-news/ipl-orange-cap,2026-04-12T02:36:03+00:00
LiveMint,75,Purple Cap in IPL 2026,https://www.livemint.com/sports/cricket-news/ipl-purple-cap,2026-04-12T02:36:03+00:00
LiveMint,76,IPL 2026 Points Table,https://www.livemint.com/sports/cricket-news/ipl-points-table,2026-04-12T02:36:03+00:00
LiveMint,77,IFSC Code Finder,https://www.livemint.com/ifsc-code,2026-04-12T02:36:03+00:00
LiveMint,78,Income Tax Calculator,https://www.livemint.com/tools-calculators/income-tax-calculator,2026-04-12T02:36:03+00:00
LiveMint,79,Gold Rate Today,https://www.livemint.com/gold-prices,2026-04-12T02:36:03+00:00
