source,rank,headline,link,collected_at_iso
TOI ETimes,107,"After Lenskart row, IndiGo under fire! Grooming policy sparks massive ‘tilak vs rules’ debate online - Airline responds",https://timesofindia.indiatimes.com/articleshow/130508243.cms,2026-04-29T02:52:55+00:00
TOI ETimes,108,"As Virat Kohli shines on the field, all eyes turn to Anushka Sharma at RCB match - what was the tiny black gadget in her hand?",https://timesofindia.indiatimes.com/articleshow/130502852.cms,2026-04-29T02:52:55+00:00
TOI ETimes,109,“I was just trying to protect my wife”: How a British man’s complaint about wife’s harassment at a luxury Doha hotel led to 5‑year Qatar ban,https://timesofindia.indiatimes.com/articleshow/130502537.cms,2026-04-29T02:52:55+00:00
TOI ETimes,110,"₹90,000 expenditure a month in Gurgaon, and he doesn’t even party: This young professional breaks down his surprising monthly expenses",https://timesofindia.indiatimes.com/articleshow/130500590.cms,2026-04-29T02:52:55+00:00
TOI ETimes,111,Meet Linh Mai: The adorable Asian elephant calf that has become Washington’s newest star,https://timesofindia.indiatimes.com/articleshow/130500343.cms,2026-04-29T02:52:55+00:00
TOI ETimes,112,The 9/11 story when 38 planes landed in a small Canadian town and those passengers now fund million-dollar scholarships for local students,https://timesofindia.indiatimes.com/articleshow/130499431.cms,2026-04-29T02:52:55+00:00
TOI ETimes,113,What is Project Him Sarovar in Ladakh that will turn seasonal floods into stable water security for the year,https://timesofindia.indiatimes.com/articleshow/130498127.cms,2026-04-29T02:52:55+00:00
TOI ETimes,114,British mum heads to a Swiss clinic to end her life after her only son’s death,https://timesofindia.indiatimes.com/articleshow/130492746.cms,2026-04-29T02:52:55+00:00
TOI ETimes,115,'Why’d you all leave to come here?': MAGA influencer Kaylee Campbell's remark supporting Trump's anti-India rant faces massive flak online,https://timesofindia.indiatimes.com/articleshow/130491808.cms,2026-04-29T02:52:55+00:00
TOI ETimes,116,‘I’m not going to eat this…’ Arjun Tendulkar refuses cake on Sachin Tendulkar’s 53rd birthday – reason shocks fans,https://timesofindia.indiatimes.com/articleshow/130488897.cms,2026-04-29T02:52:55+00:00
TOI ETimes,117,Why do charging cables keep breaking and how to make them last longer,https://timesofindia.indiatimes.com/articleshow/130487800.cms,2026-04-29T02:52:55+00:00
TOI ETimes,118,Sara Cox's net worth: How rich is the breakfast show's new host?,https://timesofindia.indiatimes.com/articleshow/130487087.cms,2026-04-29T02:52:55+00:00
TOI ETimes,119,"‘China, or India, or some other hell-hole…’ Who is Michael Savage, the controversial host whose comment was reposted by Donald Trump?",https://timesofindia.indiatimes.com/articleshow/130486649.cms,2026-04-29T02:52:55+00:00
TOI ETimes,120,"Kraken was real and devoured dinosaurs? School-bus-sized giant octopus ruled ancient seas, new fossil discovery confirms",https://timesofindia.indiatimes.com/articleshow/130483329.cms,2026-04-29T02:52:55+00:00
TOI ETimes,121,"'Just a big heart…' Mumbai man finds sick community dog, takes it on his bicycle for treatment; internet in tears",https://timesofindia.indiatimes.com/articleshow/130484037.cms,2026-04-29T02:52:55+00:00
TOI ETimes,122,"'Mother worked as public school teacher, father as engineer': Indian-origin US Rep Ami Bera reacts to Trump's anti-India rant on Truth Social",https://timesofindia.indiatimes.com/articleshow/130483094.cms,2026-04-29T02:52:55+00:00
TOI ETimes,123,"‘These people should have their hands and feet broken…’ Heavy rush at Kedarnath opening, netizens react strongly",https://timesofindia.indiatimes.com/articleshow/130482486.cms,2026-04-29T02:52:55+00:00
TOI ETimes,124,"Viral video claims 'alien- origin' Buga metallic sphere reacts to Sanskrit Mantras, gains weight, and has mysterious etchings in an unknown script- Truth or hoax?",https://timesofindia.indiatimes.com/articleshow/130477721.cms,2026-04-29T02:52:55+00:00
TOI ETimes,125,This ‘yellow watermelon’ gamble made an Odisha village rich in just 90 days - here’s how,https://timesofindia.indiatimes.com/articleshow/130476683.cms,2026-04-29T02:52:55+00:00
TOI ETimes,126,Who is Sasha Sobhani? The Iranian ‘Rich Kid’ going viral for his Ibiza jet lifestyle,https://timesofindia.indiatimes.com/articleshow/130474060.cms,2026-04-29T02:52:55+00:00
TOI ETimes,127,Lyrid meteor showers to streak across the sky: When and where to watch in India,https://timesofindia.indiatimes.com/articleshow/130472864.cms,2026-04-29T02:52:55+00:00
TOI ETimes,128,"Viral: Bali hotel catches Indian tourists carrying away hairdryer, doormat, bathrobes after checkout",https://timesofindia.indiatimes.com/articleshow/130466174.cms,2026-04-29T02:52:55+00:00
TOI ETimes,129,"Meet Antoine Moses: The athlete who planted 23,060 trees in just 24 hours, one every four seconds",https://timesofindia.indiatimes.com/articleshow/130466419.cms,2026-04-29T02:52:55+00:00
TOI ETimes,130,Woman walked away from a high-paying job – her reason is leaving the internet stunned,https://timesofindia.indiatimes.com/articleshow/130464213.cms,2026-04-29T02:52:55+00:00
TOI ETimes,131,‘Mass killing of ants?’ Viral video showing thousands being burned alive leaves internet disturbed and divided,https://timesofindia.indiatimes.com/articleshow/130462252.cms,2026-04-29T02:52:55+00:00
TOI ETimes,132,What surprised her in India? Foreigner’s solo trip reel with 5 observations sparks debate online,https://timesofindia.indiatimes.com/articleshow/130458935.cms,2026-04-29T02:52:55+00:00
TOI ETimes,133,"Chilling gym video: Man gets stuck under 165 kg barbell, what happens next is shocking",https://timesofindia.indiatimes.com/articleshow/130456826.cms,2026-04-29T02:52:55+00:00
TOI ETimes,134,"Techie sets Reddit on fire: Claims he secretly worked 2 jobs, made ₹70L a yr, bought ₹1.3 crore house without loan, then deletes his post",https://timesofindia.indiatimes.com/articleshow/130456168.cms,2026-04-29T02:52:55+00:00
TOI ETimes,135,"The Alice in Wonderland cave? How a group of teenagers found ancient treasure sealed for 17,000‑years in a cave!",https://timesofindia.indiatimes.com/articleshow/130449893.cms,2026-04-29T02:52:55+00:00
TOI ETimes,136,170‑year‑old Himalayan photographs and paintings will show you a landscape that no longer exists: When and where can you see them?,https://timesofindia.indiatimes.com/articleshow/130449037.cms,2026-04-29T02:52:55+00:00
TOI ETimes,137,A door of light and a staircase to heaven? Study reveals what you dream about in the final days before death,https://timesofindia.indiatimes.com/articleshow/130446301.cms,2026-04-29T02:52:55+00:00
TOI ETimes,138,Meet Kali: The guardian stray dog who died battling a venomous cobra to protect over 30 kindergarten children,https://timesofindia.indiatimes.com/articleshow/130444324.cms,2026-04-29T02:52:55+00:00
TOI ETimes,139,"Wait, what, plants can hear the sound of rain?",https://timesofindia.indiatimes.com/articleshow/130443295.cms,2026-04-29T02:52:55+00:00
TOI ETimes,140,No tickets needed: Abu Dhabi airport launches shopping pass for non-travellers who can come to just shop,https://timesofindia.indiatimes.com/articleshow/130441997.cms,2026-04-29T02:52:55+00:00
TOI ETimes,141,Why does Japan experience so many earthquakes and tsunamis? Know the science behind it,https://timesofindia.indiatimes.com/articleshow/130442559.cms,2026-04-29T02:52:55+00:00
TOI ETimes,142,'Don’t White people qualify?': Australians row over $5.5M ‘House of India’ project in Queensland,https://timesofindia.indiatimes.com/articleshow/130441695.cms,2026-04-29T02:52:55+00:00
TOI ETimes,143,World’s first virtual train lets elderly explore 10 countries without leaving their seats,https://timesofindia.indiatimes.com/articleshow/130441328.cms,2026-04-29T02:52:55+00:00
TOI ETimes,144,"Man buys Rs 12K Lenskart glasses, smashes them; controversy fuels debate",https://timesofindia.indiatimes.com/articleshow/130439010.cms,2026-04-29T02:52:55+00:00
TOI ETimes,145,Fairytale wedding? This bride's night ended With an ambulance and a viral video,https://timesofindia.indiatimes.com/articleshow/130438095.cms,2026-04-29T02:52:55+00:00
TOI ETimes,146,Who is Bang Si-hyuk? Man behind BTS now under police lens in $100 million fraud case,https://timesofindia.indiatimes.com/articleshow/130437865.cms,2026-04-29T02:52:55+00:00
TOI ETimes,147,"New Zealand MP calls Indian immigration 'butter chicken tsunami', faces massive flak online",https://timesofindia.indiatimes.com/articleshow/130436972.cms,2026-04-29T02:52:55+00:00
TOI ETimes,148,'Demon boss': Meghan Markle's former employees reveal the shocking way she treats her team,https://timesofindia.indiatimes.com/articleshow/130436058.cms,2026-04-29T02:52:55+00:00
TOI ETimes,149,Viral video: Dog found peacefully sleeping inside the UK Parliament,https://timesofindia.indiatimes.com/articleshow/130434571.cms,2026-04-29T02:52:55+00:00
TOI ETimes,150,Kindergarten fee hits Rs 2.2 lakh? Viral post sparks debate on rising school costs,https://timesofindia.indiatimes.com/articleshow/130434151.cms,2026-04-29T02:52:55+00:00
TOI ETimes,151,Are Indians taking over Cyprus? Viral video claims 'looking like Bombay'; raises debate online,https://timesofindia.indiatimes.com/articleshow/130433840.cms,2026-04-29T02:52:55+00:00
TOI ETimes,152,UK woman dies of 'traumatic neck injuries' suspected to have been caused by family dog,https://timesofindia.indiatimes.com/articleshow/130433320.cms,2026-04-29T02:52:55+00:00
TOI ETimes,153,"‘Emily Hart’ unmasked: Indian man used fake AI persona to con 'super dumb' MAGA fans, fund medical school",https://timesofindia.indiatimes.com/articleshow/130432330.cms,2026-04-29T02:52:55+00:00
TOI ETimes,154,"‘Ab nahi ho raha AC ke bina’: Bengaluru woman books hotel near home to beat heat, internet relates",https://timesofindia.indiatimes.com/articleshow/130431234.cms,2026-04-29T02:52:55+00:00
TOI ETimes,155,Shocking truth behind ‘silver’ offerings at Vaishno Devi Temple: Not just fake - potentially harmful,https://timesofindia.indiatimes.com/articleshow/130430776.cms,2026-04-29T02:52:55+00:00
TOI ETimes,156,Are floating ghost ships real? Why do ships appear to be floating above the ocean when viewed from a distance,https://timesofindia.indiatimes.com/articleshow/130422242.cms,2026-04-29T02:52:55+00:00
TOI ETimes,157,Who is Kanak Agrawal? IITian who left McKinsey job for the hills of Himachal and a soothing life,https://timesofindia.indiatimes.com/articleshow/130420481.cms,2026-04-29T02:52:55+00:00
TOI ETimes,158,"Haryana farmer’s ‘rainbow watermelons’ go viral: Meet Ram Pratap Sharma who's growing blue, gold and orange fruity delights",https://timesofindia.indiatimes.com/articleshow/130420192.cms,2026-04-29T02:52:55+00:00
TOI ETimes,159,"Who is Anjani Mishra, the retired Air Force officer who called out a troll for body-shaming her on social media",https://timesofindia.indiatimes.com/articleshow/130412189.cms,2026-04-29T02:52:55+00:00
TOI ETimes,160,Watch: Woman was posing underwater when a massive Whale Shark appeared right behind her,https://timesofindia.indiatimes.com/articleshow/130415328.cms,2026-04-29T02:52:55+00:00
TOI ETimes,161,"36,000 people quit Facebook for six weeks: Researchers reveal how deeply their lives were affected",https://timesofindia.indiatimes.com/articleshow/130415590.cms,2026-04-29T02:52:55+00:00
TOI ETimes,162,"John Ternus net worth: How rich is Apple’s next CEO, set to replace Tim Cook",https://timesofindia.indiatimes.com/articleshow/130415719.cms,2026-04-29T02:52:55+00:00
TOI ETimes,163,"Who is Aliya Korotkaya? The 22-year-old model linked to 71-year-old President of Belarus, Alexander Lukashenko",https://timesofindia.indiatimes.com/articleshow/130414931.cms,2026-04-29T02:52:55+00:00
TOI ETimes,164,Life as a South Korean in Chennai: Mum of two reveals why India stole her heart,https://timesofindia.indiatimes.com/articleshow/130412701.cms,2026-04-29T02:52:55+00:00
TOI ETimes,165,Meet John Ternus: Apple insider set to take over as CEO after Tim Cook,https://timesofindia.indiatimes.com/articleshow/130408322.cms,2026-04-29T02:52:55+00:00
TOI ETimes,166,"Robot dog with Elon Musk’s face spotted in public, viewers call it ‘bizarre’",https://timesofindia.indiatimes.com/articleshow/130406906.cms,2026-04-29T02:52:55+00:00
TOI ETimes,167,'Hurts even more than a breakup': Indian techie left jobless after Big 4 firm cancels offer post selection,https://timesofindia.indiatimes.com/articleshow/130400470.cms,2026-04-29T02:52:55+00:00
TOI ETimes,168,"Ritual site or marketplace? Peru’s bizarre 5,000-hole 'Serpent Mountain' just got a game-changing explanation",https://timesofindia.indiatimes.com/articleshow/130400034.cms,2026-04-29T02:52:55+00:00
TOI ETimes,169,Asia's longest uninterrupted river poisoned by arsenic - What is the reason behind the contamination?,https://timesofindia.indiatimes.com/articleshow/130398429.cms,2026-04-29T02:52:55+00:00
TOI ETimes,170,Viral video shows pilot pouring SODA on jet windshield: Genius hack or hoax?,https://timesofindia.indiatimes.com/articleshow/130395691.cms,2026-04-29T02:52:55+00:00
TOI ETimes,171,"'What kind of bhakti is this?’ Woman takes Lord Krishna idol for hair spa at salon, internet explodes",https://timesofindia.indiatimes.com/articleshow/130395517.cms,2026-04-29T02:52:55+00:00
TOI ETimes,172,"Who is Anshika Singh? The woman who ditched her Gurugram job ""that sucked the life out of..."" for slower Dehradun bliss",https://timesofindia.indiatimes.com/articleshow/130394154.cms,2026-04-29T02:52:55+00:00
TOI ETimes,173,Can’t keep doom-scrolling while eating? You are not welcome for dining!,https://timesofindia.indiatimes.com/articleshow/130392189.cms,2026-04-29T02:52:55+00:00
TOI ETimes,174,"Viral in India, questioned everywhere: Pakistani drama ‘Jahannum Ba'raasta Jannat’ sparks meme fest online for getting everything wrong",https://timesofindia.indiatimes.com/articleshow/130390632.cms,2026-04-29T02:52:55+00:00
TOI ETimes,175,Brock Lesnar’s net worth: Inside the WWE and UFC star’s fortune,https://timesofindia.indiatimes.com/articleshow/130388936.cms,2026-04-29T02:52:55+00:00
TOI ETimes,176,'Want my country back': MAGA reporter Sara Gonzales faces backlash for criticising Indian-origin kids playing in park,https://timesofindia.indiatimes.com/articleshow/130387655.cms,2026-04-29T02:52:55+00:00
TOI ETimes,177,Why whale vomit is worth millions to humans and you could be wearing it right now,https://timesofindia.indiatimes.com/articleshow/130386257.cms,2026-04-29T02:52:55+00:00
TOI ETimes,178,Who is Nidhi Mittal? Peyush Bansal’s wife at centre of Lenskart storm – here’s what we know,https://timesofindia.indiatimes.com/articleshow/130385866.cms,2026-04-29T02:52:55+00:00
TOI ETimes,179,Why did India import ice from the US for four decades? The frozen history of the 'ice king' who smashed the Indian markets,https://timesofindia.indiatimes.com/articleshow/130384290.cms,2026-04-29T02:52:55+00:00
TOI ETimes,180,Big bet or bold risk? IIT grad skipped ₹4 crore job to build AI startup now in focus,https://timesofindia.indiatimes.com/articleshow/130383843.cms,2026-04-29T02:52:55+00:00
TOI ETimes,181,Bengaluru man fixes pothole with a Porsche – but it’s the way he did it that’s raising questions,https://timesofindia.indiatimes.com/articleshow/130381736.cms,2026-04-29T02:52:55+00:00
TOI ETimes,182,Why we cry explained: Scientists reveal evolutionary secret hidden in tears,https://timesofindia.indiatimes.com/articleshow/130380699.cms,2026-04-29T02:52:55+00:00
TOI ETimes,183,British cyclist’s heartwarming encounter in India: A glass of buttermilk and the power of genuine hospitality,https://timesofindia.indiatimes.com/articleshow/130380150.cms,2026-04-29T02:52:55+00:00
TOI ETimes,184,How many times do you poop in a day? Your poop schedule might actually signal something for your body,https://timesofindia.indiatimes.com/articleshow/130371365.cms,2026-04-29T02:52:55+00:00
TOI ETimes,185,What is the washlet? The Japanese invention that could make toilet paper obsolete!,https://timesofindia.indiatimes.com/articleshow/130370807.cms,2026-04-29T02:52:55+00:00
TOI ETimes,186,"This “normal” farm was hiding 5,000-year-old graves all along -Archaeologists stunned",https://timesofindia.indiatimes.com/articleshow/130369192.cms,2026-04-29T02:52:55+00:00
TOI ETimes,187,Who is Daniel Kinahan? The alleged Irish drug boss arrested in Dubai,https://timesofindia.indiatimes.com/articleshow/130369006.cms,2026-04-29T02:52:55+00:00
TOI ETimes,188,"Meet the ‘Pink Fairy’, the world’s smallest mammal that’s making a surprisingly big impact",https://timesofindia.indiatimes.com/articleshow/130367837.cms,2026-04-29T02:52:55+00:00
TOI ETimes,189,"Who is Parvathy Krishna, and why is she trending over her viral face yoga controversy?",https://timesofindia.indiatimes.com/articleshow/130366933.cms,2026-04-29T02:52:55+00:00
TOI ETimes,190,"75+ Parshuram Jayanti Wishes 2026 Quotes, Images & Status Updates WhatsApp Messages to Share",https://timesofindia.indiatimes.com/articleshow/130365718.cms,2026-04-29T02:52:55+00:00
TOI ETimes,191,"Happy Akshaya Tritiya 2026: Best Messages, Quotes, Wishes and Images to share on Akshaya Tritiya",https://timesofindia.indiatimes.com/articleshow/130359788.cms,2026-04-29T02:52:55+00:00
TOI ETimes,192,Why are people smashing glasses on camera as ‘Boycott Lenskart’ trends,https://timesofindia.indiatimes.com/articleshow/130364410.cms,2026-04-29T02:52:55+00:00
TOI ETimes,193,"Happy Akshaya Tritiya 2026: 50+ Wishes, Messages, Quotes, Images, Facebook & WhatsApp status",https://timesofindia.indiatimes.com/articleshow/130355729.cms,2026-04-29T02:52:55+00:00
TOI ETimes,194,"'I lost my job because of ADHD…': Viral layoff story exposes corporate struggle, expert explains why this is more common in workplaces than thought",https://timesofindia.indiatimes.com/articleshow/130358382.cms,2026-04-29T02:52:55+00:00
TOI ETimes,195,Who is Shaila Khan? Pakistani YouTuber praised after viral clip shows her calling out man: “Don’t touch me without permission”,https://timesofindia.indiatimes.com/articleshow/130351330.cms,2026-04-29T02:52:55+00:00
TOI ETimes,196,"Lord Krishna's image with non-veg dish sparks row; Kerala eatery faces backlash, FIR filed",https://timesofindia.indiatimes.com/articleshow/130351143.cms,2026-04-29T02:52:55+00:00
TOI ETimes,197,“Who eats dates on Pongal?” “They got confused with Ramzan”: Lenskart under fire again as viral ad sparks backlash,https://timesofindia.indiatimes.com/articleshow/130350025.cms,2026-04-29T02:52:55+00:00
TOI ETimes,198,Watch: Cash rains from high-rise after woman throws bundles – police confirm it was real money,https://timesofindia.indiatimes.com/articleshow/130348711.cms,2026-04-29T02:52:55+00:00
TOI ETimes,199,“Strong girl”: Young specially-abled child reacts beautifully while watching other children play in front of her – netizens get emotional,https://timesofindia.indiatimes.com/articleshow/130347428.cms,2026-04-29T02:52:55+00:00
TOI ETimes,200,She claims to live in Mumbai on ₹18k budget with ₹11.5k rent! Woman's viral claim leaves the internet stunned,https://timesofindia.indiatimes.com/articleshow/130346661.cms,2026-04-29T02:52:55+00:00
TOI ETimes,201,Is supervolcano Yellowstone going to erupt anytime soon? New study analyses what's next,https://timesofindia.indiatimes.com/articleshow/130341367.cms,2026-04-29T02:52:55+00:00
TOI ETimes,202,"Who is Connor Esterhuizen, the player Gujarat Titans signed to replace Tom Banton and why is he trending?",https://timesofindia.indiatimes.com/articleshow/130341173.cms,2026-04-29T02:52:55+00:00
TOI ETimes,203,Have we lost compassion for the poor? Viral Hyderabad video shows guard wrapped in mosquito net to escape bites,https://timesofindia.indiatimes.com/articleshow/130340382.cms,2026-04-29T02:52:55+00:00
TOI ETimes,204,“Aap hote kaun ho?”: Influencer Kanika Sharma CLAPS BACK at trolls after her interfaith wedding sparks online storm,https://timesofindia.indiatimes.com/articleshow/130338078.cms,2026-04-29T02:52:55+00:00
TOI ETimes,205,Did the Artemis II astronauts see God?,https://timesofindia.indiatimes.com/articleshow/130337249.cms,2026-04-29T02:52:55+00:00
TOI ETimes,206,Magic diet and no steroids: Meet the Chennai construction worker who built ripped abs with 'simple food' and discipline,https://timesofindia.indiatimes.com/articleshow/130336214.cms,2026-04-29T02:52:55+00:00
TOI ETimes,207,"Viral video shows Rs. 50 chips sold for Rs. 100 at IPL match, internet asks, “Isn’t this a punishable offence """,https://timesofindia.indiatimes.com/articleshow/130335470.cms,2026-04-29T02:52:55+00:00
TOI ETimes,208,Another ‘zombie drug’ case or something more serious at play? This spine-chilling Maharashtra video is going viral,https://timesofindia.indiatimes.com/articleshow/130333317.cms,2026-04-29T02:52:55+00:00
TOI ETimes,209,Indian placements spoil us: Young Indian living in Paris reveals real reason why getting jobs in Europe is difficult,https://timesofindia.indiatimes.com/articleshow/130333108.cms,2026-04-29T02:52:55+00:00
TOI ETimes,210,Watch: Robot chases wild boars in viral video – but there’s a jaw-dropping twist,https://timesofindia.indiatimes.com/articleshow/130331686.cms,2026-04-29T02:52:55+00:00
TOI ETimes,211,Ghee Purity Check,https://timesofindia.indiatimes.com/articleshow/130544411.cms,2026-04-29T02:52:55+00:00
TOI ETimes,212,Sundar Pichai Quote,https://timesofindia.indiatimes.com/articleshow/130443249.cms,2026-04-29T02:52:55+00:00
TOI ETimes,213,Dacoit Box Office Collection,https://timesofindia.indiatimes.com/articleshow/130566649.cms,2026-04-29T02:52:55+00:00
TOI ETimes,214,Dhurandhar 2 Collection,https://timesofindia.indiatimes.com/articleshow/130481014.cms,2026-04-29T02:52:55+00:00
TOI ETimes,215,Elon Musk Vs Sam Altman,https://timesofindia.indiatimes.com/articleshow/130553142.cms,2026-04-29T02:52:55+00:00
TOI ETimes,216,Garena Free Fire Max Redeem Codes,https://timesofindia.indiatimes.com/articleshow/130568827.cms,2026-04-29T02:52:55+00:00
TOI ETimes,217,Microsoft Outlook Down,https://timesofindia.indiatimes.com/articleshow/130554099.cms,2026-04-29T02:52:55+00:00
TOI ETimes,218,Hazaribag man drowns while fishing in lake,https://timesofindia.indiatimes.com/articleshow/130060093.cms,2026-04-29T02:52:55+00:00
TOI ETimes,219,"""Behen Darr Gayi!"": Fans relive ‘Bhagam Bhag’ era after watching Akshay Kumar's 'Bhooth Bangla' trailer",https://timesofindia.indiatimes.com/articleshow/130060027.cms,2026-04-29T02:52:55+00:00
TOI ETimes,220,MBOSE HSLC result 2026 to release tomorrow: Check details here,https://timesofindia.indiatimes.com/articleshow/130059814.cms,2026-04-29T02:52:55+00:00
TOI ETimes,221,"Iran war risk: JPMorgan CEO Jamie Dimon warns of oil shocks, sticky inflation and higher interest rates",https://timesofindia.indiatimes.com/articleshow/130059993.cms,2026-04-29T02:52:55+00:00
TOI ETimes,222,Make your clutch last longer with these easy driving tips,https://timesofindia.indiatimes.com/articleshow/130052232.cms,2026-04-29T02:52:55+00:00
TOI ETimes,223,“Three-against-one situation”: El Rubius opens up on being “targeted” in MrBeast’s viral $1M challenge,https://timesofindia.indiatimes.com/articleshow/130054402.cms,2026-04-29T02:52:55+00:00
TOI ETimes,224,Bihar BTSC lab assistant notification released for 1091 posts at btsc.bihar.gov.in; apply here,https://timesofindia.indiatimes.com/articleshow/130059322.cms,2026-04-29T02:52:55+00:00
TOI ETimes,225,IPL craze costs techie Rs 1.46 lakh in fake RCB vs CSK ticket scam,https://timesofindia.indiatimes.com/articleshow/130059549.cms,2026-04-29T02:52:55+00:00
TOI ETimes,226,Raising “robot-proof” kids: Why creativity and curiosity matter more than ever,https://timesofindia.indiatimes.com/articleshow/130057342.cms,2026-04-29T02:52:55+00:00
TOI ETimes,227,Inside ‘Satguru Sharan’: Exploring Saif Ali Khan and Kareena Kapoor Khan’s Rs 100 crore Bandra home,https://timesofindia.indiatimes.com/articleshow/130059584.cms,2026-04-29T02:52:55+00:00
TOI ETimes,228,How selling Alaska in 1867 was a costly mistake for Russia,https://timesofindia.indiatimes.com/articleshow/130057081.cms,2026-04-29T02:52:55+00:00
TOI ETimes,229,'Hera Pheri 3 is coming': Paresh Rawal dismisses delay reports and reveals he will 'start shooting soon',https://timesofindia.indiatimes.com/articleshow/130059421.cms,2026-04-29T02:52:55+00:00
TOI ETimes,230,"US-Iran War: A daring rescue Hollywood blockbuster is on its way. Till then, pick your favourite from these 10 films on bringing someone home against all odds",https://timesofindia.indiatimes.com/articleshow/130059208.cms,2026-04-29T02:52:55+00:00
TOI ETimes,231,"Kolkata team unveils fan mural at Rash Behari Avenue, celebrating city’s first love",https://timesofindia.indiatimes.com/articleshow/130059554.cms,2026-04-29T02:52:55+00:00
TOI ETimes,232,How US spread a lie to rescue a pilot of a jet shot down in Iran,https://timesofindia.indiatimes.com/articleshow/130058641.cms,2026-04-29T02:52:55+00:00
TOI ETimes,233,"Netflix unveils ‘VOID’, an AI model that can change a movie plot",https://timesofindia.indiatimes.com/articleshow/130058880.cms,2026-04-29T02:52:55+00:00
TOI ETimes,234,"AI data centers are causing 'stress' not just to tech companies, but also private insurers",https://timesofindia.indiatimes.com/articleshow/130058967.cms,2026-04-29T02:52:55+00:00
TOI ETimes,235,"""Trans women are....."": Clavicular’s viral moment with trans women sparks fresh conversation on internet culture",https://timesofindia.indiatimes.com/articleshow/130053479.cms,2026-04-29T02:52:55+00:00
