source,rank,headline,link,collected_at_iso
LiveMint,81,Gold Rate Hyderabad,https://www.livemint.com/gold-prices/hyderabad,2026-04-18T08:51:53+00:00
LiveMint,82,Silver Rate Today,https://www.livemint.com/silver-prices,2026-04-18T08:51:53+00:00
LiveMint,83,Silver Rate in Delhi,https://www.livemint.com/silver-prices/delhi,2026-04-18T08:51:53+00:00
LiveMint,84,Silver Rate in Bangalore,https://www.livemint.com/silver-prices/bangalore,2026-04-18T08:51:53+00:00
LiveMint,85,US Stock Market,https://www.livemint.com/market/us-market,2026-04-18T08:51:53+00:00
LiveMint,86,Terms of Use,https://www.livemint.com/terms-of-use,2026-04-18T08:51:53+00:00
LiveMint,87,Code of ethics,https://www.livemint.com/code-of-ethics,2026-04-18T08:51:53+00:00
LiveMint,88,Stock Market Today,https://www.livemint.com/market/stock-market-news/stock-market-today-sensex-today-nifty-gold-rate-today-silver-rate-today-crude-oil-prices-us-iran-war-trump-7-april-2026-11775527434110.html,2026-04-18T08:51:53+00:00
LiveMint,89,MCX Gold Rate,https://www.livemint.com/market/market-stats/commodity-mcx-gold-price,2026-04-18T08:51:53+00:00
LiveMint,90,MCX Silver Price,https://www.livemint.com/market/market-stats/commodity-mcx-silver-price,2026-04-18T08:51:53+00:00
LiveMint,91,Gold Price in Mumbai,https://www.livemint.com/gold-prices/mumbai,2026-04-18T08:51:53+00:00
LiveMint,92,Gold Price in Chennai,https://www.livemint.com/gold-prices/chennai,2026-04-18T08:51:53+00:00
LiveMint,93,Gold Price in Kolkata,https://www.livemint.com/gold-prices/kolkata,2026-04-18T08:51:53+00:00
LiveMint,94,Silver Price in Mumbai,https://www.livemint.com/silver-prices/mumbai,2026-04-18T08:51:53+00:00
LiveMint,95,Silver Price in Chennai,https://www.livemint.com/silver-prices/chennai,2026-04-18T08:51:53+00:00
LiveMint,96,Silver Price in Hyderabad,https://www.livemint.com/silver-prices/hyderabad,2026-04-18T08:51:53+00:00
LiveMint,97,Silver Price in Kolkata,https://www.livemint.com/silver-prices/kolkata,2026-04-18T08:51:53+00:00
LiveMint,98,Latest News Today,https://www.livemint.com/news,2026-04-18T08:51:53+00:00
LiveMint,99,US News Today,https://www.livemint.com/news/us-news,2026-04-18T08:51:53+00:00
LiveMint,100,Top Company Leader,https://www.livemint.com/companies/people,2026-04-18T08:51:53+00:00
LiveMint,101,personal loan emi calculator,https://www.livemint.com/loans/personal-loan-emi-calculator,2026-04-18T08:51:53+00:00
LiveMint,102,Personal Loan Interest Rate,https://www.livemint.com/loans/personal-loan-interest-rates,2026-04-18T08:51:53+00:00
LiveMint,103,Personal Loan Eligibility,https://www.livemint.com/loans/personal-loan-eligibility,2026-04-18T08:51:53+00:00
LiveMint,104,Instant Personal Loan,https://www.livemint.com/loans/instant-personal-loan,2026-04-18T08:51:53+00:00
LiveMint,105,Home Loan EMI Calculator,https://www.livemint.com/tools-calculators/home-loan-emi-calculator,2026-04-18T08:51:53+00:00
LiveMint,106,Car Loan EMI,https://www.livemint.com/tools-calculators/car-loan-calculator,2026-04-18T08:51:53+00:00
India Today,1,"Bengaluru woman stunned as city's heat melts crayons at home, shares video",https://www.indiatoday.in/trending-news/story/bengaluru-woman-stunned-as-citys-heat-melts-crayons-at-home-shares-video-2898108-2026-04-18,2026-04-18T08:51:53+00:00
India Today,2,"Man gets into argument with AI recruiter during interview, internet says 'same here'",https://www.indiatoday.in/trending-news/story/man-gets-into-argument-with-ai-recruiter-during-interview-internet-says-same-here-2898076-2026-04-18,2026-04-18T08:51:53+00:00
India Today,3,Pakistani woman records real-life Lion King moment as lioness recreates iconic scene,https://www.indiatoday.in/trending-news/story/pakistani-woman-records-lion-king-moment-as-lioness-recreates-iconic-scene-at-uk-safari-park-2898058-2026-04-18,2026-04-18T08:51:53+00:00
India Today,4,"Woman shocked at filthy mess left in her Airbnb, guests had an excuse you won't expect",https://www.indiatoday.in/trending-news/story/woman-shocked-at-filthy-mess-left-in-her-airbnb-guests-had-an-excuse-you-wont-expect-2898049-2026-04-18,2026-04-18T08:51:53+00:00
India Today,5,"Man shows up for interview at company, but nothing prepared him for this",https://www.indiatoday.in/trending-news/story/man-shows-up-for-interview-at-company-but-nothing-prepared-him-for-this-2897853-2026-04-17,2026-04-18T08:51:53+00:00
India Today,6,"Langur walks into Baghpat Farmers' Day meet, DM offers it her chair",https://www.indiatoday.in/trending-news/story/langur-walks-into-baghpat-farmers-day-meet-dm-offers-it-her-chair-video-uttar-pradesh-2897829-2026-04-17,2026-04-18T08:51:53+00:00
India Today,7,"Man offers rides and chai in rented Rolls-Royce for a day, here's how much he earned",https://www.indiatoday.in/trending-news/story/man-offers-rides-and-chai-in-rented-rolls-royce-for-a-day-heres-how-much-he-earned-2897750-2026-04-17,2026-04-18T08:51:53+00:00
India Today,8,Himachal woman marries South African man in traditional ceremony,https://www.indiatoday.in/trending-news/story/himachal-woman-marries-south-african-man-in-traditional-ceremony-2897723-2026-04-17,2026-04-18T08:51:53+00:00
India Today,9,Video: Mamata Banerjee panics as man breaches security to touch her feet,https://www.indiatoday.in/trending-news/story/video-mamata-banerjee-panics-as-man-breaches-security-to-touch-her-feet-2897691-2026-04-17,2026-04-18T08:51:53+00:00
India Today,10,"Delhi girl's 'Mummy, main pass hogayi' phone call is pure triumph and tears",https://www.indiatoday.in/trending-news/story/delhi-girls-mummy-main-pass-hogayi-phone-call-is-pure-triumph-and-tears-2897638-2026-04-17,2026-04-18T08:51:53+00:00
India Today,11,Bengal father's biryani treat for son amid financial crisis draws prayers online,https://www.indiatoday.in/trending-news/story/bengal-father-biryani-treat-for-son-amid-financial-crisis-draws-prayers-online-2897632-2026-04-17,2026-04-18T08:51:53+00:00
India Today,12,"Indian students give UAE anthem a classical edge, Dubai Crown Prince takes note",https://www.indiatoday.in/trending-news/story/indian-students-give-uae-anthem-a-classical-edge-dubai-crown-prince-takes-note-2897612-2026-04-17,2026-04-18T08:51:53+00:00
India Today,13,Bengaluru man shares post on mother cleaning son's vomit in Kolkata Metro coach,https://www.indiatoday.in/trending-news/story/bengaluru-man-shares-post-on-mother-cleaning-sons-vomit-in-kolkata-metro-coach-2897594-2026-04-17,2026-04-18T08:51:53+00:00
India Today,14,Telangana man claims he found water in sealed cooking oil can ordered from Zepto,https://www.indiatoday.in/trending-news/story/telangana-man-claims-he-found-water-in-sealed-cooking-oil-can-ordered-from-zepto-2897518-2026-04-17,2026-04-18T08:51:53+00:00
India Today,15,Mosquitoes force Hyderabad security guard to cover himself with net on night duty,https://www.indiatoday.in/trending-news/story/hyderabad-security-guard-covers-himself-with-mosquito-net-night-duty-viral-video-2897502-2026-04-17,2026-04-18T08:51:53+00:00
India Today,16,Man's rant about soul-crushing Gurgaon traffic is a hard relate for many,https://www.indiatoday.in/trending-news/story/mans-rant-about-soul-crushing-gurgaon-traffic-is-a-hard-relate-for-many-2897320-2026-04-16,2026-04-18T08:51:53+00:00
India Today,17,Woman says 6 months in Bengaluru is enough to change you. Internet relates,https://www.indiatoday.in/trending-news/story/woman-says-6-months-in-bengaluru-is-enough-to-change-you-internet-relates-2897317-2026-04-16,2026-04-18T08:51:53+00:00
India Today,18,"Luxury chai in a Rolls-Royce? Viral idea draws crowds, not profit",https://www.indiatoday.in/trending-news/story/luxury-chai-in-a-rolls-royce-viral-idea-draws-crowds-not-profit-2897307-2026-04-16,2026-04-18T08:51:53+00:00
India Today,19,"Christian priest steps in as Hindu bride's father in Kerala, performs kanyadaan",https://www.indiatoday.in/trending-news/story/christian-priest-steps-in-as-hindu-brides-father-in-kerala-performs-kanyadaan-2897283-2026-04-16,2026-04-18T08:51:53+00:00
India Today,20,US man builds submarine for parakeet's snorkeling adventure,https://www.indiatoday.in/trending-news/story/us-man-submarine-parakeet-snorkeling-bahamas-2897263-2026-04-16,2026-04-18T08:51:53+00:00
India Today,21,"Iran reimposes restrictions in Strait of Hormuz, accuses US of violating ceasefire",https://www.indiatoday.in/world/story/iran-reimposes-restrictions-in-strait-of-hormuz-accuses-us-of-violating-ceasefire-2898124-2026-04-18,2026-04-18T08:51:53+00:00
India Today,22,Four teenagers detained for raping friend at birthday party in Jharkhand,https://www.indiatoday.in/india/jharkhand/story/jharkhand-ranchi-minors-detained-rape-friend-teenagers-accused-birthday-party-consume-alcohol-2898115-2026-04-18,2026-04-18T08:51:53+00:00
India Today,23,"Husband of TCS Nashik's Nida Khan reveals her location, police find house locked",https://www.indiatoday.in/india/story/tcs-harassment-case-nashik-police-search-for-absconding-nida-khan-2898112-2026-04-18,2026-04-18T08:51:53+00:00
India Today,24,"Shreyas Iyer defies gravity for relay catch in Mumbai, Rohit's reaction goes viral",https://www.indiatoday.in/sports/cricket/story/mi-vs-pbks-shreyas-catch-hardik-pandya-ipl-2026-2897360-2026-04-16,2026-04-18T08:51:53+00:00
India Today,25,Ambanis lead Asia's 10 richest families in 2026: Check who else is on the list,https://www.indiatoday.in/business/story/ambanis-lead-asias-10-richest-families-in-2026-check-who-else-is-on-the-list-2895424-2026-04-13,2026-04-18T08:51:53+00:00
India Today,26,Word of the day: What 'alacrity' means and how to use it right,https://www.indiatoday.in/education-today/grammar-vocabulary/story/word-of-the-day-alacrity-meaning-daily-conversation-usage-tips-to-use-it-right-2897828-2026-04-18,2026-04-18T08:51:53+00:00
India Today,27,"Pisces Tarot Horoscope Today, April 13, 2026: Financial difficulties will trouble you, do not fall into superstition regarding fate",https://www.indiatoday.in/horoscopes/tarot-card-reading/story/pisces-horoscope-tarot-cards-reading-prediction-today-april-13-2026-financial-difficulties-will-trouble-you-do-not-fall-into-superstition-regarding-fate-2895102-2026-04-13,2026-04-18T08:51:53+00:00
India Today,28,"This is the only way to buy the Royal Enfield Classic 500 today and it costs Rs 88,000",https://www.indiatoday.in/auto/the-advisor/story/royal-enfield-classic-500-13-scale-model-gets-two-new-colours-medallion-bronze-and-orange-ember-2898074-2026-04-18,2026-04-18T08:51:53+00:00
TOI ETimes,1,"Parents, mind your phone use, or your rules for kids won't matter",https://timesofindia.indiatimes.com/articleshow/130311587.cms,2026-04-18T08:51:53+00:00
TOI ETimes,2,Bikaner family’s tearful goodbye to deer they raised for 18 months leaves internet emotional: Parenting lesson on love and letting go,https://timesofindia.indiatimes.com/articleshow/130326640.cms,2026-04-18T08:51:53+00:00
TOI ETimes,3,8-week-old baby's sudden death sparks urgent warning for parents on infant safety and medication,https://timesofindia.indiatimes.com/articleshow/130327840.cms,2026-04-18T08:51:53+00:00
TOI ETimes,4,Japanese school gives iPads to every student; viral video sparks debate online,https://timesofindia.indiatimes.com/articleshow/130323470.cms,2026-04-18T08:51:53+00:00
TOI ETimes,5,Little girl questions biker for not wearing helmet; adorable road safety video goes viral,https://timesofindia.indiatimes.com/articleshow/130345841.cms,2026-04-18T08:51:53+00:00
TOI ETimes,6,"Child lashes out at mother; viral video sparks debate on parenting, boundaries and emotional health",https://timesofindia.indiatimes.com/articleshow/130346731.cms,2026-04-18T08:51:53+00:00
TOI ETimes,7,"'Dhurandhar 2' hits Rs 1,742 cr; matches 'Pushpa 2' record",https://timesofindia.indiatimes.com/articleshow/130345552.cms,2026-04-18T08:51:53+00:00
TOI ETimes,8,'Bhooth Bangla' scores Rs 23 cr debut; ends 'Dhurandhar 2' reign,https://timesofindia.indiatimes.com/articleshow/130345389.cms,2026-04-18T08:51:53+00:00
TOI ETimes,9,Rajinikanth's 'Jailer 2' OTT rights sealed for a record price,https://timesofindia.indiatimes.com/articleshow/130349940.cms,2026-04-18T08:51:53+00:00
TOI ETimes,10,Vignesh Shivan reveals what happens when Nayanthara gets angry,https://timesofindia.indiatimes.com/articleshow/130349241.cms,2026-04-18T08:51:53+00:00
TOI ETimes,11,"Brenda Song shares adorable detail about sons Dakota, Carson",https://timesofindia.indiatimes.com/articleshow/130349040.cms,2026-04-18T08:51:53+00:00
TOI ETimes,12,Inside 'Nawab': Nawazuddin Siddiqui’s tribute to his roots,https://timesofindia.indiatimes.com/articleshow/130348942.cms,2026-04-18T08:51:53+00:00
TOI ETimes,13,'I wish I look like Salman Khan at 60': 'Glory' actor Pulkit Samrat reacts to comparison with 'Sultan' star,https://timesofindia.indiatimes.com/articleshow/130349746.cms,2026-04-18T08:51:53+00:00
TOI ETimes,14,'I just could not sleep': Kalki Koechlin opens up on how heartbreak caused four months of insomnia,https://timesofindia.indiatimes.com/articleshow/130349476.cms,2026-04-18T08:51:53+00:00
TOI ETimes,15,Ayan Mukerji meets ‘The Temple Girl’ Namratha Mohan; sparks new round of Ranbir Kapoor led ‘Brahmastra 2’ rumors,https://timesofindia.indiatimes.com/articleshow/130348956.cms,2026-04-18T08:51:53+00:00
TOI ETimes,16,"Palak Tiwari: I feel most comfortable on a movie set, it feels like home",https://timesofindia.indiatimes.com/articleshow/130349122.cms,2026-04-18T08:51:53+00:00
TOI ETimes,17,Motor Matters with Raghav Juyal! Says driving on hill roads has made him a hands-on driver,https://timesofindia.indiatimes.com/articleshow/130348978.cms,2026-04-18T08:51:53+00:00
TOI ETimes,18,'Dhurandhar 2' BO collection day 30 [LIVE]: Ranveer Singh film eyes 'Pushpa 2's collection,https://timesofindia.indiatimes.com/articleshow/130327376.cms,2026-04-18T08:51:53+00:00
TOI ETimes,19,'Bhooth Bangla' eyes Rs 15 crore box office opening,https://timesofindia.indiatimes.com/articleshow/130321718.cms,2026-04-18T08:51:53+00:00
TOI ETimes,20,'Dhurandhar 2' FAILS to break 'Dhurandhar' week 4 record,https://timesofindia.indiatimes.com/articleshow/130320148.cms,2026-04-18T08:51:53+00:00
TOI ETimes,21,"'Dhurandhar 2' BO day 29 [LIVE]: Ranveer Singh film marches past Rs. 1,100 crore milestone",https://timesofindia.indiatimes.com/articleshow/130301791.cms,2026-04-18T08:51:53+00:00
TOI ETimes,22,Animal Preview: Ranbir Kapoor and Sandeep Reddy Vanga are set to shake up the box office hierarchy,https://timesofindia.indiatimes.com/articleshow/105615612.cms,2026-04-18T08:51:53+00:00
TOI ETimes,23,Tu Jhoothi Main Makkaar,https://timesofindia.indiatimes.com/articleshow/98272134.cms,2026-04-18T08:51:53+00:00
TOI ETimes,24,Shailesh recalls a 24-year-old memory as he meets with Mahesh,https://timesofindia.indiatimes.com/articleshow/130347446.cms,2026-04-18T08:51:53+00:00
TOI ETimes,25,Splitsvilla X6: Asmita on Sunny–Karan's take in the latest task,https://timesofindia.indiatimes.com/articleshow/130346897.cms,2026-04-18T08:51:53+00:00
TOI ETimes,26,Kanika’s Faithful Vaishno Journey: actor recalls miracles at the shrine,https://timesofindia.indiatimes.com/articleshow/130340158.cms,2026-04-18T08:51:53+00:00
TOI ETimes,27,Ganga Mai Ki Betiyan: TV show completes 200 episodes,https://timesofindia.indiatimes.com/articleshow/130338475.cms,2026-04-18T08:51:53+00:00
TOI ETimes,28,Smriti Irani offers prayers at Baba Vishwanath temple in Kashi,https://timesofindia.indiatimes.com/articleshow/130349021.cms,2026-04-18T08:51:53+00:00
TOI ETimes,29,Anupama fights to save the cafe as hope keeps her going,https://timesofindia.indiatimes.com/articleshow/130348893.cms,2026-04-18T08:51:53+00:00
TOI ETimes,30,"“I couldn't save my mother"": This Bihar doctor has treated 50,000 patients free, takes no donation, and why Amitabh Bachchan wanted to meet him",https://timesofindia.indiatimes.com/articleshow/130348185.cms,2026-04-18T08:51:53+00:00
TOI ETimes,31,"Success quote of the day by Jeff Bezos: “Complaining is not a strategy, you have to...""",https://timesofindia.indiatimes.com/articleshow/130337925.cms,2026-04-18T08:51:53+00:00
TOI ETimes,32,"Fashion quote of the day by Angelina Jolie - ""Anyone can put on a dress. It’s your mind that defines you.""",https://timesofindia.indiatimes.com/articleshow/130346593.cms,2026-04-18T08:51:53+00:00
TOI ETimes,33,Kunthipuzha: The silent river of India flowing through Kerala’s untouched wilderness,https://timesofindia.indiatimes.com/articleshow/130336672.cms,2026-04-18T08:51:53+00:00
TOI ETimes,34,Watch: Cash rains from high-rise after woman throws bundles – police confirm it was real money,https://timesofindia.indiatimes.com/articleshow/130348711.cms,2026-04-18T08:51:53+00:00
TOI ETimes,35,“Strong girl”: Young specially-abled child reacts beautifully while watching other children play in front of her – netizens get emotional,https://timesofindia.indiatimes.com/articleshow/130347428.cms,2026-04-18T08:51:53+00:00
TOI ETimes,36,Astronauts And The God Question: Artemis II rekindles spiritual awe,https://timesofindia.indiatimes.com/articleshow/130337249.cms,2026-04-18T08:51:53+00:00
TOI ETimes,37,She claims to live in Mumbai on ₹18k budget with ₹11.5k rent! Woman's viral claim leaves the internet stunned,https://timesofindia.indiatimes.com/articleshow/130346661.cms,2026-04-18T08:51:53+00:00
TOI ETimes,38,Is supervolcano Yellowstone going to erupt anytime soon? New study analyses what's next,https://timesofindia.indiatimes.com/articleshow/130341367.cms,2026-04-18T08:51:53+00:00
TOI ETimes,39,"Who is Connor Esterhuizen, the player Gujarat Titans signed to replace Tom Banton and why is he trending?",https://timesofindia.indiatimes.com/articleshow/130341173.cms,2026-04-18T08:51:53+00:00
TOI ETimes,40,D4vd Arrested: Singer held without bail in murder of 14-year-old,https://timesofindia.indiatimes.com/articleshow/130320407.cms,2026-04-18T08:51:53+00:00
TOI ETimes,41,Katy Perry's 2010 videos resurface amid investigation,https://timesofindia.indiatimes.com/articleshow/130295279.cms,2026-04-18T08:51:53+00:00
TOI ETimes,42,"After UK, Kanye West to be banned in France?",https://timesofindia.indiatimes.com/articleshow/130268434.cms,2026-04-18T08:51:53+00:00
TOI ETimes,43,Offset shooting case: Suspects tried to rob rapper's watch,https://timesofindia.indiatimes.com/articleshow/130268437.cms,2026-04-18T08:51:53+00:00
TOI ETimes,44,‘Gaate gaate hi chali jau’: Asha Bhosle’s heartfelt wish to embrace her final note while singing,https://timesofindia.indiatimes.com/articleshow/130229352.cms,2026-04-18T08:51:53+00:00
TOI ETimes,45,Juggy D: ‘Asha ji will forever be the definition of Indian music industry’ - Exclusive,https://timesofindia.indiatimes.com/articleshow/130228380.cms,2026-04-18T08:51:53+00:00
TOI ETimes,46,Beyond Ebooks: The charm of bookstores endures,https://timesofindia.indiatimes.com/articleshow/101098088.cms,2026-04-18T08:51:53+00:00
TOI ETimes,47,It’s a curtain call: Sania Mirza bids adieu to tennis with ‘happy tears’,https://timesofindia.indiatimes.com/articleshow/98440670.cms,2026-04-18T08:51:53+00:00
TOI ETimes,48,A magical makeover for 17th Century stepwell: From neglected ruins to a glorious piece of history,https://timesofindia.indiatimes.com/articleshow/96557955.cms,2026-04-18T08:51:53+00:00
TOI ETimes,49,The city comes alive with Christmas fervour,https://timesofindia.indiatimes.com/articleshow/96406573.cms,2026-04-18T08:51:53+00:00
TOI ETimes,50,#BringRioHome: Pet parents launch search to find their kidnapped cat,https://timesofindia.indiatimes.com/articleshow/96334809.cms,2026-04-18T08:51:53+00:00
TOI ETimes,51,Adil Hussain’s 'Mercy' release date OUT: Film's first look to be attached with Ranveer Singh's 'Dhurandhar: The Revenge',https://timesofindia.indiatimes.com/articleshow/129843424.cms,2026-04-18T08:51:53+00:00
TOI ETimes,52,It’s the best time to be doing theatre: Juhi Babbar Soni,https://timesofindia.indiatimes.com/articleshow/129826631.cms,2026-04-18T08:51:53+00:00
TOI ETimes,53,"Anu Malik steps into theatre with Anupam Kher’s play, Calls it his most exciting challenge yet",https://timesofindia.indiatimes.com/articleshow/129729335.cms,2026-04-18T08:51:53+00:00
TOI ETimes,54,'Wicked' musical director John Stefaniuk on live music on the stage: 'It is so exciting to hear the orchestra whisk us away',https://timesofindia.indiatimes.com/articleshow/129610267.cms,2026-04-18T08:51:53+00:00
TOI ETimes,55,"'Wicked' stars Rebekah Lowings and Eve Shanu-Wilson on Elphaba-Glinda's bond: 'Friends challenge you, not just cheer you on'",https://timesofindia.indiatimes.com/articleshow/129607673.cms,2026-04-18T08:51:53+00:00
TOI ETimes,56,"Vijay Crishna, Shah Rukh Khan’s on-screen father in ‘Devdas,’ passes away at 81: Tributes pour in for theatre stalwart",https://timesofindia.indiatimes.com/articleshow/129016007.cms,2026-04-18T08:51:53+00:00
TOI ETimes,57,Raj Kundra and Shilpa Shetty's 15th Wedding Anniversary,https://timesofindia.indiatimes.com/articleshow/115563990.cms,2026-04-18T08:51:53+00:00
TOI ETimes,58,​Bigg Boss winners list from season 1 to 17​,https://timesofindia.indiatimes.com/articleshow/114277426.cms,2026-04-18T08:51:53+00:00
TOI ETimes,59,​Discover the bird with a prehistoric roar​,https://timesofindia.indiatimes.com/articleshow/114244474.cms,2026-04-18T08:51:53+00:00
TOI ETimes,60,Dia Mirza's ethnic wear,https://timesofindia.indiatimes.com/articleshow/114243410.cms,2026-04-18T08:51:53+00:00
TOI ETimes,61,​Incredible facts about ants you won’t believe​,https://timesofindia.indiatimes.com/articleshow/114243248.cms,2026-04-18T08:51:53+00:00
TOI ETimes,62,'Bigg Boss Marathi 5' nears grand finale​,https://timesofindia.indiatimes.com/articleshow/113936459.cms,2026-04-18T08:51:53+00:00
TOI ETimes,63,Have we lost compassion for the poor? Viral Hyderabad video shows guard wrapped in mosquito net to escape bites,https://timesofindia.indiatimes.com/articleshow/130340382.cms,2026-04-18T08:51:53+00:00
TOI ETimes,64,“Aap hote kaun ho?”: Influencer Kanika Sharma CLAPS BACK at trolls after her interfaith wedding sparks online storm,https://timesofindia.indiatimes.com/articleshow/130338078.cms,2026-04-18T08:51:53+00:00
TOI ETimes,65,Magic diet and no steroids: Meet the Chennai construction worker who built ripped abs with 'simple food' and discipline,https://timesofindia.indiatimes.com/articleshow/130336214.cms,2026-04-18T08:51:53+00:00
TOI ETimes,66,"Viral video shows Rs. 50 chips sold for Rs. 100 at IPL match, internet asks, “Isn’t this a punishable offence """,https://timesofindia.indiatimes.com/articleshow/130335470.cms,2026-04-18T08:51:53+00:00
TOI ETimes,67,Another ‘zombie drug’ case or something more serious at play? This spine-chilling Maharashtra video is going viral,https://timesofindia.indiatimes.com/articleshow/130333317.cms,2026-04-18T08:51:53+00:00
TOI ETimes,68,Indian placements spoil us: Young Indian living in Paris reveals real reason why getting jobs in Europe is difficult,https://timesofindia.indiatimes.com/articleshow/130333108.cms,2026-04-18T08:51:53+00:00
TOI ETimes,69,Watch: Robot chases wild boars in viral video – but there’s a jaw-dropping twist,https://timesofindia.indiatimes.com/articleshow/130331686.cms,2026-04-18T08:51:53+00:00
TOI ETimes,70,"‘Algorithm strikes again, Virat Kohli?’ Who is Liz Laz, the German model trending after cricket star liked her picture",https://timesofindia.indiatimes.com/articleshow/130326992.cms,2026-04-18T08:51:53+00:00
TOI ETimes,71,He sold chai from a Rolls-Royce after spending Rs 1 lakh – what he earned will surprise you,https://timesofindia.indiatimes.com/articleshow/130326264.cms,2026-04-18T08:51:53+00:00
TOI ETimes,72,"Same pay, different roles: This Bengaluru vs Hyderabad job dilemma has the internet divided",https://timesofindia.indiatimes.com/articleshow/130325788.cms,2026-04-18T08:51:53+00:00
TOI ETimes,73,"'No more 2:00 AM flights, no more missing birthdays and festivals and meals': Cabin crew woman’s emotional goodbye goes viral",https://timesofindia.indiatimes.com/articleshow/130321657.cms,2026-04-18T08:51:53+00:00
TOI ETimes,74,"Navy SEAL, then Harvard doctor, then NASA astronaut: Meet the man who changed careers three times and succeeded in all of them",https://timesofindia.indiatimes.com/articleshow/130317658.cms,2026-04-18T08:51:53+00:00
TOI ETimes,75,Raising kids in India > USA? Meet Kelsey- the expat mon who reveals top 5 reasons why India is better for raising kids than America,https://timesofindia.indiatimes.com/articleshow/130313232.cms,2026-04-18T08:51:53+00:00
TOI ETimes,76,"Meet the Ice Age survivor: The rotifer that cheated death for 24,000 years and started reproducing after coming back to life",https://timesofindia.indiatimes.com/articleshow/130311156.cms,2026-04-18T08:51:53+00:00
TOI ETimes,77,Cranes or storks? How to differentiate between these 2 graceful white birds,https://timesofindia.indiatimes.com/articleshow/130308569.cms,2026-04-18T08:51:53+00:00
TOI ETimes,78,IIT Delhi grad ditches ₹17 LPA banking job over 15-min lunch breaks and 'nightmare' sick leaves,https://timesofindia.indiatimes.com/articleshow/130308446.cms,2026-04-18T08:51:53+00:00
TOI ETimes,79,'Fake Christian': US Secretary of War Pete Hegseth trolled for quoting a 'Bible verse' from Pulp Fiction,https://timesofindia.indiatimes.com/articleshow/130306055.cms,2026-04-18T08:51:53+00:00
TOI ETimes,80,He holds 138 degrees at 55: Rajasthan ex-Army man sets 11 world records – his inspiring story,https://timesofindia.indiatimes.com/articleshow/130305419.cms,2026-04-18T08:51:53+00:00
TOI ETimes,81,Who is Bita Hemmati? Know the Iranian woman set to face execution in her homeland - What are the charges?,https://timesofindia.indiatimes.com/articleshow/130305942.cms,2026-04-18T08:51:53+00:00
