source,rank,headline,link,collected_at_iso
TOI ETimes,82,"Watch here: 11,000 litres of milk poured into Narmada river during MP temple ritual, video sparks debate",https://timesofindia.indiatimes.com/articleshow/130163631.cms,2026-04-12T02:36:03+00:00
TOI ETimes,83,Watch here: Cockroach in biryani? Birthday celebration at Barbeque Nation Gorakhpur sparks outrage,https://timesofindia.indiatimes.com/articleshow/130163142.cms,2026-04-12T02:36:03+00:00
TOI ETimes,84,"'Colourist, classist, garbage': Hollywood actresses Maitreyi Ramakrishnan and Supriya Ganesh hit back at 'maid phenotype' labels online",https://timesofindia.indiatimes.com/articleshow/130160652.cms,2026-04-12T02:36:03+00:00
TOI ETimes,85,What is ‘MMIWG2SLGBTQQIA+’? Canadian MP’s remark goes viral; Elon Musk reacts,https://timesofindia.indiatimes.com/articleshow/130160287.cms,2026-04-12T02:36:03+00:00
TOI ETimes,86,‘I have blacklisted your company’: Job seeker’s shocking reply leaves recruiter speechless,https://timesofindia.indiatimes.com/articleshow/130158695.cms,2026-04-12T02:36:03+00:00
TOI ETimes,87,Peaky Blinders: Uncovering the truth behind Tommy Shelby’s empire; what’s real and what’s fiction?,https://timesofindia.indiatimes.com/articleshow/130152544.cms,2026-04-12T02:36:03+00:00
TOI ETimes,88,Watch Noida shocker: Dog tied and thrashed on balcony; pet rescued after video goes viral,https://timesofindia.indiatimes.com/articleshow/130152017.cms,2026-04-12T02:36:03+00:00
TOI ETimes,89,Who is Venkatraman Ramakrishnan? The scientist who could not make it to IITs but won the Nobel Prize and Padma Vibhushan,https://timesofindia.indiatimes.com/articleshow/130175981.cms,2026-04-12T02:36:03+00:00
TOI ETimes,90,Major update in fatal MRI incident: Lawsuit filed after man gets pulled into machine with metal chain,https://timesofindia.indiatimes.com/articleshow/130147240.cms,2026-04-12T02:36:03+00:00
TOI ETimes,91,‘Poor kid got exhausted…’: Viral video of student fanning teacher in MP government school sparks outrage,https://timesofindia.indiatimes.com/articleshow/130148991.cms,2026-04-12T02:36:03+00:00
TOI ETimes,92,"Watch: 12-year-old’s violent reaction to ‘no more food’ goes viral, debate on parenting begins",https://timesofindia.indiatimes.com/articleshow/130147878.cms,2026-04-12T02:36:03+00:00
TOI ETimes,93,Samay Raina's challenge goes viral: ‘Still Alive’ reels show sons saying ‘I love you’ to dads,https://timesofindia.indiatimes.com/articleshow/130146175.cms,2026-04-12T02:36:03+00:00
TOI ETimes,94,One of psychology’s darkest human experiments: ‘Little Albert’ terrified for science in infamous 1920 study,https://timesofindia.indiatimes.com/articleshow/130142929.cms,2026-04-12T02:36:03+00:00
TOI ETimes,95,No aloo in samosa? This 500-year-old recipe from Akbar’s era is going viral,https://timesofindia.indiatimes.com/articleshow/130142851.cms,2026-04-12T02:36:03+00:00
TOI ETimes,96,Meet Gauri M? The 19‑year‑old Indian woman who landed a marketing job at BMW without a degree,https://timesofindia.indiatimes.com/articleshow/130140303.cms,2026-04-12T02:36:03+00:00
TOI ETimes,97,British pastor charged with manslaughter after man drowns during his own ‘born again’ baptism,https://timesofindia.indiatimes.com/articleshow/130139073.cms,2026-04-12T02:36:03+00:00
TOI ETimes,98,Meet Harshita Arora: Indian-origin founder of $700M startup ...,https://timesofindia.indiatimes.com/articleshow/130122853.cms,2026-04-12T02:36:03+00:00
TOI ETimes,99,‘Did he just fart?’ US Defense Secretary Pete Hegseth’s seri...,https://timesofindia.indiatimes.com/articleshow/130101919.cms,2026-04-12T02:36:03+00:00
TOI ETimes,100,Viral video: Russian tourist choked by locals in Bali after ...,https://timesofindia.indiatimes.com/articleshow/129983079.cms,2026-04-12T02:36:03+00:00
TOI ETimes,101,‘First in 36 years’: Indian-origin student wins elite Church...,https://timesofindia.indiatimes.com/articleshow/129998588.cms,2026-04-12T02:36:03+00:00
TOI ETimes,102,"Happy Easter Sunday 2026: Top 70 Wishes, Messages, Greetings...",https://timesofindia.indiatimes.com/articleshow/130004282.cms,2026-04-12T02:36:03+00:00
TOI ETimes,103,"Meet Palmer Luckey: He built a $2 billion company at 19, got...",https://timesofindia.indiatimes.com/articleshow/129907090.cms,2026-04-12T02:36:03+00:00
TOI ETimes,104,"Happy Eid-ul-Fitr 2026: Eid Mubarak Wishes, Messages, Quotes...",https://timesofindia.indiatimes.com/articleshow/129680487.cms,2026-04-12T02:36:03+00:00
TOI ETimes,105,Meet Patrick Winston: MIT professor whose one-hour lecture s...,https://timesofindia.indiatimes.com/articleshow/129827810.cms,2026-04-12T02:36:03+00:00
TOI ETimes,106,'Not a game at all': Canadian PM Mark Carney and Finland’s p...,https://timesofindia.indiatimes.com/articleshow/129641203.cms,2026-04-12T02:36:03+00:00
TOI ETimes,107,‘Chef is a big Emraan Hashmi fan!’: What is the viral ‘Chef’s Kiss’ dessert everyone’s talking about?,https://timesofindia.indiatimes.com/articleshow/130138249.cms,2026-04-12T02:36:03+00:00
TOI ETimes,108,From Kashmir to Edinburgh: Who is Dr Zarak Bhat - Kashmir scholar lands prestigious AI role at Edinburgh University,https://timesofindia.indiatimes.com/articleshow/130135692.cms,2026-04-12T02:36:03+00:00
TOI ETimes,109,"30 kg school bags & ₹9,000 for class 2 books: Parents call out ‘Education Scam’ in viral videos",https://timesofindia.indiatimes.com/articleshow/130131060.cms,2026-04-12T02:36:03+00:00
TOI ETimes,110,"Just days before Chardham Yatra 2026, Kedarnath Dham covered in 5 feet snow - Internet reacts to viral videos",https://timesofindia.indiatimes.com/articleshow/130129107.cms,2026-04-12T02:36:03+00:00
TOI ETimes,111,Zoho’s Sridhar Vembu says ‘Go back to villages’ - Netizens are divided,https://timesofindia.indiatimes.com/articleshow/130128299.cms,2026-04-12T02:36:03+00:00
TOI ETimes,112,Watch: Man frozen on Bengaluru street fuels shocking ‘zombie drug’ claims online,https://timesofindia.indiatimes.com/articleshow/130122834.cms,2026-04-12T02:36:03+00:00
TOI ETimes,113,Is El Niño coming back? Here’s what it could mean for 2026 weather,https://timesofindia.indiatimes.com/articleshow/130122893.cms,2026-04-12T02:36:03+00:00
TOI ETimes,114,7-Eleven video of Indian worker sparks H-1B debate in US; congressman calls it a ‘scam’,https://timesofindia.indiatimes.com/articleshow/130117948.cms,2026-04-12T02:36:03+00:00
TOI ETimes,115,"Who is Abhijay Arora? Failed JEE, faced ₹1 crore debt and 90-day job deadline, then cracked Google",https://timesofindia.indiatimes.com/articleshow/130117745.cms,2026-04-12T02:36:03+00:00
TOI ETimes,116,"College backlog to big tech offers: How this Indian engineer grabbed job offers from Google, Microsoft, Meta and Uber",https://timesofindia.indiatimes.com/articleshow/130114672.cms,2026-04-12T02:36:03+00:00
TOI ETimes,117,This viral 'Rambaan' fertiliser recipe is making plants explode with flowers in weeks,https://timesofindia.indiatimes.com/articleshow/130109256.cms,2026-04-12T02:36:03+00:00
TOI ETimes,118,Who is ‘Ketamine Queen’ Jasveen Sangha? The woman now at the centre of the Matthew Perry drug overdose case,https://timesofindia.indiatimes.com/articleshow/130110198.cms,2026-04-12T02:36:03+00:00
TOI ETimes,119,No LPG or cylinder required for cooking: What is the 'plug-and-play' Hydrogen cooking stove that produces gas through water electrolysis?,https://timesofindia.indiatimes.com/articleshow/130109070.cms,2026-04-12T02:36:03+00:00
TOI ETimes,120,Keralite reveals being punished for speaking mother tongue in school: Viral Reddit post shares story of 30-year-old who lost his language in English-only system,https://timesofindia.indiatimes.com/articleshow/130106790.cms,2026-04-12T02:36:03+00:00
TOI ETimes,121,Meet Shirli Ling: The social media influencer and chicken hotpot boss who became a grandmother at 34,https://timesofindia.indiatimes.com/articleshow/130101855.cms,2026-04-12T02:36:03+00:00
TOI ETimes,122,Meet ‘Chaya Chechi’: Her dreamy chai-on-a-boat experience is going viral– here’s why,https://timesofindia.indiatimes.com/articleshow/130094820.cms,2026-04-12T02:36:03+00:00
TOI ETimes,123,Love teddy bears? These 5 dog breeds look just like them,https://timesofindia.indiatimes.com/articleshow/130093314.cms,2026-04-12T02:36:03+00:00
TOI ETimes,124,We’re running out of Earth: Study warns current lifestyle needs 2 planets,https://timesofindia.indiatimes.com/articleshow/130092316.cms,2026-04-12T02:36:03+00:00
TOI ETimes,125,Inside the row over Pippa Middleton’s countryside home: Why are locals upset with Kate Middleton’s sister,https://timesofindia.indiatimes.com/articleshow/130091068.cms,2026-04-12T02:36:03+00:00
TOI ETimes,126,Did you know NYC once flew helicopters from skyscraper rooftops to airports in 1965? Here’s how it all went wrong,https://timesofindia.indiatimes.com/articleshow/130085042.cms,2026-04-12T02:36:03+00:00
TOI ETimes,127,Inside Gaurav Taneja’s Rs 10 crore Gurugram farmhouse: Where 200 cows power a desi food venture,https://timesofindia.indiatimes.com/articleshow/130089447.cms,2026-04-12T02:36:03+00:00
TOI ETimes,128,"After 'Dhurandhar' made Lyari in Pakistan viral, ‘Lyari in India’ is trending online - All about the hidden gem of Gujarat",https://timesofindia.indiatimes.com/articleshow/130087039.cms,2026-04-12T02:36:03+00:00
TOI ETimes,129,"Macaulay's children are triggered because Pujarini Pradhan, from Medinipur, didn’t ask for permission to think, and speak English",https://timesofindia.indiatimes.com/articleshow/130085029.cms,2026-04-12T02:36:03+00:00
TOI ETimes,130,"Rs 200 sapling to Rs 60,000 tree: The mahogany farming secret turning Indian farmers into crorepatis",https://timesofindia.indiatimes.com/articleshow/130085813.cms,2026-04-12T02:36:03+00:00
TOI ETimes,131,"Meet Africa’s richest king: How King Mohammed VI’s ₹6,200 crore gold bet is changing the gold game",https://timesofindia.indiatimes.com/articleshow/130084007.cms,2026-04-12T02:36:03+00:00
TOI ETimes,132,India's unstoppable daughter: Who is Payal Nag - World’s first quadruple amputee archer,https://timesofindia.indiatimes.com/articleshow/130082222.cms,2026-04-12T02:36:03+00:00
TOI ETimes,133,Who is Divya Singh? A 28-year-old teacher and the first Indian woman to cycle to Everest Base Camp,https://timesofindia.indiatimes.com/articleshow/130079771.cms,2026-04-12T02:36:03+00:00
TOI ETimes,134,Mid-air shock! Sydney-Dallas Qantas flight dumps fuel over ocean after sudden emergency - here’s what happened,https://timesofindia.indiatimes.com/articleshow/130077596.cms,2026-04-12T02:36:03+00:00
TOI ETimes,135,'IITian Baba' Abhey Singh gets married: Who is his wife Pratika?,https://timesofindia.indiatimes.com/articleshow/130076066.cms,2026-04-12T02:36:03+00:00
TOI ETimes,136,He made JEE history with 360/360: From IIT topper to singer-songwriter? Kalpit Veerwal’s journey is anything but typical,https://timesofindia.indiatimes.com/articleshow/130074916.cms,2026-04-12T02:36:03+00:00
TOI ETimes,137,Struggling with self-appraisal? 5 simple ways to make your boss notice your work,https://timesofindia.indiatimes.com/articleshow/130069343.cms,2026-04-12T02:36:03+00:00
TOI ETimes,138,"Researchers create QR code thinner than a human hair, set world record",https://timesofindia.indiatimes.com/articleshow/130068978.cms,2026-04-12T02:36:03+00:00
TOI ETimes,139,Viral: Walking at 2:30 am ‘without fear’? Gurugram couple’s clip gets people talking,https://timesofindia.indiatimes.com/articleshow/130066968.cms,2026-04-12T02:36:03+00:00
TOI ETimes,140,"Video: Young doctor quits on first day, alleges patients were kept in ICU unnecessarily for profit: ‘Keep them for…’",https://timesofindia.indiatimes.com/articleshow/130065115.cms,2026-04-12T02:36:03+00:00
TOI ETimes,141,Watch here: Dog goes on attacking spree in seconds; viral video triggers fear online,https://timesofindia.indiatimes.com/articleshow/130063159.cms,2026-04-12T02:36:03+00:00
TOI ETimes,142,Beloved Indian gulab jamun stuffed in a croissant? ‘Cromun’ leaves internet furious over new food experiment,https://timesofindia.indiatimes.com/articleshow/130061664.cms,2026-04-12T02:36:03+00:00
TOI ETimes,143,"Rare pair eclipse in August 2026: When and where to watch, timings, and what does it mean?",https://timesofindia.indiatimes.com/articleshow/130058133.cms,2026-04-12T02:36:03+00:00
TOI ETimes,144,PowerWash Simulator 2: The oddly satisfying ‘boring’ yet viral game people are playing for 24 hours straight,https://timesofindia.indiatimes.com/articleshow/130056751.cms,2026-04-12T02:36:03+00:00
TOI ETimes,145,Viral dance party on rails: Marwari family books entire train coach for wedding; watch video,https://timesofindia.indiatimes.com/articleshow/130056945.cms,2026-04-12T02:36:03+00:00
TOI ETimes,146,Who was Kasey Grelle? ‘Brilliant and selfless’ CEO mom killed in tragic resort truck crash in Nicaragua,https://timesofindia.indiatimes.com/articleshow/130056642.cms,2026-04-12T02:36:03+00:00
TOI ETimes,147,Too expensive to have a respectful funeral? What is China's burial crisis that is forcing people to store ashes in 'new' apartments,https://timesofindia.indiatimes.com/articleshow/130053917.cms,2026-04-12T02:36:03+00:00
TOI ETimes,148,"Detroit bakery’s ‘creepy lamb cake’ prank goes viral, sparks reactions and real orders",https://timesofindia.indiatimes.com/articleshow/130052880.cms,2026-04-12T02:36:03+00:00
TOI ETimes,149,Who is Disha Sharma? Famous media personality's daughter who tied the knot in a 2-states styled wedding with Bengaluru-based lawyer Sudarshan MJ,https://timesofindia.indiatimes.com/articleshow/130052454.cms,2026-04-12T02:36:03+00:00
TOI ETimes,150,"Artemis II astronauts lose contact with Earth for 40 minutes in space: Why will this happen, and what will the crew do during this time?",https://timesofindia.indiatimes.com/articleshow/130050721.cms,2026-04-12T02:36:03+00:00
TOI ETimes,151,Who is Kashmira Pardeshi? The ‘mystery girl’ and PBKS fan from IPL stands everyone can’t stop talking about,https://timesofindia.indiatimes.com/articleshow/130049862.cms,2026-04-12T02:36:03+00:00
TOI ETimes,152,‘How is that comedy?’: SNL UK faces backlash over crude joke referencing Mark Zuckerberg and Adolf Hitler,https://timesofindia.indiatimes.com/articleshow/130046367.cms,2026-04-12T02:36:03+00:00
TOI ETimes,153,Who is Priya Patel? Indian-origin pro-MAGA influencer sparks massive row over viral immigration video,https://timesofindia.indiatimes.com/articleshow/130041982.cms,2026-04-12T02:36:03+00:00
TOI ETimes,154,From Daya to Jethalal: This family’s Taarak Mehta Ka Ooltah Chashmah-themed birthday party is going viral,https://timesofindia.indiatimes.com/articleshow/130041622.cms,2026-04-12T02:36:03+00:00
TOI ETimes,155,"'My duty to keep her happy’: Retired judge welcomes divorced daughter home with dhol, dance, and pride",https://timesofindia.indiatimes.com/articleshow/130038650.cms,2026-04-12T02:36:03+00:00
TOI ETimes,156,No more Gutkha spits on roads! Meet the young innovators who have found an innovative and bio-friendly device for India's spitting problem,https://timesofindia.indiatimes.com/articleshow/130038404.cms,2026-04-12T02:36:03+00:00
TOI ETimes,157,Venus has a hidden volcano cave! Astronomers spot a giant lava tube beneath 'Nyx Mons',https://timesofindia.indiatimes.com/articleshow/130038058.cms,2026-04-12T02:36:03+00:00
TOI ETimes,158,What is the net worth of Kash Patel? Everything you should know about the Indian-origin FBI director and why he is in news,https://timesofindia.indiatimes.com/articleshow/130037613.cms,2026-04-12T02:36:03+00:00
TOI ETimes,159,No cash or card needed from bazaars to temples: German traveller appreciates the “Real Digi‑India” for cashless payments,https://timesofindia.indiatimes.com/articleshow/130036993.cms,2026-04-12T02:36:03+00:00
TOI ETimes,160,"From sugar‑filled mornings to a bittersweet exit: After 15 years of sweet cravings, this beloved doughnut chain is quietly exiting India",https://timesofindia.indiatimes.com/articleshow/130035309.cms,2026-04-12T02:36:03+00:00
TOI ETimes,161,"Who is Kai Trump? US President Donald Trump's granddaughter, influencer and golfer who is receiving backlash for her dream job reveal",https://timesofindia.indiatimes.com/articleshow/130034216.cms,2026-04-12T02:36:03+00:00
TOI ETimes,162,"Happy Easter Sunday 2026: Best Messages, Quotes, Wishes, Greetings and Images to share on Easter Sunday",https://timesofindia.indiatimes.com/articleshow/130025228.cms,2026-04-12T02:36:03+00:00
TOI ETimes,163,‘It changed me’: British traveller’s raw take on India is winning hearts online,https://timesofindia.indiatimes.com/articleshow/130033290.cms,2026-04-12T02:36:03+00:00
TOI ETimes,164,"Happy Easter Sunday 2026: Images, Quotes, Wishes, Messages, Images, Cards, Greetings, Pictures and GIFs",https://timesofindia.indiatimes.com/articleshow/130001252.cms,2026-04-12T02:36:03+00:00
TOI ETimes,165,"‘Not Kashmir!’ Bikaner looks snow-white after rare hailstorm, internet can’t believe it",https://timesofindia.indiatimes.com/articleshow/130024752.cms,2026-04-12T02:36:03+00:00
TOI ETimes,166,Europe’s first total solar eclipse in 27 years is coming and this country is the best place to watch it,https://timesofindia.indiatimes.com/articleshow/130020939.cms,2026-04-12T02:36:03+00:00
TOI ETimes,167,Kenyan man sells honey with his swollen face on the label and it turns out to be a marketing masterstroke,https://timesofindia.indiatimes.com/articleshow/130020924.cms,2026-04-12T02:36:03+00:00
TOI ETimes,168,Sunday Reset trend explained: Why people are romanticising mundane rituals as ‘Hot Girl Walk’ of home,https://timesofindia.indiatimes.com/articleshow/129997465.cms,2026-04-12T02:36:03+00:00
TOI ETimes,169,GTA 6 leaks reveal a mind-blowing AI upgrade - and a locked-in release date,https://timesofindia.indiatimes.com/articleshow/130017265.cms,2026-04-12T02:36:03+00:00
TOI ETimes,170,Child Lunch Story,https://timesofindia.indiatimes.com/articleshow/130110517.cms,2026-04-12T02:36:03+00:00
TOI ETimes,171,Dacoit Box Office Collection,https://timesofindia.indiatimes.com/articleshow/130201087.cms,2026-04-12T02:36:03+00:00
TOI ETimes,172,Ahmedabad Dosa Batter Tragedy,https://timesofindia.indiatimes.com/articleshow/130089214.cms,2026-04-12T02:36:03+00:00
TOI ETimes,173,Dacoit Twitter Reviews,https://timesofindia.indiatimes.com/articleshow/130157947.cms,2026-04-12T02:36:03+00:00
TOI ETimes,174,Sandeep Reddy Vanga,https://timesofindia.indiatimes.com/articleshow/130144470.cms,2026-04-12T02:36:03+00:00
TOI ETimes,175,Jack Ma Quote,https://timesofindia.indiatimes.com/articleshow/130131342.cms,2026-04-12T02:36:03+00:00
TOI ETimes,176,Love Insurance Kompany Reviews,https://timesofindia.indiatimes.com/articleshow/130162738.cms,2026-04-12T02:36:03+00:00
TOI ETimes,177,Lionel Messi Parenting,https://timesofindia.indiatimes.com/articleshow/130133957.cms,2026-04-12T02:36:03+00:00
TOI ETimes,178,Lord Ganesha Drawing,https://timesofindia.indiatimes.com/articleshow/130110992.cms,2026-04-12T02:36:03+00:00
TOI ETimes,179,Baba Ka Dhaba,https://timesofindia.indiatimes.com/articleshow/130158160.cms,2026-04-12T02:36:03+00:00
TOI ETimes,180,Fungus That Eats Gold,https://timesofindia.indiatimes.com/articleshow/130110618.cms,2026-04-12T02:36:03+00:00
TOI ETimes,181,Quote Of The Day By Aristotle,https://timesofindia.indiatimes.com/articleshow/130179215.cms,2026-04-12T02:36:03+00:00
TOI ETimes,182,CSK Vs DC Live Streaming,https://timesofindia.indiatimes.com/articleshow/130190747.cms,2026-04-12T02:36:03+00:00
TOI ETimes,183,Basketball Zero Codes,https://timesofindia.indiatimes.com/articleshow/129802738.cms,2026-04-12T02:36:03+00:00
TOI ETimes,184,Hazaribag man drowns while fishing in lake,https://timesofindia.indiatimes.com/articleshow/130060093.cms,2026-04-12T02:36:03+00:00
TOI ETimes,185,"""Behen Darr Gayi!"": Fans relive ‘Bhagam Bhag’ era after watching Akshay Kumar's 'Bhooth Bangla' trailer",https://timesofindia.indiatimes.com/articleshow/130060027.cms,2026-04-12T02:36:03+00:00
TOI ETimes,186,MBOSE HSLC result 2026 to release tomorrow: Check details here,https://timesofindia.indiatimes.com/articleshow/130059814.cms,2026-04-12T02:36:03+00:00
TOI ETimes,187,"Iran war risk: JPMorgan CEO Jamie Dimon warns of oil shocks, sticky inflation and higher interest rates",https://timesofindia.indiatimes.com/articleshow/130059993.cms,2026-04-12T02:36:03+00:00
TOI ETimes,188,Make your clutch last longer with these easy driving tips,https://timesofindia.indiatimes.com/articleshow/130052232.cms,2026-04-12T02:36:03+00:00
TOI ETimes,189,“Three-against-one situation”: El Rubius opens up on being “targeted” in MrBeast’s viral $1M challenge,https://timesofindia.indiatimes.com/articleshow/130054402.cms,2026-04-12T02:36:03+00:00
TOI ETimes,190,Bihar BTSC lab assistant notification released for 1091 posts at btsc.bihar.gov.in; apply here,https://timesofindia.indiatimes.com/articleshow/130059322.cms,2026-04-12T02:36:03+00:00
TOI ETimes,191,IPL craze costs techie Rs 1.46 lakh in fake RCB vs CSK ticket scam,https://timesofindia.indiatimes.com/articleshow/130059549.cms,2026-04-12T02:36:03+00:00
TOI ETimes,192,Raising “robot-proof” kids: Why creativity and curiosity matter more than ever,https://timesofindia.indiatimes.com/articleshow/130057342.cms,2026-04-12T02:36:03+00:00
TOI ETimes,193,Inside ‘Satguru Sharan’: Exploring Saif Ali Khan and Kareena Kapoor Khan’s Rs 100 crore Bandra home,https://timesofindia.indiatimes.com/articleshow/130059584.cms,2026-04-12T02:36:03+00:00
TOI ETimes,194,How selling Alaska in 1867 was a costly mistake for Russia,https://timesofindia.indiatimes.com/articleshow/130057081.cms,2026-04-12T02:36:03+00:00
TOI ETimes,195,'Hera Pheri 3 is coming': Paresh Rawal dismisses delay reports and reveals he will 'start shooting soon',https://timesofindia.indiatimes.com/articleshow/130059421.cms,2026-04-12T02:36:03+00:00
TOI ETimes,196,"US-Iran War: A daring rescue Hollywood blockbuster is on its way. Till then, pick your favourite from these 10 films on bringing someone home against all odds",https://timesofindia.indiatimes.com/articleshow/130059208.cms,2026-04-12T02:36:03+00:00
TOI ETimes,197,"Kolkata team unveils fan mural at Rash Behari Avenue, celebrating city’s first love",https://timesofindia.indiatimes.com/articleshow/130059554.cms,2026-04-12T02:36:03+00:00
TOI ETimes,198,How US spread a lie to rescue a pilot of a jet shot down in Iran,https://timesofindia.indiatimes.com/articleshow/130058641.cms,2026-04-12T02:36:03+00:00
TOI ETimes,199,"Netflix unveils ‘VOID’, an AI model that can change a movie plot",https://timesofindia.indiatimes.com/articleshow/130058880.cms,2026-04-12T02:36:03+00:00
TOI ETimes,200,"AI data centers are causing 'stress' not just to tech companies, but also private insurers",https://timesofindia.indiatimes.com/articleshow/130058967.cms,2026-04-12T02:36:03+00:00
TOI ETimes,201,"""Trans women are....."": Clavicular’s viral moment with trans women sparks fresh conversation on internet culture",https://timesofindia.indiatimes.com/articleshow/130053479.cms,2026-04-12T02:36:03+00:00
TOI Viral News,1,"Watch: Hardeep Singh Puri reunites with old friend from Delhi University, video melts hearts",https://timesofindia.indiatimes.com/articleshow/108418522.cms,2026-04-12T02:36:03+00:00
TOI Viral News,2,Narayana Murthy and daughter Akshata enjoy 'Corner House' ice cream in Bengaluru,https://timesofindia.indiatimes.com/articleshow/107659138.cms,2026-04-12T02:36:03+00:00
TOI Viral News,3,Taylor Swift cheers boyfriend Travis Kelce at the Super Bowl,https://timesofindia.indiatimes.com/articleshow/107613344.cms,2026-04-12T02:36:03+00:00
TOI Viral News,4,'He Nitished me' to 'Paltu Chacha': Nitish Kumar's 'swing politics' sparks humour fest,https://timesofindia.indiatimes.com/articleshow/107236114.cms,2026-04-12T02:36:03+00:00
TOI Viral News,5,"Flyer hits IndiGo Pilot announcing flight delay due to dense fog conditions, video goes viral",https://timesofindia.indiatimes.com/articleshow/106851189.cms,2026-04-12T02:36:03+00:00
TOI Viral News,6,"New Zealand's youngest MP performs native 'war cry' in Parliament, video goes viral",https://timesofindia.indiatimes.com/articleshow/106572179.cms,2026-04-12T02:36:03+00:00
TOI Viral News,7,"NASA unveils stunning image of 'evil eye' galaxy, sparking internet awe",https://timesofindia.indiatimes.com/articleshow/105570940.cms,2026-04-12T02:36:03+00:00
TOI Viral News,8,Millennials bemoan lackluster Black Friday deals in social media uproar,https://timesofindia.indiatimes.com/articleshow/105475777.cms,2026-04-12T02:36:03+00:00
TOI Viral News,9,'At least they'll not lose to India in semis': Memes erupt with Pakistan all but out of World Cup,https://timesofindia.indiatimes.com/articleshow/105122539.cms,2026-04-12T02:36:03+00:00
TOI Viral News,10,Brazilian influencer Vanessa Mancini dies at 41 from massive heart attack,https://timesofindia.indiatimes.com/articleshow/105110853.cms,2026-04-12T02:36:03+00:00
TOI Viral News,11,Memes erupt as Angelo Mathews becomes first international cricketer to be timed out,https://timesofindia.indiatimes.com/articleshow/105016656.cms,2026-04-12T02:36:03+00:00
TOI Viral News,12,Mia Khalifa posts Amy Schumer's heated exchange with Asia Jackson over Israel-Palestine conflict,https://timesofindia.indiatimes.com/articleshow/104947696.cms,2026-04-12T02:36:03+00:00
TOI Viral News,13,Fans troll Pakistan as Proteas beat Kiwis to keep Pak's semi-final hopes alive,https://timesofindia.indiatimes.com/articleshow/104912338.cms,2026-04-12T02:36:03+00:00
