source,rank,headline,link,collected_at_iso
Indian Express,1,Trending in India,https://indianexpress.com/section/trending/trending-in-india/,2026-05-15T22:54:00+00:00
Indian Express,2,This is Serious,https://indianexpress.com/section/trending/this-is-serious/,2026-05-15T22:54:00+00:00
Indian Express,3,Nepal rhino fight video,https://indianexpress.com/article/trending/trending-in-india/2-rhinos-fight-in-nepal-near-chitwan-national-park-viral-video-stuns-tourists-10691404/,2026-05-15T22:54:00+00:00
Indian Express,4,"aviation, atf fuel price hike, maharashtra",https://indianexpress.com/article/trending/top-10-listing/top-10-most-polluted-airports-in-the-world-indian-airports-release-27-6-million-tonnes-of-co2-10691371/,2026-05-15T22:54:00+00:00
Indian Express,5,Mumbai family celebrates son's results with marksheet cake,https://indianexpress.com/article/trending/trending-in-india/mumbai-family-celebrates-son-55-percent-marks-with-with-marksheet-cake-10691225/,2026-05-15T22:54:00+00:00
Indian Express,6,viral mountain Maggi stall video,https://indianexpress.com/article/trending/trending-in-india/delhi-content-creator-sell-maggi-in-mountains-reveal-single-day-earnings-in-viral-video-10690878/,2026-05-15T22:54:00+00:00
Indian Express,7,Florida plane crash survivors,https://indianexpress.com/article/trending/trending-globally/florida-plane-crash-11-survivors-stranded-on-raft-for-5-hours-before-rescue-10690734/,2026-05-15T22:54:00+00:00
Indian Express,8,Scarlett Johansson work-life balance,https://indianexpress.com/article/trending/trending-globally/scarlett-johansson-says-work-life-balance-is-not-possible-despite-net-worth-of-165-million-dollars-10690596/,2026-05-15T22:54:00+00:00
Indian Express,9,Indian States with Highest Petrol Consumption,https://indianexpress.com/article/trending/top-10-listing/top-10-indian-states-in-petrol-consumption-up-beats-maharashtra-delhi-rank-10689576/,2026-05-15T22:54:00+00:00
Indian Express,10,Air India halwa puri meal,https://indianexpress.com/article/trending/trending-in-india/pune-woman-amused-after-air-india-serve-halwa-puri-channa-on-delhi-bali-flight-10689409/,2026-05-15T22:54:00+00:00
Indian Express,11,Nanhe Miyan Bareilly storm viral video,https://indianexpress.com/article/trending/trending-in-india/nanhe-miyan-lifted-50-metres-into-air-viral-video-bareilly-up-storm-10689210/,2026-05-15T22:54:00+00:00
Indian Express,12,China school baby doll exercise,https://indianexpress.com/article/trending/trending-globally/china-school-make-rebellious-students-carry-baby-dolls-to-teach-parenting-struggles-10688969/,2026-05-15T22:54:00+00:00
Indian Express,13,UP storm viral video,https://indianexpress.com/article/trending/trending-in-india/up-storm-viral-video-man-thrown-into-air-as-powerful-winds-lash-bareilly-10688840/,2026-05-15T22:54:00+00:00
Indian Express,14,Uber CEO Dara Khosrowshahi Delhi Metro ride,https://indianexpress.com/article/trending/trending-in-india/uber-ceo-dara-khosrowshahi-take-delhi-metro-ride-to-jor-bagh-call-it-fast-affordable-10688691/,2026-05-15T22:54:00+00:00
Indian Express,15,Top 10 countries with largest gold reserves in world,https://indianexpress.com/article/trending/top-10-listing/top-10-countries-with-largest-gold-reserves-in-the-world-10687821/,2026-05-15T22:54:00+00:00
Indian Express,16,Kaddu airport stray dog found,https://indianexpress.com/article/trending/trending-in-india/kaddu-delhi-airport-stray-dog-found-safe-in-dwarka-viral-video-10687797/,2026-05-15T22:54:00+00:00
Indian Express,17,viral underwater sunset video,https://indianexpress.com/article/trending/trending-globally/diver-leave-camera-underwater-in-maui-hawaii-capture-sea-creatures-in-viral-video-10687654/,2026-05-15T22:54:00+00:00
Indian Express,18,Vladimir Putin viral video,https://indianexpress.com/article/trending/trending-globally/russian-president-vladimir-putin-drives-former-school-teacher-to-kremlin-dinner-viral-video-10687494/,2026-05-15T22:54:00+00:00
Indian Express,19,DTC bus stop,https://indianexpress.com/article/trending/trending-in-india/delhi-traffic-police-dtc-bus-stop-blocked-by-car-viral-post-10687155/,2026-05-15T22:54:00+00:00
Indian Express,20,Diljit Dosanjh Chicago concert gender reveal,https://indianexpress.com/article/trending/trending-in-india/diljit-dosanjh-chicago-concert-gender-reveal-viral-video-10687146/,2026-05-15T22:54:00+00:00
Indian Express,21,Princess Jahnavi Kumari Mewar 3 jobs generational wealth,https://indianexpress.com/article/trending/trending-in-india/princess-jahnavi-kumari-mewar-worked-3-jobs-despite-generational-wealth-money-was-never-unlimited-10686962/,2026-05-15T22:54:00+00:00
Indian Express,22,Gir National Park is home to 40 species of mammals and 425 species of birds,https://indianexpress.com/article/trending/trending-in-india/gir-lioness-launches-a-live-hunt-in-front-of-a-tourist-jeep-viral-10686849/,2026-05-15T22:54:00+00:00
Indian Express,23,Top 10 most economically stable countries in the world,https://indianexpress.com/article/trending/top-10-listing/top-10-most-economically-stable-countries-in-the-world-10685987/,2026-05-15T22:54:00+00:00
Indian Express,24,Anupam Mittal work from home policy,https://indianexpress.com/article/trending/trending-in-india/anupam-mittal-work-from-home-for-shaadicom-employees-pm-modi-fuel-saving-policy-10685932/,2026-05-15T22:54:00+00:00
Indian Express,25,Queen Mercy Atang bread dress,https://indianexpress.com/article/trending/trending-globally/reality-tv-star-queen-mercy-atang-bread-dress-amvca-viral-video-10685733/,2026-05-15T22:54:00+00:00
Indian Express,26,waterspout near Odisha coast,https://indianexpress.com/article/trending/trending-in-india/waterspout-near-odisha-puri-astaranga-coast-hatisunda-viral-video-10685517/,2026-05-15T22:54:00+00:00
Indian Express,27,Sachin Tendulkar viral video,https://indianexpress.com/article/trending/trending-in-india/sachin-tendulkar-village-kids-handmade-car-viral-video-10685242/,2026-05-15T22:54:00+00:00
LiveMint,1,Joel Embiid ruled out for Philadelphia 76ers Game 2 vs Knicks due to injury,https://www.livemint.com/us/trending/joel-embiid-ruled-out-for-philadelphia-76ers-game-2-vs-new-york-knicks-due-to-injury-11778089872415.html,2026-05-15T22:54:00+00:00
LiveMint,2,"Carlos Correa injury: Astros place star player on IL, recall Shay Whitcomb",https://www.livemint.com/us/trending/carlos-correa-injury-houston-astros-place-star-player-with-season-ending-left-ankle-injury-on-il-shay-whitcomb-mlb-11778085652310.html,2026-05-15T22:54:00+00:00
LiveMint,3,Bayern Munich vs PSG: Who will win UCL clash? AI predictions and more,https://www.livemint.com/us/trending/bayern-munich-vs-psg-predictions-champions-league-semifinal-lineups-live-streaming-ucl-202526-11778071490090.html,2026-05-15T22:54:00+00:00
LiveMint,4,Are celebs really skipping Met Gala because Jeff Bezos is funding it?,https://www.livemint.com/us/trending/met-gala-are-meryl-streep-zendaya-really-skipping-the-event-because-jeff-bezos-is-funding-it-here-s-the-truth-11777924588506.html,2026-05-15T22:54:00+00:00
LiveMint,5,Met Gala 2026 LIVE Update: Rihanna shines bright like a diamond after Beyonce,https://www.livemint.com/us/trending/met-gala-2026-live-updates-red-carpet-11777915596931.html,2026-05-15T22:54:00+00:00
LiveMint,6,F1: Kimi Antonelli wins 2026 Miami Grand Prix 2026,https://www.livemint.com/us/trending/kimi-antonelli-wins-miami-grand-prix-2026-secures-third-consecutive-f1-win-in-thrilling-race-formula-1-race-11777833243419.html,2026-05-15T22:54:00+00:00
LiveMint,7,Messi steals spotlight at 2026 F1 Miami Grand Prix with Mercedes Paddock visit,https://www.livemint.com/us/trending/lionel-messi-steals-spotlight-at-2026-f1-miami-grand-prix-with-mercedes-paddock-visit-11777828759020.html,2026-05-15T22:54:00+00:00
LiveMint,8,Sinner becomes first man in history to win 5 consecutive ATP Masters 1000 titles,https://www.livemint.com/us/trending/jannik-sinner-becomes-first-man-in-history-to-win-five-consecutive-atp-masters-1000-titles-with-madrid-open-2026-win-11777824491199.html,2026-05-15T22:54:00+00:00
LiveMint,9,Sir Alex Ferguson taken to hospital before Manchester United vs Liverpool clash,https://www.livemint.com/us/trending/sir-alex-ferguson-hospitalized-before-manchester-united-vs-liverpool-clash-at-old-trafford-premier-league-11777821038054.html,2026-05-15T22:54:00+00:00
LiveMint,10,F1: New start time confirmed for Miami Grand Prix 2026 following weather concern,https://www.livemint.com/us/trending/f1-race-today-new-start-time-confirmed-for-miami-grand-prix-2026-following-weather-concerns-1-pm-formula-one-11777815611939.html,2026-05-15T22:54:00+00:00
LiveMint,11,Isack Hadjar disqualified from Miami GP qualifying after Antonelli claims pole,https://www.livemint.com/us/trending/isack-hadjar-disqualified-from-miami-gp-qualifying-over-floor-breach-after-kimi-antonelli-claims-pole-f1-formula-one-11777812192883.html,2026-05-15T22:54:00+00:00
LiveMint,12,F1 standings: Lando Norris wins 2026 Miami Grand Prix sprint; check details,https://www.livemint.com/us/trending/f1-standings-lando-norris-wins-2026-miami-grand-prix-sprint-mclaren-dominates-ahead-of-oscar-piastri-charles-leclerc-11777748165459.html,2026-05-15T22:54:00+00:00
LiveMint,13,Marta Kostyuk wins first WTA 1000 title at Madrid Open defeating Mirra Andreeva,https://www.livemint.com/us/trending/marta-kostyuk-wins-first-wta-1000-title-at-2026-mutua-madrid-open-defeating-mirra-andreeva-tennis-11777741831620.html,2026-05-15T22:54:00+00:00
LiveMint,14,Kofi Kingston and Xavier Woods mutually part ways with WWE; check details,https://www.livemint.com/us/trending/kofi-kingston-and-xavier-woods-mutually-part-ways-with-wwe-new-day-era-ends-after-two-decades-11777737655848.html,2026-05-15T22:54:00+00:00
LiveMint,15,Alex Zanardi death: Ex-F1 driver and Paralympic champion passes away at 59,https://www.livemint.com/us/trending/alex-zanardi-death-ex-f1-driver-and-paralympic-champion-passes-away-at-59-11777722809154.html,2026-05-15T22:54:00+00:00
LiveMint,16,Notre Dame lands four-star QB Wonderful Monds IV for 2027 Class,https://www.livemint.com/us/trending/notre-dame-lands-four-star-qb-wonderful-monds-iv-for-2027-class-future-quarterback-pipeline-gets-major-boost-11777663752062.html,2026-05-15T22:54:00+00:00
LiveMint,17,Las Vegas Raiders release LB Jamin Davis; check details,https://www.livemint.com/us/trending/las-vegas-raiders-release-lb-jamin-davis-nfl-11777648041021.html,2026-05-15T22:54:00+00:00
LiveMint,18,Jannik Sinner breaks Novak Djokovic's record after reaching Madrid Open final,https://www.livemint.com/us/trending/jannik-sinner-breaks-novak-djokovics-record-youngest-ever-to-reach-finals-at-all-atp-masters-1000-events-madrid-open-11777651008351.html,2026-05-15T22:54:00+00:00
LiveMint,19,"Miami Grand Prix 2026: Date, schedule, drivers and more details",https://www.livemint.com/us/trending/f1-miami-grand-prix-2026-date-schedule-drivers-and-more-details-as-formula-1-returns-to-south-florida-11777645272617.html,2026-05-15T22:54:00+00:00
LiveMint,20,Calais Campbell signs one-year deal to reunite with Baltimore Ravens,https://www.livemint.com/us/trending/calais-campbell-signs-one-year-deal-to-reunite-with-baltimore-ravens-for-19th-nfl-season-11777568784994.html,2026-05-15T22:54:00+00:00
LiveMint,21,John Wall named president of basketball operations at Howard University,https://www.livemint.com/us/trending/john-wall-named-president-of-basketball-operations-at-howard-university-nba-star-returns-to-dc-roots-college-basketball-11777563099390.html,2026-05-15T22:54:00+00:00
LiveMint,22,Alexander Blockx stuns Casper Ruud to reach Madrid Open semifinals,https://www.livemint.com/us/trending/alexander-blockx-stuns-casper-ruud-to-reach-madrid-open-semifinals-tennis-11777556320538.html,2026-05-15T22:54:00+00:00
LiveMint,23,Jayson Tatum surpasses Kobe Bryant for second-most playoff points before age 29,https://www.livemint.com/us/trending/jayson-tatum-surpasses-kobe-bryant-for-second-most-playoff-points-in-nba-history-before-age-29-11777553504237.html,2026-05-15T22:54:00+00:00
LiveMint,24,"Jannik Sinner storms into Madrid Open semifinals, beating Rafael Jodar",https://www.livemint.com/us/trending/jannik-sinner-storms-into-madrid-open-semifinals-crushing-teen-sensation-rafael-jodar-s-dream-run-11777482782147.html,2026-05-15T22:54:00+00:00
LiveMint,25,Chelsea's Mykhailo Mudryk appeals four-year FA drugs ban at CAS,https://www.livemint.com/us/trending/mykhailo-mudryk-appeals-four-year-fa-drugs-ban-at-cas-chelseas-winger-hopes-for-early-return-11777480017651.html,2026-05-15T22:54:00+00:00
LiveMint,26,Justin Simmons retires: Denver Broncos All-Pro safety ends NFL career,https://www.livemint.com/us/trending/justin-simmons-retires-four-time-all-pro-safety-ends-nfl-career-with-denver-broncos-11777474772792.html,2026-05-15T22:54:00+00:00
LiveMint,27,Kirsten Storms faces restraining order filed by ex-husband Brandon Barash,https://www.livemint.com/us/trending/kirsten-storms-faces-emergency-restraining-order-as-ex-husband-brandon-barash-raises-alarming-claims-in-court-11777405092046.html,2026-05-15T22:54:00+00:00
LiveMint,28,"Over 20 years later, ‘Friends’ brings in $20 Million a year: Lisa Kudrow reveals",https://www.livemint.com/us/trending/over-20-years-later-friends-brings-in-20-million-a-year-lisa-kudrow-shares-insights-11777400523739.html,2026-05-15T22:54:00+00:00
LiveMint,29,Kimmel responds to Trump’s firing demand with sharp message to Melania,https://www.livemint.com/us/trending/jimmy-kimmel-hits-back-after-expectant-widow-joke-tells-melania-to-address-trump-s-hateful-and-violent-rhetoric-11777382628899.html,2026-05-15T22:54:00+00:00
LiveMint,30,"Harry Styles-Zoë Kravitz Ring: A Look at the Rumoured $350,000 Sparkler",https://www.livemint.com/us/trending/harry-styles-zo-kravitz-engagement-ring-a-closer-look-at-the-rumoured-350-000-sparkler-11777318122710.html,2026-05-15T22:54:00+00:00
LiveMint,31,Chelsea 1-0 Leeds: Enzo Fernandez header sends Blues to 2026 FA Cup final,https://www.livemint.com/us/trending/chelsea-1-0-leeds-enzo-fernandez-header-sends-blues-to-2026-fa-cup-final-manchester-city-11777230733431.html,2026-05-15T22:54:00+00:00
LiveMint,32,Deion Sanders shows strong support for Diego Pavia after 2026 NFL draft snub,https://www.livemint.com/us/trending/deion-sanders-diego-pavia-undrafted-2026-nfl-draft-snub-11777213593804.html,2026-05-15T22:54:00+00:00
LiveMint,33,Luxury vs struggle: Former Iranian diplomat’s son exposes harsh reality gap,https://www.livemint.com/us/trending/private-jets-parties-scantily-clad-women-former-iranian-diplomat-s-son-exposes-countrys-deep-inequality-11777220729337.html,2026-05-15T22:54:00+00:00
LiveMint,34,Lawrence Taylor medical emergency: Giants legend hospitalized in New Jersey,https://www.livemint.com/us/trending/lawrence-taylor-medical-emergency-new-york-giants-legend-hospitalized-in-new-jersey-nfl-11777058394793.html,2026-05-15T22:54:00+00:00
LiveMint,35,Carlos Alcaraz withdraws from Roland Garros 2026; check details,https://www.livemint.com/us/trending/carlos-alcaraz-withdraws-roland-garros-2026-french-open-defending-champion-misses-title-defense-wrist-injury-tennis-11777049401197.html,2026-05-15T22:54:00+00:00
LiveMint,36,Fact you may not know: This war lasted shorter than your commute to office,https://www.livemint.com/us/trending/fact-you-probably-dont-know-this-battle-between-two-countries-lasted-shorter-than-your-commute-to-office-11777041884176.html,2026-05-15T22:54:00+00:00
LiveMint,37,David Wilcock harassed by 'cyber-stalkers'? Corey Goode drops shocking claims,https://www.livemint.com/us/trending/ufo-expert-david-wilcock-harassed-by-cyber-stalkers-corey-goode-drops-shocking-claims-after-his-death-11776888810059.html,2026-05-15T22:54:00+00:00
LiveMint,38,"David Wilcock death: Friend shares final moments, reveals he was ‘misunderstood'",https://www.livemint.com/us/trending/david-wilcock-death-best-friend-shares-final-moments-reveals-he-was-excited-about-the-future-11776886359815.html,2026-05-15T22:54:00+00:00
LiveMint,39,Padres sign Lucas Giolito: Veteran pitcher joins San Diego rotation,https://www.livemint.com/us/trending/padres-sign-lucas-giolito-to-one-year-deal-veteran-pitcher-joins-san-diego-rotation-amid-injury-woes-mlb-baseball-11776879659418.html,2026-05-15T22:54:00+00:00
LiveMint,40,Mark to Market,https://www.livemint.com/market/mark-to-market,2026-05-15T22:54:00+00:00
LiveMint,41,Emerging Markets Join Global Selloff as Borrowing Costs Soar,https://www.livemint.com/market/emerging-markets-join-global-selloff-as-borrowing-costs-soar-11778878727122.html,2026-05-15T22:54:00+00:00
LiveMint,42,Yield-Hungry Investors Bet on Credit as Government Debt Sours,https://www.livemint.com/market/yieldhungry-investors-bet-on-credit-as-government-debt-sours-11778875471209.html,2026-05-15T22:54:00+00:00
LiveMint,43,Dollar climbs for fifth straight day as Treasury yields surge,https://www.livemint.com/market/dollar-climbs-for-fifth-straight-day-as-treasury-yields-surge-11778872652229.html,2026-05-15T22:54:00+00:00
LiveMint,44,Wall Street pulls back from all-time highs on inflation worries,https://www.livemint.com/market/wall-street-pulls-back-from-all-time-highs-on-inflation-worries-11778870383850.html,2026-05-15T22:54:00+00:00
LiveMint,45,Are U.S. Markets Acting Like Meme Stocks? Some Actions Have Investors Worried.,https://www.livemint.com/market/are-u-s-markets-acting-like-meme-stocks-some-actions-have-investors-worried-11778867649348.html,2026-05-15T22:54:00+00:00
LiveMint,46,"Gold, silver rates today: Comex gold plunges $171/oz; silver down $9.1 on inflation worries, firm US dollar",https://www.livemint.com/market/commodities/gold-silver-rates-today-comex-gold-plunges-171-oz-silver-down-9-1-on-inflation-worries-firm-us-dollar-11778860351116.html,2026-05-15T22:54:00+00:00
LiveMint,47,James Bond auditions officially begin as producers search for next 007 after Daniel Craig,https://www.livemint.com/news/trends/james-bond-auditions-officially-begin-as-producers-search-for-next-007-after-daniel-craig-11778879316925.html,2026-05-15T22:54:00+00:00
LiveMint,48,"Who is Mohammad Baqer Saad Dawood Al-Saadi, Kata’ib Hizballah commander arrested by US over terror plot charges",https://www.livemint.com/news/us-news/who-is-mohammad-baqer-saad-dawood-al-saadi-kata-ib-hizballah-commander-arrested-by-us-over-terror-plot-charges-11778879162038.html,2026-05-15T22:54:00+00:00
LiveMint,49,US officials suspect Iranian hackers behind breaches of fuel monitoring systems at gas stations across states: Report,https://www.livemint.com/news/us-news/us-officials-suspect-iranian-hackers-behind-breaches-of-fuel-monitoring-systems-at-gas-stations-across-states-report-11778874660506.html,2026-05-15T22:54:00+00:00
LiveMint,50,"NJ Transit, LIRR Trains Disrupted After Fire Near Penn Station",https://www.livemint.com/news/nj-transit-lirr-trains-disrupted-after-fire-near-penn-station-11778874614918.html,2026-05-15T22:54:00+00:00
LiveMint,51,Judge declares Harvey Weinstein sex crimes retrial in Manhattan a mistrial after jury deadlock,https://www.livemint.com/news/us-news/judge-declares-harvey-weinstein-sex-crimes-retrial-in-manhattan-a-mistrial-after-jury-deadlock-11778870671783.html,2026-05-15T22:54:00+00:00
LiveMint,52,David Letterman returns to Stephen Colbert’s Late Show with sharp attack on CBS ahead of finale,https://www.livemint.com/news/us-news/david-letterman-returns-to-stephen-colbert-s-late-show-with-sharp-attack-on-cbs-ahead-of-finale-11778863968713.html,2026-05-15T22:54:00+00:00
LiveMint,53,Berkshire Hathaway triples Alphabet stake and invests in Delta and Macys under new CEO,https://www.livemint.com/companies/berkshire-hathaway-triples-alphabet-stake-and-invests-in-delta-and-macys-under-new-ceo-11778885136179.html,2026-05-15T22:54:00+00:00
LiveMint,54,"Exclusive-SpaceX accelerates IPO timeline, targets June 12 listing on Nasdaq, sources say",https://www.livemint.com/companies/exclusivespacex-accelerates-ipo-timeline-targets-june-12-listing-on-nasdaq-sources-say-11778874615504.html,2026-05-15T22:54:00+00:00
LiveMint,55,Sherritt to Dissolve Cuba Mining Venture Due to US Sanctions,https://www.livemint.com/companies/sherritt-to-dissolve-cuba-mining-venture-due-to-us-sanctions-11778869834455.html,2026-05-15T22:54:00+00:00
LiveMint,56,"Tata Steel ended FY26 on a strong note, aided by higher volumes and firm steel prices",https://www.livemint.com/companies/tata-steel-ended-fy26-on-a-strong-note-aided-by-higher-volumes-and-firm-steel-prices-11778855911355.html,2026-05-15T22:54:00+00:00
LiveMint,57,Charity commissioner halts Tata Trusts board meeting after Srinivasan's complaint,https://www.livemint.com/companies/news/tata-trusts-board-meeting-venu-srinivasan-tata-sons-charity-commissioner-noel-tata-11778856708193.html,2026-05-15T22:54:00+00:00
LiveMint,58,JioStar initiates legal measures against Zee entertainment for alleged unauthorised airing of Bollywood films: Report,https://www.livemint.com/companies/jiostar-initiates-legal-measures-against-zee-entertainment-for-alleged-unauthorised-airing-of-bollywood-films-report-11778847237342.html,2026-05-15T22:54:00+00:00
LiveMint,59,Ask Mint Money,https://www.livemint.com/money/ask-mint-money,2026-05-15T22:54:00+00:00
LiveMint,60,"₹1 lakh monthly salary plan: How much should go to SIP, FD, PPF and emergency fund?",https://www.livemint.com/money/personal-finance/1-lakh-monthly-salary-plan-how-much-should-go-to-sip-fd-ppf-and-emergency-fund-11778862392700.html,2026-05-15T22:54:00+00:00
LiveMint,61,B-khata to A-khata: Bengaluru camps to offer on-the-spot help to property owners from 16 May,https://www.livemint.com/money/personal-finance/bkhata-to-a-khata-bengaluru-camps-to-offer-on-the-spot-help-to-property-owners-from-16-may-11778863143365.html,2026-05-15T22:54:00+00:00
LiveMint,62,Marginal relief in income tax explained: Who it applies to and how it works under new vs old tax regime,https://www.livemint.com/money/personal-finance/marginal-relief-in-income-tax-explained-who-it-applies-to-and-how-it-works-under-new-vs-old-tax-regime-11778858090598.html,2026-05-15T22:54:00+00:00
LiveMint,63,₹30 lakh CTC breakdown: How much in-hand salary can you actually get?,https://www.livemint.com/money/personal-finance/30-lakh-ctc-breakdown-how-much-in-hand-salary-can-you-actually-get-11778859776863.html,2026-05-15T22:54:00+00:00
LiveMint,64,Gift tax rules explained: Who can give you money or assets without tax implications?,https://www.livemint.com/money/personal-finance/gift-tax-rules-explained-who-can-give-you-money-or-assets-without-tax-implications-11778848387023.html,2026-05-15T22:54:00+00:00
LiveMint,65,"You can earn up to ₹69,000 monthly income from ₹1 crore FD in small finance banks. Here's how",https://www.livemint.com/money/personal-finance/you-can-earn-up-to-69-000-monthly-income-from-1-crore-fd-in-small-finance-banks-heres-how-11778844735389.html,2026-05-15T22:54:00+00:00
LiveMint,66,Tech CEOs summoned to Congress for another hearing on social medias risks for children,https://www.livemint.com/technology/tech-ceos-summoned-to-congress-for-another-hearing-on-social-medias-risks-for-children-11778865978171.html,2026-05-15T22:54:00+00:00
LiveMint,67,I will be skipping a gaming laptop for a thin and light laptop in 2026 and you should too,https://www.livemint.com/technology/gadgets/i-will-be-skipping-a-gaming-laptop-for-a-thin-and-light-laptop-in-2026-and-you-should-too-11778840544526.html,2026-05-15T22:54:00+00:00
LiveMint,68,From Essential to Fire Phone: 10 smartphone startups and brands that failed despite massive hype,https://www.livemint.com/technology/from-essential-to-fire-phone-10-smartphone-startups-and-brands-that-failed-despite-massive-hype-11778829097916.html,2026-05-15T22:54:00+00:00
LiveMint,69,"Big Tech turns to Sesame Street, Girl Scouts to deflect scrutiny over kids screen time",https://www.livemint.com/technology/big-tech-turns-to-sesame-street-girl-scouts-to-deflect-scrutiny-over-kids-screen-time-11778787176237.html,2026-05-15T22:54:00+00:00
LiveMint,70,"Musk, OpenAI lawyers begin closing arguments in landmark trial that could shape AIs future",https://www.livemint.com/technology/musk-openai-lawyers-begin-closing-arguments-in-landmark-trial-that-could-shape-ais-future-11778777834157.html,2026-05-15T22:54:00+00:00
LiveMint,71,Want a smartwatch for swimming and workouts? Top water resistant options to consider,https://www.livemint.com/technology/gadgets/want-a-smartwatch-for-swimming-and-workouts-top-water-resistant-options-to-consider-11778745211481.html,2026-05-15T22:54:00+00:00
LiveMint,72,IPL 2026 Schedule,https://www.livemint.com/sports/cricket-news/ipl-schedule,2026-05-15T22:54:00+00:00
LiveMint,73,Orange Cap in IPL 2026,https://www.livemint.com/sports/cricket-news/ipl-orange-cap,2026-05-15T22:54:00+00:00
LiveMint,74,Purple Cap in IPL 2026,https://www.livemint.com/sports/cricket-news/ipl-purple-cap,2026-05-15T22:54:00+00:00
LiveMint,75,IPL 2026 Points Table,https://www.livemint.com/sports/cricket-news/ipl-points-table,2026-05-15T22:54:00+00:00
LiveMint,76,IFSC Code Finder,https://www.livemint.com/ifsc-code,2026-05-15T22:54:00+00:00
LiveMint,77,Income Tax Calculator,https://www.livemint.com/tools-calculators/income-tax-calculator,2026-05-15T22:54:00+00:00
LiveMint,78,Gold Rate Today,https://www.livemint.com/gold-prices,2026-05-15T22:54:00+00:00
LiveMint,79,Gold Rate in Delhi,https://www.livemint.com/gold-prices/delhi,2026-05-15T22:54:00+00:00
LiveMint,80,Gold Rate Hyderabad,https://www.livemint.com/gold-prices/hyderabad,2026-05-15T22:54:00+00:00
LiveMint,81,Silver Rate Today,https://www.livemint.com/silver-prices,2026-05-15T22:54:00+00:00
LiveMint,82,Silver Rate in Delhi,https://www.livemint.com/silver-prices/delhi,2026-05-15T22:54:00+00:00
LiveMint,83,Silver Rate in Bangalore,https://www.livemint.com/silver-prices/bangalore,2026-05-15T22:54:00+00:00
