source,rank,headline,link,collected_at_iso
NDTV,2,What Top Court Said On Centre's Objection To DY Chandrachud's View On Adultery,https://www.ndtv.com/india-news/who-is-this-segal-supreme-court-on-centre-objection-to-dy-chandrachud-view-on-adultery-11331006,2026-04-08T20:43:04+00:00
NDTV,3,"Pune Doctor, 75, Duped Of Rs 12 Crore In Share Market Investment Fraud: Cops",https://www.ndtv.com/india-news/pune-doctor-75-duped-of-rs-12-crore-in-share-market-investment-fraud-cops-11330917,2026-04-08T20:43:04+00:00
NDTV,4,Inside 15-Minute Meet Between Trinamool Congress And Poll Body Chief,https://www.ndtv.com/india-news/inside-15-minute-meet-between-trinamool-congress-and-poll-body-chief-11330909,2026-04-08T20:43:04+00:00
NDTV,5,UP Woman Beats 3-Year-Old Stepdaughter To Death: Police,https://www.ndtv.com/india-news/up-woman-beats-3-year-old-stepdaughter-to-death-police-11330902,2026-04-08T20:43:04+00:00
NDTV,6,BJP's Bengal Candidate Shankar Ghosh Charged For Obstructing Police Duty,https://www.ndtv.com/india-news/bjps-bengal-candidate-shankar-ghosh-charged-for-obstructing-police-duty-11330848,2026-04-08T20:43:04+00:00
NDTV,7,"School Assembly News Headlines (April 9): Top National, World, Education News",https://www.ndtv.com/education/school-assembly-news-headlines-april-9-top-national-world-sports-education-news-11330605,2026-04-08T20:43:04+00:00
NDTV,8,Which Are The World's Top Universities For Studying International Relations,https://www.ndtv.com/education/which-university-is-best-in-the-world-for-studying-international-relations-heres-what-rankings-show-11329622,2026-04-08T20:43:04+00:00
NDTV,9,NMC Warns Colleges Against Charging MBBS Fees Beyond Four And A Half Years,https://www.ndtv.com/education/nmc-directs-medical-colleges-not-to-charge-mbbs-fees-beyond-4-5-year-academic-duration-11328973,2026-04-08T20:43:04+00:00
NDTV,10,"Karnataka 2nd PUC Result 2026 To Be Out Tomorrow At 3 PM, Here's How To Check",https://www.ndtv.com/education/karnataka-2nd-puc-result-2026-live-karnataka-board-kseab-12th-result-date-time-check-official-notice-direct-link-here-11328556,2026-04-08T20:43:04+00:00
NDTV,11,"KVS Balvatika Lottery Provisional Result Out, Here's Direct Link To Check",https://www.ndtv.com/education/kvs-balvatika-lottery-result-2026-out-provisional-selection-list-released-heres-direct-link-to-check-11328200,2026-04-08T20:43:04+00:00
NDTV,12,Assembly Elections 2026,https://www.ndtv.com/elections,2026-04-08T20:43:04+00:00
NDTV,13,"Mojtaba Khamenei, Largely MIA, Helped Cut Truce Deal With US: Report",https://www.ndtv.com/world-news/iran-war-ceasefire-iran-us-war-update-2-hours-before-trumps-deadline-a-deal-was-made-mojtabas-role-was-key-11327273,2026-04-08T20:43:04+00:00
NDTV,14,Iran Closes Strait Of Hormuz In Response To Israeli Strikes On Lebanon,https://www.ndtv.com/world-news/us-iran-war-us-iran-ceasefire-donald-trump-iran-closes-strait-of-hormuz-in-response-to-israeli-strikes-on-lebanon-11330466,2026-04-08T20:43:04+00:00
NDTV,15,"Israel Unhappy, Says US Kept It In Dark On Ceasefire Deal With Iran Until End",https://www.ndtv.com/world-news/israel-unhappy-says-us-kept-it-in-dark-on-ceasefire-deal-with-iran-until-end-11330371,2026-04-08T20:43:04+00:00
NDTV,16,"Iran Issues 10-Point Ceasefire Conditions, Trump Says ""Plan Workable""",https://www.ndtv.com/world-news/iran-us-war-news-irans-10-ceasefire-conditions-uranium-enrichment-hormuz-control-donald-trump-says-proposal-workable-11326086,2026-04-08T20:43:04+00:00
NDTV,17,"Oil Refinery In Iran Struck Despite Ceasefire, Tehran Strikes Kuwait, UAE",https://www.ndtv.com/world-news/oil-refinery-in-iran-struck-despite-ceasefire-tehran-strikes-kuwait-uae-reports-11328385,2026-04-08T20:43:04+00:00
NDTV,18,"Live: Trump Will Send JD Vance To Pakistan For Iran Talks, Says White House",https://www.ndtv.com/world-news/us-israel-iran-war-live-updates-us-iran-ceasefire-missile-strikes-middle-east-crisis-conflict-live-news-iran-drone-attack-trump-ceasefire-strait-of-ho-11325915,2026-04-08T20:43:04+00:00
NDTV,19,Why Both US And Iran Trusted Pakistan As Mediator In Ceasefire Talks,https://www.ndtv.com/world-news/iran-war-pakistan-us-iran-ceasefire-asim-munir-why-both-us-and-iran-trusted-pakistan-as-mediator-in-ceasefire-talks-11326840,2026-04-08T20:43:04+00:00
NDTV,20,"""We Are In World War"": Billionaire Investor Says China, Russia Won In Iran",https://www.ndtv.com/world-news/iran-us-war-news-ray-dalio-we-are-in-world-war-billionaire-investor-calls-china-russia-winners-11326949,2026-04-08T20:43:04+00:00
NDTV,21,"Centre Says Time To Remove PIL As Concept; Supreme Court Says ""We're Cautious""",https://www.ndtv.com/india-news/centre-says-time-to-remove-pil-as-a-concept-supreme-court-says-we-are-cautious-11330343,2026-04-08T20:43:04+00:00
NDTV,22,'Ketamine Queen' Jailed For 15 Years For Selling Drugs To Matthew Perry,https://www.ndtv.com/world-news/ketamine-queen-jailed-for-15-years-for-selling-drugs-to-friends-star-matthew-perry-11330927,2026-04-08T20:43:04+00:00
NDTV,23,"BMW Hires 19-Year-Old Without Degree, Viral LinkedIn Post Sparks Debate",https://www.ndtv.com/feature/bmw-hires-19-year-old-without-degree-viral-linkedin-post-sparks-debate-on-personal-branding-11327030,2026-04-08T20:43:04+00:00
NDTV,24,"Iran's Mojtaba Orders Military To Stop Firing, But Warns ""Not End Of War""",https://www.ndtv.com/world-news/not-end-of-war-irans-mojtaba-khamenei-warns-as-he-orders-its-military-to-stop-firing-11326048,2026-04-08T20:43:04+00:00
NDTV,25,"Boss Rejects Sick Leave Without Hospitalisation, Sparks Workplace Debate",https://www.ndtv.com/offbeat/manager-rejects-employees-sick-leave-without-hospitalisation-proof-sparks-debate-on-workplace-etiquette-11330054,2026-04-08T20:43:04+00:00
NDTV,26,The Gulf Country That Stands to Gain Most From Iran's Ceasefire Plan,https://www.ndtv.com/world-news/iran-us-war-news-in-irans-ceasefire-plan-a-hormuz-size-gain-for-oman-11326976,2026-04-08T20:43:04+00:00
NDTV,27,Trump Announces 2-Week Ceasefire With Iran: Here's Full Statement,https://www.ndtv.com/world-news/us-iran-ceasefire-updates-shehbaz-sharif-asim-munir-pakistan-israel-war-news-trump-agrees-to-two-week-ceasefire-with-iran-full-statement-truth-social-11325832,2026-04-08T20:43:04+00:00
NDTV,28,'Get Lost' vs 'Stay Quiet': An Election Body-Trinamool Congress Showdown,https://www.ndtv.com/india-news/derek-obrien-election-commission-gyanesh-kumar-get-lost-vs-stay-quiet-an-election-body-trinamool-congress-showdown-11327170,2026-04-08T20:43:04+00:00
NDTV,29,"Hrithik Roshan Reacts To Ramayana's VFX Backlash: ""It's Painful To Watch""",https://www.ndtv.com/entertainment/hrithik-roshan-defends-artistic-intent-behind-ramayana-quot-bad-vfx-quot-controversy-11313090,2026-04-08T20:43:04+00:00
NDTV,30,Janhvi Kapoor Teases Varun Dhawan On New Film Still With Pooja Hegde: 'But Why Are You Screaming In Caption?',https://www.ndtv.com/entertainment/janhvi-kapoor-teases-varun-dhawan-on-new-film-still-with-pooja-hegde-but-why-are-you-screaming-in-caption-11322878,2026-04-08T20:43:04+00:00
NDTV,31,Priyadarshan Reveals Why He Divorced Ex-Wife Lissy After Confirming Reunion: 'Ego And Boredom Worked On Us',https://www.ndtv.com/entertainment/priyadarshan-reveals-why-he-divorced-ex-wife-lissy-after-confirming-reunion-ego-and-boredom-worked-on-us-11321187,2026-04-08T20:43:04+00:00
NDTV,32,"Ramayana Cast Salary: Rs 150 Crore For Ranbir Kapoor, Yash Takes Home Rs 100 Crore",https://www.ndtv.com/entertainment/ramayana-cast-salary-rs-150-crore-for-ranbir-kapoor-yash-takes-home-rs-100-crore-11305724,2026-04-08T20:43:04+00:00
NDTV,33,Dhurandhar Casting Director Says 3 Actors Rejected Rehman Dakait's Role: 'They Regret That Decision Today',https://www.ndtv.com/entertainment/dhurandhar-casting-director-says-3-actors-rejected-rehman-dakaits-role-they-regret-that-decision-today-11309471,2026-04-08T20:43:04+00:00
NDTV,34,"Ajay Devgn Gets Roasted By Kajol On His 57th Birthday: ""Candles On The Cake Look Less Like A Celebration""",https://www.ndtv.com/entertainment/ajay-devgn-gets-roasted-by-kajol-on-his-57th-birthday-candles-on-the-cake-look-less-like-a-celebration-11301945,2026-04-08T20:43:04+00:00
NDTV,35,Latest News Today,https://www.ndtv.com/latest,2026-04-08T20:43:04+00:00
NDTV,36,Education News India,https://www.ndtv.com/education,2026-04-08T20:43:04+00:00
NDTV,37,Latest Business News,https://www.ndtv.com/business-news,2026-04-08T20:43:04+00:00
