source,rank,headline,link,collected_at_iso
LiveMint,81,Silver Rate in Bangalore,https://www.livemint.com/silver-prices/bangalore,2026-05-14T10:15:17+00:00
LiveMint,82,US Stock Market,https://www.livemint.com/market/us-market,2026-05-14T10:15:17+00:00
LiveMint,83,Terms of Use,https://www.livemint.com/terms-of-use,2026-05-14T10:15:17+00:00
LiveMint,84,Code of ethics,https://www.livemint.com/code-of-ethics,2026-05-14T10:15:17+00:00
LiveMint,85,CBSE Class 12 Result 2026,https://www.livemint.com/education/cbse-class-12th-result-2026-live-results-to-be-out-at-cbseresults-nic-in-today-heres-how-to-check-score-11778633818664.html,2026-05-14T10:15:17+00:00
LiveMint,86,MCX Gold Rate,https://www.livemint.com/market/market-stats/commodity-mcx-gold-price,2026-05-14T10:15:17+00:00
LiveMint,87,MCX Silver Price,https://www.livemint.com/market/market-stats/commodity-mcx-silver-price,2026-05-14T10:15:17+00:00
LiveMint,88,Gold Price in Mumbai,https://www.livemint.com/gold-prices/mumbai,2026-05-14T10:15:17+00:00
LiveMint,89,Gold Price in Chennai,https://www.livemint.com/gold-prices/chennai,2026-05-14T10:15:17+00:00
LiveMint,90,Gold Price in Kolkata,https://www.livemint.com/gold-prices/kolkata,2026-05-14T10:15:17+00:00
LiveMint,91,Silver Price in Mumbai,https://www.livemint.com/silver-prices/mumbai,2026-05-14T10:15:17+00:00
LiveMint,92,Silver Price in Chennai,https://www.livemint.com/silver-prices/chennai,2026-05-14T10:15:17+00:00
LiveMint,93,Silver Price in Hyderabad,https://www.livemint.com/silver-prices/hyderabad,2026-05-14T10:15:17+00:00
LiveMint,94,Silver Price in Kolkata,https://www.livemint.com/silver-prices/kolkata,2026-05-14T10:15:17+00:00
LiveMint,95,Latest News Today,https://www.livemint.com/news,2026-05-14T10:15:17+00:00
LiveMint,96,US News Today,https://www.livemint.com/news/us-news,2026-05-14T10:15:17+00:00
LiveMint,97,Top Company Leader,https://www.livemint.com/companies/people,2026-05-14T10:15:17+00:00
LiveMint,98,personal loan emi calculator,https://www.livemint.com/loans/personal-loan-emi-calculator,2026-05-14T10:15:17+00:00
LiveMint,99,Personal Loan Interest Rate,https://www.livemint.com/loans/personal-loan-interest-rates,2026-05-14T10:15:17+00:00
LiveMint,100,Personal Loan Eligibility,https://www.livemint.com/loans/personal-loan-eligibility,2026-05-14T10:15:17+00:00
LiveMint,101,Instant Personal Loan,https://www.livemint.com/loans/instant-personal-loan,2026-05-14T10:15:17+00:00
LiveMint,102,Home Loan EMI Calculator,https://www.livemint.com/tools-calculators/home-loan-emi-calculator,2026-05-14T10:15:17+00:00
LiveMint,103,Car Loan EMI,https://www.livemint.com/tools-calculators/car-loan-calculator,2026-05-14T10:15:17+00:00
India Today,1,Traumatised: Indian woman recounts humiliating ordeal from airport in Laos,https://www.indiatoday.in/trending-news/story/indian-woman-recounts-humiliating-ordeal-from-airport-in-laos-2911484-2026-05-14,2026-05-14T10:15:17+00:00
India Today,2,"Man finds 'Click Buddy' at Indian wedding, a one-stop solution to Insta-worthy clicks",https://www.indiatoday.in/trending-news/story/man-finds-click-buddy-at-indian-wedding-a-one-stop-solution-to-insta-worthy-clicks-2911599-2026-05-14,2026-05-14T10:15:17+00:00
India Today,3,Shaadi.com's Anupam Mittal makes Wednesdays WFH days after PM Modi's appeal,https://www.indiatoday.in/trending-news/story/shaadicom-anupam-mittal-makes-wednesdays-wfh-days-after-pm-modi-appeal-2911525-2026-05-14,2026-05-14T10:15:17+00:00
India Today,4,"Pune woman receives late-night texts from restaurant staff, management fires him",https://www.indiatoday.in/trending-news/story/pune-woman-says-staff-member-used-qr-menu-data-to-send-late-night-texts-2911463-2026-05-14,2026-05-14T10:15:17+00:00
India Today,5,Uber CEO picks Delhi metro over road travel during India visit,https://www.indiatoday.in/trending-news/story/uber-ceo-picks-delhi-metro-over-roads-during-india-visit-calls-it-fast-reliable-2911410-2026-05-14,2026-05-14T10:15:17+00:00
India Today,6,"US woman plays tic-tac-toe with pet axolotl, but no one would've guessed who won",https://www.indiatoday.in/trending-news/story/us-woman-plays-tic-tac-toe-with-pet-axolotl-but-no-one-wouldve-guessed-who-won-2911268-2026-05-13,2026-05-14T10:15:17+00:00
India Today,7,"Hyderabad family drives at high speed with children in open boot, police reacts",https://www.indiatoday.in/trending-news/story/hyderabad-family-drives-at-high-speed-with-children-in-open-boot-police-reacts-2911233-2026-05-13,2026-05-14T10:15:17+00:00
India Today,8,"Delhi man sells Maggi for Rs 100 in mountains, here's how much he earned in a day",https://www.indiatoday.in/trending-news/story/delhi-man-sells-maggi-for-rs-100-in-mountains-heres-how-much-he-earned-in-a-day-2911164-2026-05-13,2026-05-14T10:15:17+00:00
India Today,9,Kerala ticket checker tracks down passenger to return AirPods left behind on train,https://www.indiatoday.in/trending-news/story/kerala-ticket-checker-tracks-down-passenger-to-return-airpods-left-behind-on-train-2911149-2026-05-13,2026-05-14T10:15:17+00:00
India Today,10,"As UK politics spiral again, Downing Street's Larry the cat has only one concern",https://www.indiatoday.in/trending-news/story/as-uk-politics-spiral-again-downing-streets-larry-the-cat-has-only-one-concern-2911132-2026-05-13,2026-05-14T10:15:17+00:00
India Today,11,"US techie shares why he feels 'unhireable' after 2,000 job recruiters ghost him",https://www.indiatoday.in/trending-news/story/us-techie-shares-why-he-feels-unhireable-after-2000-job-recruiters-ghost-him-2911098-2026-05-13,2026-05-14T10:15:17+00:00
India Today,12,Amazon employee shares heartwarming story of mother's manifestation coming true,https://www.indiatoday.in/trending-news/story/amazon-employee-shares-heartwarming-story-of-mothers-manifestation-coming-true-2911107-2026-05-13,2026-05-14T10:15:17+00:00
India Today,13,Hyderabad's new 'Feel the Jail' museum lets visitors see what prison life feels like,https://www.indiatoday.in/trending-news/story/hyderabads-new-feel-the-jail-museum-lets-visitors-see-what-prison-life-feels-like-2911045-2026-05-13,2026-05-14T10:15:17+00:00
India Today,14,Tourists get front-row seat to lioness' hunt in Gujarat's Gir forest,https://www.indiatoday.in/trending-news/story/tourists-get-front-row-seat-to-lioness-hunt-in-gujarats-gir-forest-2911038-2026-05-13,2026-05-14T10:15:17+00:00
India Today,15,"It's May 13, and Google India has officially joined the Main Tera trend",https://www.indiatoday.in/trending-news/story/its-may-13-and-google-india-has-officially-joined-the-main-tera-trend-2911029-2026-05-13,2026-05-14T10:15:17+00:00
India Today,16,"Elderly vendor folds hands after 'harassment' by staff on train, Railways reacts",https://www.indiatoday.in/trending-news/story/elderly-vendor-folds-hands-after-harassment-by-staff-on-train-railways-reacts-2911015-2026-05-13,2026-05-14T10:15:17+00:00
India Today,17,"Employee fired 2 days before notice period ends, HR's reason has people confused",https://www.indiatoday.in/trending-news/story/employee-fired-2-days-before-notice-period-ends-hrs-reason-has-people-confused-2910997-2026-05-13,2026-05-14T10:15:17+00:00
India Today,18,Gen Z employee quits on the spot with brutal message after boss humiliates her,https://www.indiatoday.in/trending-news/story/gen-z-employee-quits-on-the-spot-with-brutal-message-after-boss-humiliates-her-2910995-2026-05-13,2026-05-14T10:15:17+00:00
India Today,19,Your share of mosquitoes are biting me: AMU students fight over using net,https://www.indiatoday.in/trending-news/story/aligarh-muslim-university-mosquito-net-dispute-hostel-fight-2910952-2026-05-13,2026-05-14T10:15:17+00:00
India Today,20,"Mumbai student shares how she survives in the city on a Rs 25,000 monthly budget",https://www.indiatoday.in/trending-news/story/mumbai-student-shares-how-she-survives-rs-25000-monthly-budget-andheri-east-pg-rent-2910961-2026-05-13,2026-05-14T10:15:17+00:00
India Today,21,Golden chance for Arshdeep Singh to find form: S Badrinath ahead of MI clash,https://www.indiatoday.in/sports/cricket/story/s-badrinath-arshdeep-singh-pbks-mi-fatigue-workload-comments-playoff-race-2911636-2026-05-14,2026-05-14T10:15:17+00:00
India Today,22,"Oracle revokes IIT, NIT placement offers, leaves campus dreams hanging mid-air",https://www.indiatoday.in/jobs/story/oracle-revokes-campus-placement-offers-at-iits-nits-educ-2911628-2026-05-14,2026-05-14T10:15:17+00:00
India Today,23,"Covid-19 death toll far higher than official numbers, says WHO",https://www.indiatoday.in/health/story/covid-19-death-toll-far-higher-than-official-numbers-says-who-2911627-2026-05-14,2026-05-14T10:15:17+00:00
India Today,24,Trisha stuns in ice-blue Kanjeevaram and jasmine flowers at Vijay's oath,https://www.indiatoday.in/movies/regional-cinema/story/trisha-krishnan-vijay-oath-taking-ceremony-chennai-nehru-stadium-2909383-2026-05-10,2026-05-14T10:15:17+00:00
India Today,25,Take Pak citizenship: Congress leader to Dhurandhar critic over propaganda claim,https://www.indiatoday.in/movies/celebrities/story/shama-mohamed-dhurandhar-part-1-x-row-propaganda-film-remark-2908455-2026-05-08,2026-05-14T10:15:17+00:00
India Today,26,"MLAs favoured KC Venugopal, yet he was passed over for Kerala CM. Here's why",https://www.indiatoday.in/india/kerala/story/kerala-chief-minister-vd-satheesan-cm-kc-venugopal-congress-leaderhip-public-mood-ally-backing-mla-assembly-2911626-2026-05-14,2026-05-14T10:15:17+00:00
India Today,27,"Karachi's cocaine queen' gets VIP treatment after arrest, viral video sparks row",https://www.indiatoday.in/world/story/karachi-cocaine-queen-vip-treatment-sparks-controversy-2911166-2026-05-13,2026-05-14T10:15:17+00:00
India Today,28,Over Rs 12 crore in 90 days: This is how much money Nothing Store in Bengaluru has made so far,https://www.indiatoday.in/technology/news/story/over-rs-12-crore-in-90-days-this-is-how-much-money-nothing-store-in-bengaluru-has-made-so-far-2911634-2026-05-14,2026-05-14T10:15:17+00:00
TOI ETimes,1,Hyderabad-based Amazon employee shares what not to say at work,https://timesofindia.indiatimes.com/articleshow/130726842.cms,2026-05-14T10:15:17+00:00
TOI ETimes,2,Salad topper recalled over salmonella risk,https://timesofindia.indiatimes.com/articleshow/130458722.cms,2026-05-14T10:15:17+00:00
TOI ETimes,3,Rebel Wilson weight loss: How she lost 36 kgs without extreme dieting - Ozempic or lifestyle?,https://timesofindia.indiatimes.com/articleshow/130457577.cms,2026-05-14T10:15:17+00:00
TOI ETimes,4,Viral: India-Australia work-life comparison sparks debate on ‘hustle culture’,https://timesofindia.indiatimes.com/articleshow/130456543.cms,2026-05-14T10:15:17+00:00
TOI ETimes,5,What is the meaning of Indian summer in the UK?,https://timesofindia.indiatimes.com/articleshow/130436405.cms,2026-05-14T10:15:17+00:00
TOI ETimes,6,This sympathetic syndrome makes Fathers feel pregnant,https://timesofindia.indiatimes.com/articleshow/130451612.cms,2026-05-14T10:15:17+00:00
TOI ETimes,7,"Mike Stone, Sharon Stone’s brother, passes away at 74",https://timesofindia.indiatimes.com/articleshow/131089562.cms,2026-05-14T10:15:17+00:00
TOI ETimes,8,'Bridgerton Season 5' to release in 2027,https://timesofindia.indiatimes.com/articleshow/131089097.cms,2026-05-14T10:15:17+00:00
TOI ETimes,9,Neetu can’t stop gushing over Alia's Cannes 2026 look,https://timesofindia.indiatimes.com/articleshow/131089179.cms,2026-05-14T10:15:17+00:00
TOI ETimes,10,Who is Ramana Balachandran? The veena prodigy behind Ranveer's viral song,https://timesofindia.indiatimes.com/articleshow/131088983.cms,2026-05-14T10:15:17+00:00
TOI ETimes,11,Thalapathy Vijay’s old speech on parents’ love marriage resurfaces,https://timesofindia.indiatimes.com/articleshow/131088871.cms,2026-05-14T10:15:17+00:00
TOI ETimes,12,"'Mera Lyari': Pakistan's answer to Ranveer Singh’s 'Dhurandhar' sells only 22 tickets on opening day, pulled from theatres",https://timesofindia.indiatimes.com/articleshow/131088849.cms,2026-05-14T10:15:17+00:00
TOI ETimes,13,"Mahesh Bhatt narrated 'Zakhm' to Ajay Devgn while he was in the shower, the actor ended up getting a National award for it",https://timesofindia.indiatimes.com/articleshow/131088350.cms,2026-05-14T10:15:17+00:00
TOI ETimes,14,As 'Krishnavataram Part 1: The Heart' box office touches Rs 12.10 Cr; Hardik Gajjar says he was wary of Raas Leela,https://timesofindia.indiatimes.com/articleshow/131087979.cms,2026-05-14T10:15:17+00:00
TOI ETimes,15,Sara Ali Khan opens up on social media trolling and its impact on her mental health: 'I do get affected',https://timesofindia.indiatimes.com/articleshow/131087558.cms,2026-05-14T10:15:17+00:00
TOI ETimes,16,"'Dhurandhar 2' BO day 57 [LIVE]: Ranveer Singh film eyes Rs 1,150 crore",https://timesofindia.indiatimes.com/articleshow/131088366.cms,2026-05-14T10:15:17+00:00
TOI ETimes,17,'Raja Shivaji' marches towards the Rs 90 crore mark in its second week,https://timesofindia.indiatimes.com/articleshow/131080363.cms,2026-05-14T10:15:17+00:00
TOI ETimes,18,'Dhurandhar 2' adds Rs 0.37 crore to the tally amid OTT release buzz,https://timesofindia.indiatimes.com/articleshow/131080096.cms,2026-05-14T10:15:17+00:00
TOI ETimes,19,'Dhurandhar 2' BO day 56 [LIVE]: Ranveer Singh film nets Rs 1144.21 crore on 8th Wednesday,https://timesofindia.indiatimes.com/articleshow/131044710.cms,2026-05-14T10:15:17+00:00
TOI ETimes,20,"'Dhurandhar 2' nears Rs 1,800 cr mark ahead of OTT debut",https://timesofindia.indiatimes.com/articleshow/131052068.cms,2026-05-14T10:15:17+00:00
TOI ETimes,21,'Bhooth Bangla' BO day 26: Film holds steady,https://timesofindia.indiatimes.com/articleshow/131052130.cms,2026-05-14T10:15:17+00:00
TOI ETimes,22,Animal Preview: Ranbir Kapoor and Sandeep Reddy Vanga are set to shake up the box office hierarchy,https://timesofindia.indiatimes.com/articleshow/105615612.cms,2026-05-14T10:15:17+00:00
TOI ETimes,23,Tu Jhoothi Main Makkaar,https://timesofindia.indiatimes.com/articleshow/98272134.cms,2026-05-14T10:15:17+00:00
TOI ETimes,24,Rakhi congratulates Vivek after Divyanka announces pregnancy,https://timesofindia.indiatimes.com/articleshow/131083090.cms,2026-05-14T10:15:17+00:00
TOI ETimes,25,Splitsvilla X6: Asmita Adhikari takes an indirect dig at Yogesh,https://timesofindia.indiatimes.com/articleshow/131081677.cms,2026-05-14T10:15:17+00:00
TOI ETimes,26,Manisha Rani joins Preeti Simoes and Neeti Simoes’ Maa Hai Na with her father,https://timesofindia.indiatimes.com/articleshow/131073733.cms,2026-05-14T10:15:17+00:00
TOI ETimes,27,Rithvik Dhanjani says 'Pavitra Rishta' is the reason behind his absence from TV,https://timesofindia.indiatimes.com/articleshow/131063346.cms,2026-05-14T10:15:17+00:00
TOI ETimes,28,Khatron Ke Khiladi Participation: Ruhaanika calls Divyanka an iron woman,https://timesofindia.indiatimes.com/articleshow/131063281.cms,2026-05-14T10:15:17+00:00
TOI ETimes,29,Parag Tyagi reveals how his ‘son’ helped him,https://timesofindia.indiatimes.com/articleshow/131063198.cms,2026-05-14T10:15:17+00:00
TOI ETimes,30,Archana Puran Singh reveals she eats dinner by 6:30 pm,https://timesofindia.indiatimes.com/articleshow/131085441.cms,2026-05-14T10:15:17+00:00
TOI ETimes,31,KKK: Orry reveals Khushi Kapoor pushed him to do the show,https://timesofindia.indiatimes.com/articleshow/131084765.cms,2026-05-14T10:15:17+00:00
TOI ETimes,32,"“I want her to finally…"" We asked 10 people what they wished most for their mothers, and the answers were deeply emotional",https://timesofindia.indiatimes.com/articleshow/131086631.cms,2026-05-14T10:15:17+00:00
TOI ETimes,33,How birds react to danger,https://timesofindia.indiatimes.com/articleshow/131086592.cms,2026-05-14T10:15:17+00:00
TOI ETimes,34,"“Achievement alone cannot guarantee fulfillment”: Dr. Abraham M. George on purpose, wealth, and service",https://timesofindia.indiatimes.com/articleshow/131084717.cms,2026-05-14T10:15:17+00:00
TOI ETimes,35,"Want to know what jail feels like? Hyderabad prison now offers 24-hour stays for Rs 2,000",https://timesofindia.indiatimes.com/articleshow/131087827.cms,2026-05-14T10:15:17+00:00
TOI ETimes,36,"US Senator Eric Schmitt claims Indians visit 'Visa temple' in Hyderabad, while attacking H-1B visa programme",https://timesofindia.indiatimes.com/articleshow/131086465.cms,2026-05-14T10:15:17+00:00
TOI ETimes,37,"Uber CEO Dara Khosrowshahi takes Delhi Metro from Central Secretariat to Jor Bagh, calls it 'fast, affordable, reliable'; watch video",https://timesofindia.indiatimes.com/articleshow/131084488.cms,2026-05-14T10:15:17+00:00
TOI ETimes,38,"'Kisi ko bhi call karlo, cab nahi rukegi': Patna woman shares scary Bengaluru cab experience after driver refused to stop vehicle, cancel ride",https://timesofindia.indiatimes.com/articleshow/131083722.cms,2026-05-14T10:15:17+00:00
TOI ETimes,39,Meet Scott Vincent Borba: e.l.f. Cosmetics founder leaving $3 billion fortune to become a Catholic priest,https://timesofindia.indiatimes.com/articleshow/131082539.cms,2026-05-14T10:15:17+00:00
TOI ETimes,40,"Eurovision: Israel's Noam Bettan qualifies for finals, amid controversial exit of 5 countries from music festival",https://timesofindia.indiatimes.com/articleshow/131060187.cms,2026-05-14T10:15:17+00:00
TOI ETimes,41,3 Countries that can’t stop streaming Taylor Swift songs,https://timesofindia.indiatimes.com/articleshow/131059436.cms,2026-05-14T10:15:17+00:00
TOI ETimes,42,Hailee Steinfeld and Josh Allen extend late Mother’s Day wishes,https://timesofindia.indiatimes.com/articleshow/131035687.cms,2026-05-14T10:15:17+00:00
TOI ETimes,43,Abbie Chatfield issues apology after Keli Holiday is refused US re-entry during tour,https://timesofindia.indiatimes.com/articleshow/131033969.cms,2026-05-14T10:15:17+00:00
TOI ETimes,44,The Weeknd to go on Asia Tour soon,https://timesofindia.indiatimes.com/articleshow/131017751.cms,2026-05-14T10:15:17+00:00
TOI ETimes,45,Guy Sebastian takes the ancestry DNA test,https://timesofindia.indiatimes.com/articleshow/131015302.cms,2026-05-14T10:15:17+00:00
TOI ETimes,46,Beyond Ebooks: The charm of bookstores endures,https://timesofindia.indiatimes.com/articleshow/101098088.cms,2026-05-14T10:15:17+00:00
TOI ETimes,47,It’s a curtain call: Sania Mirza bids adieu to tennis with ‘happy tears’,https://timesofindia.indiatimes.com/articleshow/98440670.cms,2026-05-14T10:15:17+00:00
TOI ETimes,48,A magical makeover for 17th Century stepwell: From neglected ruins to a glorious piece of history,https://timesofindia.indiatimes.com/articleshow/96557955.cms,2026-05-14T10:15:17+00:00
TOI ETimes,49,The city comes alive with Christmas fervour,https://timesofindia.indiatimes.com/articleshow/96406573.cms,2026-05-14T10:15:17+00:00
TOI ETimes,50,#BringRioHome: Pet parents launch search to find their kidnapped cat,https://timesofindia.indiatimes.com/articleshow/96334809.cms,2026-05-14T10:15:17+00:00
TOI ETimes,51,"Horror needs the stage to conspire with you, says Gopal Datt",https://timesofindia.indiatimes.com/articleshow/130598133.cms,2026-05-14T10:15:17+00:00
TOI ETimes,52,"Theatre is magic, and it’s time audiences felt it again: Gopal Datt",https://timesofindia.indiatimes.com/articleshow/130595267.cms,2026-05-14T10:15:17+00:00
TOI ETimes,53,Adil Hussain’s 'Mercy' release date OUT: Film's first look to be attached with Ranveer Singh's 'Dhurandhar: The Revenge',https://timesofindia.indiatimes.com/articleshow/129843424.cms,2026-05-14T10:15:17+00:00
TOI ETimes,54,It’s the best time to be doing theatre: Juhi Babbar Soni,https://timesofindia.indiatimes.com/articleshow/129826631.cms,2026-05-14T10:15:17+00:00
TOI ETimes,55,"Anu Malik steps into theatre with Anupam Kher’s play, Calls it his most exciting challenge yet",https://timesofindia.indiatimes.com/articleshow/129729335.cms,2026-05-14T10:15:17+00:00
TOI ETimes,56,'Wicked' musical director John Stefaniuk on live music on the stage: 'It is so exciting to hear the orchestra whisk us away',https://timesofindia.indiatimes.com/articleshow/129610267.cms,2026-05-14T10:15:17+00:00
TOI ETimes,57,Raj Kundra and Shilpa Shetty's 15th Wedding Anniversary,https://timesofindia.indiatimes.com/articleshow/115563990.cms,2026-05-14T10:15:17+00:00
TOI ETimes,58,​Bigg Boss winners list from season 1 to 17​,https://timesofindia.indiatimes.com/articleshow/114277426.cms,2026-05-14T10:15:17+00:00
TOI ETimes,59,​Discover the bird with a prehistoric roar​,https://timesofindia.indiatimes.com/articleshow/114244474.cms,2026-05-14T10:15:17+00:00
TOI ETimes,60,Dia Mirza's ethnic wear,https://timesofindia.indiatimes.com/articleshow/114243410.cms,2026-05-14T10:15:17+00:00
TOI ETimes,61,​Incredible facts about ants you won’t believe​,https://timesofindia.indiatimes.com/articleshow/114243248.cms,2026-05-14T10:15:17+00:00
TOI ETimes,62,'Bigg Boss Marathi 5' nears grand finale​,https://timesofindia.indiatimes.com/articleshow/113936459.cms,2026-05-14T10:15:17+00:00
TOI ETimes,63,The world’s honey supply is in trouble: Why bees are suddenly making less honey than before,https://timesofindia.indiatimes.com/articleshow/131081426.cms,2026-05-14T10:15:17+00:00
TOI ETimes,64,"British couple jailed in Iran: Who are the Foremans, facing 10 years of jail time?",https://timesofindia.indiatimes.com/articleshow/131080554.cms,2026-05-14T10:15:17+00:00
TOI ETimes,65,"Video: 8-year-old Karnataka boy recites Shiv Tandav Stotram in Shirshasana for 3 minutes 47 seconds, sets world record",https://timesofindia.indiatimes.com/articleshow/131073578.cms,2026-05-14T10:15:17+00:00
TOI ETimes,66,Which city is known as the milk capital of India? The powerful story behind it,https://timesofindia.indiatimes.com/articleshow/131073011.cms,2026-05-14T10:15:17+00:00
TOI ETimes,67,"A newly discovered asteroid will pass within about 56,000 miles of Earth on Monday",https://timesofindia.indiatimes.com/articleshow/131072172.cms,2026-05-14T10:15:17+00:00
TOI ETimes,68,Did you waste money by paying off your home loan early?,https://timesofindia.indiatimes.com/articleshow/131070250.cms,2026-05-14T10:15:17+00:00
TOI ETimes,69,Woman claims she lives in Mumbai on ₹25K – the internet immediately starts arguing,https://timesofindia.indiatimes.com/articleshow/131066741.cms,2026-05-14T10:15:17+00:00
TOI ETimes,70,"‘It stays warm from the natural heat of your feet’: Influencer stuffs pasta inside her shoe, then casually eats it",https://timesofindia.indiatimes.com/articleshow/131066384.cms,2026-05-14T10:15:17+00:00
TOI ETimes,71,Viral ‘Sumit Sir’ classroom beating video takes shocking turn after student calls it a ‘skit’,https://timesofindia.indiatimes.com/articleshow/131064157.cms,2026-05-14T10:15:17+00:00
TOI ETimes,72,Cannes 2026: Watching Pan’s Labyrinth isn’t a choice for this generation. It’s defiance to make sense of a world gone mad,https://timesofindia.indiatimes.com/articleshow/131060921.cms,2026-05-14T10:15:17+00:00
TOI ETimes,73,Google India joins the 'Main Tera' trend: What is it and why are fans grooving to it on social media?,https://timesofindia.indiatimes.com/articleshow/131061592.cms,2026-05-14T10:15:17+00:00
TOI ETimes,74,'To every mother...': Anand Mahindra shares vegetable seller's reaction to son's CRPF selection,https://timesofindia.indiatimes.com/articleshow/131058088.cms,2026-05-14T10:15:17+00:00
TOI ETimes,75,"Working Indian couple failed to buy a flat in Bangalore, owns a 3BHK house in the UK",https://timesofindia.indiatimes.com/articleshow/131056509.cms,2026-05-14T10:15:17+00:00
TOI ETimes,76,Who was Seth Amar Chand Banthia? 'Mangal Pandey of Rajasthan' who fought the Revolt of 1857 without using arms,https://timesofindia.indiatimes.com/articleshow/131054958.cms,2026-05-14T10:15:17+00:00
TOI ETimes,77,"Radhakrishnan Pillai, author of Inside Chanakya's Mind, passes away: Timeless quotes of the author that will keep inspiring generations",https://timesofindia.indiatimes.com/articleshow/131054633.cms,2026-05-14T10:15:17+00:00
TOI ETimes,78,'Share confidential interview questions': Ex-Google contractor reveals how Indian hiring networks function at the top,https://timesofindia.indiatimes.com/articleshow/131053404.cms,2026-05-14T10:15:17+00:00
TOI ETimes,79,Who is Professor Susan Elias? The woman making history as St Stephen’s College gets its first female principal in 145 years,https://timesofindia.indiatimes.com/articleshow/131053359.cms,2026-05-14T10:15:17+00:00
TOI ETimes,80,Brandon Clarke’s heartfelt message to schoolchildren goes viral as sports world mourns the ‘gentlest soul’,https://timesofindia.indiatimes.com/articleshow/131052659.cms,2026-05-14T10:15:17+00:00
TOI ETimes,81,"₹3.5 lakh fine for picking a fallen mango? THIS Singapore rule goes viral, leaves internet stunned and divided",https://timesofindia.indiatimes.com/articleshow/131046533.cms,2026-05-14T10:15:17+00:00
TOI ETimes,82,‘Only option is to leave’: German YouTuber with 2 million followers says he wants to abandon the country after 30 years,https://timesofindia.indiatimes.com/articleshow/131043379.cms,2026-05-14T10:15:17+00:00
TOI ETimes,83,What this delivery rider allegedly did outside a temple at 1 am has social media shocked and furious,https://timesofindia.indiatimes.com/articleshow/131044088.cms,2026-05-14T10:15:17+00:00
TOI ETimes,84,ISRO scientist Nandini Harinath’s saree from India’s Mars mission showcased at Smithsonian Museum in the US,https://timesofindia.indiatimes.com/articleshow/131043620.cms,2026-05-14T10:15:17+00:00
TOI ETimes,85,From freezer to oven: Woman’s absurd H₂O recipe reel blows up online; Ranveer Brar reacts with ‘I can make it better!’,https://timesofindia.indiatimes.com/articleshow/131041974.cms,2026-05-14T10:15:17+00:00
TOI ETimes,86,Peak humanity: Parisians form a human chain to save a drowning pup from the Seine River,https://timesofindia.indiatimes.com/articleshow/131038817.cms,2026-05-14T10:15:17+00:00
