source,rank,headline,link,collected_at_iso
India Today,8,"Little boy cries inconsolably, smashes cricket bat after failing to meet Virat Kohli",https://www.indiatoday.in/trending-news/story/virat-kohli-fan-video-little-boy-cries-inconsolably-smashes-cricket-bat-after-failing-to-meet-autograph-rcb-star-2902611-2026-04-28,2026-04-29T02:52:55+00:00
India Today,9,Man celebrates his 59th birthday by running 59 kms from Dehradun to Mussoorie,https://www.indiatoday.in/trending-news/story/man-celebrates-his-59th-birthday-by-running-59-kms-from-dehradun-to-mussoorie-2902566-2026-04-28,2026-04-29T02:52:55+00:00
India Today,10,Viral pic of six children on a scooter in Bengaluru draws police attention,https://www.indiatoday.in/trending-news/story/bengaluru-six-children-on-scooter-viral-pic-draws-police-attention-2902565-2026-04-28,2026-04-29T02:52:55+00:00
India Today,11,Guests grab wine bottles amid panic at White House press dinner. Videos are viral,https://www.indiatoday.in/trending-news/story/guests-grab-wine-bottles-amid-panic-at-white-house-press-dinner-videos-are-viral-2902345-2026-04-27,2026-04-29T02:52:55+00:00
India Today,12,"Ashneer Grover mocks Sridhar Vembu's 'return to India' post, calls it 'delulu'",https://www.indiatoday.in/trending-news/story/ashneer-grover-mocks-sridhar-vembus-return-to-india-post-calls-it-delulu-2902313-2026-04-27,2026-04-29T02:52:55+00:00
India Today,13,Rihanna feeds cow while holding calfskin Dior bag. Internet calls out irony,https://www.indiatoday.in/trending-news/story/rihanna-feeds-cow-while-holding-calfskin-dior-bag-internet-calls-out-irony-2902270-2026-04-27,2026-04-29T02:52:55+00:00
India Today,14,"Who is Michael Glantz, the man who kept eating during White House press dinner chaos",https://www.indiatoday.in/trending-news/story/who-is-michael-glantz-the-unfazed-attendee-who-kept-eating-during-white-house-press-dinner-panic-2902218-2026-04-27,2026-04-29T02:52:55+00:00
India Today,15,Internet questions fate of steak and lobster after White House press dinner cut short,https://www.indiatoday.in/trending-news/story/internet-questions-fate-of-steak-and-lobster-after-white-house-press-dinner-cut-short-shooting-2902176-2026-04-27,2026-04-29T02:52:55+00:00
India Today,16,"Strike her off rolls: UP school principal yells at parents over notebooks, fee",https://www.indiatoday.in/trending-news/story/up-school-principal-denies-charges-after-viral-clash-with-parent-over-notebook-issue-2902109-2026-04-27,2026-04-29T02:52:55+00:00
India Today,17,Shopkeeper opens doors to stray dogs to escape scorching heat,https://www.indiatoday.in/trending-news/story/shopkeeper-opens-doors-to-stray-dogs-to-escape-scorching-heat-2902050-2026-04-27,2026-04-29T02:52:55+00:00
India Today,18,Safari crowd near fighting tigers exposes risky tourist behaviour. Video is viral,https://www.indiatoday.in/trending-news/story/safari-crowd-near-fighting-tigers-exposes-risky-tourist-behaviour-video-is-viral-2901906-2026-04-26,2026-04-29T02:52:55+00:00
India Today,19,"Indian woman in Ireland misses cousin's wedding, shares reality of life abroad",https://www.indiatoday.in/trending-news/story/indian-woman-in-ireland-misses-cousins-wedding-shares-reality-of-life-abroad-2901896-2026-04-26,2026-04-29T02:52:55+00:00
India Today,20,Foreigner thinks he can see himself living in Bengaluru. Here's why,https://www.indiatoday.in/trending-news/story/foreigner-thinks-he-can-see-himself-living-in-bengaluru-heres-why-2901832-2026-04-26,2026-04-29T02:52:55+00:00
India Today,21,"Bengaluru Congress leader assaults lover’s minor children, Pocso case filed",https://www.indiatoday.in/cities/bengaluru/story/bengaluru-congress-leader-anand-naidu-pocso-case-after-minors-assault-complaint-2902977-2026-04-29,2026-04-29T02:52:55+00:00
India Today,22,Pune cops issue 'Leave India Notice' to 3 US nationals for promoting Christianity,https://www.indiatoday.in/india/story/pune-police-issue-leave-india-notice-three-us-nationals-for-promoting-christianity-tourist-visa-violations-2902987-2026-04-29,2026-04-29T02:52:55+00:00
India Today,23,Highly partisan: Plea seeks removal of ‘Singham’ IPS officer as Bengal poll observer,https://www.indiatoday.in/elections/assembly/story/ips-officer-singham-ajay-pal-sharma-petition-south-24-parganas-poll-observer-removal-2902985-2026-04-29,2026-04-29T02:52:55+00:00
India Today,24,"Bhajan troupe sings Christian devotional song in Kerala temple, faces backlash",https://www.indiatoday.in/india/story/kottayam-temple-festival-row-bhajan-troupe-sings-christian-devotional-song-at-sri-mahavishnu-temple-2900673-2026-04-23,2026-04-29T02:52:55+00:00
India Today,25,"In India's big defence reset, how reforms ride on new leadership",https://www.indiatoday.in/india-today-insight/story/in-indias-big-defence-reset-how-reforms-ride-on-new-leadership-2900559-2026-04-23,2026-04-29T02:52:55+00:00
India Today,26,"This long-time US ally turns to Russia, China after no help on Iran war fallout",https://www.indiatoday.in/world/story/thailand-turns-russia-china-after-us-offers-no-help-on-iran-war-fallout-2902918-2026-04-28,2026-04-29T02:52:55+00:00
India Today,27,Donald Trump's face to feature on limited edition US passports,https://www.indiatoday.in/world/story/us-to-issue-limited-edition-commemorative-passports-featuring-trumps-image-for-america250-2902969-2026-04-29,2026-04-29T02:52:55+00:00
India Today,28,"THE Asia Rankings 2026: 128 Indian universities ranked, none in top 40; China rules",https://www.indiatoday.in/education-today/news/story/the-asia-rankings-2026-128-indian-universities-ranked-none-in-top-40-china-rules-2900893-2026-04-24,2026-04-29T02:52:55+00:00
TOI ETimes,1,Salad topper recalled over salmonella risk,https://timesofindia.indiatimes.com/articleshow/130458722.cms,2026-04-29T02:52:55+00:00
TOI ETimes,2,Rebel Wilson weight loss: How she lost 36 kgs without extreme dieting - Ozempic or lifestyle?,https://timesofindia.indiatimes.com/articleshow/130457577.cms,2026-04-29T02:52:55+00:00
TOI ETimes,3,Viral: India-Australia work-life comparison sparks debate on ‘hustle culture’,https://timesofindia.indiatimes.com/articleshow/130456543.cms,2026-04-29T02:52:55+00:00
TOI ETimes,4,What is the meaning of Indian summer in the UK?,https://timesofindia.indiatimes.com/articleshow/130436405.cms,2026-04-29T02:52:55+00:00
TOI ETimes,5,This sympathetic syndrome makes Fathers feel pregnant,https://timesofindia.indiatimes.com/articleshow/130451612.cms,2026-04-29T02:52:55+00:00
TOI ETimes,6,Quotes that will make you pick up a book even if you haven’t in years,https://timesofindia.indiatimes.com/articleshow/130456862.cms,2026-04-29T02:52:55+00:00
TOI ETimes,7,'Bhooth Bangla' BO Day 12: Akshay's film nears Rs 200 cr globally,https://timesofindia.indiatimes.com/articleshow/130592993.cms,2026-04-29T02:52:55+00:00
TOI ETimes,8,'Michael' crosses Rs 25 crore mark; tops April Hollywood chart in India,https://timesofindia.indiatimes.com/articleshow/130592823.cms,2026-04-29T02:52:55+00:00
TOI ETimes,9,Ranveer's Dhurandhar 2 crosses Rs 1780 cr globally on Day 41,https://timesofindia.indiatimes.com/articleshow/130593211.cms,2026-04-29T02:52:55+00:00
TOI ETimes,10,'Vaazha 2' box office collections day 28,https://timesofindia.indiatimes.com/articleshow/130593897.cms,2026-04-29T02:52:55+00:00
TOI ETimes,11,Deepika and Ranveer to make Met Gala appearance?,https://timesofindia.indiatimes.com/articleshow/130593552.cms,2026-04-29T02:52:55+00:00
TOI ETimes,12,Aneet Padda's 'Shakti Shalini' schoolgirl look LEAKED - WATCH,https://timesofindia.indiatimes.com/articleshow/130593063.cms,2026-04-29T02:52:55+00:00
TOI ETimes,13,"Saif Ali Khan's 'Kartavya' backed by Shah Rukh Khan, gets May 15 release after three-year wait",https://timesofindia.indiatimes.com/articleshow/130592475.cms,2026-04-29T02:52:55+00:00
TOI ETimes,14,Annu Kapoor recalls actor ‘losing control’ during intimate scene; actress locked herself in room for two days: 'Some take advantage',https://timesofindia.indiatimes.com/articleshow/130592383.cms,2026-04-29T02:52:55+00:00
TOI ETimes,15,Ranveer Singh in talks to headline 'Dhurandhar' director Aditya Dhar's next; film to go on floors in March 2027: Reports,https://timesofindia.indiatimes.com/articleshow/130590516.cms,2026-04-29T02:52:55+00:00
TOI ETimes,16,Kritika Kamra says love with Gaurav Kapur wasn’t instant: 'Realising I want to be with him for life took time',https://timesofindia.indiatimes.com/articleshow/130590225.cms,2026-04-29T02:52:55+00:00
TOI ETimes,17,'Dhurandhar 2' BO day 41 [LIVE]: Ranveer Singh film eyes nine-year global record of 'Baahubali 2',https://timesofindia.indiatimes.com/articleshow/130573426.cms,2026-04-29T02:52:55+00:00
TOI ETimes,18,‘Dhurandhar 2’ misses the Rs 1780 crore worldwide by a whisker,https://timesofindia.indiatimes.com/articleshow/130566754.cms,2026-04-29T02:52:55+00:00
TOI ETimes,19,'Bhooth Bangla' Day 11: Akshay's film inches towards Rs 200 crore,https://timesofindia.indiatimes.com/articleshow/130566623.cms,2026-04-29T02:52:55+00:00
TOI ETimes,20,Animal Preview: Ranbir Kapoor and Sandeep Reddy Vanga are set to shake up the box office hierarchy,https://timesofindia.indiatimes.com/articleshow/105615612.cms,2026-04-29T02:52:55+00:00
TOI ETimes,21,Tu Jhoothi Main Makkaar,https://timesofindia.indiatimes.com/articleshow/98272134.cms,2026-04-29T02:52:55+00:00
TOI ETimes,22,Khatron Ke Khiladi 15: Ex-Contestants to make a comeback?,https://timesofindia.indiatimes.com/articleshow/130573254.cms,2026-04-29T02:52:55+00:00
TOI ETimes,23,Riddhi Dogra opens up about finding love again,https://timesofindia.indiatimes.com/articleshow/130572496.cms,2026-04-29T02:52:55+00:00
TOI ETimes,24,Reem recalls her parents’ divorce and her failed relationships,https://timesofindia.indiatimes.com/articleshow/130568326.cms,2026-04-29T02:52:55+00:00
TOI ETimes,25,Exclusive - Akashdeep Saigal on joining Kyunki Saas Bhi Kabhi Bahu Thi 2,https://timesofindia.indiatimes.com/articleshow/130556373.cms,2026-04-29T02:52:55+00:00
TOI ETimes,26,Sunita Roasts Govinda: Laughter Chefs promo teases reunion,https://timesofindia.indiatimes.com/articleshow/130567170.cms,2026-04-29T02:52:55+00:00
TOI ETimes,27,Nikki Vs Abhishek Drama: Tamboli posts cryptic ‘paid PR’ note,https://timesofindia.indiatimes.com/articleshow/130585819.cms,2026-04-29T02:52:55+00:00
TOI ETimes,28,Akshay Dances In Heels: Actor aces one‑minute challenge,https://timesofindia.indiatimes.com/articleshow/130584406.cms,2026-04-29T02:52:55+00:00
TOI ETimes,29,Shriya Tiwari joins Kyunki season 2 says it is a forever genre,https://timesofindia.indiatimes.com/articleshow/130580831.cms,2026-04-29T02:52:55+00:00
TOI ETimes,30,"Delhi-NCR rain alert on April 29: Thunderstorms, showers bring much-needed relief from heatwaves; what travellers need to know",https://timesofindia.indiatimes.com/articleshow/130594027.cms,2026-04-29T02:52:55+00:00
TOI ETimes,31,"Fast-Growing Trees For Privacy: USDA backs leafy screens; homeowners get beauty, shade",https://timesofindia.indiatimes.com/articleshow/130579361.cms,2026-04-29T02:52:55+00:00
TOI ETimes,32,Reuse Orange Peels In Garden: Turn kitchen scraps into plant booster; cut waste and chemicals,https://timesofindia.indiatimes.com/articleshow/130578917.cms,2026-04-29T02:52:55+00:00
TOI ETimes,33,Don’t Seal Sweaty Sneakers: Trapped heat wrecks shoes; air them out after runs,https://timesofindia.indiatimes.com/articleshow/130486335.cms,2026-04-29T02:52:55+00:00
TOI ETimes,34,"Japanese proverb of the day: “If you are in a hurry, go the long way around” — lessons on patience, careful planning, and why slowing down can save time",https://timesofindia.indiatimes.com/articleshow/130587439.cms,2026-04-29T02:52:55+00:00
TOI ETimes,35,"Personality test: Cup, guitar, or clock? What you choose first reveals if you are creative, a nurturer or planner",https://timesofindia.indiatimes.com/articleshow/130585523.cms,2026-04-29T02:52:55+00:00
TOI ETimes,36,“I took disagreement personally”: IIT–ISB boss admits he lost 3 employees over basic mistakes,https://timesofindia.indiatimes.com/articleshow/130593917.cms,2026-04-29T02:52:55+00:00
TOI ETimes,37,Bizarre tax laws in US could drain 30+ nations’ World Cup earnings as FIFA fails to secure exemption,https://timesofindia.indiatimes.com/articleshow/130589917.cms,2026-04-29T02:52:55+00:00
TOI ETimes,38,FIFA World Cup 2026: Major yellow card rule change explained as new system to affect every nation,https://timesofindia.indiatimes.com/articleshow/130585296.cms,2026-04-29T02:52:55+00:00
TOI ETimes,39,What are death doulas and why even Nicole Kidman is exploring this path after personal loss,https://timesofindia.indiatimes.com/articleshow/130585068.cms,2026-04-29T02:52:55+00:00
TOI ETimes,40,Who was Kiara Janae Brokenbrough? Bride who went viral for $500 wedding dies during childbirth,https://timesofindia.indiatimes.com/articleshow/130583033.cms,2026-04-29T02:52:55+00:00
TOI ETimes,41,When fandom goes a bit too far: From Abhishek Sharma’s viral hand grab incident to 5 times fans crossed the line with Indian celebs,https://timesofindia.indiatimes.com/articleshow/130582642.cms,2026-04-29T02:52:55+00:00
TOI ETimes,42,Here' how Dr. Yamuna Sangarasivam landed in MJ’s 1991 'Black or White',https://timesofindia.indiatimes.com/articleshow/130572602.cms,2026-04-29T02:52:55+00:00
TOI ETimes,43,Shakira Brazil concert: Man CRUSHED to death in stage accident,https://timesofindia.indiatimes.com/articleshow/130564408.cms,2026-04-29T02:52:55+00:00
TOI ETimes,44,WORLD DANCE DAY: The iconic dance-offs that defined Bollywood,https://timesofindia.indiatimes.com/articleshow/130548354.cms,2026-04-29T02:52:55+00:00
TOI ETimes,45,When Bappi Lahiri recalled Michael Jackson’s praise;'MJ said ‘I love your song ‘Jimmi Jimmi’,https://timesofindia.indiatimes.com/articleshow/130525461.cms,2026-04-29T02:52:55+00:00
TOI ETimes,46,Smokey Davidson’s defamation claims dismissed,https://timesofindia.indiatimes.com/articleshow/130497760.cms,2026-04-29T02:52:55+00:00
TOI ETimes,47,All you need to know about Meghan Trainor’s net worth,https://timesofindia.indiatimes.com/articleshow/130496071.cms,2026-04-29T02:52:55+00:00
TOI ETimes,48,Beyond Ebooks: The charm of bookstores endures,https://timesofindia.indiatimes.com/articleshow/101098088.cms,2026-04-29T02:52:55+00:00
TOI ETimes,49,It’s a curtain call: Sania Mirza bids adieu to tennis with ‘happy tears’,https://timesofindia.indiatimes.com/articleshow/98440670.cms,2026-04-29T02:52:55+00:00
TOI ETimes,50,A magical makeover for 17th Century stepwell: From neglected ruins to a glorious piece of history,https://timesofindia.indiatimes.com/articleshow/96557955.cms,2026-04-29T02:52:55+00:00
TOI ETimes,51,The city comes alive with Christmas fervour,https://timesofindia.indiatimes.com/articleshow/96406573.cms,2026-04-29T02:52:55+00:00
TOI ETimes,52,#BringRioHome: Pet parents launch search to find their kidnapped cat,https://timesofindia.indiatimes.com/articleshow/96334809.cms,2026-04-29T02:52:55+00:00
TOI ETimes,53,Adil Hussain’s 'Mercy' release date OUT: Film's first look to be attached with Ranveer Singh's 'Dhurandhar: The Revenge',https://timesofindia.indiatimes.com/articleshow/129843424.cms,2026-04-29T02:52:55+00:00
TOI ETimes,54,It’s the best time to be doing theatre: Juhi Babbar Soni,https://timesofindia.indiatimes.com/articleshow/129826631.cms,2026-04-29T02:52:55+00:00
TOI ETimes,55,"Anu Malik steps into theatre with Anupam Kher’s play, Calls it his most exciting challenge yet",https://timesofindia.indiatimes.com/articleshow/129729335.cms,2026-04-29T02:52:55+00:00
TOI ETimes,56,'Wicked' musical director John Stefaniuk on live music on the stage: 'It is so exciting to hear the orchestra whisk us away',https://timesofindia.indiatimes.com/articleshow/129610267.cms,2026-04-29T02:52:55+00:00
TOI ETimes,57,"'Wicked' stars Rebekah Lowings and Eve Shanu-Wilson on Elphaba-Glinda's bond: 'Friends challenge you, not just cheer you on'",https://timesofindia.indiatimes.com/articleshow/129607673.cms,2026-04-29T02:52:55+00:00
TOI ETimes,58,"Vijay Crishna, Shah Rukh Khan’s on-screen father in ‘Devdas,’ passes away at 81: Tributes pour in for theatre stalwart",https://timesofindia.indiatimes.com/articleshow/129016007.cms,2026-04-29T02:52:55+00:00
TOI ETimes,59,Raj Kundra and Shilpa Shetty's 15th Wedding Anniversary,https://timesofindia.indiatimes.com/articleshow/115563990.cms,2026-04-29T02:52:55+00:00
TOI ETimes,60,​Bigg Boss winners list from season 1 to 17​,https://timesofindia.indiatimes.com/articleshow/114277426.cms,2026-04-29T02:52:55+00:00
TOI ETimes,61,​Discover the bird with a prehistoric roar​,https://timesofindia.indiatimes.com/articleshow/114244474.cms,2026-04-29T02:52:55+00:00
TOI ETimes,62,Dia Mirza's ethnic wear,https://timesofindia.indiatimes.com/articleshow/114243410.cms,2026-04-29T02:52:55+00:00
TOI ETimes,63,​Incredible facts about ants you won’t believe​,https://timesofindia.indiatimes.com/articleshow/114243248.cms,2026-04-29T02:52:55+00:00
TOI ETimes,64,'Bigg Boss Marathi 5' nears grand finale​,https://timesofindia.indiatimes.com/articleshow/113936459.cms,2026-04-29T02:52:55+00:00
TOI ETimes,65,"Meet the man behind algebra and algorithms: The Persian scholar who shaped mathematics more than 1,200 years ago",https://timesofindia.indiatimes.com/articleshow/130581830.cms,2026-04-29T02:52:55+00:00
TOI ETimes,66,Ex-flight attendant reveals why families should board last,https://timesofindia.indiatimes.com/articleshow/130578149.cms,2026-04-29T02:52:55+00:00
TOI ETimes,67,‘We wasted three years’: Bengaluru couple who moved to Canada reveal the harrowing truth about moving abroad,https://timesofindia.indiatimes.com/articleshow/130579090.cms,2026-04-29T02:52:55+00:00
TOI ETimes,68,"Everything that needs to go right for Messi and Ronaldo to meet at the World Cup, one last time",https://timesofindia.indiatimes.com/articleshow/130575449.cms,2026-04-29T02:52:55+00:00
TOI ETimes,69,"“In India, they’d rush to help”: Florida woman on the fate of a trapped venomous snake",https://timesofindia.indiatimes.com/articleshow/130584673.cms,2026-04-29T02:52:55+00:00
TOI ETimes,70,Who is Himshikha Tripathi? The girl who grabbed cricketer Abhishek Sharma’s hand - and later apologised,https://timesofindia.indiatimes.com/articleshow/130575521.cms,2026-04-29T02:52:55+00:00
TOI ETimes,71,Indian woman living in Australia says her mum’s ‘haldi doodh’ is now an $8 turmeric latte,https://timesofindia.indiatimes.com/articleshow/130574466.cms,2026-04-29T02:52:55+00:00
TOI ETimes,72,'India is terrible': Tamil actor reacts to Zoho founder Sridhar Vembu's urge for Indians in US to return,https://timesofindia.indiatimes.com/articleshow/130570953.cms,2026-04-29T02:52:55+00:00
TOI ETimes,73,This volcano doesn't glow red - it turns electric blue at night and looks straight out of a sci-fi movie,https://timesofindia.indiatimes.com/articleshow/130568934.cms,2026-04-29T02:52:55+00:00
TOI ETimes,74,She solved a 400-year-old problem that Newton and Kepler couldn’t: Meet the Ukrainian mathematician Maryna Viazovska,https://timesofindia.indiatimes.com/articleshow/130564119.cms,2026-04-29T02:52:55+00:00
TOI ETimes,75,Did an asteroid pave the way for 'Octopus like-squids' ? How these creatures survived the extinction of the dinosaurs,https://timesofindia.indiatimes.com/articleshow/130561662.cms,2026-04-29T02:52:55+00:00
TOI ETimes,76,"What is the unique 5,000-year-old Raulane festival in Himachal where men cover their faces and dress as brides?",https://timesofindia.indiatimes.com/articleshow/130560339.cms,2026-04-29T02:52:55+00:00
TOI ETimes,77,"""That doesn't look human"": Vaibhav Sooryavanshi comes under bizarre AI chip claim by Pakistani analyst, netizens can't stop laughing",https://timesofindia.indiatimes.com/articleshow/130558255.cms,2026-04-29T02:52:55+00:00
TOI ETimes,78,Who is Cole Tomas Allen? The 31-year-old California tutor accused of storming the White House Correspondents' Association dinner,https://timesofindia.indiatimes.com/articleshow/130557041.cms,2026-04-29T02:52:55+00:00
TOI ETimes,79,Husky escapes from home to meet her friend at daycare!,https://timesofindia.indiatimes.com/articleshow/130555189.cms,2026-04-29T02:52:55+00:00
TOI ETimes,80,Who is Arun Panwar? The YouTuber at the center of the controversy surrounding his wedding ‘daan’ video,https://timesofindia.indiatimes.com/articleshow/130552063.cms,2026-04-29T02:52:55+00:00
TOI ETimes,81,Who is Oz Pearlman? Performer at Washington dinner as shooting scare triggered Trump's evacuation,https://timesofindia.indiatimes.com/articleshow/130551895.cms,2026-04-29T02:52:55+00:00
TOI ETimes,82,"Missing toddler found peacefully napping on a mountain, and the internet can’t get over it",https://timesofindia.indiatimes.com/articleshow/130550400.cms,2026-04-29T02:52:55+00:00
TOI ETimes,83,"Trying to escape 44°C heat, Rajasthan man ends up trapped inside milk can – video viral",https://timesofindia.indiatimes.com/articleshow/130549540.cms,2026-04-29T02:52:55+00:00
TOI ETimes,84,Armpit-sniffing: Japanese underground idol faces backlash over controversial fan interaction,https://timesofindia.indiatimes.com/articleshow/130544269.cms,2026-04-29T02:52:55+00:00
TOI ETimes,85,American woman with four kids lists 10 lessons about living in India: ‘‘5 minutes’ means flexible time?’,https://timesofindia.indiatimes.com/articleshow/130544316.cms,2026-04-29T02:52:55+00:00
TOI ETimes,86,"$1000 rent, $100 groceries: US man who moved to China calls life his 'version of the American Dream'",https://timesofindia.indiatimes.com/articleshow/130544273.cms,2026-04-29T02:52:55+00:00
TOI ETimes,87,"Haldi doodh is the new turmeric latte? Viral video shows how Indian traditions called ""old"" are becoming ""gold"" in Western countries",https://timesofindia.indiatimes.com/articleshow/130562084.cms,2026-04-29T02:52:55+00:00
TOI ETimes,88,Why do dreams feel so real after a bad night’s sleep? Experts reveal the shocking science behind dream vividness,https://timesofindia.indiatimes.com/articleshow/130532104.cms,2026-04-29T02:52:55+00:00
TOI ETimes,89,"While Trump was rushed to safety after ‘shots fired’ at White House event, viral video shows press members ‘stealing’ wine amid chaos",https://timesofindia.indiatimes.com/articleshow/130529417.cms,2026-04-29T02:52:55+00:00
TOI ETimes,90,"Bigg Boss Telugu sensation Ashu Reddy embroiled in ₹9.35 crore marriage promise case, threatens legal action",https://timesofindia.indiatimes.com/articleshow/130528760.cms,2026-04-29T02:52:55+00:00
TOI ETimes,91,Fungi in space? Study finds surprising survival ability in Mars-like conditions,https://timesofindia.indiatimes.com/articleshow/130526781.cms,2026-04-29T02:52:55+00:00
TOI ETimes,92,A teacher’s gift to the world: MIT professor who taught the math behind AI for 60 years has made his lectures free online,https://timesofindia.indiatimes.com/articleshow/130524783.cms,2026-04-29T02:52:55+00:00
TOI ETimes,93,Indian woman in Dublin says she missed a loved one’s wedding due to responsibilities: 'It’s not just the money…',https://timesofindia.indiatimes.com/articleshow/130522361.cms,2026-04-29T02:52:55+00:00
TOI ETimes,94,The green warrior: Man grew a 31-hectare forest on degraded ...,https://timesofindia.indiatimes.com/articleshow/130472357.cms,2026-04-29T02:52:55+00:00
TOI ETimes,95,"Rajasthan’s 100-year-old ‘desi fridge’ with no electricity, ...",https://timesofindia.indiatimes.com/articleshow/130409107.cms,2026-04-29T02:52:55+00:00
TOI ETimes,96,14-year-old boy selling postcards outside Angkor Wat who spo...,https://timesofindia.indiatimes.com/articleshow/130197303.cms,2026-04-29T02:52:55+00:00
TOI ETimes,97,Who was Sawai Madho Singh II? The Maharaja who carried his o...,https://timesofindia.indiatimes.com/articleshow/130190590.cms,2026-04-29T02:52:55+00:00
TOI ETimes,98,"Meet Palmer Luckey: He built a $2 billion company at 19, got...",https://timesofindia.indiatimes.com/articleshow/129907090.cms,2026-04-29T02:52:55+00:00
TOI ETimes,99,Pay maintenance but barred from using society's facilities: Karnataka society bars 1bhk residents from using gym and pool,https://timesofindia.indiatimes.com/articleshow/130515066.cms,2026-04-29T02:52:55+00:00
TOI ETimes,100,"Sleep on a yoga mat, work without pay: Singapore domestic helper’s shocking claim against British-Indian family goes viral",https://timesofindia.indiatimes.com/articleshow/130514900.cms,2026-04-29T02:52:55+00:00
TOI ETimes,101,"2,000‑year‑old charred and well preserved bread reveals how Roman soldiers really ate on the frontier",https://timesofindia.indiatimes.com/articleshow/130514733.cms,2026-04-29T02:52:55+00:00
TOI ETimes,102,Heartbeat louder than the engine: How a family of 9 pulled off one daring escape from North Korea,https://timesofindia.indiatimes.com/articleshow/130514172.cms,2026-04-29T02:52:55+00:00
TOI ETimes,103,"Darker frogs, resilient wolves, and radiation-eating fungi: The surprising wildlife thriving in the Chernobyl exclusion zone",https://timesofindia.indiatimes.com/articleshow/130512816.cms,2026-04-29T02:52:55+00:00
TOI ETimes,104,Chilli peppers may hold the secret to longevity: Studies suggest that adding more heat to your plate could boost your chances of living longer,https://timesofindia.indiatimes.com/articleshow/130510923.cms,2026-04-29T02:52:55+00:00
TOI ETimes,105,Heading for the London Marathon? 5 things to know before running your first,https://timesofindia.indiatimes.com/articleshow/130509573.cms,2026-04-29T02:52:55+00:00
TOI ETimes,106,Not massive sharks or snakes: This 62 feet tall 'kraken' octopus was the real terror of the dinosaur‑era oceans,https://timesofindia.indiatimes.com/articleshow/130509313.cms,2026-04-29T02:52:55+00:00
