source,rank,headline,link,collected_at_iso
TOI ETimes,18,'Michael' crosses Rs 25 crore mark; tops April Hollywood chart in India,https://timesofindia.indiatimes.com/articleshow/130592823.cms,2026-04-29T22:56:58+00:00
TOI ETimes,19,'Dhurandhar 2' BO day 41 [LIVE]: Ranveer Singh film eyes nine-year global record of 'Baahubali 2',https://timesofindia.indiatimes.com/articleshow/130573426.cms,2026-04-29T22:56:58+00:00
TOI ETimes,20,‘Dhurandhar 2’ misses the Rs 1780 crore worldwide by a whisker,https://timesofindia.indiatimes.com/articleshow/130566754.cms,2026-04-29T22:56:58+00:00
TOI ETimes,21,Animal Preview: Ranbir Kapoor and Sandeep Reddy Vanga are set to shake up the box office hierarchy,https://timesofindia.indiatimes.com/articleshow/105615612.cms,2026-04-29T22:56:58+00:00
TOI ETimes,22,Tu Jhoothi Main Makkaar,https://timesofindia.indiatimes.com/articleshow/98272134.cms,2026-04-29T22:56:58+00:00
TOI ETimes,23,Splitsvilla X6 Gullu- Kaira Unfollow? Fans speculate breakup,https://timesofindia.indiatimes.com/articleshow/130602061.cms,2026-04-29T22:56:58+00:00
TOI ETimes,24,"Dharmesh: I never felt the struggle, I enjoyed the dance",https://timesofindia.indiatimes.com/articleshow/130600858.cms,2026-04-29T22:56:58+00:00
TOI ETimes,25,Jaaved: What took so long? Nobody asked me,https://timesofindia.indiatimes.com/articleshow/130600040.cms,2026-04-29T22:56:58+00:00
TOI ETimes,26,Riddhi on suffering from ‘anxiety’ while playing SRK’s mother in Jawan,https://timesofindia.indiatimes.com/articleshow/130599979.cms,2026-04-29T22:56:58+00:00
TOI ETimes,27,Sunil Lahri wishes his on-screen ‘bhabhi’ Dipika on her birthday,https://timesofindia.indiatimes.com/articleshow/130599315.cms,2026-04-29T22:56:58+00:00
TOI ETimes,28,"Mango shake vs Aamras: Traditional roots, modern twist and how to prepare",https://timesofindia.indiatimes.com/articleshow/130605355.cms,2026-04-29T22:56:58+00:00
TOI ETimes,29,5 scenic hill stations in India where you can truly feel above the clouds this summer,https://timesofindia.indiatimes.com/articleshow/130612439.cms,2026-04-29T22:56:58+00:00
TOI ETimes,30,"Korean proverb of the day for success: “Don’t aim for success if you want it; just do what you love and believe in, and it will come naturally” — lessons on passion, purpose, consistency, and long-term growth",https://timesofindia.indiatimes.com/articleshow/130614176.cms,2026-04-29T22:56:58+00:00
TOI ETimes,31,"Love quote of the day by Colleen Hoover: “Sometimes two people have to fall apart, to realize...”",https://timesofindia.indiatimes.com/articleshow/130613651.cms,2026-04-29T22:56:58+00:00
TOI ETimes,32,"Success quote of the day by Anand Mahindra: ""Leaders don't look behind or to the side, instead...""",https://timesofindia.indiatimes.com/articleshow/130611324.cms,2026-04-29T22:56:58+00:00
TOI ETimes,33,He is 46 but lives like a 6-year-old girl: Meet the Canadian man who left wife and seven children to live a new identity,https://timesofindia.indiatimes.com/articleshow/130617050.cms,2026-04-29T22:56:58+00:00
TOI ETimes,34,London Marathon winner’s massive payday revealed as he names first purchase after historic run,https://timesofindia.indiatimes.com/articleshow/130616518.cms,2026-04-29T22:56:58+00:00
TOI ETimes,35,"'AC, Metro, Chai!' African student Ayyuba's Chatur Ramalingam-style speech steals the show at AMU polls",https://timesofindia.indiatimes.com/articleshow/130614464.cms,2026-04-29T22:56:58+00:00
TOI ETimes,36,'Just give us a ring!': King Charles presents Trump with historic submarine bell at state dinner,https://timesofindia.indiatimes.com/articleshow/130607429.cms,2026-04-29T22:56:58+00:00
TOI ETimes,37,Tesco announces free fruit for customers,https://timesofindia.indiatimes.com/articleshow/130605417.cms,2026-04-29T22:56:58+00:00
TOI ETimes,38,'Never sold my stake for $800': Apple co-founder Ronald Wayne reveals truth about viral 'missed opportunity',https://timesofindia.indiatimes.com/articleshow/130606176.cms,2026-04-29T22:56:58+00:00
TOI ETimes,39,Here' how Dr. Yamuna Sangarasivam landed in MJ’s 1991 'Black or White',https://timesofindia.indiatimes.com/articleshow/130572602.cms,2026-04-29T22:56:58+00:00
TOI ETimes,40,Shakira Brazil concert: Man CRUSHED to death in stage accident,https://timesofindia.indiatimes.com/articleshow/130564408.cms,2026-04-29T22:56:58+00:00
TOI ETimes,41,WORLD DANCE DAY: The iconic dance-offs that defined Bollywood,https://timesofindia.indiatimes.com/articleshow/130548354.cms,2026-04-29T22:56:58+00:00
TOI ETimes,42,When Bappi Lahiri recalled Michael Jackson’s praise;'MJ said ‘I love your song ‘Jimmi Jimmi’,https://timesofindia.indiatimes.com/articleshow/130525461.cms,2026-04-29T22:56:58+00:00
TOI ETimes,43,Smokey Davidson’s defamation claims dismissed,https://timesofindia.indiatimes.com/articleshow/130497760.cms,2026-04-29T22:56:58+00:00
TOI ETimes,44,All you need to know about Meghan Trainor’s net worth,https://timesofindia.indiatimes.com/articleshow/130496071.cms,2026-04-29T22:56:58+00:00
TOI ETimes,45,Beyond Ebooks: The charm of bookstores endures,https://timesofindia.indiatimes.com/articleshow/101098088.cms,2026-04-29T22:56:58+00:00
TOI ETimes,46,It’s a curtain call: Sania Mirza bids adieu to tennis with ‘happy tears’,https://timesofindia.indiatimes.com/articleshow/98440670.cms,2026-04-29T22:56:58+00:00
TOI ETimes,47,A magical makeover for 17th Century stepwell: From neglected ruins to a glorious piece of history,https://timesofindia.indiatimes.com/articleshow/96557955.cms,2026-04-29T22:56:58+00:00
TOI ETimes,48,The city comes alive with Christmas fervour,https://timesofindia.indiatimes.com/articleshow/96406573.cms,2026-04-29T22:56:58+00:00
TOI ETimes,49,#BringRioHome: Pet parents launch search to find their kidnapped cat,https://timesofindia.indiatimes.com/articleshow/96334809.cms,2026-04-29T22:56:58+00:00
TOI ETimes,50,"Theatre is magic, and it’s time audiences felt it again: Gopal Dutt",https://timesofindia.indiatimes.com/articleshow/130595267.cms,2026-04-29T22:56:58+00:00
TOI ETimes,51,Adil Hussain’s 'Mercy' release date OUT: Film's first look to be attached with Ranveer Singh's 'Dhurandhar: The Revenge',https://timesofindia.indiatimes.com/articleshow/129843424.cms,2026-04-29T22:56:58+00:00
TOI ETimes,52,It’s the best time to be doing theatre: Juhi Babbar Soni,https://timesofindia.indiatimes.com/articleshow/129826631.cms,2026-04-29T22:56:58+00:00
TOI ETimes,53,"Anu Malik steps into theatre with Anupam Kher’s play, Calls it his most exciting challenge yet",https://timesofindia.indiatimes.com/articleshow/129729335.cms,2026-04-29T22:56:58+00:00
TOI ETimes,54,'Wicked' musical director John Stefaniuk on live music on the stage: 'It is so exciting to hear the orchestra whisk us away',https://timesofindia.indiatimes.com/articleshow/129610267.cms,2026-04-29T22:56:58+00:00
TOI ETimes,55,"'Wicked' stars Rebekah Lowings and Eve Shanu-Wilson on Elphaba-Glinda's bond: 'Friends challenge you, not just cheer you on'",https://timesofindia.indiatimes.com/articleshow/129607673.cms,2026-04-29T22:56:58+00:00
TOI ETimes,56,Raj Kundra and Shilpa Shetty's 15th Wedding Anniversary,https://timesofindia.indiatimes.com/articleshow/115563990.cms,2026-04-29T22:56:58+00:00
TOI ETimes,57,​Bigg Boss winners list from season 1 to 17​,https://timesofindia.indiatimes.com/articleshow/114277426.cms,2026-04-29T22:56:58+00:00
TOI ETimes,58,​Discover the bird with a prehistoric roar​,https://timesofindia.indiatimes.com/articleshow/114244474.cms,2026-04-29T22:56:58+00:00
TOI ETimes,59,Dia Mirza's ethnic wear,https://timesofindia.indiatimes.com/articleshow/114243410.cms,2026-04-29T22:56:58+00:00
TOI ETimes,60,​Incredible facts about ants you won’t believe​,https://timesofindia.indiatimes.com/articleshow/114243248.cms,2026-04-29T22:56:58+00:00
TOI ETimes,61,'Bigg Boss Marathi 5' nears grand finale​,https://timesofindia.indiatimes.com/articleshow/113936459.cms,2026-04-29T22:56:58+00:00
TOI ETimes,62,‘Not proper football’: Fans blast Piers Morgan after savage take on PSG vs Bayern epic nine-goal thriller,https://timesofindia.indiatimes.com/articleshow/130606150.cms,2026-04-29T22:56:58+00:00
TOI ETimes,63,‘Hum sochte rehte the ke koi le jaye hume… bada shauk hai trekking ka’: Two sisters over the age of 70 on Kedarnath trek win hearts,https://timesofindia.indiatimes.com/articleshow/130605210.cms,2026-04-29T22:56:58+00:00
TOI ETimes,64,FIFA makes rarest exception to let Afghan women’s refugee team play as official national side without Taliban approval,https://timesofindia.indiatimes.com/articleshow/130603956.cms,2026-04-29T22:56:58+00:00
TOI ETimes,65,What is mithi jal: Rajasthan's desi AC system that keeps surroundings 8 degrees cooler than outside in summers,https://timesofindia.indiatimes.com/articleshow/130605091.cms,2026-04-29T22:56:58+00:00
TOI ETimes,66,‘Need ₹40 crore to retire in India?’ Founder’s claim leaves internet stunned,https://timesofindia.indiatimes.com/articleshow/130599986.cms,2026-04-29T22:56:58+00:00
TOI ETimes,67,‘My dad’s screen time is higher than mine’: Indian woman on rising phone addiction among older adults,https://timesofindia.indiatimes.com/articleshow/130600507.cms,2026-04-29T22:56:58+00:00
TOI ETimes,68,Polish woman living in India for a decade reveals things the world can learn: 'Should be in every country',https://timesofindia.indiatimes.com/articleshow/130599742.cms,2026-04-29T22:56:58+00:00
TOI ETimes,69,"Laid off at 43, found another in 90 days: Man’s ‘stop blind applying’ advice goes viral | Video",https://timesofindia.indiatimes.com/articleshow/130597653.cms,2026-04-29T22:56:58+00:00
TOI ETimes,70,'Go back to India': Canadian school offering Punjabi classes faces massive backlash online,https://timesofindia.indiatimes.com/articleshow/130597658.cms,2026-04-29T22:56:58+00:00
TOI ETimes,71,“I took disagreement personally”: IIT–ISB boss admits he lost 3 employees over basic mistakes,https://timesofindia.indiatimes.com/articleshow/130593917.cms,2026-04-29T22:56:58+00:00
TOI ETimes,72,What are death doulas and why even Nicole Kidman is exploring this path after personal loss,https://timesofindia.indiatimes.com/articleshow/130585068.cms,2026-04-29T22:56:58+00:00
TOI ETimes,73,"“In India, they’d rush to help”: Florida woman on the fate of a trapped venomous snake",https://timesofindia.indiatimes.com/articleshow/130584673.cms,2026-04-29T22:56:58+00:00
TOI ETimes,74,Who was Kiara Janae Brokenbrough? Bride who went viral for $500 wedding dies during childbirth,https://timesofindia.indiatimes.com/articleshow/130583033.cms,2026-04-29T22:56:58+00:00
TOI ETimes,75,When fandom goes a bit too far: From Abhishek Sharma’s viral hand grab incident to 5 times fans crossed the line with Indian celebs,https://timesofindia.indiatimes.com/articleshow/130582642.cms,2026-04-29T22:56:58+00:00
TOI ETimes,76,"Meet the man behind algebra and algorithms: The Persian scholar who shaped mathematics more than 1,200 years ago",https://timesofindia.indiatimes.com/articleshow/130581830.cms,2026-04-29T22:56:58+00:00
TOI ETimes,77,‘We wasted three years’: Bengaluru couple who moved to Canada reveal the harrowing truth about moving abroad,https://timesofindia.indiatimes.com/articleshow/130579090.cms,2026-04-29T22:56:58+00:00
TOI ETimes,78,"Why families with small children should board planes last, according to a former flight attendant",https://timesofindia.indiatimes.com/articleshow/130578149.cms,2026-04-29T22:56:58+00:00
TOI ETimes,79,Who is Himshikha Tripathi? The girl who grabbed cricketer Abhishek Sharma’s hand - and later apologised,https://timesofindia.indiatimes.com/articleshow/130575521.cms,2026-04-29T22:56:58+00:00
TOI ETimes,80,Indian woman living in Australia says her mum’s ‘haldi doodh’ is now an $8 turmeric latte,https://timesofindia.indiatimes.com/articleshow/130574466.cms,2026-04-29T22:56:58+00:00
TOI ETimes,81,'India is terrible': Tamil actor reacts to Zoho founder Sridhar Vembu's urge for Indians in US to return,https://timesofindia.indiatimes.com/articleshow/130570953.cms,2026-04-29T22:56:58+00:00
TOI ETimes,82,This volcano doesn't glow red - it turns electric blue at night and looks straight out of a sci-fi movie,https://timesofindia.indiatimes.com/articleshow/130568934.cms,2026-04-29T22:56:58+00:00
TOI ETimes,83,She solved a 400-year-old problem that Newton and Kepler couldn’t: Meet the Ukrainian mathematician Maryna Viazovska,https://timesofindia.indiatimes.com/articleshow/130564119.cms,2026-04-29T22:56:58+00:00
TOI ETimes,84,Did an asteroid pave the way for 'Octopus like-squids' ? How these creatures survived the extinction of the dinosaurs,https://timesofindia.indiatimes.com/articleshow/130561662.cms,2026-04-29T22:56:58+00:00
TOI ETimes,85,"What is the unique 5,000-year-old Raulane festival in Himachal where men cover their faces and dress as brides?",https://timesofindia.indiatimes.com/articleshow/130560339.cms,2026-04-29T22:56:58+00:00
TOI ETimes,86,"""That doesn't look human"": Vaibhav Sooryavanshi comes under bizarre AI chip claim by Pakistani analyst, netizens can't stop laughing",https://timesofindia.indiatimes.com/articleshow/130558255.cms,2026-04-29T22:56:58+00:00
TOI ETimes,87,Who is Cole Tomas Allen? The 31-year-old California tutor accused of storming the White House Correspondents' Association dinner,https://timesofindia.indiatimes.com/articleshow/130557041.cms,2026-04-29T22:56:58+00:00
TOI ETimes,88,Husky escapes from home to meet her friend at daycare!,https://timesofindia.indiatimes.com/articleshow/130555189.cms,2026-04-29T22:56:58+00:00
TOI ETimes,89,Who is Arun Panwar? The YouTuber at the center of the controversy surrounding his wedding ‘daan’ video,https://timesofindia.indiatimes.com/articleshow/130552063.cms,2026-04-29T22:56:58+00:00
TOI ETimes,90,Who is Oz Pearlman? Performer at Washington dinner as shooting scare triggered Trump's evacuation,https://timesofindia.indiatimes.com/articleshow/130551895.cms,2026-04-29T22:56:58+00:00
TOI ETimes,91,A teacher’s gift to the world: MIT professor who taught the ...,https://timesofindia.indiatimes.com/articleshow/130524783.cms,2026-04-29T22:56:58+00:00
TOI ETimes,92,The green warrior: Man grew a 31-hectare forest on degraded ...,https://timesofindia.indiatimes.com/articleshow/130472357.cms,2026-04-29T22:56:58+00:00
TOI ETimes,93,American woman with four kids lists 10 lessons about living ...,https://timesofindia.indiatimes.com/articleshow/130544316.cms,2026-04-29T22:56:58+00:00
TOI ETimes,94,Indian woman in Dublin says she missed a loved one’s wedding...,https://timesofindia.indiatimes.com/articleshow/130522361.cms,2026-04-29T22:56:58+00:00
TOI ETimes,95,14-year-old boy selling postcards outside Angkor Wat who spo...,https://timesofindia.indiatimes.com/articleshow/130197303.cms,2026-04-29T22:56:58+00:00
TOI ETimes,96,Who was Sawai Madho Singh II? The Maharaja who carried his o...,https://timesofindia.indiatimes.com/articleshow/130190590.cms,2026-04-29T22:56:58+00:00
TOI ETimes,97,"Meet Palmer Luckey: He built a $2 billion company at 19, got...",https://timesofindia.indiatimes.com/articleshow/129907090.cms,2026-04-29T22:56:58+00:00
TOI ETimes,98,"Missing toddler found peacefully napping on a mountain, and the internet can’t get over it",https://timesofindia.indiatimes.com/articleshow/130550400.cms,2026-04-29T22:56:58+00:00
TOI ETimes,99,"Trying to escape 44°C heat, Rajasthan man ends up trapped inside milk can – video viral",https://timesofindia.indiatimes.com/articleshow/130549540.cms,2026-04-29T22:56:58+00:00
TOI ETimes,100,Armpit-sniffing: Japanese underground idol faces backlash over controversial fan interaction,https://timesofindia.indiatimes.com/articleshow/130544269.cms,2026-04-29T22:56:58+00:00
TOI ETimes,101,"$1000 rent, $100 groceries: US man who moved to China calls life his 'version of the American Dream'",https://timesofindia.indiatimes.com/articleshow/130544273.cms,2026-04-29T22:56:58+00:00
TOI ETimes,102,"Haldi doodh is the new turmeric latte? Viral video shows how Indian traditions called ""old"" are becoming ""gold"" in Western countries",https://timesofindia.indiatimes.com/articleshow/130562084.cms,2026-04-29T22:56:58+00:00
TOI ETimes,103,Why do dreams feel so real after a bad night’s sleep? Experts reveal the shocking science behind dream vividness,https://timesofindia.indiatimes.com/articleshow/130532104.cms,2026-04-29T22:56:58+00:00
TOI ETimes,104,"While Trump was rushed to safety after ‘shots fired’ at White House event, viral video shows press members ‘stealing’ wine amid chaos",https://timesofindia.indiatimes.com/articleshow/130529417.cms,2026-04-29T22:56:58+00:00
TOI ETimes,105,"Bigg Boss Telugu sensation Ashu Reddy embroiled in ₹9.35 crore marriage promise case, threatens legal action",https://timesofindia.indiatimes.com/articleshow/130528760.cms,2026-04-29T22:56:58+00:00
TOI ETimes,106,Fungi in space? Study finds surprising survival ability in Mars-like conditions,https://timesofindia.indiatimes.com/articleshow/130526781.cms,2026-04-29T22:56:58+00:00
TOI ETimes,107,Pay maintenance but barred from using society's facilities: Karnataka society bars 1bhk residents from using gym and pool,https://timesofindia.indiatimes.com/articleshow/130515066.cms,2026-04-29T22:56:58+00:00
TOI ETimes,108,"Sleep on a yoga mat, work without pay: Singapore domestic helper’s shocking claim against British-Indian family goes viral",https://timesofindia.indiatimes.com/articleshow/130514900.cms,2026-04-29T22:56:58+00:00
TOI ETimes,109,"2,000‑year‑old charred and well preserved bread reveals how Roman soldiers really ate on the frontier",https://timesofindia.indiatimes.com/articleshow/130514733.cms,2026-04-29T22:56:58+00:00
TOI ETimes,110,Drishyam 3 Teaser,https://timesofindia.indiatimes.com/articleshow/130611588.cms,2026-04-29T22:56:58+00:00
TOI ETimes,111,Ghee Purity Check,https://timesofindia.indiatimes.com/articleshow/130544411.cms,2026-04-29T22:56:58+00:00
TOI ETimes,112,Dhurandhar 2 Collection,https://timesofindia.indiatimes.com/articleshow/130481014.cms,2026-04-29T22:56:58+00:00
TOI ETimes,113,Garena Free Fire Max Redeem Codes,https://timesofindia.indiatimes.com/articleshow/130595454.cms,2026-04-29T22:56:58+00:00
TOI ETimes,114,EU Warns Meta,https://timesofindia.indiatimes.com/articleshow/130605946.cms,2026-04-29T22:56:58+00:00
TOI ETimes,115,Hazaribag man drowns while fishing in lake,https://timesofindia.indiatimes.com/articleshow/130060093.cms,2026-04-29T22:56:58+00:00
TOI ETimes,116,"""Behen Darr Gayi!"": Fans relive ‘Bhagam Bhag’ era after watching Akshay Kumar's 'Bhooth Bangla' trailer",https://timesofindia.indiatimes.com/articleshow/130060027.cms,2026-04-29T22:56:58+00:00
TOI ETimes,117,MBOSE HSLC result 2026 to release tomorrow: Check details here,https://timesofindia.indiatimes.com/articleshow/130059814.cms,2026-04-29T22:56:58+00:00
TOI ETimes,118,"Iran war risk: JPMorgan CEO Jamie Dimon warns of oil shocks, sticky inflation and higher interest rates",https://timesofindia.indiatimes.com/articleshow/130059993.cms,2026-04-29T22:56:58+00:00
TOI ETimes,119,Make your clutch last longer with these easy driving tips,https://timesofindia.indiatimes.com/articleshow/130052232.cms,2026-04-29T22:56:58+00:00
TOI ETimes,120,“Three-against-one situation”: El Rubius opens up on being “targeted” in MrBeast’s viral $1M challenge,https://timesofindia.indiatimes.com/articleshow/130054402.cms,2026-04-29T22:56:58+00:00
TOI ETimes,121,Bihar BTSC lab assistant notification released for 1091 posts at btsc.bihar.gov.in; apply here,https://timesofindia.indiatimes.com/articleshow/130059322.cms,2026-04-29T22:56:58+00:00
TOI ETimes,122,IPL craze costs techie Rs 1.46 lakh in fake RCB vs CSK ticket scam,https://timesofindia.indiatimes.com/articleshow/130059549.cms,2026-04-29T22:56:58+00:00
TOI ETimes,123,Raising “robot-proof” kids: Why creativity and curiosity matter more than ever,https://timesofindia.indiatimes.com/articleshow/130057342.cms,2026-04-29T22:56:58+00:00
TOI ETimes,124,Inside ‘Satguru Sharan’: Exploring Saif Ali Khan and Kareena Kapoor Khan’s Rs 100 crore Bandra home,https://timesofindia.indiatimes.com/articleshow/130059584.cms,2026-04-29T22:56:58+00:00
TOI ETimes,125,How selling Alaska in 1867 was a costly mistake for Russia,https://timesofindia.indiatimes.com/articleshow/130057081.cms,2026-04-29T22:56:58+00:00
TOI ETimes,126,'Hera Pheri 3 is coming': Paresh Rawal dismisses delay reports and reveals he will 'start shooting soon',https://timesofindia.indiatimes.com/articleshow/130059421.cms,2026-04-29T22:56:58+00:00
TOI ETimes,127,"US-Iran War: A daring rescue Hollywood blockbuster is on its way. Till then, pick your favourite from these 10 films on bringing someone home against all odds",https://timesofindia.indiatimes.com/articleshow/130059208.cms,2026-04-29T22:56:58+00:00
TOI ETimes,128,"Kolkata team unveils fan mural at Rash Behari Avenue, celebrating city’s first love",https://timesofindia.indiatimes.com/articleshow/130059554.cms,2026-04-29T22:56:58+00:00
TOI ETimes,129,How US spread a lie to rescue a pilot of a jet shot down in Iran,https://timesofindia.indiatimes.com/articleshow/130058641.cms,2026-04-29T22:56:58+00:00
TOI ETimes,130,"Netflix unveils ‘VOID’, an AI model that can change a movie plot",https://timesofindia.indiatimes.com/articleshow/130058880.cms,2026-04-29T22:56:58+00:00
TOI ETimes,131,"AI data centers are causing 'stress' not just to tech companies, but also private insurers",https://timesofindia.indiatimes.com/articleshow/130058967.cms,2026-04-29T22:56:58+00:00
TOI ETimes,132,"""Trans women are....."": Clavicular’s viral moment with trans women sparks fresh conversation on internet culture",https://timesofindia.indiatimes.com/articleshow/130053479.cms,2026-04-29T22:56:58+00:00
TOI Viral News,1,"Watch: Hardeep Singh Puri reunites with old friend from Delhi University, video melts hearts",https://timesofindia.indiatimes.com/articleshow/108418522.cms,2026-04-29T22:56:58+00:00
TOI Viral News,2,Narayana Murthy and daughter Akshata enjoy 'Corner House' ice cream in Bengaluru,https://timesofindia.indiatimes.com/articleshow/107659138.cms,2026-04-29T22:56:58+00:00
TOI Viral News,3,Taylor Swift cheers boyfriend Travis Kelce at the Super Bowl,https://timesofindia.indiatimes.com/articleshow/107613344.cms,2026-04-29T22:56:58+00:00
TOI Viral News,4,'He Nitished me' to 'Paltu Chacha': Nitish Kumar's 'swing politics' sparks humour fest,https://timesofindia.indiatimes.com/articleshow/107236114.cms,2026-04-29T22:56:58+00:00
TOI Viral News,5,"Flyer hits IndiGo Pilot announcing flight delay due to dense fog conditions, video goes viral",https://timesofindia.indiatimes.com/articleshow/106851189.cms,2026-04-29T22:56:58+00:00
TOI Viral News,6,"New Zealand's youngest MP performs native 'war cry' in Parliament, video goes viral",https://timesofindia.indiatimes.com/articleshow/106572179.cms,2026-04-29T22:56:58+00:00
TOI Viral News,7,"NASA unveils stunning image of 'evil eye' galaxy, sparking internet awe",https://timesofindia.indiatimes.com/articleshow/105570940.cms,2026-04-29T22:56:58+00:00
TOI Viral News,8,Millennials bemoan lackluster Black Friday deals in social media uproar,https://timesofindia.indiatimes.com/articleshow/105475777.cms,2026-04-29T22:56:58+00:00
TOI Viral News,9,'At least they'll not lose to India in semis': Memes erupt with Pakistan all but out of World Cup,https://timesofindia.indiatimes.com/articleshow/105122539.cms,2026-04-29T22:56:58+00:00
TOI Viral News,10,Brazilian influencer Vanessa Mancini dies at 41 from massive heart attack,https://timesofindia.indiatimes.com/articleshow/105110853.cms,2026-04-29T22:56:58+00:00
TOI Viral News,11,Memes erupt as Angelo Mathews becomes first international cricketer to be timed out,https://timesofindia.indiatimes.com/articleshow/105016656.cms,2026-04-29T22:56:58+00:00
TOI Viral News,12,Mia Khalifa posts Amy Schumer's heated exchange with Asia Jackson over Israel-Palestine conflict,https://timesofindia.indiatimes.com/articleshow/104947696.cms,2026-04-29T22:56:58+00:00
TOI Viral News,13,Fans troll Pakistan as Proteas beat Kiwis to keep Pak's semi-final hopes alive,https://timesofindia.indiatimes.com/articleshow/104912338.cms,2026-04-29T22:56:58+00:00
TOI Viral News,14,Mark Zuckerberg and family's Halloween transformation into Hogwarts icons warms hearts,https://timesofindia.indiatimes.com/articleshow/104888586.cms,2026-04-29T22:56:58+00:00
TOI Viral News,15,'Bore hone ka chance-ich nahi' as auto driver sings & entertains people stuck in Andheri traffic,https://timesofindia.indiatimes.com/articleshow/104886091.cms,2026-04-29T22:56:58+00:00
TOI Viral News,16,Escaped monkey 'Momo' captured after it drinks beer and runs riot in Indianapolis,https://timesofindia.indiatimes.com/articleshow/104208644.cms,2026-04-29T22:56:58+00:00
TOI Viral News,17,"Animal smuggling: Otter, rat and 28 turtles cause chaos on Bangkok to Taipei flight",https://timesofindia.indiatimes.com/articleshow/104208771.cms,2026-04-29T22:56:58+00:00
TOI Viral News,18,Alligator ally oops! Phillies fan denied entry with emotional support gator,https://timesofindia.indiatimes.com/articleshow/104043227.cms,2026-04-29T22:56:58+00:00
TOI Viral News,19,'Qualified for Karachi station': Pakistan's exit from Asia Cup sparks memefest,https://timesofindia.indiatimes.com/articleshow/103687163.cms,2026-04-29T22:56:58+00:00
TOI Viral News,20,"'Racist bigots': Arabic restaurant in US refuses to serve cops in uniform, faces fury",https://timesofindia.indiatimes.com/articleshow/103285144.cms,2026-04-29T22:56:58+00:00
TOI Viral News,21,Watch: Pakistani wedding in UK descends into mass brawl as guests hurl chairs at each other,https://timesofindia.indiatimes.com/articleshow/103245258.cms,2026-04-29T22:56:58+00:00
