source,rank,headline,link,collected_at_iso
TOI ETimes,91,‘Poor kid got exhausted…’: Viral video of student fanning teacher in MP government school sparks outrage,https://timesofindia.indiatimes.com/articleshow/130148991.cms,2026-04-12T10:38:49+00:00
TOI ETimes,92,Meet Harshita Arora: Indian-origin founder of $700M startup ...,https://timesofindia.indiatimes.com/articleshow/130122853.cms,2026-04-12T10:38:49+00:00
TOI ETimes,93,Viral video: Russian tourist choked by locals in Bali after ...,https://timesofindia.indiatimes.com/articleshow/129983079.cms,2026-04-12T10:38:49+00:00
TOI ETimes,94,‘First in 36 years’: Indian-origin student wins elite Church...,https://timesofindia.indiatimes.com/articleshow/129998588.cms,2026-04-12T10:38:49+00:00
TOI ETimes,95,"Happy Easter Sunday 2026: Top 70 Wishes, Messages, Greetings...",https://timesofindia.indiatimes.com/articleshow/130004282.cms,2026-04-12T10:38:49+00:00
TOI ETimes,96,"Meet Palmer Luckey: He built a $2 billion company at 19, got...",https://timesofindia.indiatimes.com/articleshow/129907090.cms,2026-04-12T10:38:49+00:00
TOI ETimes,97,"Happy Eid-ul-Fitr 2026: Eid Mubarak Wishes, Messages, Quotes...",https://timesofindia.indiatimes.com/articleshow/129680487.cms,2026-04-12T10:38:49+00:00
TOI ETimes,98,Meet Patrick Winston: MIT professor whose one-hour lecture s...,https://timesofindia.indiatimes.com/articleshow/129827810.cms,2026-04-12T10:38:49+00:00
TOI ETimes,99,'Not a game at all': Canadian PM Mark Carney and Finland’s p...,https://timesofindia.indiatimes.com/articleshow/129641203.cms,2026-04-12T10:38:49+00:00
TOI ETimes,100,"Watch: 12-year-old’s violent reaction to ‘no more food’ goes viral, debate on parenting begins",https://timesofindia.indiatimes.com/articleshow/130147878.cms,2026-04-12T10:38:49+00:00
TOI ETimes,101,Samay Raina's challenge goes viral: ‘Still Alive’ reels show sons saying ‘I love you’ to dads,https://timesofindia.indiatimes.com/articleshow/130146175.cms,2026-04-12T10:38:49+00:00
TOI ETimes,102,One of psychology’s darkest human experiments: ‘Little Albert’ terrified for science in infamous 1920 study,https://timesofindia.indiatimes.com/articleshow/130142929.cms,2026-04-12T10:38:49+00:00
TOI ETimes,103,No aloo in samosa? This 500-year-old recipe from Akbar’s era is going viral,https://timesofindia.indiatimes.com/articleshow/130142851.cms,2026-04-12T10:38:49+00:00
TOI ETimes,104,Meet Gauri M? The 19‑year‑old Indian woman who landed a marketing job at BMW without a degree,https://timesofindia.indiatimes.com/articleshow/130140303.cms,2026-04-12T10:38:49+00:00
TOI ETimes,105,British pastor charged with manslaughter after man drowns during his own ‘born again’ baptism,https://timesofindia.indiatimes.com/articleshow/130139073.cms,2026-04-12T10:38:49+00:00
TOI ETimes,106,‘Chef is a big Emraan Hashmi fan!’: What is the viral ‘Chef’s Kiss’ dessert everyone’s talking about?,https://timesofindia.indiatimes.com/articleshow/130138249.cms,2026-04-12T10:38:49+00:00
TOI ETimes,107,From Kashmir to Edinburgh: Who is Dr Zarak Bhat - Kashmir scholar lands prestigious AI role at Edinburgh University,https://timesofindia.indiatimes.com/articleshow/130135692.cms,2026-04-12T10:38:49+00:00
TOI ETimes,108,"30 kg school bags & ₹9,000 for class 2 books: Parents call out ‘Education Scam’ in viral videos",https://timesofindia.indiatimes.com/articleshow/130131060.cms,2026-04-12T10:38:49+00:00
TOI ETimes,109,"Just days before Chardham Yatra 2026, Kedarnath Dham covered in 5 feet snow - Internet reacts to viral videos",https://timesofindia.indiatimes.com/articleshow/130129107.cms,2026-04-12T10:38:49+00:00
TOI ETimes,110,Zoho’s Sridhar Vembu says ‘Go back to villages’ - Netizens are divided,https://timesofindia.indiatimes.com/articleshow/130128299.cms,2026-04-12T10:38:49+00:00
TOI ETimes,111,Watch: Man frozen on Bengaluru street fuels shocking ‘zombie drug’ claims online,https://timesofindia.indiatimes.com/articleshow/130122834.cms,2026-04-12T10:38:49+00:00
TOI ETimes,112,Is El Niño coming back? Here’s what it could mean for 2026 weather,https://timesofindia.indiatimes.com/articleshow/130122893.cms,2026-04-12T10:38:49+00:00
TOI ETimes,113,7-Eleven video of Indian worker sparks H-1B debate in US; congressman calls it a ‘scam’,https://timesofindia.indiatimes.com/articleshow/130117948.cms,2026-04-12T10:38:49+00:00
TOI ETimes,114,Who is ‘Ketamine Queen’ Jasveen Sangha? The woman now at the centre of the Matthew Perry drug overdose case,https://timesofindia.indiatimes.com/articleshow/130110198.cms,2026-04-12T10:38:49+00:00
TOI ETimes,115,No LPG or cylinder required for cooking: What is the 'plug-and-play' Hydrogen cooking stove that produces gas through water electrolysis?,https://timesofindia.indiatimes.com/articleshow/130109070.cms,2026-04-12T10:38:49+00:00
TOI ETimes,116,Keralite reveals being punished for speaking mother tongue in school: Viral Reddit post shares story of 30-year-old who lost his language in English-only system,https://timesofindia.indiatimes.com/articleshow/130106790.cms,2026-04-12T10:38:49+00:00
TOI ETimes,117,"Petrol shock in Pakistan! After outrage over ₹152/L, government slashes fuel rates - check latest prices",https://timesofindia.indiatimes.com/articleshow/130104650.cms,2026-04-12T10:38:49+00:00
TOI ETimes,118,Erratic rainfalls in March impact Mango crop: How to ripen raw Mangoes rightly with grandma's newspaper hack using quick commerce paper bags,https://timesofindia.indiatimes.com/articleshow/130083166.cms,2026-04-12T10:38:49+00:00
TOI ETimes,119,‘Did he just fart?’ US Defense Secretary Pete Hegseth’s serious briefing turns into viral moment,https://timesofindia.indiatimes.com/articleshow/130101919.cms,2026-04-12T10:38:49+00:00
TOI ETimes,120,Meet Shirli Ling: The social media influencer and chicken hotpot boss who became a grandmother at 34,https://timesofindia.indiatimes.com/articleshow/130101855.cms,2026-04-12T10:38:49+00:00
TOI ETimes,121,Meet ‘Chaya Chechi’: Her dreamy chai-on-a-boat experience is going viral– here’s why,https://timesofindia.indiatimes.com/articleshow/130094820.cms,2026-04-12T10:38:49+00:00
TOI ETimes,122,Love teddy bears? These 5 dog breeds look just like them,https://timesofindia.indiatimes.com/articleshow/130093314.cms,2026-04-12T10:38:49+00:00
TOI ETimes,123,We’re running out of Earth: Study warns current lifestyle needs 2 planets,https://timesofindia.indiatimes.com/articleshow/130092316.cms,2026-04-12T10:38:49+00:00
TOI ETimes,124,Inside the row over Pippa Middleton’s countryside home: Why are locals upset with Kate Middleton’s sister,https://timesofindia.indiatimes.com/articleshow/130091068.cms,2026-04-12T10:38:49+00:00
TOI ETimes,125,Did you know NYC once flew helicopters from skyscraper rooftops to airports in 1965? Here’s how it all went wrong,https://timesofindia.indiatimes.com/articleshow/130085042.cms,2026-04-12T10:38:49+00:00
TOI ETimes,126,Inside Gaurav Taneja’s Rs 10 crore Gurugram farmhouse: Where 200 cows power a desi food venture,https://timesofindia.indiatimes.com/articleshow/130089447.cms,2026-04-12T10:38:49+00:00
TOI ETimes,127,"After 'Dhurandhar' made Lyari in Pakistan viral, ‘Lyari in India’ is trending online - All about the hidden gem of Gujarat",https://timesofindia.indiatimes.com/articleshow/130087039.cms,2026-04-12T10:38:49+00:00
TOI ETimes,128,"Macaulay's children are triggered because Pujarini Pradhan, from Medinipur, didn’t ask for permission to think, and speak English",https://timesofindia.indiatimes.com/articleshow/130085029.cms,2026-04-12T10:38:49+00:00
TOI ETimes,129,"Rs 200 sapling to Rs 60,000 tree: The mahogany farming secret turning Indian farmers into crorepatis",https://timesofindia.indiatimes.com/articleshow/130085813.cms,2026-04-12T10:38:49+00:00
TOI ETimes,130,"Meet Africa’s richest king: How King Mohammed VI’s ₹6,200 crore gold bet is changing the gold game",https://timesofindia.indiatimes.com/articleshow/130084007.cms,2026-04-12T10:38:49+00:00
TOI ETimes,131,India's unstoppable daughter: Who is Payal Nag - World’s first quadruple amputee archer,https://timesofindia.indiatimes.com/articleshow/130082222.cms,2026-04-12T10:38:49+00:00
TOI ETimes,132,Who is Divya Singh? A 28-year-old teacher and the first Indian woman to cycle to Everest Base Camp,https://timesofindia.indiatimes.com/articleshow/130079771.cms,2026-04-12T10:38:49+00:00
TOI ETimes,133,Mid-air shock! Sydney-Dallas Qantas flight dumps fuel over ocean after sudden emergency - here’s what happened,https://timesofindia.indiatimes.com/articleshow/130077596.cms,2026-04-12T10:38:49+00:00
TOI ETimes,134,'IITian Baba' Abhey Singh gets married: Who is his wife Pratika?,https://timesofindia.indiatimes.com/articleshow/130076066.cms,2026-04-12T10:38:49+00:00
TOI ETimes,135,He made JEE history with 360/360: From IIT topper to singer-songwriter? Kalpit Veerwal’s journey is anything but typical,https://timesofindia.indiatimes.com/articleshow/130074916.cms,2026-04-12T10:38:49+00:00
TOI ETimes,136,Struggling with self-appraisal? 5 simple ways to make your boss notice your work,https://timesofindia.indiatimes.com/articleshow/130069343.cms,2026-04-12T10:38:49+00:00
TOI ETimes,137,"Researchers create QR code thinner than a human hair, set world record",https://timesofindia.indiatimes.com/articleshow/130068978.cms,2026-04-12T10:38:49+00:00
TOI ETimes,138,Viral: Walking at 2:30 am ‘without fear’? Gurugram couple’s clip gets people talking,https://timesofindia.indiatimes.com/articleshow/130066968.cms,2026-04-12T10:38:49+00:00
TOI ETimes,139,"Video: Young doctor quits on first day, alleges patients were kept in ICU unnecessarily for profit: ‘Keep them for…’",https://timesofindia.indiatimes.com/articleshow/130065115.cms,2026-04-12T10:38:49+00:00
TOI ETimes,140,Watch here: Dog goes on attacking spree in seconds; viral video triggers fear online,https://timesofindia.indiatimes.com/articleshow/130063159.cms,2026-04-12T10:38:49+00:00
TOI ETimes,141,Beloved Indian gulab jamun stuffed in a croissant? ‘Cromun’ leaves internet furious over new food experiment,https://timesofindia.indiatimes.com/articleshow/130061664.cms,2026-04-12T10:38:49+00:00
TOI ETimes,142,"Rare pair eclipse in August 2026: When and where to watch, timings, and what does it mean?",https://timesofindia.indiatimes.com/articleshow/130058133.cms,2026-04-12T10:38:49+00:00
TOI ETimes,143,PowerWash Simulator 2: The oddly satisfying ‘boring’ yet viral game people are playing for 24 hours straight,https://timesofindia.indiatimes.com/articleshow/130056751.cms,2026-04-12T10:38:49+00:00
TOI ETimes,144,Viral dance party on rails: Marwari family books entire train coach for wedding; watch video,https://timesofindia.indiatimes.com/articleshow/130056945.cms,2026-04-12T10:38:49+00:00
TOI ETimes,145,Who was Kasey Grelle? ‘Brilliant and selfless’ CEO mom killed in tragic resort truck crash in Nicaragua,https://timesofindia.indiatimes.com/articleshow/130056642.cms,2026-04-12T10:38:49+00:00
TOI ETimes,146,Too expensive to have a respectful funeral? What is China's burial crisis that is forcing people to store ashes in 'new' apartments,https://timesofindia.indiatimes.com/articleshow/130053917.cms,2026-04-12T10:38:49+00:00
TOI ETimes,147,"Detroit bakery’s ‘creepy lamb cake’ prank goes viral, sparks reactions and real orders",https://timesofindia.indiatimes.com/articleshow/130052880.cms,2026-04-12T10:38:49+00:00
TOI ETimes,148,Who is Disha Sharma? Famous media personality's daughter who tied the knot in a 2-states styled wedding with Bengaluru-based lawyer Sudarshan MJ,https://timesofindia.indiatimes.com/articleshow/130052454.cms,2026-04-12T10:38:49+00:00
TOI ETimes,149,"Artemis II astronauts lose contact with Earth for 40 minutes in space: Why will this happen, and what will the crew do during this time?",https://timesofindia.indiatimes.com/articleshow/130050721.cms,2026-04-12T10:38:49+00:00
TOI ETimes,150,Who is Kashmira Pardeshi? The ‘mystery girl’ and PBKS fan from IPL stands everyone can’t stop talking about,https://timesofindia.indiatimes.com/articleshow/130049862.cms,2026-04-12T10:38:49+00:00
TOI ETimes,151,‘How is that comedy?’: SNL UK faces backlash over crude joke referencing Mark Zuckerberg and Adolf Hitler,https://timesofindia.indiatimes.com/articleshow/130046367.cms,2026-04-12T10:38:49+00:00
TOI ETimes,152,Who is Priya Patel? Indian-origin pro-MAGA influencer sparks massive row over viral immigration video,https://timesofindia.indiatimes.com/articleshow/130041982.cms,2026-04-12T10:38:49+00:00
TOI ETimes,153,From Daya to Jethalal: This family’s Taarak Mehta Ka Ooltah Chashmah-themed birthday party is going viral,https://timesofindia.indiatimes.com/articleshow/130041622.cms,2026-04-12T10:38:49+00:00
TOI ETimes,154,"'My duty to keep her happy’: Retired judge welcomes divorced daughter home with dhol, dance, and pride",https://timesofindia.indiatimes.com/articleshow/130038650.cms,2026-04-12T10:38:49+00:00
TOI ETimes,155,No more Gutkha spits on roads! Meet the young innovators who have found an innovative and bio-friendly device for India's spitting problem,https://timesofindia.indiatimes.com/articleshow/130038404.cms,2026-04-12T10:38:49+00:00
TOI ETimes,156,Venus has a hidden volcano cave! Astronomers spot a giant lava tube beneath 'Nyx Mons',https://timesofindia.indiatimes.com/articleshow/130038058.cms,2026-04-12T10:38:49+00:00
TOI ETimes,157,What is the net worth of Kash Patel? Everything you should know about the Indian-origin FBI director and why he is in news,https://timesofindia.indiatimes.com/articleshow/130037613.cms,2026-04-12T10:38:49+00:00
TOI ETimes,158,No cash or card needed from bazaars to temples: German traveller appreciates the “Real Digi‑India” for cashless payments,https://timesofindia.indiatimes.com/articleshow/130036993.cms,2026-04-12T10:38:49+00:00
TOI ETimes,159,"From sugar‑filled mornings to a bittersweet exit: After 15 years of sweet cravings, this beloved doughnut chain is quietly exiting India",https://timesofindia.indiatimes.com/articleshow/130035309.cms,2026-04-12T10:38:49+00:00
TOI ETimes,160,"Who is Kai Trump? US President Donald Trump's granddaughter, influencer and golfer who is receiving backlash for her dream job reveal",https://timesofindia.indiatimes.com/articleshow/130034216.cms,2026-04-12T10:38:49+00:00
TOI ETimes,161,"Happy Easter Sunday 2026: Best Messages, Quotes, Wishes, Greetings and Images to share on Easter Sunday",https://timesofindia.indiatimes.com/articleshow/130025228.cms,2026-04-12T10:38:49+00:00
TOI ETimes,162,‘It changed me’: British traveller’s raw take on India is winning hearts online,https://timesofindia.indiatimes.com/articleshow/130033290.cms,2026-04-12T10:38:49+00:00
TOI ETimes,163,"Happy Easter Sunday 2026: Images, Quotes, Wishes, Messages, Images, Cards, Greetings, Pictures and GIFs",https://timesofindia.indiatimes.com/articleshow/130001252.cms,2026-04-12T10:38:49+00:00
TOI ETimes,164,Asha Bhosle Death News,https://timesofindia.indiatimes.com/articleshow/130204281.cms,2026-04-12T10:38:49+00:00
TOI ETimes,165,Child Lunch Story,https://timesofindia.indiatimes.com/articleshow/130110517.cms,2026-04-12T10:38:49+00:00
TOI ETimes,166,Dacoit Box Office Collection,https://timesofindia.indiatimes.com/articleshow/130201087.cms,2026-04-12T10:38:49+00:00
TOI ETimes,167,Ahmedabad Dosa Batter Tragedy,https://timesofindia.indiatimes.com/articleshow/130089214.cms,2026-04-12T10:38:49+00:00
TOI ETimes,168,Dacoit Twitter Reviews,https://timesofindia.indiatimes.com/articleshow/130157947.cms,2026-04-12T10:38:49+00:00
TOI ETimes,169,Sandeep Reddy Vanga,https://timesofindia.indiatimes.com/articleshow/130144470.cms,2026-04-12T10:38:49+00:00
TOI ETimes,170,Jack Ma Quote,https://timesofindia.indiatimes.com/articleshow/130131342.cms,2026-04-12T10:38:49+00:00
TOI ETimes,171,Love Insurance Kompany Reviews,https://timesofindia.indiatimes.com/articleshow/130162738.cms,2026-04-12T10:38:49+00:00
TOI ETimes,172,Lionel Messi Parenting,https://timesofindia.indiatimes.com/articleshow/130133957.cms,2026-04-12T10:38:49+00:00
TOI ETimes,173,Lord Ganesha Drawing,https://timesofindia.indiatimes.com/articleshow/130110992.cms,2026-04-12T10:38:49+00:00
TOI ETimes,174,Baba Ka Dhaba,https://timesofindia.indiatimes.com/articleshow/130158160.cms,2026-04-12T10:38:49+00:00
TOI ETimes,175,Fungus That Eats Gold,https://timesofindia.indiatimes.com/articleshow/130110618.cms,2026-04-12T10:38:49+00:00
TOI ETimes,176,Quote Of The Day By Aristotle,https://timesofindia.indiatimes.com/articleshow/130179215.cms,2026-04-12T10:38:49+00:00
TOI ETimes,177,CSK Vs DC Live Streaming,https://timesofindia.indiatimes.com/articleshow/130190747.cms,2026-04-12T10:38:49+00:00
TOI ETimes,178,Basketball Zero Codes,https://timesofindia.indiatimes.com/articleshow/129802738.cms,2026-04-12T10:38:49+00:00
TOI ETimes,179,Hazaribag man drowns while fishing in lake,https://timesofindia.indiatimes.com/articleshow/130060093.cms,2026-04-12T10:38:49+00:00
TOI ETimes,180,"""Behen Darr Gayi!"": Fans relive ‘Bhagam Bhag’ era after watching Akshay Kumar's 'Bhooth Bangla' trailer",https://timesofindia.indiatimes.com/articleshow/130060027.cms,2026-04-12T10:38:49+00:00
TOI ETimes,181,MBOSE HSLC result 2026 to release tomorrow: Check details here,https://timesofindia.indiatimes.com/articleshow/130059814.cms,2026-04-12T10:38:49+00:00
TOI ETimes,182,"Iran war risk: JPMorgan CEO Jamie Dimon warns of oil shocks, sticky inflation and higher interest rates",https://timesofindia.indiatimes.com/articleshow/130059993.cms,2026-04-12T10:38:49+00:00
TOI ETimes,183,Make your clutch last longer with these easy driving tips,https://timesofindia.indiatimes.com/articleshow/130052232.cms,2026-04-12T10:38:49+00:00
TOI ETimes,184,“Three-against-one situation”: El Rubius opens up on being “targeted” in MrBeast’s viral $1M challenge,https://timesofindia.indiatimes.com/articleshow/130054402.cms,2026-04-12T10:38:49+00:00
TOI ETimes,185,Bihar BTSC lab assistant notification released for 1091 posts at btsc.bihar.gov.in; apply here,https://timesofindia.indiatimes.com/articleshow/130059322.cms,2026-04-12T10:38:49+00:00
TOI ETimes,186,IPL craze costs techie Rs 1.46 lakh in fake RCB vs CSK ticket scam,https://timesofindia.indiatimes.com/articleshow/130059549.cms,2026-04-12T10:38:49+00:00
TOI ETimes,187,Raising “robot-proof” kids: Why creativity and curiosity matter more than ever,https://timesofindia.indiatimes.com/articleshow/130057342.cms,2026-04-12T10:38:49+00:00
TOI ETimes,188,Inside ‘Satguru Sharan’: Exploring Saif Ali Khan and Kareena Kapoor Khan’s Rs 100 crore Bandra home,https://timesofindia.indiatimes.com/articleshow/130059584.cms,2026-04-12T10:38:49+00:00
TOI ETimes,189,How selling Alaska in 1867 was a costly mistake for Russia,https://timesofindia.indiatimes.com/articleshow/130057081.cms,2026-04-12T10:38:49+00:00
TOI ETimes,190,'Hera Pheri 3 is coming': Paresh Rawal dismisses delay reports and reveals he will 'start shooting soon',https://timesofindia.indiatimes.com/articleshow/130059421.cms,2026-04-12T10:38:49+00:00
TOI ETimes,191,"US-Iran War: A daring rescue Hollywood blockbuster is on its way. Till then, pick your favourite from these 10 films on bringing someone home against all odds",https://timesofindia.indiatimes.com/articleshow/130059208.cms,2026-04-12T10:38:49+00:00
TOI ETimes,192,"Kolkata team unveils fan mural at Rash Behari Avenue, celebrating city’s first love",https://timesofindia.indiatimes.com/articleshow/130059554.cms,2026-04-12T10:38:49+00:00
TOI ETimes,193,How US spread a lie to rescue a pilot of a jet shot down in Iran,https://timesofindia.indiatimes.com/articleshow/130058641.cms,2026-04-12T10:38:49+00:00
TOI ETimes,194,"Netflix unveils ‘VOID’, an AI model that can change a movie plot",https://timesofindia.indiatimes.com/articleshow/130058880.cms,2026-04-12T10:38:49+00:00
TOI ETimes,195,"AI data centers are causing 'stress' not just to tech companies, but also private insurers",https://timesofindia.indiatimes.com/articleshow/130058967.cms,2026-04-12T10:38:49+00:00
TOI ETimes,196,"""Trans women are....."": Clavicular’s viral moment with trans women sparks fresh conversation on internet culture",https://timesofindia.indiatimes.com/articleshow/130053479.cms,2026-04-12T10:38:49+00:00
TOI Viral News,1,"Watch: Hardeep Singh Puri reunites with old friend from Delhi University, video melts hearts",https://timesofindia.indiatimes.com/articleshow/108418522.cms,2026-04-12T10:38:49+00:00
TOI Viral News,2,Narayana Murthy and daughter Akshata enjoy 'Corner House' ice cream in Bengaluru,https://timesofindia.indiatimes.com/articleshow/107659138.cms,2026-04-12T10:38:49+00:00
TOI Viral News,3,Taylor Swift cheers boyfriend Travis Kelce at the Super Bowl,https://timesofindia.indiatimes.com/articleshow/107613344.cms,2026-04-12T10:38:49+00:00
TOI Viral News,4,'He Nitished me' to 'Paltu Chacha': Nitish Kumar's 'swing politics' sparks humour fest,https://timesofindia.indiatimes.com/articleshow/107236114.cms,2026-04-12T10:38:49+00:00
TOI Viral News,5,"Flyer hits IndiGo Pilot announcing flight delay due to dense fog conditions, video goes viral",https://timesofindia.indiatimes.com/articleshow/106851189.cms,2026-04-12T10:38:49+00:00
TOI Viral News,6,"New Zealand's youngest MP performs native 'war cry' in Parliament, video goes viral",https://timesofindia.indiatimes.com/articleshow/106572179.cms,2026-04-12T10:38:49+00:00
TOI Viral News,7,"NASA unveils stunning image of 'evil eye' galaxy, sparking internet awe",https://timesofindia.indiatimes.com/articleshow/105570940.cms,2026-04-12T10:38:49+00:00
TOI Viral News,8,Millennials bemoan lackluster Black Friday deals in social media uproar,https://timesofindia.indiatimes.com/articleshow/105475777.cms,2026-04-12T10:38:49+00:00
TOI Viral News,9,'At least they'll not lose to India in semis': Memes erupt with Pakistan all but out of World Cup,https://timesofindia.indiatimes.com/articleshow/105122539.cms,2026-04-12T10:38:49+00:00
TOI Viral News,10,Brazilian influencer Vanessa Mancini dies at 41 from massive heart attack,https://timesofindia.indiatimes.com/articleshow/105110853.cms,2026-04-12T10:38:49+00:00
TOI Viral News,11,Memes erupt as Angelo Mathews becomes first international cricketer to be timed out,https://timesofindia.indiatimes.com/articleshow/105016656.cms,2026-04-12T10:38:49+00:00
TOI Viral News,12,Mia Khalifa posts Amy Schumer's heated exchange with Asia Jackson over Israel-Palestine conflict,https://timesofindia.indiatimes.com/articleshow/104947696.cms,2026-04-12T10:38:49+00:00
TOI Viral News,13,Fans troll Pakistan as Proteas beat Kiwis to keep Pak's semi-final hopes alive,https://timesofindia.indiatimes.com/articleshow/104912338.cms,2026-04-12T10:38:49+00:00
TOI Viral News,14,Mark Zuckerberg and family's Halloween transformation into Hogwarts icons warms hearts,https://timesofindia.indiatimes.com/articleshow/104888586.cms,2026-04-12T10:38:49+00:00
TOI Viral News,15,'Bore hone ka chance-ich nahi' as auto driver sings & entertains people stuck in Andheri traffic,https://timesofindia.indiatimes.com/articleshow/104886091.cms,2026-04-12T10:38:49+00:00
TOI Viral News,16,Escaped monkey 'Momo' captured after it drinks beer and runs riot in Indianapolis,https://timesofindia.indiatimes.com/articleshow/104208644.cms,2026-04-12T10:38:49+00:00
TOI Viral News,17,"Animal smuggling: Otter, rat and 28 turtles cause chaos on Bangkok to Taipei flight",https://timesofindia.indiatimes.com/articleshow/104208771.cms,2026-04-12T10:38:49+00:00
TOI Viral News,18,Alligator ally oops! Phillies fan denied entry with emotional support gator,https://timesofindia.indiatimes.com/articleshow/104043227.cms,2026-04-12T10:38:49+00:00
TOI Viral News,19,'Qualified for Karachi station': Pakistan's exit from Asia Cup sparks memefest,https://timesofindia.indiatimes.com/articleshow/103687163.cms,2026-04-12T10:38:49+00:00
TOI Viral News,20,"'Racist bigots': Arabic restaurant in US refuses to serve cops in uniform, faces fury",https://timesofindia.indiatimes.com/articleshow/103285144.cms,2026-04-12T10:38:49+00:00
TOI Viral News,21,Watch: Pakistani wedding in UK descends into mass brawl as guests hurl chairs at each other,https://timesofindia.indiatimes.com/articleshow/103245258.cms,2026-04-12T10:38:49+00:00
TOI Viral News,22,Memes abuzz as Neeraj Chopra makes history with first gold for India in World Championship,https://timesofindia.indiatimes.com/articleshow/103138499.cms,2026-04-12T10:38:49+00:00
TOI Viral News,23,Boyfriend held in murder of Instagram influencer Beauty Couch in Georgia,https://timesofindia.indiatimes.com/articleshow/103125550.cms,2026-04-12T10:38:49+00:00
TOI Viral News,24,Why internet is suddenly talking about Donald Trump’s weight,https://timesofindia.indiatimes.com/articleshow/103058329.cms,2026-04-12T10:38:49+00:00
TOI Viral News,25,'Don is back': Trump's mug shot triggers memefest,https://timesofindia.indiatimes.com/articleshow/103047943.cms,2026-04-12T10:38:49+00:00
TOI Viral News,26,"Hurricane Hilary unleashes fury on Southern California, visuals viral",https://timesofindia.indiatimes.com/articleshow/102906246.cms,2026-04-12T10:38:49+00:00
TOI Viral News,27,'Shameless': Prakash Raj blasted by netizens for mocking India's moon mission,https://timesofindia.indiatimes.com/articleshow/102902284.cms,2026-04-12T10:38:49+00:00
TOI Viral News,28,'Me during WFH': Photo of Selena Gomez wrapped in 'shawl' stirs memefest,https://timesofindia.indiatimes.com/articleshow/102799584.cms,2026-04-12T10:38:49+00:00
TOI Viral News,29,'Mission impossible': Memes erupt as people find it hard to return to office after long weekend,https://timesofindia.indiatimes.com/articleshow/102768800.cms,2026-04-12T10:38:49+00:00
