source,rank,headline,link,collected_at_iso
NDTV,11,JEE Main Result 2026: Check JEE Advanced Eligibility,https://www.ndtv.com/education/jee-main-result-2026-check-category-wise-eligible-candidates-for-jee-advanced-11386592,2026-04-21T09:26:46+00:00
NDTV,12,Assembly Elections 2026,https://www.ndtv.com/elections,2026-04-21T09:26:46+00:00
NDTV,13,"Vance Heads For A Deal Do-Over, This Time With No One Across The Table",https://www.ndtv.com/world-news/iran-war-exams-vances-peacemaker-president-bid-faces-crunch-test-11386821,2026-04-21T09:26:46+00:00
NDTV,14,Trump Has Found His Iran 'Scapegoat'. The Scapegoat Doesn't Know It Yet,https://www.ndtv.com/opinion/us-israel-iran-war-can-jd-vance-survive-being-trumps-most-useful-punching-bag-11386596,2026-04-21T09:26:46+00:00
NDTV,15,"Trump Warns 'Bombs Will Go Off' If No Deal, Iran Says Ready With 'New Cards'",https://www.ndtv.com/world-news/us-iran-war-news-hormuz-blockade-donald-trumps-bomb-vs-tehrans-cards-us-iran-trade-threats-as-truce-nears-end-11385951,2026-04-21T09:26:46+00:00
NDTV,16,From 'Borewell Boy' To Resilient Man: Prince's Journey 20 Years After Rescue,https://www.ndtv.com/india-news/from-borewell-boy-to-resilient-man-princes-journey-20-years-after-rescue-11383044,2026-04-21T09:26:46+00:00
NDTV,17,Chemicals For Missiles From China On Seized Iran Ship? Nikki Haley's Claim,https://www.ndtv.com/world-news/iran-us-war-touska-hormuz-seizure-missile-chemicals-from-china-on-seized-iran-ship-nikki-haleys-big-claim-11386171,2026-04-21T09:26:46+00:00
NDTV,18,The Image That Shook India: One Year Since The Pahalgam Terror Attack,https://www.ndtv.com/india-news/pahalgam-terror-attack-baisaran-jammu-and-kashmir-himanshi-narwal-the-image-that-shook-india-11387159,2026-04-21T09:26:46+00:00
NDTV,19,Iran's 'Pride And Prejudice'-Coded Message To Trump On Peace Talks,https://www.ndtv.com/world-news/irans-pride-and-prejudice-coded-message-to-trump-on-peace-talks-11386392,2026-04-21T09:26:46+00:00
NDTV,20,"Techie Spends 27 Lakhs On Office Credit Card, Sends Obscene Pics To Boss",https://www.ndtv.com/bangalore-news/bengaluru-techie-spends-rs-27-lakh-on-office-credit-card-sends-obscene-pics-to-boss-11386866,2026-04-21T09:26:46+00:00
NDTV,21,"Alia Bhatt's Hosting Gig Falls Flat, Mini Mathur Agrees With Viral Critique",https://www.ndtv.com/entertainment/alia-bhatts-hosting-gig-falls-flat-mini-mathur-agrees-with-viral-critique-11384732,2026-04-21T09:26:46+00:00
NDTV,22,"Bengaluru Woman Books AC Room In Nearby Hotel To Escape Heat, Sparks Debate",https://www.ndtv.com/offbeat/bengaluru-woman-books-ac-room-in-nearby-hotel-to-beat-heat-sparks-debate-11385789,2026-04-21T09:26:46+00:00
NDTV,23,Trump May Travel To Pakistan For Deal With Iran: Report,https://www.ndtv.com/world-news/iran-us-peace-talks-pakistan-trump-may-attend-iran-us-talks-either-in-person-or-virtually-11386478,2026-04-21T09:26:46+00:00
NDTV,24,"""You Are Entering Military Blockade"": US' Hormuz Action With Machinegun",https://www.ndtv.com/world-news/video-us-chopper-points-machinegun-at-ship-near-iran-sends-warning-on-radio-11385197,2026-04-21T09:26:46+00:00
NDTV,25,Live: Iran Slams US Over 'Illegal' Attack on Iranian Commercial Vessel,https://www.ndtv.com/world-news/donald-trump-us-iran-war-live-updates-strait-of-hormuz-chaos-peace-deal-israel-lebanon-hezbollah-ceasefire-11378272,2026-04-21T09:26:46+00:00
NDTV,26,Video: UP Thar Driver's Drifting Stunt Near Police Post Gets SUV Seized,https://www.ndtv.com/india-news/prayagraj-thar-stunt-video-uttar-pradesh-thar-drivers-drifting-stunt-near-police-post-gets-suv-seized-11387161,2026-04-21T09:26:46+00:00
NDTV,27,"Ex-Bar Dancer Arrested In Rs 6-Crore Mumbai Drug Bust, 5,000 Pills Seized",https://www.ndtv.com/india-news/ex-bar-dancer-ashwini-paul-arrested-in-rs-6-crore-mumbai-drug-bust-5-000-mdma-ecstasy-pills-seized-11386344,2026-04-21T09:26:46+00:00
NDTV,28,33-Year-Old Man Dies By Suicide After Killing His Wife In Gurugram: Cops,https://www.ndtv.com/gurgaon-news/33-year-old-man-dies-by-suicide-after-killing-his-wife-in-gurugram-cops-11385351,2026-04-21T09:26:46+00:00
NDTV,29,"Why Akshay Kumar's Son Aarav ""Refused"" To Meet Vidya Balan For 6 Years",https://www.ndtv.com/entertainment/why-akshay-kumars-son-aarav-refused-to-meet-vidya-balan-for-6-years-11355694,2026-04-21T09:26:46+00:00
NDTV,30,"Chahatt Khanna Opens Up On Her Two Divorces: ""I Converted To Islam, Then Returned To Sanatan Dharma""",https://www.ndtv.com/entertainment/chahatt-khanna-opens-up-on-her-two-divorces-i-converted-to-islam-then-returned-to-sanatan-dharma-11370005,2026-04-21T09:26:46+00:00
NDTV,31,"Canadian Tourist Killed, 13 Injured In Mexico Pyramid Shooting",https://www.ndtv.com/world-news/canadian-tourist-killed-13-injured-in-mexico-pyramid-shooting-11386461,2026-04-21T09:26:46+00:00
NDTV,32,Latest News Today,https://www.ndtv.com/latest,2026-04-21T09:26:46+00:00
NDTV,33,Education News India,https://www.ndtv.com/education,2026-04-21T09:26:46+00:00
NDTV,34,Latest Business News,https://www.ndtv.com/business-news,2026-04-21T09:26:46+00:00
NDTV,35,Apple's Tim Cook To Step Down As CEO,https://www.ndtv.com/world-news/apple-ceo-tim-cook-to-step-down-in-september-11385509,2026-04-21T09:26:46+00:00
