source,rank,headline,link,collected_at_iso
Indian Express,1,Trending in India,https://indianexpress.com/section/trending/trending-in-india/,2026-04-01T07:21:27+00:00
Indian Express,2,This is Serious,https://indianexpress.com/section/trending/this-is-serious/,2026-04-01T07:21:27+00:00
Indian Express,3,Kerala Tourism and brands react humorously to the missing 4 lakh KitKat bars,https://indianexpress.com/article/trending/trending-in-india/kitkat-truck-theft-europe-kerala-tourism-viral-trend-10612931/,2026-04-01T07:21:27+00:00
Indian Express,4,Kevin Pietersen Mumbai air quality,https://indianexpress.com/article/trending/trending-globally/kevin-pietersen-mumbai-air-quality-aqi-tweet-controversy-ipl-2026-10611887/,2026-04-01T07:21:27+00:00
Indian Express,5,amy arora bengaluru budget,https://indianexpress.com/article/trending/trending-in-india/bengaluru-intern-amy-arora-viral-18000-monthly-budget-breakdown-sde-pg-life-10611810/,2026-04-01T07:21:27+00:00
Indian Express,6,Pune professor Mehbooba Mehbooba viral video,https://indianexpress.com/article/trending/trending-in-india/pune-professor-viral-video-singing-mehbooba-mehbooba-sri-balaji-university-10611549/,2026-04-01T07:21:27+00:00
Indian Express,7,Bihar engineer viral post,https://indianexpress.com/article/trending/trending-in-india/bihar-software-engineer-ananya-shaswat-intel-job-28-lpa-mother-viral-post-10611258/,2026-04-01T07:21:27+00:00
Indian Express,8,Bengaluru vs Delhi Metro,https://indianexpress.com/article/trending/trending-in-india/delhi-metro-vs-bengaluru-namma-metro-viral-x-post-civic-sense-connectivity-debate-10610961/,2026-04-01T07:21:27+00:00
Indian Express,9,"For a few seconds, the couple and those around them scrambled to find the missing ring",https://indianexpress.com/article/trending/trending-in-india/mumbai-indians-fan-heartfelt-proposal-nearly-ends-in-disaster-as-ring-disappears-in-stand-10610869/,2026-04-01T07:21:27+00:00
Indian Express,10,Brand Finance Top 10 Most Valuable Telecom Brands In The World 2026,https://indianexpress.com/article/trending/top-10-listing/brand-finance-most-valuable-telecom-brands-globally-2026-10610717/,2026-04-01T07:21:27+00:00
Indian Express,11,KitKat bars stolen in Europe have triggered widespread attention after Domino’s UK posted a viral response announcing a KitKat pizza,https://indianexpress.com/article/trending/trending-globally/kitkat-bars-stolen-europe-dominos-uk-viral-post-10610775/,2026-04-01T07:21:27+00:00
Indian Express,12,"In the viral photos, the model can be seen painted pink and posing on the elephant, which had been coloured the same hue",https://indianexpress.com/article/trending/trending-in-india/russian-artist-paints-elephant-pink-for-photoshoot-in-jaipur-sparks-outrage-10609761/,2026-04-01T07:21:27+00:00
Indian Express,13,"Sweeney's apology prompted a wave of reactions, with several users slamming him for his decision",https://indianexpress.com/article/trending/trending-globally/epic-games-layoffs-tim-sweeney-apology-cancer-employee-insurance-10609724/,2026-04-01T07:21:27+00:00
Indian Express,14,"Sharing the details of the incident, the CEO said he decided to get a rabies shot, despite the pet dog being vaccinated for the virus",https://indianexpress.com/article/trending/trending-in-india/india-vs-us-healthcare-ceo-gets-rabies-shot-in-10-minutes-post-goes-viral-10609617/,2026-04-01T07:21:27+00:00
Indian Express,15,Anand Mahindra shared a video of Bittu cleaning the polluted river,https://indianexpress.com/article/trending/trending-in-india/bittu-tabahi-river-cleaning-anand-mahindra-viral-video-10609189/,2026-04-01T07:21:27+00:00
Indian Express,16,Arpit Bala controversy erupted after a viral video showed the rapper allegedly spitting at a fan during a Hyderabad concert,https://indianexpress.com/article/trending/trending-in-india/who-is-arpit-bala-controversy-hyderabad-concert-spitting-fan-10609122/,2026-04-01T07:21:27+00:00
Indian Express,17,Top 10 Highest Grossing Movies Of All Time 2026 Edition,https://indianexpress.com/article/trending/top-10-listing/top-10-highest-grossing-movies-of-all-time-2026-globally-10609025/,2026-04-01T07:21:27+00:00
Indian Express,18,"By using its image recognition and translation features, he scanned the remote and received clear explanations for each button",https://indianexpress.com/article/trending/trending-globally/american-tourist-google-nano-banana-ai-translate-japanese-remote-10608979/,2026-04-01T07:21:27+00:00
Indian Express,19,He shared a screenshot on X showing an email sent by an AI assistant,https://indianexpress.com/article/trending/trending-in-india/engineer-rejects-ai-written-email-sparks-debate-on-professional-use-of-technology-10608375/,2026-04-01T07:21:27+00:00
Indian Express,20,"According to reports, the daylight vanished within minutes, with visibility plunging to near zero as thick dust engulfed the areas",https://indianexpress.com/article/trending/trending-globally/red-skies-australia-cyclone-narelle-video-10608098/,2026-04-01T07:21:27+00:00
Indian Express,21,Julia Chaigneau took to X to share her surprise at finding a movie screening at 6.50 am,https://indianexpress.com/article/trending/trending-in-india/early-movie-show-india-french-tourist-viral-post-10607491/,2026-04-01T07:21:27+00:00
Indian Express,22,"At one point, IShowSpeed almost kicks Jamal during a dance step",https://indianexpress.com/article/trending/trending-globally/ishowspeed-dances-to-punjabi-song-tunak-tunak-tun-kicks-his-brother-jamal-during-live-stream-10607358/,2026-04-01T07:21:27+00:00
Indian Express,23,"12 tons—about 413,793 bars—of its KitKat chocolate got stolen",https://indianexpress.com/article/trending/trending-globally/kitkat-heist-12-tonnes-of-nestle-chocolate-missing-in-europe-transit-10607320/,2026-04-01T07:21:27+00:00
Indian Express,24,sperm whale birth footage,https://indianexpress.com/article/trending/trending-globally/rare-video-sperm-whale-birth-wild-assistance-dominica-project-ceti-10606464/,2026-04-01T07:21:27+00:00
Indian Express,25,MacBook Neo box Indian parents,https://indianexpress.com/article/trending/trending-in-india/ex-google-md-dad-macbook-box-viral-reaction-10606438/,2026-04-01T07:21:27+00:00
Indian Express,26,pani puri vendor earnings,https://indianexpress.com/article/trending/trending-in-india/bengaluru-content-creator-pani-puri-stall-10-lakh-earnings-viral-video-10606220/,2026-04-01T07:21:27+00:00
Indian Express,27,Nita Ambani Rohit Sharma viral video IPL 2026,https://indianexpress.com/article/trending/trending-in-india/nita-ambani-rohit-sharma-mumbai-indians-training-viral-video-ipl-2026-10605974/,2026-04-01T07:21:27+00:00
LiveMint,1,Warren Buffett teams up with NBA star Stephen Curry for charity lunch auction,https://www.livemint.com/us/trending/warren-buffett-teams-up-with-nba-star-stephen-curry-for-charity-lunch-auction-berkshire-event-returns-in-2026-11774962320767.html,2026-04-01T07:21:27+00:00
LiveMint,2,Tiger Woods’ ex Kristin Smith breaks silence after ‘triggering’ DUI arrest,https://www.livemint.com/us/trending/tiger-woods-ex-kristin-smith-breaks-silence-after-triggering-dui-arrest-seeks-privacy-11774949316320.html,2026-04-01T07:21:27+00:00
LiveMint,3,"Sophie Turner injured, Tomb Raider series halts production temporarily",https://www.livemint.com/us/trending/sophie-turner-injured-tomb-raider-series-halts-production-temporarily-11774878671976.html,2026-04-01T07:21:27+00:00
LiveMint,4,Viral video of Kash Patel dancing? Here’s the truth behind the clip,https://www.livemint.com/us/trending/viral-video-of-kash-patel-dancing-here-s-the-truth-behind-the-clip-11774814955782.html,2026-04-01T07:21:27+00:00
LiveMint,5,"Arnold Schwarzenegger returns to gym—But this time, he’s coaching his son |Watch",https://www.livemint.com/us/trending/arnold-schwarzenegger-returns-to-gym-but-this-time-he-s-coaching-his-son-to-bodybuilding-glory-watch-11774816425352.html,2026-04-01T07:21:27+00:00
LiveMint,6,"Bachelorette star James McCoy Taylor arrested again, months after guilty plea",https://www.livemint.com/us/trending/bachelorette-star-james-mccoy-taylor-arrested-again-months-after-guilty-plea-11774189913536.html,2026-04-01T07:21:27+00:00
LiveMint,7,Comedian jokes about Jews’ expulsion: Social media reacts to viral video,https://www.livemint.com/us/trending/comedian-jokes-about-jews-expulsion-social-media-reacts-to-viral-video-using-antisemitic-talking-points-as-humor-11773998180773.html,2026-04-01T07:21:27+00:00
LiveMint,8,Who is Joseph Duggar? All about reality TV star arrested on abuse charges,https://www.livemint.com/us/trending/who-is-joseph-duggar-all-about-the-19-kids-and-counting-star-arrested-on-abuse-charges-11773894381944.html,2026-04-01T07:21:27+00:00
LiveMint,9,"St Patrick’s Day 2026: Date, history, meaning and traditions worldwide",https://www.livemint.com/us/trending/st-patrick-s-day-2026-date-history-meaning-and-traditions-worldwide-11773760629096.html,2026-04-01T07:21:27+00:00
LiveMint,10,Oscars 2026: What’s on the menu at official after-party for Hollywood A-listers?,https://www.livemint.com/us/trending/oscars-2026-what-s-on-the-menu-at-the-official-after-party-luxurious-food-desserts-and-drinks-for-hollywood-alisters-11773548247036.html,2026-04-01T07:21:27+00:00
LiveMint,11,"Meghan Markle: Harry’s wife faces backlash over $2,235 ticket for group photo",https://www.livemint.com/us/trending/meghan-markle-harry-s-wife-faces-backlash-over-2-235-vip-ticket-for-group-photo-she-s-a-nobody-who-tricked-a-prince-11773538916724.html,2026-04-01T07:21:27+00:00
LiveMint,12,Apple kicks off 50th anniversary with surprise performance by Alicia Keys in NY,https://www.livemint.com/us/trending/alicia-keys-turns-apples-grand-central-in-new-york-into-a-concert-venue-at-tech-giant-s-50th-anniversary-kickoff-11773508129097.html,2026-04-01T07:21:27+00:00
LiveMint,13,"Marco Rubio large shoe size stuns Internet, social media points to ‘sycophancy'",https://www.livemint.com/us/trending/marco-rubio-large-shoe-size-stuns-internet-social-media-points-to-sycophancy-idol-worship-among-trump-officials-11773470692943.html,2026-04-01T07:21:27+00:00
LiveMint,14,Was Bill Clinton about to push Hillary into running traffic? Watch viral video,https://www.livemint.com/us/trending/did-bill-clinton-almost-push-hillary-into-running-traffic-social-media-reacts-to-viral-video-hes-was-so-close-11773280988605.html,2026-04-01T07:21:27+00:00
LiveMint,15,"Dr Dre net worth: Inside his earnings, brands, cars and real estate",https://www.livemint.com/us/trending/dr-dre-net-worth-how-did-the-new-billionaire-make-his-fortune-inside-his-earnings-cars-mansions-and-brands-11773167989493.html,2026-04-01T07:21:27+00:00
LiveMint,16,Nike launches Air Jordan 4 Retro ‘Imperial Purple’ sneakers: Details,https://www.livemint.com/us/trending/nike-launches-air-jordan-4-retro-imperial-purple-sneakers-how-much-do-they-cost-where-to-buy-online-11772907741201.html,2026-04-01T07:21:27+00:00
LiveMint,17,Quote of the day by Robert T Kiyosaki on success: ‘Winners are not afraid of….',https://www.livemint.com/us/trending/quote-of-the-day-by-robert-t-kiyosaki-on-success-winners-are-not-afraid-of-losing-but-11772854894148.html,2026-04-01T07:21:27+00:00
LiveMint,18,Bodybuilder Jeff Nippard’s fiancé Stephanie Buttermore dies at 36,https://www.livemint.com/us/trending/bodybuilder-jeff-nippard-s-fianc-stephanie-buttermore-dies-at-36-a-look-at-the-late-fitness-stars-net-worth-11772860396173.html,2026-04-01T07:21:27+00:00
LiveMint,19,Toddler triggers airport alarms chasing a toy; what happened next surprised all,https://www.livemint.com/us/trending/toddler-triggers-airport-alarms-chasing-a-toy-what-happened-next-surprised-everyone-11772786934708.html,2026-04-01T07:21:27+00:00
LiveMint,20,Quote of the day by Abraham Lincoln: ‘We the people are rightful masters of…’,https://www.livemint.com/us/trending/quote-of-the-day-by-abraham-lincoln-we-the-people-are-rightful-masters-of-11772622098976.html,2026-04-01T07:21:27+00:00
LiveMint,21,Can AI really do your taxes? Elon Musk sparks massive online debate,https://www.livemint.com/us/trending/can-grok-help-you-cut-your-taxes-elon-musk-says-11772572363426.html,2026-04-01T07:21:27+00:00
LiveMint,22,Instagram to notify parents if teens repeatedly search for suicide or self-harm,https://www.livemint.com/us/trending/instagram-will-alert-parents-over-repeated-suicide-related-searches-by-teen-users-amid-global-push-for-sm-regulations-11772110629794.html,2026-04-01T07:21:27+00:00
LiveMint,23,‘Done with New Jersey’: US-based engineer’s rant goes viral,https://www.livemint.com/us/trending/done-with-new-jersey-us-based-engineer-gets-frustrated-over-property-tax-heavy-snow-ice-rant-goes-viral-11771923467675.html,2026-04-01T07:21:27+00:00
LiveMint,24,Last Week Tonight: John Oliver uses Nikhil Kamath podcast to mock Elon Musk,https://www.livemint.com/us/trending/watch-john-oliver-uses-nikhil-kamaths-podcast-to-mock-elon-musk-on-last-week-tonight-buffering-like-aol-in-1999-11771911124869.html,2026-04-01T07:21:27+00:00
LiveMint,25,"Trump's latest tariffs: Netizens rake up Epstein, jobs, and Iran",https://www.livemint.com/us/trending/trumps-latest-tariffs-netizens-rake-up-epstein-jobs-and-iran-as-white-house-says-keep-calm-and-tariff-on-11771643415503.html,2026-04-01T07:21:27+00:00
LiveMint,26,NRI influencer’s post on returning to India ignites family responsibility debate,https://www.livemint.com/us/trending/moving-back-to-india-from-the-us-to-raise-kids-or-care-for-parents-influencer-sparks-debate-11771617446170.html,2026-04-01T07:21:27+00:00
LiveMint,27,"Netizens in meme frenzy as Trump announces release of files on aliens, UFOs",https://www.livemint.com/us/trending/netizens-in-meme-frenzy-as-trump-announces-release-of-files-on-aliens-ufos-epstein-files-11771556439611.html,2026-04-01T07:21:27+00:00
LiveMint,28,"‘Satanic ritual’? Viral video shows blindfolded, shirtless men",https://www.livemint.com/us/trending/viral-video-iowa-university-blindfolded-shirtless-young-men-social-media-hazing-ritual-11771502449739.html,2026-04-01T07:21:27+00:00
LiveMint,29,When is Mardi Gras 2026? Why is it celebrated? What is Fat Tuesday?,https://www.livemint.com/us/trending/when-is-mardi-gras-2026-why-is-it-celebrated-what-is-fat-tuesday-also-the-rare-overlap-of-len-and-ramadan-this-year-11771340190144.html,2026-04-01T07:21:27+00:00
LiveMint,30,Stephen Colbert to release James Talarico’s interview after CBS’ refusal,https://www.livemint.com/us/trending/stephen-colbert-to-release-james-talarico-s-interview-on-youtube-as-cbs-refuses-to-air-it-for-financial-reasons-11771322377565.html,2026-04-01T07:21:27+00:00
LiveMint,31,Manchester Orchestra drummer Tim Very dies at 42: Rock band mourns loss,https://www.livemint.com/us/trending/manchester-orchestra-drummer-dies-at-42-rock-band-mourns-loss-tim-very-held-together-the-entire-mo-universe-11771126673065.html,2026-04-01T07:21:27+00:00
LiveMint,32,Quote of the Day | Valentine’s Day: Taylor Swift on love and perfection,https://www.livemint.com/us/trending/quote-of-the-day-valentine-s-day-special-taylor-swift-on-why-love-isn-t-meant-to-be-perfect-11770975532058.html,2026-04-01T07:21:27+00:00
LiveMint,33,Cardi B slams DHS over ‘drugs’ remark after criticizing ICE,https://www.livemint.com/us/trending/lets-talk-about-epstein-cardi-b-slams-dhs-over-drugs-remark-after-criticizing-ice-during-little-miss-drama-tour-11770943241509.html,2026-04-01T07:21:27+00:00
LiveMint,34,Quote of the day from Abraham Lincoln: ‘The ballot is stronger than the bullet’,https://www.livemint.com/us/trending/quote-of-the-day-from-abraham-lincoln-the-ballot-is-stronger-than-the-bullet-bangladesh-elections-polls-result-11770894713401.html,2026-04-01T07:21:27+00:00
LiveMint,35,Quote of the day from Paul Graham: ‘Do you want to become like these people?’,https://www.livemint.com/us/trending/quote-of-the-day-from-paul-graham-youll-become-like-whoever-you-work-with-do-you-want-to-become-like-these-people-11770887177070.html,2026-04-01T07:21:27+00:00
LiveMint,36,Bad Bunny's Super Bowl show sparks row: Did FCC impose $10 million fine?,https://www.livemint.com/us/trending/bad-bunnys-super-bowl-show-sparks-row-did-fcc-impose-10-million-fine-on-latin-artist-heres-the-truth-11770873313564.html,2026-04-01T07:21:27+00:00
LiveMint,37,James Van Der Beek's wife Kimberly expresses gratitude as fundraiser hits $800K,https://www.livemint.com/us/trending/james-van-der-beeks-wife-kimberly-expresses-gratitude-as-gofundme-fundraiser-hits-700k-mark-following-actors-death-11770859082865.html,2026-04-01T07:21:27+00:00
LiveMint,38,"Ja Rule, Tony Yayo clash on San Francisco–New York flight; video goes viral",https://www.livemint.com/us/trending/ja-rule-tony-yayo-clash-on-san-francisco-new-york-flight-video-goes-viral-11770740625215.html,2026-04-01T07:21:27+00:00
LiveMint,39,Influencer’s Bad Bunny boycott at Super Bowl sparks social media backlash,https://www.livemint.com/us/trending/influencers-bad-bunny-boycott-at-super-bowl-sparks-instant-social-media-backlash-claims-to-lose-1k-followers-in-mins-11770667177787.html,2026-04-01T07:21:27+00:00
LiveMint,40,Mark to Market,https://www.livemint.com/market/mark-to-market,2026-04-01T07:21:27+00:00
LiveMint,41,How long can the Nifty 50 stay in the bull trend after the US-Iran war de-escalation?,https://www.livemint.com/market/stock-market-news/how-long-can-the-nifty-50-stay-in-the-bull-trend-after-the-us-iran-war-deescalation-11775026415149.html,2026-04-01T07:21:27+00:00
LiveMint,42,"Vodafone Idea, Ola Electric, YES Bank, HDFC Bank— These are among the most traded stocks on NSE today",https://www.livemint.com/market/stock-market-news/vodafone-idea-ola-electric-yes-bank-hdfc-bank-these-are-among-the-most-traded-stocks-on-nse-today-11775025233848.html,2026-04-01T07:21:27+00:00
LiveMint,43,"PC Jeweller share price jumps 7% amid rising gold, silver rates today",https://www.livemint.com/market/stock-market-news/pc-jeweller-share-price-jumps-7-amid-rising-gold-silver-rates-today-11775023779061.html,2026-04-01T07:21:27+00:00
LiveMint,44,"Gold, silver rates today: Check 24K, 22K gold, 999 silver rates on 1 April in your city — Delhi, Mumbai, others",https://www.livemint.com/market/commodities/gold-silver-rates-today-check-24k-22k-gold-999-silver-rates-on-1-april-in-your-city-delhi-mumbai-others-11775024366150.html,2026-04-01T07:21:27+00:00
LiveMint,45,Small-cap stock under ₹50 jumps over 9% following Dalal Street rally,https://www.livemint.com/market/stock-market-news/smallcap-stock-under-rs-50-hazoor-multi-projects-share-price-jumps-9-following-dalal-street-rally-11775025022902.html,2026-04-01T07:21:27+00:00
LiveMint,46,IndiGo share price jumps nearly 8% after airline ropes in ex-IATA chief William Walsh as CEO,https://www.livemint.com/market/stock-market-news/indigo-share-price-jumps-nearly-8-after-airline-ropes-in-ex-iata-chief-william-walsh-as-ceo-11775023272039.html,2026-04-01T07:21:27+00:00
LiveMint,47,Quote of the day by Milton Friedman: ‘Underlying most arguments against the free market…’,https://www.livemint.com/news/us-news/quote-of-the-day-by-milton-friedman-underlying-most-arguments-against-the-free-market-11775026089758.html,2026-04-01T07:21:27+00:00
LiveMint,48,"Quote of the Day: French existentialist Simone de Beauvoir on gender - ‘One is not born, but rather becomes, a woman’",https://www.livemint.com/news/trends/quote-of-the-day-french-existentialist-simone-de-beauvoir-on-gender-one-is-not-born-but-rather-becomes-a-woman-11775022844836.html,2026-04-01T07:21:27+00:00
LiveMint,49,Alert! Gurugram sets up 24×7 control room to address LPG complaints. Check helpline number,https://www.livemint.com/news/india/alert-gurugram-sets-up-24-7-control-room-to-address-lpg-complaints-check-helpline-number-11775022534915.html,2026-04-01T07:21:27+00:00
LiveMint,50,Russia and Ukraine Set to Intensify War as World Focuses on Iran,https://www.livemint.com/news/world/russia-and-ukraine-set-to-intensify-war-as-world-focuses-on-iran-11775025368037.html,2026-04-01T07:21:27+00:00
LiveMint,51,Oracle employee for 20 years laid off via email; has cancer and no health insurance — ‘Companies are evil’,https://www.livemint.com/news/trends/oracle-employee-for-20-years-laid-off-via-email-has-cancer-and-no-health-insurance-companies-are-evil-11775020952578.html,2026-04-01T07:21:27+00:00
LiveMint,52,Breakthrough or escalation? Donald Trump to announce ‘important’ Iran War update tomorrow — what to expect,https://www.livemint.com/news/us-news/breakthrough-or-escalation-donald-trump-to-announce-important-iran-war-update-tomorrow-what-to-expect-israel-11775021190460.html,2026-04-01T07:21:27+00:00
LiveMint,53,iPhone production at risk? Report says India's smartphone export could go down by 25% amid Iran war,https://www.livemint.com/companies/news/iphone-production-at-risk-report-says-indias-smartphone-export-could-go-down-by-25-amid-iran-war-11775024152523.html,2026-04-01T07:21:27+00:00
LiveMint,54,"Jungle Ventures eyes 8-10 exits in 18 months, half from India",https://www.livemint.com/companies/news/jungle-ventures-exits-india-startups-ipo-pipeline-11775006991020.html,2026-04-01T07:21:27+00:00
LiveMint,55,"Oracle slashes 30,000 jobs: How much severance was offered? Which departments were affected? Key questions answered",https://www.livemint.com/companies/news/oracle-slashes-30-000-jobs-how-much-severance-pay-were-offered-which-dept-were-affected-key-question-answered-11775018754012.html,2026-04-01T07:21:27+00:00
LiveMint,56,AAI profit leans on privatized airports as core network bleeds,https://www.livemint.com/companies/news/aai-profit-driven-by-privatized-airports-ppp-adani-11775013672269.html,2026-04-01T07:21:27+00:00
LiveMint,57,"ChatGPT parent OpenAI raises $122 billion in record funding round, valuation hits $852 billion",https://www.livemint.com/companies/news/chatgpt-parent-openai-raises-122-billion-in-record-funding-round-valuation-hits-852-billion-11775014375379.html,2026-04-01T07:21:27+00:00
LiveMint,58,"Credit guarantee boost to help revive microfinance growth, says Muthoot Microfin CEO Sadaf Sayeed",https://www.livemint.com/companies/news/credit-guarantee-boost-microfinance-growth-muthoot-microfinance-ceo-sadaf-sayeed-lenders-financial-inclusion-nbfc-mfis-11775016730907.html,2026-04-01T07:21:27+00:00
LiveMint,59,Ask Mint Money,https://www.livemint.com/money/ask-mint-money,2026-04-01T07:21:27+00:00
LiveMint,60,From UAE to India: When a temporary return triggers lasting tax risks,https://www.livemint.com/money/personal-finance/indians-returning-from-uae-tax-rules-west-asia-war-11775021681139.html,2026-04-01T07:21:27+00:00
LiveMint,61,FY27 Begins: Post Office TD rates up to 7.5% outpace bank FDs in April–June quarter,https://www.livemint.com/money/personal-finance/fy27-begins-post-office-td-rates-up-to-7-5-outpace-bank-fds-in-april-june-quarter-11775020017470.html,2026-04-01T07:21:27+00:00
LiveMint,62,Expenses rise with summer heat: Weather-proof your budget,https://www.livemint.com/money/personal-finance/summer-expenses-budgeting-electricity-bills-11774965802404.html,2026-04-01T07:21:27+00:00
LiveMint,63,April 1 checklist: 10 money moves you must make today to start FY27 right,https://www.livemint.com/money/personal-finance/april-1-checklist-10-money-moves-you-must-make-today-to-start-fy27-right-11774989514472.html,2026-04-01T07:21:27+00:00
LiveMint,64,"New Financial Year 2026-27 Rule Changes LIVE: Jet fuel, commercial LPG prices revised; income tax rules updated",https://www.livemint.com/money/personal-finance/new-income-tax-act-2026-live-updates-slabs-standard-deduction-basic-salary-changes-form-16-labour-laws-april-1-tds-itr-11774970274159.html,2026-04-01T07:21:27+00:00
LiveMint,65,Here's how your in-hand salary changes after 1 April as new Income-Tax Act comes into effect — Check details,https://www.livemint.com/money/personal-finance/how-your-in-hand-salary-change-1-april-2026-new-income-tax-act-exempt-basic-pay-pf-hra-meal-card-gift-coupon-labour-code-11774976223499.html,2026-04-01T07:21:27+00:00
LiveMint,66,Perplexity AI accused of embedding ‘undetectable’ trackers for secretly routing sensitive user data to Meta and Google,https://www.livemint.com/technology/tech-news/perplexity-ai-accused-of-embedding-undetectable-trackers-for-secretly-routing-sensitive-user-data-to-meta-and-google-11775013680758.html,2026-04-01T07:21:27+00:00
LiveMint,67,"Google ends 20-year restriction, finally allows users to change embarrassing Gmail usernames",https://www.livemint.com/technology/tech-news/google-ends-20-year-restriction-finally-allows-users-to-change-embarrassing-gmail-usernames-11775014836422.html,2026-04-01T07:21:27+00:00
LiveMint,68,Siri set for a big upgrade as Apple begins testing ChatGPT and Gemini like multi-request processing feature,https://www.livemint.com/technology/tech-news/siri-set-for-a-big-upgrade-as-apple-begins-testing-chatgpt-and-gemini-like-multi-request-processing-feature-ios-27-wwdc-11775011039107.html,2026-04-01T07:21:27+00:00
LiveMint,69,X down again? Elon Musk's social media platform suffers another outage for thousands of users,https://www.livemint.com/technology/tech-news/x-twitter-down-again-elon-musks-social-media-app-suffers-another-outage-for-thousands-of-users-11775006632638.html,2026-04-01T07:21:27+00:00
LiveMint,70,Mamdani puts New York City government back on TikTok,https://www.livemint.com/technology/mamdani-puts-new-york-city-government-back-on-tiktok-11774992096059.html,2026-04-01T07:21:27+00:00
LiveMint,71,"Anthropic's AI coding tool, Claude Code, accidentally reveals its source code; here's what happened",https://www.livemint.com/technology/tech-news/anthropics-ai-coding-tool-claude-code-accidentally-reveals-its-source-code-heres-what-happened-11774977255558.html,2026-04-01T07:21:27+00:00
