source,rank,headline,link,collected_at_iso
Indian Express,1,Trending in India,https://indianexpress.com/section/trending/trending-in-india/,2026-07-11T16:57:54+00:00
Indian Express,2,This is Serious,https://indianexpress.com/section/trending/this-is-serious/,2026-07-11T16:57:54+00:00
Indian Express,3,British Airways vs Norwegian Instagram bet,https://indianexpress.com/article/trending/trending-globally/british-airways-norwegian-air-instagram-logo-bet-england-vs-norway-fifa-world-cup-quaterfinal-10782138/,2026-07-11T16:57:54+00:00
Indian Express,4,How learning Spanish helped Delhi woman live in Switzerland,https://indianexpress.com/article/trending/trending-in-india/no-job-no-corporate-salary-how-learning-spanish-helped-delhi-woman-live-in-switzerland-10782087/,2026-07-11T16:57:54+00:00
Indian Express,5,"Top 10 food regions in the world: Italy & Greece lead global food regions list, here’s where Indian regions ranked",https://indianexpress.com/article/trending/top-10-listing/top-10-food-regions-in-the-world-italy-and-greece-lead-global-food-regions-list-heres-where-indian-regions-ranked-10781874/,2026-07-11T16:57:54+00:00
Indian Express,6,Caron Rawnsley Jodhpur stepwells anand mahindra,https://indianexpress.com/article/trending/trending-in-india/anand-mahindra-praise-80-year-old-caron-rawnsley-jodhpur-stepwells-10781752/,2026-07-11T16:57:54+00:00
Indian Express,7,Erling Haaland Google Easter egg,https://indianexpress.com/article/trending/trending-globally/erling-haaland-google-easter-egg-viking-row-norway-10781649/,2026-07-11T16:57:54+00:00
Indian Express,8,Canadian woman marries Pakistani man,https://indianexpress.com/article/trending/trending-in-india/canadian-woman-marries-pakistani-man-cultural-differences-viral-video-10780743/,2026-07-11T16:57:54+00:00
Indian Express,9,"Top 10 most valuable brands in the world: Costco earns top position, Canva closes list",https://indianexpress.com/article/trending/top-10-listing/top-10-most-valuable-brands-in-the-world-costco-earns-top-position-canva-closes-list-10780499/,2026-07-11T16:57:54+00:00
Indian Express,10,Germany-based woman gifts mother gold jewellery,https://indianexpress.com/article/trending/trending-in-india/germany-based-woman-gifts-mother-gold-jewellery-viral-video-10780614/,2026-07-11T16:57:54+00:00
Indian Express,11,France vs Morocco London unrest,https://indianexpress.com/article/trending/trending-globally/france-vs-morocco-london-unrest-officer-injured-four-arrested-viral-video-10780437/,2026-07-11T16:57:54+00:00
Indian Express,12,Indonesian farmer agricultural drone,https://indianexpress.com/article/trending/trending-globally/indonesian-farmer-uses-drone-as-mode-of-transport-viral-video-10780255/,2026-07-11T16:57:54+00:00
Indian Express,13,cab driver cancels ride after passenger smokes,https://indianexpress.com/article/trending/trending-in-india/cab-driver-cancels-ride-passenger-smokes-viral-video-10780173/,2026-07-11T16:57:54+00:00
Indian Express,14,Revanth Reddy cooking pooris with grandson,https://indianexpress.com/article/trending/trending-in-india/telangana-cm-revanth-reddy-cooking-pooris-with-grandson-viral-video-10780060/,2026-07-11T16:57:54+00:00
Indian Express,15,Expensive Cities for Luxury Spending,https://indianexpress.com/article/trending/top-10-listing/top-10-most-expensive-cities-in-the-world-2026-10779245/,2026-07-11T16:57:54+00:00
Indian Express,16,Sridhar Vembu Japan veshti video,https://indianexpress.com/article/trending/trending-in-india/sridhar-vembu-japan-veshti-video-goes-viral-10779107/,2026-07-11T16:57:54+00:00
Indian Express,17,man sleeping on bull viral video,https://indianexpress.com/article/trending/trending-in-india/man-sleeping-on-bull-viral-video-india-busy-road-10778948/,2026-07-11T16:57:54+00:00
Indian Express,18,Emmanuel Macron Emine Erdoğan greeting,https://indianexpress.com/article/trending/trending-globally/emmanuel-macron-emine-erdogan-hand-kiss-turkish-first-lady-pulls-away-10778661/,2026-07-11T16:57:54+00:00
Indian Express,19,Raigad LPG cylinders washed away,https://indianexpress.com/article/trending/trending-in-india/raigad-3000-lpg-cylinders-washed-away-maharashtra-floods-viral-video-10778440/,2026-07-11T16:57:54+00:00
Indian Express,20,Connor Murphy dies,https://indianexpress.com/article/trending/trending-globally/looksmaxxing-influencer-connor-murphy-dies-thailand-apparent-drowning-10778422/,2026-07-11T16:57:54+00:00
Indian Express,21,The Ministry of Railways issued a statement reiterating the same position,https://indianexpress.com/article/trending/trending-in-india/indian-railways-first-ac-honeymoon-suite-video-tte-suspended-10778284/,2026-07-11T16:57:54+00:00
Indian Express,22,Top 10 Richest People in the World,https://indianexpress.com/article/trending/top-10-listing/top-10-richest-people-in-the-world-elon-musk-first-trillionaire-forbes-july-2026-10777667/,2026-07-11T16:57:54+00:00
Indian Express,23,Grrom carry bride Indore flooded wedding,https://indianexpress.com/article/trending/trending-in-india/indore-viral-wedding-groom-carries-bride-flooded-venue-10777611/,2026-07-11T16:57:54+00:00
Indian Express,24,Top 10 Strongest Currencies In The World In 2026,https://indianexpress.com/article/trending/top-10-listing/top-10-strongest-currencies-in-the-world-in-2026-10777388/,2026-07-11T16:57:54+00:00
Indian Express,25,Japan work culture,https://indianexpress.com/article/trending/trending-in-india/japan-work-culture-indian-professional-10-years-workplace-experience-10777546/,2026-07-11T16:57:54+00:00
Indian Express,26,"Top 10 happiest cities in the world 2026: English city tops rankings, Jaipur shines at No. 6",https://indianexpress.com/article/trending/top-10-listing/top-10-happiest-cities-in-the-world-2026-english-city-tops-rankings-jaipur-shines-at-no-6-10777189/,2026-07-11T16:57:54+00:00
Indian Express,27,Erling Haaland lookalike,https://indianexpress.com/article/trending/trending-globally/erling-haaland-viral-lookalike-emma-kate-willman-viral-video-10777065/,2026-07-11T16:57:54+00:00
LiveMint,1,"OTT releases this week: Jennifer Garner's The Five Star Weekend, and more",https://www.livemint.com/us/trending/us-ott-releases-this-week-jennifer-garners-the-five-star-weekend-the-man-will-burn-and-more-11783692043417.html,2026-07-11T16:57:54+00:00
LiveMint,2,Quote of the day by Gayle Forman: ‘Life might take you down different…’,https://www.livemint.com/us/trending/quote-of-the-day-by-gayle-forman-life-might-take-you-down-different-roads-why-choices-matter-more-than-circumstances-11783413351658.html,2026-07-11T16:57:54+00:00
LiveMint,3,"Quote of the day by Charles Schulz: ‘Learn from yesterday, live for today…’",https://www.livemint.com/us/trending/quote-of-the-day-by-charles-schulz-learn-from-yesterday-live-for-today-life-lessons-on-value-of-time-11783411939895.html,2026-07-11T16:57:54+00:00
LiveMint,4,Comedian Adam Sandler officiated Taylor Swift-Travis Kelce wedding,https://www.livemint.com/us/trending/comedian-adam-sandler-officiated-taylor-swift-travis-kelce-wedding-all-about-his-relationship-with-the-star-couple-11783129384586.html,2026-07-11T16:57:54+00:00
LiveMint,5,‘Just&t married’: Taylor Swift and Travis Kelce officially tie the knot,https://www.livemint.com/us/trending/justt-married-taylor-swift-and-travis-kelce-officially-married-at-madison-square-garden-11783122011843.html,2026-07-11T16:57:54+00:00
LiveMint,6,Quote of the day by Djokovic: ‘You have to consistently be successful to be…’,https://www.livemint.com/us/trending/quote-of-the-day-by-novak-djokovic-you-have-to-consistently-be-successful-to-be-one-of-the-top-players-11783074167321.html,2026-07-11T16:57:54+00:00
LiveMint,7,Quote of the day by Daniel J Boorstin: ‘The greatest enemy of knowledge is…’,https://www.livemint.com/us/trending/quote-of-the-day-by-daniel-j-boorstin-the-greatest-enemy-of-knowledge-is-not-ignorance-it-is-the-illusion-of-11783057446664.html,2026-07-11T16:57:54+00:00
LiveMint,8,"Quote of the day by Bruce Lee: ‘The successful warrior is the average man,…’",https://www.livemint.com/us/trending/quote-of-the-day-by-bruce-lee-the-successful-warrior-is-the-average-man-with-laser-like-focus-11783054961943.html,2026-07-11T16:57:54+00:00
LiveMint,9,Quote of the day by Lewis Hamilton: ‘You just need to be accepted for who you…’,https://www.livemint.com/us/trending/quote-of-the-day-by-lewis-hamilton-you-just-need-to-be-accepted-for-who-you-are-and-be-proud-of-11782988582326.html,2026-07-11T16:57:54+00:00
LiveMint,10,Quote of the day by Eric Thomas: ‘The difference between average and good…’,https://www.livemint.com/us/trending/quote-of-the-day-by-eric-thomas-the-difference-between-average-and-good-11782971253579.html,2026-07-11T16:57:54+00:00
LiveMint,11,Quote of the day by Jalal ad-Din Muhammad Rumi: ‘If you are irritated by…’,https://www.livemint.com/us/trending/quote-of-the-day-by-jalal-ad-din-muhammad-rumi-if-you-are-irritated-by-every-rub-11782904307985.html,2026-07-11T16:57:54+00:00
LiveMint,12,"Quote of the day by Seneca: ‘A gem cannot be polished without friction, nor a…’",https://www.livemint.com/us/trending/quote-of-the-day-by-seneca-a-gem-cannot-be-polished-without-friction-nor-a-11782899076299.html,2026-07-11T16:57:54+00:00
LiveMint,13,Strawberry Moon 2026: Everything to know about the June full moon,https://www.livemint.com/us/trending/full-strawberry-moon-2026-everything-to-know-about-the-june-full-moon-and-its-significance-11782480123886.html,2026-07-11T16:57:54+00:00
LiveMint,14,"The wait is over: Rockstar announces GTA VI price, pre-orders starts tomorrow",https://www.livemint.com/us/trending/the-wait-is-over-rockstar-announces-gta-vi-price-pre-orders-starts-tomorrow-heres-how-you-can-order-11782318796865.html,2026-07-11T16:57:54+00:00
LiveMint,15,"Amazon Prime Day 2026: Best deals under $100 on Fitbit, Kindle and more",https://www.livemint.com/us/trending/amazon-prime-day-2026-best-deals-under-100-on-fitbit-kindle-and-more-11782217189437.html,2026-07-11T16:57:54+00:00
LiveMint,16,Why was Alex Freeman's goal allowed to stand after VAR review in USA vs Australi,https://www.livemint.com/us/trending/alex-freeman-goal-allowed-to-stand-after-var-review-in-usa-vs-australia-fifa-world-cup-2026-match-11781900874288.html,2026-07-11T16:57:54+00:00
LiveMint,17,Christian Pulisic injury update: Will USMNT star play in Australia FIFA WC game?,https://www.livemint.com/us/christian-pulisic-injury-update-will-usmnt-star-play-in-australia-fifa-world-cup-2026-clash-check-playing-xi-11781890065629.html,2026-07-11T16:57:54+00:00
LiveMint,18,"This former welder turned millionaire overnight, thanks to SpaceX IPO",https://www.livemint.com/us/trending/this-former-welder-turned-millionaire-overnight-thanks-to-spacex-ipo-here-is-how-much-shares-he-owns-11781439252428.html,2026-07-11T16:57:54+00:00
LiveMint,19,Tyra Banks files defamation lawsuit against Netflix,https://www.livemint.com/us/trending/tyra-banks-sues-netflix-over-america-s-next-top-model-docuseries-alleging-defamation-and-manipulation-11781380081367.html,2026-07-11T16:57:54+00:00
LiveMint,20,Mark to Market,https://www.livemint.com/market/mark-to-market,2026-07-11T16:57:54+00:00
LiveMint,21,Nomura sees 22% upside in Ather Energy. Here's why it's the brokerage's top EV pick,https://www.livemint.com/market/stock-market-news/nomura-sees-22-upside-in-ather-energy-heres-why-its-the-brokerages-top-ev-pick-11783759286706.html,2026-07-11T16:57:54+00:00
LiveMint,22,"Why large cap and mid cap funds could be the best mutual fund to bet on now, according to Abakkus study",https://www.livemint.com/market/stock-market-news/why-large-cap-and-mid-cap-funds-could-be-the-best-mutual-fund-to-bet-on-now-according-to-abakkus-study-11783754490006.html,2026-07-11T16:57:54+00:00
LiveMint,23,AI chip fever returns? SK Hynix share price surges 13% after blockbuster $26.5 billion US listing,https://www.livemint.com/market/stock-market-news/ai-chip-fever-returns-sk-hynix-share-price-surges-13-after-blockbuster-26-5-billion-us-listing-11783751790334.html,2026-07-11T16:57:54+00:00
LiveMint,24,"SBI Funds Management IPO: SBI offloads 1.42% stake to 30 investors ahead of issue | Check latest GMP, IPO details",https://www.livemint.com/market/ipo/sbi-funds-management-ipo-sbi-offloads-1-42-stake-to-30-investors-ahead-of-issue-check-latest-gmp-ipo-details-11783747611365.html,2026-07-11T16:57:54+00:00
LiveMint,25,Greed and Fear report: Christopher Wood sees 'AI fatigue' setting in. Why Jefferies is turning bullish on India,https://www.livemint.com/market/stock-market-news/greed-and-fear-report-christopher-wood-sees-ai-fatigue-setting-in-why-jefferies-is-turning-bullish-on-india-11783742010435.html,2026-07-11T16:57:54+00:00
LiveMint,26,Buy or sell: Sumeet Bagadia recommends three stocks to buy on Monday - 13 July 2026,https://www.livemint.com/market/stock-market-news/buy-or-sell-sumeet-bagadia-recommends-three-stocks-to-buy-on-monday-13-july-2026-11783739561129.html,2026-07-11T16:57:54+00:00
LiveMint,27,Shah Rukh Khan spends ₹37 crore on Delhi home where he started married life with wife Gauri,https://www.livemint.com/news/trends/shah-rukh-khan-spends-rs-37-crore-on-delhi-home-where-he-started-married-life-with-wife-gauri-11783784482765.html,2026-07-11T16:57:54+00:00
LiveMint,28,"Quote of the day by Benjamin Franklin: ‘You may delay, but time will….’",https://www.livemint.com/news/us-news/quote-of-the-day-by-benjamin-franklin-you-may-delay-but-time-will-11783782279019.html,2026-07-11T16:57:54+00:00
LiveMint,29,7-year-old asked for a window seat to ‘feel close to God’ — What happened next moved a Pune fintech expert,https://www.livemint.com/news/trends/7yearold-asked-for-a-window-seat-to-feel-close-to-god-what-happened-next-moved-a-pune-fintech-expert-11783776807255.html,2026-07-11T16:57:54+00:00
LiveMint,30,"Pawan Kalyan health update: Andhra Pradesh deputy CM's shoulder surgery ‘highly successful' in Mumbai, confirms party",https://www.livemint.com/news/india/pawan-kalyan-health-update-andhra-pradesh-deputy-cms-shoulder-surgery-highly-successful-in-mumbai-confirms-party-11783777028788.html,2026-07-11T16:57:54+00:00
LiveMint,31,"S Janaki, nightingale of South India, dies at 88",https://www.livemint.com/news/india/s-janaki-nightingale-of-south-india-dies-at-88-11783781814919.html,2026-07-11T16:57:54+00:00
LiveMint,32,‘Vengeance is the will of our nation’: Iran’s Supreme Leader Mojtaba Khamenei vows revenge for father’s killing,https://www.livemint.com/news/world/vengeance-is-the-will-of-our-nation-iran-s-supreme-leader-mojtaba-khamenei-vows-revenge-for-father-s-killing-11783779696680.html,2026-07-11T16:57:54+00:00
LiveMint,33,"DMart Q1 results: Higher costs, slower mature-store growth weigh on margins",https://www.livemint.com/companies/company-results/dmart-q1-results-avenue-supermarts-revenue-11783769096643.html,2026-07-11T16:57:54+00:00
LiveMint,34,"Meta to discontinue controversial AI feature following privacy concerns, Hollywood's SAG-AFTRA union welcomes move",https://www.livemint.com/companies/news/meta-discontinue-controversial-ai-feature-users-generate-images-public-instagram-privacy-concerns-hollywood-sagaftra-11783765782518.html,2026-07-11T16:57:54+00:00
LiveMint,35,"What Apple accuses OpenAI of in explosive trade secret lawsuit? A laptop ‘not returned’, secret interviews, & more",https://www.livemint.com/companies/news/what-apple-accuses-openai-of-in-explosive-trade-secret-lawsuit-a-laptop-not-returned-secret-interviews-and-more-11783762780348.html,2026-07-11T16:57:54+00:00
LiveMint,36,Chairman's exit a 'challenging event' that raised governance questions: HDFC Bank CEO,https://www.livemint.com/companies/news/hdfc-bank-sashidhar-jagdishan-atanu-chakraborty-11783741260939.html,2026-07-11T16:57:54+00:00
LiveMint,37,German luxury carmakers split on hybrids as EV sales surge,https://www.livemint.com/companies/news/german-luxury-carmakers-split-on-hybrids-as-ev-sales-surge-11783680203547.html,2026-07-11T16:57:54+00:00
LiveMint,38,Plum picks Rothschild for a record $100 mn fundraise,https://www.livemint.com/companies/plum-rothschild-d2c-beauty-personal-care-fundraise-fmcg-skincare-body-care-makeup-haircare-11783677788765.html,2026-07-11T16:57:54+00:00
LiveMint,39,Ask Mint Money,https://www.livemint.com/money/ask-mint-money,2026-07-11T16:57:54+00:00
LiveMint,40,"EPFO contributions evolve: Is it still lucrative investment as EPF rules, Labour Codes change? Experts explain the math",https://www.livemint.com/money/personal-finance/epfo-contributions-evolve-is-it-still-lucrative-investment-as-epf-rules-labour-codes-change-experts-explain-the-math-11783779707951.html,2026-07-11T16:57:54+00:00
LiveMint,41,ITR filing now shapes your financial identity: 6 key benefits beyond tax compliance every taxpayer should know,https://www.livemint.com/money/personal-finance/itr-filing-now-shapes-your-financial-identity-6-key-benefits-beyond-tax-compliance-every-taxpayer-should-know-11783605919690.html,2026-07-11T16:57:54+00:00
LiveMint,42,Chose the new tax regime? Here are 5 ways to reduce your tax while filing ITR for AY 2026-27,https://www.livemint.com/money/personal-finance/chose-the-new-tax-regime-here-are-5-ways-to-reduce-your-tax-while-filing-itr-for-ay-202627-11783751958204.html,2026-07-11T16:57:54+00:00
LiveMint,43,NPS exit rules explained: How the Retirement Income Scheme and drawdown options work,https://www.livemint.com/money/personal-finance/nps-exit-rules-explained-how-the-retirement-income-scheme-and-drawdown-options-work-11783669450670.html,2026-07-11T16:57:54+00:00
LiveMint,44,"8th pay commission: Here's how employees, pensioners, govt departments can submit data — Stepwise guide",https://www.livemint.com/money/personal-finance/8th-pay-commission-how-employees-pensioners-union-government-departments-stakeholders-can-submit-data-cpc-stepwise-guide-11783774482603.html,2026-07-11T16:57:54+00:00
LiveMint,45,"SK Hynix makes history with biggest foreign US IPO, shares soar 13%: Why this is even bigger news for Indian investors",https://www.livemint.com/money/personal-finance/sk-hynix-makes-history-with-biggest-foreign-us-ipo-shares-soar-13-why-this-is-even-bigger-news-for-indian-investors-11783775018463.html,2026-07-11T16:57:54+00:00
LiveMint,46,FIFA World Cup,https://www.livemint.com/sports/football-news/fifa-world-cup,2026-07-11T16:57:54+00:00
LiveMint,47,FIFA 2026 Schedule,https://www.livemint.com/sports/football-news/fifa-world-cup-schedule,2026-07-11T16:57:54+00:00
LiveMint,48,FIFA Points Table,https://www.livemint.com/sports/football-news/fifa-world-cup-points-table,2026-07-11T16:57:54+00:00
LiveMint,49,IFSC Code Finder,https://www.livemint.com/ifsc-code,2026-07-11T16:57:54+00:00
LiveMint,50,Income Tax Calculator,https://www.livemint.com/tools-calculators/income-tax-calculator,2026-07-11T16:57:54+00:00
LiveMint,51,Gold Rate Today,https://www.livemint.com/gold-prices,2026-07-11T16:57:54+00:00
LiveMint,52,Gold Rate in Delhi,https://www.livemint.com/gold-prices/delhi,2026-07-11T16:57:54+00:00
LiveMint,53,Gold Rate Hyderabad,https://www.livemint.com/gold-prices/hyderabad,2026-07-11T16:57:54+00:00
LiveMint,54,Silver Rate Today,https://www.livemint.com/silver-prices,2026-07-11T16:57:54+00:00
LiveMint,55,Silver Rate in Delhi,https://www.livemint.com/silver-prices/delhi,2026-07-11T16:57:54+00:00
LiveMint,56,Silver Rate in Bangalore,https://www.livemint.com/silver-prices/bangalore,2026-07-11T16:57:54+00:00
LiveMint,57,US Stock Market,https://www.livemint.com/market/us-market,2026-07-11T16:57:54+00:00
LiveMint,58,Terms of Use,https://www.livemint.com/terms-of-use,2026-07-11T16:57:54+00:00
LiveMint,59,Code of ethics,https://www.livemint.com/code-of-ethics,2026-07-11T16:57:54+00:00
LiveMint,60,Home Loan EMI Calculator,https://www.livemint.com/tools-calculators/home-loan-emi-calculator,2026-07-11T16:57:54+00:00
LiveMint,61,Car Loan EMI,https://www.livemint.com/tools-calculators/car-loan-calculator,2026-07-11T16:57:54+00:00
India Today,1,"Intern promised Rs 10,000 stipend, then salary day brought an unpleasant surprise",https://www.indiatoday.in/trending-news/story/intern-promised-rs-10000-stipend-then-salary-day-brought-an-unpleasant-surprise-2945654-2026-07-11,2026-07-11T16:57:54+00:00
India Today,2,IIT Roorkee students' unique solution to move around flooded campus goes viral,https://www.indiatoday.in/trending-news/story/iit-roorkee-students-unique-solution-to-move-around-flooded-campus-goes-viral-2945590-2026-07-11,2026-07-11T16:57:54+00:00
India Today,3,"Sri Lankan woman watches mother, 56, receive Master's degree; gets emotional",https://www.indiatoday.in/trending-news/story/sri-lankan-woman-watches-56-year-old-mother-receive-masters-degree-gets-emotional-2945548-2026-07-11,2026-07-11T16:57:54+00:00
India Today,4,"Mumbai man finds stray dog hiding from rain amid floods, his next move wins hearts",https://www.indiatoday.in/trending-news/story/mumbai-man-finds-stray-dog-hiding-from-rain-amid-floods-his-next-move-wins-hearts-2945506-2026-07-11,2026-07-11T16:57:54+00:00
India Today,5,"Manager verbally approves employee's 2-day leave, then pulls a last-minute twist",https://www.indiatoday.in/trending-news/story/manager-verbally-approves-employees-2-day-leave-then-pulls-a-last-minute-twist-2945471-2026-07-11,2026-07-11T16:57:54+00:00
India Today,6,"Mumbai woman surprises househelp with her favourite breakfast, her smile says it all",https://www.indiatoday.in/trending-news/story/mumbai-woman-surprises-househelp-with-her-favourite-breakfast-her-smile-says-it-all-2945437-2026-07-11,2026-07-11T16:57:54+00:00
India Today,7,Indian woman surprises mother with gold jewellery. Her reaction will melt your heart,https://www.indiatoday.in/trending-news/story/indian-woman-surprises-mother-with-gold-jewellery-her-reaction-will-melt-your-heart-2945419-2026-07-11,2026-07-11T16:57:54+00:00
India Today,8,Rajasthan school students flee in panic as 5-foot cobra slithers into classroom,https://www.indiatoday.in/trending-news/story/rajasthan-school-students-flee-in-panic-as-5-foot-cobra-slithers-into-classroom-2945114-2026-07-10,2026-07-11T16:57:54+00:00
India Today,9,"Ahmedabad doctors remove betel nut, water chestnut stuck in windpipes of two children",https://www.indiatoday.in/trending-news/story/ahmedabad-doctors-remove-betel-nut-water-chestnut-stuck-in-windpipes-of-two-children-2944828-2026-07-10,2026-07-11T16:57:54+00:00
India Today,10,UP bride halts wedding after groom's brother pulls her pallu. And then…,https://www.indiatoday.in/trending-news/story/up-bride-halts-wedding-after-grooms-brother-pulls-her-pallu-and-then-2944973-2026-07-10,2026-07-11T16:57:54+00:00
India Today,11,"Almost 900 snakes escape China breeding farms during floods, residents bitten",https://www.indiatoday.in/trending-news/story/almost-900-snakes-escape-china-breeding-farms-during-floods-residents-bitten-2944882-2026-07-10,2026-07-11T16:57:54+00:00
India Today,12,Brazilian couple breaks Guinness World Record with 195 kisses in 30 seconds. Watch,https://www.indiatoday.in/trending-news/story/brazilian-couple-breaks-guinness-world-record-with-195-kisses-in-30-seconds-watch-2944797-2026-07-10,2026-07-11T16:57:54+00:00
India Today,13,"Japanese woman gets into an argument with roommate, then sews her lips shut",https://www.indiatoday.in/trending-news/story/japanese-woman-gets-into-an-argument-with-roommate-then-sews-her-lips-shut-2944741-2026-07-10,2026-07-11T16:57:54+00:00
India Today,14,Boy requests window seat on flight to be 'close to God': Fintech expert narrates tear-jerker of a story,https://www.indiatoday.in/trending-news/story/pune-man-gives-up-window-seat-to-boy-learns-heartbreaking-reason-behind-request-2944743-2026-07-10,2026-07-11T16:57:54+00:00
India Today,15,Indian man apologises to Singapore Airlines crew after molestation of attendant,https://www.indiatoday.in/trending-news/story/indian-man-apologises-to-singapore-airlines-crew-after-molestation-of-attendant-2944678-2026-07-10,2026-07-11T16:57:54+00:00
India Today,16,"Woman kidnapped during Italy holiday, not once, but twice in a day",https://www.indiatoday.in/trending-news/story/australian-woman-italy-holiday-spirals-into-horror-as-she-is-kidnapped-twice-in-a-day-2944664-2026-07-10,2026-07-11T16:57:54+00:00
India Today,17,New York CEO says he doesn't care when or where employees work. Only this matters,https://www.indiatoday.in/trending-news/story/new-york-ceo-says-he-does-not-care-where-or-when-employees-work-only-this-matters-2944611-2026-07-10,2026-07-11T16:57:54+00:00
India Today,18,"Man slips while getting off moving train, RPF constable saves him inches from death",https://www.indiatoday.in/trending-news/story/jhansi-station-man-slips-while-getting-off-moving-train-rpf-constable-saves-him-inches-from-death-2944569-2026-07-10,2026-07-11T16:57:54+00:00
India Today,19,"Woman with Rs 80 lakh savings wants to quit stable job, shares her biggest reason",https://www.indiatoday.in/trending-news/story/woman-with-rs-80-lakh-savings-wants-to-quit-stable-job-shares-her-biggest-reason-2944301-2026-07-09,2026-07-11T16:57:54+00:00
India Today,20,"Candidate loses job a day after getting offer letter, all because she asked this",https://www.indiatoday.in/trending-news/story/candidate-loses-job-a-day-after-getting-offer-letter-all-because-she-asked-this-2944234-2026-07-09,2026-07-11T16:57:54+00:00
India Today,21,"5 women die in 6 days after C-section, Rajasthan hospital under scanner",https://www.indiatoday.in/india/story/bhilwara-maternal-deaths-five-women-die-after-caesarean-deliveries-at-mahatma-gandhi-hospital-2945877-2026-07-11,2026-07-11T16:57:54+00:00
India Today,22,Ro Khanna says armed Israeli settlers detained him during West Bank visit,https://www.indiatoday.in/world/story/ro-khanna-west-bank-visit-israeli-settlers-idf-detention-ptag-2945885-2026-07-11,2026-07-11T16:57:54+00:00
