source,rank,headline,link,collected_at_iso
Indian Express,1,Trending in India,https://indianexpress.com/section/trending/trending-in-india/,2026-04-18T08:51:53+00:00
Indian Express,2,This is Serious,https://indianexpress.com/section/trending/this-is-serious/,2026-04-18T08:51:53+00:00
Indian Express,3,Scorpions India tour cancelled,https://indianexpress.com/article/trending/trending-in-india/scorpions-india-tour-cancelled-medical-issues-ticket-refund-details-shillong-mumbai-bengaluru-10643268/,2026-04-18T08:51:53+00:00
Indian Express,4,Ice Spice slapped by fan at McDonald's,https://indianexpress.com/article/trending/trending-globally/rapper-ice-spice-slapped-by-fan-at-mcdonalds-hollywood-viral-video-lapd-report-10643040/,2026-04-18T08:51:53+00:00
Indian Express,5,Mamata Banerjee security scare 2026 West Bengal Assembly elections rally,https://indianexpress.com/article/trending/trending-in-india/mamata-banerjee-security-breach-jalpaiguri-2026-west-bengal-assembly-elections-rally-viral-video-10642852/,2026-04-18T08:51:53+00:00
Indian Express,6,China job market dating apps networking,https://indianexpress.com/article/trending/trending-globally/china-job-market-dating-apps-networking-trend-10641948/,2026-04-18T08:51:53+00:00
Indian Express,7,71-year-old Bengali man singing Khat viral video,https://indianexpress.com/article/trending/trending-in-india/71-year-old-man-singing-khat-viral-video-navjot-ahuja-reacts-10641874/,2026-04-18T08:51:53+00:00
Indian Express,8,CBSE Class 10 result 2026,https://indianexpress.com/article/trending/trending-in-india/visually-impaired-student-zainab-bilal-cbse-10th-results-success-95-percent-10641649/,2026-04-18T08:51:53+00:00
Indian Express,9,Bloomberg Billionaires Index Top 10 Richest Person List in the World: Gautam Adani is Asia’s richest person,https://indianexpress.com/article/trending/top-10-listing/bloomberg-billionaires-index-gautam-adani-overtakes-mukesh-ambani-worlds-top-10-richest-2026-10641401/,2026-04-18T08:51:53+00:00
Indian Express,10,Rolls-Royce tea experiment,https://indianexpress.com/article/trending/trending-in-india/content-creator-rent-rolls-royce-for-1-lakh-to-sell-tea-earns-88400-viral-video-10641067/,2026-04-18T08:51:53+00:00
Indian Express,11,China woman throws money,https://indianexpress.com/article/trending/trending-globally/china-woman-throws-money-from-balcony-after-fight-with-husband-viral-video-10640211/,2026-04-18T08:51:53+00:00
Indian Express,12,Top 10 most influential CEOs in the world,https://indianexpress.com/article/trending/top-10-listing/top-10-most-influential-ceo-in-the-world-in-2026-10640113/,2026-04-18T08:51:53+00:00
Indian Express,13,Mumbai auto driver singing Taylor Swift,https://indianexpress.com/article/trending/trending-in-india/mumbai-auto-driver-singing-taylor-swift-blank-space-viral-video-10639890/,2026-04-18T08:51:53+00:00
Indian Express,14,viral groundhog video,https://indianexpress.com/article/trending/trending-globally/viral-video-dramatic-groundhog-nail-trimming-reaction-31-million-views-10639559/,2026-04-18T08:51:53+00:00
Indian Express,15,Israel bee swarm alert,https://indianexpress.com/article/trending/trending-globally/massive-bee-swarms-shut-down-shops-trigger-urgent-alerts-across-israel-10639551/,2026-04-18T08:51:53+00:00
Indian Express,16,journalism career change,https://indianexpress.com/article/trending/trending-globally/us-sports-reporter-quit-30-years-of-journalism-turns-mail-carrier-career-switch-salary-hike-burnout-10639446/,2026-04-18T08:51:53+00:00
Indian Express,17,Peyush Bansal on religious policy row,https://indianexpress.com/article/trending/trending-in-india/lenskart-grooming-policy-controversy-peyush-bansal-clarification-10639292/,2026-04-18T08:51:53+00:00
Indian Express,18,World’s Busiest Airports Ranking in 2025,https://indianexpress.com/article/trending/top-10-listing/top-10-busiest-airports-by-total-passengers-in-2025-10638415/,2026-04-18T08:51:53+00:00
Indian Express,19,AI solves math conjecture,https://indianexpress.com/article/trending/trending-globally/chinese-ai-solves-2014-math-problem-peking-university-10638358/,2026-04-18T08:51:53+00:00
Indian Express,20,Unitree G1 robot wild boars Warsaw,https://indianexpress.com/article/trending/trending-globally/edward-warchocki-unitree-g1-humanoid-robot-wild-boars-warsaw-viral-video-10637978/,2026-04-18T08:51:53+00:00
Indian Express,21,Duolingo CEO talks about use of AI,https://indianexpress.com/article/trending/trending-globally/duolingo-ceo-ai-performance-reviews-results-not-usage-10637728/,2026-04-18T08:51:53+00:00
Indian Express,22,Bengaluru cat dispute,https://indianexpress.com/article/trending/trending-in-india/bengaluru-cat-dispute-seshadripuram-police-kitten-row-10637673/,2026-04-18T08:51:53+00:00
Indian Express,23,HYROX Bengaluru price debate,https://indianexpress.com/article/trending/trending-in-india/hyrox-bengaluru-pricing-debate-fitness-events-viral-post-marathon-fees-india-10637570/,2026-04-18T08:51:53+00:00
Indian Express,24,The situation escalated when her manager found her asleep,https://indianexpress.com/article/trending/trending-globally/chinese-employee-takes-5-hour-office-nap-to-protest-low-salary-steals-boss-snack-10637434/,2026-04-18T08:51:53+00:00
Indian Express,25,Top 10 most educated countries in the world,https://indianexpress.com/article/trending/top-10-listing/top-10-most-educated-countries-in-the-world-2026-10636368/,2026-04-18T08:51:53+00:00
Indian Express,26,Hungary politician Zsolt Hegedus dance video,https://indianexpress.com/article/trending/trending-globally/hungary-election-celebrations-politician-zsolt-hegedus-dance-viral-video-10636279/,2026-04-18T08:51:53+00:00
Indian Express,27,Praful Hinge IPL debut parents reaction,https://indianexpress.com/article/trending/trending-in-india/praful-hinge-ipl-debut-3-wickets-first-over-srh-rr-parents-video-10635822/,2026-04-18T08:51:53+00:00
LiveMint,1,"US Influencer faces backlash after running over toddler, sharing incident online",https://www.livemint.com/us/trending/us-influencer-accidentally-runs-over-23-month-old-son-internet-questions-post-says-attention-is-the-new-currency-11776454890604.html,2026-04-18T08:51:53+00:00
LiveMint,2,Kyle Cooke and Meghan King spotted kissing after Page Six party in NYC,https://www.livemint.com/us/trending/kyle-cooke-and-meghan-king-spotted-kissing-after-page-six-party-in-nyc-11776445679672.html,2026-04-18T08:51:53+00:00
LiveMint,3,Garret Anderson dies at 53: What we know about Angels Legend’s sudden passing,https://www.livemint.com/us/trending/garret-anderson-dies-at-53-what-we-know-about-angels-legend-s-sudden-passing-11776444818255.html,2026-04-18T08:51:53+00:00
LiveMint,4,"Cher seeks conservatorship for son Allman, flags drug, financial troubles",https://www.livemint.com/us/trending/cher-seeks-conservatorship-for-son-elijah-blue-allman-flags-drug-financial-troubles-report-11776439352370.html,2026-04-18T08:51:53+00:00
LiveMint,5,Donald Trump breaks silence after viral $100 tip to DoorDash Grandma,https://www.livemint.com/us/trending/donald-trump-breaks-silence-after-viral-100-tip-to-doordash-grandma-on-mcdonald-delivery-11776388215903.html,2026-04-18T08:51:53+00:00
LiveMint,6,American Pie star Shannon Elizabeth joins OnlyFans: ‘This is the future',https://www.livemint.com/us/trending/shannon-elizabeth-of-american-pie-to-join-onlyfans-hollywood-controlled-my-career-11776371145744.html,2026-04-18T08:51:53+00:00
LiveMint,7,‘Most trolled person in the world’: Meghan Markle on facing online abuse,https://www.livemint.com/us/trending/most-trolled-person-in-the-world-meghan-markle-on-facing-online-abuse-for-a-decade-11776367137558.html,2026-04-18T08:51:53+00:00
LiveMint,8,"Alex Manninger, former Arsenal goalkeeper passes way at 48 in Salzburg train col",https://www.livemint.com/us/trending/alex-manninger-death-former-arsenal-goalkeeper-passes-way-at-48-in-salzburg-train-collision-11776354419788.html,2026-04-18T08:51:53+00:00
LiveMint,9,‘What the…?’ Jon Stewart reacts to Trump’s controversial Jesus-themed AI image,https://www.livemint.com/us/trending/comedian-jon-stewart-mocks-trump-s-jesus-meme-jokes-about-resembling-sick-man-in-viral-image-11776199220897.html,2026-04-18T08:51:53+00:00
LiveMint,10,"Yellowstone volcano near eruption? New study sparks buzz, scientists urge cautio",https://www.livemint.com/us/trending/is-yellowstone-volcano-near-eruption-new-study-sparks-buzz-scientists-urge-caution-11776196907903.html,2026-04-18T08:51:53+00:00
LiveMint,11,Jonathan Quick retirement: Rangers veteran goaltender to make final NHL start,https://www.livemint.com/us/trending/jonathan-quick-retirement-new-york-rangers-veteran-goaltender-to-make-final-nhl-start-against-florida-panthers-11776101712321.html,2026-04-18T08:51:53+00:00
LiveMint,12,"NFL Draft 2026: Dates, location, top prospects, order and other details",https://www.livemint.com/us/trending/nfl-draft-2026-dates-location-top-prospects-order-heres-everything-you-need-to-know-11776088776110.html,2026-04-18T08:51:53+00:00
LiveMint,13,Giannis Antetokounmpo and Bucks enter pivotal offseason as Doc Rivers steps down,https://www.livemint.com/us/trending/giannis-antetokounmpo-milwaukee-bucks-enter-pivotal-offseason-as-doc-rivers-steps-down-after-50-loss-season-nba-11776082651467.html,2026-04-18T08:51:53+00:00
LiveMint,14,Sinner beats Alcaraz in Monte Carlo Masters final to reclaim world No. 1 ranking,https://www.livemint.com/us/trending/jannik-sinner-beats-carlos-alcaraz-in-monte-carlo-masters-final-to-reclaim-world-no-1-ranking-11776019107875.html,2026-04-18T08:51:53+00:00
LiveMint,15,Dallas Cowboys safety Markquese Bell arrested on felony drug charge,https://www.livemint.com/us/trending/markquese-bell-arrested-on-felony-drug-charge-and-marijuana-possession-dallas-cowboys-safety-11775932691814.html,2026-04-18T08:51:53+00:00
LiveMint,16,Coachella 2026 kicks off with Sabrina Carpenter's performance,https://www.livemint.com/us/trending/coachella-2026-kicks-off-with-sabrina-carpenters-performance-from-justin-bieber-to-karol-g-check-weekend-schedule-11775875804562.html,2026-04-18T08:51:53+00:00
LiveMint,17,Apple Pay scam spreading fast in the US—Are you at risk?,https://www.livemint.com/us/trending/apple-pay-users-hit-by-scam-wave-across-the-us-here-s-how-victims-are-losing-their-money-11775768345740.html,2026-04-18T08:51:53+00:00
LiveMint,18,Afrika Bambaataa death: Hip-hop pioneer-DJ dies at 67 after cancer complications,https://www.livemint.com/us/trending/afrika-bambaataa-death-hip-hop-pioneer-and-dj-dies-at-67-after-cancer-complications-11775767596687.html,2026-04-18T08:51:53+00:00
LiveMint,19,"DOJ antitrust probe into NFL media rights: What it means for streaming, and more",https://www.livemint.com/us/trending/doj-antitrust-probe-into-nfl-media-rights-what-it-means-for-fans-streaming-and-tv-deals-11775760586179.html,2026-04-18T08:51:53+00:00
LiveMint,20,"Daniil Medvedev smashes racquet in shocking 6-0, 6-0 loss at Monte Carlo Masters",https://www.livemint.com/us/trending/daniil-medvedev-racquet-video-in-shocking-6-0-6-0-clay-defeat-to-matteo-berrettini-at-monte-carlo-masters-11775674478886.html,2026-04-18T08:51:53+00:00
LiveMint,21,"Konnor Griffin signs 9-year, $140 million contract extension with Pirates",https://www.livemint.com/us/trending/konnor-griffin-signs-record-9-year-140-million-contract-extension-with-pittsburgh-pirates-mlb-baseball-11775653782727.html,2026-04-18T08:51:53+00:00
LiveMint,22,JD Vance’s awkward moment: Trump sends call to voicemail during live rally,https://www.livemint.com/us/trending/jd-vance-s-awkward-moment-trump-sends-call-to-voicemail-during-live-rally-in-hungary-watch-11775589348677.html,2026-04-18T08:51:53+00:00
LiveMint,23,"Islanders fire Patrick Roy, hire Peter DeBoer as head coach amid playoff push",https://www.livemint.com/us/trending/patrick-roy-fired-by-new-york-islanders-hire-peter-deboer-as-head-coach-amid-playoff-push-nhl-hockey-11775415170584.html,2026-04-18T08:51:53+00:00
LiveMint,24,Geno Auriemma apologizes to South Carolina after outburst in women's Final Four,https://www.livemint.com/us/trending/geno-auriemma-apologizes-to-south-carolina-after-emotional-outburst-vs-dawn-staley-in-womens-final-four-11775394255637.html,2026-04-18T08:51:53+00:00
LiveMint,25,NCAA Final Four 2026: UConn vs Illinois and Michigan vs Arizona results,https://www.livemint.com/us/trending/ncaa-final-four-2026-results-what-happened-in-uconn-vs-illinois-and-michigan-vs-arizona-march-madness-semifinals-11775390782036.html,2026-04-18T08:51:53+00:00
LiveMint,26,NASA’s Artemis II astronauts face toilet problem; social media reacts with memes,https://www.livemint.com/us/trending/nasas-artemis-ii-astronauts-faces-toilet-problem-in-space-social-media-reacts-with-jokes-memes-blame-ice-for-this-to-11775363905958.html,2026-04-18T08:51:53+00:00
LiveMint,27,Man City thrash Liverpool 4-0 while Chelsea crush Port Vale 7-0 in FA Cup QFs,https://www.livemint.com/us/trending/manchester-city-vs-liverpool-4-0-chelsea-vs-port-vale-7-0-fa-cup-quarterfinals-11775328419465.html,2026-04-18T08:51:53+00:00
LiveMint,28,Juan Soto calf injury: Mets star to undergo MRI after early exit vs Giants,https://www.livemint.com/us/trending/juan-soto-calf-injury-new-york-mets-star-to-undergo-mri-after-early-exit-vs-san-francisco-giants-11775306968287.html,2026-04-18T08:51:53+00:00
LiveMint,29,New York teacher earning $90K turns to $55/hour side gig to repay student loans,https://www.livemint.com/us/trending/new-york-teacher-earning-90k-turns-to-55-hour-side-gig-to-repay-student-loans-11775314789062.html,2026-04-18T08:51:53+00:00
LiveMint,30,NCAA men's Final Four matchups: Schedule and key details,https://www.livemint.com/us/trending/uconn-vs-illinois-and-arizona-vs-michigan-2026-ncaa-mens-final-four-matchups-schedule-and-key-details-11775243799182.html,2026-04-18T08:51:53+00:00
LiveMint,31,Gennaro Gattuso steps down as Italy manager after 2026 World Cup qualifier,https://www.livemint.com/us/trending/gennaro-gattuso-steps-down-as-italy-manager-after-2026-world-cup-qualifier-heartbreak-11775221292115.html,2026-04-18T08:51:53+00:00
LiveMint,32,"Vanessa Trump frustrated with Tiger Woods’ behavior, puts him on notice",https://www.livemint.com/us/trending/vanessa-trump-frustrated-with-tiger-woods-behavior-puts-him-on-notice-stop-acting-like-a-teenager-grow-up-11775209989597.html,2026-04-18T08:51:53+00:00
LiveMint,33,What’s wrong with Tiger Woods? ‘Heartbreaking’ video leaves fans worried,https://www.livemint.com/us/trending/whats-wrong-with-tiger-woods-heartbreaking-video-after-dui-arrest-leaves-fans-worried-mental-health-is-real-11775191311157.html,2026-04-18T08:51:53+00:00
LiveMint,34,McDonald's drops new under $3 menu and $4 breakfast deal — Here’s what you get,https://www.livemint.com/us/trending/mcdonalds-drops-new-under-3-menu-and-4-breakfast-deal-here-s-what-you-can-get-11775157327207.html,2026-04-18T08:51:53+00:00
LiveMint,35,Rapper J. Cole joins China’s Nanjing Monkey Kings for pro basketball stint,https://www.livemint.com/us/trending/grammywinning-rapper-j-cole-joins-china-s-nanjing-monkey-kings-for-pro-basketball-stint-11775141367888.html,2026-04-18T08:51:53+00:00
LiveMint,36,April Fools’ Day 2026 deals: No-joke discounts from Dunkin' and more,https://www.livemint.com/us/trending/april-fools-day-2026-discounts-dunkin-checkers-rally-hooters-qdoba-artemis-ii-doughnut-11775054510320.html,2026-04-18T08:51:53+00:00
LiveMint,37,"Oracle employee, despite being laid off, remains positive: ‘It happens…'",https://www.livemint.com/us/trending/oracle-employee-despite-being-laid-off-remains-positive-it-happens-will-enjoy-sleeping-11775051244639.html,2026-04-18T08:51:53+00:00
LiveMint,38,Warren Buffett teams up with NBA star Stephen Curry for charity lunch auction,https://www.livemint.com/us/trending/warren-buffett-teams-up-with-nba-star-stephen-curry-for-charity-lunch-auction-berkshire-event-returns-in-2026-11774962320767.html,2026-04-18T08:51:53+00:00
LiveMint,39,Tiger Woods’ ex Kristin Smith breaks silence after ‘triggering’ DUI arrest,https://www.livemint.com/us/trending/tiger-woods-ex-kristin-smith-breaks-silence-after-triggering-dui-arrest-seeks-privacy-11774949316320.html,2026-04-18T08:51:53+00:00
LiveMint,40,Mark to Market,https://www.livemint.com/market/mark-to-market,2026-04-18T08:51:53+00:00
LiveMint,41,"Yes Bank Q4 results: Net profit jumps 45% to ₹1,068 crore; NII up 16% YoY",https://www.livemint.com/market/stock-market-news/yes-bank-q4-results-net-profit-jumps-45-to-rs-1-068-crore-nii-up-16-yoy-11776500820893.html,2026-04-18T08:51:53+00:00
LiveMint,42,Buy or sell: Sumeet Bagadia recommends three stocks to buy on Monday — 20 April 2026,https://www.livemint.com/market/stock-market-news/buy-or-sell-sumeet-bagadia-recommends-three-stocks-to-buy-on-monday-20-april-2026-11776495471921.html,2026-04-18T08:51:53+00:00
LiveMint,43,Stocks to buy under ₹200: Mehul Kothari of Anand Rathi recommends three shares to buy or sell,https://www.livemint.com/market/stock-market-news/stocks-to-buy-under-rs-200-mehul-kothari-of-anand-rathi-recommends-three-shares-to-buy-or-sell-11776491921971.html,2026-04-18T08:51:53+00:00
LiveMint,44,"Yes Bank Q4 Results 2026 LIVE: Net profit jumps 45% to ₹1,068 crore; NII up 16% YoY",https://www.livemint.com/market/stock-market-news/yes-bank-q4-results-2026-live-yes-bank-q4-earnings-yes-bank-share-price-yes-bank-profit-npa-18-april-2026-11776493736366.html,2026-04-18T08:51:53+00:00
LiveMint,45,"HDFC Bank Q4 Results 2026 LIVE: Net profit may rise 9%, NII growth seen at 6% YoY with stable margins; dividend eyed",https://www.livemint.com/market/stock-market-news/hdfc-bank-q4-results-2026-live-hdfc-bank-q4-earnings-hdfc-bank-share-price-profit-npa-hdfc-bank-dividend-18-april-2026-11776491375916.html,2026-04-18T08:51:53+00:00
LiveMint,46,Three power transmission companies with strong project pipelines,https://www.livemint.com/market/stock-market-news/power-transmission-stocks-power-transmission-stocks-india-power-grid-tata-power-11776480502791.html,2026-04-18T08:51:53+00:00
LiveMint,47,Quote of the day by Mark Twain: ‘The secret of getting ahead is…’,https://www.livemint.com/news/us-news/quote-of-the-day-by-mark-twain-the-secret-of-getting-ahead-is-11776497500816.html,2026-04-18T08:51:53+00:00
LiveMint,48,"SRH vs CSK prediction: Who’ll win, Sunrisers Hyderabad or Chennai Super Kings? Grok, ChatGPT, Google Gemini pick winner",https://www.livemint.com/news/trends/srh-vs-csk-prediction-who-ll-win-sunrisers-hyderabad-or-chennai-super-kings-grok-chatgpt-google-gemini-pick-winner-11776498863317.html,2026-04-18T08:51:53+00:00
LiveMint,49,"RCB vs DC prediction: Who’ll win, Bengaluru or Delhi? Grok, ChatGPT, and Google Gemini have no confusion",https://www.livemint.com/news/trends/rcb-vs-dc-prediction-who-ll-win-bengaluru-or-delhi-grok-chatgpt-and-google-gemini-have-no-confusion-11776493598379.html,2026-04-18T08:51:53+00:00
LiveMint,50,RBI announced ‘new rules’ for exchanging old ₹500 & ₹1000 notes? PIB Factcheck says…,https://www.livemint.com/news/india/rbi-announced-new-rules-for-exchanging-old-500-1000-notes-pib-factcheck-says-11776486886253.html,2026-04-18T08:51:53+00:00
LiveMint,51,"Quote of the Day by Maya Angelou on freedom: 'The truth is, no one of us can be free…'",https://www.livemint.com/news/us-news/quote-of-the-day-by-maya-angelou-on-freedom-the-truth-is-no-one-of-us-can-be-free-11776489419122.html,2026-04-18T08:51:53+00:00
LiveMint,52,"TCS Nashik office case: Employees given WFH, HR AGM arrested, sex abuse, conversion charges — What we know so far",https://www.livemint.com/news/india/tcs-nashik-office-case-employees-given-wfh-hr-agm-arrested-sex-abuse-conversion-charges-what-we-know-so-far-11776484776088.html,2026-04-18T08:51:53+00:00
LiveMint,53,Salary Impact Tracker,https://www.livemint.com/tools-calculators/salary-impact-tracker,2026-04-18T08:51:53+00:00
LiveMint,54,Reed Hastings scripted his Netflix exit. Founder departures aren’t alway this smooth.,https://www.livemint.com/companies/reed-hastings-scripted-his-netflix-exit-founder-departures-aren-t-alway-this-smooth-11776499431200.html,2026-04-18T08:51:53+00:00
LiveMint,55,Bajaj Consumer doubles down on growth brands with ₹500 crore target,https://www.livemint.com/companies/company-results/bajaj-consumer-q4-results-almond-drops-hair-oil-inflation-india-bajaj-consumer-share-price-11776481395721.html,2026-04-18T08:51:53+00:00
LiveMint,56,"Trump labels Reed Hastings a 'SLEAZEBAG', questions why Netflix co-founder stepped down: ‘What was his crime?’",https://www.livemint.com/companies/news/trump-labels-reed-hastings-a-sleazebag-questions-why-netflix-co-founder-stepped-down-what-was-his-crime-11776483410102.html,2026-04-18T08:51:53+00:00
LiveMint,57,"Who is Srinivas Narayanan? US techie quits OpenAI, plans to return to India to spend time with ‘ageing parents’",https://www.livemint.com/companies/people/who-is-srinivas-narayanan-us-techie-quits-openai-plans-to-return-to-india-to-spend-time-with-ageing-parents-11776481567716.html,2026-04-18T08:51:53+00:00
LiveMint,58,Federal judge blocks Nexstar-Tegna TV station merger until antitrust lawsuit is settled,https://www.livemint.com/companies/federal-judge-blocks-nexstar-tegna-tv-station-merger-until-antitrust-lawsuit-is-settled-11776480945906.html,2026-04-18T08:51:53+00:00
LiveMint,59,"TCS shares update on Nashik office case: Says Nida Khan 'not an HR', forms oversight panel, calls in Deloitte",https://www.livemint.com/companies/news/tcs-shares-update-on-nashik-office-case-says-nida-khan-not-an-hr-forms-oversight-panel-calls-in-deloitte-11776475637562.html,2026-04-18T08:51:53+00:00
LiveMint,60,Ask Mint Money,https://www.livemint.com/money/ask-mint-money,2026-04-18T08:51:53+00:00
LiveMint,61,"Centre approves 2% DA hike for central govt employees, pensioners ahead of 8th Pay Commission: Report",https://www.livemint.com/money/personal-finance/government-approves-2-da-hike-for-central-govt-employees-ahead-of-8th-pay-commission-11776500013923.html,2026-04-18T08:51:53+00:00
LiveMint,62,"What are arbitrage funds? How they work, who should invest, and other details",https://www.livemint.com/money/personal-finance/what-are-arbitrage-funds-how-they-work-who-should-invest-and-other-details-11776491726346.html,2026-04-18T08:51:53+00:00
LiveMint,63,"Planning to buy Gold on Akshaya Tritiya? Here’s how to check hallmark and purity of 24K, 22K Gold",https://www.livemint.com/money/personal-finance/buying-gold-on-akshaya-tritiya-how-to-check-hallmarking-purity-11776490747987.html,2026-04-18T08:51:53+00:00
LiveMint,64,Mutual Fund SIP: Why is making the first crore the hardest thing to do?,https://www.livemint.com/money/personal-finance/mutual-fund-sip-why-is-making-the-first-crore-the-hardest-thing-to-do-11776470439203.html,2026-04-18T08:51:53+00:00
LiveMint,65,Hidden cost of delaying investments: Starting SIPs late can kill crores from your portfolio,https://www.livemint.com/money/personal-finance/hidden-cost-of-delaying-investments-starting-sips-late-can-kill-crores-from-your-portfolio-11776477521791.html,2026-04-18T08:51:53+00:00
LiveMint,66,Why should you pay your credit card bill in full? Here's how banks calculate interest on outstanding amount,https://www.livemint.com/money/personal-finance/why-should-you-pay-your-credit-card-bill-in-full-heres-how-banks-calculate-interest-on-outstanding-amount-11776486823911.html,2026-04-18T08:51:53+00:00
LiveMint,67,"In the AI propaganda war, Iran is winning",https://www.livemint.com/technology/in-the-ai-propaganda-war-iran-is-winning-11776481031340.html,2026-04-18T08:51:53+00:00
LiveMint,68,White House chief of staff to meet with Anthropic CEO over its new AI technology,https://www.livemint.com/technology/white-house-chief-of-staff-to-meet-with-anthropic-ceo-over-its-new-ai-technology-11776451301214.html,2026-04-18T08:51:53+00:00
LiveMint,69,"Backup calling, direct voicemail features in smartphones originated in India: Samsung official",https://www.livemint.com/technology/backup-calling-direct-voicemail-features-in-smartphones-originated-in-india-samsung-official-11776433528319.html,2026-04-18T08:51:53+00:00
LiveMint,70,"Buybacks vs business: Wipro’s ₹15,000 cr payout leaves investors cold as revenue declines for third straight year",https://www.livemint.com/companies/wipro-buyback-revenue-decline-tech-spending-acquisitions-deal-pipeline-large-contracts-11776421808607.html,2026-04-18T08:51:53+00:00
LiveMint,71,Tesla is preparing to launch six-seater model Y variant in India,https://www.livemint.com/technology/tesla-is-preparing-to-launch-six-seater-model-y-variant-in-india-11776427906214.html,2026-04-18T08:51:53+00:00
LiveMint,72,Microsoft to replicate Azure's cloud business strategy of flexibility to win long-term AI deals with clients,https://www.livemint.com/technology/tech-news/microsoft-azure-strategy-flexibility-clients-ai-deals-cloud-business-11776412280955.html,2026-04-18T08:51:53+00:00
LiveMint,73,IPL 2026 Schedule,https://www.livemint.com/sports/cricket-news/ipl-schedule,2026-04-18T08:51:53+00:00
LiveMint,74,Orange Cap in IPL 2026,https://www.livemint.com/sports/cricket-news/ipl-orange-cap,2026-04-18T08:51:53+00:00
LiveMint,75,Purple Cap in IPL 2026,https://www.livemint.com/sports/cricket-news/ipl-purple-cap,2026-04-18T08:51:53+00:00
LiveMint,76,IPL 2026 Points Table,https://www.livemint.com/sports/cricket-news/ipl-points-table,2026-04-18T08:51:53+00:00
LiveMint,77,IFSC Code Finder,https://www.livemint.com/ifsc-code,2026-04-18T08:51:53+00:00
LiveMint,78,Income Tax Calculator,https://www.livemint.com/tools-calculators/income-tax-calculator,2026-04-18T08:51:53+00:00
LiveMint,79,Gold Rate Today,https://www.livemint.com/gold-prices,2026-04-18T08:51:53+00:00
LiveMint,80,Gold Rate in Delhi,https://www.livemint.com/gold-prices/delhi,2026-04-18T08:51:53+00:00
