source,rank,headline,link,collected_at_iso
Indian Express,1,Trending in India,https://indianexpress.com/section/trending/trending-in-india/,2026-07-23T06:29:28+00:00
Indian Express,2,This is Serious,https://indianexpress.com/section/trending/this-is-serious/,2026-07-23T06:29:28+00:00
Indian Express,3,Blue Tokai CJP protest,https://indianexpress.com/article/trending/trending-in-india/blue-tokai-janpath-cjp-protest-matt-chitharanjan-reaction-10799586/,2026-07-23T06:29:28+00:00
Indian Express,4,Leopard enters liquor store in Rajasthan,https://indianexpress.com/article/trending/trending-in-india/leopard-enters-liquor-store-in-rajasthan-attacks-salesman-10798785/,2026-07-23T06:29:28+00:00
Indian Express,5,Erling Haaland comments on Indian man's viral reel about weight loss,https://indianexpress.com/article/trending/trending-globally/erling-haaland-reacts-to-indian-video-accepts-weight-loss-challenge-10798622/,2026-07-23T06:29:28+00:00
Indian Express,6,"Top 10 best islands in the world: St. Lucia ranks at No. 1, Fiji closes top 10 list",https://indianexpress.com/article/trending/top-10-listing/top-10-best-islands-in-the-world-st-lucia-ranks-at-no-1-fiji-closes-top-10-list-10798438/,2026-07-23T06:29:28+00:00
Indian Express,7,Sridhar Vembu's comments on the CJP protest has sparked a political debate,https://indianexpress.com/article/trending/trending-in-india/sridhar-vembu-on-cjp-protest-s-gurumurthy-delhi-protests-10798391/,2026-07-23T06:29:28+00:00
Indian Express,8,Australian politician shouting at dog live TV,https://indianexpress.com/article/trending/trending-globally/barnaby-joyce-viral-video-dog-live-tv-interview-abc-news-10798275/,2026-07-23T06:29:28+00:00
Indian Express,9,MrBeast wedding photos have gone viral,https://indianexpress.com/article/trending/trending-globally/mrbeast-wedding-thea-booysen-necker-island-jimmy-donaldson-10797958/,2026-07-23T06:29:28+00:00
Indian Express,10,Pakistan cycle ambulance,https://indianexpress.com/article/trending/trending-in-india/pakistan-cycle-ambulance-karachi-rescue-1122-explained-10796921/,2026-07-23T06:29:28+00:00
Indian Express,11,"Top 10 World’s Cities Most at Risk from Extreme Heat: Al Basrah tops list, 3 Indian cities make it to top 10",https://indianexpress.com/article/trending/top-10-listing/top-10-worlds-cities-most-at-risk-from-extreme-heat-al-basrah-tops-list-3-indian-cities-make-it-to-top-10-10796844/,2026-07-23T06:29:28+00:00
Indian Express,12,Delhi Uber Driver,https://indianexpress.com/article/trending/trending-in-india/delhi-uber-driver-rs-80000-rental-income-heart-attack-inspiration-10796862/,2026-07-23T06:29:28+00:00
Indian Express,13,"Top 10 Oil Producing Countries in the World: USA leads, Kuwait closes list",https://indianexpress.com/article/trending/top-10-listing/top-10-oil-producing-countries-in-the-world-usa-leads-kuwait-closes-list-10796623/,2026-07-23T06:29:28+00:00
Indian Express,14,Cristiano Ronaldo Instagram like,https://indianexpress.com/article/trending/trending-globally/cristiano-ronaldo-instagram-like-argentina-fifa-controversy-10796469/,2026-07-23T06:29:28+00:00
Indian Express,15,Zomato delivery at CJP protest,https://indianexpress.com/article/trending/trending-in-india/zomato-delivery-cjp-protest-delhi-viral-video-10796250/,2026-07-23T06:29:28+00:00
Indian Express,16,Anand Mahindra Indonesian YouTube channel,https://indianexpress.com/article/trending/trending-in-india/anand-mahindra-shares-indonesian-neele-gagan-ke-tale-reggae-version-10795263/,2026-07-23T06:29:28+00:00
Indian Express,17,Rapido driver viral video,https://indianexpress.com/article/trending/trending-in-india/rapido-driver-viral-video-cjp-protest-jantar-mantar-10796128/,2026-07-23T06:29:28+00:00
Indian Express,18,"Keyne is one of Lamine Yamal’s two half-siblings, along with sister Baraa",https://indianexpress.com/article/trending/trending-globally/lamine-yamal-brother-keyne-spain-world-cup-celebration-viral-video-10795218/,2026-07-23T06:29:28+00:00
Indian Express,19,Russian woman pregnancy in India,https://indianexpress.com/article/trending/trending-in-india/russian-woman-pregnancy-in-india-cultural-differences-viral-video-10795012/,2026-07-23T06:29:28+00:00
Indian Express,20,Karnataka zip line accident video,https://indianexpress.com/article/trending/trending-in-india/karnataka-zipline-accident-tourist-falls-40-feet-sterling-river-resort-video-10794822/,2026-07-23T06:29:28+00:00
Indian Express,21,Donald Trump FIFA World Cup trophy ceremony video has gone viral,https://indianexpress.com/article/trending/trending-globally/donald-trump-booed-fifa-world-cup-trophy-ceremony-spain-video-viral-10794703/,2026-07-23T06:29:28+00:00
Indian Express,22,The video features calm waves washing over wide stretches of golden sand,https://indianexpress.com/article/trending/trending-in-india/juhu-beach-1939-photo-vintage-video-mumbai-pollution-debate-10794582/,2026-07-23T06:29:28+00:00
Indian Express,23,"Man risks life, swims 3 hours through floodwaters to rescue parents, they scold him",https://indianexpress.com/article/trending/trending-globally/china-floods-son-swims-hours-to-rescue-parents-guangxi-10794561/,2026-07-23T06:29:28+00:00
Indian Express,24,PV Sindhu Japan Open win,https://indianexpress.com/article/trending/trending-in-india/pv-sindhu-japan-open-win-anand-mahindra-jackie-shroff-pawan-kalyan-reactions-10793683/,2026-07-23T06:29:28+00:00
Indian Express,25,"Instead of riding past, he stops and asks, ""Ma'am, help chahiye?""",https://indianexpress.com/article/trending/trending-in-india/bilaspur-viral-video-biker-helps-woman-flooded-road-10793300/,2026-07-23T06:29:28+00:00
Indian Express,26,Sandra Lavie builds free school in India,https://indianexpress.com/article/trending/trending-in-india/sandra-lavie-switzerland-india-west-bengal-free-school-10792707/,2026-07-23T06:29:28+00:00
Indian Express,27,Indian in Japan viral video,https://indianexpress.com/article/trending/trending-in-india/no-weekend-calls-only-bonuses-indians-take-on-japan-work-culture-goes-viral-10792680/,2026-07-23T06:29:28+00:00
LiveMint,1,Kai Trump shares the diet behind her washboard abs,https://www.livemint.com/us/trending/kai-trumps-six-pack-abs-diet-and-workout-routine-revealed-what-donald-trumps-granddaughter-eats-every-day-11784746304648.html,2026-07-23T06:29:28+00:00
LiveMint,2,Quote of the day by Brian Tracy: ‘An attitude of positive expectation…',https://www.livemint.com/us/trending/quote-of-the-day-by-brian-tracy-an-attitude-of-positive-expectation-life-lessons-on-mindset-perseverance-11784619947513.html,2026-07-23T06:29:28+00:00
LiveMint,3,Quote of the day by Edmund Hillary: ‘No one remembers who climbed Mount…’,https://www.livemint.com/us/trending/quote-of-the-day-by-edmund-hillary-no-one-remembers-who-climbed-mount-everest-life-lessons-on-courage-11784531585658.html,2026-07-23T06:29:28+00:00
LiveMint,4,FIFA World Cup 1958 final jersey worn by Brazil icon Pele sells for $4.9 million,https://www.livemint.com/us/trending/fifa-world-cup-1958-final-jersey-worn-by-brazil-legend-pele-sells-for-a-whopping-4-9-million-at-auction-11784261503495.html,2026-07-23T06:29:28+00:00
LiveMint,5,Quote of the day by Sumner Redstone: 'Success is not built on success...',https://www.livemint.com/us/trending/quote-of-the-day-by-sumner-redstone-success-is-not-built-on-success-its-built-on-life-lesson-on-perseverance-11784100392152.html,2026-07-23T06:29:28+00:00
LiveMint,6,"Quote of the day by Bill Gates: ‘Success is a lousy teacher, it seduces…’",https://www.livemint.com/us/trending/quote-of-the-day-by-bill-gates-success-is-a-lousy-teacher-it-seduces-11783958000045.html,2026-07-23T06:29:28+00:00
LiveMint,7,"OTT releases this week: Jennifer Garner's The Five Star Weekend, and more",https://www.livemint.com/us/trending/us-ott-releases-this-week-jennifer-garners-the-five-star-weekend-the-man-will-burn-and-more-11783692043417.html,2026-07-23T06:29:28+00:00
LiveMint,8,Quote of the day by Gayle Forman: ‘Life might take you down different…’,https://www.livemint.com/us/trending/quote-of-the-day-by-gayle-forman-life-might-take-you-down-different-roads-why-choices-matter-more-than-circumstances-11783413351658.html,2026-07-23T06:29:28+00:00
LiveMint,9,"Quote of the day by Charles Schulz: ‘Learn from yesterday, live for today…’",https://www.livemint.com/us/trending/quote-of-the-day-by-charles-schulz-learn-from-yesterday-live-for-today-life-lessons-on-value-of-time-11783411939895.html,2026-07-23T06:29:28+00:00
LiveMint,10,Comedian Adam Sandler officiated Taylor Swift-Travis Kelce wedding,https://www.livemint.com/us/trending/comedian-adam-sandler-officiated-taylor-swift-travis-kelce-wedding-all-about-his-relationship-with-the-star-couple-11783129384586.html,2026-07-23T06:29:28+00:00
LiveMint,11,‘Just&t married’: Taylor Swift and Travis Kelce officially tie the knot,https://www.livemint.com/us/trending/justt-married-taylor-swift-and-travis-kelce-officially-married-at-madison-square-garden-11783122011843.html,2026-07-23T06:29:28+00:00
LiveMint,12,Quote of the day by Djokovic: ‘You have to consistently be successful to be…’,https://www.livemint.com/us/trending/quote-of-the-day-by-novak-djokovic-you-have-to-consistently-be-successful-to-be-one-of-the-top-players-11783074167321.html,2026-07-23T06:29:28+00:00
LiveMint,13,Quote of the day by Daniel J Boorstin: ‘The greatest enemy of knowledge is…’,https://www.livemint.com/us/trending/quote-of-the-day-by-daniel-j-boorstin-the-greatest-enemy-of-knowledge-is-not-ignorance-it-is-the-illusion-of-11783057446664.html,2026-07-23T06:29:28+00:00
LiveMint,14,"Quote of the day by Bruce Lee: ‘The successful warrior is the average man,…’",https://www.livemint.com/us/trending/quote-of-the-day-by-bruce-lee-the-successful-warrior-is-the-average-man-with-laser-like-focus-11783054961943.html,2026-07-23T06:29:28+00:00
LiveMint,15,Quote of the day by Lewis Hamilton: ‘You just need to be accepted for who you…’,https://www.livemint.com/us/trending/quote-of-the-day-by-lewis-hamilton-you-just-need-to-be-accepted-for-who-you-are-and-be-proud-of-11782988582326.html,2026-07-23T06:29:28+00:00
LiveMint,16,Quote of the day by Eric Thomas: ‘The difference between average and good…’,https://www.livemint.com/us/trending/quote-of-the-day-by-eric-thomas-the-difference-between-average-and-good-11782971253579.html,2026-07-23T06:29:28+00:00
LiveMint,17,Quote of the day by Jalal ad-Din Muhammad Rumi: ‘If you are irritated by…’,https://www.livemint.com/us/trending/quote-of-the-day-by-jalal-ad-din-muhammad-rumi-if-you-are-irritated-by-every-rub-11782904307985.html,2026-07-23T06:29:28+00:00
LiveMint,18,"Quote of the day by Seneca: ‘A gem cannot be polished without friction, nor a…’",https://www.livemint.com/us/trending/quote-of-the-day-by-seneca-a-gem-cannot-be-polished-without-friction-nor-a-11782899076299.html,2026-07-23T06:29:28+00:00
LiveMint,19,Strawberry Moon 2026: Everything to know about the June full moon,https://www.livemint.com/us/trending/full-strawberry-moon-2026-everything-to-know-about-the-june-full-moon-and-its-significance-11782480123886.html,2026-07-23T06:29:28+00:00
LiveMint,20,"The wait is over: Rockstar announces GTA VI price, pre-orders starts tomorrow",https://www.livemint.com/us/trending/the-wait-is-over-rockstar-announces-gta-vi-price-pre-orders-starts-tomorrow-heres-how-you-can-order-11782318796865.html,2026-07-23T06:29:28+00:00
LiveMint,21,"Amazon Prime Day 2026: Best deals under $100 on Fitbit, Kindle and more",https://www.livemint.com/us/trending/amazon-prime-day-2026-best-deals-under-100-on-fitbit-kindle-and-more-11782217189437.html,2026-07-23T06:29:28+00:00
LiveMint,22,Why was Alex Freeman's goal allowed to stand after VAR review in USA vs Australi,https://www.livemint.com/us/trending/alex-freeman-goal-allowed-to-stand-after-var-review-in-usa-vs-australia-fifa-world-cup-2026-match-11781900874288.html,2026-07-23T06:29:28+00:00
LiveMint,23,Christian Pulisic injury update: Will USMNT star play in Australia FIFA WC game?,https://www.livemint.com/us/christian-pulisic-injury-update-will-usmnt-star-play-in-australia-fifa-world-cup-2026-clash-check-playing-xi-11781890065629.html,2026-07-23T06:29:28+00:00
LiveMint,24,"This former welder turned millionaire overnight, thanks to SpaceX IPO",https://www.livemint.com/us/trending/this-former-welder-turned-millionaire-overnight-thanks-to-spacex-ipo-here-is-how-much-shares-he-owns-11781439252428.html,2026-07-23T06:29:28+00:00
LiveMint,25,Tyra Banks files defamation lawsuit against Netflix,https://www.livemint.com/us/trending/tyra-banks-sues-netflix-over-america-s-next-top-model-docuseries-alleging-defamation-and-manipulation-11781380081367.html,2026-07-23T06:29:28+00:00
LiveMint,26,Morgan Wallen cancels second Pittsburgh show over severe weather,https://www.livemint.com/us/trending/morgan-wallen-cancels-second-pittsburgh-concert-as-severe-weather-threatens-area-11780773856814.html,2026-07-23T06:29:28+00:00
LiveMint,27,National Donut Day: Here are the places offering free donuts in the US today,https://www.livemint.com/us/trending/national-donut-day-2026-here-are-the-places-offering-free-donuts-in-the-us-today-11780582955435.html,2026-07-23T06:29:28+00:00
LiveMint,28,BTS lead diverse lineup for 2026 iHeartRadio Music Festival,https://www.livemint.com/us/trending/bts-cardi-b-headline-star-studded-2026-iheartradio-music-festival-lineup-in-las-vegas-11780433121103.html,2026-07-23T06:29:28+00:00
LiveMint,29,McDonald's joins FIFA World Cup 2026 fever with limited-edition menu,https://www.livemint.com/us/trending/mcdonalds-joins-fifa-world-cup-2026-fever-with-limited-edition-menu-collectable-cups-and-toys-11780414027281.html,2026-07-23T06:29:28+00:00
LiveMint,30,Tom Holland credits Zendaya for inspiring new Bero shandy flavours,https://www.livemint.com/news/trends/tom-holland-credits-zendaya-for-inspiring-new-bero-non-alcoholic-flavours-she-didn-t-love-the-beers-we-have-on-sale-11780341907920.html,2026-07-23T06:29:28+00:00
LiveMint,31,Bret Michaels becomes fifth act to quit Trump fair,https://www.livemint.com/us/trending/bret-michaels-becomes-fifth-performer-to-withdraw-from-trump-linked-great-american-state-fair-amid-backlash-11780059673299.html,2026-07-23T06:29:28+00:00
LiveMint,32,Mystery bidder pays more than $9 million to meet Warren Buffett,https://www.livemint.com/us/trending/mystery-bidder-pays-more-than-9-million-to-meet-warren-buffett-steph-and-ayesha-curry-over-lunch-11779026671945.html,2026-07-23T06:29:28+00:00
LiveMint,33,Joel Embiid ruled out for Philadelphia 76ers Game 2 vs Knicks due to injury,https://www.livemint.com/us/trending/joel-embiid-ruled-out-for-philadelphia-76ers-game-2-vs-new-york-knicks-due-to-injury-11778089872415.html,2026-07-23T06:29:28+00:00
LiveMint,34,"Carlos Correa injury: Astros place star player on IL, recall Shay Whitcomb",https://www.livemint.com/us/trending/carlos-correa-injury-houston-astros-place-star-player-with-season-ending-left-ankle-injury-on-il-shay-whitcomb-mlb-11778085652310.html,2026-07-23T06:29:28+00:00
LiveMint,35,Bayern Munich vs PSG: Who will win UCL clash? AI predictions and more,https://www.livemint.com/us/trending/bayern-munich-vs-psg-predictions-champions-league-semifinal-lineups-live-streaming-ucl-202526-11778071490090.html,2026-07-23T06:29:28+00:00
LiveMint,36,Are celebs really skipping Met Gala because Jeff Bezos is funding it?,https://www.livemint.com/us/trending/met-gala-are-meryl-streep-zendaya-really-skipping-the-event-because-jeff-bezos-is-funding-it-here-s-the-truth-11777924588506.html,2026-07-23T06:29:28+00:00
LiveMint,37,Met Gala 2026 LIVE Update: Rihanna shines bright like a diamond after Beyonce,https://www.livemint.com/us/trending/met-gala-2026-live-updates-red-carpet-11777915596931.html,2026-07-23T06:29:28+00:00
LiveMint,38,F1: Kimi Antonelli wins 2026 Miami Grand Prix 2026,https://www.livemint.com/us/trending/kimi-antonelli-wins-miami-grand-prix-2026-secures-third-consecutive-f1-win-in-thrilling-race-formula-1-race-11777833243419.html,2026-07-23T06:29:28+00:00
LiveMint,39,Messi steals spotlight at 2026 F1 Miami Grand Prix with Mercedes Paddock visit,https://www.livemint.com/us/trending/lionel-messi-steals-spotlight-at-2026-f1-miami-grand-prix-with-mercedes-paddock-visit-11777828759020.html,2026-07-23T06:29:28+00:00
LiveMint,40,Mark to Market,https://www.livemint.com/market/mark-to-market,2026-07-23T06:29:28+00:00
LiveMint,41,Gold Price Today,https://www.livemint.com/gold-prices,2026-07-23T06:29:28+00:00
LiveMint,42,Silver Price Today,https://www.livemint.com/silver-prices,2026-07-23T06:29:28+00:00
LiveMint,43,Petrol price today,https://www.livemint.com/fuel-prices-petrol,2026-07-23T06:29:28+00:00
LiveMint,44,Diesel price today,https://www.livemint.com/fuel-prices-diesel,2026-07-23T06:29:28+00:00
LiveMint,45,Bajaj Auto shares hit a 52-week high for second consecutive session; can it rise further in the near term?,https://www.livemint.com/market/stock-market-news/bajaj-auto-shares-hit-a-52-week-high-for-second-consecutive-session-can-it-rise-further-in-the-near-term-11784785307225.html,2026-07-23T06:29:28+00:00
LiveMint,46,Asia Hedge Funds Hurt by July Selloff After Strong First Half,https://www.livemint.com/market/asia-hedge-funds-hurt-by-july-selloff-after-strong-first-half-11784787050569.html,2026-07-23T06:29:28+00:00
LiveMint,47,900% return in one year! Multibagger stock hits 5% upper circuit after strong Q1FY27 results,https://www.livemint.com/market/stock-market-news/900-return-in-one-year-multibagger-stock-hits-5-upper-circuit-after-strong-q1fy27-results-11784785661007.html,2026-07-23T06:29:28+00:00
LiveMint,48,Infosys Q1 results LIVE: Guidance cut likely for the IT major - Here's what brokerages expect?,https://www.livemint.com/market/stock-market-news/infosys-q1-results-live-infosys-results-infosys-q1-preview-infosys-share-it-stocks-nifty-it-22-july-2026-q1fy27-results-11784784629569.html,2026-07-23T06:29:28+00:00
LiveMint,49,"Gulf Lloyds IPO allotment date likely today. GMP, steps to check share allotment status online for SME IPO",https://www.livemint.com/market/ipo/gulf-lloyds-ipo-allotment-date-likely-today-gmp-steps-to-check-share-allotment-status-online-for-sme-ipo-11784784637110.html,2026-07-23T06:29:28+00:00
LiveMint,50,Philippine Peso Finds a Line in the Sand as Record Low Holds,https://www.livemint.com/market/philippine-peso-finds-a-line-in-the-sand-as-record-low-holds-11784785096281.html,2026-07-23T06:29:28+00:00
LiveMint,51,"'Fast-track courts won't fix paper leaks': CJP rebuffs PM Modi's announcement, reiterates Pradhan resignation demand",https://www.livemint.com/news/india/fasttrack-courts-wont-fix-paper-leaks-cjp-rebuffs-pm-modis-announcement-reiterates-pradhan-resignation-demand-11784786470152.html,2026-07-23T06:29:28+00:00
LiveMint,52,Mint explainer: can NITI Aayog's investment index reshape state competition?,https://www.livemint.com/news/niti-aayog-investment-friendliness-index-ifi-vietnam-pci-investment-climate-fdi-gujarat-maharashtra-pli-schemes-11784771917613.html,2026-07-23T06:29:28+00:00
LiveMint,53,"Physics Wallah CEO Alakh Pandey backs CJP protest, urges Centre to 'listen to students'",https://www.livemint.com/news/india/physics-wallah-ceo-alakh-pandey-backs-cjp-protest-urges-centre-to-listen-to-students-11784785702751.html,2026-07-23T06:29:28+00:00
LiveMint,54,"Assam floods: 41 dead, over 6.5 lakh affected as situation remains critical; IMD issues alert for next four days",https://www.livemint.com/news/india/assam-floods-41-dead-over-6-5-lakh-affected-as-situation-remains-critical-imd-issues-alert-for-next-four-days-11784783773623.html,2026-07-23T06:29:28+00:00
LiveMint,55,"In 1997, Dharmendra Pradhan, then an ABVP leader, led a student protest against paper leak in Odisha",https://www.livemint.com/news/india/in-1997-dharmendra-pradhan-then-an-abvp-leader-led-a-student-protest-against-paper-leak-in-odisha-11784783458417.html,2026-07-23T06:29:28+00:00
LiveMint,56,Indian-origin doctor Amish Shah wins Democratic congressional primary in Arizona: Who is he?,https://www.livemint.com/news/us-news/indianorigin-doctor-amish-shah-wins-democratic-congressional-primary-in-arizona-who-is-he-11784777749033.html,2026-07-23T06:29:28+00:00
LiveMint,57,"UCO Bank says Iran, Russia rupee trade channels remain open within sanctions",https://www.livemint.com/companies/news/uco-bank-says-iran-russia-rupee-trade-channels-remain-open-within-sanctions-ai-cybersecurity-digital-lending-11784779446635.html,2026-07-23T06:29:28+00:00
LiveMint,58,West Asia war pushes ONGC to plan India's first strategic gas reserve,https://www.livemint.com/companies/news/ongc-strategic-natural-gas-reserve-india-west-asia-war-lng-energy-security-11784718865508.html,2026-07-23T06:29:28+00:00
LiveMint,59,BusinessNext raises $40 million from ServiceNow for SEA and Australia expansion,https://www.livemint.com/companies/businessnext-raises-40-million-servicenow-sea-australia-expansion-11784718947770.html,2026-07-23T06:29:28+00:00
LiveMint,60,Probe stalls transfer of Ratan Tata’s Tata Sons shares to his foundations,https://www.livemint.com/companies/probe-stalls-transfer-of-ratan-tata-s-tata-sons-shares-to-his-foundations-11784725209306.html,2026-07-23T06:29:28+00:00
LiveMint,61,When pay ceiling catches up with IT firms' stock-rich CEOs,https://www.livemint.com/companies/when-pay-ceiling-catches-up-with-it-firms-stock-rich-ceos-11784720203623.html,2026-07-23T06:29:28+00:00
LiveMint,62,European Union gives its greenlight to Paramount and Warners mega merger with some conditions,https://www.livemint.com/companies/european-union-gives-its-greenlight-to-paramount-and-warners-mega-merger-with-some-conditions-11784754384871.html,2026-07-23T06:29:28+00:00
LiveMint,63,Ask Mint Money,https://www.livemint.com/money/ask-mint-money,2026-07-23T06:29:28+00:00
LiveMint,64,"Global diversification matters more than ever, says Marcellus' Saurabh Mukherjea",https://www.livemint.com/money/personal-finance/market-stock-market-news-saurabh-mukherjea-global-investing-india-portfolio-diversification-big-tech-gig-economy-rupee-11784777925983.html,2026-07-23T06:29:28+00:00
LiveMint,65,"CGHS pensioner card goes paperless via Bhavishya Portal, making healthcare access for retirees faster and simpler",https://www.livemint.com/money/personal-finance/cghs-pensioner-card-goes-paperless-via-bhavishya-portal-making-healthcare-access-for-retirees-faster-and-simpler-11784782315358.html,2026-07-23T06:29:28+00:00
LiveMint,66,Revised ITR cannot take away capital loss carry-forward if original return was filed on time: ITAT,https://www.livemint.com/money/personal-finance/revised-itr-cannot-take-away-capital-loss-carry-forward-if-original-return-was-filed-on-time-itat-11784783826176.html,2026-07-23T06:29:28+00:00
LiveMint,67,Pay income tax online: Here's everything you need to know about the 5 payment modes under the e-Pay Tax facility,https://www.livemint.com/money/personal-finance/pay-income-tax-online-heres-everything-you-need-to-know-about-the-5-payment-modes-under-the-e-pay-tax-facility-11784778275328.html,2026-07-23T06:29:28+00:00
LiveMint,68,"Gold, silver prices today, 23 July: Check retail rates of 24K, 22K gold, 999 silver in Delhi, Mumbai and Kolkata",https://www.livemint.com/money/personal-finance/gold-silver-prices-today-23-july-check-retail-rates-of-24k-22k-gold-999-silver-in-delhi-mumbai-and-kolkata-11784602864857.html,2026-07-23T06:29:28+00:00
LiveMint,69,NPS rule change: Pension funds liable for third-party lapses under new PFRDA rules,https://www.livemint.com/money/personal-finance/nps-rule-change-pension-funds-liable-for-third-party-lapses-under-new-pfrda-rules-11784778092260.html,2026-07-23T06:29:28+00:00
LiveMint,70,FIFA World Cup,https://www.livemint.com/sports/football-news/fifa-world-cup,2026-07-23T06:29:28+00:00
LiveMint,71,FIFA 2026 Schedule,https://www.livemint.com/sports/football-news/fifa-world-cup-schedule,2026-07-23T06:29:28+00:00
LiveMint,72,FIFA Points Table,https://www.livemint.com/sports/football-news/fifa-world-cup-points-table,2026-07-23T06:29:28+00:00
LiveMint,73,IFSC Code Finder,https://www.livemint.com/ifsc-code,2026-07-23T06:29:28+00:00
LiveMint,74,Income Tax Calculator,https://www.livemint.com/tools-calculators/income-tax-calculator,2026-07-23T06:29:28+00:00
LiveMint,75,Gold Rate in Delhi,https://www.livemint.com/gold-prices/delhi,2026-07-23T06:29:28+00:00
LiveMint,76,Gold Rate Hyderabad,https://www.livemint.com/gold-prices/hyderabad,2026-07-23T06:29:28+00:00
LiveMint,77,Silver Rate in Delhi,https://www.livemint.com/silver-prices/delhi,2026-07-23T06:29:28+00:00
LiveMint,78,Silver Rate in Bangalore,https://www.livemint.com/silver-prices/bangalore,2026-07-23T06:29:28+00:00
LiveMint,79,US Stock Market,https://www.livemint.com/market/us-market,2026-07-23T06:29:28+00:00
LiveMint,80,Terms of Use,https://www.livemint.com/terms-of-use,2026-07-23T06:29:28+00:00
LiveMint,81,Code of ethics,https://www.livemint.com/code-of-ethics,2026-07-23T06:29:28+00:00
LiveMint,82,Home Loan EMI Calculator,https://www.livemint.com/tools-calculators/home-loan-emi-calculator,2026-07-23T06:29:28+00:00
LiveMint,83,Car Loan EMI,https://www.livemint.com/tools-calculators/car-loan-calculator,2026-07-23T06:29:28+00:00
India Today,1,This Bengaluru cafe wants Rs 99 an hour if you plan to work there,https://www.indiatoday.in/trending-news/story/this-bengaluru-cafe-wants-rs-99-an-hour-if-you-plan-to-work-there-2954112-2026-07-23,2026-07-23T06:29:28+00:00
India Today,2,"Gurugram woman fired over email during medical leave, Reddit has one piece of advice",https://www.indiatoday.in/trending-news/story/gurugram-woman-fired-over-email-during-medical-leave-reddit-has-one-piece-of-advice-2953042-2026-07-22,2026-07-23T06:29:28+00:00
