source,rank,headline,link,collected_at_iso
LiveMint,82,Silver Rate in Delhi,https://www.livemint.com/silver-prices/delhi,2026-04-12T10:38:49+00:00
LiveMint,83,Silver Rate in Bangalore,https://www.livemint.com/silver-prices/bangalore,2026-04-12T10:38:49+00:00
LiveMint,84,US Stock Market,https://www.livemint.com/market/us-market,2026-04-12T10:38:49+00:00
LiveMint,85,Terms of Use,https://www.livemint.com/terms-of-use,2026-04-12T10:38:49+00:00
LiveMint,86,Code of ethics,https://www.livemint.com/code-of-ethics,2026-04-12T10:38:49+00:00
LiveMint,87,Stock Market Today,https://www.livemint.com/market/stock-market-news/stock-market-today-sensex-today-nifty-gold-rate-today-silver-rate-today-crude-oil-prices-us-iran-war-trump-7-april-2026-11775527434110.html,2026-04-12T10:38:49+00:00
LiveMint,88,MCX Gold Rate,https://www.livemint.com/market/market-stats/commodity-mcx-gold-price,2026-04-12T10:38:49+00:00
LiveMint,89,MCX Silver Price,https://www.livemint.com/market/market-stats/commodity-mcx-silver-price,2026-04-12T10:38:49+00:00
LiveMint,90,Gold Price in Mumbai,https://www.livemint.com/gold-prices/mumbai,2026-04-12T10:38:49+00:00
LiveMint,91,Gold Price in Chennai,https://www.livemint.com/gold-prices/chennai,2026-04-12T10:38:49+00:00
LiveMint,92,Gold Price in Kolkata,https://www.livemint.com/gold-prices/kolkata,2026-04-12T10:38:49+00:00
LiveMint,93,Silver Price in Mumbai,https://www.livemint.com/silver-prices/mumbai,2026-04-12T10:38:49+00:00
LiveMint,94,Silver Price in Chennai,https://www.livemint.com/silver-prices/chennai,2026-04-12T10:38:49+00:00
LiveMint,95,Silver Price in Hyderabad,https://www.livemint.com/silver-prices/hyderabad,2026-04-12T10:38:49+00:00
LiveMint,96,Silver Price in Kolkata,https://www.livemint.com/silver-prices/kolkata,2026-04-12T10:38:49+00:00
LiveMint,97,Latest News Today,https://www.livemint.com/news,2026-04-12T10:38:49+00:00
LiveMint,98,US News Today,https://www.livemint.com/news/us-news,2026-04-12T10:38:49+00:00
LiveMint,99,Top Company Leader,https://www.livemint.com/companies/people,2026-04-12T10:38:49+00:00
LiveMint,100,personal loan emi calculator,https://www.livemint.com/loans/personal-loan-emi-calculator,2026-04-12T10:38:49+00:00
LiveMint,101,Personal Loan Interest Rate,https://www.livemint.com/loans/personal-loan-interest-rates,2026-04-12T10:38:49+00:00
LiveMint,102,Personal Loan Eligibility,https://www.livemint.com/loans/personal-loan-eligibility,2026-04-12T10:38:49+00:00
LiveMint,103,Instant Personal Loan,https://www.livemint.com/loans/instant-personal-loan,2026-04-12T10:38:49+00:00
LiveMint,104,Home Loan EMI Calculator,https://www.livemint.com/tools-calculators/home-loan-emi-calculator,2026-04-12T10:38:49+00:00
LiveMint,105,Car Loan EMI,https://www.livemint.com/tools-calculators/car-loan-calculator,2026-04-12T10:38:49+00:00
India Today,1,Family gifts air cooler to house help. Her priceless reaction has internet's heart,https://www.indiatoday.in/trending-news/story/family-gifts-air-cooler-to-house-help-her-priceless-reaction-has-internets-heart-2895052-2026-04-12,2026-04-12T10:38:49+00:00
India Today,2,This video of a paralysed auto driver offering prayers will stop you mid-scroll,https://www.indiatoday.in/trending-news/story/this-video-of-a-paralysed-auto-driver-offering-prayers-will-stop-you-mid-scroll-2895049-2026-04-12,2026-04-12T10:38:49+00:00
India Today,3,Railway staff dumps garbage from moving train. Viral video raises questions,https://www.indiatoday.in/trending-news/story/railway-staff-dumps-garbage-from-moving-train-viral-video-raises-questions-2895036-2026-04-12,2026-04-12T10:38:49+00:00
India Today,4,Russian woman rates Indian cities on safety. Guess how much Delhi got,https://www.indiatoday.in/trending-news/story/russian-woman-rates-indian-cities-on-safety-in-viral-video-guess-how-much-delhi-got-2895029-2026-04-12,2026-04-12T10:38:49+00:00
India Today,5,Rs 500 for a day in Bengaluru? Woman's budget challenge goes viral,https://www.indiatoday.in/trending-news/story/rs-500-for-a-day-in-bengaluru-womans-budget-challenge-goes-viral-2895015-2026-04-12,2026-04-12T10:38:49+00:00
India Today,6,"Woman fired for 'no work' gets rehired to train replacements, internet goes huh?",https://www.indiatoday.in/trending-news/story/woman-fired-for-no-work-gets-rehired-to-train-replacements-internet-goes-huh-2894811-2026-04-11,2026-04-12T10:38:49+00:00
India Today,7,Mumbai woman shares how her boss sent mangoes after she mentioned missing them,https://www.indiatoday.in/trending-news/story/mumbai-woman-shares-how-her-boss-sent-mangoes-after-she-mentioned-missing-them-2894796-2026-04-11,2026-04-12T10:38:49+00:00
India Today,8,"Little girl proudly shows her medal on cycle ride with father, you'll definitely smile",https://www.indiatoday.in/trending-news/story/little-girl-proudly-shows-her-medal-on-cycle-ride-with-father-youll-definitely-smile-2894771-2026-04-11,2026-04-12T10:38:49+00:00
India Today,9,"Korean woman unboxes RCB jersey, her reaction is just too adorable to miss",https://www.indiatoday.in/trending-news/story/korean-woman-unboxes-rcb-jersey-her-reaction-is-just-too-adorable-to-miss-2894721-2026-04-11,2026-04-12T10:38:49+00:00
India Today,10,"Woman confronts roadside vendor over standing on books, internet weighs in",https://www.indiatoday.in/trending-news/story/woman-confronts-roadside-vendor-over-standing-on-books-internet-weighs-in-2894712-2026-04-11,2026-04-12T10:38:49+00:00
India Today,11,"Indian techie requests flexible hours to care for newborn, US manager's reply is viral",https://www.indiatoday.in/trending-news/story/indian-techie-requests-flexible-hours-to-care-for-newborn-us-managers-reply-is-viral-2894675-2026-04-11,2026-04-12T10:38:49+00:00
India Today,12,German man praises India's healthcare after getting free treatment for dog bite,https://www.indiatoday.in/trending-news/story/german-man-praises-indias-healthcare-after-getting-free-treatment-for-dog-bite-in-gujarat-2894660-2026-04-11,2026-04-12T10:38:49+00:00
India Today,13,"IndiGo pilot meets Kattappa actor at 35,000 ft, asks iconic Baahubali question",https://www.indiatoday.in/trending-news/story/indigo-pilot-meets-kattappa-actor-at-35000-ft-asks-iconic-baahubali-question-2894409-2026-04-10,2026-04-12T10:38:49+00:00
India Today,14,"Techie who started at Rs 10,000 as intern now runs company, shares salary growth",https://www.indiatoday.in/trending-news/story/techie-who-started-at-rs-10000-as-intern-now-runs-company-shares-salary-growth-2894465-2026-04-10,2026-04-12T10:38:49+00:00
India Today,15,Mumbai Police shares 'no 2.0 to life' message as BTS comeback trends online,https://www.indiatoday.in/trending-news/story/mumbai-police-shares-no-20-to-life-message-as-bts-comeback-trends-online-2894329-2026-04-10,2026-04-12T10:38:49+00:00
India Today,16,"Gurugram founder fires employee on WhatsApp, 'no-notice' policy sparks backlash",https://www.indiatoday.in/trending-news/story/gurugram-founder-fires-employee-on-whatsapp-no-notice-policy-sparks-backlash-2894320-2026-04-10,2026-04-12T10:38:49+00:00
India Today,17,Chopper nikal jaayega: Nagaland minister's reply to woman asking for pic is viral,https://www.indiatoday.in/trending-news/story/chopper-nikal-jaayega-nagaland-ministers-reply-to-woman-asking-for-pic-is-viral-2894304-2026-04-10,2026-04-12T10:38:49+00:00
India Today,18,Maharashtrian couple reveals baby's name Virat with RCB jersey. This is too adorable,https://www.indiatoday.in/trending-news/story/maharashtrian-couple-reveals-babys-name-virat-with-rcb-jersey-this-is-too-adorable-2894249-2026-04-10,2026-04-12T10:38:49+00:00
India Today,19,"Bangkok-India flight passengers leave mess behind, woman calls out their behaviour",https://www.indiatoday.in/trending-news/story/bangkok-india-flight-passengers-leave-mess-behind-woman-calls-out-their-behaviour-2894250-2026-04-10,2026-04-12T10:38:49+00:00
India Today,20,Ankur Warikoo's emotional post on watching parents grow old hits close to home,https://www.indiatoday.in/trending-news/story/ankur-warikoos-emotional-post-on-watching-parents-grow-old-hits-close-to-home-2894189-2026-04-10,2026-04-12T10:38:49+00:00
India Today,21,Applying to 100 jobs but no calls? You might be doomjobbing,https://www.indiatoday.in/jobs/story/applying-to-100-jobs-but-no-calls-you-might-be-doomjobbing-educ-2895051-2026-04-12,2026-04-12T10:38:49+00:00
India Today,22,"Pakistan to receive $5 bn aid from Saudi Arabia, Qatar amid debt pressure",https://www.indiatoday.in/world/story/pakistan-financial-aid-saudi-arabia-qatar-billion-uae-debt-repayment-imf-2895071-2026-04-12,2026-04-12T10:38:49+00:00
India Today,23,Yuvraj Singh leads condolences after Asha Bhosle dies: Her voice will live on forever,https://www.indiatoday.in/sports/cricket/story/asha-bhosle-dies-singer-aged-92-yuvraj-singh-condolences-2895065-2026-04-12,2026-04-12T10:38:49+00:00
TOI ETimes,1,Inside Rajasthan’s push for meaningful baby names: What you name your child matters more than you think,https://timesofindia.indiatimes.com/articleshow/130161079.cms,2026-04-12T10:38:49+00:00
TOI ETimes,2,"Quote of the day by Claude Shannon, the eponym of Claude AI: Information is the resolution of uncertainty",https://timesofindia.indiatimes.com/articleshow/130164653.cms,2026-04-12T10:38:49+00:00
TOI ETimes,3,Indian and American parenting and parental care: Viral social media clip highlights cultural differences,https://timesofindia.indiatimes.com/articleshow/130167532.cms,2026-04-12T10:38:49+00:00
TOI ETimes,4,When “first day of school” feels like a big goodbye: A viral video every parent will relate to,https://timesofindia.indiatimes.com/articleshow/130167652.cms,2026-04-12T10:38:49+00:00
TOI ETimes,5,Not your usual ID check: School video showcases students’ hilarious ‘ID card emotions’,https://timesofindia.indiatimes.com/articleshow/130169206.cms,2026-04-12T10:38:49+00:00
TOI ETimes,6,"This 15-second brain puzzle can sharpen your child’s focus, boost attention skills, and train the mind to notice the smallest details",https://timesofindia.indiatimes.com/articleshow/130169671.cms,2026-04-12T10:38:49+00:00
TOI ETimes,7,"Asha Bhosle passes away, her last rites to take place at Shivaji park on Monday",https://timesofindia.indiatimes.com/articleshow/130204689.cms,2026-04-12T10:38:49+00:00
TOI ETimes,8,Sukhbir: Started my journey singing Asha Ji’s songs - Exclusive,https://timesofindia.indiatimes.com/articleshow/130205206.cms,2026-04-12T10:38:49+00:00
TOI ETimes,9,Madhushree remembers Asha Bhosle,https://timesofindia.indiatimes.com/articleshow/130205839.cms,2026-04-12T10:38:49+00:00
TOI ETimes,10,'Dhurandhar 2' box office Day 25 [LIVE]: Film is set to cross Rs 1080 cr today,https://timesofindia.indiatimes.com/articleshow/130204010.cms,2026-04-12T10:38:49+00:00
TOI ETimes,11,Dacre Montgomery's OCD helped him shape a villain character,https://timesofindia.indiatimes.com/articleshow/130205576.cms,2026-04-12T10:38:49+00:00
TOI ETimes,12,"Who is Zanai Bhosle? All about Asha Bhosle's granddaughter, who will debut as Rani Sai Bhonsale opposite Rishab Shetty",https://timesofindia.indiatimes.com/articleshow/130205231.cms,2026-04-12T10:38:49+00:00
TOI ETimes,13,"PM Narendra Modi pays tribute to Asha Bhosle, deeply saddened by her demise: 'Will cherish the interactions I’ve had with her'",https://timesofindia.indiatimes.com/articleshow/130205071.cms,2026-04-12T10:38:49+00:00
TOI ETimes,14,"Asha Bhosle passes away at 92: Akshay Kumar, Karan Johar, Mamata Banerjee, Harsha Bhogle and fans pour heartfelt tributes for the legend",https://timesofindia.indiatimes.com/articleshow/130204985.cms,2026-04-12T10:38:49+00:00
TOI ETimes,15,Maharashtra CM Devendra Fadnavis mourns Asha Bhosle's demise: 'Bharat ke itihas mein joh unhone sangeet ki seva ki hai',https://timesofindia.indiatimes.com/articleshow/130204973.cms,2026-04-12T10:38:49+00:00
TOI ETimes,16,Neha Dhupia calls Aditya Dhar a 'pure genius' and Ranveer Singh's 'Dhurandhar' performance 'perfection no one else can do',https://timesofindia.indiatimes.com/articleshow/130204914.cms,2026-04-12T10:38:49+00:00
TOI ETimes,17,"‘Dhurandhar 2’ inches closer to Rs 1,700 cr worldwide in 24 days",https://timesofindia.indiatimes.com/articleshow/130201201.cms,2026-04-12T10:38:49+00:00
TOI ETimes,18,'Dhurandhar 2' box office day 24 [LIVE]: Film inches towards Rs 1100 cr,https://timesofindia.indiatimes.com/articleshow/130185972.cms,2026-04-12T10:38:49+00:00
TOI ETimes,19,‘Dhurandhar 2’ earns Rs 6.70 crore on day 23,https://timesofindia.indiatimes.com/articleshow/130182439.cms,2026-04-12T10:38:49+00:00
TOI ETimes,20,'Dhurandhar 2' box office collection day 23 [Live],https://timesofindia.indiatimes.com/articleshow/130165382.cms,2026-04-12T10:38:49+00:00
TOI ETimes,21,'Dhurandhar 2' FAILS to break 'Dhurandhar' week 3 record,https://timesofindia.indiatimes.com/articleshow/130156099.cms,2026-04-12T10:38:49+00:00
TOI ETimes,22,Animal Preview: Ranbir Kapoor and Sandeep Reddy Vanga are set to shake up the box office hierarchy,https://timesofindia.indiatimes.com/articleshow/105615612.cms,2026-04-12T10:38:49+00:00
TOI ETimes,23,Tu Jhoothi Main Makkaar,https://timesofindia.indiatimes.com/articleshow/98272134.cms,2026-04-12T10:38:49+00:00
TOI ETimes,24,Asha passes away at 92: Sudhanshu mourns her demise,https://timesofindia.indiatimes.com/articleshow/130205080.cms,2026-04-12T10:38:49+00:00
TOI ETimes,25,Splitsvilla X6: Gullu and Kaira become an ideal match,https://timesofindia.indiatimes.com/articleshow/130203955.cms,2026-04-12T10:38:49+00:00
TOI ETimes,26,"Bigg Boss 15’s Karan, Umar and Tejasswi reunite",https://timesofindia.indiatimes.com/articleshow/130203979.cms,2026-04-12T10:38:49+00:00
TOI ETimes,27,Divyanka Tripathi and Vivek Dahiya slam IVF claims,https://timesofindia.indiatimes.com/articleshow/130202805.cms,2026-04-12T10:38:49+00:00
TOI ETimes,28,Avinash-Eisha Roka: Ring photos ignite engagement buzz,https://timesofindia.indiatimes.com/articleshow/130201465.cms,2026-04-12T10:38:49+00:00
TOI ETimes,29,Tired of stuck zippers? This 10-second pencil trick is a total game-changer,https://timesofindia.indiatimes.com/articleshow/130184969.cms,2026-04-12T10:38:49+00:00
TOI ETimes,30,When Tom Cruise fell for Asha Bhosle’s Chicken Tikka Masala,https://timesofindia.indiatimes.com/articleshow/130205671.cms,2026-04-12T10:38:49+00:00
TOI ETimes,31,The clothespin guard: Your finger's best friend in the workshop,https://timesofindia.indiatimes.com/articleshow/130184967.cms,2026-04-12T10:38:49+00:00
TOI ETimes,32,How to stand out on dating apps,https://timesofindia.indiatimes.com/articleshow/130205070.cms,2026-04-12T10:38:49+00:00
TOI ETimes,33,Remembering Asha Bhosle’s timeless elegance,https://timesofindia.indiatimes.com/articleshow/130204988.cms,2026-04-12T10:38:49+00:00
TOI ETimes,34,Top 5 countries in the world with the highest GDP (2026); check India's position,https://timesofindia.indiatimes.com/articleshow/130205069.cms,2026-04-12T10:38:49+00:00
TOI ETimes,35,"No AC, no problem: These 5 easy home hacks actually work",https://timesofindia.indiatimes.com/articleshow/130205555.cms,2026-04-12T10:38:49+00:00
TOI ETimes,36,‘It breaks my heart every time’: Bengaluru dad torn between job and 1-year-old son,https://timesofindia.indiatimes.com/articleshow/130204512.cms,2026-04-12T10:38:49+00:00
TOI ETimes,37,Happy Baisakhi 2026: Significance of Baisakhi for Sikhs,https://timesofindia.indiatimes.com/articleshow/130203814.cms,2026-04-12T10:38:49+00:00
TOI ETimes,38,‘This is dangerous’: Internet reacts to toddler’s balcony jump video,https://timesofindia.indiatimes.com/articleshow/130202672.cms,2026-04-12T10:38:49+00:00
TOI ETimes,39,'Meaningless civic gesture': MAGA backlash erupts over Swami Vivekananda's statue in Seattle,https://timesofindia.indiatimes.com/articleshow/130205578.cms,2026-04-12T10:38:49+00:00
TOI ETimes,40,Offset discharged from hospital post shooting incident,https://timesofindia.indiatimes.com/articleshow/130182642.cms,2026-04-12T10:38:49+00:00
TOI ETimes,41,BTS on early struggles: 'We were really in danger',https://timesofindia.indiatimes.com/articleshow/130128930.cms,2026-04-12T10:38:49+00:00
TOI ETimes,42,Xavier Trudeau talks about bond with Katy Perry,https://timesofindia.indiatimes.com/articleshow/130105009.cms,2026-04-12T10:38:49+00:00
TOI ETimes,43,Sabrina Carpenter reflects on working with her older sister,https://timesofindia.indiatimes.com/articleshow/130102865.cms,2026-04-12T10:38:49+00:00
TOI ETimes,44,Who is Ray Stevens?,https://timesofindia.indiatimes.com/articleshow/130102807.cms,2026-04-12T10:38:49+00:00
TOI ETimes,45,NASA replies to Travis Kelce’s old tweet,https://timesofindia.indiatimes.com/articleshow/130102760.cms,2026-04-12T10:38:49+00:00
TOI ETimes,46,Beyond Ebooks: The charm of bookstores endures,https://timesofindia.indiatimes.com/articleshow/101098088.cms,2026-04-12T10:38:49+00:00
TOI ETimes,47,It’s a curtain call: Sania Mirza bids adieu to tennis with ‘happy tears’,https://timesofindia.indiatimes.com/articleshow/98440670.cms,2026-04-12T10:38:49+00:00
TOI ETimes,48,A magical makeover for 17th Century stepwell: From neglected ruins to a glorious piece of history,https://timesofindia.indiatimes.com/articleshow/96557955.cms,2026-04-12T10:38:49+00:00
TOI ETimes,49,The city comes alive with Christmas fervour,https://timesofindia.indiatimes.com/articleshow/96406573.cms,2026-04-12T10:38:49+00:00
TOI ETimes,50,#BringRioHome: Pet parents launch search to find their kidnapped cat,https://timesofindia.indiatimes.com/articleshow/96334809.cms,2026-04-12T10:38:49+00:00
TOI ETimes,51,Adil Hussain’s 'Mercy' release date OUT: Film's first look to be attached with Ranveer Singh's 'Dhurandhar: The Revenge',https://timesofindia.indiatimes.com/articleshow/129843424.cms,2026-04-12T10:38:49+00:00
TOI ETimes,52,It’s the best time to be doing theatre: Juhi Babbar Soni,https://timesofindia.indiatimes.com/articleshow/129826631.cms,2026-04-12T10:38:49+00:00
TOI ETimes,53,"Anu Malik steps into theatre with Anupam Kher’s play, Calls it his most exciting challenge yet",https://timesofindia.indiatimes.com/articleshow/129729335.cms,2026-04-12T10:38:49+00:00
TOI ETimes,54,'Wicked' musical director John Stefaniuk on live music on the stage: 'It is so exciting to hear the orchestra whisk us away',https://timesofindia.indiatimes.com/articleshow/129610267.cms,2026-04-12T10:38:49+00:00
TOI ETimes,55,"'Wicked' stars Rebekah Lowings and Eve Shanu-Wilson on Elphaba-Glinda's bond: 'Friends challenge you, not just cheer you on'",https://timesofindia.indiatimes.com/articleshow/129607673.cms,2026-04-12T10:38:49+00:00
TOI ETimes,56,"Vijay Crishna, Shah Rukh Khan’s on-screen father in ‘Devdas,’ passes away at 81: Tributes pour in for theatre stalwart",https://timesofindia.indiatimes.com/articleshow/129016007.cms,2026-04-12T10:38:49+00:00
TOI ETimes,57,Raj Kundra and Shilpa Shetty's 15th Wedding Anniversary,https://timesofindia.indiatimes.com/articleshow/115563990.cms,2026-04-12T10:38:49+00:00
TOI ETimes,58,​Bigg Boss winners list from season 1 to 17​,https://timesofindia.indiatimes.com/articleshow/114277426.cms,2026-04-12T10:38:49+00:00
TOI ETimes,59,​Discover the bird with a prehistoric roar​,https://timesofindia.indiatimes.com/articleshow/114244474.cms,2026-04-12T10:38:49+00:00
TOI ETimes,60,Dia Mirza's ethnic wear,https://timesofindia.indiatimes.com/articleshow/114243410.cms,2026-04-12T10:38:49+00:00
TOI ETimes,61,​Incredible facts about ants you won’t believe​,https://timesofindia.indiatimes.com/articleshow/114243248.cms,2026-04-12T10:38:49+00:00
TOI ETimes,62,'Bigg Boss Marathi 5' nears grand finale​,https://timesofindia.indiatimes.com/articleshow/113936459.cms,2026-04-12T10:38:49+00:00
TOI ETimes,63,'Very isolating': Elon Musk's daughter Vivian Wilson opens up about painful childhood with billionaire dad,https://timesofindia.indiatimes.com/articleshow/130204255.cms,2026-04-12T10:38:49+00:00
TOI ETimes,64,'Skin room' trend from Wuthering Heights: Is it too intimate for your home?,https://timesofindia.indiatimes.com/articleshow/130190038.cms,2026-04-12T10:38:49+00:00
TOI ETimes,65,Optical illusion: Only 1 in 20 can crack this! Can you spot all 4 hidden animals in 15 seconds?,https://timesofindia.indiatimes.com/articleshow/130190271.cms,2026-04-12T10:38:49+00:00
TOI ETimes,66,Arriving on a horse for your baraat? Shantanu Naidu's viral video raises questions about animal cruelty in Indian weddings,https://timesofindia.indiatimes.com/articleshow/130189433.cms,2026-04-12T10:38:49+00:00
TOI ETimes,67,14-year-old boy selling postcards outside Angkor Wat who spoke 12 languages is now living an entirely different life,https://timesofindia.indiatimes.com/articleshow/130197303.cms,2026-04-12T10:38:49+00:00
TOI ETimes,68,Indian-origin MBA student Anaheez Patel breaks silence after viral clash with billionaire Nikhil Kamath: 'I grew up with privilege...',https://timesofindia.indiatimes.com/articleshow/130193502.cms,2026-04-12T10:38:49+00:00
TOI ETimes,69,Who was Sawai Madho Singh II? The Maharaja who carried his own water to the United Kingdom in the world's largest silverware,https://timesofindia.indiatimes.com/articleshow/130190590.cms,2026-04-12T10:38:49+00:00
TOI ETimes,70,"Which Raja Ravi Varma painting is now India’s most expensive ever, and why can’t it leave the country?",https://timesofindia.indiatimes.com/articleshow/130188686.cms,2026-04-12T10:38:49+00:00
TOI ETimes,71,"The Sahara desert was once green and full of lakes and rivers: Cave reveals secrets from 8,000 years ago!",https://timesofindia.indiatimes.com/articleshow/130188418.cms,2026-04-12T10:38:49+00:00
TOI ETimes,72,What is the viral 'anxiety bag' and how it’s helping stressed Gen Z stay calm?,https://timesofindia.indiatimes.com/articleshow/130186848.cms,2026-04-12T10:38:49+00:00
TOI ETimes,73,"ChatGPT’s Sam Altman home attacked with Molotov cocktail: CEO shares family photo, says, “I love them more than anything”",https://timesofindia.indiatimes.com/articleshow/130186660.cms,2026-04-12T10:38:49+00:00
TOI ETimes,74,What is Amanda Ungaro's link to Melania Trump? Meet the Brazilian model who has a connection with Epstein and claims to 'expose' everything she knows about the US First Lady,https://timesofindia.indiatimes.com/articleshow/130184673.cms,2026-04-12T10:38:49+00:00
TOI ETimes,75,"Who is Doreen Romel Shamow? ""Iraq's power queen"" and volleyball player going viral online for her adorable looks",https://timesofindia.indiatimes.com/articleshow/130176488.cms,2026-04-12T10:38:49+00:00
TOI ETimes,76,"Meet Nathan Byrd: The 18-year-old who dashed into a smoke-filled home, saved family and a dog",https://timesofindia.indiatimes.com/articleshow/130175208.cms,2026-04-12T10:38:49+00:00
TOI ETimes,77,Rare solar eclipse spotted on the never-before-seen side of the Moon: What unique phenomenon did Artemis II astronauts observe during their flyby beyond the Moon?,https://timesofindia.indiatimes.com/articleshow/130174023.cms,2026-04-12T10:38:49+00:00
TOI ETimes,78,What is Buzz Lightyear’s Space Ranger Spin? Iconic 90s Disney ride reopens with a facelift before Toy Story 5 release,https://timesofindia.indiatimes.com/articleshow/130173849.cms,2026-04-12T10:38:49+00:00
TOI ETimes,79,"He was 229 kg, his friend sent him fat-shaming texts for weeks, then he lost 130 kg",https://timesofindia.indiatimes.com/articleshow/130170915.cms,2026-04-12T10:38:49+00:00
TOI ETimes,80,Who is Jason Howe? The 26-year-old high school coach accused of assault after student’s brave complaint,https://timesofindia.indiatimes.com/articleshow/130170573.cms,2026-04-12T10:38:49+00:00
TOI ETimes,81,"Who is Rao Inderjeet Yadav? From luxury lifestyle posts to Dubai arrest claim, what we know so far",https://timesofindia.indiatimes.com/articleshow/130165704.cms,2026-04-12T10:38:49+00:00
TOI ETimes,82,"Watch here: 11,000 litres of milk poured into Narmada river during MP temple ritual, video sparks debate",https://timesofindia.indiatimes.com/articleshow/130163631.cms,2026-04-12T10:38:49+00:00
TOI ETimes,83,Watch here: Cockroach in biryani? Birthday celebration at Barbeque Nation Gorakhpur sparks outrage,https://timesofindia.indiatimes.com/articleshow/130163142.cms,2026-04-12T10:38:49+00:00
TOI ETimes,84,"'Colourist, classist, garbage': Hollywood actresses Maitreyi Ramakrishnan and Supriya Ganesh hit back at 'maid phenotype' labels online",https://timesofindia.indiatimes.com/articleshow/130160652.cms,2026-04-12T10:38:49+00:00
TOI ETimes,85,What is ‘MMIWG2SLGBTQQIA+’? Canadian MP’s remark goes viral; Elon Musk reacts,https://timesofindia.indiatimes.com/articleshow/130160287.cms,2026-04-12T10:38:49+00:00
TOI ETimes,86,‘I have blacklisted your company’: Job seeker’s shocking reply leaves recruiter speechless,https://timesofindia.indiatimes.com/articleshow/130158695.cms,2026-04-12T10:38:49+00:00
TOI ETimes,87,Peaky Blinders: Uncovering the truth behind Tommy Shelby’s empire; what’s real and what’s fiction?,https://timesofindia.indiatimes.com/articleshow/130152544.cms,2026-04-12T10:38:49+00:00
TOI ETimes,88,Watch Noida shocker: Dog tied and thrashed on balcony; pet rescued after video goes viral,https://timesofindia.indiatimes.com/articleshow/130152017.cms,2026-04-12T10:38:49+00:00
TOI ETimes,89,Who is Venkatraman Ramakrishnan? The scientist who could not make it to IITs but won the Nobel Prize and Padma Vibhushan,https://timesofindia.indiatimes.com/articleshow/130175981.cms,2026-04-12T10:38:49+00:00
TOI ETimes,90,Major update in fatal MRI incident: Lawsuit filed after man gets pulled into machine with metal chain,https://timesofindia.indiatimes.com/articleshow/130147240.cms,2026-04-12T10:38:49+00:00
