source,rank,headline,link,collected_at_iso
LiveMint,84,US Stock Market,https://www.livemint.com/market/us-market,2026-05-15T22:54:00+00:00
LiveMint,85,Terms of Use,https://www.livemint.com/terms-of-use,2026-05-15T22:54:00+00:00
LiveMint,86,Code of ethics,https://www.livemint.com/code-of-ethics,2026-05-15T22:54:00+00:00
LiveMint,87,CBSE Class 12 Result 2026,https://www.livemint.com/education/cbse-class-12th-result-2026-live-results-to-be-out-at-cbseresults-nic-in-today-heres-how-to-check-score-11778633818664.html,2026-05-15T22:54:00+00:00
LiveMint,88,MCX Gold Rate,https://www.livemint.com/market/market-stats/commodity-mcx-gold-price,2026-05-15T22:54:00+00:00
LiveMint,89,MCX Silver Price,https://www.livemint.com/market/market-stats/commodity-mcx-silver-price,2026-05-15T22:54:00+00:00
LiveMint,90,Gold Price in Mumbai,https://www.livemint.com/gold-prices/mumbai,2026-05-15T22:54:00+00:00
LiveMint,91,Gold Price in Chennai,https://www.livemint.com/gold-prices/chennai,2026-05-15T22:54:00+00:00
LiveMint,92,Gold Price in Kolkata,https://www.livemint.com/gold-prices/kolkata,2026-05-15T22:54:00+00:00
LiveMint,93,Silver Price in Mumbai,https://www.livemint.com/silver-prices/mumbai,2026-05-15T22:54:00+00:00
LiveMint,94,Silver Price in Chennai,https://www.livemint.com/silver-prices/chennai,2026-05-15T22:54:00+00:00
LiveMint,95,Silver Price in Hyderabad,https://www.livemint.com/silver-prices/hyderabad,2026-05-15T22:54:00+00:00
LiveMint,96,Silver Price in Kolkata,https://www.livemint.com/silver-prices/kolkata,2026-05-15T22:54:00+00:00
LiveMint,97,Latest News Today,https://www.livemint.com/news,2026-05-15T22:54:00+00:00
LiveMint,98,US News Today,https://www.livemint.com/news/us-news,2026-05-15T22:54:00+00:00
LiveMint,99,Top Company Leader,https://www.livemint.com/companies/people,2026-05-15T22:54:00+00:00
LiveMint,100,personal loan emi calculator,https://www.livemint.com/loans/personal-loan-emi-calculator,2026-05-15T22:54:00+00:00
LiveMint,101,Personal Loan Interest Rate,https://www.livemint.com/loans/personal-loan-interest-rates,2026-05-15T22:54:00+00:00
LiveMint,102,Personal Loan Eligibility,https://www.livemint.com/loans/personal-loan-eligibility,2026-05-15T22:54:00+00:00
LiveMint,103,Instant Personal Loan,https://www.livemint.com/loans/instant-personal-loan,2026-05-15T22:54:00+00:00
LiveMint,104,Home Loan EMI Calculator,https://www.livemint.com/tools-calculators/home-loan-emi-calculator,2026-05-15T22:54:00+00:00
LiveMint,105,Car Loan EMI,https://www.livemint.com/tools-calculators/car-loan-calculator,2026-05-15T22:54:00+00:00
India Today,1,"Man meets ex-manager after 16 years, asks him one question that leaves him speechless",https://www.indiatoday.in/trending-news/story/man-meets-ex-manager-after-16-years-asks-him-one-question-that-leaves-him-speechless-2912342-2026-05-15,2026-05-15T22:54:00+00:00
India Today,2,'India's only ape' species uses bridge to cross rail tracks in Assam. Watch,https://www.indiatoday.in/trending-news/story/indias-only-ape-species-uses-bridge-to-cross-rail-tracks-in-assam-watch-2912395-2026-05-15,2026-05-15T22:54:00+00:00
India Today,3,NRI's reply to American colleague's 'Does India have elections' question is viral,https://www.indiatoday.in/trending-news/story/nris-reply-to-american-colleagues-does-india-have-elections-question-is-viral-2912288-2026-05-15,2026-05-15T22:54:00+00:00
India Today,4,Maharashtra family shows off daughter's 90% in Class 12 with Bhagam Bhag dance,https://www.indiatoday.in/trending-news/story/maharashtra-family-shows-off-daughters-90-in-class-12-with-bhagam-bhag-dance-2912279-2026-05-15,2026-05-15T22:54:00+00:00
India Today,5,"CBSE Class 12 student gets 57.4%, father smashes laptop, makes him sleep on floor",https://www.indiatoday.in/trending-news/story/cbse-class-12-student-gets-574-father-smashes-laptop-makes-him-sleep-on-floor-2912207-2026-05-15,2026-05-15T22:54:00+00:00
India Today,6,Gujarat bhajan singer buried under cash as devotees empty bags of money on stage,https://www.indiatoday.in/trending-news/story/gujarat-bhajan-singer-buried-under-cash-as-devotees-empty-bags-of-money-on-stage-2912157-2026-05-15,2026-05-15T22:54:00+00:00
India Today,7,"Man drops gold ring in train toilet, railway staff recover it from filthy drain",https://www.indiatoday.in/trending-news/story/passenger-drops-gold-ring-in-train-toilet-ahmedabad-railway-staff-recover-it-from-filthy-drain-2912146-2026-05-15,2026-05-15T22:54:00+00:00
India Today,8,"Ludhiana brothers surprise sister with brand new house, her reaction can't be missed",https://www.indiatoday.in/trending-news/story/ludhiana-brothers-surprise-sister-with-brand-new-house-her-reaction-cant-be-missed-2912133-2026-05-15,2026-05-15T22:54:00+00:00
India Today,9,Job applicant blasts 'Indian recruitment circus' after HR's immediate joining ordeal,https://www.indiatoday.in/trending-news/story/job-applicant-blasts-indian-recruitment-circus-after-hr-immediate-joining-ordeal-2912100-2026-05-15,2026-05-15T22:54:00+00:00
India Today,10,Indonesian woman's filmy dupatta moment with Delhi man makes 52 million smile,https://www.indiatoday.in/trending-news/story/indonesian-woman-filmy-dupatta-moment-with-delhi-man-at-new-delhi-railway-station-makes-52-million-smile-2912059-2026-05-15,2026-05-15T22:54:00+00:00
India Today,11,"Philippines resort guests thought toilet was blocked, then a king cobra showed up",https://www.indiatoday.in/trending-news/story/philippines-resort-guests-thought-toilet-was-blocked-then-a-king-cobra-showed-up-2912022-2026-05-15,2026-05-15T22:54:00+00:00
India Today,12,"Indian woman silently records relatives pressuring her to marry at 25, many relate",https://www.indiatoday.in/trending-news/story/indian-woman-silently-records-relatives-pressuring-her-to-marry-at-25-many-relate-2911837-2026-05-14,2026-05-15T22:54:00+00:00
India Today,13,Mumbai family celebrates son's 55% exam results with marksheet-themed cake,https://www.indiatoday.in/trending-news/story/mumbai-family-celebrates-son-55-exam-results-with-marksheet-themed-cake-2911676-2026-05-14,2026-05-15T22:54:00+00:00
India Today,14,Man uses AI and a water gun to win the balcony war with pigeons,https://www.indiatoday.in/trending-news/story/man-uses-ai-and-a-water-gun-to-win-the-balcony-war-with-pigeons-2911653-2026-05-14,2026-05-15T22:54:00+00:00
India Today,15,"Woman gets halwa puri 'elite combo' meal on Air India flight to Bali, shares post",https://www.indiatoday.in/trending-news/story/woman-gets-halwa-puri-elite-combo-meal-on-air-india-flight-to-bali-shares-post-2911620-2026-05-14,2026-05-15T22:54:00+00:00
India Today,16,Traumatised: Indian woman recounts humiliating ordeal from airport in Laos,https://www.indiatoday.in/trending-news/story/indian-woman-recounts-humiliating-ordeal-from-airport-in-laos-2911484-2026-05-14,2026-05-15T22:54:00+00:00
India Today,17,"Man finds 'Click Buddy' at Indian wedding, a one-stop solution to Insta-worthy clicks",https://www.indiatoday.in/trending-news/story/man-finds-click-buddy-at-indian-wedding-a-one-stop-solution-to-insta-worthy-clicks-2911599-2026-05-14,2026-05-15T22:54:00+00:00
India Today,18,Shaadi.com's Anupam Mittal makes Wednesdays WFH days after PM Modi's appeal,https://www.indiatoday.in/trending-news/story/shaadicom-anupam-mittal-makes-wednesdays-wfh-days-after-pm-modi-appeal-2911525-2026-05-14,2026-05-15T22:54:00+00:00
India Today,19,"Pune woman receives late-night texts from restaurant staff, management fires him",https://www.indiatoday.in/trending-news/story/pune-woman-says-staff-member-used-qr-menu-data-to-send-late-night-texts-2911463-2026-05-14,2026-05-15T22:54:00+00:00
India Today,20,Uber CEO picks Delhi metro over road travel during India visit,https://www.indiatoday.in/trending-news/story/uber-ceo-picks-delhi-metro-over-roads-during-india-visit-calls-it-fast-reliable-2911410-2026-05-14,2026-05-15T22:54:00+00:00
India Today,21,"Trump says patience with Iran is running out, insists he didn’t ask China for favors",https://www.indiatoday.in/world/story/donald-trump-says-patience-with-iran-is-running-out-insists-he-didnt-ask-china-for-favors-2912570-2026-05-16,2026-05-15T22:54:00+00:00
India Today,22,Netherlands welcomes PM Modi on second leg of five-nation tour,https://www.indiatoday.in/india/story/pm-modi-arrives-in-netherlands-to-strengthen-trade-and-strategic-ties-2912569-2026-05-16,2026-05-15T22:54:00+00:00
India Today,23,US-brokered Israel-Lebanon talks lead to 45-day ceasefire extension,https://www.indiatoday.in/world/story/israel-lebanon-extend-ceasefire-by-45-days-after-washington-talks-2912568-2026-05-16,2026-05-15T22:54:00+00:00
India Today,24,"Man jumps into massive cauldron inside Ajmer Sharif dargah, chaos follows",https://www.indiatoday.in/trending-news/story/man-jumps-into-massive-cauldron-inside-ajmer-sharif-dargah-chaos-follows-2909870-2026-05-11,2026-05-15T22:54:00+00:00
India Today,25,"Beating the NEET leak blues, one study hour, mock test at a time",https://www.indiatoday.in/india-today-insight/story/beating-the-neet-leak-blues-one-study-hour-mock-test-at-a-time-2912408-2026-05-16,2026-05-15T22:54:00+00:00
India Today,26,Elderly man wins over internet with kind gesture towards Shahid Kapoor. Watch,https://www.indiatoday.in/movies/celebrities/story/elderly-man-wins-over-internet-with-kind-gesture-towards-shahid-kapoor-watch-2908796-2026-05-08,2026-05-15T22:54:00+00:00
TOI ETimes,1,Hyderabad-based Amazon employee shares what not to say at work,https://timesofindia.indiatimes.com/articleshow/130726842.cms,2026-05-15T22:54:00+00:00
TOI ETimes,2,Salad topper recalled over salmonella risk,https://timesofindia.indiatimes.com/articleshow/130458722.cms,2026-05-15T22:54:00+00:00
TOI ETimes,3,Rebel Wilson weight loss: How she lost 36 kgs without extreme dieting - Ozempic or lifestyle?,https://timesofindia.indiatimes.com/articleshow/130457577.cms,2026-05-15T22:54:00+00:00
TOI ETimes,4,Viral: India-Australia work-life comparison sparks debate on ‘hustle culture’,https://timesofindia.indiatimes.com/articleshow/130456543.cms,2026-05-15T22:54:00+00:00
TOI ETimes,5,What is the meaning of Indian summer in the UK?,https://timesofindia.indiatimes.com/articleshow/130436405.cms,2026-05-15T22:54:00+00:00
TOI ETimes,6,This sympathetic syndrome makes Fathers feel pregnant,https://timesofindia.indiatimes.com/articleshow/130451612.cms,2026-05-15T22:54:00+00:00
TOI ETimes,7,Amjad Khan’s son reveals he auditioned for major role in Dhurandhar,https://timesofindia.indiatimes.com/articleshow/131129750.cms,2026-05-15T22:54:00+00:00
TOI ETimes,8,Salman Khan: 'I have never read a script in my life',https://timesofindia.indiatimes.com/articleshow/131127847.cms,2026-05-15T22:54:00+00:00
TOI ETimes,9,Jyotika recalls leaving Bollywood after debut with Akshaye failed,https://timesofindia.indiatimes.com/articleshow/131127864.cms,2026-05-15T22:54:00+00:00
TOI ETimes,10,John Travolta wins honorary Palme d'Or win - WATCH,https://timesofindia.indiatimes.com/articleshow/131127574.cms,2026-05-15T22:54:00+00:00
TOI ETimes,11,Aalim refuses to work with celebs whose managers ‘mistreat’ them,https://timesofindia.indiatimes.com/articleshow/131127535.cms,2026-05-15T22:54:00+00:00
TOI ETimes,12,Amjad Khan’s son Shadaab: ‘Big producers exploited strugglers',https://timesofindia.indiatimes.com/articleshow/131127356.cms,2026-05-15T22:54:00+00:00
TOI ETimes,13,Celina Jaitly pens emotional note for Preity Zinta amid domestic violence case against husband Peter Haag: 'Biggest lights in my life',https://timesofindia.indiatimes.com/articleshow/131124036.cms,2026-05-15T22:54:00+00:00
TOI ETimes,14,'Raja Shivaji' becomes second-highest grossing Marathi film,https://timesofindia.indiatimes.com/articleshow/131106085.cms,2026-05-15T22:54:00+00:00
TOI ETimes,15,"'Dhurandhar 2' BO day 57 [LIVE]: Ranveer Singh film nets Rs. 1,144.56 crore",https://timesofindia.indiatimes.com/articleshow/131088366.cms,2026-05-15T22:54:00+00:00
TOI ETimes,16,'Raja Shivaji' marches towards the Rs 90 crore mark in its second week,https://timesofindia.indiatimes.com/articleshow/131080363.cms,2026-05-15T22:54:00+00:00
TOI ETimes,17,'Dhurandhar 2' adds Rs 0.37 crore to the tally amid OTT release buzz,https://timesofindia.indiatimes.com/articleshow/131080096.cms,2026-05-15T22:54:00+00:00
TOI ETimes,18,'Dhurandhar 2' BO day 56 [LIVE]: Ranveer Singh film nets Rs 1144.21 crore on 8th Wednesday,https://timesofindia.indiatimes.com/articleshow/131044710.cms,2026-05-15T22:54:00+00:00
TOI ETimes,19,"'Dhurandhar 2' nears Rs 1,800 cr mark ahead of OTT debut",https://timesofindia.indiatimes.com/articleshow/131052068.cms,2026-05-15T22:54:00+00:00
TOI ETimes,20,Animal Preview: Ranbir Kapoor and Sandeep Reddy Vanga are set to shake up the box office hierarchy,https://timesofindia.indiatimes.com/articleshow/105615612.cms,2026-05-15T22:54:00+00:00
TOI ETimes,21,Tu Jhoothi Main Makkaar,https://timesofindia.indiatimes.com/articleshow/98272134.cms,2026-05-15T22:54:00+00:00
TOI ETimes,22,Ruhaanika Joins KKK 15: Treats show as ‘crash course in courage’,https://timesofindia.indiatimes.com/articleshow/131122936.cms,2026-05-15T22:54:00+00:00
TOI ETimes,23,Shehnaaz sparks dating buzz: RCB outings fuel Devdutt Padikkal rumours,https://timesofindia.indiatimes.com/articleshow/131120365.cms,2026-05-15T22:54:00+00:00
TOI ETimes,24,Parag slams talk of injections and fasting as cause of wife Shefali's death,https://timesofindia.indiatimes.com/articleshow/131116202.cms,2026-05-15T22:54:00+00:00
TOI ETimes,25,Rubina on motherhood Bias: says new moms are sidelined,https://timesofindia.indiatimes.com/articleshow/131113349.cms,2026-05-15T22:54:00+00:00
TOI ETimes,26,Optical illusion personality test: Human face or cat? What you see first reveals if you have a creative mind or peaceful nature,https://timesofindia.indiatimes.com/articleshow/131124209.cms,2026-05-15T22:54:00+00:00
TOI ETimes,27,Can Pranic healing help manage stress-driven hypertension naturally?,https://timesofindia.indiatimes.com/articleshow/131121488.cms,2026-05-15T22:54:00+00:00
TOI ETimes,28,Why did Kate Middleton call herself ‘Catarina’? Royal’s Italy visit sparks attention,https://timesofindia.indiatimes.com/articleshow/131126041.cms,2026-05-15T22:54:00+00:00
TOI ETimes,29,"Indian man jumps onto railway track to pull out Indonesian woman’s ‘dupatta,’ wins praise online",https://timesofindia.indiatimes.com/articleshow/131122703.cms,2026-05-15T22:54:00+00:00
TOI ETimes,30,How a villager found Southeast Asia’s largest Dinosaur,https://timesofindia.indiatimes.com/articleshow/131120343.cms,2026-05-15T22:54:00+00:00
TOI ETimes,31,Viral 'Mochi' hack: Is this rice paper really worth the hype?,https://timesofindia.indiatimes.com/articleshow/131120944.cms,2026-05-15T22:54:00+00:00
TOI ETimes,32,"‘Why do so many men hate women this much?’ CEO’s post on AI, sexism sparks furious debate",https://timesofindia.indiatimes.com/articleshow/131124331.cms,2026-05-15T22:54:00+00:00
TOI ETimes,33,"Eurovision: Israel's Noam Bettan qualifies for finals, amid controversial exit of 5 countries from music festival",https://timesofindia.indiatimes.com/articleshow/131060187.cms,2026-05-15T22:54:00+00:00
TOI ETimes,34,3 Countries that can’t stop streaming Taylor Swift songs,https://timesofindia.indiatimes.com/articleshow/131059436.cms,2026-05-15T22:54:00+00:00
TOI ETimes,35,Hailee Steinfeld and Josh Allen extend late Mother’s Day wishes,https://timesofindia.indiatimes.com/articleshow/131035687.cms,2026-05-15T22:54:00+00:00
TOI ETimes,36,Abbie Chatfield issues apology after Keli Holiday is refused US re-entry during tour,https://timesofindia.indiatimes.com/articleshow/131033969.cms,2026-05-15T22:54:00+00:00
TOI ETimes,37,The Weeknd to go on Asia Tour soon,https://timesofindia.indiatimes.com/articleshow/131017751.cms,2026-05-15T22:54:00+00:00
TOI ETimes,38,Guy Sebastian takes the ancestry DNA test,https://timesofindia.indiatimes.com/articleshow/131015302.cms,2026-05-15T22:54:00+00:00
TOI ETimes,39,Beyond Ebooks: The charm of bookstores endures,https://timesofindia.indiatimes.com/articleshow/101098088.cms,2026-05-15T22:54:00+00:00
TOI ETimes,40,It’s a curtain call: Sania Mirza bids adieu to tennis with ‘happy tears’,https://timesofindia.indiatimes.com/articleshow/98440670.cms,2026-05-15T22:54:00+00:00
TOI ETimes,41,A magical makeover for 17th Century stepwell: From neglected ruins to a glorious piece of history,https://timesofindia.indiatimes.com/articleshow/96557955.cms,2026-05-15T22:54:00+00:00
TOI ETimes,42,The city comes alive with Christmas fervour,https://timesofindia.indiatimes.com/articleshow/96406573.cms,2026-05-15T22:54:00+00:00
TOI ETimes,43,#BringRioHome: Pet parents launch search to find their kidnapped cat,https://timesofindia.indiatimes.com/articleshow/96334809.cms,2026-05-15T22:54:00+00:00
TOI ETimes,44,Anupam Kher opens up on challenging himself at 71 and returning to theatre after doing 550 films: 'I don't take myself seriously' - Exclusive,https://timesofindia.indiatimes.com/articleshow/131115309.cms,2026-05-15T22:54:00+00:00
TOI ETimes,45,"Horror needs the stage to conspire with you, says Gopal Datt",https://timesofindia.indiatimes.com/articleshow/130598133.cms,2026-05-15T22:54:00+00:00
TOI ETimes,46,"Theatre is magic, and it’s time audiences felt it again: Gopal Datt",https://timesofindia.indiatimes.com/articleshow/130595267.cms,2026-05-15T22:54:00+00:00
TOI ETimes,47,Adil Hussain’s 'Mercy' release date OUT: Film's first look to be attached with Ranveer Singh's 'Dhurandhar: The Revenge',https://timesofindia.indiatimes.com/articleshow/129843424.cms,2026-05-15T22:54:00+00:00
TOI ETimes,48,It’s the best time to be doing theatre: Juhi Babbar Soni,https://timesofindia.indiatimes.com/articleshow/129826631.cms,2026-05-15T22:54:00+00:00
TOI ETimes,49,"Anu Malik steps into theatre with Anupam Kher’s play, Calls it his most exciting challenge yet",https://timesofindia.indiatimes.com/articleshow/129729335.cms,2026-05-15T22:54:00+00:00
TOI ETimes,50,Raj Kundra and Shilpa Shetty's 15th Wedding Anniversary,https://timesofindia.indiatimes.com/articleshow/115563990.cms,2026-05-15T22:54:00+00:00
TOI ETimes,51,​Bigg Boss winners list from season 1 to 17​,https://timesofindia.indiatimes.com/articleshow/114277426.cms,2026-05-15T22:54:00+00:00
TOI ETimes,52,​Discover the bird with a prehistoric roar​,https://timesofindia.indiatimes.com/articleshow/114244474.cms,2026-05-15T22:54:00+00:00
TOI ETimes,53,Dia Mirza's ethnic wear,https://timesofindia.indiatimes.com/articleshow/114243410.cms,2026-05-15T22:54:00+00:00
TOI ETimes,54,​Incredible facts about ants you won’t believe​,https://timesofindia.indiatimes.com/articleshow/114243248.cms,2026-05-15T22:54:00+00:00
TOI ETimes,55,'Bigg Boss Marathi 5' nears grand finale​,https://timesofindia.indiatimes.com/articleshow/113936459.cms,2026-05-15T22:54:00+00:00
TOI ETimes,56,55 Years of love: Remembering Ken Harwood’s life on and off the screen,https://timesofindia.indiatimes.com/articleshow/131121346.cms,2026-05-15T22:54:00+00:00
TOI ETimes,57,"British couple travels across India with newborn, calls Indian Railways ‘Excellent’",https://timesofindia.indiatimes.com/articleshow/131121177.cms,2026-05-15T22:54:00+00:00
TOI ETimes,58,‘I spend ₹96 lakh every year on employees who make zero money’: Indian CEO’s hiring logic sparks debate,https://timesofindia.indiatimes.com/articleshow/131115850.cms,2026-05-15T22:54:00+00:00
TOI ETimes,59,"Greenpeace report warns of ""Chemical Cocktail"" in traditional British meals",https://timesofindia.indiatimes.com/articleshow/131117860.cms,2026-05-15T22:54:00+00:00
TOI ETimes,60,"'57% in Boards, so dad broke my laptop': Student’s viral Reddit post sparks debate on toxic parenting In India",https://timesofindia.indiatimes.com/articleshow/131111917.cms,2026-05-15T22:54:00+00:00
TOI ETimes,61,"'500 mai ho jata': Indian woman in US reveals how fixing a small leak cost her Rs22,000; says India is more affordable",https://timesofindia.indiatimes.com/articleshow/131109906.cms,2026-05-15T22:54:00+00:00
TOI ETimes,62,How a farmer and his brothers unearthed the Terracotta Army while digging a well,https://timesofindia.indiatimes.com/articleshow/131108754.cms,2026-05-15T22:54:00+00:00
TOI ETimes,63,Bermuda Triangle mystery *finally* solved? Scientists discover massive clue hidden beneath the Bermuda Islands,https://timesofindia.indiatimes.com/articleshow/131108424.cms,2026-05-15T22:54:00+00:00
TOI ETimes,64,'Safety and data privacy?': Pune woman reveals restaurant worker used QR Menu to find her number and harass her,https://timesofindia.indiatimes.com/articleshow/131108303.cms,2026-05-15T22:54:00+00:00
TOI ETimes,65,How did dinosaurs become so enormous? Giant new dinosaur found in Thailand could answer the frequently asked question,https://timesofindia.indiatimes.com/articleshow/131107204.cms,2026-05-15T22:54:00+00:00
TOI ETimes,66,From exile to economic powerhouse: Indians now contribute to 65% of Uganda's tax revenue despite being just 1%,https://timesofindia.indiatimes.com/articleshow/131107327.cms,2026-05-15T22:54:00+00:00
TOI ETimes,67,"Meet ‘Paper Boy Deep’, the newspaper delivery boy taking over internet by ‘storm’ with his flawless throws",https://timesofindia.indiatimes.com/articleshow/131105697.cms,2026-05-15T22:54:00+00:00
TOI ETimes,68,London’s oldest family Italian chain collapses after seven decades,https://timesofindia.indiatimes.com/articleshow/131102567.cms,2026-05-15T22:54:00+00:00
TOI ETimes,69,Who is Golshifteh Farahani? Iranian actress suddenly pulled into French President Emmanuel Macron’s viral ‘slap-gate’ firestorm,https://timesofindia.indiatimes.com/articleshow/131101805.cms,2026-05-15T22:54:00+00:00
TOI ETimes,70,‘Leaving on time feels like a crime’: Bengaluru woman shocked after seeing the US office empty by evening,https://timesofindia.indiatimes.com/articleshow/131100779.cms,2026-05-15T22:54:00+00:00
TOI ETimes,71,Hantavirus Outbreak: Spanish passenger Quarantined after deadly,https://timesofindia.indiatimes.com/articleshow/131100028.cms,2026-05-15T22:54:00+00:00
TOI ETimes,72,"Indian woman spots trash in South Korea’s Jeju City, says ‘Every country has capability to become dirty’",https://timesofindia.indiatimes.com/articleshow/131098529.cms,2026-05-15T22:54:00+00:00
TOI ETimes,73,ChatGPT tells Mum to jump 100 times every day and results are jaw-dropping,https://timesofindia.indiatimes.com/articleshow/131097965.cms,2026-05-15T22:54:00+00:00
TOI ETimes,74,‘How do I eat this triangle?’ American man’s first dosa experience wins hearts online,https://timesofindia.indiatimes.com/articleshow/131096018.cms,2026-05-15T22:54:00+00:00
TOI ETimes,75,Triathlon: Why is it so tough and how triathletes push through pain,https://timesofindia.indiatimes.com/articleshow/131094639.cms,2026-05-15T22:54:00+00:00
TOI ETimes,76,"‘Immigration is only a problem depending on the demographic’: Indian-origin Neha Suratran dismantles MAGA claims on H-1B fraud, assimilation and religion",https://timesofindia.indiatimes.com/articleshow/131091675.cms,2026-05-15T22:54:00+00:00
TOI ETimes,77,"Want to know what jail feels like? Hyderabad prison now offers 24-hour stays for Rs 2,000",https://timesofindia.indiatimes.com/articleshow/131087827.cms,2026-05-15T22:54:00+00:00
TOI ETimes,78,"US Senator Eric Schmitt claims Indians visit 'Visa temple' in Hyderabad, while attacking H-1B visa programme",https://timesofindia.indiatimes.com/articleshow/131086465.cms,2026-05-15T22:54:00+00:00
TOI ETimes,79,"Uber CEO Dara Khosrowshahi takes Delhi Metro from Central Secretariat to Jor Bagh, calls it 'fast, affordable, reliable'; watch video",https://timesofindia.indiatimes.com/articleshow/131084488.cms,2026-05-15T22:54:00+00:00
TOI ETimes,80,"'Kisi ko bhi call karlo, cab nahi rukegi': Patna woman shares scary Bengaluru cab experience after driver refused to stop vehicle, cancel ride",https://timesofindia.indiatimes.com/articleshow/131083722.cms,2026-05-15T22:54:00+00:00
TOI ETimes,81,Meet Scott Vincent Borba: e.l.f. Cosmetics founder leaving $3 billion fortune to become a Catholic priest,https://timesofindia.indiatimes.com/articleshow/131082539.cms,2026-05-15T22:54:00+00:00
TOI ETimes,82,The world’s honey supply is in trouble: Why bees are suddenly making less honey than before,https://timesofindia.indiatimes.com/articleshow/131081426.cms,2026-05-15T22:54:00+00:00
TOI ETimes,83,Meet Matt Berger: A 9-year-old who accidentally discovered a...,https://timesofindia.indiatimes.com/articleshow/131031576.cms,2026-05-15T22:54:00+00:00
TOI ETimes,84,'To every mother...': Anand Mahindra shares vegetable seller...,https://timesofindia.indiatimes.com/articleshow/131058088.cms,2026-05-15T22:54:00+00:00
TOI ETimes,85,Scientists warn of Arunachal Pradesh’s Khangri Glacier's cur...,https://timesofindia.indiatimes.com/articleshow/131030504.cms,2026-05-15T22:54:00+00:00
TOI ETimes,86,Top 5 toughest medical exams in the world,https://timesofindia.indiatimes.com/articleshow/131034488.cms,2026-05-15T22:54:00+00:00
TOI ETimes,87,"Happy Mother's Day 2026: Top 140 Wishes, Messages, Images, G...",https://timesofindia.indiatimes.com/articleshow/130961074.cms,2026-05-15T22:54:00+00:00
TOI ETimes,88,Meet Anke Gowda: 79-year-old retired sugar factory worker wh...,https://timesofindia.indiatimes.com/articleshow/130878612.cms,2026-05-15T22:54:00+00:00
TOI ETimes,89,Meet the penguin who swims thousands of miles every year jus...,https://timesofindia.indiatimes.com/articleshow/130768159.cms,2026-05-15T22:54:00+00:00
TOI ETimes,90,A teacher’s gift to the world: MIT professor who taught the ...,https://timesofindia.indiatimes.com/articleshow/130524783.cms,2026-05-15T22:54:00+00:00
