source,rank,headline,link,collected_at_iso
NDTV,2,"""Show Birth Certificates Of Cows,"" Says Bengal BJP MLA, Trinamool Reacts",https://www.ndtv.com/india-news/show-birth-certificates-of-cows-says-bengal-bjp-mla-rekha-patra-trinamool-reacts-11508135,2026-05-17T13:20:21+00:00
NDTV,3,Adani Group Announces Investment And Development Roadmap For Bihar,https://www.ndtv.com/india-news/adani-group-gautam-adani-announces-investment-and-development-roadmap-for-bihar-11508076,2026-05-17T13:20:21+00:00
NDTV,4,Naveen Patnaik's MP Calls For Bringing Petro-Products Under GST,https://www.ndtv.com/india-news/naveen-patnaiks-mp-calls-for-bringing-petro-products-under-gst-11508039,2026-05-17T13:20:21+00:00
NDTV,5,Pics: Gautam Adani Performs Bhoomi Pujan For Adani Centre For Eye Diseases In Bihar,https://www.ndtv.com/india-news/pics-gautam-adani-performs-bhoomi-pujan-for-adani-centre-for-eye-diseases-in-bihar-11507927,2026-05-17T13:20:21+00:00
NDTV,6,"Karnataka Man Throws Teen Daughter Into Well, Hits With Stones, Buries Her",https://www.ndtv.com/india-news/karnataka-man-throws-teen-daughter-into-well-hits-with-stones-buries-her-11507921,2026-05-17T13:20:21+00:00
NDTV,7,CBSE Defends Digital Evaluation System Amid Class 12 Result Concerns,https://www.ndtv.com/education/cbse-defends-digital-evaluation-system-amid-class-12-result-concerns-says-only-medium-changed-not-marking-11507815,2026-05-17T13:20:21+00:00
NDTV,8,JEE Advanced 2026 Marks vs Rank: Check Expected AIR Based on Scores,https://www.ndtv.com/education/jee-advanced-2026-marks-vs-rank-check-expected-air-based-on-scores-11507788,2026-05-17T13:20:21+00:00
NDTV,9,"""KCET Result Will Be Withheld If Class 12 Marks Not Updated,"" Says KEA",https://www.ndtv.com/education/kcet-2026-result-will-be-withheld-if-class-12-marks-not-updated-through-digilocker-says-kea-11507783,2026-05-17T13:20:21+00:00
NDTV,10,What Is OSM? CBSE Explains Digital Evaluation System After Students Concerns,https://www.ndtv.com/education/what-is-osm-cbse-explains-digital-evaluation-system-after-students-raise-marks-concerns-11507782,2026-05-17T13:20:21+00:00
NDTV,11,"""This Is An Every Year Issue"": CBSE On Students Scoring Higher In JEE Than Boards",https://www.ndtv.com/education/this-is-an-every-year-issue-cbse-on-students-scoring-higher-in-jee-than-boards-11507687,2026-05-17T13:20:21+00:00
NDTV,12,NEET UG Cancellation,https://www.ndtv.com/education/neet-ug-2026-exam-live-updates-paper-cancelled-for-over-22-lakh-students-11482588,2026-05-17T13:20:21+00:00
NDTV,13,West Bengal Class 12 Results,https://www.ndtv.com/education/west-bengal-hs-12th-result-2026-live-check-direct-link-class-12-marksheets-pass-percentage-11492225,2026-05-17T13:20:21+00:00
NDTV,14,"Uranium Transfer, Nuclear Limits: US Sets 5 Conditions In Ongoing Iran Talks",https://www.ndtv.com/world-news/uranium-transfer-nuclear-limits-us-sets-5-conditions-in-ongoing-iran-negotiations-11507870,2026-05-17T13:20:21+00:00
NDTV,15,"Massive Fire On Delhi-Bound Rajdhani Express In Madhya Pradesh, Passengers Rescued",https://www.ndtv.com/india-news/massive-fire-on-delhi-thiruvananthapuram-rajdhani-express-in-kota-dozens-rescued-11506687,2026-05-17T13:20:21+00:00
NDTV,16,"Asked To Give Way, 2 Men Stop Bengaluru Woman's Range Rover, Assault Husband",https://www.ndtv.com/bangalore-news/asked-to-give-way-2-men-stop-bengaluru-womans-range-rover-assault-her-husband-11507653,2026-05-17T13:20:21+00:00
NDTV,17,"LIVE: Iran Prepares Mechanism For Hormuz Traffic, Israel Strikes Lebanon",https://www.ndtv.com/world-news/us-iran-war-news-live-updates-tehran-prepares-professional-mechanism-for-strait-of-hormuz-traffic-strikes-lebanon-despite-ceasefire-trump-11506528,2026-05-17T13:20:21+00:00
NDTV,18,"Years Of Gang-Rape, Blackmail, Then 2 Sisters' Suicide In Jodhpur Horror",https://www.ndtv.com/india-news/rajasthan-news-years-of-gang-rape-blackmail-then-2-suicides-in-jodhpur-horror-11507077,2026-05-17T13:20:21+00:00
NDTV,19,Soni Razdan Hits Back At Trolls Over Alia Bhatt's Viral Cannes Video,https://www.ndtv.com/entertainment/soni-razdan-hits-back-at-trolls-over-alia-bhatts-viral-cannes-video-social-media-has-a-lot-of-hate-11508033,2026-05-17T13:20:21+00:00
NDTV,20,"Rs 30,000 For 3rd Child, Rs 40,000 For 4th: C Naidu's Population Incentive",https://www.ndtv.com/india-news/rs-30-000-for-3rd-child-rs-40-000-for-4th-chandrababu-naidus-population-incentive-11505731,2026-05-17T13:20:21+00:00
NDTV,21,Aarthi Slams Husband Ravi Mohan Over His 'Slit My Wrists During Marriage' Remark,https://www.ndtv.com/entertainment/ravi-mohans-wife-aarthi-slams-actor-over-his-slit-my-wrists-during-marriage-remark-never-wake-a-sleeping-lion-11506929,2026-05-17T13:20:21+00:00
NDTV,22,"Bangladesh Seeks New Ganges Treaty, Says Ties With India ""Will Depend On It""",https://www.ndtv.com/world-news/india-bangladesh-relations-bangladesh-seeks-new-indo-bangladesh-ganges-water-sharing-treaty-says-ties-with-india-will-depend-on-it-11506983,2026-05-17T13:20:21+00:00
NDTV,23,New Taliban Law Says 'Silence Of Virgin Girl' Counts As Consent For Marriage,https://www.ndtv.com/world-news/new-taliban-law-says-silence-of-virgin-girl-counts-as-consent-for-marriage-11507937,2026-05-17T13:20:21+00:00
NDTV,24,Aarti Ravi's Mother Sujatha Vijaykumar Reacts To Ravi Mohan's Claims,https://www.ndtv.com/entertainment/aarti-ravis-mother-sujatha-vijaykumar-reacts-to-ravi-mohans-claims-my-grandson-is-under-a-lot-of-stress-11507778,2026-05-17T13:20:21+00:00
NDTV,25,"US Deported Woman Without 2-Year-Old Son, Then Blamed Her After He Was Killed",https://www.ndtv.com/world-news/wendy-hernandez-reyes-ice-deported-woman-without-2-year-old-son-then-blamed-her-after-his-death-11507177,2026-05-17T13:20:21+00:00
NDTV,26,"FBI Jet, $35,000 Suite Date, Pearl Harbour Snorkel: Kash Patel Faces Heat",https://www.ndtv.com/world-news/date-on-fbi-jet-pearl-harbour-snorkel-kash-patel-faces-fresh-scrutiny-11507342,2026-05-17T13:20:21+00:00
NDTV,27,"'Rahul, Priyanka Forget Wayanad': Case Filed Over Posters Warning Gandhis",https://www.ndtv.com/india-news/case-filed-over-wayanad-will-become-next-amethi-posters-near-congress-office-targetting-rahul-gandhi-priyanka-11507093,2026-05-17T13:20:21+00:00
NDTV,28,"Vijay Keeps Key Portfolios, Tamil Nadu Gets First Woman Industries Minister",https://www.ndtv.com/india-news/tamil-nadu-cabinet-vijay-keeps-key-portfolios-for-himself-ka-sengottaiyan-gets-finance-11505260,2026-05-17T13:20:21+00:00
NDTV,29,"Average Students, Extraordinary NEET Scores: Curious Case Of The Rajasthan 5",https://www.ndtv.com/education/neet-ug-2026-paper-leak-neet-leak-neet-paper-leak-rajasthan-cbi-average-students-extraordinary-neet-scores-curious-case-of-the-rajasthan-5-11506118,2026-05-17T13:20:21+00:00
NDTV,30,"Rakul Preet Singh's Viral Gir Safari Video Sparks Debate, Officials Issue Statement",https://www.ndtv.com/entertainment/rakul-preet-singhs-viral-gir-safari-video-sparks-debate-officials-issue-statement-11475946,2026-05-17T13:20:21+00:00
NDTV,31,Midnight Demolition Drive Targeting Temples Sparks Protest In Rajkot,https://www.ndtv.com/india-news/midnight-demolition-drive-targeting-temples-sparks-protest-in-rajkot-11505739,2026-05-17T13:20:21+00:00
NDTV,32,Shah Rukh Khan Brings Home Brand-New Cadillac Escalade Worth Rs 5 Crore,https://www.ndtv.com/entertainment/shah-rukh-khan-brings-home-brand-new-cadillac-escalade-worth-rs-5-crore-11499017,2026-05-17T13:20:21+00:00
NDTV,33,Which Airport Is Closest To Mount Everest?,https://www.ndtv.com/travel/which-airport-is-closest-to-mount-everest-11500607,2026-05-17T13:20:21+00:00
NDTV,34,Latest News Today,https://www.ndtv.com/latest,2026-05-17T13:20:21+00:00
NDTV,35,Education News India,https://www.ndtv.com/education,2026-05-17T13:20:21+00:00
NDTV,36,Latest Business News,https://www.ndtv.com/business-news,2026-05-17T13:20:21+00:00
NDTV,37,NEET Paper Leak Case,https://www.ndtv.com/education/neet-ug-2026-paper-leak-how-questions-reached-aspirants-from-insiders-11507367,2026-05-17T13:20:21+00:00
