source,rank,headline,link,collected_at_iso
Indian Express,1,Trending in India,https://indianexpress.com/section/trending/trending-in-india/,2026-06-19T10:25:38+00:00
Indian Express,2,This is Serious,https://indianexpress.com/section/trending/this-is-serious/,2026-06-19T10:25:38+00:00
Indian Express,3,US woman Mumbai Metro experience,https://indianexpress.com/article/trending/trending-in-india/us-woman-impressed-by-mumbai-metro-america-needs-to-learn-from-india-10747574/,2026-06-19T10:25:38+00:00
Indian Express,4,GTA 6 release,https://indianexpress.com/article/trending/trending-globally/gta-6-release-us-company-declares-holiday-10747328/,2026-06-19T10:25:38+00:00
Indian Express,5,Emmanuel Macron Hindi message to PM Modi,https://indianexpress.com/article/trending/trending-in-india/emmanuel-macron-hindi-message-pm-modi-france-visit-10747258/,2026-06-19T10:25:38+00:00
Indian Express,6,Nithin Kamath fitness bet,https://indianexpress.com/article/trending/trending-in-india/zerodha-ceo-nithin-kamath-loses-rs-2-5-lakh-fitness-bet-employee-weight-loss-10746421/,2026-06-19T10:25:38+00:00
Indian Express,7,Top 7 world's most beautiful airports,https://indianexpress.com/article/trending/top-10-listing/worlds-most-beautiful-airports-2-indian-airports-earn-recognition-10746378/,2026-06-19T10:25:38+00:00
Indian Express,8,Versova Beach viral photos power outages Mumbai,https://indianexpress.com/article/trending/trending-in-india/versova-beach-images-show-dozens-sleeping-on-sand-intense-heat-power-outages-mumbai-10746301/,2026-06-19T10:25:38+00:00
Indian Express,9,Hemakshi Motka viral video,https://indianexpress.com/article/trending/trending-in-india/i-run-multi-million-dollar-firm-nyc-ceo-says-grandma-worried-she-still-unmarried-10746089/,2026-06-19T10:25:38+00:00
Indian Express,10,Cristiano Ronaldo Messi chants,https://indianexpress.com/article/trending/trending-globally/cristiano-ronaldo-messi-chants-portugal-dr-congo-draw-10745757/,2026-06-19T10:25:38+00:00
Indian Express,11,Indian teen dies in horse carriage accident in New York,https://indianexpress.com/article/trending/trending-globally/indian-teen-dies-after-horse-carriage-gets-loose-in-new-york-central-park-10745655/,2026-06-19T10:25:38+00:00
Indian Express,12,"During formal interactions and greetings with officials, she was occasionally seen standing behind Meloni",https://indianexpress.com/article/trending/trending-globally/giorgia-meloni-daughter-g7-summit-video-10745624/,2026-06-19T10:25:38+00:00
Indian Express,13,Trump appeared to walk in the wrong direction following a group photograph session,https://indianexpress.com/article/trending/trending-globally/donald-trump-g7-summit-2026-awkward-moments-modi-meeting-10745490/,2026-06-19T10:25:38+00:00
Indian Express,14,Brazil hiking accident,https://indianexpress.com/article/trending/trending-globally/day-after-bungee-horror-100-foot-fall-claims-another-womans-life-in-brazil-10744589/,2026-06-19T10:25:38+00:00
Indian Express,15,Giorgia Meloni quits smoking G7 viral video,https://indianexpress.com/article/trending/trending-globally/giorgia-meloni-reveals-she-quit-smoking-a-month-ago-during-g7-exchange-10744536/,2026-06-19T10:25:38+00:00
Indian Express,16,Shalmali Kholgade viral Uber driver video,https://indianexpress.com/article/trending/trending-in-india/shalmali-kholgade-viral-uber-driver-video-india-driving-rules-10744457/,2026-06-19T10:25:38+00:00
Indian Express,17,Karnataka elephant eating plastic waste,https://indianexpress.com/article/trending/trending-in-india/karnataka-elephant-eating-plastic-waste-mm-hills-video-viral-10744277/,2026-06-19T10:25:38+00:00
Indian Express,18,Bihar milkman learns US milk prices,https://indianexpress.com/article/trending/trending-in-india/rs-450-for-1-litre-bihar-doodhwala-speechless-after-chaiguy-reveals-milk-price-in-us-10744009/,2026-06-19T10:25:38+00:00
Indian Express,19,31-year-old intern quit stable job,https://indianexpress.com/article/trending/trending-globally/at-31-i-became-an-intern-woman-who-quit-stable-job-on-instinct-lands-dream-role-10743804/,2026-06-19T10:25:38+00:00
Indian Express,20,Modi Meloni viral video,https://indianexpress.com/article/trending/trending-in-india/most-famous-couple-on-instagram-giorgia-meloni-pm-modi-at-g7-summit-goes-viral-10743625/,2026-06-19T10:25:38+00:00
Indian Express,21,richest self-made women,https://indianexpress.com/article/trending/top-10-listing/america-top-10-richest-self-made-women-diane-hendricks-indian-origin-jayshree-ullal-10737819/,2026-06-19T10:25:38+00:00
Indian Express,22,Kochi Water Metro garba video,https://indianexpress.com/article/trending/trending-in-india/harsh-goenka-kochi-water-metro-garba-viral-video-criticism-10742769/,2026-06-19T10:25:38+00:00
Indian Express,23,"Top 10 biggest companies in the world 2026: NVIDIA swoops #1 spot, Elon Musk’s Space X at #6",https://indianexpress.com/article/trending/top-10-listing/top-10-biggest-companies-world-2026-nvidia-elon-musk-space-x-10742252/,2026-06-19T10:25:38+00:00
Indian Express,24,"Top 10 countries with most spoken languages in the world: Papua New Guinea at No. 1, India ranked 4th",https://indianexpress.com/article/trending/top-10-listing/top-10-countries-with-most-spoken-languages-in-the-world-papua-new-guinea-at-no-1-india-ranked-4th-10738871/,2026-06-19T10:25:38+00:00
Indian Express,25,UK social media ban,https://indianexpress.com/article/trending/trending-globally/uk-student-with-9-hours-of-screen-time-reacts-to-keir-starmer-social-media-ban-10742619/,2026-06-19T10:25:38+00:00
Indian Express,26,former Amazon employee becomes Uber driver,https://indianexpress.com/article/trending/trending-in-india/former-amazon-employee-becomes-uber-driver-passion-story-10742572/,2026-06-19T10:25:38+00:00
Indian Express,27,Bengaluru auto driver smartwatch QR code,https://indianexpress.com/article/trending/trending-in-india/bengaluru-auto-driver-smartwatch-qr-code-payment-viral-10742447/,2026-06-19T10:25:38+00:00
LiveMint,1,"This former welder turned millionaire overnight, thanks to SpaceX IPO",https://www.livemint.com/us/trending/this-former-welder-turned-millionaire-overnight-thanks-to-spacex-ipo-here-is-how-much-shares-he-owns-11781439252428.html,2026-06-19T10:25:38+00:00
LiveMint,2,Tyra Banks files defamation lawsuit against Netflix,https://www.livemint.com/us/trending/tyra-banks-sues-netflix-over-america-s-next-top-model-docuseries-alleging-defamation-and-manipulation-11781380081367.html,2026-06-19T10:25:38+00:00
LiveMint,3,Morgan Wallen cancels second Pittsburgh show over severe weather,https://www.livemint.com/us/trending/morgan-wallen-cancels-second-pittsburgh-concert-as-severe-weather-threatens-area-11780773856814.html,2026-06-19T10:25:38+00:00
LiveMint,4,National Donut Day: Here are the places offering free donuts in the US today,https://www.livemint.com/us/trending/national-donut-day-2026-here-are-the-places-offering-free-donuts-in-the-us-today-11780582955435.html,2026-06-19T10:25:38+00:00
LiveMint,5,BTS lead diverse lineup for 2026 iHeartRadio Music Festival,https://www.livemint.com/us/trending/bts-cardi-b-headline-star-studded-2026-iheartradio-music-festival-lineup-in-las-vegas-11780433121103.html,2026-06-19T10:25:38+00:00
LiveMint,6,McDonald's joins FIFA World Cup 2026 fever with limited-edition menu,https://www.livemint.com/us/trending/mcdonalds-joins-fifa-world-cup-2026-fever-with-limited-edition-menu-collectable-cups-and-toys-11780414027281.html,2026-06-19T10:25:38+00:00
LiveMint,7,Tom Holland credits Zendaya for inspiring new Bero shandy flavours,https://www.livemint.com/news/trends/tom-holland-credits-zendaya-for-inspiring-new-bero-non-alcoholic-flavours-she-didn-t-love-the-beers-we-have-on-sale-11780341907920.html,2026-06-19T10:25:38+00:00
LiveMint,8,Bret Michaels becomes fifth act to quit Trump fair,https://www.livemint.com/us/trending/bret-michaels-becomes-fifth-performer-to-withdraw-from-trump-linked-great-american-state-fair-amid-backlash-11780059673299.html,2026-06-19T10:25:38+00:00
LiveMint,9,Mystery bidder pays more than $9 million to meet Warren Buffett,https://www.livemint.com/us/trending/mystery-bidder-pays-more-than-9-million-to-meet-warren-buffett-steph-and-ayesha-curry-over-lunch-11779026671945.html,2026-06-19T10:25:38+00:00
LiveMint,10,Joel Embiid ruled out for Philadelphia 76ers Game 2 vs Knicks due to injury,https://www.livemint.com/us/trending/joel-embiid-ruled-out-for-philadelphia-76ers-game-2-vs-new-york-knicks-due-to-injury-11778089872415.html,2026-06-19T10:25:38+00:00
LiveMint,11,"Carlos Correa injury: Astros place star player on IL, recall Shay Whitcomb",https://www.livemint.com/us/trending/carlos-correa-injury-houston-astros-place-star-player-with-season-ending-left-ankle-injury-on-il-shay-whitcomb-mlb-11778085652310.html,2026-06-19T10:25:38+00:00
LiveMint,12,Bayern Munich vs PSG: Who will win UCL clash? AI predictions and more,https://www.livemint.com/us/trending/bayern-munich-vs-psg-predictions-champions-league-semifinal-lineups-live-streaming-ucl-202526-11778071490090.html,2026-06-19T10:25:38+00:00
LiveMint,13,Are celebs really skipping Met Gala because Jeff Bezos is funding it?,https://www.livemint.com/us/trending/met-gala-are-meryl-streep-zendaya-really-skipping-the-event-because-jeff-bezos-is-funding-it-here-s-the-truth-11777924588506.html,2026-06-19T10:25:38+00:00
LiveMint,14,Met Gala 2026 LIVE Update: Rihanna shines bright like a diamond after Beyonce,https://www.livemint.com/us/trending/met-gala-2026-live-updates-red-carpet-11777915596931.html,2026-06-19T10:25:38+00:00
LiveMint,15,F1: Kimi Antonelli wins 2026 Miami Grand Prix 2026,https://www.livemint.com/us/trending/kimi-antonelli-wins-miami-grand-prix-2026-secures-third-consecutive-f1-win-in-thrilling-race-formula-1-race-11777833243419.html,2026-06-19T10:25:38+00:00
LiveMint,16,Messi steals spotlight at 2026 F1 Miami Grand Prix with Mercedes Paddock visit,https://www.livemint.com/us/trending/lionel-messi-steals-spotlight-at-2026-f1-miami-grand-prix-with-mercedes-paddock-visit-11777828759020.html,2026-06-19T10:25:38+00:00
LiveMint,17,Sinner becomes first man in history to win 5 consecutive ATP Masters 1000 titles,https://www.livemint.com/us/trending/jannik-sinner-becomes-first-man-in-history-to-win-five-consecutive-atp-masters-1000-titles-with-madrid-open-2026-win-11777824491199.html,2026-06-19T10:25:38+00:00
LiveMint,18,Sir Alex Ferguson taken to hospital before Manchester United vs Liverpool clash,https://www.livemint.com/us/trending/sir-alex-ferguson-hospitalized-before-manchester-united-vs-liverpool-clash-at-old-trafford-premier-league-11777821038054.html,2026-06-19T10:25:38+00:00
LiveMint,19,F1: New start time confirmed for Miami Grand Prix 2026 following weather concern,https://www.livemint.com/us/trending/f1-race-today-new-start-time-confirmed-for-miami-grand-prix-2026-following-weather-concerns-1-pm-formula-one-11777815611939.html,2026-06-19T10:25:38+00:00
LiveMint,20,Isack Hadjar disqualified from Miami GP qualifying after Antonelli claims pole,https://www.livemint.com/us/trending/isack-hadjar-disqualified-from-miami-gp-qualifying-over-floor-breach-after-kimi-antonelli-claims-pole-f1-formula-one-11777812192883.html,2026-06-19T10:25:38+00:00
LiveMint,21,Mark to Market,https://www.livemint.com/market/mark-to-market,2026-06-19T10:25:38+00:00
LiveMint,22,Health stock Park Medi World jumps 10% despite stock market crash. Emkay sees over 25% more upside,https://www.livemint.com/market/stock-market-news/health-stock-park-medi-world-jumps-10-despite-stock-market-crash-emkay-sees-over-25-more-upside-11781862653652.html,2026-06-19T10:25:38+00:00
LiveMint,23,Reliance AGM: From Satellite broadband to AI infrastructure - Jio’s five-point growth agenda,https://www.livemint.com/market/stock-market-news/from-satellite-broadband-to-ai-infrastructure-jio-s-five-point-growth-agenda-11781860794377.html,2026-06-19T10:25:38+00:00
LiveMint,24,Small-cap stock under ₹50 Indiabulls hits upper circuit despite stock market crash,https://www.livemint.com/market/stock-market-news/smallcap-stock-under-rs-50-indiabulls-share-price-hits-upper-circuit-despite-stock-market-crash-11781860969312.html,2026-06-19T10:25:38+00:00
LiveMint,25,"Jio Platforms to file DRHP today, to sell 270 mn shares in IPO",https://www.livemint.com/market/ipo/jio-platforms-draft-papers-ipo-shares-reliance-industries-drhp-sebi-meta-google-offer-for-sale-11774521093481.html,2026-06-19T10:25:38+00:00
LiveMint,26,"Multibagger Diamond Power Infrastructure shares gain 3% as board approves ₹2,000 crore QIP",https://www.livemint.com/market/stock-market-news/multibagger-diamond-power-infrastructure-shares-gain-3-as-board-approves-rs-2-000-crore-qip-11781858919877.html,2026-06-19T10:25:38+00:00
LiveMint,27,"Reliance AGM 2026: Jio IPO roadmap, AI vision and other key announcements from RIL's 49th AGM",https://www.livemint.com/market/stock-market-news/reliance-agm-2026-highlights-jio-ipo-roadmap-ai-vision-new-energy-and-other-key-announcements-from-rils-49th-agm-11781858079175.html,2026-06-19T10:25:38+00:00
LiveMint,28,IMD says monsoon set to advance into key central and eastern states by 23 June,https://www.livemint.com/news/india/imd-says-monsoon-set-to-advance-into-key-central-and-eastern-states-by-23-june-11781862525458.html,2026-06-19T10:25:38+00:00
LiveMint,29,Why Saurabh Mukherjea advises to stop studying after class 12: ‘Construction worker will earn twice...’,https://www.livemint.com/news/trends/why-saurabh-mukherjea-advises-to-stop-studying-after-class-12-construction-worker-will-earn-twice-11781857879741.html,2026-06-19T10:25:38+00:00
LiveMint,30,US launches tariff probe against Germany under Section 301 over drug pricing | What does it mean for Berlin?,https://www.livemint.com/news/us-news/us-launches-tariff-probe-against-germany-under-section-301-over-drug-pricing-what-does-it-mean-for-berlin-11781857392968.html,2026-06-19T10:25:38+00:00
LiveMint,31,"Rekha Gupta govt doubles parking charges for 4 months, outlines other measures to combat Winter air pollution in Delhi",https://www.livemint.com/news/india/rekha-gupta-govt-doubles-parking-charges-for-4-months-outlines-other-measures-to-combat-winter-air-pollution-in-delhi-11781855953723.html,2026-06-19T10:25:38+00:00
LiveMint,32,Centre to deploy 100 officers ahead of 1 July rollout of VB-G RAM G,https://www.livemint.com/news/india/centre-to-deploy-100-officers-as-1-july-rollout-of-vb-g-ram-g-enters-final-phase-11781853175598.html,2026-06-19T10:25:38+00:00
LiveMint,33,Quote of the day by Socrates: ‘The only true wisdom is in knowing you know nothing’,https://www.livemint.com/news/us-news/quote-of-the-day-by-socrates-the-only-true-wisdom-is-in-knowing-you-know-nothing-11781850021107.html,2026-06-19T10:25:38+00:00
LiveMint,34,"Urban Harvest in talks to raise ₹300 crore at ₹1,500 crore valuation",https://www.livemint.com/companies/news/b2b-foodtech-startup-urban-harvest-in-advanced-talks-to-raise-300-crore-11781850174520.html,2026-06-19T10:25:38+00:00
LiveMint,35,Reliance AGM report card: Company missed these key targets set over the last five years,https://www.livemint.com/companies/news/reliance-agm-reliance-share-price-jio-ipo-mukesh-ambani-ril-gigafactories-india-11781845318977.html,2026-06-19T10:25:38+00:00
LiveMint,36,Telegram case: Delhi high court rejects plea challenging Centre's temporary ban on platform,https://www.livemint.com/companies/news/telegram-case-delhi-high-court-plea-centres-temporary-ban-messaging-platform-neetug-11781841381936.html,2026-06-19T10:25:38+00:00
LiveMint,37,HealthQuad looking at deeper opportunities in new age healthcare with its Fund III,https://www.livemint.com/companies/news/healthquad-announces-first-close-of-fund-iii-11781784097022.html,2026-06-19T10:25:38+00:00
LiveMint,38,Blue Sapphire promoter taps 360 ONE for private credit to buy out PE investors in AIMS,https://www.livemint.com/companies/news/aims-promoter-raises-rs-415-crore-private-credit-buyback-orbimed-bii-stake-11781761485572.html,2026-06-19T10:25:38+00:00
LiveMint,39,Ask Mint Money,https://www.livemint.com/money/ask-mint-money,2026-06-19T10:25:38+00:00
LiveMint,40,Zerodha Capital's net profit rises 20% to ₹14.7 crore as lending business scales up,https://www.livemint.com/money/personal-finance/zerodha-capitals-net-profit-rises-20-to-14-7-crore-as-lending-business-scales-up-11781859693439.html,2026-06-19T10:25:38+00:00
LiveMint,41,'Japan is 100% doable on a real salary': Mumbai influencers share detailed ₹2.4 lakh budget guide,https://www.livemint.com/money/personal-finance/japan-is-100-doable-on-a-real-salary-mumbai-influencers-share-detailed-2-4-lakh-budget-guide-11781862289227.html,2026-06-19T10:25:38+00:00
LiveMint,42,"Personal loans from 8.95%: Compare June 2026 rates of HDFC Bank, ICICI Bank, Axis Bank and other top private lenders",https://www.livemint.com/money/personal-finance/personal-loans-from-8-95-compare-june-2026-rates-of-hdfc-bank-icici-bank-axis-bank-and-other-top-private-lenders-11781855664371.html,2026-06-19T10:25:38+00:00
LiveMint,43,I asked ChatGPT to plan perfect monsoon family getaway near Mumbai — Here's what AI recommended,https://www.livemint.com/money/personal-finance/i-asked-chatgpt-to-plan-perfect-monsoon-family-getaway-near-mumbai-heres-what-ai-recommended-11781856561939.html,2026-06-19T10:25:38+00:00
LiveMint,44,Income Tax: ITR-3 Excel Utility released — should taxpayers wait until August or file their returns early?,https://www.livemint.com/money/personal-finance/income-tax-itr-3-excel-utility-released-should-taxpayers-wait-till-august-or-file-their-returns-early-11781851635391.html,2026-06-19T10:25:38+00:00
LiveMint,45,SEBI introduces new Gold ETF trading framework with dynamic price bands from 1 September; check details,https://www.livemint.com/money/personal-finance/sebi-introduces-new-gold-etf-trading-framework-with-dynamic-price-bands-from-1-september-check-details-11781851345556.html,2026-06-19T10:25:38+00:00
LiveMint,46,IPL 2026 Schedule,https://www.livemint.com/sports/cricket-news/ipl-schedule,2026-06-19T10:25:38+00:00
LiveMint,47,Orange Cap in IPL 2026,https://www.livemint.com/sports/cricket-news/ipl-orange-cap,2026-06-19T10:25:38+00:00
LiveMint,48,Purple Cap in IPL 2026,https://www.livemint.com/sports/cricket-news/ipl-purple-cap,2026-06-19T10:25:38+00:00
LiveMint,49,IPL 2026 Points Table,https://www.livemint.com/sports/cricket-news/ipl-points-table,2026-06-19T10:25:38+00:00
LiveMint,50,IFSC Code Finder,https://www.livemint.com/ifsc-code,2026-06-19T10:25:38+00:00
LiveMint,51,Income Tax Calculator,https://www.livemint.com/tools-calculators/income-tax-calculator,2026-06-19T10:25:38+00:00
LiveMint,52,Gold Rate Today,https://www.livemint.com/gold-prices,2026-06-19T10:25:38+00:00
LiveMint,53,Gold Rate in Delhi,https://www.livemint.com/gold-prices/delhi,2026-06-19T10:25:38+00:00
LiveMint,54,Gold Rate Hyderabad,https://www.livemint.com/gold-prices/hyderabad,2026-06-19T10:25:38+00:00
LiveMint,55,Silver Rate Today,https://www.livemint.com/silver-prices,2026-06-19T10:25:38+00:00
LiveMint,56,Silver Rate in Delhi,https://www.livemint.com/silver-prices/delhi,2026-06-19T10:25:38+00:00
LiveMint,57,Silver Rate in Bangalore,https://www.livemint.com/silver-prices/bangalore,2026-06-19T10:25:38+00:00
LiveMint,58,US Stock Market,https://www.livemint.com/market/us-market,2026-06-19T10:25:38+00:00
LiveMint,59,Terms of Use,https://www.livemint.com/terms-of-use,2026-06-19T10:25:38+00:00
LiveMint,60,Code of ethics,https://www.livemint.com/code-of-ethics,2026-06-19T10:25:38+00:00
LiveMint,61,MCX Gold Rate,https://www.livemint.com/market/market-stats/commodity-mcx-gold-price,2026-06-19T10:25:38+00:00
LiveMint,62,MCX Silver Price,https://www.livemint.com/market/market-stats/commodity-mcx-silver-price,2026-06-19T10:25:38+00:00
LiveMint,63,Gold Price in Mumbai,https://www.livemint.com/gold-prices/mumbai,2026-06-19T10:25:38+00:00
LiveMint,64,Gold Price in Chennai,https://www.livemint.com/gold-prices/chennai,2026-06-19T10:25:38+00:00
LiveMint,65,Gold Price in Kolkata,https://www.livemint.com/gold-prices/kolkata,2026-06-19T10:25:38+00:00
LiveMint,66,Silver Price in Mumbai,https://www.livemint.com/silver-prices/mumbai,2026-06-19T10:25:38+00:00
LiveMint,67,Silver Price in Chennai,https://www.livemint.com/silver-prices/chennai,2026-06-19T10:25:38+00:00
LiveMint,68,Silver Price in Hyderabad,https://www.livemint.com/silver-prices/hyderabad,2026-06-19T10:25:38+00:00
LiveMint,69,Silver Price in Kolkata,https://www.livemint.com/silver-prices/kolkata,2026-06-19T10:25:38+00:00
LiveMint,70,Latest News Today,https://www.livemint.com/news,2026-06-19T10:25:38+00:00
LiveMint,71,US News Today,https://www.livemint.com/news/us-news,2026-06-19T10:25:38+00:00
LiveMint,72,Top Company Leader,https://www.livemint.com/companies/people,2026-06-19T10:25:38+00:00
LiveMint,73,personal loan emi calculator,https://www.livemint.com/loans/personal-loan-emi-calculator,2026-06-19T10:25:38+00:00
LiveMint,74,Personal Loan Interest Rate,https://www.livemint.com/loans/personal-loan-interest-rates,2026-06-19T10:25:38+00:00
LiveMint,75,Personal Loan Eligibility,https://www.livemint.com/loans/personal-loan-eligibility,2026-06-19T10:25:38+00:00
LiveMint,76,Instant Personal Loan,https://www.livemint.com/loans/instant-personal-loan,2026-06-19T10:25:38+00:00
LiveMint,77,Home Loan EMI Calculator,https://www.livemint.com/tools-calculators/home-loan-emi-calculator,2026-06-19T10:25:38+00:00
LiveMint,78,Car Loan EMI,https://www.livemint.com/tools-calculators/car-loan-calculator,2026-06-19T10:25:38+00:00
India Today,1,Bengaluru man motivates specially-abled Zomato delivery agent with powerful message,https://www.indiatoday.in/trending-news/story/bengaluru-man-motivates-specially-abled-zomato-delivery-agent-with-powerful-message-2929769-2026-06-19,2026-06-19T10:25:38+00:00
India Today,2,Delhi woman's Urban Company AC service experience goes viral after angry post,https://www.indiatoday.in/trending-news/story/delhi-woman-urban-company-ac-service-experience-goes-viral-after-angry-post-2929773-2026-06-19,2026-06-19T10:25:38+00:00
India Today,3,Bengaluru woman's unfiltered comparison between Indian and foreign clients goes viral,https://www.indiatoday.in/trending-news/story/bengaluru-womans-unfiltered-comparison-between-indian-and-foreign-clients-goes-viral-2929703-2026-06-19,2026-06-19T10:25:38+00:00
India Today,4,IIM Ahmedabad professor uses Dhurandhar scene to teach statistics in class. Watch,https://www.indiatoday.in/trending-news/story/iim-ahmedabad-professor-uses-ranveer-singh-dhurandhar-scene-to-teach-statistics-in-class-viral-video-2929689-2026-06-19,2026-06-19T10:25:38+00:00
India Today,5,Techie's shares how first job celebration ended with hurtful remark from relatives,https://www.indiatoday.in/trending-news/story/techies-shares-how-first-job-celebration-ended-with-hurtful-remark-from-relatives-2929663-2026-06-19,2026-06-19T10:25:38+00:00
India Today,6,Pune resident warns of health crisis after sharing muddy tanker water photo,https://www.indiatoday.in/trending-news/story/pune-resident-warns-of-health-crisis-after-sharing-muddy-tanker-water-photo-2929581-2026-06-19,2026-06-19T10:25:38+00:00
India Today,7,Gurugram woman shares complexities of running startup with co-founder husband,https://www.indiatoday.in/trending-news/story/gurugram-woman-shares-complexities-of-running-startup-with-co-founder-husband-2929553-2026-06-19,2026-06-19T10:25:38+00:00
India Today,8,Techie shares HR's 'bizarre' email after candidate she referred fails interview,https://www.indiatoday.in/trending-news/story/techie-shares-hrs-bizarre-email-after-candidate-she-referred-fails-interview-2929238-2026-06-18,2026-06-19T10:25:38+00:00
India Today,9,"Zerodha CEO Nithin Kamath loses Rs 2.5 lakh on fitness bet with employee, shares pic",https://www.indiatoday.in/trending-news/story/zerodha-ceo-nithin-kamath-loses-rs-25-lakh-on-fitness-bet-with-employee-shares-pic-2929142-2026-06-18,2026-06-19T10:25:38+00:00
India Today,10,"Man loses job, then gets WFH role paying over twice his old salary. He's 'shocked'",https://www.indiatoday.in/trending-news/story/man-loses-job-then-gets-wfh-role-paying-over-twice-his-old-salary-he-is-shocked-2929162-2026-06-18,2026-06-19T10:25:38+00:00
India Today,11,Bengaluru landlord's Rs 2.4 lakh deposit demand from tenant sparks debate online,https://www.indiatoday.in/trending-news/story/bengaluru-landlords-rs-24-lakh-deposit-demand-from-tenant-sparks-debate-online-2929049-2026-06-18,2026-06-19T10:25:38+00:00
India Today,12,"New York CEO ran a marathon, built a company. Her grandma still had one complaint",https://www.indiatoday.in/trending-news/story/new-york-ceo-ran-a-marathon-built-a-company-her-grandma-still-had-one-complaint-2929069-2026-06-18,2026-06-19T10:25:38+00:00
India Today,13,"In Haryana's Nuh, young men smash 55 phones to mark exit from addiction",https://www.indiatoday.in/trending-news/story/in-haryanas-nuh-young-men-smash-55-phones-to-mark-exit-from-addiction-2928955-2026-06-18,2026-06-19T10:25:38+00:00
India Today,14,Mumbai techie shares how annual awards at work exposed harsh reality of corporate life,https://www.indiatoday.in/trending-news/story/mumbai-techie-shares-how-annual-awards-at-work-exposed-harsh-reality-of-corporate-life-2928974-2026-06-18,2026-06-19T10:25:38+00:00
India Today,15,Uttarakhand cop stopped a car just in time. The rescue that followed is adorable,https://www.indiatoday.in/trending-news/story/uttarakhand-cop-stopped-a-car-just-in-time-the-rescue-that-followed-is-adorable-2928943-2026-06-18,2026-06-19T10:25:38+00:00
India Today,16,"Bengaluru man spots 40 people waiting for Uber while Ola cabs sit idle, shares reason",https://www.indiatoday.in/trending-news/story/bengaluru-man-spots-40-people-waiting-for-uber-while-ola-cabs-sit-idle-shares-reason-2928920-2026-06-18,2026-06-19T10:25:38+00:00
