source,rank,headline,link,collected_at_iso
LiveMint,72,IPL 2026 Schedule,https://www.livemint.com/sports/cricket-news/ipl-schedule,2026-04-01T07:21:27+00:00
LiveMint,73,Orange Cap in IPL 2026,https://www.livemint.com/sports/cricket-news/ipl-orange-cap,2026-04-01T07:21:27+00:00
LiveMint,74,Purple Cap in IPL 2026,https://www.livemint.com/sports/cricket-news/ipl-purple-cap,2026-04-01T07:21:27+00:00
LiveMint,75,IPL 2026 Points Table,https://www.livemint.com/sports/cricket-news/ipl-points-table,2026-04-01T07:21:27+00:00
LiveMint,76,IFSC Code Finder,https://www.livemint.com/ifsc-code,2026-04-01T07:21:27+00:00
LiveMint,77,Income Tax Calculator,https://www.livemint.com/tools-calculators/income-tax-calculator,2026-04-01T07:21:27+00:00
LiveMint,78,Gold Rate Today,https://www.livemint.com/gold-prices,2026-04-01T07:21:27+00:00
LiveMint,79,Gold Rate in Delhi,https://www.livemint.com/gold-prices/delhi,2026-04-01T07:21:27+00:00
LiveMint,80,Gold Rate Hyderabad,https://www.livemint.com/gold-prices/hyderabad,2026-04-01T07:21:27+00:00
LiveMint,81,Silver Rate Today,https://www.livemint.com/silver-prices,2026-04-01T07:21:27+00:00
LiveMint,82,Silver Rate in Delhi,https://www.livemint.com/silver-prices/delhi,2026-04-01T07:21:27+00:00
LiveMint,83,Silver Rate in Bangalore,https://www.livemint.com/silver-prices/bangalore,2026-04-01T07:21:27+00:00
LiveMint,84,US Stock Market,https://www.livemint.com/market/us-market,2026-04-01T07:21:27+00:00
LiveMint,85,Terms of Use,https://www.livemint.com/terms-of-use,2026-04-01T07:21:27+00:00
LiveMint,86,Code of ethics,https://www.livemint.com/code-of-ethics,2026-04-01T07:21:27+00:00
LiveMint,87,RBSE 12th Result 2026,https://www.livemint.com/education/rajasthan-rbse-board-result-updates/rbse-12th-result-2026-live-updates-rajasthan-board-class-12-result-march-31-rajresults-nic-in-scorecard-download-11774913893685.html,2026-04-01T07:21:27+00:00
LiveMint,88,MCX Gold Rate,https://www.livemint.com/market/market-stats/commodity-mcx-gold-price,2026-04-01T07:21:27+00:00
LiveMint,89,MCX Silver Price,https://www.livemint.com/market/market-stats/commodity-mcx-silver-price,2026-04-01T07:21:27+00:00
LiveMint,90,Gold Price in Mumbai,https://www.livemint.com/gold-prices/mumbai,2026-04-01T07:21:27+00:00
LiveMint,91,Gold Price in Chennai,https://www.livemint.com/gold-prices/chennai,2026-04-01T07:21:27+00:00
LiveMint,92,Gold Price in Kolkata,https://www.livemint.com/gold-prices/kolkata,2026-04-01T07:21:27+00:00
LiveMint,93,Silver Price in Mumbai,https://www.livemint.com/silver-prices/mumbai,2026-04-01T07:21:27+00:00
LiveMint,94,Silver Price in Chennai,https://www.livemint.com/silver-prices/chennai,2026-04-01T07:21:27+00:00
LiveMint,95,Silver Price in Hyderabad,https://www.livemint.com/silver-prices/hyderabad,2026-04-01T07:21:27+00:00
LiveMint,96,Silver Price in Kolkata,https://www.livemint.com/silver-prices/kolkata,2026-04-01T07:21:27+00:00
LiveMint,97,Latest News Today,https://www.livemint.com/news,2026-04-01T07:21:27+00:00
LiveMint,98,US News Today,https://www.livemint.com/news/us-news,2026-04-01T07:21:27+00:00
LiveMint,99,Top Company Leader,https://www.livemint.com/companies/people,2026-04-01T07:21:27+00:00
LiveMint,100,personal loan emi calculator,https://www.livemint.com/loans/personal-loan-emi-calculator,2026-04-01T07:21:27+00:00
LiveMint,101,Personal Loan Interest Rate,https://www.livemint.com/loans/personal-loan-interest-rates,2026-04-01T07:21:27+00:00
LiveMint,102,Personal Loan Eligibility,https://www.livemint.com/loans/personal-loan-eligibility,2026-04-01T07:21:27+00:00
LiveMint,103,Instant Personal Loan,https://www.livemint.com/loans/instant-personal-loan,2026-04-01T07:21:27+00:00
LiveMint,104,Home Loan EMI Calculator,https://www.livemint.com/tools-calculators/home-loan-emi-calculator,2026-04-01T07:21:27+00:00
LiveMint,105,Car Loan EMI,https://www.livemint.com/tools-calculators/car-loan-calculator,2026-04-01T07:21:27+00:00
India Today,1,"Employee's Rs 11,000 salary cut over late arrivals draws criticism, not sympathy",https://www.indiatoday.in/trending-news/story/employee-rs-11000-salary-cut-over-late-arrivals-at-office-draws-criticism-not-sympathy-2889964-2026-04-01,2026-04-01T07:21:27+00:00
India Today,2,Bengaluru man spots woman leaving wheelchair to walk into lounge at airport,https://www.indiatoday.in/trending-news/story/bengaluru-man-spots-woman-leaving-wheelchair-to-walk-into-lounge-at-airport-2889920-2026-04-01,2026-04-01T07:21:27+00:00
India Today,3,US woman squeezes out of police car window while handcuffed,https://www.indiatoday.in/trending-news/story/us-woman-squeezes-out-of-police-car-window-while-handcuffed-video-goes-viral-2889891-2026-04-01,2026-04-01T07:21:27+00:00
India Today,4,"Woman complains of severe allergy, diarrhoea after eating on Vande Bharat train",https://www.indiatoday.in/trending-news/story/woman-complains-of-severe-allergy-diarrhoea-after-eating-on-vande-bharat-train-irctc-responds-2889766-2026-03-31,2026-04-01T07:21:27+00:00
India Today,5,"Bas itna kam? Auto driver reacts to intern's stipend, offers discount",https://www.indiatoday.in/trending-news/story/bas-itna-kam-auto-driver-reacts-to-interns-stipend-offers-discount-2889745-2026-03-31,2026-04-01T07:21:27+00:00
India Today,6,Chinese woman spends Rs 1.6 lakh every month on pet dog's 'school',https://www.indiatoday.in/trending-news/story/chinese-woman-spends-rs-16-lakh-every-month-on-pet-dogs-school-heres-why-2889659-2026-03-31,2026-04-01T07:21:27+00:00
India Today,7,"UP Police, Kerala Tourism join global meme fest over Europe's viral KitKat heist",https://www.indiatoday.in/trending-news/story/blinkit-kerala-tourism-kfc-dominos-join-global-meme-fest-over-europes-viral-kitkat-heist-2889616-2026-03-31,2026-04-01T07:21:27+00:00
India Today,8,"US man finds lost wallet on street, Instagram says 'mine' in 1000 different ways",https://www.indiatoday.in/trending-news/story/us-man-finds-lost-wallet-on-street-instagram-says-mine-in-1000-different-ways-2889627-2026-03-31,2026-04-01T07:21:27+00:00
India Today,9,Man compares Delhi and Bengaluru metro,https://www.indiatoday.in/trending-news/story/man-compares-delhi-and-bengaluru-metro-heres-what-he-observed-2889560-2026-03-31,2026-04-01T07:21:27+00:00
India Today,10,"UK woman gets pregnant by identical twins, the twist lies in the paternity test",https://www.indiatoday.in/trending-news/story/uk-woman-gets-pregnant-by-identical-twins-the-twist-lies-in-the-paternity-test-2889518-2026-03-31,2026-04-01T07:21:27+00:00
India Today,11,"Dhurandhar 2's Shirani Sahab dubbed 'Blinkit of Baloch', memes follow",https://www.indiatoday.in/trending-news/story/dhurandhar-2s-shirani-baloch-sparks-meme-fest-dubbed-doraemon-of-jugaad-2889531-2026-03-31,2026-04-01T07:21:27+00:00
India Today,12,Couple wakes up to cobra hissing near bed in Thailand hotel. Video is viral,https://www.indiatoday.in/trending-news/story/couple-wakes-up-to-cobra-hissing-near-bed-in-thailand-hotel-video-is-viral-2889506-2026-03-31,2026-04-01T07:21:27+00:00
India Today,13,Man offers water to thirsty stray dog on Mumbai local,https://www.indiatoday.in/trending-news/story/man-offers-water-to-thirsty-stray-dog-on-mumbai-local-wholesome-video-2889444-2026-03-31,2026-04-01T07:21:27+00:00
India Today,14,Indian restaurant in Dubai offers up to 65% discount,https://www.indiatoday.in/trending-news/story/indian-restaurant-in-dubai-offers-up-to-65-discount-but-theres-a-twist-2889408-2026-03-31,2026-04-01T07:21:27+00:00
India Today,15,When Pope Leo XIV met his 'mini-me' at the Vatican and had to stop,https://www.indiatoday.in/trending-news/story/when-pope-leo-xiv-met-his-mini-me-at-the-vatican-and-had-to-stop-2889247-2026-03-30,2026-04-01T07:21:27+00:00
India Today,16,Woman films man 'creepily' staring at her on Kerala's Vanchinad Express,https://www.indiatoday.in/trending-news/story/woman-films-man-creepily-staring-at-her-on-keralas-vanchinad-express-2889242-2026-03-30,2026-04-01T07:21:27+00:00
India Today,17,Bengal influencer Pujarini Pradhan reacts after being called an 'industry plant',https://www.indiatoday.in/trending-news/story/bengal-influencer-pujarini-pradhan-reacts-after-being-called-an-industry-plant-2889230-2026-03-30,2026-04-01T07:21:27+00:00
India Today,18,Madhya Pradesh man inspires Anand Mahindra with his solo river cleanup drive,https://www.indiatoday.in/trending-news/story/madhya-pradesh-man-inspires-anand-mahindra-with-his-solo-river-cleanup-drive-2889191-2026-03-30,2026-04-01T07:21:27+00:00
India Today,19,UP man's 9-km Dandavat Yatra to celebrate divorce goes viral,https://www.indiatoday.in/trending-news/story/up-mans-9-km-long-dandvat-yatra-to-celebrate-divorce-goes-viral-2889163-2026-03-30,2026-04-01T07:21:27+00:00
India Today,20,Employee's upfront reply refusing weekend work prompts boss to escalate,https://www.indiatoday.in/trending-news/story/employee-upfront-reply-refusing-weekend-work-prompts-boss-to-escalate-2889118-2026-03-30,2026-04-01T07:21:27+00:00
India Today,21,"After raising whopping $122 Bn, OpenAI says it is ready to build AI superapp to take on Anthropic",https://www.indiatoday.in/technology/story/openai-raises-122-billion-dollar-to-build-ai-superapp-competing-anthropic-2889943-2026-04-01,2026-04-01T07:21:27+00:00
India Today,22,"Siri may soon multitask like a pro, Apple expected to make big AI announcement at WWDC",https://www.indiatoday.in/technology/story/siri-may-soon-multitask-like-a-pro-apple-expected-to-make-big-ai-announcement-at-wwdc-2889968-2026-04-01,2026-04-01T07:21:27+00:00
India Today,23,"Kia India clocks record March sales, posts strongest-ever Q1 performance",https://www.indiatoday.in/auto/cars/story/kia-india-clocks-record-march-sales-posts-strongest-ever-q1-performance-2889975-2026-04-01,2026-04-01T07:21:27+00:00
India Today,24,"Creatine is the top-selling supplement, what makes it so popular?",https://www.indiatoday.in/health/story/creatine-is-the-top-selling-supplement-what-makes-it-so-popular-2886952-2026-03-25,2026-04-01T07:21:27+00:00
India Today,25,Jet fuel price up 8.5%; government says partial hike to shield domestic fares,https://www.indiatoday.in/business/story/jet-fuel-price-crosses-rs-2-lakh-india-atf-surge-crude-oil-iran-war-2889863-2026-04-01,2026-04-01T07:21:27+00:00
India Today,26,CEO and laid off: What's left for corporate India's top leaders now?,https://www.indiatoday.in/jobs/story/ceo-and-laid-off-whats-left-for-corporate-indias-top-leaders-now-educ-2888315-2026-03-28,2026-04-01T07:21:27+00:00
India Today,27,"Career Horoscope Today, March 26, 2026: Sagittarius Should Maintain Self-Control at Work, Know the Status of Other Signs",https://www.indiatoday.in/horoscopes/career-horoscope/story/career-horoscope-today-march-26-2026-sagittarius-should-maintain-self-control-at-work-know-the-status-of-other-signs-2887017-2026-03-26,2026-04-01T07:21:27+00:00
TOI ETimes,1,Australian study finds heart cells can regenerate post-heart attack; India’s leading cardiologist calls it a ‘big step’,https://timesofindia.indiatimes.com/articleshow/127212793.cms,2026-04-01T07:21:27+00:00
TOI ETimes,2,Hold that bite: Doctor explains the post-workout mistake that could cost you your life,https://timesofindia.indiatimes.com/articleshow/127102424.cms,2026-04-01T07:21:27+00:00
TOI ETimes,3,When Anxiety Signals Brain Issues: Neurologist explains red flags,https://timesofindia.indiatimes.com/articleshow/127119929.cms,2026-04-01T07:21:27+00:00
TOI ETimes,4,Doctor's Advice On Common Traps: Dr Ankur Gahlot warns about hidden,https://timesofindia.indiatimes.com/articleshow/127111948.cms,2026-04-01T07:21:27+00:00
TOI ETimes,5,Knee care: Orthopaedic doctor approved tips that can delay joint replacement by 10 years,https://timesofindia.indiatimes.com/articleshow/127125728.cms,2026-04-01T07:21:27+00:00
TOI ETimes,6,Peace lily benefits: How this elegant plant cleans air and calms your mind,https://timesofindia.indiatimes.com/articleshow/127125253.cms,2026-04-01T07:21:27+00:00
TOI ETimes,7,MEET Kannada actors with blockbuster films,https://timesofindia.indiatimes.com/articleshow/129944575.cms,2026-04-01T07:21:27+00:00
TOI ETimes,8,'Dhurandhar2' BO Day 14 [LIVE]: Ranveer Singh film eyes Rs 1000 crore net,https://timesofindia.indiatimes.com/articleshow/129944191.cms,2026-04-01T07:21:27+00:00
TOI ETimes,9,"'Dhurandhar 2' crosses Rs 900 cr net; eyes Rs 1,500 cr worldwide",https://timesofindia.indiatimes.com/articleshow/129938520.cms,2026-04-01T07:21:27+00:00
TOI ETimes,10,"Priyanka Chopra praises Ranveer, Aditya Dhar for ‘Dhurandhar’",https://timesofindia.indiatimes.com/articleshow/129944228.cms,2026-04-01T07:21:27+00:00
TOI ETimes,11,Anupam Kher bids RIP to 'Dhurandhar' propaganda label,https://timesofindia.indiatimes.com/articleshow/129944306.cms,2026-04-01T07:21:27+00:00
TOI ETimes,12,Patrick J. Adams on why he got 'eye rolls' from Meghan Markle,https://timesofindia.indiatimes.com/articleshow/129944058.cms,2026-04-01T07:21:27+00:00
TOI ETimes,13,Rajat Dalal Wedding Video: shares romantic clip,https://timesofindia.indiatimes.com/articleshow/129934052.cms,2026-04-01T07:21:27+00:00
TOI ETimes,14,Bhabhiji Ghar Par Hain to go off air; final episode on 16 April,https://timesofindia.indiatimes.com/articleshow/129932165.cms,2026-04-01T07:21:27+00:00
TOI ETimes,15,Zayn Ibad Khan Enters Priyanka Chahar's Naagin 7,https://timesofindia.indiatimes.com/articleshow/129930654.cms,2026-04-01T07:21:27+00:00
TOI ETimes,16,Poonam sparks pregnancy rumours; shares pics of baby bump,https://timesofindia.indiatimes.com/articleshow/129923141.cms,2026-04-01T07:21:27+00:00
TOI ETimes,17,Farah Khan praises Rajat Dalal’s journey in ‘The 50',https://timesofindia.indiatimes.com/articleshow/129921812.cms,2026-04-01T07:21:27+00:00
TOI ETimes,18,How to protect mangoes at home using paper bags without sprays or harmful chemicals,https://timesofindia.indiatimes.com/articleshow/129943681.cms,2026-04-01T07:21:27+00:00
TOI ETimes,19,DNA analysis suggests the Shroud of Turin may have been crafted in India,https://timesofindia.indiatimes.com/articleshow/129933766.cms,2026-04-01T07:21:27+00:00
TOI ETimes,20,Dubai Airports Update April 1: Air India group to run 30 flights; IndiGo shares list of scheduled flights to operate amid ongoing conflict,https://timesofindia.indiatimes.com/articleshow/129943511.cms,2026-04-01T07:21:27+00:00
TOI ETimes,21,The surprising story behind Satinder Sartaaj’s iconic Sufi look,https://timesofindia.indiatimes.com/articleshow/129943459.cms,2026-04-01T07:21:27+00:00
TOI ETimes,22,"Heard about 'LifeofPujaa'? Meet Pujarini Pradhan, the viral 'village girl' on Instagram with premium brand collabs, facing backlash for being 'too articulate'",https://timesofindia.indiatimes.com/articleshow/129942707.cms,2026-04-01T07:21:27+00:00
TOI ETimes,23,"Why is Oracle trending? Tech giant joins 'layoff club', cuts 30,000 jobs in major restructuring; shares topple nearly 30%",https://timesofindia.indiatimes.com/articleshow/129941597.cms,2026-04-01T07:21:27+00:00
TOI ETimes,24,April’s ‘Pink Moon’ is coming: When to catch it and everything you need to know about this week's lunar show,https://timesofindia.indiatimes.com/articleshow/129939894.cms,2026-04-01T07:21:27+00:00
TOI ETimes,25,Did the Shroud of Turin originate in India? DNA analysis reveals shocking connection of the cloak of Jesus,https://timesofindia.indiatimes.com/articleshow/129944346.cms,2026-04-01T07:21:27+00:00
TOI ETimes,26,"Zendaya stuns bride by crashing dress shopping, buys her dream wedding gown: Netizens hail 'queen' behaviour",https://timesofindia.indiatimes.com/articleshow/129942134.cms,2026-04-01T07:21:27+00:00
TOI ETimes,27,5 smallest dogs with the biggest personalities,https://timesofindia.indiatimes.com/articleshow/129933049.cms,2026-04-01T07:21:27+00:00
TOI ETimes,28,'Life Of A Showgirl' Lawsuit: Taylor Swift sued over title,https://timesofindia.indiatimes.com/articleshow/129914575.cms,2026-04-01T07:21:27+00:00
TOI ETimes,29,Celine Dion announces COMEBACK with Paris residency,https://timesofindia.indiatimes.com/articleshow/129913382.cms,2026-04-01T07:21:27+00:00
TOI ETimes,30,'Viva La Lisa': Lisa becomes first K-Pop star with Vegas residency,https://timesofindia.indiatimes.com/articleshow/129913024.cms,2026-04-01T07:21:27+00:00
TOI ETimes,31,Paul McCartney recalls ‘The Beatles’ first trip to America,https://timesofindia.indiatimes.com/articleshow/129894858.cms,2026-04-01T07:21:27+00:00
TOI ETimes,32,"Benson Boone announces ‘Wanted Man’ US tour after record-breaking global run - All about the dates, booking, and more",https://timesofindia.indiatimes.com/articleshow/129890937.cms,2026-04-01T07:21:27+00:00
TOI ETimes,33,Taylor Swift dodges ex John Mayer at Paul McCartney’s concert,https://timesofindia.indiatimes.com/articleshow/129890568.cms,2026-04-01T07:21:27+00:00
TOI ETimes,34,Beyond Ebooks: The charm of bookstores endures,https://timesofindia.indiatimes.com/articleshow/101098088.cms,2026-04-01T07:21:27+00:00
TOI ETimes,35,It’s a curtain call: Sania Mirza bids adieu to tennis with ‘happy tears’,https://timesofindia.indiatimes.com/articleshow/98440670.cms,2026-04-01T07:21:27+00:00
TOI ETimes,36,A magical makeover for 17th Century stepwell: From neglected ruins to a glorious piece of history,https://timesofindia.indiatimes.com/articleshow/96557955.cms,2026-04-01T07:21:27+00:00
TOI ETimes,37,The city comes alive with Christmas fervour,https://timesofindia.indiatimes.com/articleshow/96406573.cms,2026-04-01T07:21:27+00:00
TOI ETimes,38,#BringRioHome: Pet parents launch search to find their kidnapped cat,https://timesofindia.indiatimes.com/articleshow/96334809.cms,2026-04-01T07:21:27+00:00
TOI ETimes,39,Adil Hussain’s 'Mercy' release date OUT: Film's first look to be attached with Ranveer Singh's 'Dhurandhar: The Revenge',https://timesofindia.indiatimes.com/articleshow/129843424.cms,2026-04-01T07:21:27+00:00
TOI ETimes,40,It’s the best time to be doing theatre: Juhi Babbar Soni,https://timesofindia.indiatimes.com/articleshow/129826631.cms,2026-04-01T07:21:27+00:00
TOI ETimes,41,"Anu Malik steps into theatre with Anupam Kher’s play, Calls it his most exciting challenge yet",https://timesofindia.indiatimes.com/articleshow/129729335.cms,2026-04-01T07:21:27+00:00
TOI ETimes,42,'Wicked' musical director John Stefaniuk on live music on the stage: 'It is so exciting to hear the orchestra whisk us away',https://timesofindia.indiatimes.com/articleshow/129610267.cms,2026-04-01T07:21:27+00:00
TOI ETimes,43,"'Wicked' stars Rebekah Lowings and Eve Shanu-Wilson on Elphaba-Glinda's bond: 'Friends challenge you, not just cheer you on'",https://timesofindia.indiatimes.com/articleshow/129607673.cms,2026-04-01T07:21:27+00:00
TOI ETimes,44,"Vijay Crishna, Shah Rukh Khan’s on-screen father in ‘Devdas,’ passes away at 81: Tributes pour in for theatre stalwart",https://timesofindia.indiatimes.com/articleshow/129016007.cms,2026-04-01T07:21:27+00:00
TOI ETimes,45,Raj Kundra and Shilpa Shetty's 15th Wedding Anniversary,https://timesofindia.indiatimes.com/articleshow/115563990.cms,2026-04-01T07:21:27+00:00
TOI ETimes,46,​Bigg Boss winners list from season 1 to 17​,https://timesofindia.indiatimes.com/articleshow/114277426.cms,2026-04-01T07:21:27+00:00
TOI ETimes,47,​Discover the bird with a prehistoric roar​,https://timesofindia.indiatimes.com/articleshow/114244474.cms,2026-04-01T07:21:27+00:00
TOI ETimes,48,Dia Mirza's ethnic wear,https://timesofindia.indiatimes.com/articleshow/114243410.cms,2026-04-01T07:21:27+00:00
TOI ETimes,49,​Incredible facts about ants you won’t believe​,https://timesofindia.indiatimes.com/articleshow/114243248.cms,2026-04-01T07:21:27+00:00
TOI ETimes,50,'Bigg Boss Marathi 5' nears grand finale​,https://timesofindia.indiatimes.com/articleshow/113936459.cms,2026-04-01T07:21:27+00:00
TOI ETimes,51,Woman reports severe allergy after consuming meal on Vande Bharat Express; IRCTC says ‘lunch on train was…’,https://timesofindia.indiatimes.com/articleshow/129934587.cms,2026-04-01T07:21:27+00:00
TOI ETimes,52,From king cobra to taipan: 5 of the world’s deadliest snakes and how they come close to humans,https://timesofindia.indiatimes.com/articleshow/129930907.cms,2026-04-01T07:21:27+00:00
TOI ETimes,53,Always short on money? 7 simple ways to save better,https://timesofindia.indiatimes.com/articleshow/129929838.cms,2026-04-01T07:21:27+00:00
TOI ETimes,54,Viral experiment: YouTuber grows real tomatoes from McDonald’s burger,https://timesofindia.indiatimes.com/articleshow/129928498.cms,2026-04-01T07:21:27+00:00
TOI ETimes,55,Happy April Fool’s Day 2026: 20 Funny memes and jokes that perfectly sum up the spirit of 1st April,https://timesofindia.indiatimes.com/articleshow/129934212.cms,2026-04-01T07:21:27+00:00
TOI ETimes,56,April Fools' pranks 2026: Try these hilarious jokes and prank ideas to amaze your loved ones,https://timesofindia.indiatimes.com/articleshow/129932394.cms,2026-04-01T07:21:27+00:00
TOI ETimes,57,"Did Egypt really issue a passport to 3,000-year-old Ramesses II for 1974 flight to Paris? Fact or fiction?",https://timesofindia.indiatimes.com/articleshow/129935320.cms,2026-04-01T07:21:27+00:00
TOI ETimes,58,Shocking visuals: Goa parasailing video shows tourist falling after cable snaps mid-air,https://timesofindia.indiatimes.com/articleshow/129925376.cms,2026-04-01T07:21:27+00:00
TOI ETimes,59,‘Pure evil’: Piers Morgan names the most dangerous person he’s ever interviewed in 35-year career,https://timesofindia.indiatimes.com/articleshow/129923651.cms,2026-04-01T07:21:27+00:00
TOI ETimes,60,The ‘Caveman’ move explained: How R Praggnanandhaa stunned Anish Giri with a shock move,https://timesofindia.indiatimes.com/articleshow/129923567.cms,2026-04-01T07:21:27+00:00
TOI ETimes,61,US woman bags Rs 11.4 crore jackpot playing the exact same numbers for years - here's her incredible story,https://timesofindia.indiatimes.com/articleshow/129922355.cms,2026-04-01T07:21:27+00:00
TOI ETimes,62,Watch video: Windsurfer hits whale in ‘unbelievable’ mid-ride moment caught on camera,https://timesofindia.indiatimes.com/articleshow/129921854.cms,2026-04-01T07:21:27+00:00
TOI ETimes,63,Meet Bittu Tabahi: The Indian boy who single-handedly cleaned the heavily polluted Ajnar river,https://timesofindia.indiatimes.com/articleshow/129921945.cms,2026-04-01T07:21:27+00:00
TOI ETimes,64,"Covered in gold head-to-toe, ‘Dubai bride’ sparks massive online debate",https://timesofindia.indiatimes.com/articleshow/129919212.cms,2026-04-01T07:21:27+00:00
TOI ETimes,65,"Astronaut Shubhanshu Shukla revisits NDA, surprises Hunter Squadron Cadets with push-ups",https://timesofindia.indiatimes.com/articleshow/129916261.cms,2026-04-01T07:21:27+00:00
TOI ETimes,66,"Happy Mahavir Jayanti 2026: 30+ Messages, Images, WhatsApp Messages, Wishes, Status, Quotes, GIF Pics, Photos, Greetings, Wallpapers",https://timesofindia.indiatimes.com/articleshow/129906603.cms,2026-04-01T07:21:27+00:00
TOI ETimes,67,Not Kashmir! Pune wakes up to ‘snowfall’ scenes as hailstorm blankets Hinjewadi,https://timesofindia.indiatimes.com/articleshow/129914943.cms,2026-04-01T07:21:27+00:00
TOI ETimes,68,Meet the mango master Shri Kishan Suman: The genius farmer behind the unusual ‘Sadabahar’ mango that blooms 3 times a year,https://timesofindia.indiatimes.com/articleshow/129899583.cms,2026-04-01T07:21:27+00:00
TOI ETimes,69,5 Indian airports so stunning they feel like destinations themselves,https://timesofindia.indiatimes.com/articleshow/129909898.cms,2026-04-01T07:21:27+00:00
TOI ETimes,70,Meet the tiny titans of the ocean: 5 fish under 1 inch you won’t believe exist,https://timesofindia.indiatimes.com/articleshow/129908301.cms,2026-04-01T07:21:27+00:00
TOI ETimes,71,From Ferraris to faith: Hardik Pandya’s SECRET source of strength is winning hearts,https://timesofindia.indiatimes.com/articleshow/129907203.cms,2026-04-01T07:21:27+00:00
TOI ETimes,72,"Meet Palmer Luckey: He built a $2 billion company at 19, got ousted from Facebook, and returned with a defence empire that powers Pentagon",https://timesofindia.indiatimes.com/articleshow/129907090.cms,2026-04-01T07:21:27+00:00
TOI ETimes,73,Why this city is called the ‘Biryani Capital of India’ – the story behind the title,https://timesofindia.indiatimes.com/articleshow/129905647.cms,2026-04-01T07:21:27+00:00
TOI ETimes,74,"Happy Mahavir Jayanti 2026: Best wishes, messages, quotes, greetings card and images to share with your family and friends",https://timesofindia.indiatimes.com/articleshow/129904942.cms,2026-04-01T07:21:27+00:00
TOI ETimes,75,Entirely shot in India with Bollywood classics: Russian film ‘Persimmon of My Love’ goes viral ahead of April 1 release,https://timesofindia.indiatimes.com/articleshow/129904175.cms,2026-04-01T07:21:27+00:00
TOI ETimes,76,Mosquitoes at home? 6 natural ways to keep them away without chemicals,https://timesofindia.indiatimes.com/articleshow/129903876.cms,2026-04-01T07:21:27+00:00
TOI ETimes,77,"‘He ate’, ‘he’s cooked’, ‘NPC behaviour’: The new language taking over your feed in 2026",https://timesofindia.indiatimes.com/articleshow/129901978.cms,2026-04-01T07:21:27+00:00
TOI ETimes,78,"Workers dug a ditch, found ancient Gold: This reclining Buddha statue hid 1300-year-old Gold treasures",https://timesofindia.indiatimes.com/articleshow/129899388.cms,2026-04-01T07:21:27+00:00
TOI ETimes,79,"Viral video: Can you survive in Bengaluru on Rs 18,000? This 22-year-old intern says 'yes'",https://timesofindia.indiatimes.com/articleshow/129899197.cms,2026-04-01T07:21:27+00:00
TOI ETimes,80,A timeless bond: Japanese diver regularly meets and feeds th...,https://timesofindia.indiatimes.com/articleshow/129785510.cms,2026-04-01T07:21:27+00:00
