source,rank,headline,link,collected_at_iso
India Today,23,"Record partnership, highest total: Buttler, Brook add insult to India's injury",https://www.indiatoday.in/sports/cricket/story/england-vs-india-5th-t20i-jos-buttler-harry-brook-2945872-2026-07-11,2026-07-11T16:57:54+00:00
India Today,24,Anushka Sharma's comeback ad leaves fans surprised by her look. Watch,https://www.indiatoday.in/movies/celebrities/story/anushka-sharma-giva-ad-goes-viral-fans-react-to-comeback-buzz-and-changed-look-2911082-2026-05-13,2026-07-11T16:57:54+00:00
TOI ETimes,1,Indian women’s saree ramp walk near Eiffel Tower sparks debate online: Celebration of culture or social media cringe?,https://timesofindia.indiatimes.com/articleshow/131454770.cms,2026-07-11T16:57:54+00:00
TOI ETimes,2,Meet Rounak Adhikary: Ashneer Grover once told him ‘Tu Baith Jaa Yaar’ and cut off his pitch mid-sentence; now he's living every startup founder's dream,https://timesofindia.indiatimes.com/articleshow/131419890.cms,2026-07-11T16:57:54+00:00
TOI ETimes,3,Hyderabad-based Amazon employee shares what not to say at work,https://timesofindia.indiatimes.com/articleshow/130726842.cms,2026-07-11T16:57:54+00:00
TOI ETimes,4,Salad topper recalled over salmonella risk,https://timesofindia.indiatimes.com/articleshow/130458722.cms,2026-07-11T16:57:54+00:00
TOI ETimes,5,Rebel Wilson weight loss: How she lost 36 kgs without extreme dieting - Ozempic or lifestyle?,https://timesofindia.indiatimes.com/articleshow/130457577.cms,2026-07-11T16:57:54+00:00
TOI ETimes,6,"Legendary singer S Janaki, called Nightingale of South India passes away at 88",https://timesofindia.indiatimes.com/articleshow/132333161.cms,2026-07-11T16:57:54+00:00
TOI ETimes,7,Quote of the day by Tom Hanks,https://timesofindia.indiatimes.com/articleshow/132333263.cms,2026-07-11T16:57:54+00:00
TOI ETimes,8,Palaash Muchhal fails to get anticipatory bail in Rs 40 lakh cheating case,https://timesofindia.indiatimes.com/articleshow/132332292.cms,2026-07-11T16:57:54+00:00
TOI ETimes,9,Pawan Kalyan undergoes 3.5 hour shoulder surgery in Mumbai,https://timesofindia.indiatimes.com/articleshow/132332115.cms,2026-07-11T16:57:54+00:00
TOI ETimes,10,Vijay's ‘Jana Nayagan’ drop fierce new poster,https://timesofindia.indiatimes.com/articleshow/132331178.cms,2026-07-11T16:57:54+00:00
TOI ETimes,11,"Akansha Ranjan Kapoor and 'Mr And Mrs Mahi' director Sharan Sharma are officially married, drop FIRST PICS, Alia Bhatt, Ananya Panday and others shower love",https://timesofindia.indiatimes.com/articleshow/132334606.cms,2026-07-11T16:57:54+00:00
TOI ETimes,12,Sanjana Sanghi: The discipline I learnt as a child helped me face Bollywood,https://timesofindia.indiatimes.com/articleshow/132332928.cms,2026-07-11T16:57:54+00:00
TOI ETimes,13,'Picture mein ek minute boring scene nahi hai': Ashish Chanchlani predicts blockbuster run for Christopher Nolan's 'The Odyssey',https://timesofindia.indiatimes.com/articleshow/132331259.cms,2026-07-11T16:57:54+00:00
TOI ETimes,14,'Dhamaal 4' box office collection Day 1: Film beats estimates with ₹21.5cr worldwide,https://timesofindia.indiatimes.com/articleshow/132323332.cms,2026-07-11T16:57:54+00:00
TOI ETimes,15,'Alpha' Box Office Collection Day 8: Film crosses Rs 80 crore worldwide,https://timesofindia.indiatimes.com/articleshow/132323253.cms,2026-07-11T16:57:54+00:00
TOI ETimes,16,'Welcome to the Jungle' zooms past Rs 180 crore mark on Day 15,https://timesofindia.indiatimes.com/articleshow/132307821.cms,2026-07-11T16:57:54+00:00
TOI ETimes,17,Alpha Box Office Collection Day 7: Film nears Rs 80cr worldwide,https://timesofindia.indiatimes.com/articleshow/132300767.cms,2026-07-11T16:57:54+00:00
TOI ETimes,18,'Welcome to the Jungle' smashes past Rs 180 crore worldwide gross on Day 14,https://timesofindia.indiatimes.com/articleshow/132282768.cms,2026-07-11T16:57:54+00:00
TOI ETimes,19,'Alpha' nears Rs 75 crore mark at box office on Day 6,https://timesofindia.indiatimes.com/articleshow/132274759.cms,2026-07-11T16:57:54+00:00
TOI ETimes,20,Animal Preview: Ranbir Kapoor and Sandeep Reddy Vanga are set to shake up the box office hierarchy,https://timesofindia.indiatimes.com/articleshow/105615612.cms,2026-07-11T16:57:54+00:00
TOI ETimes,21,Tu Jhoothi Main Makkaar,https://timesofindia.indiatimes.com/articleshow/98272134.cms,2026-07-11T16:57:54+00:00
TOI ETimes,22,Ekta Kapoor marks 3 years of Barsatein,https://timesofindia.indiatimes.com/articleshow/132328124.cms,2026-07-11T16:57:54+00:00
TOI ETimes,23,Jay says daughter Tara mostly stays with Mahhi,https://timesofindia.indiatimes.com/articleshow/132327205.cms,2026-07-11T16:57:54+00:00
TOI ETimes,24,I’ve been married to my work: Terence Lewis,https://timesofindia.indiatimes.com/articleshow/132326868.cms,2026-07-11T16:57:54+00:00
TOI ETimes,25,Actor On TV Career Lull: Jayashree says TV left her,https://timesofindia.indiatimes.com/articleshow/132325873.cms,2026-07-11T16:57:54+00:00
TOI ETimes,26,Kushal's sister backs actor after Shreya's flirting claims,https://timesofindia.indiatimes.com/articleshow/132326610.cms,2026-07-11T16:57:54+00:00
TOI ETimes,27,"Do you have a 'Phone body'? Has your phone changed you, 6 subtle signs people really notice",https://timesofindia.indiatimes.com/articleshow/132333337.cms,2026-07-11T16:57:54+00:00
TOI ETimes,28,Japan puts farmers' photos inside fruit boxes; Harsh Goenka says India should learn from it,https://timesofindia.indiatimes.com/articleshow/132332491.cms,2026-07-11T16:57:54+00:00
TOI ETimes,29,Psychology says kids who always sleep with one leg outside the blanket often share these personality traits,https://timesofindia.indiatimes.com/articleshow/132326259.cms,2026-07-11T16:57:54+00:00
TOI ETimes,30,"This tree is one of the most dangerous in the world-- it can explode, stab and poison",https://timesofindia.indiatimes.com/articleshow/132331876.cms,2026-07-11T16:57:54+00:00
TOI ETimes,31,"Pune customer spots woman delivery partner with her 3-year-old daughter in the rain, quietly hands her a Rs 1,000 tip",https://timesofindia.indiatimes.com/articleshow/132331172.cms,2026-07-11T16:57:54+00:00
TOI ETimes,32,Why do coins have ridged edges? The clever reason dates back centuries,https://timesofindia.indiatimes.com/articleshow/132329923.cms,2026-07-11T16:57:54+00:00
TOI ETimes,33,"Rare Himalayan flower, lost to India for 158 years, spotted in a remote valley after the 1800s",https://timesofindia.indiatimes.com/articleshow/132329828.cms,2026-07-11T16:57:54+00:00
TOI ETimes,34,'Papa's inner child was really alive': Google employee's video of her parents' first office visit melts hearts,https://timesofindia.indiatimes.com/articleshow/132329255.cms,2026-07-11T16:57:54+00:00
TOI ETimes,35,'People only see the tax-free salary': 23-year-old Indian woman reveals the hidden cost of living in Dubai,https://timesofindia.indiatimes.com/articleshow/132327836.cms,2026-07-11T16:57:54+00:00
TOI ETimes,36,Ananya Pandey shares glimpses of attending Pitbull's concert,https://timesofindia.indiatimes.com/articleshow/132327553.cms,2026-07-11T16:57:54+00:00
TOI ETimes,37,"Andy Bickers, Cold Chisel sax player, passes away after battling cancer",https://timesofindia.indiatimes.com/articleshow/132326413.cms,2026-07-11T16:57:54+00:00
TOI ETimes,38,Kylie and Jason Kelce’s daughters were the flower girls for Taylor-Travis wedding,https://timesofindia.indiatimes.com/articleshow/132325847.cms,2026-07-11T16:57:54+00:00
TOI ETimes,39,Olivia Dean and Sam Fender break their UK record of 'longest-running number one single',https://timesofindia.indiatimes.com/articleshow/132325770.cms,2026-07-11T16:57:54+00:00
TOI ETimes,40,Tate McRae's VMA performance earns rare Emmy nomination,https://timesofindia.indiatimes.com/articleshow/132325271.cms,2026-07-11T16:57:54+00:00
TOI ETimes,41,Taylor Swift defeats Kimberly Marasco in copyright lawsuit,https://timesofindia.indiatimes.com/articleshow/132255703.cms,2026-07-11T16:57:54+00:00
TOI ETimes,42,Beyond Ebooks: The charm of bookstores endures,https://timesofindia.indiatimes.com/articleshow/101098088.cms,2026-07-11T16:57:54+00:00
TOI ETimes,43,It’s a curtain call: Sania Mirza bids adieu to tennis with ‘happy tears’,https://timesofindia.indiatimes.com/articleshow/98440670.cms,2026-07-11T16:57:54+00:00
TOI ETimes,44,A magical makeover for 17th Century stepwell: From neglected ruins to a glorious piece of history,https://timesofindia.indiatimes.com/articleshow/96557955.cms,2026-07-11T16:57:54+00:00
TOI ETimes,45,The city comes alive with Christmas fervour,https://timesofindia.indiatimes.com/articleshow/96406573.cms,2026-07-11T16:57:54+00:00
TOI ETimes,46,#BringRioHome: Pet parents launch search to find their kidnapped cat,https://timesofindia.indiatimes.com/articleshow/96334809.cms,2026-07-11T16:57:54+00:00
TOI ETimes,47,From Bharatanatyam to Bhangra: Over 300 artists present India's diverse dance traditions,https://timesofindia.indiatimes.com/articleshow/132208323.cms,2026-07-11T16:57:54+00:00
TOI ETimes,48,‘Social media puts pressure on women to be perfect moms’,https://timesofindia.indiatimes.com/articleshow/132198860.cms,2026-07-11T16:57:54+00:00
TOI ETimes,49,"Anupam Kher shares mantra for a happy 41-year marriage with Kirron Kher, reacts to Gen Z dating terms like situationship, benching - EXCLUSIVE",https://timesofindia.indiatimes.com/articleshow/131228920.cms,2026-07-11T16:57:54+00:00
TOI ETimes,50,Anupam Kher opens up on challenging himself at 71 and returning to theatre after doing 550 films: 'I don't take myself seriously' - Exclusive,https://timesofindia.indiatimes.com/articleshow/131115309.cms,2026-07-11T16:57:54+00:00
TOI ETimes,51,"Horror needs the stage to conspire with you, says Gopal Datt",https://timesofindia.indiatimes.com/articleshow/130598133.cms,2026-07-11T16:57:54+00:00
TOI ETimes,52,"Theatre is magic, and it’s time audiences felt it again: Gopal Datt",https://timesofindia.indiatimes.com/articleshow/130595267.cms,2026-07-11T16:57:54+00:00
TOI ETimes,53,Raj Kundra and Shilpa Shetty's 15th Wedding Anniversary,https://timesofindia.indiatimes.com/articleshow/115563990.cms,2026-07-11T16:57:54+00:00
TOI ETimes,54,​Bigg Boss winners list from season 1 to 17​,https://timesofindia.indiatimes.com/articleshow/114277426.cms,2026-07-11T16:57:54+00:00
TOI ETimes,55,​Discover the bird with a prehistoric roar​,https://timesofindia.indiatimes.com/articleshow/114244474.cms,2026-07-11T16:57:54+00:00
TOI ETimes,56,Dia Mirza's ethnic wear,https://timesofindia.indiatimes.com/articleshow/114243410.cms,2026-07-11T16:57:54+00:00
TOI ETimes,57,​Incredible facts about ants you won’t believe​,https://timesofindia.indiatimes.com/articleshow/114243248.cms,2026-07-11T16:57:54+00:00
TOI ETimes,58,'Bigg Boss Marathi 5' nears grand finale​,https://timesofindia.indiatimes.com/articleshow/113936459.cms,2026-07-11T16:57:54+00:00
TOI ETimes,59,Chhattisgarh villagers save 31 crore litres of water through 15-day conservation campaign: Here's how they did it,https://timesofindia.indiatimes.com/articleshow/132326876.cms,2026-07-11T16:57:54+00:00
TOI ETimes,60,"Video inside: Before logging into her 12 pm job, this Bengaluru woman does something that's making thousands rethink their mornings",https://timesofindia.indiatimes.com/articleshow/132326551.cms,2026-07-11T16:57:54+00:00
TOI ETimes,61,‘Indians can learn this from Americans’: Content creator's New York holiday observation sparks debate online,https://timesofindia.indiatimes.com/articleshow/132325655.cms,2026-07-11T16:57:54+00:00
TOI ETimes,62,"56-year-old Indian mom finally earns her Master's degree, daughter's emotional tribute leaves the internet in tears",https://timesofindia.indiatimes.com/articleshow/132323872.cms,2026-07-11T16:57:54+00:00
TOI ETimes,63,A broken safety net? UK watchdog warns electronic tagging scheme is flawed,https://timesofindia.indiatimes.com/articleshow/132319785.cms,2026-07-11T16:57:54+00:00
TOI ETimes,64,Why do clocks in advertisements almost always show 10:10? Here's the real reason,https://timesofindia.indiatimes.com/articleshow/132318000.cms,2026-07-11T16:57:54+00:00
TOI ETimes,65,Erling Haaland's off-field flex: 5 cars that make up the Viking's car collection,https://timesofindia.indiatimes.com/articleshow/132311890.cms,2026-07-11T16:57:54+00:00
TOI ETimes,66,Who is Jacob Tobey? Spurs broadcaster reportedly loses job after viral affair allegations involving player's sister,https://timesofindia.indiatimes.com/articleshow/132310291.cms,2026-07-11T16:57:54+00:00
TOI ETimes,67,Teacher patiently accompanies a specially abled child to complete his race on the tracks amid pouring rain; social media can't stop appreciating the humility,https://timesofindia.indiatimes.com/articleshow/132309551.cms,2026-07-11T16:57:54+00:00
TOI ETimes,68,"Indians chant Gayatri Mantra inside Azerbaijan Museum, viral video sparks debate over tourist behaviour abroad",https://timesofindia.indiatimes.com/articleshow/132307782.cms,2026-07-11T16:57:54+00:00
TOI ETimes,69,Meet Anil Menon: The Indian-origin NASA astronaut set for his first mission to the International Space Station,https://timesofindia.indiatimes.com/articleshow/132306142.cms,2026-07-11T16:57:54+00:00
TOI ETimes,70,"GTA 6 fans, mark your calendars: Rockstar Games reveals when you can download the game early",https://timesofindia.indiatimes.com/articleshow/132305488.cms,2026-07-11T16:57:54+00:00
TOI ETimes,71,How would astronauts on a space mission drink coffee? That’s why NASA came up with the Space Cup,https://timesofindia.indiatimes.com/articleshow/132303179.cms,2026-07-11T16:57:54+00:00
TOI ETimes,72,‘Operation ke beech hosh aa gaya’: Influencer alleges medical negligence after 10-year-old sister dies following tonsil surgery in UP,https://timesofindia.indiatimes.com/articleshow/132302816.cms,2026-07-11T16:57:54+00:00
TOI ETimes,73,'It's not just about the money': Two Indian women explain why they would choose the US over a Rs 40 lakh job in India,https://timesofindia.indiatimes.com/articleshow/132301607.cms,2026-07-11T16:57:54+00:00
TOI ETimes,74,Who is Zeynep Sonmez? The Turkish tennis player whose Palestine-linked watermelon symbol sparked debate at Wimbledon,https://timesofindia.indiatimes.com/articleshow/132297985.cms,2026-07-11T16:57:54+00:00
TOI ETimes,75,"Why an Indian employee refused a US job offer despite higher pay, says ""Won't get...""",https://timesofindia.indiatimes.com/articleshow/132296880.cms,2026-07-11T16:57:54+00:00
TOI ETimes,76,Thinking of quitting your 9-to-5? This entrepreneur shares 3 lessons learned after taking the leap,https://timesofindia.indiatimes.com/articleshow/132295274.cms,2026-07-11T16:57:54+00:00
TOI ETimes,77,This content creator says you don't need to quit your 9-to-5 to travel the world - here's how,https://timesofindia.indiatimes.com/articleshow/132290762.cms,2026-07-11T16:57:54+00:00
TOI ETimes,78,Stop wasting money on whey: This ₹10 kitchen ingredient builds more muscle!,https://timesofindia.indiatimes.com/articleshow/132288935.cms,2026-07-11T16:57:54+00:00
TOI ETimes,79,"Cab driver says, ‘I'm not your servant’ after passenger lights cigarette mid-ride; internet is split",https://timesofindia.indiatimes.com/articleshow/132288504.cms,2026-07-11T16:57:54+00:00
TOI ETimes,80,"What guests left behind at this ₹1.05 crore Airbnb has the internet asking, ‘Where does basic courtesy end?’",https://timesofindia.indiatimes.com/articleshow/132285840.cms,2026-07-11T16:57:54+00:00
TOI ETimes,81,"He dreamed of a giant gold nugget—12 days later, he found 27 kgs of gold worth $1 million that made history",https://timesofindia.indiatimes.com/articleshow/132283008.cms,2026-07-11T16:57:54+00:00
TOI ETimes,82,"'Hrithik Roshan, is that you?' Marine Drive gets its own superhero as man dressed as Krrish leaves onlookers amused",https://timesofindia.indiatimes.com/articleshow/132282428.cms,2026-07-11T16:57:54+00:00
TOI ETimes,83,Cambodia wants to bring tigers back — here’s why many Cambodians don't want that,https://timesofindia.indiatimes.com/articleshow/132279313.cms,2026-07-11T16:57:54+00:00
TOI ETimes,84,"Watch: Floodwaters carry away 3,000 LPG cylinders in Maharashtra, videos show people rushing into river to grab them",https://timesofindia.indiatimes.com/articleshow/132280695.cms,2026-07-11T16:57:54+00:00
TOI ETimes,85,"Who was Ruth Ellis? All about the last woman hanged in UK, granted posthumous conditional pardon",https://timesofindia.indiatimes.com/articleshow/132278664.cms,2026-07-11T16:57:54+00:00
TOI ETimes,86,"Katie Price net worth: From a £45 million fortune to bankruptcy battles, how much is the former glamour model worth today?",https://timesofindia.indiatimes.com/articleshow/132277771.cms,2026-07-11T16:57:54+00:00
TOI ETimes,87,"""Carry on"": Flight instructor jumps to death from aircraft, ...",https://timesofindia.indiatimes.com/articleshow/132277505.cms,2026-07-11T16:57:54+00:00
TOI ETimes,88,British traveller calls this the 'biggest scam in India' aft...,https://timesofindia.indiatimes.com/articleshow/132264842.cms,2026-07-11T16:57:54+00:00
TOI ETimes,89,His father sold his mother's gold jewellery to pay college f...,https://timesofindia.indiatimes.com/articleshow/132211599.cms,2026-07-11T16:57:54+00:00
TOI ETimes,90,"Meet Kelsey Pfendler, the 32-year-old who spent 43 days alon...",https://timesofindia.indiatimes.com/articleshow/132217377.cms,2026-07-11T16:57:54+00:00
TOI ETimes,91,"No hotels, endless food, and family everywhere: Canadian wom...",https://timesofindia.indiatimes.com/articleshow/132268913.cms,2026-07-11T16:57:54+00:00
TOI ETimes,92,"'We accidentally started saving ₹30,000 a month': Corporate ...",https://timesofindia.indiatimes.com/articleshow/132192437.cms,2026-07-11T16:57:54+00:00
TOI ETimes,93,US couple left New York’s high-flying life to buy a house in...,https://timesofindia.indiatimes.com/articleshow/132235170.cms,2026-07-11T16:57:54+00:00
TOI ETimes,94,Zoho co-founder Sridhar Vembu's veshti moment on Japan's bul...,https://timesofindia.indiatimes.com/articleshow/132233260.cms,2026-07-11T16:57:54+00:00
TOI ETimes,95,Bengaluru road rage: Luxury car passenger caught on camera s...,https://timesofindia.indiatimes.com/articleshow/132174664.cms,2026-07-11T16:57:54+00:00
TOI ETimes,96,Meet Lhakpa Sherpa: The 'Mountain Queen' who climbed Mount E...,https://timesofindia.indiatimes.com/articleshow/132220304.cms,2026-07-11T16:57:54+00:00
TOI ETimes,97,"Ladakh struggled with water for years, then Sonam Wangchuk c...",https://timesofindia.indiatimes.com/articleshow/132023820.cms,2026-07-11T16:57:54+00:00
TOI ETimes,98,"Meet Purnima Devi Barman: Leader of Hargila Army, a 20,000-m...",https://timesofindia.indiatimes.com/articleshow/132067699.cms,2026-07-11T16:57:54+00:00
TOI ETimes,99,"Atacama Desert was the driest place in the world, until one ...",https://timesofindia.indiatimes.com/articleshow/132047381.cms,2026-07-11T16:57:54+00:00
TOI ETimes,100,Cristiano Ronaldo has one of the finest elite car collection...,https://timesofindia.indiatimes.com/articleshow/132032753.cms,2026-07-11T16:57:54+00:00
TOI ETimes,101,Meet Fabrice Bellard: The French engineer whose code powers ...,https://timesofindia.indiatimes.com/articleshow/131602101.cms,2026-07-11T16:57:54+00:00
TOI ETimes,102,"Microsoft layoffs: Kevin LaChapelle, the Xbox veteran who got laid off after 37 years says ‘I wish the team nothing but success'",https://timesofindia.indiatimes.com/articleshow/132276881.cms,2026-07-11T16:57:54+00:00
TOI ETimes,103,"Company lays off 62 employees, retains 8 - says 'Claude Fable 5 is enough'; Reddit post goes viral",https://timesofindia.indiatimes.com/articleshow/132276124.cms,2026-07-11T16:57:54+00:00
TOI ETimes,104,"‘Suhagrat Express’ goes viral after 1st AC train coupe is transformed into a wedding suite; internet asks, ‘Who allowed this?’",https://timesofindia.indiatimes.com/articleshow/132266680.cms,2026-07-11T16:57:54+00:00
TOI ETimes,105,Microsoft layoffs: Some employees could get up to 39 weeks' salary as part of exit package - severance package details here,https://timesofindia.indiatimes.com/articleshow/132262783.cms,2026-07-11T16:57:54+00:00
TOI ETimes,106,One drink order could make or break your interview: The unusual hiring rule of Bupa's CEO,https://timesofindia.indiatimes.com/articleshow/132262490.cms,2026-07-11T16:57:54+00:00
TOI ETimes,107,'You are not in India': Billionaire heiress Vasundhara Oswal says she faced racism in Switzerland,https://timesofindia.indiatimes.com/articleshow/132259091.cms,2026-07-11T16:57:54+00:00
TOI ETimes,108,"'It's not Gurgaon, it's Venice': Viral videos capture city under water after heavy rain",https://timesofindia.indiatimes.com/articleshow/132254891.cms,2026-07-11T16:57:54+00:00
TOI ETimes,109,"Child seen urinating on Indore Airport tarmac, entrepreneur says 'the real problem is parenting'",https://timesofindia.indiatimes.com/articleshow/132252094.cms,2026-07-11T16:57:54+00:00
TOI ETimes,110,Erling Haaland shares his love for Butter Chicken and naan: Is it the secret ingredient behind his power-packed performance?,https://timesofindia.indiatimes.com/articleshow/132252171.cms,2026-07-11T16:57:54+00:00
TOI ETimes,111,Ferrari Star Charles Leclerc loves this meal at this Indian Restaurant in London,https://timesofindia.indiatimes.com/articleshow/132248834.cms,2026-07-11T16:57:54+00:00
TOI ETimes,112,"This Restaurant charges Rs 7,000 for Tomatoes and Eggs, and netizens are furious",https://timesofindia.indiatimes.com/articleshow/132244713.cms,2026-07-11T16:57:54+00:00
TOI ETimes,113,Video: Bengaluru couple reveals how they invest ₹1.7 lakh every month; internet has plenty of questions,https://timesofindia.indiatimes.com/articleshow/132244171.cms,2026-07-11T16:57:54+00:00
TOI ETimes,114,'Salary gets debited before it even arrives': Gurgaon woman's work-life video strikes a chord online,https://timesofindia.indiatimes.com/articleshow/132242635.cms,2026-07-11T16:57:54+00:00
TOI ETimes,115,Virat Kohli lookalike walks into mall with bodyguards; shoppers rush for selfies before realising the truth,https://timesofindia.indiatimes.com/articleshow/132241179.cms,2026-07-11T16:57:54+00:00
TOI ETimes,116,"Bengaluru corporate employee reveals ₹45,000 monthly expense breakdown; internet can't agree if she's overspending",https://timesofindia.indiatimes.com/articleshow/132238676.cms,2026-07-11T16:57:54+00:00
TOI ETimes,117,PlayStation 6 will cost 1.3 lakh rupees? Here's what reports say about price hike in raw materials and AI,https://timesofindia.indiatimes.com/articleshow/132238349.cms,2026-07-11T16:57:54+00:00
TOI ETimes,118,900 snakes escape from South China's village farm after devastating floods: Residents panic as snakebites reported,https://timesofindia.indiatimes.com/articleshow/132237347.cms,2026-07-11T16:57:54+00:00
TOI ETimes,119,"420 rejections later, this Indian woman landed her dream job in New York and her advice is going viral",https://timesofindia.indiatimes.com/articleshow/132236892.cms,2026-07-11T16:57:54+00:00
TOI ETimes,120,"Newton's apple tree, 'Flower of Kent' is 350 years old and still growing: What is this 'rare' variety, and where can it be found in the world?",https://timesofindia.indiatimes.com/articleshow/132230716.cms,2026-07-11T16:57:54+00:00
TOI ETimes,121,Indian employee turns down US job offer for surprising reasons: 'I’ll have to clean the house on my own' and 'won't get 10 minute grocery',https://timesofindia.indiatimes.com/articleshow/132230467.cms,2026-07-11T16:57:54+00:00
TOI ETimes,122,Ashneer Grover fires back after X user asks him to donate ₹900 crore over wife Madhuri's controversial comments,https://timesofindia.indiatimes.com/articleshow/132229313.cms,2026-07-11T16:57:54+00:00
TOI ETimes,123,China’s great green wall: Over 60 billion trees are growing faster than natural forests — here's the secret behind that growth,https://timesofindia.indiatimes.com/articleshow/132228721.cms,2026-07-11T16:57:54+00:00
TOI ETimes,124,"Best proverb of the day: 'The ocean keeps every secret, but charges salt for storage', and every hidden truth returns altered by time and chemistry",https://timesofindia.indiatimes.com/articleshow/132225441.cms,2026-07-11T16:57:54+00:00
TOI ETimes,125,"Best proverb of the day: 'Even the sun negotiates with dust to make a shadow', where even brilliance must bargain with resistance",https://timesofindia.indiatimes.com/articleshow/132225392.cms,2026-07-11T16:57:54+00:00
TOI ETimes,126,"Indian senior citizen's account comparing US and Indian healthcare goes viral: 'Medicines for my wife worth Rs 2,500 in India cost Rs 42,000 in US'",https://timesofindia.indiatimes.com/articleshow/132222908.cms,2026-07-11T16:57:54+00:00
TOI ETimes,127,66 Hot Dogs in 10 minutes? This is what the duo did to win a whopping Rs 9.5 lakh reward,https://timesofindia.indiatimes.com/articleshow/132221790.cms,2026-07-11T16:57:54+00:00
TOI ETimes,128,"2,000-year-old gold rings unearthed in Thailand reveal surprising ancient links with India",https://timesofindia.indiatimes.com/articleshow/132221328.cms,2026-07-11T16:57:54+00:00
TOI ETimes,129,"Indian entrepreneur says US F-1 visa rejection changed his life, led to multi-million-dollar success: 'Thought the whole world crumbled'",https://timesofindia.indiatimes.com/articleshow/132220655.cms,2026-07-11T16:57:54+00:00
TOI ETimes,130,"Tiger attacks snake in Corbett: Video of predators goes viral on internet; viewers say, 'expect the unexpected'",https://timesofindia.indiatimes.com/articleshow/132220900.cms,2026-07-11T16:57:54+00:00
TOI ETimes,131,"'This is true love, brother': Man finds water-soaked diary on roadside; what he discovers inside leaves internet emotional",https://timesofindia.indiatimes.com/articleshow/132220347.cms,2026-07-11T16:57:54+00:00
