source,rank,headline,link,collected_at_iso
Indian Express,1,Trending in India,https://indianexpress.com/section/trending/trending-in-india/,2026-04-08T20:43:04+00:00
Indian Express,2,This is Serious,https://indianexpress.com/section/trending/this-is-serious/,2026-04-08T20:43:04+00:00
Indian Express,3,Gulmarg littering video,https://indianexpress.com/article/trending/trending-in-india/film-crew-sparks-fury-after-leaving-piles-of-trash-in-gulmarg-pristine-snow-10626390/,2026-04-08T20:43:04+00:00
Indian Express,4,Techie with backlog cracks FAANG offers,https://indianexpress.com/article/trending/trending-in-india/indian-techie-explains-how-he-landed-google-meta-offers-after-failing-in-college-exam-10626372/,2026-04-08T20:43:04+00:00
Indian Express,5,Phoebe Gates faces backlash over influencer pay dispute,https://indianexpress.com/article/trending/trending-globally/bill-gates-daughter-phoebe-gates-influencer-controversy-pay-dispute-10625524/,2026-04-08T20:43:04+00:00
Indian Express,6,Sridhar Vembu post,https://indianexpress.com/article/trending/trending-in-india/zoho-sridhar-vembu-urges-reverse-migration-to-villages-time-to-go-back-viral-post-10624899/,2026-04-08T20:43:04+00:00
Indian Express,7,Top 10 Countries to Live in the World in 2026,https://indianexpress.com/article/trending/top-10-listing/top-10-best-countries-to-live-in-the-world-in-2026-10624090/,2026-04-08T20:43:04+00:00
Indian Express,8,Nutella jar in space Artemis II livestream,https://indianexpress.com/article/trending/trending-globally/nutella-jar-viral-video-nasa-artemis-2-moon-mission-product-placement-10624062/,2026-04-08T20:43:04+00:00
Indian Express,9,Duolingo CEO hiring test,https://indianexpress.com/article/trending/trending-globally/duolingo-ceo-luis-von-ahn-hiring-taxi-driver-test-ai-layoffs-backlash-10623944/,2026-04-08T20:43:04+00:00
Indian Express,10,Khan Saab concert viral video,https://indianexpress.com/article/trending/trending-in-india/khan-saab-concert-viral-video-fan-performance-73-million-views-10623813/,2026-04-08T20:43:04+00:00
Indian Express,11,The former Google techie revealed that his routine revolved heavily around his job,https://indianexpress.com/article/trending/trending-globally/google-employee-who-spent-years-delaying-vacation-working-weekends-only-to-get-laid-off-10623398/,2026-04-08T20:43:04+00:00
Indian Express,12,Artemis II Moon flyby Project Hail Mary,https://indianexpress.com/article/trending/trending-globally/nasa-artemis-2-moon-flyby-mission-control-project-hail-mary-ryan-gosling-rocky-amaze-amaze-amaze-reference-10623226/,2026-04-08T20:43:04+00:00
Indian Express,13,AI changing work trends emerge as economist highlights editing Claude output,https://indianexpress.com/article/trending/trending-globally/removing-em-dashes-economist-says-his-job-is-to-make-ai-generated-text-look-human-10623033/,2026-04-08T20:43:04+00:00
Indian Express,14,Payal Nag lost all four limbs in an electrocution accident,https://indianexpress.com/article/trending/trending-in-india/anand-mahindra-shares-inspiring-story-of-odisha-payal-nag-four-limb-amputee-world-archery-para-series-bangkok-10622189/,2026-04-08T20:43:04+00:00
Indian Express,15,Iran mocks the US President Donald Trump,https://indianexpress.com/article/trending/trending-globally/iran-mocks-donald-trump-with-memes-amid-tensions-over-strait-of-hormuz-10622168/,2026-04-08T20:43:04+00:00
Indian Express,16,Top 10 India's most women-friendly cities in 2026,https://indianexpress.com/article/trending/top-10-listing/top-10-indias-most-women-friendly-cities-in-2026-10622125/,2026-04-08T20:43:04+00:00
Indian Express,17,Ranthambore tiger viral video,https://indianexpress.com/article/trending/trending-in-india/ranthambore-national-park-tiger-viral-video-safari-vehicles-traffic-jam-10622042/,2026-04-08T20:43:04+00:00
Indian Express,18,The video shows Hayden quietly collecting discarded items and placing them in a dustbin,https://indianexpress.com/article/trending/trending-in-india/gujarat-titans-batting-coach-matthew-hayden-picks-up-trash-during-ipl-match-video-sparks-outrage-10621958/,2026-04-08T20:43:04+00:00
Indian Express,19,Indian woman Sri Lanka beaches,https://indianexpress.com/article/trending/trending-in-india/indian-woman-sri-lanka-clean-beaches-vs-india-civic-sense-debate-viral-video-10621778/,2026-04-08T20:43:04+00:00
Indian Express,20,Nikhil Kamath MBA remark,https://indianexpress.com/article/trending/trending-in-india/nikhil-kamath-mba-remark-columbia-business-school-viral-video-rich-kids-comment-10621598/,2026-04-08T20:43:04+00:00
Indian Express,21,Auto driver viral video is gaining attention online after a late-night passenger shared a touching conversation about loneliness,https://indianexpress.com/article/trending/trending-in-india/60-year-old-auto-driver-reason-for-working-late-viral-video-10621393/,2026-04-08T20:43:04+00:00
Indian Express,22,RCB vs CSK viral video,https://indianexpress.com/article/trending/trending-in-india/rcb-vs-csk-viral-video-fan-celebration-chinnaswamy-stadium-10621347/,2026-04-08T20:43:04+00:00
Indian Express,23,Anand Mahindra praises Ashwini Bhide BMC Commissioner,https://indianexpress.com/article/trending/trending-in-india/anand-mahindra-praise-ashwini-bhide-first-woman-bmc-commissioner-mumbai-metro-10620252/,2026-04-08T20:43:04+00:00
Indian Express,24,Arunachal traveller Bihar viral video,https://indianexpress.com/article/trending/trending-in-india/arunachal-woman-biker-tenzin-metoh-bhagalpur-bihar-viral-video-kindness-10620128/,2026-04-08T20:43:04+00:00
Indian Express,25,Sunanda Sharma Ghaziabad concert incident,https://indianexpress.com/article/trending/trending-in-india/sunanda-sharma-ghaziabad-concert-interrupted-fan-stage-invasion-rkgit-viral-video-10619946/,2026-04-08T20:43:04+00:00
Indian Express,26,Zambian dancers Lollipop Lagelu Bihar Diwas,https://indianexpress.com/article/trending/trending-in-india/zambian-dancers-lollipop-lagelu-bihar-diwas-zambia-viral-video-10619855/,2026-04-08T20:43:04+00:00
Indian Express,27,A windsurfer was knocked off his board after colliding with a gray whale in San Francisco Bay,https://indianexpress.com/article/trending/trending-globally/san-francisco-whale-collision-video-windsurfer-10618949/,2026-04-08T20:43:04+00:00
LiveMint,1,"Daniil Medvedev smashes racquet in shocking 6-0, 6-0 loss at Monte Carlo Masters",https://www.livemint.com/us/trending/daniil-medvedev-racquet-video-in-shocking-6-0-6-0-clay-defeat-to-matteo-berrettini-at-monte-carlo-masters-11775674478886.html,2026-04-08T20:43:04+00:00
LiveMint,2,"Konnor Griffin signs 9-year, $140 million contract extension with Pirates",https://www.livemint.com/us/trending/konnor-griffin-signs-record-9-year-140-million-contract-extension-with-pittsburgh-pirates-mlb-baseball-11775653782727.html,2026-04-08T20:43:04+00:00
LiveMint,3,JD Vance’s awkward moment: Trump sends call to voicemail during live rally,https://www.livemint.com/us/trending/jd-vance-s-awkward-moment-trump-sends-call-to-voicemail-during-live-rally-in-hungary-watch-11775589348677.html,2026-04-08T20:43:04+00:00
LiveMint,4,"Islanders fire Patrick Roy, hire Peter DeBoer as head coach amid playoff push",https://www.livemint.com/us/trending/patrick-roy-fired-by-new-york-islanders-hire-peter-deboer-as-head-coach-amid-playoff-push-nhl-hockey-11775415170584.html,2026-04-08T20:43:04+00:00
LiveMint,5,Geno Auriemma apologizes to South Carolina after outburst in women's Final Four,https://www.livemint.com/us/trending/geno-auriemma-apologizes-to-south-carolina-after-emotional-outburst-vs-dawn-staley-in-womens-final-four-11775394255637.html,2026-04-08T20:43:04+00:00
LiveMint,6,NCAA Final Four 2026: UConn vs Illinois and Michigan vs Arizona results,https://www.livemint.com/us/trending/ncaa-final-four-2026-results-what-happened-in-uconn-vs-illinois-and-michigan-vs-arizona-march-madness-semifinals-11775390782036.html,2026-04-08T20:43:04+00:00
LiveMint,7,NASA’s Artemis II astronauts face toilet problem; social media reacts with memes,https://www.livemint.com/us/trending/nasas-artemis-ii-astronauts-faces-toilet-problem-in-space-social-media-reacts-with-jokes-memes-blame-ice-for-this-to-11775363905958.html,2026-04-08T20:43:04+00:00
LiveMint,8,Man City thrash Liverpool 4-0 while Chelsea crush Port Vale 7-0 in FA Cup QFs,https://www.livemint.com/us/trending/manchester-city-vs-liverpool-4-0-chelsea-vs-port-vale-7-0-fa-cup-quarterfinals-11775328419465.html,2026-04-08T20:43:04+00:00
LiveMint,9,Juan Soto calf injury: Mets star to undergo MRI after early exit vs Giants,https://www.livemint.com/us/trending/juan-soto-calf-injury-new-york-mets-star-to-undergo-mri-after-early-exit-vs-san-francisco-giants-11775306968287.html,2026-04-08T20:43:04+00:00
LiveMint,10,New York teacher earning $90K turns to $55/hour side gig to repay student loans,https://www.livemint.com/us/trending/new-york-teacher-earning-90k-turns-to-55-hour-side-gig-to-repay-student-loans-11775314789062.html,2026-04-08T20:43:04+00:00
LiveMint,11,NCAA men's Final Four matchups: Schedule and key details,https://www.livemint.com/us/trending/uconn-vs-illinois-and-arizona-vs-michigan-2026-ncaa-mens-final-four-matchups-schedule-and-key-details-11775243799182.html,2026-04-08T20:43:04+00:00
LiveMint,12,Gennaro Gattuso steps down as Italy manager after 2026 World Cup qualifier,https://www.livemint.com/us/trending/gennaro-gattuso-steps-down-as-italy-manager-after-2026-world-cup-qualifier-heartbreak-11775221292115.html,2026-04-08T20:43:04+00:00
LiveMint,13,"Vanessa Trump frustrated with Tiger Woods’ behavior, puts him on notice",https://www.livemint.com/us/trending/vanessa-trump-frustrated-with-tiger-woods-behavior-puts-him-on-notice-stop-acting-like-a-teenager-grow-up-11775209989597.html,2026-04-08T20:43:04+00:00
LiveMint,14,What’s wrong with Tiger Woods? ‘Heartbreaking’ video leaves fans worried,https://www.livemint.com/us/trending/whats-wrong-with-tiger-woods-heartbreaking-video-after-dui-arrest-leaves-fans-worried-mental-health-is-real-11775191311157.html,2026-04-08T20:43:04+00:00
LiveMint,15,McDonald's drops new under $3 menu and $4 breakfast deal — Here’s what you get,https://www.livemint.com/us/trending/mcdonalds-drops-new-under-3-menu-and-4-breakfast-deal-here-s-what-you-can-get-11775157327207.html,2026-04-08T20:43:04+00:00
LiveMint,16,Rapper J. Cole joins China’s Nanjing Monkey Kings for pro basketball stint,https://www.livemint.com/us/trending/grammywinning-rapper-j-cole-joins-china-s-nanjing-monkey-kings-for-pro-basketball-stint-11775141367888.html,2026-04-08T20:43:04+00:00
LiveMint,17,April Fools’ Day 2026 deals: No-joke discounts from Dunkin' and more,https://www.livemint.com/us/trending/april-fools-day-2026-discounts-dunkin-checkers-rally-hooters-qdoba-artemis-ii-doughnut-11775054510320.html,2026-04-08T20:43:04+00:00
LiveMint,18,"Oracle employee, despite being laid off, remains positive: ‘It happens…'",https://www.livemint.com/us/trending/oracle-employee-despite-being-laid-off-remains-positive-it-happens-will-enjoy-sleeping-11775051244639.html,2026-04-08T20:43:04+00:00
LiveMint,19,Warren Buffett teams up with NBA star Stephen Curry for charity lunch auction,https://www.livemint.com/us/trending/warren-buffett-teams-up-with-nba-star-stephen-curry-for-charity-lunch-auction-berkshire-event-returns-in-2026-11774962320767.html,2026-04-08T20:43:04+00:00
LiveMint,20,Tiger Woods’ ex Kristin Smith breaks silence after ‘triggering’ DUI arrest,https://www.livemint.com/us/trending/tiger-woods-ex-kristin-smith-breaks-silence-after-triggering-dui-arrest-seeks-privacy-11774949316320.html,2026-04-08T20:43:04+00:00
LiveMint,21,"Sophie Turner injured, Tomb Raider series halts production temporarily",https://www.livemint.com/us/trending/sophie-turner-injured-tomb-raider-series-halts-production-temporarily-11774878671976.html,2026-04-08T20:43:04+00:00
LiveMint,22,Viral video of Kash Patel dancing? Here’s the truth behind the clip,https://www.livemint.com/us/trending/viral-video-of-kash-patel-dancing-here-s-the-truth-behind-the-clip-11774814955782.html,2026-04-08T20:43:04+00:00
LiveMint,23,"Arnold Schwarzenegger returns to gym—But this time, he’s coaching his son |Watch",https://www.livemint.com/us/trending/arnold-schwarzenegger-returns-to-gym-but-this-time-he-s-coaching-his-son-to-bodybuilding-glory-watch-11774816425352.html,2026-04-08T20:43:04+00:00
LiveMint,24,"Bachelorette star James McCoy Taylor arrested again, months after guilty plea",https://www.livemint.com/us/trending/bachelorette-star-james-mccoy-taylor-arrested-again-months-after-guilty-plea-11774189913536.html,2026-04-08T20:43:04+00:00
LiveMint,25,Comedian jokes about Jews’ expulsion: Social media reacts to viral video,https://www.livemint.com/us/trending/comedian-jokes-about-jews-expulsion-social-media-reacts-to-viral-video-using-antisemitic-talking-points-as-humor-11773998180773.html,2026-04-08T20:43:04+00:00
LiveMint,26,Who is Joseph Duggar? All about reality TV star arrested on abuse charges,https://www.livemint.com/us/trending/who-is-joseph-duggar-all-about-the-19-kids-and-counting-star-arrested-on-abuse-charges-11773894381944.html,2026-04-08T20:43:04+00:00
LiveMint,27,"St Patrick’s Day 2026: Date, history, meaning and traditions worldwide",https://www.livemint.com/us/trending/st-patrick-s-day-2026-date-history-meaning-and-traditions-worldwide-11773760629096.html,2026-04-08T20:43:04+00:00
LiveMint,28,Oscars 2026: What’s on the menu at official after-party for Hollywood A-listers?,https://www.livemint.com/us/trending/oscars-2026-what-s-on-the-menu-at-the-official-after-party-luxurious-food-desserts-and-drinks-for-hollywood-alisters-11773548247036.html,2026-04-08T20:43:04+00:00
LiveMint,29,"Meghan Markle: Harry’s wife faces backlash over $2,235 ticket for group photo",https://www.livemint.com/us/trending/meghan-markle-harry-s-wife-faces-backlash-over-2-235-vip-ticket-for-group-photo-she-s-a-nobody-who-tricked-a-prince-11773538916724.html,2026-04-08T20:43:04+00:00
LiveMint,30,Apple kicks off 50th anniversary with surprise performance by Alicia Keys in NY,https://www.livemint.com/us/trending/alicia-keys-turns-apples-grand-central-in-new-york-into-a-concert-venue-at-tech-giant-s-50th-anniversary-kickoff-11773508129097.html,2026-04-08T20:43:04+00:00
LiveMint,31,"Marco Rubio large shoe size stuns Internet, social media points to ‘sycophancy'",https://www.livemint.com/us/trending/marco-rubio-large-shoe-size-stuns-internet-social-media-points-to-sycophancy-idol-worship-among-trump-officials-11773470692943.html,2026-04-08T20:43:04+00:00
LiveMint,32,Was Bill Clinton about to push Hillary into running traffic? Watch viral video,https://www.livemint.com/us/trending/did-bill-clinton-almost-push-hillary-into-running-traffic-social-media-reacts-to-viral-video-hes-was-so-close-11773280988605.html,2026-04-08T20:43:04+00:00
LiveMint,33,"Dr Dre net worth: Inside his earnings, brands, cars and real estate",https://www.livemint.com/us/trending/dr-dre-net-worth-how-did-the-new-billionaire-make-his-fortune-inside-his-earnings-cars-mansions-and-brands-11773167989493.html,2026-04-08T20:43:04+00:00
LiveMint,34,Nike launches Air Jordan 4 Retro ‘Imperial Purple’ sneakers: Details,https://www.livemint.com/us/trending/nike-launches-air-jordan-4-retro-imperial-purple-sneakers-how-much-do-they-cost-where-to-buy-online-11772907741201.html,2026-04-08T20:43:04+00:00
LiveMint,35,Quote of the day by Robert T Kiyosaki on success: ‘Winners are not afraid of….',https://www.livemint.com/us/trending/quote-of-the-day-by-robert-t-kiyosaki-on-success-winners-are-not-afraid-of-losing-but-11772854894148.html,2026-04-08T20:43:04+00:00
LiveMint,36,Bodybuilder Jeff Nippard’s fiancé Stephanie Buttermore dies at 36,https://www.livemint.com/us/trending/bodybuilder-jeff-nippard-s-fianc-stephanie-buttermore-dies-at-36-a-look-at-the-late-fitness-stars-net-worth-11772860396173.html,2026-04-08T20:43:04+00:00
LiveMint,37,Toddler triggers airport alarms chasing a toy; what happened next surprised all,https://www.livemint.com/us/trending/toddler-triggers-airport-alarms-chasing-a-toy-what-happened-next-surprised-everyone-11772786934708.html,2026-04-08T20:43:04+00:00
LiveMint,38,Quote of the day by Abraham Lincoln: ‘We the people are rightful masters of…’,https://www.livemint.com/us/trending/quote-of-the-day-by-abraham-lincoln-we-the-people-are-rightful-masters-of-11772622098976.html,2026-04-08T20:43:04+00:00
LiveMint,39,Can AI really do your taxes? Elon Musk sparks massive online debate,https://www.livemint.com/us/trending/can-grok-help-you-cut-your-taxes-elon-musk-says-11772572363426.html,2026-04-08T20:43:04+00:00
LiveMint,40,Mark to Market,https://www.livemint.com/market/mark-to-market,2026-04-08T20:43:04+00:00
LiveMint,41,Oil tumbles below $100 after Trump announces two-week ceasefire,https://www.livemint.com/market/oil-tumbles-below-100-after-trump-announces-two-week-ceasefire-11775677984340.html,2026-04-08T20:43:04+00:00
LiveMint,42,Short Sellers Squeezed Hard as Avis Shares Rocket 150%,https://www.livemint.com/market/short-sellers-squeezed-hard-as-avis-shares-rocket-150-11775677126619.html,2026-04-08T20:43:04+00:00
LiveMint,43,Treasuries Waver as Iranian Official Says Ceasefire Violated,https://www.livemint.com/market/treasuries-waver-as-iranian-official-says-ceasefire-violated-11775676444659.html,2026-04-08T20:43:04+00:00
LiveMint,44,April’s First US Treasury Auctions See Improved Demand,https://www.livemint.com/market/aprils-first-us-treasury-auctions-see-improved-demand-11775674099826.html,2026-04-08T20:43:04+00:00
LiveMint,45,Lupin shares to be in focus on Thursday as USFDA approves Dapagliflozin and Metformin tablets,https://www.livemint.com/market/stock-market-news/lupin-shares-to-be-in-focus-on-thursday-as-usfda-approves-dapagliflozin-and-metformin-tablets-11775669174996.html,2026-04-08T20:43:04+00:00
LiveMint,46,Delta Air Lines shares climb over 11% even as carrier forecasts higher fuel costs in second quarter,https://www.livemint.com/market/stock-market-news/delta-air-lines-shares-climb-over-11-even-as-carrier-forecasts-higher-fuel-costs-in-second-quarter-11775663970315.html,2026-04-08T20:43:04+00:00
LiveMint,47,‘Shut down the business’: US company faces backlash over ‘earth usage fee’ on online orders,https://www.livemint.com/news/trends/shut-down-the-business-us-company-faces-backlash-over-earth-usage-fee-on-online-orders-11775679850939.html,2026-04-08T20:43:04+00:00
LiveMint,48,JD Vance to lead US delegation to Pakistan for direct talks with Iran amid fragile ceasefire,https://www.livemint.com/news/us-news/jd-vance-to-lead-us-delegation-to-pakistan-for-direct-talks-with-iran-amid-fragile-ceasefire-11775677989327.html,2026-04-08T20:43:04+00:00
LiveMint,49,"Tik Tok star Khaby Lame divorce case raises questions on $20 million net worth, assets in father’s name",https://www.livemint.com/news/trends/tik-tok-star-khaby-lame-divorce-case-raises-questions-on-20-million-net-worth-assets-in-father-s-name-11775671687368.html,2026-04-08T20:43:04+00:00
LiveMint,50,Matthew Perry death: ‘Ketamine Queen’ gets 15 years in prison,https://www.livemint.com/news/us-news/matthew-perry-death-ketamine-queen-gets-15-years-in-prison-11775673987086.html,2026-04-08T20:43:04+00:00
LiveMint,51,White House demands Iran reopen Strait of Hormuz immediately after closure claims,https://www.livemint.com/news/us-news/white-house-demands-iran-reopen-strait-of-hormuz-immediately-after-closure-claims-11775671281945.html,2026-04-08T20:43:04+00:00
LiveMint,52,Quote of the day: Robert Kiyosaki on financial freedom- ‘Financial struggle is often the result of people working…’,https://www.livemint.com/news/us-news/quote-of-the-day-robert-kiyosaki-on-financial-freedom-financial-struggle-is-often-the-result-of-people-working-11775671085147.html,2026-04-08T20:43:04+00:00
LiveMint,53,Salary Impact Tracker,https://www.livemint.com/tools-calculators/salary-impact-tracker,2026-04-08T20:43:04+00:00
LiveMint,54,Banks Selling $3 Billion Debt for Meta’s Prometheus Data Center,https://www.livemint.com/companies/banks-selling-3-billion-debt-for-meta-s-prometheus-data-center-11775676946793.html,2026-04-08T20:43:04+00:00
LiveMint,55,"US banks could release $320 billion in capital with new draft rules, analysts say",https://www.livemint.com/companies/us-banks-could-release-320-billion-in-capital-with-new-draft-rules-analysts-say-11775675521680.html,2026-04-08T20:43:04+00:00
LiveMint,56,"Amazon denies reports of 14,000 layoffs planned for May: ‘…not based in fact’",https://www.livemint.com/companies/news/amazon-denies-reports-of-14-000-layoffs-planned-for-may-not-based-in-fact-11775664019857.html,2026-04-08T20:43:04+00:00
LiveMint,57,PPFAS Asset Management gets PFRDA approval to launch pension fund under NPS,https://www.livemint.com/money/ppfas-asset-management-gets-pfrda-approval-to-launch-pension-fund-under-nps-11775644238225.html,2026-04-08T20:43:04+00:00
LiveMint,58,TikTok plans second billion-dollar data centre in Finland in move to store European user data locally,https://www.livemint.com/companies/news/tiktok-to-set-up-second-billion-dollar-data-centre-in-finland-in-move-to-store-european-user-data-locally-11775646618820.html,2026-04-08T20:43:04+00:00
LiveMint,59,"Neo Alternative Asset Managers plots ₹2,000-crore realty debut with Walton Street veterans",https://www.livemint.com/companies/news/neo-alternative-asset-managers-real-estate-fund-india-11775637596726.html,2026-04-08T20:43:04+00:00
LiveMint,60,Ask Mint Money,https://www.livemint.com/money/ask-mint-money,2026-04-08T20:43:04+00:00
LiveMint,61,Gifting property to your spouse? The taxman is watching now,https://www.livemint.com/money/personal-finance/income-tax-property-gift-spouse-clubbing-provisions-reporting-11775640281359.html,2026-04-08T20:43:04+00:00
LiveMint,62,"EPFO 3.0: From PF withdrawal categories and pension to UPI-based fund access, here are 10 key things to know",https://www.livemint.com/money/personal-finance/epfo-3-0-from-withdrawal-categories-and-pension-to-upi-based-fund-access-here-are-10-key-things-to-know-11775650300486.html,2026-04-08T20:43:04+00:00
LiveMint,63,Is diversifying into real estate a good idea when your portfolio has 60% equity exposure?,https://www.livemint.com/money/personal-finance/is-diversifying-into-real-estate-a-good-idea-when-your-portfolio-has-60-equity-exposure-11775622374961.html,2026-04-08T20:43:04+00:00
LiveMint,64,Is your KYC safe? 5 steps to check status and avoid mutual fund scams,https://www.livemint.com/money/personal-finance/is-your-kyc-safe-5-steps-to-check-status-and-avoid-mutual-fund-scams-11775642574201.html,2026-04-08T20:43:04+00:00
LiveMint,65,RBI policy: Why the end of the ‘Goldilocks’ phase isn’t a jolt for investors,https://www.livemint.com/money/personal-finance/rbi-policy-goldilocks-economy-india-inflation-outlook-investors-11775634251600.html,2026-04-08T20:43:04+00:00
LiveMint,66,"Meta unveils Muse Spark AI to rival Google, OpenAI; stock rallies 7%",https://www.livemint.com/technology/meta-unveils-first-ai-model-from-costly-superintelligence-team-11775665071090.html,2026-04-08T20:43:04+00:00
LiveMint,67,How to use Google Gemini's new AI shopping features in India: Check step-by-step guide,https://www.livemint.com/technology/tech-news/how-to-use-google-geminis-new-ai-shopping-features-in-india-check-step-by-step-guide-11775576244400.html,2026-04-08T20:43:04+00:00
LiveMint,68,Keep your number hidden: WhatsApp reportedly begins rolling out username feature to change how you chat,https://www.livemint.com/technology/tech-news/keep-your-number-hidden-whatsapp-reportedly-begins-rolling-out-username-feature-to-change-how-you-chat-11775643338292.html,2026-04-08T20:43:04+00:00
LiveMint,69,What is ‘Ghost Murmur’? The secret CIA heartbeat tracker used to find downed American pilot in Iran,https://www.livemint.com/technology/tech-news/what-is-ghost-murmur-the-secret-cia-heartbeat-tracker-used-to-find-downed-american-pilot-in-iran-11775630423998.html,2026-04-08T20:43:04+00:00
LiveMint,70,Mint Explainer | Anthropic biotech bet and AI's growing importance for Indian pharma,https://www.livemint.com/technology/india-pharma-ai-anthropic-coefficient-bio-drug-discovery-sun-pharma-biocon-glenmark-11775418665231.html,2026-04-08T20:43:04+00:00
LiveMint,71,"Vivo T5 Pro 5G India launch date confirmed: Expected price, specifications and features",https://www.livemint.com/technology/gadgets/vivo-t5-pro-5g-india-launch-date-confirmed-expected-price-specifications-and-features-11775632542323.html,2026-04-08T20:43:04+00:00
LiveMint,72,IPL 2026 Schedule,https://www.livemint.com/sports/cricket-news/ipl-schedule,2026-04-08T20:43:04+00:00
LiveMint,73,Orange Cap in IPL 2026,https://www.livemint.com/sports/cricket-news/ipl-orange-cap,2026-04-08T20:43:04+00:00
LiveMint,74,Purple Cap in IPL 2026,https://www.livemint.com/sports/cricket-news/ipl-purple-cap,2026-04-08T20:43:04+00:00
LiveMint,75,IPL 2026 Points Table,https://www.livemint.com/sports/cricket-news/ipl-points-table,2026-04-08T20:43:04+00:00
LiveMint,76,IFSC Code Finder,https://www.livemint.com/ifsc-code,2026-04-08T20:43:04+00:00
LiveMint,77,Income Tax Calculator,https://www.livemint.com/tools-calculators/income-tax-calculator,2026-04-08T20:43:04+00:00
LiveMint,78,Gold Rate Today,https://www.livemint.com/gold-prices,2026-04-08T20:43:04+00:00
LiveMint,79,Gold Rate in Delhi,https://www.livemint.com/gold-prices/delhi,2026-04-08T20:43:04+00:00
LiveMint,80,Gold Rate Hyderabad,https://www.livemint.com/gold-prices/hyderabad,2026-04-08T20:43:04+00:00
LiveMint,81,Silver Rate Today,https://www.livemint.com/silver-prices,2026-04-08T20:43:04+00:00
LiveMint,82,Silver Rate in Delhi,https://www.livemint.com/silver-prices/delhi,2026-04-08T20:43:04+00:00
LiveMint,83,Silver Rate in Bangalore,https://www.livemint.com/silver-prices/bangalore,2026-04-08T20:43:04+00:00
