source,rank,headline,link,collected_at_iso
LiveMint,76,IPL 2026 Points Table,https://www.livemint.com/sports/cricket-news/ipl-points-table,2026-04-14T15:13:57+00:00
LiveMint,77,IFSC Code Finder,https://www.livemint.com/ifsc-code,2026-04-14T15:13:57+00:00
LiveMint,78,Income Tax Calculator,https://www.livemint.com/tools-calculators/income-tax-calculator,2026-04-14T15:13:57+00:00
LiveMint,79,Gold Rate Today,https://www.livemint.com/gold-prices,2026-04-14T15:13:57+00:00
LiveMint,80,Gold Rate in Delhi,https://www.livemint.com/gold-prices/delhi,2026-04-14T15:13:57+00:00
LiveMint,81,Gold Rate Hyderabad,https://www.livemint.com/gold-prices/hyderabad,2026-04-14T15:13:57+00:00
LiveMint,82,Silver Rate Today,https://www.livemint.com/silver-prices,2026-04-14T15:13:57+00:00
LiveMint,83,Silver Rate in Delhi,https://www.livemint.com/silver-prices/delhi,2026-04-14T15:13:57+00:00
LiveMint,84,Silver Rate in Bangalore,https://www.livemint.com/silver-prices/bangalore,2026-04-14T15:13:57+00:00
LiveMint,85,US Stock Market,https://www.livemint.com/market/us-market,2026-04-14T15:13:57+00:00
LiveMint,86,Terms of Use,https://www.livemint.com/terms-of-use,2026-04-14T15:13:57+00:00
LiveMint,87,Code of ethics,https://www.livemint.com/code-of-ethics,2026-04-14T15:13:57+00:00
LiveMint,88,Stock Market Today,https://www.livemint.com/market/stock-market-news/stock-market-today-sensex-today-nifty-gold-rate-today-silver-rate-today-crude-oil-prices-us-iran-war-trump-7-april-2026-11775527434110.html,2026-04-14T15:13:57+00:00
LiveMint,89,MCX Gold Rate,https://www.livemint.com/market/market-stats/commodity-mcx-gold-price,2026-04-14T15:13:57+00:00
LiveMint,90,MCX Silver Price,https://www.livemint.com/market/market-stats/commodity-mcx-silver-price,2026-04-14T15:13:57+00:00
LiveMint,91,Gold Price in Mumbai,https://www.livemint.com/gold-prices/mumbai,2026-04-14T15:13:57+00:00
LiveMint,92,Gold Price in Chennai,https://www.livemint.com/gold-prices/chennai,2026-04-14T15:13:57+00:00
LiveMint,93,Gold Price in Kolkata,https://www.livemint.com/gold-prices/kolkata,2026-04-14T15:13:57+00:00
LiveMint,94,Silver Price in Mumbai,https://www.livemint.com/silver-prices/mumbai,2026-04-14T15:13:57+00:00
LiveMint,95,Silver Price in Chennai,https://www.livemint.com/silver-prices/chennai,2026-04-14T15:13:57+00:00
LiveMint,96,Silver Price in Hyderabad,https://www.livemint.com/silver-prices/hyderabad,2026-04-14T15:13:57+00:00
LiveMint,97,Silver Price in Kolkata,https://www.livemint.com/silver-prices/kolkata,2026-04-14T15:13:57+00:00
LiveMint,98,Latest News Today,https://www.livemint.com/news,2026-04-14T15:13:57+00:00
LiveMint,99,US News Today,https://www.livemint.com/news/us-news,2026-04-14T15:13:57+00:00
LiveMint,100,Top Company Leader,https://www.livemint.com/companies/people,2026-04-14T15:13:57+00:00
LiveMint,101,personal loan emi calculator,https://www.livemint.com/loans/personal-loan-emi-calculator,2026-04-14T15:13:57+00:00
LiveMint,102,Personal Loan Interest Rate,https://www.livemint.com/loans/personal-loan-interest-rates,2026-04-14T15:13:57+00:00
LiveMint,103,Personal Loan Eligibility,https://www.livemint.com/loans/personal-loan-eligibility,2026-04-14T15:13:57+00:00
LiveMint,104,Instant Personal Loan,https://www.livemint.com/loans/instant-personal-loan,2026-04-14T15:13:57+00:00
LiveMint,105,Home Loan EMI Calculator,https://www.livemint.com/tools-calculators/home-loan-emi-calculator,2026-04-14T15:13:57+00:00
LiveMint,106,Car Loan EMI,https://www.livemint.com/tools-calculators/car-loan-calculator,2026-04-14T15:13:57+00:00
India Today,1,"Mexico zoo's baby monkey clings to teddy bear, reminds Internet of Japan's Punch",https://www.indiatoday.in/trending-news/story/mexico-zoos-baby-monkey-clings-to-teddy-bear-reminds-internet-of-japans-punch-2896204-2026-04-14,2026-04-14T15:13:57+00:00
India Today,2,Bengaluru Police play referee in unusual kitten custody drama,https://www.indiatoday.in/trending-news/story/bengaluru-police-play-referee-in-unusual-kitten-custody-drama-2896192-2026-04-14,2026-04-14T15:13:57+00:00
India Today,3,"Woman purposely drops Rs 70,000 ring at IPL stadium to film reel, fails to find it",https://www.indiatoday.in/trending-news/story/woman-purposely-drops-rs-70000-ring-at-ipl-stadium-to-film-reel-fails-to-find-it-2896149-2026-04-14,2026-04-14T15:13:57+00:00
India Today,4,"Employee quits in 7 days over 'toxic behaviour,' HR denies salary on WhatsApp",https://www.indiatoday.in/trending-news/story/employee-quits-in-7-days-over-toxic-behaviour-hr-denies-salary-on-whatsapp-2896095-2026-04-14,2026-04-14T15:13:57+00:00
India Today,5,Delhi firm HR insists on 90-day notice period. Employee hits back with one question,https://www.indiatoday.in/trending-news/story/delhi-firm-hr-insists-on-90-day-notice-period-employee-hits-back-with-one-question-2896073-2026-04-14,2026-04-14T15:13:57+00:00
India Today,6,"Man shares how his cab driver helped him save Rs 75,000 on car purchase",https://www.indiatoday.in/trending-news/story/man-shares-how-his-cab-driver-helped-him-save-rs-75000-on-car-purchase-2896042-2026-04-14,2026-04-14T15:13:57+00:00
India Today,7,"Odisha women trick shopkeepers to steal sarees worth Rs 7 lakh, caught on camera",https://www.indiatoday.in/trending-news/story/odisha-women-trick-shopkeepers-to-steal-sarees-worth-rs-7-lakh-caught-on-camera-2895975-2026-04-14,2026-04-14T15:13:57+00:00
India Today,8,"Family faces backlash for enjoying snacks in train, but not everyone agrees",https://www.indiatoday.in/trending-news/story/family-faces-backlash-for-enjoying-snacks-in-train-but-not-everyone-agrees-2895999-2026-04-14,2026-04-14T15:13:57+00:00
India Today,9,"Men in Thar create ruckus in Noida, one gets hit by bike, video leads to arrest",https://www.indiatoday.in/trending-news/story/men-in-thar-create-ruckus-in-noida-one-gets-hit-by-bike-video-leads-to-arrest-2895944-2026-04-14,2026-04-14T15:13:57+00:00
India Today,10,Strait of Hormuz is not social media: Iran roasts Trump for blocking its ports,https://www.indiatoday.in/trending-news/story/strait-of-hormuz-is-not-social-media-iran-roasts-trump-for-blocking-its-ports-2895948-2026-04-14,2026-04-14T15:13:57+00:00
India Today,11,Pakistani woman shares what her 10-hour layover at Mumbai airport looked like,https://www.indiatoday.in/trending-news/story/pakistani-woman-shares-what-her-10-hour-layover-at-mumbai-airport-looked-like-2895914-2026-04-14,2026-04-14T15:13:57+00:00
India Today,12,Man confronts woman clerk over 'ticket scam' at Bhopal station. Railways reacts,https://www.indiatoday.in/trending-news/story/man-confronts-woman-clerk-over-ticket-scam-at-bhopal-station-railways-reacts-2895917-2026-04-14,2026-04-14T15:13:57+00:00
India Today,13,"Gyaan bhi, swag bhi: Iran consulate's post praising India has the internet talking",https://www.indiatoday.in/trending-news/story/gyaan-bhi-swag-bhi-iran-consulates-post-praising-india-has-the-internet-talking-2895887-2026-04-14,2026-04-14T15:13:57+00:00
India Today,14,"22-year-old man quits corporate job after earning Rs 40,000 as delivery agent",https://www.indiatoday.in/trending-news/story/22-year-old-man-quits-corporate-job-after-earning-rs-40000-as-delivery-agent-2895837-2026-04-14,2026-04-14T15:13:57+00:00
India Today,15,"Mamata Banerjee spotted wearing 3 fitness trackers, here's why it's not unusual",https://www.indiatoday.in/trending-news/story/mamata-banerjee-spotted-wearing-3-fitness-trackers-heres-why-its-not-unusual-2895773-2026-04-14,2026-04-14T15:13:57+00:00
India Today,16,CISF's quick action helps German passenger retrieve bag at Delhi airport,https://www.indiatoday.in/trending-news/story/cisfs-quick-action-helps-german-passenger-retrieve-bag-at-delhi-airport-2895654-2026-04-13,2026-04-14T15:13:57+00:00
India Today,17,Lion pulled to safety after hour-long rescue in Gujarat. Deputy CM shares video,https://www.indiatoday.in/trending-news/story/lion-pulled-to-safety-after-hour-long-rescue-in-gujarat-deputy-cm-shares-video-2895635-2026-04-13,2026-04-14T15:13:57+00:00
India Today,18,Bengaluru founder blames pedestrians for traffic jam. Internet has thoughts,https://www.indiatoday.in/trending-news/story/bengaluru-founder-blames-pedestrians-for-traffic-jam-internet-has-thoughts-2895578-2026-04-13,2026-04-14T15:13:57+00:00
India Today,19,"Red panda cute, Hungrypanda not: Zohran Mamdani's zoo announcement goes viral",https://www.indiatoday.in/trending-news/story/zohran-mamdanis-zoo-announcement-goes-viral-in-new-york-city-food-delivery-app-hungrypanda-settlement-2895546-2026-04-13,2026-04-14T15:13:57+00:00
India Today,20,"After Arijit Singh concert, HCL employees discover an unexpected metro perk",https://www.indiatoday.in/trending-news/story/after-arijit-singh-concert-hcl-employees-discover-an-unexpected-delhi-metro-perk-2895486-2026-04-13,2026-04-14T15:13:57+00:00
India Today,21,We all love you: Trump's special message for PM Modi during call,https://www.indiatoday.in/india/story/trump-pm-modi-praise-during-call-hormuz-iran-war-ceasefire-2896205-2026-04-14,2026-04-14T15:13:57+00:00
India Today,22,CSK's Ruturaj Gaikwad under pressure after fifth successive failure in IPL 2026,https://www.indiatoday.in/sports/cricket/story/ipl-2026-csk-captain-ruturaj-gaikwad-form-raises-concerns-2896198-2026-04-14,2026-04-14T15:13:57+00:00
India Today,23,"YouTube now automatically adjust playback speed, changes control if you are walking",https://www.indiatoday.in/technology/news/story/youtube-now-automatically-adjust-playback-speed-changes-control-if-you-are-walking-2893747-2026-04-09,2026-04-14T15:13:57+00:00
India Today,24,"iPhone 18 Pro is launching soon, leak says Android is getting ready to copy its one big feature",https://www.indiatoday.in/technology/news/story/iphone-18-pro-is-launching-soon-leak-says-android-is-getting-ready-to-copy-its-one-big-feature-2896062-2026-04-14,2026-04-14T15:13:57+00:00
India Today,25,IPL 2026: Will Jacks set to join Mumbai Indians after missing first four games,https://www.indiatoday.in/sports/cricket/story/will-jacks-mumbai-indians-return-ipl-2026-after-absence-2896128-2026-04-14,2026-04-14T15:13:57+00:00
India Today,26,Thousands of birds fly as one over Delhi: Nature's stunning drone show explained,https://www.indiatoday.in/science/story/murmuration-of-birds-india-rosy-starlings-why-birds-fly-together-2894140-2026-04-10,2026-04-14T15:13:57+00:00
India Today,27,What happens after Ayodhya? The Renunciation reclaims Sita's voice,https://www.indiatoday.in/books/story/what-happens-after-ayodhya-the-renunciation-reclaims-sitas-voice-2896008-2026-04-14,2026-04-14T15:13:57+00:00
TOI ETimes,1,Kareena stuns in red Valentino as Saif can’t take eyes off her,https://timesofindia.indiatimes.com/articleshow/130209251.cms,2026-04-14T15:13:57+00:00
TOI ETimes,2,Inside Rajasthan’s push for meaningful baby names: What you name your child matters more than you think,https://timesofindia.indiatimes.com/articleshow/130161079.cms,2026-04-14T15:13:57+00:00
TOI ETimes,3,"Quote of the day by Claude Shannon, the eponym of Claude AI: Information is the resolution of uncertainty",https://timesofindia.indiatimes.com/articleshow/130164653.cms,2026-04-14T15:13:57+00:00
TOI ETimes,4,Indian and American parenting and parental care: Viral social media clip highlights cultural differences,https://timesofindia.indiatimes.com/articleshow/130167532.cms,2026-04-14T15:13:57+00:00
TOI ETimes,5,When “first day of school” feels like a big goodbye: A viral video every parent will relate to,https://timesofindia.indiatimes.com/articleshow/130167652.cms,2026-04-14T15:13:57+00:00
TOI ETimes,6,Not your usual ID check: School video showcases students’ hilarious ‘ID card emotions’,https://timesofindia.indiatimes.com/articleshow/130169206.cms,2026-04-14T15:13:57+00:00
TOI ETimes,7,"Akshay fell unconscious, had 103 degree fever, recalls miraculously surviving",https://timesofindia.indiatimes.com/articleshow/130262438.cms,2026-04-14T15:13:57+00:00
TOI ETimes,8,"Imran praises Adivi and Mrunal's Dacoit, calls Zayn ‘top star’",https://timesofindia.indiatimes.com/articleshow/130261029.cms,2026-04-14T15:13:57+00:00
TOI ETimes,9,Namit Malhotra confirms 'Brahmastra 2' after 'Ramayana',https://timesofindia.indiatimes.com/articleshow/130257470.cms,2026-04-14T15:13:57+00:00
TOI ETimes,10,'Dhurandhar 2' BO day 27 [LIVE]: Ranveer Singh film eyes Rs. 1100 crore milestone,https://timesofindia.indiatimes.com/articleshow/130254538.cms,2026-04-14T15:13:57+00:00
TOI ETimes,11,Vikram Bhatt recalls terrifying jail experience when he was arrested in Rs 30 cr fraud case,https://timesofindia.indiatimes.com/articleshow/130260575.cms,2026-04-14T15:13:57+00:00
TOI ETimes,12,"'Nobody supported Dhurandhar, people said it will decline on Monday'",https://timesofindia.indiatimes.com/articleshow/130258607.cms,2026-04-14T15:13:57+00:00
TOI ETimes,13,"""Golden era in Indian music has come to an end"": Sonia Gandhi pays tribute to Asha Bhosle after singer's demise",https://timesofindia.indiatimes.com/articleshow/130261993.cms,2026-04-14T15:13:57+00:00
TOI ETimes,14,‘Main Vaapas Aaunga’: Diljit Dosanjh and Imtiaz Ali give a glimpse behind the making of song ‘Kya Kamaal Hai’ - Watch,https://timesofindia.indiatimes.com/articleshow/130260959.cms,2026-04-14T15:13:57+00:00
TOI ETimes,15,'Dhurandhar 2’ BEATS ‘Jawan’ and ‘Stree 2’ in week 4,https://timesofindia.indiatimes.com/articleshow/130249009.cms,2026-04-14T15:13:57+00:00
TOI ETimes,16,'Dhurandhar 2' BO day 26 [LIVE]: Ranveer Singh film chases Rs. 1100 crore,https://timesofindia.indiatimes.com/articleshow/130230475.cms,2026-04-14T15:13:57+00:00
TOI ETimes,17,"'Dhurandhar 2' now first Hindi film to cross Rs 1,700 cr",https://timesofindia.indiatimes.com/articleshow/130222386.cms,2026-04-14T15:13:57+00:00
TOI ETimes,18,'Super Mario Galaxy' crowned highest-grossing film of 2026,https://timesofindia.indiatimes.com/articleshow/130220558.cms,2026-04-14T15:13:57+00:00
TOI ETimes,19,'Dhurandhar 2' box office Day 25 [LIVE]: Film is set to cross Rs 1080 cr today,https://timesofindia.indiatimes.com/articleshow/130204010.cms,2026-04-14T15:13:57+00:00
TOI ETimes,20,Animal Preview: Ranbir Kapoor and Sandeep Reddy Vanga are set to shake up the box office hierarchy,https://timesofindia.indiatimes.com/articleshow/105615612.cms,2026-04-14T15:13:57+00:00
TOI ETimes,21,Tu Jhoothi Main Makkaar,https://timesofindia.indiatimes.com/articleshow/98272134.cms,2026-04-14T15:13:57+00:00
TOI ETimes,22,Baseer Ali reacts to claims of him promoting hate on social media,https://timesofindia.indiatimes.com/articleshow/130257032.cms,2026-04-14T15:13:57+00:00
TOI ETimes,23,Mr. & Mrs. Parshuram: Shalini finally speaks up for herself,https://timesofindia.indiatimes.com/articleshow/130257072.cms,2026-04-14T15:13:57+00:00
TOI ETimes,24,Shehzad Shaikh on celebrating festival in Chandigarh,https://timesofindia.indiatimes.com/articleshow/130256297.cms,2026-04-14T15:13:57+00:00
TOI ETimes,25,Actress Anita Hassanandani celebrates her 45th birthday,https://timesofindia.indiatimes.com/articleshow/130255779.cms,2026-04-14T15:13:57+00:00
TOI ETimes,26,Wheel Of Fortune: Akshay Kumar recalls childhood days,https://timesofindia.indiatimes.com/articleshow/130256708.cms,2026-04-14T15:13:57+00:00
TOI ETimes,27,"How to clean a ceiling fan without a ladder: A smart, quick method",https://timesofindia.indiatimes.com/articleshow/130252044.cms,2026-04-14T15:13:57+00:00
TOI ETimes,28,5 national parks in India where chances of spotting a tiger is between 70–90 percent; India’s most reliable safaris to see the big cat,https://timesofindia.indiatimes.com/articleshow/130260890.cms,2026-04-14T15:13:57+00:00
TOI ETimes,29,Lisbon is the world’s most colourful city; Porto secures third place,https://timesofindia.indiatimes.com/articleshow/130258941.cms,2026-04-14T15:13:57+00:00
TOI ETimes,30,The secret to crispy fries: Why adding vinegar to potatoes works,https://timesofindia.indiatimes.com/articleshow/130255022.cms,2026-04-14T15:13:57+00:00
TOI ETimes,31,Why you should not wash a new clay pot with your hands inside: The right way to clean a matka,https://timesofindia.indiatimes.com/articleshow/130243466.cms,2026-04-14T15:13:57+00:00
TOI ETimes,32,What are aircraft boneyards and why do thousands of planes sit abandoned in deserts?,https://timesofindia.indiatimes.com/articleshow/130262681.cms,2026-04-14T15:13:57+00:00
TOI ETimes,33,"This one house is blocking the Delhi-Dehradun Expressway: What is Mandola’s ‘Swabhiman’, the home that refuses to move?",https://timesofindia.indiatimes.com/articleshow/130259687.cms,2026-04-14T15:13:57+00:00
TOI ETimes,34,Who is Azzi Fudd? The first No. 1 pick in WNBA history to sign league’s highest-ever rookie deal at $500K,https://timesofindia.indiatimes.com/articleshow/130260393.cms,2026-04-14T15:13:57+00:00
TOI ETimes,35,What really happened during her 10-hour Mumbai layover? Pakistani traveller’s India video goes viral,https://timesofindia.indiatimes.com/articleshow/130250806.cms,2026-04-14T15:13:57+00:00
TOI ETimes,36,Not feeling it today? 5 believable excuses to take a break from work,https://timesofindia.indiatimes.com/articleshow/130257176.cms,2026-04-14T15:13:57+00:00
TOI ETimes,37,"Angry over low salary, employee sleeps for 5 hours at work to protest – what happened next shocked everyone",https://timesofindia.indiatimes.com/articleshow/130255636.cms,2026-04-14T15:13:57+00:00
TOI ETimes,38,‘Gaate gaate hi chali jau’: Asha Bhosle’s heartfelt wish to embrace her final note while singing,https://timesofindia.indiatimes.com/articleshow/130229352.cms,2026-04-14T15:13:57+00:00
TOI ETimes,39,Juggy D: ‘Asha ji will forever be the definition of Indian music industry’ - Exclusive,https://timesofindia.indiatimes.com/articleshow/130228380.cms,2026-04-14T15:13:57+00:00
TOI ETimes,40,Shreya Ghoshal pays tribute to Asha Bhosle at her London concert: 'You are gonna be eternal',https://timesofindia.indiatimes.com/articleshow/130225605.cms,2026-04-14T15:13:57+00:00
TOI ETimes,41,Usha Uthup remembers Asha Bhosle,https://timesofindia.indiatimes.com/articleshow/130225773.cms,2026-04-14T15:13:57+00:00
TOI ETimes,42,Anup Jalota pays tribute: calls Asha Bhosle pillar of playback,https://timesofindia.indiatimes.com/articleshow/130225517.cms,2026-04-14T15:13:57+00:00
TOI ETimes,43,Dia Mirza remembers Asha Bhosle: Actor recalls first meeting and shoot,https://timesofindia.indiatimes.com/articleshow/130224700.cms,2026-04-14T15:13:57+00:00
TOI ETimes,44,Beyond Ebooks: The charm of bookstores endures,https://timesofindia.indiatimes.com/articleshow/101098088.cms,2026-04-14T15:13:57+00:00
TOI ETimes,45,It’s a curtain call: Sania Mirza bids adieu to tennis with ‘happy tears’,https://timesofindia.indiatimes.com/articleshow/98440670.cms,2026-04-14T15:13:57+00:00
TOI ETimes,46,A magical makeover for 17th Century stepwell: From neglected ruins to a glorious piece of history,https://timesofindia.indiatimes.com/articleshow/96557955.cms,2026-04-14T15:13:57+00:00
TOI ETimes,47,The city comes alive with Christmas fervour,https://timesofindia.indiatimes.com/articleshow/96406573.cms,2026-04-14T15:13:57+00:00
TOI ETimes,48,#BringRioHome: Pet parents launch search to find their kidnapped cat,https://timesofindia.indiatimes.com/articleshow/96334809.cms,2026-04-14T15:13:57+00:00
TOI ETimes,49,Adil Hussain’s 'Mercy' release date OUT: Film's first look to be attached with Ranveer Singh's 'Dhurandhar: The Revenge',https://timesofindia.indiatimes.com/articleshow/129843424.cms,2026-04-14T15:13:57+00:00
TOI ETimes,50,It’s the best time to be doing theatre: Juhi Babbar Soni,https://timesofindia.indiatimes.com/articleshow/129826631.cms,2026-04-14T15:13:57+00:00
TOI ETimes,51,"Anu Malik steps into theatre with Anupam Kher’s play, Calls it his most exciting challenge yet",https://timesofindia.indiatimes.com/articleshow/129729335.cms,2026-04-14T15:13:57+00:00
TOI ETimes,52,'Wicked' musical director John Stefaniuk on live music on the stage: 'It is so exciting to hear the orchestra whisk us away',https://timesofindia.indiatimes.com/articleshow/129610267.cms,2026-04-14T15:13:57+00:00
TOI ETimes,53,"'Wicked' stars Rebekah Lowings and Eve Shanu-Wilson on Elphaba-Glinda's bond: 'Friends challenge you, not just cheer you on'",https://timesofindia.indiatimes.com/articleshow/129607673.cms,2026-04-14T15:13:57+00:00
TOI ETimes,54,"Vijay Crishna, Shah Rukh Khan’s on-screen father in ‘Devdas,’ passes away at 81: Tributes pour in for theatre stalwart",https://timesofindia.indiatimes.com/articleshow/129016007.cms,2026-04-14T15:13:57+00:00
TOI ETimes,55,Raj Kundra and Shilpa Shetty's 15th Wedding Anniversary,https://timesofindia.indiatimes.com/articleshow/115563990.cms,2026-04-14T15:13:57+00:00
TOI ETimes,56,​Bigg Boss winners list from season 1 to 17​,https://timesofindia.indiatimes.com/articleshow/114277426.cms,2026-04-14T15:13:57+00:00
TOI ETimes,57,​Discover the bird with a prehistoric roar​,https://timesofindia.indiatimes.com/articleshow/114244474.cms,2026-04-14T15:13:57+00:00
TOI ETimes,58,Dia Mirza's ethnic wear,https://timesofindia.indiatimes.com/articleshow/114243410.cms,2026-04-14T15:13:57+00:00
TOI ETimes,59,​Incredible facts about ants you won’t believe​,https://timesofindia.indiatimes.com/articleshow/114243248.cms,2026-04-14T15:13:57+00:00
TOI ETimes,60,'Bigg Boss Marathi 5' nears grand finale​,https://timesofindia.indiatimes.com/articleshow/113936459.cms,2026-04-14T15:13:57+00:00
TOI ETimes,61,Ice cream brand's ‘ballet shoes’ ad backfires - internet says 'this feels weird',https://timesofindia.indiatimes.com/articleshow/130255174.cms,2026-04-14T15:13:57+00:00
TOI ETimes,62,Saw a cockroach at home? Here’s what it means and how to get rid of them,https://timesofindia.indiatimes.com/articleshow/130254758.cms,2026-04-14T15:13:57+00:00
TOI ETimes,63,‘Yeh hi appraisal hai?’ HCL’s free metro move after Arijit Singh concert triggers online backlash,https://timesofindia.indiatimes.com/articleshow/130251713.cms,2026-04-14T15:13:57+00:00
TOI ETimes,64,Video: She tried living on ₹500 in Bengaluru for a day – what happened next surprised many,https://timesofindia.indiatimes.com/articleshow/130250878.cms,2026-04-14T15:13:57+00:00
TOI ETimes,65,Samay Raina didn’t deliver perfect comedy – he delivered perfect catharsis,https://timesofindia.indiatimes.com/articleshow/130256789.cms,2026-04-14T15:13:57+00:00
TOI ETimes,66,Russian YouTuber Vitaly apologises to Indian man after wrongly accusing him of being a child predator: ‘We are deeply sorry’,https://timesofindia.indiatimes.com/articleshow/130252898.cms,2026-04-14T15:13:57+00:00
TOI ETimes,67,"Happy Puthandu 2026: Best Tamil New Year Messages, Quotes, Wishes and Images to share on Puthu Varudam",https://timesofindia.indiatimes.com/articleshow/130244000.cms,2026-04-14T15:13:57+00:00
TOI ETimes,68,"Happy Rongali Bihu 2026: Best Messages, Quotes, Wishes and Images to share on Assamese New Year",https://timesofindia.indiatimes.com/articleshow/130243736.cms,2026-04-14T15:13:57+00:00
TOI ETimes,69,"Ambedkar Jayanti 2026: Images, Quotes, Wishes, Messages, Cards, Greetings, and GIFs",https://timesofindia.indiatimes.com/articleshow/130242222.cms,2026-04-14T15:13:57+00:00
TOI ETimes,70,"Happy Vishu 2026: Wishes, Greetings Card, Messages, WhatsApp Status And Images To Share",https://timesofindia.indiatimes.com/articleshow/130236318.cms,2026-04-14T15:13:57+00:00
TOI ETimes,71,"Hyderabad shocker: Drunk BMW driver uses gadget to switch number plate in seconds, lands in police custody",https://timesofindia.indiatimes.com/articleshow/130243920.cms,2026-04-14T15:13:57+00:00
TOI ETimes,72,From silver rice to pampered chickens: 5 most royal yet peculiar cuisine practices of Emperor Akbar,https://timesofindia.indiatimes.com/articleshow/130243768.cms,2026-04-14T15:13:57+00:00
TOI ETimes,73,Beauty Queen to Army Officer: The inspiring journey of Lt. Kashish Methwani will give you goosebumps,https://timesofindia.indiatimes.com/articleshow/130242847.cms,2026-04-14T15:13:57+00:00
TOI ETimes,74,Viral: Hyderabad wedding cook reveals 4 secret ingredients behind perfect biryani,https://timesofindia.indiatimes.com/articleshow/130242045.cms,2026-04-14T15:13:57+00:00
TOI ETimes,75,"Meet Zeeshan Bakhrani: Fired twice, now making ₹1.3 crore a month from his Manhattan food venture",https://timesofindia.indiatimes.com/articleshow/130240704.cms,2026-04-14T15:13:57+00:00
TOI ETimes,76,Who is Angad Daryani? Indian-origin engineer who dropped out of school now spearheading air purification innovation,https://timesofindia.indiatimes.com/articleshow/130238967.cms,2026-04-14T15:13:57+00:00
TOI ETimes,77,"2-year-old starved to death, ate drywall and diapers in horror home; parents arrested",https://timesofindia.indiatimes.com/articleshow/130236870.cms,2026-04-14T15:13:57+00:00
TOI ETimes,78,‘Training their own replacements’: Indians filming AI training videos spark backlash online,https://timesofindia.indiatimes.com/articleshow/130235359.cms,2026-04-14T15:13:57+00:00
TOI ETimes,79,"Inside Jeff Bezos and Lauren Sanchez’s daily routine: No phones, sunrise coffee, and a ‘Billionaire Bunker’",https://timesofindia.indiatimes.com/articleshow/130235132.cms,2026-04-14T15:13:57+00:00
TOI ETimes,80,"Happy Baisakhi 2026: Best Messages, Quotes, Wishes and Images to share on Baisakhi",https://timesofindia.indiatimes.com/articleshow/130209908.cms,2026-04-14T15:13:57+00:00
TOI ETimes,81,What is ‘Katychella 2027’? Katy Perry’s viral comment on Justin Bieber at Coachella explained,https://timesofindia.indiatimes.com/articleshow/130233387.cms,2026-04-14T15:13:57+00:00
TOI ETimes,82,From sleeping on streets to giving shelter to others: NYC restaurant owner builds refuge for the homeless,https://timesofindia.indiatimes.com/articleshow/130232214.cms,2026-04-14T15:13:57+00:00
