source,rank,headline,link,collected_at_iso
LiveMint,84,US Stock Market,https://www.livemint.com/market/us-market,2026-04-08T20:43:04+00:00
LiveMint,85,Terms of Use,https://www.livemint.com/terms-of-use,2026-04-08T20:43:04+00:00
LiveMint,86,Code of ethics,https://www.livemint.com/code-of-ethics,2026-04-08T20:43:04+00:00
LiveMint,87,Stock Market Today,https://www.livemint.com/market/stock-market-news/stock-market-today-sensex-today-nifty-gold-rate-today-silver-rate-today-crude-oil-prices-us-iran-war-trump-7-april-2026-11775527434110.html,2026-04-08T20:43:04+00:00
LiveMint,88,MCX Gold Rate,https://www.livemint.com/market/market-stats/commodity-mcx-gold-price,2026-04-08T20:43:04+00:00
LiveMint,89,MCX Silver Price,https://www.livemint.com/market/market-stats/commodity-mcx-silver-price,2026-04-08T20:43:04+00:00
LiveMint,90,Gold Price in Mumbai,https://www.livemint.com/gold-prices/mumbai,2026-04-08T20:43:04+00:00
LiveMint,91,Gold Price in Chennai,https://www.livemint.com/gold-prices/chennai,2026-04-08T20:43:04+00:00
LiveMint,92,Gold Price in Kolkata,https://www.livemint.com/gold-prices/kolkata,2026-04-08T20:43:04+00:00
LiveMint,93,Silver Price in Mumbai,https://www.livemint.com/silver-prices/mumbai,2026-04-08T20:43:04+00:00
LiveMint,94,Silver Price in Chennai,https://www.livemint.com/silver-prices/chennai,2026-04-08T20:43:04+00:00
LiveMint,95,Silver Price in Hyderabad,https://www.livemint.com/silver-prices/hyderabad,2026-04-08T20:43:04+00:00
LiveMint,96,Silver Price in Kolkata,https://www.livemint.com/silver-prices/kolkata,2026-04-08T20:43:04+00:00
LiveMint,97,Latest News Today,https://www.livemint.com/news,2026-04-08T20:43:04+00:00
LiveMint,98,US News Today,https://www.livemint.com/news/us-news,2026-04-08T20:43:04+00:00
LiveMint,99,Top Company Leader,https://www.livemint.com/companies/people,2026-04-08T20:43:04+00:00
LiveMint,100,personal loan emi calculator,https://www.livemint.com/loans/personal-loan-emi-calculator,2026-04-08T20:43:04+00:00
LiveMint,101,Personal Loan Interest Rate,https://www.livemint.com/loans/personal-loan-interest-rates,2026-04-08T20:43:04+00:00
LiveMint,102,Personal Loan Eligibility,https://www.livemint.com/loans/personal-loan-eligibility,2026-04-08T20:43:04+00:00
LiveMint,103,Instant Personal Loan,https://www.livemint.com/loans/instant-personal-loan,2026-04-08T20:43:04+00:00
LiveMint,104,Home Loan EMI Calculator,https://www.livemint.com/tools-calculators/home-loan-emi-calculator,2026-04-08T20:43:04+00:00
LiveMint,105,Car Loan EMI,https://www.livemint.com/tools-calculators/car-loan-calculator,2026-04-08T20:43:04+00:00
India Today,1,Rs 900 in 45 minutes? Viral post says blue-collar jobs are the future,https://www.indiatoday.in/trending-news/story/rs-900-in-45-minutes-viral-post-says-blue-collar-jobs-are-the-future-2893430-2026-04-08,2026-04-08T20:43:04+00:00
India Today,2,Delhi woman urges couple to rethink coconut ritual at Yamuna over pollution concern,https://www.indiatoday.in/trending-news/story/delhi-woman-urges-couple-to-rethink-coconut-ritual-at-yamuna-over-pollution-concern-2893425-2026-04-08,2026-04-08T20:43:04+00:00
India Today,3,"Bengali mother scolds monkey for eating soap, hands it a potato instead",https://www.indiatoday.in/trending-news/story/bengali-mother-scolds-monkey-for-eating-soap-hands-it-a-potato-instead-2893396-2026-04-08,2026-04-08T20:43:04+00:00
India Today,4,Vande Bharat passenger claims he found metal piece in meal. IRCTC reacts,https://www.indiatoday.in/trending-news/story/vande-bharat-passenger-claims-he-found-metal-piece-in-meal-irctc-reacts-2893352-2026-04-08,2026-04-08T20:43:04+00:00
India Today,5,KitKat Canada deploys VIP-style security to escort delivery truck after viral heist,https://www.indiatoday.in/trending-news/story/kitkat-canada-deploys-vip-style-security-to-escort-delivery-truck-after-viral-heist-2893346-2026-04-08,2026-04-08T20:43:04+00:00
India Today,6,"Thief hides in pond for 5 hours to evade arrest, uses lotus stem to breathe",https://www.indiatoday.in/trending-news/story/video-thief-hides-in-pond-for-5-hours-to-evade-arrest-uses-lotus-stem-to-breathe-2893318-2026-04-08,2026-04-08T20:43:04+00:00
India Today,7,"Zoho's Sridhar Vembu urges rebuilding, revival of villages: Time to go back",https://www.indiatoday.in/trending-news/story/zohos-sridhar-vembu-urges-rebuilding-revival-of-villages-time-to-go-back-2893250-2026-04-08,2026-04-08T20:43:04+00:00
India Today,8,"Hyderabad man gets challan for vehicle stolen 3 months ago, thief caught on camera",https://www.indiatoday.in/trending-news/story/hyderabad-man-gets-challan-for-vehicle-stolen-3-months-ago-thief-caught-on-camera-2893287-2026-04-08,2026-04-08T20:43:04+00:00
India Today,9,"Fight isn't fair, you f*** off from there: Samay Raina's viral Kashmiri Pandit wisdom",https://www.indiatoday.in/trending-news/story/5-statements-made-by-samay-raina-on-still-alive-that-are-raw-risky-unmissable-2893184-2026-04-08,2026-04-08T20:43:04+00:00
India Today,10,"Nepali locals shame Indian tourists for spitting gutka on road, make them clean stains",https://www.indiatoday.in/trending-news/story/nepali-locals-shame-indian-tourists-for-spitting-gutka-on-road-make-them-clean-stains-2893196-2026-04-08,2026-04-08T20:43:04+00:00
India Today,11,"Bengaluru woman takes parents to office, they meet her manager. Then, this happens",https://www.indiatoday.in/trending-news/story/bengaluru-woman-takes-parents-to-office-they-meet-her-manager-then-this-happens-2893181-2026-04-08,2026-04-08T20:43:04+00:00
India Today,12,"Manager's response to employee's sick leave request makes Reddit go wait, what?",https://www.indiatoday.in/trending-news/story/managers-response-to-employees-sick-leave-request-makes-reddit-go-wait-what-2893136-2026-04-08,2026-04-08T20:43:04+00:00
India Today,13,"Bengaluru auto driver checks crypto charts in between traffic, man records his video",https://www.indiatoday.in/trending-news/story/bengaluru-auto-driver-checks-crypto-charts-in-between-traffic-man-records-his-video-2893088-2026-04-08,2026-04-08T20:43:04+00:00
India Today,14,"We would love to, but...: Iran Consulate reacts to Indian man's job query",https://www.indiatoday.in/trending-news/story/iran-consulate-reacts-to-indian-man-job-query-we-would-love-to-but-2893098-2026-04-08,2026-04-08T20:43:04+00:00
India Today,15,Indian Railways staff dumps garbage on tracks at Gujarat station. DRM reacts,https://www.indiatoday.in/trending-news/story/indian-railways-staff-dumps-garbage-on-tracks-at-gujarat-station-drm-reacts-2893062-2026-04-08,2026-04-08T20:43:04+00:00
India Today,16,Ranthambore safari video shows tiger struggling for space amid jeep rush,https://www.indiatoday.in/trending-news/story/ranthambore-safari-video-shows-tiger-struggling-for-space-amid-jeep-rush-2892916-2026-04-07,2026-04-08T20:43:04+00:00
India Today,17,This toddler's after-school routine is everything good parenting stands for,https://www.indiatoday.in/trending-news/story/this-toddlers-after-school-routine-is-everything-good-parenting-stands-for-2892909-2026-04-07,2026-04-08T20:43:04+00:00
India Today,18,Bengaluru auto ride turns wholesome as driver vibes with Bengali passenger,https://www.indiatoday.in/trending-news/story/bengaluru-auto-ride-turns-wholesome-as-driver-vibes-with-bengali-passenger-2892883-2026-04-07,2026-04-08T20:43:04+00:00
India Today,19,From tarantula eating to heat drills: US company's 2017 retreat turned disastrous,https://www.indiatoday.in/trending-news/story/from-tarantula-eating-to-heat-drills-us-companys-2017-retreat-turned-disastrous-2892860-2026-04-07,2026-04-08T20:43:04+00:00
India Today,20,Bengaluru man plans to 'quit corporate slavery' for son. Reddit warns of risks,https://www.indiatoday.in/trending-news/story/bengaluru-man-plans-to-quit-corporate-slavery-to-spend-time-with-son-reddit-warns-of-risks-2892855-2026-04-07,2026-04-08T20:43:04+00:00
India Today,21,Vaishali beats Divya to share lead with Jiner Zhu in Candidates Chess,https://www.indiatoday.in/sports/other-sports/story/r-vaishali-beat-divya-deshmukh-joint-lead-womens-candidates-chess-tournament-2893491-2026-04-09,2026-04-08T20:43:04+00:00
India Today,22,100 strikes in 10 mins: Why Lebanon faces biggest Israel attack despite ceasefire,https://www.indiatoday.in/world/story/why-lebanon-is-facing-biggest-israel-attack-despite-us-iran-ceasefire-2893490-2026-04-09,2026-04-08T20:43:04+00:00
India Today,23,"US serial killer architect admits 7 murders, confesses 8th in Gilgo Beach case",https://www.indiatoday.in/world/story/us-secret-serial-killer-architect-admits-7-murders-confesses-8th-in-chilling-gilgo-beach-case-2893488-2026-04-09,2026-04-08T20:43:04+00:00
India Today,24,Indian woman shares reality of living alone in Dubai despite company perks,https://www.indiatoday.in/trending-news/story/indian-woman-shares-reality-of-living-alone-in-dubai-despite-company-perks-2892169-2026-04-06,2026-04-08T20:43:04+00:00
India Today,25,"Sir, I'll tell you everything: Constable key to death penalty for 9 Tamil Nadu cops",https://www.indiatoday.in/india/tamil-nadu/story/tamil-nadu-police-death-penalty-custodial-deaths-sathankulam-2020-beating-case-constable-revathi-2893080-2026-04-08,2026-04-08T20:43:04+00:00
India Today,26,"Sonam Kapoor shares gratitude note after welcoming 2nd child, thanks hospital staff",https://www.indiatoday.in/movies/celebrities/story/sonam-kapoor-shares-gratitude-note-after-welcoming-second-child-thanks-hospital-staff-2891048-2026-04-03,2026-04-08T20:43:04+00:00
India Today,27,'Ketamine Queen' gets 15 years in prison over death of 'Friends' star Matthew Perry,https://www.indiatoday.in/world/story/ketamine-queen-sentenced-to-15-years-in-prison-over-death-of-friends-star-matthew-perry-2893487-2026-04-09,2026-04-08T20:43:04+00:00
India Today,28,US woman lures partner for surprise massage then shoots him and his parents,https://www.indiatoday.in/world/story/jenna-strouble-triple-murder-case-chicago-suburbs-jacob-lambert-parents-2892987-2026-04-07,2026-04-08T20:43:04+00:00
TOI ETimes,1,Australian study finds heart cells can regenerate post-heart attack; India’s leading cardiologist calls it a ‘big step’,https://timesofindia.indiatimes.com/articleshow/127212793.cms,2026-04-08T20:43:04+00:00
TOI ETimes,2,Hold that bite: Doctor explains the post-workout mistake that could cost you your life,https://timesofindia.indiatimes.com/articleshow/127102424.cms,2026-04-08T20:43:04+00:00
TOI ETimes,3,When Anxiety Signals Brain Issues: Neurologist explains red flags,https://timesofindia.indiatimes.com/articleshow/127119929.cms,2026-04-08T20:43:04+00:00
TOI ETimes,4,Doctor's Advice On Common Traps: Dr Ankur Gahlot warns about hidden,https://timesofindia.indiatimes.com/articleshow/127111948.cms,2026-04-08T20:43:04+00:00
TOI ETimes,5,Knee care: Orthopaedic doctor approved tips that can delay joint replacement by 10 years,https://timesofindia.indiatimes.com/articleshow/127125728.cms,2026-04-08T20:43:04+00:00
TOI ETimes,6,Peace lily benefits: How this elegant plant cleans air and calms your mind,https://timesofindia.indiatimes.com/articleshow/127125253.cms,2026-04-08T20:43:04+00:00
TOI ETimes,7,"'Ranveer feels like a different person after Dhurandhar,' reveals Manav Gohil",https://timesofindia.indiatimes.com/articleshow/130123851.cms,2026-04-08T20:43:04+00:00
TOI ETimes,8,Vikrant Massey reveals he took a break from movies out of 'dad' guilt,https://timesofindia.indiatimes.com/articleshow/130121226.cms,2026-04-08T20:43:04+00:00
TOI ETimes,9,Mukesh Khanna calls Samay Raina 'kutte ki dum' in scathing attack,https://timesofindia.indiatimes.com/articleshow/130123611.cms,2026-04-08T20:43:04+00:00
TOI ETimes,10,Dhurandhar 2 makers sued over use of Oye Oye song,https://timesofindia.indiatimes.com/articleshow/130121578.cms,2026-04-08T20:43:04+00:00
TOI ETimes,11,"SRK cheers for Allu Arjun's 'Raaka' look on his birthday, netizens react",https://timesofindia.indiatimes.com/articleshow/130118312.cms,2026-04-08T20:43:04+00:00
TOI ETimes,12,Ramanand Sagar’s son Moti Sagar backs Ranbir as Lord Ram,https://timesofindia.indiatimes.com/articleshow/130119092.cms,2026-04-08T20:43:04+00:00
TOI ETimes,13,Aditya Dhar praises Mukesh Chhabra after Dhurandhar: The Revenge success; calls him ‘a key force’ behind the film,https://timesofindia.indiatimes.com/articleshow/130118401.cms,2026-04-08T20:43:04+00:00
TOI ETimes,14,"‘Dhurandhar 2’ box office day 20: Film eyes Rs 1,650 cr worldwide",https://timesofindia.indiatimes.com/articleshow/130099338.cms,2026-04-08T20:43:04+00:00
TOI ETimes,15,"'Dhurandhar 2' BO day 20 [LIVE]: Ranveer Singh film surges past Rs. 1,025 crore",https://timesofindia.indiatimes.com/articleshow/130079921.cms,2026-04-08T20:43:04+00:00
TOI ETimes,16,"‘Dhurandhar 2’ box office day 19: Film eyes Rs 1,630 cr worldwide",https://timesofindia.indiatimes.com/articleshow/130073458.cms,2026-04-08T20:43:04+00:00
TOI ETimes,17,"'Dhurandhar 2' BO day 19 [LIVE]: Ranveer Singh film mints overRs. 1,023 crore net",https://timesofindia.indiatimes.com/articleshow/130054387.cms,2026-04-08T20:43:04+00:00
TOI ETimes,18,"‘Dhurandhar 2’ box office day 18: Film crosses Rs 1,600 cr worldwide",https://timesofindia.indiatimes.com/articleshow/130048430.cms,2026-04-08T20:43:04+00:00
TOI ETimes,19,'Super Mario' tops US box office; ‘Dhurandhar 2' extends record run,https://timesofindia.indiatimes.com/articleshow/130046377.cms,2026-04-08T20:43:04+00:00
TOI ETimes,20,Animal Preview: Ranbir Kapoor and Sandeep Reddy Vanga are set to shake up the box office hierarchy,https://timesofindia.indiatimes.com/articleshow/105615612.cms,2026-04-08T20:43:04+00:00
TOI ETimes,21,Tu Jhoothi Main Makkaar,https://timesofindia.indiatimes.com/articleshow/98272134.cms,2026-04-08T20:43:04+00:00
TOI ETimes,22,Ankita and Vicky seek blessings at Mahakaleshwar,https://timesofindia.indiatimes.com/articleshow/130110185.cms,2026-04-08T20:43:04+00:00
TOI ETimes,23,"Nia Sharma, Krystle D'Souza reunite, indulge in a jamming session",https://timesofindia.indiatimes.com/articleshow/130110522.cms,2026-04-08T20:43:04+00:00
TOI ETimes,24,Shraddha gives a glimpse into her beautiful ‘morning view’,https://timesofindia.indiatimes.com/articleshow/130110280.cms,2026-04-08T20:43:04+00:00
TOI ETimes,25,Rubina On Food And Mood: TV actor recalls stress eating,https://timesofindia.indiatimes.com/articleshow/130108407.cms,2026-04-08T20:43:04+00:00
TOI ETimes,26,Pallavi Chaterjee reacts to the untimely demise of Rahul,https://timesofindia.indiatimes.com/articleshow/130107873.cms,2026-04-08T20:43:04+00:00
TOI ETimes,27,Rajeev Khandelwal Tv Return: actor hosts Tum Ho Naa,https://timesofindia.indiatimes.com/articleshow/130105944.cms,2026-04-08T20:43:04+00:00
TOI ETimes,28,Bhim Vakani Passes Away: Disha Vakani breaks down at father,https://timesofindia.indiatimes.com/articleshow/130116562.cms,2026-04-08T20:43:04+00:00
TOI ETimes,29,IPL 2026: Who is Indian cricketer Yashasvi Jaiswal's rumoured girlfriend Maddie Hamilton?,https://timesofindia.indiatimes.com/articleshow/130119645.cms,2026-04-08T20:43:04+00:00
TOI ETimes,30,What you see first reveals if you are an introvert or extrovert,https://timesofindia.indiatimes.com/articleshow/130116922.cms,2026-04-08T20:43:04+00:00
TOI ETimes,31,Do snake plants really attract snakes: Understanding the truth about their appearance and why they are linked to snakes,https://timesofindia.indiatimes.com/articleshow/130116236.cms,2026-04-08T20:43:04+00:00
TOI ETimes,32,Who knows if you lived a past life? 10 signs your soul could have lived through a previous life,https://timesofindia.indiatimes.com/articleshow/130113010.cms,2026-04-08T20:43:04+00:00
TOI ETimes,33,"What you see first reveals if you enjoy being alone, with few people, or love changes in life",https://timesofindia.indiatimes.com/articleshow/130109696.cms,2026-04-08T20:43:04+00:00
TOI ETimes,34,Watch: Man frozen on Bengaluru street fuels shocking ‘zombie drug’ claims online,https://timesofindia.indiatimes.com/articleshow/130122834.cms,2026-04-08T20:43:04+00:00
TOI ETimes,35,Is El Niño coming back? Here’s what it could mean for 2026 weather,https://timesofindia.indiatimes.com/articleshow/130122893.cms,2026-04-08T20:43:04+00:00
TOI ETimes,36,7-Eleven video of Indian worker sparks H-1B debate in US; congressman calls it a ‘scam’,https://timesofindia.indiatimes.com/articleshow/130117948.cms,2026-04-08T20:43:04+00:00
TOI ETimes,37,"Who is Abhijay Arora? Failed JEE, faced ₹1 crore debt and 90-day job deadline, then cracked Google",https://timesofindia.indiatimes.com/articleshow/130117745.cms,2026-04-08T20:43:04+00:00
TOI ETimes,38,"College backlog to big tech offers: How this Indian engineer grabbed job offers from Google, Microsoft, Meta and Uber",https://timesofindia.indiatimes.com/articleshow/130114672.cms,2026-04-08T20:43:04+00:00
TOI ETimes,39,Xavier Trudeau talks about bond with Katy Perry,https://timesofindia.indiatimes.com/articleshow/130105009.cms,2026-04-08T20:43:04+00:00
TOI ETimes,40,Sabrina Carpenter reflects on working with her older sister,https://timesofindia.indiatimes.com/articleshow/130102865.cms,2026-04-08T20:43:04+00:00
TOI ETimes,41,Who is Ray Stevens?,https://timesofindia.indiatimes.com/articleshow/130102807.cms,2026-04-08T20:43:04+00:00
TOI ETimes,42,NASA replies to Travis Kelce’s old tweet,https://timesofindia.indiatimes.com/articleshow/130102760.cms,2026-04-08T20:43:04+00:00
TOI ETimes,43,Badshah Apologises To NCW: Rapper issues unconditional regret,https://timesofindia.indiatimes.com/articleshow/130089199.cms,2026-04-08T20:43:04+00:00
TOI ETimes,44,'Half the world is lakeer ka fakeer’: Kailash Kher REACTS to viral memes,https://timesofindia.indiatimes.com/articleshow/130088599.cms,2026-04-08T20:43:04+00:00
TOI ETimes,45,Beyond Ebooks: The charm of bookstores endures,https://timesofindia.indiatimes.com/articleshow/101098088.cms,2026-04-08T20:43:04+00:00
TOI ETimes,46,It’s a curtain call: Sania Mirza bids adieu to tennis with ‘happy tears’,https://timesofindia.indiatimes.com/articleshow/98440670.cms,2026-04-08T20:43:04+00:00
TOI ETimes,47,A magical makeover for 17th Century stepwell: From neglected ruins to a glorious piece of history,https://timesofindia.indiatimes.com/articleshow/96557955.cms,2026-04-08T20:43:04+00:00
TOI ETimes,48,The city comes alive with Christmas fervour,https://timesofindia.indiatimes.com/articleshow/96406573.cms,2026-04-08T20:43:04+00:00
TOI ETimes,49,#BringRioHome: Pet parents launch search to find their kidnapped cat,https://timesofindia.indiatimes.com/articleshow/96334809.cms,2026-04-08T20:43:04+00:00
TOI ETimes,50,Adil Hussain’s 'Mercy' release date OUT: Film's first look to be attached with Ranveer Singh's 'Dhurandhar: The Revenge',https://timesofindia.indiatimes.com/articleshow/129843424.cms,2026-04-08T20:43:04+00:00
TOI ETimes,51,It’s the best time to be doing theatre: Juhi Babbar Soni,https://timesofindia.indiatimes.com/articleshow/129826631.cms,2026-04-08T20:43:04+00:00
TOI ETimes,52,"Anu Malik steps into theatre with Anupam Kher’s play, Calls it his most exciting challenge yet",https://timesofindia.indiatimes.com/articleshow/129729335.cms,2026-04-08T20:43:04+00:00
TOI ETimes,53,'Wicked' musical director John Stefaniuk on live music on the stage: 'It is so exciting to hear the orchestra whisk us away',https://timesofindia.indiatimes.com/articleshow/129610267.cms,2026-04-08T20:43:04+00:00
TOI ETimes,54,"'Wicked' stars Rebekah Lowings and Eve Shanu-Wilson on Elphaba-Glinda's bond: 'Friends challenge you, not just cheer you on'",https://timesofindia.indiatimes.com/articleshow/129607673.cms,2026-04-08T20:43:04+00:00
TOI ETimes,55,"Vijay Crishna, Shah Rukh Khan’s on-screen father in ‘Devdas,’ passes away at 81: Tributes pour in for theatre stalwart",https://timesofindia.indiatimes.com/articleshow/129016007.cms,2026-04-08T20:43:04+00:00
TOI ETimes,56,Raj Kundra and Shilpa Shetty's 15th Wedding Anniversary,https://timesofindia.indiatimes.com/articleshow/115563990.cms,2026-04-08T20:43:04+00:00
TOI ETimes,57,​Bigg Boss winners list from season 1 to 17​,https://timesofindia.indiatimes.com/articleshow/114277426.cms,2026-04-08T20:43:04+00:00
TOI ETimes,58,​Discover the bird with a prehistoric roar​,https://timesofindia.indiatimes.com/articleshow/114244474.cms,2026-04-08T20:43:04+00:00
TOI ETimes,59,Dia Mirza's ethnic wear,https://timesofindia.indiatimes.com/articleshow/114243410.cms,2026-04-08T20:43:04+00:00
TOI ETimes,60,​Incredible facts about ants you won’t believe​,https://timesofindia.indiatimes.com/articleshow/114243248.cms,2026-04-08T20:43:04+00:00
TOI ETimes,61,'Bigg Boss Marathi 5' nears grand finale​,https://timesofindia.indiatimes.com/articleshow/113936459.cms,2026-04-08T20:43:04+00:00
TOI ETimes,62,This viral 'Rambaan' fertiliser recipe is making plants explode with flowers in weeks,https://timesofindia.indiatimes.com/articleshow/130109256.cms,2026-04-08T20:43:04+00:00
TOI ETimes,63,Meet Harshita Arora: Indian-origin founder of $700M startup becomes Y Combinator's youngest General Partner at 25,https://timesofindia.indiatimes.com/articleshow/130122853.cms,2026-04-08T20:43:04+00:00
TOI ETimes,64,Who is ‘Ketamine Queen’ Jasveen Sangha? The woman now at the centre of the Matthew Perry drug overdose case,https://timesofindia.indiatimes.com/articleshow/130110198.cms,2026-04-08T20:43:04+00:00
TOI ETimes,65,No LPG or cylinder required for cooking: What is the 'plug-and-play' Hydrogen cooking stove that produces gas through water electrolysis?,https://timesofindia.indiatimes.com/articleshow/130109070.cms,2026-04-08T20:43:04+00:00
TOI ETimes,66,Keralite reveals being punished for speaking mother tongue in school: Viral Reddit post shares story of 30-year-old who lost his language in English-only system,https://timesofindia.indiatimes.com/articleshow/130106790.cms,2026-04-08T20:43:04+00:00
TOI ETimes,67,"Petrol shock in Pakistan! After outrage over ₹152/L, government slashes fuel rates - check latest prices",https://timesofindia.indiatimes.com/articleshow/130104650.cms,2026-04-08T20:43:04+00:00
TOI ETimes,68,Erratic rainfalls in March impact Mango crop: How to ripen raw Mangoes rightly with grandma's newspaper hack using quick commerce paper bags,https://timesofindia.indiatimes.com/articleshow/130083166.cms,2026-04-08T20:43:04+00:00
TOI ETimes,69,‘Did he just fart?’ US Defense Secretary Pete Hegseth’s serious briefing turns into viral moment,https://timesofindia.indiatimes.com/articleshow/130101919.cms,2026-04-08T20:43:04+00:00
TOI ETimes,70,Meet Shirli Ling: The social media influencer and chicken hotpot boss who became a grandmother at 34,https://timesofindia.indiatimes.com/articleshow/130101855.cms,2026-04-08T20:43:04+00:00
TOI ETimes,71,Meet ‘Chaya Chechi’: Her dreamy chai-on-a-boat experience is going viral– here’s why,https://timesofindia.indiatimes.com/articleshow/130094820.cms,2026-04-08T20:43:04+00:00
TOI ETimes,72,Love teddy bears? These 5 dog breeds look just like them,https://timesofindia.indiatimes.com/articleshow/130093314.cms,2026-04-08T20:43:04+00:00
TOI ETimes,73,We’re running out of Earth: Study warns current lifestyle needs 2 planets,https://timesofindia.indiatimes.com/articleshow/130092316.cms,2026-04-08T20:43:04+00:00
TOI ETimes,74,Inside the row over Pippa Middleton’s countryside home: Why are locals upset with Kate Middleton’s sister,https://timesofindia.indiatimes.com/articleshow/130091068.cms,2026-04-08T20:43:04+00:00
TOI ETimes,75,Did you know NYC once flew helicopters from skyscraper rooftops to airports in 1965? Here’s how it all went wrong,https://timesofindia.indiatimes.com/articleshow/130085042.cms,2026-04-08T20:43:04+00:00
TOI ETimes,76,Inside Gaurav Taneja’s Rs 10 crore Gurugram farmhouse: Where 200 cows power a desi food venture,https://timesofindia.indiatimes.com/articleshow/130089447.cms,2026-04-08T20:43:04+00:00
TOI ETimes,77,"After 'Dhurandhar' made Lyari in Pakistan viral, ‘Lyari in India’ is trending online - All about the hidden gem of Gujarat",https://timesofindia.indiatimes.com/articleshow/130087039.cms,2026-04-08T20:43:04+00:00
TOI ETimes,78,"Macaulay's children are triggered because Pujarini Pradhan, from Medinipur, didn’t ask for permission to think, and speak English",https://timesofindia.indiatimes.com/articleshow/130085029.cms,2026-04-08T20:43:04+00:00
TOI ETimes,79,"Rs 200 sapling to Rs 60,000 tree: The mahogany farming secret turning Indian farmers into crorepatis",https://timesofindia.indiatimes.com/articleshow/130085813.cms,2026-04-08T20:43:04+00:00
TOI ETimes,80,"Meet Africa’s richest king: How King Mohammed VI’s ₹6,200 crore gold bet is changing the gold game",https://timesofindia.indiatimes.com/articleshow/130084007.cms,2026-04-08T20:43:04+00:00
TOI ETimes,81,India's unstoppable daughter: Who is Payal Nag - World’s first quadruple amputee archer,https://timesofindia.indiatimes.com/articleshow/130082222.cms,2026-04-08T20:43:04+00:00
TOI ETimes,82,Who is Divya Singh? A 28-year-old teacher and the first Indian woman to cycle to Everest Base Camp,https://timesofindia.indiatimes.com/articleshow/130079771.cms,2026-04-08T20:43:04+00:00
TOI ETimes,83,Mid-air shock! Sydney-Dallas Qantas flight dumps fuel over ocean after sudden emergency - here’s what happened,https://timesofindia.indiatimes.com/articleshow/130077596.cms,2026-04-08T20:43:04+00:00
TOI ETimes,84,'IITian Baba' Abhey Singh gets married: Who is his wife Pratika?,https://timesofindia.indiatimes.com/articleshow/130076066.cms,2026-04-08T20:43:04+00:00
TOI ETimes,85,He made JEE history with 360/360: From IIT topper to singer-songwriter? Kalpit Veerwal’s journey is anything but typical,https://timesofindia.indiatimes.com/articleshow/130074916.cms,2026-04-08T20:43:04+00:00
