source,rank,headline,link,collected_at_iso
Indian Express,1,Trending in India,https://indianexpress.com/section/trending/trending-in-india/,2026-04-12T10:38:49+00:00
Indian Express,2,This is Serious,https://indianexpress.com/section/trending/this-is-serious/,2026-04-12T10:38:49+00:00
Indian Express,3,Parakeet Bebe snorkelling video,https://indianexpress.com/article/trending/trending-globally/meet-bebe-world-first-snorkelling-parakeet-viral-bird-10632480/,2026-04-12T10:38:49+00:00
Indian Express,4,Digital arrest scam in UP,https://indianexpress.com/article/trending/trending-in-india/digital-arrest-scam-bareilly-student-saves-parents-10632297/,2026-04-12T10:38:49+00:00
Indian Express,5,She shared that lunchtime proved to be the toughest part due to steep prices.,https://indianexpress.com/article/trending/trending-in-india/bengaluru-500-day-challenge-budget-survival-10632231/,2026-04-12T10:38:49+00:00
Indian Express,6,Most Valuable Banks in India in 2026,https://indianexpress.com/article/trending/top-10-listing/top-10-most-valuable-banks-in-india-in-2026-10631398/,2026-04-12T10:38:49+00:00
Indian Express,7,Shantanu Naidu viral video,https://indianexpress.com/article/trending/trending-in-india/shantanu-naidu-viral-video-horse-cruelty-indian-weddings-baraat-10631327/,2026-04-12T10:38:49+00:00
Indian Express,8,Ichiro Suzuki statue broken bay,https://indianexpress.com/article/trending/trending-globally/watch-ichiro-suzuki-statue-reveal-broken-bat-seattle-mariners-video-10631296/,2026-04-12T10:38:49+00:00
Indian Express,9,Gen Z work culture,https://indianexpress.com/article/trending/trending-in-india/gen-z-work-culture-linkedin-post-workplace-boundaries-debate-overtime-pay-burnout-10631091/,2026-04-12T10:38:49+00:00
Indian Express,10,Kunal Kamra apology row,https://indianexpress.com/article/trending/trending-in-india/kunal-kamra-refuses-apology-maharashtra-privileges-committee-eknath-shinde-parody-song-10630923/,2026-04-12T10:38:49+00:00
Indian Express,11,Bangkok to India flight dirty video,https://indianexpress.com/article/trending/trending-in-india/bangkok-india-flight-dirty-video-indian-passenger-civic-sense-10630788/,2026-04-12T10:38:49+00:00
Indian Express,12,Top 10 most valuable power companies in the world,https://indianexpress.com/article/trending/top-10-listing/top-10-most-valuable-power-companies-in-the-world-2026-10629824/,2026-04-12T10:38:49+00:00
Indian Express,13,Kerala voting controversy,https://indianexpress.com/article/trending/trending-in-india/kerala-voting-controversy-thrissur-woman-bandaged-finger-indelible-ink-row-10629778/,2026-04-12T10:38:49+00:00
Indian Express,14,Gurgaon founder firing employee,https://indianexpress.com/article/trending/trending-in-india/gurgaon-founder-fires-employee-over-text-no-notice-period-startup-work-culture-debate-10629584/,2026-04-12T10:38:49+00:00
Indian Express,15,Sanju Samson gifts phone to fan,https://indianexpress.com/article/trending/trending-in-india/sanju-samson-gifts-new-phone-fan-palakkad-kerala-ipl-2026-csk-10629238/,2026-04-12T10:38:49+00:00
Indian Express,16,Anant Ambani birthday,https://indianexpress.com/article/trending/trending-in-india/anant-ambani-31st-birthday-bandra-worli-sea-link-tribute-viral-video-10629005/,2026-04-12T10:38:49+00:00
Indian Express,17,Top 10 export countries in the world,https://indianexpress.com/article/trending/top-10-listing/top-10-export-countries-in-the-world-2025-26-10628094/,2026-04-12T10:38:49+00:00
Indian Express,18,KitKat chocolate heist,https://indianexpress.com/article/trending/trending-globally/kitkat-canada-chocolate-heist-convoy-security-viral-video-10628022/,2026-04-12T10:38:49+00:00
Indian Express,19,Narmada River milk ritual video,https://indianexpress.com/article/trending/trending-in-india/11000-litres-milk-poured-narmada-river-video-viral-religious-ritual-outrage-10627861/,2026-04-12T10:38:49+00:00
Indian Express,20,Hachiko Statue Tokyo viral video,https://indianexpress.com/article/trending/trending-globally/viral-video-tokyo-hachiko-statue-indian-tourists-queue-jumping-social-media-backlash-civic-sense-10627605/,2026-04-12T10:38:49+00:00
Indian Express,21,deaf Uber driver blind passenger,https://indianexpress.com/article/trending/trending-in-india/blind-passenger-deaf-uber-driver-viral-linkedin-post-aishwarya-pillai-10627371/,2026-04-12T10:38:49+00:00
Indian Express,22,Chennai company Audi cars employees,https://indianexpress.com/article/trending/trending-in-india/chennai-firm-handed-over-12-luxury-audi-cars-to-its-employees-10627247/,2026-04-12T10:38:49+00:00
Indian Express,23,Nepal viral video Indian tourists spitting,https://indianexpress.com/article/trending/trending-in-india/nepal-man-confronts-indian-tourists-spitting-clean-road-civic-sense-viral-video-10627172/,2026-04-12T10:38:49+00:00
Indian Express,24,The dog got trapped when the river’s water level suddenly increased,https://indianexpress.com/article/trending/trending-in-india/heroic-rafter-brave-gangas-rising-currents-to-save-dog-stranded-on-rock-viral-video-10626991/,2026-04-12T10:38:49+00:00
Indian Express,25,Gulmarg littering video,https://indianexpress.com/article/trending/trending-in-india/film-crew-sparks-fury-after-leaving-piles-of-trash-in-gulmarg-pristine-snow-10626390/,2026-04-12T10:38:49+00:00
Indian Express,26,Techie with backlog cracks FAANG offers,https://indianexpress.com/article/trending/trending-in-india/indian-techie-explains-how-he-landed-google-meta-offers-after-failing-in-college-exam-10626372/,2026-04-12T10:38:49+00:00
Indian Express,27,Phoebe Gates faces backlash over influencer pay dispute,https://indianexpress.com/article/trending/trending-globally/bill-gates-daughter-phoebe-gates-influencer-controversy-pay-dispute-10625524/,2026-04-12T10:38:49+00:00
LiveMint,1,Dallas Cowboys safety Markquese Bell arrested on felony drug charge,https://www.livemint.com/us/trending/markquese-bell-arrested-on-felony-drug-charge-and-marijuana-possession-dallas-cowboys-safety-11775932691814.html,2026-04-12T10:38:49+00:00
LiveMint,2,Coachella 2026 kicks off with Sabrina Carpenter's performance,https://www.livemint.com/us/trending/coachella-2026-kicks-off-with-sabrina-carpenters-performance-from-justin-bieber-to-karol-g-check-weekend-schedule-11775875804562.html,2026-04-12T10:38:49+00:00
LiveMint,3,Apple Pay scam spreading fast in the US—Are you at risk?,https://www.livemint.com/us/trending/apple-pay-users-hit-by-scam-wave-across-the-us-here-s-how-victims-are-losing-their-money-11775768345740.html,2026-04-12T10:38:49+00:00
LiveMint,4,Afrika Bambaataa death: Hip-hop pioneer-DJ dies at 67 after cancer complications,https://www.livemint.com/us/trending/afrika-bambaataa-death-hip-hop-pioneer-and-dj-dies-at-67-after-cancer-complications-11775767596687.html,2026-04-12T10:38:49+00:00
LiveMint,5,"DOJ antitrust probe into NFL media rights: What it means for streaming, and more",https://www.livemint.com/us/trending/doj-antitrust-probe-into-nfl-media-rights-what-it-means-for-fans-streaming-and-tv-deals-11775760586179.html,2026-04-12T10:38:49+00:00
LiveMint,6,"Daniil Medvedev smashes racquet in shocking 6-0, 6-0 loss at Monte Carlo Masters",https://www.livemint.com/us/trending/daniil-medvedev-racquet-video-in-shocking-6-0-6-0-clay-defeat-to-matteo-berrettini-at-monte-carlo-masters-11775674478886.html,2026-04-12T10:38:49+00:00
LiveMint,7,"Konnor Griffin signs 9-year, $140 million contract extension with Pirates",https://www.livemint.com/us/trending/konnor-griffin-signs-record-9-year-140-million-contract-extension-with-pittsburgh-pirates-mlb-baseball-11775653782727.html,2026-04-12T10:38:49+00:00
LiveMint,8,JD Vance’s awkward moment: Trump sends call to voicemail during live rally,https://www.livemint.com/us/trending/jd-vance-s-awkward-moment-trump-sends-call-to-voicemail-during-live-rally-in-hungary-watch-11775589348677.html,2026-04-12T10:38:49+00:00
LiveMint,9,"Islanders fire Patrick Roy, hire Peter DeBoer as head coach amid playoff push",https://www.livemint.com/us/trending/patrick-roy-fired-by-new-york-islanders-hire-peter-deboer-as-head-coach-amid-playoff-push-nhl-hockey-11775415170584.html,2026-04-12T10:38:49+00:00
LiveMint,10,Geno Auriemma apologizes to South Carolina after outburst in women's Final Four,https://www.livemint.com/us/trending/geno-auriemma-apologizes-to-south-carolina-after-emotional-outburst-vs-dawn-staley-in-womens-final-four-11775394255637.html,2026-04-12T10:38:49+00:00
LiveMint,11,NCAA Final Four 2026: UConn vs Illinois and Michigan vs Arizona results,https://www.livemint.com/us/trending/ncaa-final-four-2026-results-what-happened-in-uconn-vs-illinois-and-michigan-vs-arizona-march-madness-semifinals-11775390782036.html,2026-04-12T10:38:49+00:00
LiveMint,12,NASA’s Artemis II astronauts face toilet problem; social media reacts with memes,https://www.livemint.com/us/trending/nasas-artemis-ii-astronauts-faces-toilet-problem-in-space-social-media-reacts-with-jokes-memes-blame-ice-for-this-to-11775363905958.html,2026-04-12T10:38:49+00:00
LiveMint,13,Man City thrash Liverpool 4-0 while Chelsea crush Port Vale 7-0 in FA Cup QFs,https://www.livemint.com/us/trending/manchester-city-vs-liverpool-4-0-chelsea-vs-port-vale-7-0-fa-cup-quarterfinals-11775328419465.html,2026-04-12T10:38:49+00:00
LiveMint,14,Juan Soto calf injury: Mets star to undergo MRI after early exit vs Giants,https://www.livemint.com/us/trending/juan-soto-calf-injury-new-york-mets-star-to-undergo-mri-after-early-exit-vs-san-francisco-giants-11775306968287.html,2026-04-12T10:38:49+00:00
LiveMint,15,New York teacher earning $90K turns to $55/hour side gig to repay student loans,https://www.livemint.com/us/trending/new-york-teacher-earning-90k-turns-to-55-hour-side-gig-to-repay-student-loans-11775314789062.html,2026-04-12T10:38:49+00:00
LiveMint,16,NCAA men's Final Four matchups: Schedule and key details,https://www.livemint.com/us/trending/uconn-vs-illinois-and-arizona-vs-michigan-2026-ncaa-mens-final-four-matchups-schedule-and-key-details-11775243799182.html,2026-04-12T10:38:49+00:00
LiveMint,17,Gennaro Gattuso steps down as Italy manager after 2026 World Cup qualifier,https://www.livemint.com/us/trending/gennaro-gattuso-steps-down-as-italy-manager-after-2026-world-cup-qualifier-heartbreak-11775221292115.html,2026-04-12T10:38:49+00:00
LiveMint,18,"Vanessa Trump frustrated with Tiger Woods’ behavior, puts him on notice",https://www.livemint.com/us/trending/vanessa-trump-frustrated-with-tiger-woods-behavior-puts-him-on-notice-stop-acting-like-a-teenager-grow-up-11775209989597.html,2026-04-12T10:38:49+00:00
LiveMint,19,What’s wrong with Tiger Woods? ‘Heartbreaking’ video leaves fans worried,https://www.livemint.com/us/trending/whats-wrong-with-tiger-woods-heartbreaking-video-after-dui-arrest-leaves-fans-worried-mental-health-is-real-11775191311157.html,2026-04-12T10:38:49+00:00
LiveMint,20,McDonald's drops new under $3 menu and $4 breakfast deal — Here’s what you get,https://www.livemint.com/us/trending/mcdonalds-drops-new-under-3-menu-and-4-breakfast-deal-here-s-what-you-can-get-11775157327207.html,2026-04-12T10:38:49+00:00
LiveMint,21,Rapper J. Cole joins China’s Nanjing Monkey Kings for pro basketball stint,https://www.livemint.com/us/trending/grammywinning-rapper-j-cole-joins-china-s-nanjing-monkey-kings-for-pro-basketball-stint-11775141367888.html,2026-04-12T10:38:49+00:00
LiveMint,22,April Fools’ Day 2026 deals: No-joke discounts from Dunkin' and more,https://www.livemint.com/us/trending/april-fools-day-2026-discounts-dunkin-checkers-rally-hooters-qdoba-artemis-ii-doughnut-11775054510320.html,2026-04-12T10:38:49+00:00
LiveMint,23,"Oracle employee, despite being laid off, remains positive: ‘It happens…'",https://www.livemint.com/us/trending/oracle-employee-despite-being-laid-off-remains-positive-it-happens-will-enjoy-sleeping-11775051244639.html,2026-04-12T10:38:49+00:00
LiveMint,24,Warren Buffett teams up with NBA star Stephen Curry for charity lunch auction,https://www.livemint.com/us/trending/warren-buffett-teams-up-with-nba-star-stephen-curry-for-charity-lunch-auction-berkshire-event-returns-in-2026-11774962320767.html,2026-04-12T10:38:49+00:00
LiveMint,25,Tiger Woods’ ex Kristin Smith breaks silence after ‘triggering’ DUI arrest,https://www.livemint.com/us/trending/tiger-woods-ex-kristin-smith-breaks-silence-after-triggering-dui-arrest-seeks-privacy-11774949316320.html,2026-04-12T10:38:49+00:00
LiveMint,26,"Sophie Turner injured, Tomb Raider series halts production temporarily",https://www.livemint.com/us/trending/sophie-turner-injured-tomb-raider-series-halts-production-temporarily-11774878671976.html,2026-04-12T10:38:49+00:00
LiveMint,27,Viral video of Kash Patel dancing? Here’s the truth behind the clip,https://www.livemint.com/us/trending/viral-video-of-kash-patel-dancing-here-s-the-truth-behind-the-clip-11774814955782.html,2026-04-12T10:38:49+00:00
LiveMint,28,"Arnold Schwarzenegger returns to gym—But this time, he’s coaching his son |Watch",https://www.livemint.com/us/trending/arnold-schwarzenegger-returns-to-gym-but-this-time-he-s-coaching-his-son-to-bodybuilding-glory-watch-11774816425352.html,2026-04-12T10:38:49+00:00
LiveMint,29,"Bachelorette star James McCoy Taylor arrested again, months after guilty plea",https://www.livemint.com/us/trending/bachelorette-star-james-mccoy-taylor-arrested-again-months-after-guilty-plea-11774189913536.html,2026-04-12T10:38:49+00:00
LiveMint,30,Comedian jokes about Jews’ expulsion: Social media reacts to viral video,https://www.livemint.com/us/trending/comedian-jokes-about-jews-expulsion-social-media-reacts-to-viral-video-using-antisemitic-talking-points-as-humor-11773998180773.html,2026-04-12T10:38:49+00:00
LiveMint,31,Who is Joseph Duggar? All about reality TV star arrested on abuse charges,https://www.livemint.com/us/trending/who-is-joseph-duggar-all-about-the-19-kids-and-counting-star-arrested-on-abuse-charges-11773894381944.html,2026-04-12T10:38:49+00:00
LiveMint,32,"St Patrick’s Day 2026: Date, history, meaning and traditions worldwide",https://www.livemint.com/us/trending/st-patrick-s-day-2026-date-history-meaning-and-traditions-worldwide-11773760629096.html,2026-04-12T10:38:49+00:00
LiveMint,33,Oscars 2026: What’s on the menu at official after-party for Hollywood A-listers?,https://www.livemint.com/us/trending/oscars-2026-what-s-on-the-menu-at-the-official-after-party-luxurious-food-desserts-and-drinks-for-hollywood-alisters-11773548247036.html,2026-04-12T10:38:49+00:00
LiveMint,34,"Meghan Markle: Harry’s wife faces backlash over $2,235 ticket for group photo",https://www.livemint.com/us/trending/meghan-markle-harry-s-wife-faces-backlash-over-2-235-vip-ticket-for-group-photo-she-s-a-nobody-who-tricked-a-prince-11773538916724.html,2026-04-12T10:38:49+00:00
LiveMint,35,Apple kicks off 50th anniversary with surprise performance by Alicia Keys in NY,https://www.livemint.com/us/trending/alicia-keys-turns-apples-grand-central-in-new-york-into-a-concert-venue-at-tech-giant-s-50th-anniversary-kickoff-11773508129097.html,2026-04-12T10:38:49+00:00
LiveMint,36,"Marco Rubio large shoe size stuns Internet, social media points to ‘sycophancy'",https://www.livemint.com/us/trending/marco-rubio-large-shoe-size-stuns-internet-social-media-points-to-sycophancy-idol-worship-among-trump-officials-11773470692943.html,2026-04-12T10:38:49+00:00
LiveMint,37,Was Bill Clinton about to push Hillary into running traffic? Watch viral video,https://www.livemint.com/us/trending/did-bill-clinton-almost-push-hillary-into-running-traffic-social-media-reacts-to-viral-video-hes-was-so-close-11773280988605.html,2026-04-12T10:38:49+00:00
LiveMint,38,"Dr Dre net worth: Inside his earnings, brands, cars and real estate",https://www.livemint.com/us/trending/dr-dre-net-worth-how-did-the-new-billionaire-make-his-fortune-inside-his-earnings-cars-mansions-and-brands-11773167989493.html,2026-04-12T10:38:49+00:00
LiveMint,39,Nike launches Air Jordan 4 Retro ‘Imperial Purple’ sneakers: Details,https://www.livemint.com/us/trending/nike-launches-air-jordan-4-retro-imperial-purple-sneakers-how-much-do-they-cost-where-to-buy-online-11772907741201.html,2026-04-12T10:38:49+00:00
LiveMint,40,Mark to Market,https://www.livemint.com/market/mark-to-market,2026-04-12T10:38:49+00:00
LiveMint,41,"US-Iran war: Ceasefire negotiation fails; what does it mean for gold, oil, silver and Indian stock market?",https://www.livemint.com/market/stock-market-news/usiran-war-ceasefire-negotiation-fails-what-does-it-mean-for-gold-oil-silver-and-indian-stock-market-11775987161746.html,2026-04-12T10:38:49+00:00
LiveMint,42,Failure of US-Iran Talks Set to Weigh on Risk Assets Monday,https://www.livemint.com/market/failure-of-us-iran-talks-set-to-weigh-on-risk-assets-monday-11775987050787.html,2026-04-12T10:38:49+00:00
LiveMint,43,Gold rate today: Yellow metal falls 9% since onset of US-Iran war. Experts see more dip as ceasefire negotiation fails,https://www.livemint.com/market/commodities/gold-rate-today-yellow-metal-falls-9-since-onset-of-us-iran-war-experts-see-more-dip-as-ceasefire-negotiation-fails-11775980204041.html,2026-04-12T10:38:49+00:00
LiveMint,44,"Mint Explainer | Why SpaceX’s $75 billion IPO matters: Size, stakes and market impact",https://www.livemint.com/market/ipo/mint-explainer-why-spacex-s-75-billion-ipo-matters-size-stakes-and-market-impact-11775972006375.html,2026-04-12T10:38:49+00:00
LiveMint,45,Small-cap NSE stock to be in focus on Monday; here's why,https://www.livemint.com/market/stock-market-news/smallcap-nse-stock-mangalam-worldwide-to-be-in-focus-on-monday-heres-why-11775977341617.html,2026-04-12T10:38:49+00:00
LiveMint,46,"Q4 results 2026: Wipro, HDFC Bank, ICICI Bank among 50 companies to declare earnings next week; check full list here",https://www.livemint.com/market/stock-market-news/q4-results-2026-wipro-hdfc-bank-icici-bank-among-50-companies-to-declare-earnings-next-week-check-full-list-here-11775972931542.html,2026-04-12T10:38:49+00:00
LiveMint,47,BCCI admits to breach in protocol of PMOA during RR vs RCB clash in IPL 2026 in Guwahati; ‘there has to be some action’,https://www.livemint.com/news/bcci-admits-to-breach-in-protocol-of-pmoa-during-rr-vs-rcb-clash-in-ipl-2026-in-guwahati-there-has-to-be-some-action-11775988313307.html,2026-04-12T10:38:49+00:00
LiveMint,48,Quote of the day by Benjamin Franklin: ‘If you want to be wealthy…’,https://www.livemint.com/news/us-news/quote-of-the-day-by-benjamin-franklin-if-you-want-to-be-wealthy-11775985611556.html,2026-04-12T10:38:49+00:00
LiveMint,49,"PM Modi expresses condolences over Asha Bhosle's death, calls her ‘iconic and versatile’ voice of India",https://www.livemint.com/news/india/pm-modi-expresses-condolences-over-asha-bhosles-death-calls-her-iconic-and-versatile-voice-of-india-11775983387089.html,2026-04-12T10:38:49+00:00
LiveMint,50,Quote of the Day by John D Rockefeller: ‘If your only goal is to become rich…’,https://www.livemint.com/news/us-news/quote-of-the-day-by-john-d-rockefeller-if-your-only-goal-is-to-become-rich-11775981724374.html,2026-04-12T10:38:49+00:00
LiveMint,51,"Asha Bhosle passes away: Akshay Kumar, Mamata Banerjee, fans pay tribute to the legendary singer",https://www.livemint.com/news/india/asha-bhosle-passes-away-tributes-pour-in-after-death-of-legendary-singer-11775980907209.html,2026-04-12T10:38:49+00:00
LiveMint,52,"Amarnath Yatra 2026 dates announced: Pilgrimage to begin July 3, registrations open April 15",https://www.livemint.com/news/india/amarnath-yatra-2026-dates-announced-pilgrimage-to-begin-july-3-registrations-open-april-15-11775977179145.html,2026-04-12T10:38:49+00:00
LiveMint,53,Salary Impact Tracker,https://www.livemint.com/tools-calculators/salary-impact-tracker,2026-04-12T10:38:49+00:00
LiveMint,54,"8 out of 10 most India's valuable companies add ₹4.13 lakh crore mcap amid US-Iran ceasefire; HDFC, ICICI Bank top list",https://www.livemint.com/companies/news/8-out-of-10-most-indias-valuable-companies-add-4-13-lakh-crore-mcap-amid-us-iran-ceasefire-hdfc-icici-bank-top-list-11775981327633.html,2026-04-12T10:38:49+00:00
LiveMint,55,"TCS makes 25,000 fresher offers in FY27, says more hiring hinges on demand: Report",https://www.livemint.com/companies/news/tcs-makes-25-000-fresher-offers-in-fy27-says-more-hiring-hinges-on-demand-report-11775977193435.html,2026-04-12T10:38:49+00:00
LiveMint,56,"TCS payouts to Tata Sons fall as acquisitions, AI push weigh on cash flows",https://www.livemint.com/companies/tata-sons-atm-dispensing-less-cash-acquisitions-tcs-payouts-11775817660337.html,2026-04-12T10:38:49+00:00
LiveMint,57,Lufthansa Crew Strike Set to Cancel More Than 500 Flights,https://www.livemint.com/companies/lufthansa-crew-strike-set-to-cancel-more-than-500-flights-11775970692843.html,2026-04-12T10:38:49+00:00
LiveMint,58,How Oracle’s huge AI build-out is causing a cash crunch and layoffs,https://www.livemint.com/companies/news/oracle-layoffs-india-oracle-job-cuts-11775824138456.html,2026-04-12T10:38:49+00:00
LiveMint,59,Ask Mint Money,https://www.livemint.com/money/ask-mint-money,2026-04-12T10:38:49+00:00
LiveMint,60,Buying a home? How 800+ credit score will help you get better home loan interest rates and 5 tips to increase it,https://www.livemint.com/money/personal-finance/buying-a-home-how-800-plus-credit-score-will-help-you-get-better-home-loan-interest-rates-and-5-tips-to-increase-it-11775983718586.html,2026-04-12T10:38:49+00:00
LiveMint,61,UP-RERA eases property transfers in the state: What the new rules mean for buyers?,https://www.livemint.com/money/personal-finance/uprera-eases-property-transfers-in-the-state-what-the-new-rules-mean-for-buyers-11775984817107.html,2026-04-12T10:38:49+00:00
LiveMint,62,Take-home salary calculation: How much will your in-hand pay change if you have a ₹30 lakh CTC? Check here,https://www.livemint.com/money/personal-finance/take-home-salary-calculation-labour-laws-how-much-will-your-in-hand-pay-change-if-you-have-a-30-lakh-ctc-check-here-11775976543109.html,2026-04-12T10:38:49+00:00
LiveMint,63,FD rates: Top five private banks of India offer up to 7.5% fixed deposit interest rates — Check full list,https://www.livemint.com/money/personal-finance/fd-rates-top-five-private-banks-of-india-offer-up-to-7-5-fixed-deposit-interest-rates-hdfc-icici-axis-kotak-mahindra-11775966101756.html,2026-04-12T10:38:49+00:00
LiveMint,64,RBI proposes safeguards for digital transactions — what it means for senior citizens and other users,https://www.livemint.com/money/personal-finance/rbi-proposes-safeguards-for-digital-transactions-what-it-means-for-senior-citizens-and-other-users-11775971344350.html,2026-04-12T10:38:49+00:00
LiveMint,65,"PPF income strategy: How to get ₹61,000 monthly pension from your public provident fund investment? See calculation",https://www.livemint.com/money/personal-finance/ppf-income-strategy-how-to-get-61-000-monthly-pension-from-your-public-provident-fund-investment-see-calculation-11775966181622.html,2026-04-12T10:38:49+00:00
LiveMint,66,Anthropic brings Claude AI to Microsoft Word so you can chat with your documents,https://www.livemint.com/technology/tech-news/anthropic-brings-claude-ai-to-microsoft-word-so-you-can-chat-with-your-documents-11775892419940.html,2026-04-12T10:38:49+00:00
LiveMint,67,"Anthropic blocks OpenClaw's founder from accessing Claude AI, reverses decision in hours",https://www.livemint.com/technology/tech-news/anthropic-blocks-openclaws-founder-from-accessing-claude-ai-reverses-decision-in-hours-11775888501493.html,2026-04-12T10:38:49+00:00
LiveMint,68,Elon Musk's X is finally cracking down on engagement farming with big overhaul to its monetization program,https://www.livemint.com/technology/tech-news/elon-musks-x-is-finally-cracking-down-on-engagement-farming-with-big-overhaul-to-its-monetization-program-11775876168952.html,2026-04-12T10:38:49+00:00
LiveMint,69,"Pixel users report phones freezing on startup screen after latest Google update, company responds",https://www.livemint.com/technology/tech-news/pixel-users-report-phones-freezing-on-startup-screen-after-latest-google-update-company-responds-11775875036837.html,2026-04-12T10:38:49+00:00
LiveMint,70,"Mac users, update your ChatGPT app immediately: OpenAI issues urgent security warning",https://www.livemint.com/technology/tech-news/openai-says-it-faced-a-security-issue-forces-mandatory-update-for-all-mac-users-to-block-fake-chatgpt-apps-11775873495758.html,2026-04-12T10:38:49+00:00
LiveMint,71,"Vijay Sales Apple Days: Check out top offers on iPhone 17 Pro Max, iPhone 17, iPhone 16 and more",https://www.livemint.com/technology/tech-news/vijay-sales-apple-days-check-out-top-offers-on-iphone-17-pro-max-iphone-17-iphone-16-and-more-11775868830097.html,2026-04-12T10:38:49+00:00
LiveMint,72,IPL 2026 Schedule,https://www.livemint.com/sports/cricket-news/ipl-schedule,2026-04-12T10:38:49+00:00
LiveMint,73,Orange Cap in IPL 2026,https://www.livemint.com/sports/cricket-news/ipl-orange-cap,2026-04-12T10:38:49+00:00
LiveMint,74,Purple Cap in IPL 2026,https://www.livemint.com/sports/cricket-news/ipl-purple-cap,2026-04-12T10:38:49+00:00
LiveMint,75,IPL 2026 Points Table,https://www.livemint.com/sports/cricket-news/ipl-points-table,2026-04-12T10:38:49+00:00
LiveMint,76,IFSC Code Finder,https://www.livemint.com/ifsc-code,2026-04-12T10:38:49+00:00
LiveMint,77,Income Tax Calculator,https://www.livemint.com/tools-calculators/income-tax-calculator,2026-04-12T10:38:49+00:00
LiveMint,78,Gold Rate Today,https://www.livemint.com/gold-prices,2026-04-12T10:38:49+00:00
LiveMint,79,Gold Rate in Delhi,https://www.livemint.com/gold-prices/delhi,2026-04-12T10:38:49+00:00
LiveMint,80,Gold Rate Hyderabad,https://www.livemint.com/gold-prices/hyderabad,2026-04-12T10:38:49+00:00
LiveMint,81,Silver Rate Today,https://www.livemint.com/silver-prices,2026-04-12T10:38:49+00:00
