source,rank,headline,link,collected_at_iso
Indian Express,1,Trending in India,https://indianexpress.com/section/trending/trending-in-india/,2026-05-14T10:15:17+00:00
Indian Express,2,This is Serious,https://indianexpress.com/section/trending/this-is-serious/,2026-05-14T10:15:17+00:00
Indian Express,3,Nanhe Miyan Bareilly storm viral video,https://indianexpress.com/article/trending/trending-in-india/nanhe-miyan-lifted-50-metres-into-air-viral-video-bareilly-up-storm-10689210/,2026-05-14T10:15:17+00:00
Indian Express,4,China school baby doll exercise,https://indianexpress.com/article/trending/trending-globally/china-school-make-rebellious-students-carry-baby-dolls-to-teach-parenting-struggles-10688969/,2026-05-14T10:15:17+00:00
Indian Express,5,UP storm viral video,https://indianexpress.com/article/trending/trending-in-india/up-storm-viral-video-man-thrown-into-air-as-powerful-winds-lash-bareilly-10688840/,2026-05-14T10:15:17+00:00
Indian Express,6,Uber CEO Dara Khosrowshahi Delhi Metro ride,https://indianexpress.com/article/trending/trending-in-india/uber-ceo-dara-khosrowshahi-take-delhi-metro-ride-to-jor-bagh-call-it-fast-affordable-10688691/,2026-05-14T10:15:17+00:00
Indian Express,7,Top 10 countries with largest gold reserves in world,https://indianexpress.com/article/trending/top-10-listing/top-10-countries-with-largest-gold-reserves-in-the-world-10687821/,2026-05-14T10:15:17+00:00
Indian Express,8,Kaddu airport stray dog found,https://indianexpress.com/article/trending/trending-in-india/kaddu-delhi-airport-stray-dog-found-safe-in-dwarka-viral-video-10687797/,2026-05-14T10:15:17+00:00
Indian Express,9,viral underwater sunset video,https://indianexpress.com/article/trending/trending-globally/diver-leave-camera-underwater-in-maui-hawaii-capture-sea-creatures-in-viral-video-10687654/,2026-05-14T10:15:17+00:00
Indian Express,10,Vladimir Putin viral video,https://indianexpress.com/article/trending/trending-globally/russian-president-vladimir-putin-drives-former-school-teacher-to-kremlin-dinner-viral-video-10687494/,2026-05-14T10:15:17+00:00
Indian Express,11,DTC bus stop,https://indianexpress.com/article/trending/trending-in-india/delhi-traffic-police-dtc-bus-stop-blocked-by-car-viral-post-10687155/,2026-05-14T10:15:17+00:00
Indian Express,12,Diljit Dosanjh Chicago concert gender reveal,https://indianexpress.com/article/trending/trending-in-india/diljit-dosanjh-chicago-concert-gender-reveal-viral-video-10687146/,2026-05-14T10:15:17+00:00
Indian Express,13,Princess Jahnavi Kumari Mewar 3 jobs generational wealth,https://indianexpress.com/article/trending/trending-in-india/princess-jahnavi-kumari-mewar-worked-3-jobs-despite-generational-wealth-money-was-never-unlimited-10686962/,2026-05-14T10:15:17+00:00
Indian Express,14,Gir National Park is home to 40 species of mammals and 425 species of birds,https://indianexpress.com/article/trending/trending-in-india/gir-lioness-launches-a-live-hunt-in-front-of-a-tourist-jeep-viral-10686849/,2026-05-14T10:15:17+00:00
Indian Express,15,Top 10 most economically stable countries in the world,https://indianexpress.com/article/trending/top-10-listing/top-10-most-economically-stable-countries-in-the-world-10685987/,2026-05-14T10:15:17+00:00
Indian Express,16,Anupam Mittal work from home policy,https://indianexpress.com/article/trending/trending-in-india/anupam-mittal-work-from-home-for-shaadicom-employees-pm-modi-fuel-saving-policy-10685932/,2026-05-14T10:15:17+00:00
Indian Express,17,Queen Mercy Atang bread dress,https://indianexpress.com/article/trending/trending-globally/reality-tv-star-queen-mercy-atang-bread-dress-amvca-viral-video-10685733/,2026-05-14T10:15:17+00:00
Indian Express,18,waterspout near Odisha coast,https://indianexpress.com/article/trending/trending-in-india/waterspout-near-odisha-puri-astaranga-coast-hatisunda-viral-video-10685517/,2026-05-14T10:15:17+00:00
Indian Express,19,Sachin Tendulkar viral video,https://indianexpress.com/article/trending/trending-in-india/sachin-tendulkar-village-kids-handmade-car-viral-video-10685242/,2026-05-14T10:15:17+00:00
Indian Express,20,The viral post featured a mannequin draped in a striking blue-red saree,https://indianexpress.com/article/trending/trending-globally/rocket-woman-nandini-harinath-saree-smithsonian-mangalyaan-isro-10685142/,2026-05-14T10:15:17+00:00
Indian Express,21,Emmanuel Macron halts Africa-France summit to quiet crowd viral video,https://indianexpress.com/article/trending/trending-globally/emmanuel-macron-stop-africa-france-summit-session-to-scold-noisy-crowd-viral-video-10685018/,2026-05-14T10:15:17+00:00
Indian Express,22,No injuries or aircraft damage were immediately reported,https://indianexpress.com/article/trending/trending-globally/korean-air-flight-shaking-before-aborting-landing-at-tokyo-airport-viral-video-10684818/,2026-05-14T10:15:17+00:00
Indian Express,23,The vacant ATM booth was later rented out and converted into a salon,https://indianexpress.com/article/trending/trending-in-india/bihar-barber-shop-inside-old-sbi-atm-booth-goes-viral-10684080/,2026-05-14T10:15:17+00:00
Indian Express,24,The viral video shows the motorcycle suspended awkwardly from the pole,https://indianexpress.com/article/trending/trending-globally/motorcycle-ends-up-hanging-from-traffic-light-pole-after-accident-in-canada-video-10683971/,2026-05-14T10:15:17+00:00
Indian Express,25,Vijay’s political ascent has emerged as one of the most discussed developments in the country,https://indianexpress.com/article/trending/trending-in-india/kerala-couple-embarks-on-650-km-walk-to-meet-tamil-nadus-new-cm-vijay-in-chennai-10683826/,2026-05-14T10:15:17+00:00
Indian Express,26,"He shared that his father, Prakash Chand Kochhar, had moved to Raleigh in 1946 to study textile manufacturing at NC State",https://indianexpress.com/article/trending/trending-globally/indian-origin-philanthropist-pays-off-student-loans-for-a-class-of-college-graduates-in-us-10683580/,2026-05-14T10:15:17+00:00
Indian Express,27,Vaibhav Sooryavanshi's Mother's Day post,https://indianexpress.com/article/trending/trending-in-india/vaibhav-sooryavanshi-shares-heart-warming-photo-on-mothers-day-10683486/,2026-05-14T10:15:17+00:00
LiveMint,1,Joel Embiid ruled out for Philadelphia 76ers Game 2 vs Knicks due to injury,https://www.livemint.com/us/trending/joel-embiid-ruled-out-for-philadelphia-76ers-game-2-vs-new-york-knicks-due-to-injury-11778089872415.html,2026-05-14T10:15:17+00:00
LiveMint,2,"Carlos Correa injury: Astros place star player on IL, recall Shay Whitcomb",https://www.livemint.com/us/trending/carlos-correa-injury-houston-astros-place-star-player-with-season-ending-left-ankle-injury-on-il-shay-whitcomb-mlb-11778085652310.html,2026-05-14T10:15:17+00:00
LiveMint,3,Bayern Munich vs PSG: Who will win UCL clash? AI predictions and more,https://www.livemint.com/us/trending/bayern-munich-vs-psg-predictions-champions-league-semifinal-lineups-live-streaming-ucl-202526-11778071490090.html,2026-05-14T10:15:17+00:00
LiveMint,4,Are celebs really skipping Met Gala because Jeff Bezos is funding it?,https://www.livemint.com/us/trending/met-gala-are-meryl-streep-zendaya-really-skipping-the-event-because-jeff-bezos-is-funding-it-here-s-the-truth-11777924588506.html,2026-05-14T10:15:17+00:00
LiveMint,5,Met Gala 2026 LIVE Update: Rihanna shines bright like a diamond after Beyonce,https://www.livemint.com/us/trending/met-gala-2026-live-updates-red-carpet-11777915596931.html,2026-05-14T10:15:17+00:00
LiveMint,6,F1: Kimi Antonelli wins 2026 Miami Grand Prix 2026,https://www.livemint.com/us/trending/kimi-antonelli-wins-miami-grand-prix-2026-secures-third-consecutive-f1-win-in-thrilling-race-formula-1-race-11777833243419.html,2026-05-14T10:15:17+00:00
LiveMint,7,Messi steals spotlight at 2026 F1 Miami Grand Prix with Mercedes Paddock visit,https://www.livemint.com/us/trending/lionel-messi-steals-spotlight-at-2026-f1-miami-grand-prix-with-mercedes-paddock-visit-11777828759020.html,2026-05-14T10:15:17+00:00
LiveMint,8,Sinner becomes first man in history to win 5 consecutive ATP Masters 1000 titles,https://www.livemint.com/us/trending/jannik-sinner-becomes-first-man-in-history-to-win-five-consecutive-atp-masters-1000-titles-with-madrid-open-2026-win-11777824491199.html,2026-05-14T10:15:17+00:00
LiveMint,9,Sir Alex Ferguson taken to hospital before Manchester United vs Liverpool clash,https://www.livemint.com/us/trending/sir-alex-ferguson-hospitalized-before-manchester-united-vs-liverpool-clash-at-old-trafford-premier-league-11777821038054.html,2026-05-14T10:15:17+00:00
LiveMint,10,F1: New start time confirmed for Miami Grand Prix 2026 following weather concern,https://www.livemint.com/us/trending/f1-race-today-new-start-time-confirmed-for-miami-grand-prix-2026-following-weather-concerns-1-pm-formula-one-11777815611939.html,2026-05-14T10:15:17+00:00
LiveMint,11,Isack Hadjar disqualified from Miami GP qualifying after Antonelli claims pole,https://www.livemint.com/us/trending/isack-hadjar-disqualified-from-miami-gp-qualifying-over-floor-breach-after-kimi-antonelli-claims-pole-f1-formula-one-11777812192883.html,2026-05-14T10:15:17+00:00
LiveMint,12,F1 standings: Lando Norris wins 2026 Miami Grand Prix sprint; check details,https://www.livemint.com/us/trending/f1-standings-lando-norris-wins-2026-miami-grand-prix-sprint-mclaren-dominates-ahead-of-oscar-piastri-charles-leclerc-11777748165459.html,2026-05-14T10:15:17+00:00
LiveMint,13,Marta Kostyuk wins first WTA 1000 title at Madrid Open defeating Mirra Andreeva,https://www.livemint.com/us/trending/marta-kostyuk-wins-first-wta-1000-title-at-2026-mutua-madrid-open-defeating-mirra-andreeva-tennis-11777741831620.html,2026-05-14T10:15:17+00:00
LiveMint,14,Kofi Kingston and Xavier Woods mutually part ways with WWE; check details,https://www.livemint.com/us/trending/kofi-kingston-and-xavier-woods-mutually-part-ways-with-wwe-new-day-era-ends-after-two-decades-11777737655848.html,2026-05-14T10:15:17+00:00
LiveMint,15,Alex Zanardi death: Ex-F1 driver and Paralympic champion passes away at 59,https://www.livemint.com/us/trending/alex-zanardi-death-ex-f1-driver-and-paralympic-champion-passes-away-at-59-11777722809154.html,2026-05-14T10:15:17+00:00
LiveMint,16,Notre Dame lands four-star QB Wonderful Monds IV for 2027 Class,https://www.livemint.com/us/trending/notre-dame-lands-four-star-qb-wonderful-monds-iv-for-2027-class-future-quarterback-pipeline-gets-major-boost-11777663752062.html,2026-05-14T10:15:17+00:00
LiveMint,17,Las Vegas Raiders release LB Jamin Davis; check details,https://www.livemint.com/us/trending/las-vegas-raiders-release-lb-jamin-davis-nfl-11777648041021.html,2026-05-14T10:15:17+00:00
LiveMint,18,Jannik Sinner breaks Novak Djokovic's record after reaching Madrid Open final,https://www.livemint.com/us/trending/jannik-sinner-breaks-novak-djokovics-record-youngest-ever-to-reach-finals-at-all-atp-masters-1000-events-madrid-open-11777651008351.html,2026-05-14T10:15:17+00:00
LiveMint,19,"Miami Grand Prix 2026: Date, schedule, drivers and more details",https://www.livemint.com/us/trending/f1-miami-grand-prix-2026-date-schedule-drivers-and-more-details-as-formula-1-returns-to-south-florida-11777645272617.html,2026-05-14T10:15:17+00:00
LiveMint,20,Calais Campbell signs one-year deal to reunite with Baltimore Ravens,https://www.livemint.com/us/trending/calais-campbell-signs-one-year-deal-to-reunite-with-baltimore-ravens-for-19th-nfl-season-11777568784994.html,2026-05-14T10:15:17+00:00
LiveMint,21,John Wall named president of basketball operations at Howard University,https://www.livemint.com/us/trending/john-wall-named-president-of-basketball-operations-at-howard-university-nba-star-returns-to-dc-roots-college-basketball-11777563099390.html,2026-05-14T10:15:17+00:00
LiveMint,22,Alexander Blockx stuns Casper Ruud to reach Madrid Open semifinals,https://www.livemint.com/us/trending/alexander-blockx-stuns-casper-ruud-to-reach-madrid-open-semifinals-tennis-11777556320538.html,2026-05-14T10:15:17+00:00
LiveMint,23,Jayson Tatum surpasses Kobe Bryant for second-most playoff points before age 29,https://www.livemint.com/us/trending/jayson-tatum-surpasses-kobe-bryant-for-second-most-playoff-points-in-nba-history-before-age-29-11777553504237.html,2026-05-14T10:15:17+00:00
LiveMint,24,"Jannik Sinner storms into Madrid Open semifinals, beating Rafael Jodar",https://www.livemint.com/us/trending/jannik-sinner-storms-into-madrid-open-semifinals-crushing-teen-sensation-rafael-jodar-s-dream-run-11777482782147.html,2026-05-14T10:15:17+00:00
LiveMint,25,Chelsea's Mykhailo Mudryk appeals four-year FA drugs ban at CAS,https://www.livemint.com/us/trending/mykhailo-mudryk-appeals-four-year-fa-drugs-ban-at-cas-chelseas-winger-hopes-for-early-return-11777480017651.html,2026-05-14T10:15:17+00:00
LiveMint,26,Justin Simmons retires: Denver Broncos All-Pro safety ends NFL career,https://www.livemint.com/us/trending/justin-simmons-retires-four-time-all-pro-safety-ends-nfl-career-with-denver-broncos-11777474772792.html,2026-05-14T10:15:17+00:00
LiveMint,27,Kirsten Storms faces restraining order filed by ex-husband Brandon Barash,https://www.livemint.com/us/trending/kirsten-storms-faces-emergency-restraining-order-as-ex-husband-brandon-barash-raises-alarming-claims-in-court-11777405092046.html,2026-05-14T10:15:17+00:00
LiveMint,28,"Over 20 years later, ‘Friends’ brings in $20 Million a year: Lisa Kudrow reveals",https://www.livemint.com/us/trending/over-20-years-later-friends-brings-in-20-million-a-year-lisa-kudrow-shares-insights-11777400523739.html,2026-05-14T10:15:17+00:00
LiveMint,29,Kimmel responds to Trump’s firing demand with sharp message to Melania,https://www.livemint.com/us/trending/jimmy-kimmel-hits-back-after-expectant-widow-joke-tells-melania-to-address-trump-s-hateful-and-violent-rhetoric-11777382628899.html,2026-05-14T10:15:17+00:00
LiveMint,30,"Harry Styles-Zoë Kravitz Ring: A Look at the Rumoured $350,000 Sparkler",https://www.livemint.com/us/trending/harry-styles-zo-kravitz-engagement-ring-a-closer-look-at-the-rumoured-350-000-sparkler-11777318122710.html,2026-05-14T10:15:17+00:00
LiveMint,31,Chelsea 1-0 Leeds: Enzo Fernandez header sends Blues to 2026 FA Cup final,https://www.livemint.com/us/trending/chelsea-1-0-leeds-enzo-fernandez-header-sends-blues-to-2026-fa-cup-final-manchester-city-11777230733431.html,2026-05-14T10:15:17+00:00
LiveMint,32,Deion Sanders shows strong support for Diego Pavia after 2026 NFL draft snub,https://www.livemint.com/us/trending/deion-sanders-diego-pavia-undrafted-2026-nfl-draft-snub-11777213593804.html,2026-05-14T10:15:17+00:00
LiveMint,33,Luxury vs struggle: Former Iranian diplomat’s son exposes harsh reality gap,https://www.livemint.com/us/trending/private-jets-parties-scantily-clad-women-former-iranian-diplomat-s-son-exposes-countrys-deep-inequality-11777220729337.html,2026-05-14T10:15:17+00:00
LiveMint,34,Lawrence Taylor medical emergency: Giants legend hospitalized in New Jersey,https://www.livemint.com/us/trending/lawrence-taylor-medical-emergency-new-york-giants-legend-hospitalized-in-new-jersey-nfl-11777058394793.html,2026-05-14T10:15:17+00:00
LiveMint,35,Carlos Alcaraz withdraws from Roland Garros 2026; check details,https://www.livemint.com/us/trending/carlos-alcaraz-withdraws-roland-garros-2026-french-open-defending-champion-misses-title-defense-wrist-injury-tennis-11777049401197.html,2026-05-14T10:15:17+00:00
LiveMint,36,Fact you may not know: This war lasted shorter than your commute to office,https://www.livemint.com/us/trending/fact-you-probably-dont-know-this-battle-between-two-countries-lasted-shorter-than-your-commute-to-office-11777041884176.html,2026-05-14T10:15:17+00:00
LiveMint,37,David Wilcock harassed by 'cyber-stalkers'? Corey Goode drops shocking claims,https://www.livemint.com/us/trending/ufo-expert-david-wilcock-harassed-by-cyber-stalkers-corey-goode-drops-shocking-claims-after-his-death-11776888810059.html,2026-05-14T10:15:17+00:00
LiveMint,38,"David Wilcock death: Friend shares final moments, reveals he was ‘misunderstood'",https://www.livemint.com/us/trending/david-wilcock-death-best-friend-shares-final-moments-reveals-he-was-excited-about-the-future-11776886359815.html,2026-05-14T10:15:17+00:00
LiveMint,39,Padres sign Lucas Giolito: Veteran pitcher joins San Diego rotation,https://www.livemint.com/us/trending/padres-sign-lucas-giolito-to-one-year-deal-veteran-pitcher-joins-san-diego-rotation-amid-injury-woes-mlb-baseball-11776879659418.html,2026-05-14T10:15:17+00:00
LiveMint,40,Mark to Market,https://www.livemint.com/market/mark-to-market,2026-05-14T10:15:17+00:00
LiveMint,41,"Top Gainers & Losers on May 14: NLC India, Cipla, Bharti Airtel, Vedanta, MCX, BSE, Berger Paints among top gainers",https://www.livemint.com/market/stock-market-news/top-gainers-losers-on-may-14-nlc-india-cipla-bharti-airtel-vedanta-mcx-bse-berger-paints-among-top-gainers-11778750851464.html,2026-05-14T10:15:17+00:00
LiveMint,42,"Stock market today: Sensex jumps 800 points, Nifty 50 ends near 23,700; bank, metal, pharma shine",https://www.livemint.com/market/stock-market-news/stock-market-today-sensex-jumps-800-points-nifty-50-ends-near-23-700-bank-metal-pharma-shine-11778752612727.html,2026-05-14T10:15:17+00:00
LiveMint,43,Silver inventories on COMEX drop below 80 million ounces. What it means for silver prices?,https://www.livemint.com/market/commodities/silver-inventories-on-comex-drop-below-80-million-ounces-what-it-means-for-silver-prices-11778749989042.html,2026-05-14T10:15:17+00:00
LiveMint,44,Do you know what upstream and downstream companies are? How do changes in crude oil prices impact them?,https://www.livemint.com/market/stock-market-news/do-you-know-what-upstream-and-downstream-companies-are-how-do-crude-oil-prices-impact-them-11778746738096.html,2026-05-14T10:15:17+00:00
LiveMint,45,Small-cap stock jumps over 17% to hit six-month high after securing multiple orders,https://www.livemint.com/market/stock-market-news/smallcap-stock-jumps-over-17-to-hit-six-month-high-after-securing-multiple-orders-11778748123073.html,2026-05-14T10:15:17+00:00
LiveMint,46,"IRFC Q4 Results: Railway PSU's profit remains unchanged at ₹1,684 crore; total income grows 9% YoY",https://www.livemint.com/market/stock-market-news/irfc-q4-results-railway-psus-profit-remains-unchanged-at-rs-1-684-crore-total-income-grows-9-yoy-11778749886348.html,2026-05-14T10:15:17+00:00
LiveMint,47,US officials accompanying Trump enter 'digital lockdown' as US president visits China — What does it mean?,https://www.livemint.com/news/world/us-officials-accompanying-trump-enter-digital-lockdown-as-us-president-visits-china-what-does-it-mean-11778749767736.html,2026-05-14T10:15:17+00:00
LiveMint,48,"EC announces SIR Phase-III in 19 states, UTs; excludes Himachal, J&K and Ladakh: Full schedule here",https://www.livemint.com/news/india/ec-announces-sir-phase-iii-in-19-states-uts-excludes-himachal-j-k-and-ladakh-full-schedule-here-11778749202160.html,2026-05-14T10:15:17+00:00
LiveMint,49,"‘Free WiFi, AC and charging port': Man reveals ways to work remotely without spending money in Bengaluru",https://www.livemint.com/news/trends/free-wifi-ac-and-charging-port-man-reveals-ways-to-work-remotely-without-spending-money-in-bengaluru-11778743455233.html,2026-05-14T10:15:17+00:00
LiveMint,50,US Efforts to End Iran War Stumble as Ship Seized Near UAE,https://www.livemint.com/news/world/us-efforts-to-end-iran-war-stumble-as-ship-seized-near-uae-11778749279376.html,2026-05-14T10:15:17+00:00
LiveMint,51,Quote of the Day: Virat Kohli on pressure — ‘There’s a reason why people say pressure is a privilege',https://www.livemint.com/news/trends/quote-of-the-day-virat-kohli-on-pressure-there-s-a-reason-why-people-say-pressure-is-a-privilege-11778748288230.html,2026-05-14T10:15:17+00:00
LiveMint,52,Mamata Banerjee appears before Calcutta HC wearing lawyer's gown to argue Bengal post-poll violence case,https://www.livemint.com/news/india/mamata-banerjee-appears-before-calcutta-hc-wearing-lawyers-gown-to-argue-in-bengal-post-poll-violence-case-11778742221833.html,2026-05-14T10:15:17+00:00
LiveMint,53,Kapur family dispute: Supreme Court halts director appointments at RIPL,https://www.livemint.com/companies/news/kapur-family-dispute-supreme-court-halts-director-appointments-at-ripl-11778748076965.html,2026-05-14T10:15:17+00:00
LiveMint,54,"Iran war impact: Lufthansa, Cathay capitalize on Air India’s massive international flight cuts",https://www.livemint.com/companies/news/iran-war-impact-lufthansa-cathay-capitalize-on-air-india-s-massive-international-flight-cuts-11778749947171.html,2026-05-14T10:15:17+00:00
LiveMint,55,"Clocking out: IT giants pivot to fixed and outcome-based pricing, driven by growing use of AI tools",https://www.livemint.com/companies/it-giants-automation-tools-fixed-prices-outcome-based-contracts-infosys-cognizant-time-and-material-billing-ai-11778729641584.html,2026-05-14T10:15:17+00:00
LiveMint,56,"Skyroot Aerospace does a SpaceX, offers Elon Musk-style Esops to its founders",https://www.livemint.com/technology/tech-news/skyroot-aerospace-does-a-spacex-offers-elon-musk-style-esops-to-its-founders-11778646935329.html,2026-05-14T10:15:17+00:00
LiveMint,57,NTSB urges airlines to train their pilots to deal with smoke in the cockpit,https://www.livemint.com/companies/ntsb-urges-airlines-to-train-their-pilots-to-deal-with-smoke-in-the-cockpit-11778704880805.html,2026-05-14T10:15:17+00:00
LiveMint,58,Silicon Valley Prosecutor Targets Foreign Corporate Spying,https://www.livemint.com/companies/silicon-valley-prosecutor-targets-foreign-corporate-spying-11778700455000.html,2026-05-14T10:15:17+00:00
LiveMint,59,Ask Mint Money,https://www.livemint.com/money/ask-mint-money,2026-05-14T10:15:17+00:00
LiveMint,60,50-30-20 vs envelope vs zero-based budgeting: Which method suits you best?,https://www.livemint.com/money/personal-finance/503020-vs-envelope-vs-zero-based-budgeting-which-method-suits-you-best-11778747142167.html,2026-05-14T10:15:17+00:00
LiveMint,61,Can Indians earn from idle gold through stablecoins? Why CoinSwitch co-founder sees challenges in Nikhil Kamath’s idea,https://www.livemint.com/money/personal-finance/can-indians-earn-from-idle-gold-through-stablecoins-why-coinswitch-co-founder-sees-challenges-in-nikhil-kamath-s-idea-11778743376692.html,2026-05-14T10:15:17+00:00
LiveMint,62,"EPFO deadline alert: File April 2026 ECR, deposit PF dues by 15 May to avoid penalties",https://www.livemint.com/money/personal-finance/epfo-deadline-alert-file-april-2026-ecr-deposit-pf-dues-by-15-may-to-avoid-penalties-11778738884719.html,2026-05-14T10:15:17+00:00
LiveMint,63,"Should you add silver instead of gold after the duty hike-triggered price rally? Experts say, ‘a tactical addition…’",https://www.livemint.com/money/personal-finance/should-you-add-silver-instead-of-gold-after-the-duty-hike-triggered-price-rally-experts-say-a-tactical-addition-to-11778735099785.html,2026-05-14T10:15:17+00:00
LiveMint,64,Income isn’t wealth: The silent trap of high-flying executives,https://www.livemint.com/money/personal-finance/income-silent-trap-high-flying-executives-wealth-creation-high-income-financial-planning-taxation-11778731410779.html,2026-05-14T10:15:17+00:00
LiveMint,65,Mirae Asset launches SIF-based Platinum Hybrid Long-Short Fund – key details explained,https://www.livemint.com/money/personal-finance/mirae-asset-launches-sif-based-platinum-hybrid-long-short-fund-key-details-explained-11778734160725.html,2026-05-14T10:15:17+00:00
LiveMint,66,Crypto Die-Hards Think They’ve Found the Next Bitcoin,https://www.livemint.com/technology/crypto-die-hards-think-they-ve-found-the-next-bitcoin-11778752666334.html,2026-05-14T10:15:17+00:00
LiveMint,67,"SOS walking sticks, smart rings and more: Gadgets making life easier for senior citizens",https://www.livemint.com/technology/sos-walking-sticks-smart-rings-and-more-gadgets-making-life-easier-for-senior-citizens-11778733115569.html,2026-05-14T10:15:17+00:00
LiveMint,68,"After bombs, blackouts and bank restrictions, Gaza’s digital workers are still coding",https://www.livemint.com/technology/after-bombs-blackouts-and-bank-restrictions-gaza-s-digital-workers-are-still-coding-11778731889627.html,2026-05-14T10:15:17+00:00
LiveMint,69,"Google confirms which OnePlus, Oppo, Xiaomi and Vivo phones are getting AirDrop support via Quick Share",https://www.livemint.com/technology/tech-news/google-confirms-which-oneplus-oppo-xiaomi-and-vivo-phones-are-getting-airdrop-support-via-quick-share-11778661743596.html,2026-05-14T10:15:17+00:00
LiveMint,70,IPL 2026 Schedule,https://www.livemint.com/sports/cricket-news/ipl-schedule,2026-05-14T10:15:17+00:00
LiveMint,71,Orange Cap in IPL 2026,https://www.livemint.com/sports/cricket-news/ipl-orange-cap,2026-05-14T10:15:17+00:00
LiveMint,72,Purple Cap in IPL 2026,https://www.livemint.com/sports/cricket-news/ipl-purple-cap,2026-05-14T10:15:17+00:00
LiveMint,73,IPL 2026 Points Table,https://www.livemint.com/sports/cricket-news/ipl-points-table,2026-05-14T10:15:17+00:00
LiveMint,74,IFSC Code Finder,https://www.livemint.com/ifsc-code,2026-05-14T10:15:17+00:00
LiveMint,75,Income Tax Calculator,https://www.livemint.com/tools-calculators/income-tax-calculator,2026-05-14T10:15:17+00:00
LiveMint,76,Gold Rate Today,https://www.livemint.com/gold-prices,2026-05-14T10:15:17+00:00
LiveMint,77,Gold Rate in Delhi,https://www.livemint.com/gold-prices/delhi,2026-05-14T10:15:17+00:00
LiveMint,78,Gold Rate Hyderabad,https://www.livemint.com/gold-prices/hyderabad,2026-05-14T10:15:17+00:00
LiveMint,79,Silver Rate Today,https://www.livemint.com/silver-prices,2026-05-14T10:15:17+00:00
LiveMint,80,Silver Rate in Delhi,https://www.livemint.com/silver-prices/delhi,2026-05-14T10:15:17+00:00
