source,rank,headline,link,collected_at_iso
TOI ETimes,82,Who was Savitha Shan? Parents launch scholarship for low-income family students in memory of UT student killed in March shooting,https://timesofindia.indiatimes.com/articleshow/130302311.cms,2026-04-18T08:51:53+00:00
TOI ETimes,83,"Black hijab and turban allowed but no bindi, chooda or tilak? Lenskart office policy making netizens furious - Peyush Bansal responds",https://timesofindia.indiatimes.com/articleshow/130300518.cms,2026-04-18T08:51:53+00:00
TOI ETimes,84,"Who is Vaishali Rameshbabu? Indian chess grandmaster set to challenge world champion Ju Wenjun for €300,000 title",https://timesofindia.indiatimes.com/articleshow/130299641.cms,2026-04-18T08:51:53+00:00
TOI ETimes,85,'You touched me without my permission’: Internet outraged as old Pakistan interview resurfaces showing man touching reporter mid-interview,https://timesofindia.indiatimes.com/articleshow/130298608.cms,2026-04-18T08:51:53+00:00
TOI ETimes,86,Punjabi dhaba owner in Kochi speaks Malayalam like a local – but how? Viral video gets Shashi Tharoor’s attention,https://timesofindia.indiatimes.com/articleshow/130297383.cms,2026-04-18T08:51:53+00:00
TOI ETimes,87,Pune’s 169-year-old bakery serves an iconic bread once loved by Indira Gandhi and Dilip Kumar,https://timesofindia.indiatimes.com/articleshow/130296506.cms,2026-04-18T08:51:53+00:00
TOI ETimes,88,Meet Arjun Singh: Indian-origin Gradescope co-founder wins prestigious Mark Bingham Award for Excellence in Achievement,https://timesofindia.indiatimes.com/articleshow/130293030.cms,2026-04-18T08:51:53+00:00
TOI ETimes,89,"Meghan Markle says she was 'the most trolled person in the world', urges people to be stronger against cruelty",https://timesofindia.indiatimes.com/articleshow/130315929.cms,2026-04-18T08:51:53+00:00
TOI ETimes,90,"""Experiences > objects"": Bengaluru techie with 50 LPA salary sets example by investing in house and travel over iPhones and Zara clothing",https://timesofindia.indiatimes.com/articleshow/130292147.cms,2026-04-18T08:51:53+00:00
TOI ETimes,91,"Who is Gulabo Sapera? Rajasthani woman once buried alive, wh...",https://timesofindia.indiatimes.com/articleshow/130275017.cms,2026-04-18T08:51:53+00:00
TOI ETimes,92,Who was Sawai Madho Singh II? The Maharaja who carried his o...,https://timesofindia.indiatimes.com/articleshow/130190590.cms,2026-04-18T08:51:53+00:00
TOI ETimes,93,14-year-old boy selling postcards outside Angkor Wat who spo...,https://timesofindia.indiatimes.com/articleshow/130197303.cms,2026-04-18T08:51:53+00:00
TOI ETimes,94,Who is Angad Daryani? Indian-origin engineer who dropped out...,https://timesofindia.indiatimes.com/articleshow/130238967.cms,2026-04-18T08:51:53+00:00
TOI ETimes,95,Indian-origin MBA student Anaheez Patel breaks silence after...,https://timesofindia.indiatimes.com/articleshow/130193502.cms,2026-04-18T08:51:53+00:00
TOI ETimes,96,Who is Venkatraman Ramakrishnan? The scientist who could not...,https://timesofindia.indiatimes.com/articleshow/130175981.cms,2026-04-18T08:51:53+00:00
TOI ETimes,97,"Meet Palmer Luckey: He built a $2 billion company at 19, got...",https://timesofindia.indiatimes.com/articleshow/129907090.cms,2026-04-18T08:51:53+00:00
TOI ETimes,98,"Happy Eid-ul-Fitr 2026: Eid Mubarak Wishes, Messages, Quotes...",https://timesofindia.indiatimes.com/articleshow/129680487.cms,2026-04-18T08:51:53+00:00
TOI ETimes,99,Meet Patrick Winston: MIT professor whose one-hour lecture s...,https://timesofindia.indiatimes.com/articleshow/129827810.cms,2026-04-18T08:51:53+00:00
TOI ETimes,100,"Woman sues ChatGPT, alleges AI helped ex-boyfriend stalk her despite red flags",https://timesofindia.indiatimes.com/articleshow/130291183.cms,2026-04-18T08:51:53+00:00
TOI ETimes,101,What are dark factories in China that work without any human intervention?,https://timesofindia.indiatimes.com/articleshow/130290333.cms,2026-04-18T08:51:53+00:00
TOI ETimes,102,Why do we have fingerprints? Study reveals unexpected reasons why this trait evolved,https://timesofindia.indiatimes.com/articleshow/130288560.cms,2026-04-18T08:51:53+00:00
TOI ETimes,103,"Who is Jeffrey Scruggs, the Obama lookalike Joe Biden hilariously called out at his Law school event?",https://timesofindia.indiatimes.com/articleshow/130285430.cms,2026-04-18T08:51:53+00:00
TOI ETimes,104,Meghan Markle and Prince Harry’s Australia visit sparks one big question: Who is paying?,https://timesofindia.indiatimes.com/articleshow/130282998.cms,2026-04-18T08:51:53+00:00
TOI ETimes,105,‘Becoming a US colony?’ Trump-themed autos in Delhi spark outrage ahead of America’s 250th Independence celebrations,https://timesofindia.indiatimes.com/articleshow/130283443.cms,2026-04-18T08:51:53+00:00
TOI ETimes,106,Aur inhe Kashmir chahiye’: Internet erupts over Pakistan’s 2-hour power cuts- know the exact outage timings and more,https://timesofindia.indiatimes.com/articleshow/130283027.cms,2026-04-18T08:51:53+00:00
TOI ETimes,107,"He spent ₹10,000 on a random raffle ticket - what did he win next? A $1 million Picasso",https://timesofindia.indiatimes.com/articleshow/130281710.cms,2026-04-18T08:51:53+00:00
TOI ETimes,108,"Who is Hungary's 'Dancing Minister' Zsolt Hegedus, going viral for his celebration over Viktor Orban's loss",https://timesofindia.indiatimes.com/articleshow/130281606.cms,2026-04-18T08:51:53+00:00
TOI ETimes,109,This ‘teacher-student-roti-cheeni’ viral video is the hope we did not know we were seeking,https://timesofindia.indiatimes.com/articleshow/130279662.cms,2026-04-18T08:51:53+00:00
TOI ETimes,110,Watch: Indian man allegedly harasses female hotel staff in Thailand; viral video sparks outrage,https://timesofindia.indiatimes.com/articleshow/130279749.cms,2026-04-18T08:51:53+00:00
TOI ETimes,111,"‘Is this your idea of protein?’ Author finds insect in Provilac milk bottle, founder responds, says…",https://timesofindia.indiatimes.com/articleshow/130272430.cms,2026-04-18T08:51:53+00:00
TOI ETimes,112,Cherry blossom dream shattered: Indian family reveals shocking ₹3 lakh/month cost of living in Tokyo,https://timesofindia.indiatimes.com/articleshow/130264487.cms,2026-04-18T08:51:53+00:00
TOI ETimes,113,What are aircraft boneyards and why do thousands of planes sit abandoned in deserts?,https://timesofindia.indiatimes.com/articleshow/130262681.cms,2026-04-18T08:51:53+00:00
TOI ETimes,114,"This one house is blocking the Delhi-Dehradun Expressway: What is Mandola’s ‘Swabhiman’, the home that refuses to move?",https://timesofindia.indiatimes.com/articleshow/130259687.cms,2026-04-18T08:51:53+00:00
TOI ETimes,115,Not feeling it today? 5 believable excuses to take a break from work,https://timesofindia.indiatimes.com/articleshow/130257176.cms,2026-04-18T08:51:53+00:00
TOI ETimes,116,Samay Raina didn’t deliver perfect comedy – he delivered perfect catharsis,https://timesofindia.indiatimes.com/articleshow/130256789.cms,2026-04-18T08:51:53+00:00
TOI ETimes,117,"Angry over low salary, employee sleeps for 5 hours at work to protest – what happened next shocked everyone",https://timesofindia.indiatimes.com/articleshow/130255636.cms,2026-04-18T08:51:53+00:00
TOI ETimes,118,Ice cream brand's ‘ballet shoes’ ad backfires - internet says 'this feels weird',https://timesofindia.indiatimes.com/articleshow/130255174.cms,2026-04-18T08:51:53+00:00
TOI ETimes,119,Saw a cockroach at home? Here’s what it means and how to get rid of them,https://timesofindia.indiatimes.com/articleshow/130254758.cms,2026-04-18T08:51:53+00:00
TOI ETimes,120,Russian YouTuber Vitaly apologises to Indian man after wrongly accusing him of being a child predator: ‘We are deeply sorry’,https://timesofindia.indiatimes.com/articleshow/130252898.cms,2026-04-18T08:51:53+00:00
TOI ETimes,121,"Happy Puthandu 2026: Best Tamil New Year Messages, Quotes, Wishes and Images to share on Puthu Varudam",https://timesofindia.indiatimes.com/articleshow/130244000.cms,2026-04-18T08:51:53+00:00
TOI ETimes,122,‘Yeh hi appraisal hai?’ HCL’s free metro move after Arijit Singh concert triggers online backlash,https://timesofindia.indiatimes.com/articleshow/130251713.cms,2026-04-18T08:51:53+00:00
TOI ETimes,123,Video: She tried living on ₹500 in Bengaluru for a day – what happened next surprised many,https://timesofindia.indiatimes.com/articleshow/130250878.cms,2026-04-18T08:51:53+00:00
TOI ETimes,124,What really happened during her 10-hour Mumbai layover? Pakistani traveller’s India video goes viral,https://timesofindia.indiatimes.com/articleshow/130250806.cms,2026-04-18T08:51:53+00:00
TOI ETimes,125,"Happy Rongali Bihu 2026: Best Messages, Quotes, Wishes and Images to share on Assamese New Year",https://timesofindia.indiatimes.com/articleshow/130243736.cms,2026-04-18T08:51:53+00:00
TOI ETimes,126,"Ambedkar Jayanti 2026: Images, Quotes, Wishes, Messages, Cards, Greetings, and GIFs",https://timesofindia.indiatimes.com/articleshow/130242222.cms,2026-04-18T08:51:53+00:00
TOI ETimes,127,"Happy Vishu 2026: 30+ Wishes, Greeting Cards, Messages, GIFs, WhatsApp & Facebook Status And Images To Share",https://timesofindia.indiatimes.com/articleshow/130236318.cms,2026-04-18T08:51:53+00:00
TOI ETimes,128,"Hyderabad shocker: Drunk BMW driver uses gadget to switch number plate in seconds, lands in police custody",https://timesofindia.indiatimes.com/articleshow/130243920.cms,2026-04-18T08:51:53+00:00
TOI ETimes,129,From silver rice to pampered chickens: 5 most royal yet peculiar cuisine practices of Emperor Akbar,https://timesofindia.indiatimes.com/articleshow/130243768.cms,2026-04-18T08:51:53+00:00
TOI ETimes,130,Beauty Queen to Army Officer: The inspiring journey of Lt. Kashish Methwani will give you goosebumps,https://timesofindia.indiatimes.com/articleshow/130242847.cms,2026-04-18T08:51:53+00:00
TOI ETimes,131,Viral: Hyderabad wedding cook reveals 4 secret ingredients behind perfect biryani,https://timesofindia.indiatimes.com/articleshow/130242045.cms,2026-04-18T08:51:53+00:00
TOI ETimes,132,"Meet Zeeshan Bakhrani: Fired twice, now making ₹1.3 crore a month from his Manhattan food venture",https://timesofindia.indiatimes.com/articleshow/130240704.cms,2026-04-18T08:51:53+00:00
TOI ETimes,133,"2-year-old starved to death, ate drywall and diapers in horror home; parents arrested",https://timesofindia.indiatimes.com/articleshow/130236870.cms,2026-04-18T08:51:53+00:00
TOI ETimes,134,‘Training their own replacements’: Indians filming AI training videos spark backlash online,https://timesofindia.indiatimes.com/articleshow/130235359.cms,2026-04-18T08:51:53+00:00
TOI ETimes,135,"Inside Jeff Bezos and Lauren Sanchez’s daily routine: No phones, sunrise coffee, and a ‘Billionaire Bunker’",https://timesofindia.indiatimes.com/articleshow/130235132.cms,2026-04-18T08:51:53+00:00
TOI ETimes,136,"Happy Baisakhi 2026: Best Messages, Quotes, Wishes and Images to share on Baisakhi",https://timesofindia.indiatimes.com/articleshow/130209908.cms,2026-04-18T08:51:53+00:00
TOI ETimes,137,What is ‘Katychella 2027’? Katy Perry’s viral comment on Justin Bieber at Coachella explained,https://timesofindia.indiatimes.com/articleshow/130233387.cms,2026-04-18T08:51:53+00:00
TOI ETimes,138,From sleeping on streets to giving shelter to others: NYC restaurant owner builds refuge for the homeless,https://timesofindia.indiatimes.com/articleshow/130232214.cms,2026-04-18T08:51:53+00:00
TOI ETimes,139,Ankur Warikoo’s post on ageing parents is hitting everyone right in the heart - here's why!,https://timesofindia.indiatimes.com/articleshow/130231910.cms,2026-04-18T08:51:53+00:00
TOI ETimes,140,Who is Richard Maza? YouTuber arrested after pepper spray clash; lawsuit crosses $1 million,https://timesofindia.indiatimes.com/articleshow/130231139.cms,2026-04-18T08:51:53+00:00
TOI ETimes,141,What is Bixonimania? How AI treated a fake illness as a real medical condition,https://timesofindia.indiatimes.com/articleshow/130230032.cms,2026-04-18T08:51:53+00:00
TOI ETimes,142,'This is evil': AI tool charging $2 per minute to talk with Jesus faces massive backlash online,https://timesofindia.indiatimes.com/articleshow/130226073.cms,2026-04-18T08:51:53+00:00
TOI ETimes,143,‘Priorities clear’: Hilarious KKR vs LSG clip shows husband glued to match as wife walks away mid-argument,https://timesofindia.indiatimes.com/articleshow/130225505.cms,2026-04-18T08:51:53+00:00
TOI ETimes,144,Foreign woman rates Indian cities; Delhi’s shocking score doesn’t surprise many,https://timesofindia.indiatimes.com/articleshow/130224421.cms,2026-04-18T08:51:53+00:00
TOI ETimes,145,Meet Mike Egan: Marine veteran who lost his legs in a blast completes 110 miles outlasting 117 athletes in a brutal 27-hour race,https://timesofindia.indiatimes.com/articleshow/130220469.cms,2026-04-18T08:51:53+00:00
TOI ETimes,146,"Famous 'tape guy' who secretly recorded 10,000 live concerts is now putting them online for free",https://timesofindia.indiatimes.com/articleshow/130219497.cms,2026-04-18T08:51:53+00:00
TOI ETimes,147,"Happy Baisakhi 2026: Top 100 Wishes, Messages and Quotes to share with your loved ones",https://timesofindia.indiatimes.com/articleshow/130208136.cms,2026-04-18T08:51:53+00:00
TOI ETimes,148,5 viral home remedies to kill termites (deemak) without harsh chemicals,https://timesofindia.indiatimes.com/articleshow/130207052.cms,2026-04-18T08:51:53+00:00
TOI ETimes,149,‘Is it anyone’s job to check for sharks?’ NASA responds after Artemis II splashdown,https://timesofindia.indiatimes.com/articleshow/130207133.cms,2026-04-18T08:51:53+00:00
TOI ETimes,150,'I alone eat 150-200 mangoes': Indians react as internet fumes over India eating 50% of global mango supply,https://timesofindia.indiatimes.com/articleshow/130206271.cms,2026-04-18T08:51:53+00:00
TOI ETimes,151,"No AC, no problem: These 5 easy home hacks actually work",https://timesofindia.indiatimes.com/articleshow/130205555.cms,2026-04-18T08:51:53+00:00
TOI ETimes,152,When Tom Cruise fell for Asha Bhosle’s Chicken Tikka Masala: A story that says all about her love for food,https://timesofindia.indiatimes.com/articleshow/130205671.cms,2026-04-18T08:51:53+00:00
TOI ETimes,153,‘It breaks my heart every time’: Bengaluru dad torn between job and 1-year-old son,https://timesofindia.indiatimes.com/articleshow/130204512.cms,2026-04-18T08:51:53+00:00
TOI ETimes,154,'Very isolating': Elon Musk's estranged trans daughter Vivian Wilson opens up about painful childhood with billionaire dad,https://timesofindia.indiatimes.com/articleshow/130204255.cms,2026-04-18T08:51:53+00:00
TOI ETimes,155,Happy Baisakhi 2026: Significance of Baisakhi for Sikhs,https://timesofindia.indiatimes.com/articleshow/130203814.cms,2026-04-18T08:51:53+00:00
TOI ETimes,156,‘This is dangerous’: Internet reacts to toddler’s balcony jump video,https://timesofindia.indiatimes.com/articleshow/130202672.cms,2026-04-18T08:51:53+00:00
TOI ETimes,157,Arriving on a horse for your baraat? Shantanu Naidu's viral video raises questions about animal cruelty in Indian weddings,https://timesofindia.indiatimes.com/articleshow/130189433.cms,2026-04-18T08:51:53+00:00
TOI ETimes,158,"Which Raja Ravi Varma painting is now India’s most expensive ever, and why can’t it leave the country?",https://timesofindia.indiatimes.com/articleshow/130188686.cms,2026-04-18T08:51:53+00:00
TOI ETimes,159,Leo Tolstoy Quote,https://timesofindia.indiatimes.com/articleshow/130304354.cms,2026-04-18T08:51:53+00:00
TOI ETimes,160,Bhoot Bangla Review,https://timesofindia.indiatimes.com/articleshow/130309647.cms,2026-04-18T08:51:53+00:00
TOI ETimes,161,Mr X Box Office Collection,https://timesofindia.indiatimes.com/articleshow/130345466.cms,2026-04-18T08:51:53+00:00
TOI ETimes,162,Dacoit Box Office Collection,https://timesofindia.indiatimes.com/articleshow/130345377.cms,2026-04-18T08:51:53+00:00
TOI ETimes,163,Hazaribag man drowns while fishing in lake,https://timesofindia.indiatimes.com/articleshow/130060093.cms,2026-04-18T08:51:53+00:00
TOI ETimes,164,"""Behen Darr Gayi!"": Fans relive ‘Bhagam Bhag’ era after watching Akshay Kumar's 'Bhooth Bangla' trailer",https://timesofindia.indiatimes.com/articleshow/130060027.cms,2026-04-18T08:51:53+00:00
TOI ETimes,165,MBOSE HSLC result 2026 to release tomorrow: Check details here,https://timesofindia.indiatimes.com/articleshow/130059814.cms,2026-04-18T08:51:53+00:00
TOI ETimes,166,"Iran war risk: JPMorgan CEO Jamie Dimon warns of oil shocks, sticky inflation and higher interest rates",https://timesofindia.indiatimes.com/articleshow/130059993.cms,2026-04-18T08:51:53+00:00
TOI ETimes,167,Make your clutch last longer with these easy driving tips,https://timesofindia.indiatimes.com/articleshow/130052232.cms,2026-04-18T08:51:53+00:00
TOI ETimes,168,“Three-against-one situation”: El Rubius opens up on being “targeted” in MrBeast’s viral $1M challenge,https://timesofindia.indiatimes.com/articleshow/130054402.cms,2026-04-18T08:51:53+00:00
TOI ETimes,169,Bihar BTSC lab assistant notification released for 1091 posts at btsc.bihar.gov.in; apply here,https://timesofindia.indiatimes.com/articleshow/130059322.cms,2026-04-18T08:51:53+00:00
TOI ETimes,170,IPL craze costs techie Rs 1.46 lakh in fake RCB vs CSK ticket scam,https://timesofindia.indiatimes.com/articleshow/130059549.cms,2026-04-18T08:51:53+00:00
TOI ETimes,171,Raising “robot-proof” kids: Why creativity and curiosity matter more than ever,https://timesofindia.indiatimes.com/articleshow/130057342.cms,2026-04-18T08:51:53+00:00
TOI ETimes,172,Inside ‘Satguru Sharan’: Exploring Saif Ali Khan and Kareena Kapoor Khan’s Rs 100 crore Bandra home,https://timesofindia.indiatimes.com/articleshow/130059584.cms,2026-04-18T08:51:53+00:00
TOI ETimes,173,How selling Alaska in 1867 was a costly mistake for Russia,https://timesofindia.indiatimes.com/articleshow/130057081.cms,2026-04-18T08:51:53+00:00
TOI ETimes,174,'Hera Pheri 3 is coming': Paresh Rawal dismisses delay reports and reveals he will 'start shooting soon',https://timesofindia.indiatimes.com/articleshow/130059421.cms,2026-04-18T08:51:53+00:00
TOI ETimes,175,"US-Iran War: A daring rescue Hollywood blockbuster is on its way. Till then, pick your favourite from these 10 films on bringing someone home against all odds",https://timesofindia.indiatimes.com/articleshow/130059208.cms,2026-04-18T08:51:53+00:00
TOI ETimes,176,"Kolkata team unveils fan mural at Rash Behari Avenue, celebrating city’s first love",https://timesofindia.indiatimes.com/articleshow/130059554.cms,2026-04-18T08:51:53+00:00
TOI ETimes,177,How US spread a lie to rescue a pilot of a jet shot down in Iran,https://timesofindia.indiatimes.com/articleshow/130058641.cms,2026-04-18T08:51:53+00:00
TOI ETimes,178,"Netflix unveils ‘VOID’, an AI model that can change a movie plot",https://timesofindia.indiatimes.com/articleshow/130058880.cms,2026-04-18T08:51:53+00:00
TOI ETimes,179,"AI data centers are causing 'stress' not just to tech companies, but also private insurers",https://timesofindia.indiatimes.com/articleshow/130058967.cms,2026-04-18T08:51:53+00:00
TOI ETimes,180,"""Trans women are....."": Clavicular’s viral moment with trans women sparks fresh conversation on internet culture",https://timesofindia.indiatimes.com/articleshow/130053479.cms,2026-04-18T08:51:53+00:00
TOI Viral News,1,"Watch: Hardeep Singh Puri reunites with old friend from Delhi University, video melts hearts",https://timesofindia.indiatimes.com/articleshow/108418522.cms,2026-04-18T08:51:53+00:00
TOI Viral News,2,Narayana Murthy and daughter Akshata enjoy 'Corner House' ice cream in Bengaluru,https://timesofindia.indiatimes.com/articleshow/107659138.cms,2026-04-18T08:51:53+00:00
TOI Viral News,3,Taylor Swift cheers boyfriend Travis Kelce at the Super Bowl,https://timesofindia.indiatimes.com/articleshow/107613344.cms,2026-04-18T08:51:53+00:00
TOI Viral News,4,'He Nitished me' to 'Paltu Chacha': Nitish Kumar's 'swing politics' sparks humour fest,https://timesofindia.indiatimes.com/articleshow/107236114.cms,2026-04-18T08:51:53+00:00
TOI Viral News,5,"Flyer hits IndiGo Pilot announcing flight delay due to dense fog conditions, video goes viral",https://timesofindia.indiatimes.com/articleshow/106851189.cms,2026-04-18T08:51:53+00:00
TOI Viral News,6,"New Zealand's youngest MP performs native 'war cry' in Parliament, video goes viral",https://timesofindia.indiatimes.com/articleshow/106572179.cms,2026-04-18T08:51:53+00:00
TOI Viral News,7,"NASA unveils stunning image of 'evil eye' galaxy, sparking internet awe",https://timesofindia.indiatimes.com/articleshow/105570940.cms,2026-04-18T08:51:53+00:00
TOI Viral News,8,Millennials bemoan lackluster Black Friday deals in social media uproar,https://timesofindia.indiatimes.com/articleshow/105475777.cms,2026-04-18T08:51:53+00:00
TOI Viral News,9,'At least they'll not lose to India in semis': Memes erupt with Pakistan all but out of World Cup,https://timesofindia.indiatimes.com/articleshow/105122539.cms,2026-04-18T08:51:53+00:00
TOI Viral News,10,Brazilian influencer Vanessa Mancini dies at 41 from massive heart attack,https://timesofindia.indiatimes.com/articleshow/105110853.cms,2026-04-18T08:51:53+00:00
TOI Viral News,11,Memes erupt as Angelo Mathews becomes first international cricketer to be timed out,https://timesofindia.indiatimes.com/articleshow/105016656.cms,2026-04-18T08:51:53+00:00
TOI Viral News,12,Mia Khalifa posts Amy Schumer's heated exchange with Asia Jackson over Israel-Palestine conflict,https://timesofindia.indiatimes.com/articleshow/104947696.cms,2026-04-18T08:51:53+00:00
TOI Viral News,13,Fans troll Pakistan as Proteas beat Kiwis to keep Pak's semi-final hopes alive,https://timesofindia.indiatimes.com/articleshow/104912338.cms,2026-04-18T08:51:53+00:00
TOI Viral News,14,Mark Zuckerberg and family's Halloween transformation into Hogwarts icons warms hearts,https://timesofindia.indiatimes.com/articleshow/104888586.cms,2026-04-18T08:51:53+00:00
TOI Viral News,15,'Bore hone ka chance-ich nahi' as auto driver sings & entertains people stuck in Andheri traffic,https://timesofindia.indiatimes.com/articleshow/104886091.cms,2026-04-18T08:51:53+00:00
TOI Viral News,16,Escaped monkey 'Momo' captured after it drinks beer and runs riot in Indianapolis,https://timesofindia.indiatimes.com/articleshow/104208644.cms,2026-04-18T08:51:53+00:00
TOI Viral News,17,"Animal smuggling: Otter, rat and 28 turtles cause chaos on Bangkok to Taipei flight",https://timesofindia.indiatimes.com/articleshow/104208771.cms,2026-04-18T08:51:53+00:00
TOI Viral News,18,Alligator ally oops! Phillies fan denied entry with emotional support gator,https://timesofindia.indiatimes.com/articleshow/104043227.cms,2026-04-18T08:51:53+00:00
TOI Viral News,19,'Qualified for Karachi station': Pakistan's exit from Asia Cup sparks memefest,https://timesofindia.indiatimes.com/articleshow/103687163.cms,2026-04-18T08:51:53+00:00
TOI Viral News,20,"'Racist bigots': Arabic restaurant in US refuses to serve cops in uniform, faces fury",https://timesofindia.indiatimes.com/articleshow/103285144.cms,2026-04-18T08:51:53+00:00
TOI Viral News,21,Watch: Pakistani wedding in UK descends into mass brawl as guests hurl chairs at each other,https://timesofindia.indiatimes.com/articleshow/103245258.cms,2026-04-18T08:51:53+00:00
TOI Viral News,22,Memes abuzz as Neeraj Chopra makes history with first gold for India in World Championship,https://timesofindia.indiatimes.com/articleshow/103138499.cms,2026-04-18T08:51:53+00:00
TOI Viral News,23,Boyfriend held in murder of Instagram influencer Beauty Couch in Georgia,https://timesofindia.indiatimes.com/articleshow/103125550.cms,2026-04-18T08:51:53+00:00
TOI Viral News,24,Why internet is suddenly talking about Donald Trump’s weight,https://timesofindia.indiatimes.com/articleshow/103058329.cms,2026-04-18T08:51:53+00:00
TOI Viral News,25,'Don is back': Trump's mug shot triggers memefest,https://timesofindia.indiatimes.com/articleshow/103047943.cms,2026-04-18T08:51:53+00:00
TOI Viral News,26,"Hurricane Hilary unleashes fury on Southern California, visuals viral",https://timesofindia.indiatimes.com/articleshow/102906246.cms,2026-04-18T08:51:53+00:00
TOI Viral News,27,'Shameless': Prakash Raj blasted by netizens for mocking India's moon mission,https://timesofindia.indiatimes.com/articleshow/102902284.cms,2026-04-18T08:51:53+00:00
TOI Viral News,28,'Me during WFH': Photo of Selena Gomez wrapped in 'shawl' stirs memefest,https://timesofindia.indiatimes.com/articleshow/102799584.cms,2026-04-18T08:51:53+00:00
TOI Viral News,29,'Mission impossible': Memes erupt as people find it hard to return to office after long weekend,https://timesofindia.indiatimes.com/articleshow/102768800.cms,2026-04-18T08:51:53+00:00
TOI Viral News,30,‘Paisa hi paisa hoga’: Memes erupt as Indian creators receive massive payout from Twitter,https://timesofindia.indiatimes.com/articleshow/102576219.cms,2026-04-18T08:51:53+00:00
TOI Viral News,31,TCS Nashik office employees told to work from home,https://timesofindia.indiatimes.com/articleshow/130298285.cms,2026-04-18T08:51:53+00:00
TOI Viral News,32,‘Not a major scandal’: Uncle of accused in TCS Nashik case says ‘scripted conspiracy by Bajrang Dal’,https://timesofindia.indiatimes.com/articleshow/130321976.cms,2026-04-18T08:51:53+00:00
TOI Viral News,33,"TCS Nashik scandal: FIRs map chilling 4-year pattern of sex abuse, coercion and religious targeting",https://timesofindia.indiatimes.com/articleshow/130273789.cms,2026-04-18T08:51:53+00:00
TOI Viral News,34,"‘Rented room, 100 videos’: How Maharashtra teen 'lured, abused minors'; chilling details emerge",https://timesofindia.indiatimes.com/articleshow/130295799.cms,2026-04-18T08:51:53+00:00
