source,rank,headline,link,collected_at_iso
Indian Express,1,Trending in India,https://indianexpress.com/section/trending/trending-in-india/,2026-04-29T02:52:55+00:00
Indian Express,2,This is Serious,https://indianexpress.com/section/trending/this-is-serious/,2026-04-29T02:52:55+00:00
Indian Express,3,Top 10 wealthiest countries by GDP per capita in 2026,https://indianexpress.com/article/trending/top-10-listing/top-10-wealthiest-countries-by-gdp-per-capita-in-2026-india-rank-10660644/,2026-04-29T02:52:55+00:00
Indian Express,4,Indian baraat New York Fifth Avenue,https://indianexpress.com/article/trending/trending-in-india/indian-baraat-bride-groom-shut-down-5th-avenue-new-york-viral-video-10660610/,2026-04-29T02:52:55+00:00
Indian Express,5,baby born on Delta flight,https://indianexpress.com/article/trending/trending-globally/baby-born-delta-flight-oregon-mid-air-delivery-paramedics-shoelace-10660299/,2026-04-29T02:52:55+00:00
Indian Express,6,Virat Kohli viral video IPL 2026,https://indianexpress.com/article/trending/trending-in-india/virat-kohli-little-fan-crying-viral-video-dc-vs-rcb-ipl-2026-10660026/,2026-04-29T02:52:55+00:00
Indian Express,7,Ashneer Grover reacts to Sridhar Vembu's X post,https://indianexpress.com/article/trending/trending-in-india/ashneer-grover-sridhar-vembu-us-nris-to-return-post-10659917/,2026-04-29T02:52:55+00:00
Indian Express,8,PM Modi football Gangtok,https://indianexpress.com/article/trending/trending-in-india/pm-modi-gangtok-football-viral-video-sikkim-statehood-day-olympics-10659795/,2026-04-29T02:52:55+00:00
Indian Express,9,Rihanna cowhide dior bag,https://indianexpress.com/article/trending/trending-in-india/rihanna-mumbai-visit-feeds-cow-dior-cowhide-bag-antilia-ambani-event-10659651/,2026-04-29T02:52:55+00:00
Indian Express,10,The now-viral video shows a casually dressed presenter reading Bouman’s introduction from a phone,https://indianexpress.com/article/trending/trending-globally/google-scientist-on-unprofessional-keynote-intro-of-black-hole-researcher-katie-bouman-10659491/,2026-04-29T02:52:55+00:00
Indian Express,11,Mahabalipuram beach littering,https://indianexpress.com/article/trending/trending-in-india/foreign-tourist-slams-indians-over-littering-in-public-spaces-10658584/,2026-04-29T02:52:55+00:00
Indian Express,12,"Prachi Nigam, Class 10 UP board topper who got trolled for facial hair, scores 91.2 per cent in Class 12",https://indianexpress.com/article/trending/trending-in-india/prachi-nigam-up-board-class-12-result-facial-hair-10658197/,2026-04-29T02:52:55+00:00
Indian Express,13,"The video claimed that while Trump projects strength publicly, he is not taken seriously behind the scenes and is often ridiculed",https://indianexpress.com/article/trending/trending-globally/iran-mocks-trump-with-lego-style-diss-track-after-white-house-dinner-scare-10658163/,2026-04-29T02:52:55+00:00
Indian Express,14,"When his first daughter was born, he took only two days off before returning to work",https://indianexpress.com/article/trending/trending-globally/ceo-ron-schneidermann-regrets-choosing-startup-grind-over-his-daughters-birth-10657647/,2026-04-29T02:52:55+00:00
Indian Express,15,The rescue operation reportedly took nearly two hours,https://indianexpress.com/article/trending/trending-in-india/rajasthan-man-stuck-milk-can-rescue-viral-video-10656959/,2026-04-29T02:52:55+00:00
Indian Express,16,Rihanna learns Bharatnatyam,https://indianexpress.com/article/trending/trending-in-india/rihanna-bharatanatyam-mudras-tamil-nadu-influencer-fenty-beauty-10656941/,2026-04-29T02:52:55+00:00
Indian Express,17,The accident unfolded on the Steel Max bungee-style attraction at the Seville Fair,https://indianexpress.com/article/trending/trending-globally/slingshot-ride-cable-snaps-at-spain-fair-sends-capsule-free-falling-10656484/,2026-04-29T02:52:55+00:00
Indian Express,18,"The US millionaire had amassed several hunting trophies over decades, including elephants and lions",https://indianexpress.com/article/trending/trending-globally/us-millionaire-dies-after-elephant-attack-during-hunt-in-gabon-rainforest-10656471/,2026-04-29T02:52:55+00:00
Indian Express,19,US man moves to Bengaluru,https://indianexpress.com/article/trending/trending-in-india/american-youtuber-move-to-bengaluru-goes-viral-for-busting-myths-about-india-10655753/,2026-04-29T02:52:55+00:00
Indian Express,20,Raj Shamani podcast python viral video,https://indianexpress.com/article/trending/trending-in-india/raj-shamani-figuring-out-podcast-500-episode-paul-rosolie-burmese-python-viral-video-10655710/,2026-04-29T02:52:55+00:00
Indian Express,21,Raghav Chadha Instagram followers,https://indianexpress.com/article/trending/trending-in-india/raghav-chadha-bjp-switch-instagram-followers-drop-gen-z-backlash-10655614/,2026-04-29T02:52:55+00:00
Indian Express,22,British traveller India viral video,https://indianexpress.com/article/trending/trending-in-india/british-traveler-duncan-evans-viral-video-indian-hospitality-buttermilk-10655242/,2026-04-29T02:52:55+00:00
Indian Express,23,Guatemala volcano eruption,https://indianexpress.com/article/trending/trending-globally/guatemala-volcano-eruption-santiaguito-hikers-flee-viral-video-10655034/,2026-04-29T02:52:55+00:00
Indian Express,24,Sachin Tendulkar birthday Arjun Tendulkar,https://indianexpress.com/article/trending/trending-in-india/sachin-tendulkars-53rd-birthday-arjun-tendulkar-wishes-father-but-skips-cake-in-viral-video-10654025/,2026-04-29T02:52:55+00:00
Indian Express,25,Kerala boy stuck in cooking pot,https://indianexpress.com/article/trending/trending-in-india/kerala-malappuram-four-year-old-boy-trapped-cooking-pot-fire-force-rescue-10653930/,2026-04-29T02:52:55+00:00
Indian Express,26,Florida parking lot crash Lamborghini,https://indianexpress.com/article/trending/trending-globally/chevrolet-truck-drives-over-lamborghini-huracan-florida-parking-lot-viral-video-10653768/,2026-04-29T02:52:55+00:00
Indian Express,27,Dhurandhar 2 AI ending,https://indianexpress.com/article/trending/trending-in-india/dhurandhar-2-alternate-ending-viral-ai-video-ranveer-singh-hamza-yalina-reunite-10653458/,2026-04-29T02:52:55+00:00
LiveMint,1,Kirsten Storms faces restraining order filed by ex-husband Brandon Barash,https://www.livemint.com/us/trending/kirsten-storms-faces-emergency-restraining-order-as-ex-husband-brandon-barash-raises-alarming-claims-in-court-11777405092046.html,2026-04-29T02:52:55+00:00
LiveMint,2,"Over 20 years later, ‘Friends’ brings in $20 Million a year: Lisa Kudrow reveals",https://www.livemint.com/us/trending/over-20-years-later-friends-brings-in-20-million-a-year-lisa-kudrow-shares-insights-11777400523739.html,2026-04-29T02:52:55+00:00
LiveMint,3,Kimmel responds to Trump’s firing demand with sharp message to Melania,https://www.livemint.com/us/trending/jimmy-kimmel-hits-back-after-expectant-widow-joke-tells-melania-to-address-trump-s-hateful-and-violent-rhetoric-11777382628899.html,2026-04-29T02:52:55+00:00
LiveMint,4,"Trump brings up White House shooting, Putin war in Charles meet — Lip reader",https://www.livemint.com/us/trending/trump-mentions-white-house-dinner-shooting-says-putin-wants-war-during-king-charles-visit-to-white-house-lip-reader-11777380974134.html,2026-04-29T02:52:55+00:00
LiveMint,5,"Harry Styles-Zoë Kravitz Ring: A Look at the Rumoured $350,000 Sparkler",https://www.livemint.com/us/trending/harry-styles-zo-kravitz-engagement-ring-a-closer-look-at-the-rumoured-350-000-sparkler-11777318122710.html,2026-04-29T02:52:55+00:00
LiveMint,6,Chelsea 1-0 Leeds: Enzo Fernandez header sends Blues to 2026 FA Cup final,https://www.livemint.com/us/trending/chelsea-1-0-leeds-enzo-fernandez-header-sends-blues-to-2026-fa-cup-final-manchester-city-11777230733431.html,2026-04-29T02:52:55+00:00
LiveMint,7,Deion Sanders shows strong support for Diego Pavia after 2026 NFL draft snub,https://www.livemint.com/us/trending/deion-sanders-diego-pavia-undrafted-2026-nfl-draft-snub-11777213593804.html,2026-04-29T02:52:55+00:00
LiveMint,8,Luxury vs struggle: Former Iranian diplomat’s son exposes harsh reality gap,https://www.livemint.com/us/trending/private-jets-parties-scantily-clad-women-former-iranian-diplomat-s-son-exposes-countrys-deep-inequality-11777220729337.html,2026-04-29T02:52:55+00:00
LiveMint,9,Lawrence Taylor medical emergency: Giants legend hospitalized in New Jersey,https://www.livemint.com/us/trending/lawrence-taylor-medical-emergency-new-york-giants-legend-hospitalized-in-new-jersey-nfl-11777058394793.html,2026-04-29T02:52:55+00:00
LiveMint,10,Carlos Alcaraz withdraws from Roland Garros 2026; check details,https://www.livemint.com/us/trending/carlos-alcaraz-withdraws-roland-garros-2026-french-open-defending-champion-misses-title-defense-wrist-injury-tennis-11777049401197.html,2026-04-29T02:52:55+00:00
LiveMint,11,Fact you may not know: This war lasted shorter than your commute to office,https://www.livemint.com/us/trending/fact-you-probably-dont-know-this-battle-between-two-countries-lasted-shorter-than-your-commute-to-office-11777041884176.html,2026-04-29T02:52:55+00:00
LiveMint,12,David Wilcock harassed by 'cyber-stalkers'? Corey Goode drops shocking claims,https://www.livemint.com/us/trending/ufo-expert-david-wilcock-harassed-by-cyber-stalkers-corey-goode-drops-shocking-claims-after-his-death-11776888810059.html,2026-04-29T02:52:55+00:00
LiveMint,13,"David Wilcock death: Friend shares final moments, reveals he was ‘misunderstood'",https://www.livemint.com/us/trending/david-wilcock-death-best-friend-shares-final-moments-reveals-he-was-excited-about-the-future-11776886359815.html,2026-04-29T02:52:55+00:00
LiveMint,14,Padres sign Lucas Giolito: Veteran pitcher joins San Diego rotation,https://www.livemint.com/us/trending/padres-sign-lucas-giolito-to-one-year-deal-veteran-pitcher-joins-san-diego-rotation-amid-injury-woes-mlb-baseball-11776879659418.html,2026-04-29T02:52:55+00:00
LiveMint,15,FIFA World Cup tickets: Last-minute sales reopen just 50 days before kick-off,https://www.livemint.com/us/trending/fifa-world-cup-tickets-last-minute-sales-reopen-for-all-104-matches-just-50-days-before-kick-off-football-2026-11776873249712.html,2026-04-29T02:52:55+00:00
LiveMint,16,Jude Bellingham reveals why he bought stake in The Hundred's Birmingham Phoenix,https://www.livemint.com/us/trending/jude-bellingham-birmingham-phoenix-the-hundred-investment-reason-cricket-real-madrid-11776867634181.html,2026-04-29T02:52:55+00:00
LiveMint,17,"Fans use blowtorches, hammers on Drake’s ice installation teasing new album",https://www.livemint.com/us/trending/watch-fans-climb-hammer-ice-block-in-toronto-as-drake-teases-iceman-album-release-11776797196268.html,2026-04-29T02:52:55+00:00
LiveMint,18,Jude Bellingham buys stake in Birmingham Phoenix; check details,https://www.livemint.com/us/trending/jude-bellingham-buys-stake-in-birmingham-phoenix-real-madrid-star-invests-in-the-hundred-cricket-franchise-11776795110823.html,2026-04-29T02:52:55+00:00
LiveMint,19,Dunkin' is giving away 1 million free coffees today — Here’s how to claim yours,https://www.livemint.com/us/trending/dunkin-is-giving-away-1-million-free-coffees-today-here-s-how-to-claim-yours-11776780641113.html,2026-04-29T02:52:55+00:00
LiveMint,20,Mark to Market,https://www.livemint.com/market/mark-to-market,2026-04-29T02:52:55+00:00
LiveMint,21,Options data hint at limited upside after sharp recovery this month,https://www.livemint.com/market/stock-market-news/nifty-derivatives-expiry-options-iran-war-crude-oil-prices-opec-fpi-flows-dii-buying-market-volatility-trading-11777404172823.html,2026-04-29T02:52:55+00:00
LiveMint,22,Q4 results 2026: Bajaj Finance to Vedanta among companies to declare Q4 results today; check full list here,https://www.livemint.com/market/stock-market-news/q4-results-2026-bajaj-finance-to-vedanta-among-companies-to-declare-q4-results-today-check-full-list-here-11777427504679.html,2026-04-29T02:52:55+00:00
LiveMint,23,"Buy or sell: Gift Nifty signals flat opening, Vaishali Parekh recommends three stocks to buy today — 29 April 2026",https://www.livemint.com/market/stock-market-news/buy-or-sell-29-april-2026-gift-nifty-signals-flat-opening-vaishali-parekh-recommends-three-stocks-to-buy-today-11777426955089.html,2026-04-29T02:52:55+00:00
LiveMint,24,"Nifty 50, Sensex prediction today: Check how Indian stock market is expected to trade on 29 April",https://www.livemint.com/market/stock-market-news/nifty-50-sensex-prediction-today-check-how-indian-stock-market-is-expected-to-trade-on-29-april-11777427579280.html,2026-04-29T02:52:55+00:00
LiveMint,25,"Stocks to watch: Bajaj Finance, Eternal, BHEL among 10 shares in focus today",https://www.livemint.com/market/stock-market-news/stocks-to-watch-bajaj-finance-eternal-bhel-among-10-shares-in-focus-today-11777425155169.html,2026-04-29T02:52:55+00:00
LiveMint,26,"From Gift Nifty, US tech stocks to crude oil prices: 8 key things that changed for Indian stock market overnight",https://www.livemint.com/market/stock-market-news/from-gift-nifty-us-tech-stocks-to-crude-oil-prices-8-key-things-that-changed-for-indian-stock-market-overnight-11777426077504.html,2026-04-29T02:52:55+00:00
LiveMint,27,"LPG cylinder price on April 29: Here's how much domestic and commercial gas costs in Delhi, Bengaluru, Mumbai today",https://www.livemint.com/news/india/lpg-cylinder-price-on-april-29-heres-how-much-domestic-and-commercial-gas-costs-in-delhi-bengaluru-mumbai-today-11777429449289.html,2026-04-29T02:52:55+00:00
LiveMint,28,US-Iran War LIVE Updates: UAE exits OPEC as US-Iran negotiations stall,https://www.livemint.com/news/world/us-iran-war-live-latest-news-brent-crude-oil-gold-price-donald-trump-truth-social-uae-exits-opec-strait-of-hormuz-11777424527191.html,2026-04-29T02:52:55+00:00
LiveMint,29,‘Encounter specialist’ IPS Ajay Pal Sharma to be removed from Bengal poll duty? Plea filed in SC alleges ‘bias’,https://www.livemint.com/news/india/encounter-specialist-ips-ajay-pal-sharma-to-be-ousted-from-bengal-poll-duty-plea-filed-in-sc-alleges-bias-11777423237375.html,2026-04-29T02:52:55+00:00
LiveMint,30,Weather today: Delhi-NCR skies turn stormy as rain hits city; Bengal on IMD's orange alert on Phase 2 polling day,https://www.livemint.com/news/india/weather-today-delhi-ncr-skies-turn-stormy-as-rain-hits-city-bengal-on-imds-orange-alert-on-phase-2-polling-day-11777423187677.html,2026-04-29T02:52:55+00:00
LiveMint,31,Bankruptcy bottleneck: 380 resolution plans approved by lenders await NCLT nod,https://www.livemint.com/news/bankruptcy-380-debt-resolution-plans-awaiting-nclt-nod-11777369865409.html,2026-04-29T02:52:55+00:00
LiveMint,32,Ex-FBI chief James Comey indicted over Instagram post for threatening to kill Donald Trump — What does ‘86 47’ mean?,https://www.livemint.com/news/us-news/exfbi-chief-james-comey-indicted-over-instagram-post-for-threatening-to-kill-donald-trump-what-does-86-47-mean-11777419751685.html,2026-04-29T02:52:55+00:00
LiveMint,33,Infosys secures largest GCC deal,https://www.livemint.com/companies/news/infosys-secures-largest-gcc-deal-11777387530757.html,2026-04-29T02:52:55+00:00
LiveMint,34,"Neo Alternative announces first close of ₹5,000 crore second infra income fund, targets ₹1 trillion platform",https://www.livemint.com/companies/news/neo-announces-first-close-of-new-rs-5-000-crore-infra-fund-eyes-rs-1-trillion-practice-in-5-7-years-11777367352223.html,2026-04-29T02:52:55+00:00
LiveMint,35,AI on the shopfloor: India Inc's next frontier in the upskilling playbook,https://www.livemint.com/companies/news/ai-shopfloor-india-inc-next-frontier-upskilling-playbook-blue-collar-workers-python-genai-pokayoke-11777357636325.html,2026-04-29T02:52:55+00:00
LiveMint,36,Sahi raises $33 million at over 3x valuation,https://www.livemint.com/companies/broking-firm-sahi-s-valuation-jumps-over-3x-in-new-funding-from-accel-global-11777375673714.html,2026-04-29T02:52:55+00:00
LiveMint,37,Elon Musk vs Sam Altman Day 2: Tesla boss testifies he founded OpenAI as nonprofit to counter Google,https://www.livemint.com/companies/news/elon-musk-vs-sam-altman-day-2-tesla-boss-testifies-he-founded-openai-as-nonprofit-to-counter-google-11777420358620.html,2026-04-29T02:52:55+00:00
LiveMint,38,Oaktree Capital Accuses BJ’s of Reneging on Tariff Refund Trade,https://www.livemint.com/companies/oaktree-capital-accuses-bj-s-of-reneging-on-tariff-refund-trade-11777402142635.html,2026-04-29T02:52:55+00:00
LiveMint,39,Ask Mint Money,https://www.livemint.com/money/ask-mint-money,2026-04-29T02:52:55+00:00
LiveMint,40,Social Security payout: Billionaire Warren Buffett gets retirement payment too - How big his paycheck?,https://www.livemint.com/money/personal-finance/social-security-payout-billionaire-warren-buffett-gets-retirement-payment-too-how-big-his-paycheck-11777422941083.html,2026-04-29T02:52:55+00:00
LiveMint,41,Update PF KYC online through UAN portal: Step-by-step guide to prevent claim rejection,https://www.livemint.com/money/personal-finance/update-pf-kyc-online-through-uan-portal-step-by-step-guide-to-prevent-claim-rejection-11777381662388.html,2026-04-29T02:52:55+00:00
LiveMint,42,"NSC interest rate at 7.7% for April–June 2026: Key features, returns and rules explained",https://www.livemint.com/money/personal-finance/nsc-interest-rate-at-7-7-for-april-june-2026-key-features-returns-and-rules-explained-11777377295986.html,2026-04-29T02:52:55+00:00
LiveMint,43,"HDFC ERGO Optima Secure vs Optima Secure Plus 2026: Features, benefits, premium, coverage and infinite bonus compared",https://www.livemint.com/money/personal-finance/hdfc-ergo-optima-secure-vs-optima-secure-plus-2026-features-benefits-premium-coverage-infinite-bonus-11777371127901.html,2026-04-29T02:52:55+00:00
LiveMint,44,Should you track your mutual fund's cash levels?,https://www.livemint.com/money/personal-finance/should-you-track-your-mutual-funds-cash-levels-equity-funds-investors-11777367682545.html,2026-04-29T02:52:55+00:00
LiveMint,45,"Mumbai: ‘I asked ChatGPT to save ₹5,000 every month for my travel fund’; check personal finance advice from AI",https://www.livemint.com/money/personal-finance/mumbai-i-asked-chatgpt-to-save-5-000-every-month-for-my-travel-fund-check-personal-finance-advice-from-ai-11777366755052.html,2026-04-29T02:52:55+00:00
LiveMint,46,"iPhone Fold's first comparison video releases even before launch, reveals exact dimensions and an ultra-thin chassis",https://www.livemint.com/technology/gadgets/iphone-folds-first-comparison-video-releases-even-before-launch-reveals-exact-dimensions-and-an-ultra-thin-chassis-11777424564959.html,2026-04-29T02:52:55+00:00
LiveMint,47,Apple confirms iOS Weather App outage: Is it working now? What we know,https://www.livemint.com/technology/apple-confirms-ios-weather-app-down-is-it-working-now-what-we-know-11777418402011.html,2026-04-29T02:52:55+00:00
LiveMint,48,The Supreme Court seems likely to shut down a lawsuit by Falun Gong over Ciscos aid to China,https://www.livemint.com/technology/the-supreme-court-seems-likely-to-shut-down-a-lawsuit-by-falun-gong-over-ciscos-aid-to-china-11777396447503.html,2026-04-29T02:52:55+00:00
LiveMint,49,"MeitY flags VPN providers, intermediaries enabling access to blocked betting and prediction platforms: Check advisory",https://www.livemint.com/technology/meity-flags-vpn-providers-intermediaries-enabling-access-to-blocked-betting-prediction-platforms-polymarket-advisory-11777374360644.html,2026-04-29T02:52:55+00:00
LiveMint,50,"Flipkart 'Sasa Lele' sale dates announced: iPhone 17, Galaxy S25 deals and bank offers revealed",https://www.livemint.com/technology/tech-news/flipkart-sasa-lele-sale-dates-announced-iphone-17-galaxy-s25-deals-and-bank-offers-revealed-11777370362870.html,2026-04-29T02:52:55+00:00
LiveMint,51,MacBook prices slashed: These premium Apple laptops are affordable now,https://www.livemint.com/technology/gadgets/macbook-prices-slashed-these-premium-apple-laptops-are-affordable-now-11777369531013.html,2026-04-29T02:52:55+00:00
LiveMint,52,IPL 2026 Schedule,https://www.livemint.com/sports/cricket-news/ipl-schedule,2026-04-29T02:52:55+00:00
LiveMint,53,Orange Cap in IPL 2026,https://www.livemint.com/sports/cricket-news/ipl-orange-cap,2026-04-29T02:52:55+00:00
LiveMint,54,Purple Cap in IPL 2026,https://www.livemint.com/sports/cricket-news/ipl-purple-cap,2026-04-29T02:52:55+00:00
LiveMint,55,IPL 2026 Points Table,https://www.livemint.com/sports/cricket-news/ipl-points-table,2026-04-29T02:52:55+00:00
LiveMint,56,IFSC Code Finder,https://www.livemint.com/ifsc-code,2026-04-29T02:52:55+00:00
LiveMint,57,Income Tax Calculator,https://www.livemint.com/tools-calculators/income-tax-calculator,2026-04-29T02:52:55+00:00
LiveMint,58,Gold Rate Today,https://www.livemint.com/gold-prices,2026-04-29T02:52:55+00:00
LiveMint,59,Gold Rate in Delhi,https://www.livemint.com/gold-prices/delhi,2026-04-29T02:52:55+00:00
LiveMint,60,Gold Rate Hyderabad,https://www.livemint.com/gold-prices/hyderabad,2026-04-29T02:52:55+00:00
LiveMint,61,Silver Rate Today,https://www.livemint.com/silver-prices,2026-04-29T02:52:55+00:00
LiveMint,62,Silver Rate in Delhi,https://www.livemint.com/silver-prices/delhi,2026-04-29T02:52:55+00:00
LiveMint,63,Silver Rate in Bangalore,https://www.livemint.com/silver-prices/bangalore,2026-04-29T02:52:55+00:00
LiveMint,64,US Stock Market,https://www.livemint.com/market/us-market,2026-04-29T02:52:55+00:00
LiveMint,65,Terms of Use,https://www.livemint.com/terms-of-use,2026-04-29T02:52:55+00:00
LiveMint,66,Code of ethics,https://www.livemint.com/code-of-ethics,2026-04-29T02:52:55+00:00
LiveMint,67,Stock Market Today,https://www.livemint.com/market/stock-market-news/stock-market-sensex-nifty-50-live-updates-gift-nifty-20-april-2026-us-iran-war-crude-oil-prices-gold-rate-today-silver-11776651995951.html,2026-04-29T02:52:55+00:00
LiveMint,68,MCX Gold Rate,https://www.livemint.com/market/market-stats/commodity-mcx-gold-price,2026-04-29T02:52:55+00:00
LiveMint,69,MCX Silver Price,https://www.livemint.com/market/market-stats/commodity-mcx-silver-price,2026-04-29T02:52:55+00:00
LiveMint,70,Gold Price in Mumbai,https://www.livemint.com/gold-prices/mumbai,2026-04-29T02:52:55+00:00
LiveMint,71,Gold Price in Chennai,https://www.livemint.com/gold-prices/chennai,2026-04-29T02:52:55+00:00
LiveMint,72,Gold Price in Kolkata,https://www.livemint.com/gold-prices/kolkata,2026-04-29T02:52:55+00:00
LiveMint,73,Silver Price in Mumbai,https://www.livemint.com/silver-prices/mumbai,2026-04-29T02:52:55+00:00
LiveMint,74,Silver Price in Chennai,https://www.livemint.com/silver-prices/chennai,2026-04-29T02:52:55+00:00
LiveMint,75,Silver Price in Hyderabad,https://www.livemint.com/silver-prices/hyderabad,2026-04-29T02:52:55+00:00
LiveMint,76,Silver Price in Kolkata,https://www.livemint.com/silver-prices/kolkata,2026-04-29T02:52:55+00:00
LiveMint,77,Latest News Today,https://www.livemint.com/news,2026-04-29T02:52:55+00:00
LiveMint,78,US News Today,https://www.livemint.com/news/us-news,2026-04-29T02:52:55+00:00
LiveMint,79,Top Company Leader,https://www.livemint.com/companies/people,2026-04-29T02:52:55+00:00
LiveMint,80,personal loan emi calculator,https://www.livemint.com/loans/personal-loan-emi-calculator,2026-04-29T02:52:55+00:00
LiveMint,81,Personal Loan Interest Rate,https://www.livemint.com/loans/personal-loan-interest-rates,2026-04-29T02:52:55+00:00
LiveMint,82,Personal Loan Eligibility,https://www.livemint.com/loans/personal-loan-eligibility,2026-04-29T02:52:55+00:00
LiveMint,83,Instant Personal Loan,https://www.livemint.com/loans/instant-personal-loan,2026-04-29T02:52:55+00:00
LiveMint,84,Home Loan EMI Calculator,https://www.livemint.com/tools-calculators/home-loan-emi-calculator,2026-04-29T02:52:55+00:00
LiveMint,85,Car Loan EMI,https://www.livemint.com/tools-calculators/car-loan-calculator,2026-04-29T02:52:55+00:00
India Today,1,"Man shares how layoffs now lead to years-long struggle, internet collectively sighs",https://www.indiatoday.in/trending-news/story/man-shares-how-layoffs-now-lead-to-years-long-struggle-internet-collectively-sighs-2902841-2026-04-28,2026-04-29T02:52:55+00:00
India Today,2,"Mumbai woman accidentally leaves house unlocked, delivery man notices it. And then..",https://www.indiatoday.in/trending-news/story/mumbai-woman-accidentally-leaves-house-unlocked-delivery-man-notices-it-and-then-2902829-2026-04-28,2026-04-29T02:52:55+00:00
India Today,3,Street dog guards grave of Kerala woman who fed it daily. Video will break your heart,https://www.indiatoday.in/trending-news/story/street-dog-guards-grave-of-kerala-woman-who-fed-it-daily-video-will-break-your-heart-2902759-2026-04-28,2026-04-29T02:52:55+00:00
India Today,4,"Rapido driver struggles as phone crashes in extreme heat, video shows harsh reality",https://www.indiatoday.in/trending-news/story/rapido-driver-struggles-as-phone-crashes-in-extreme-heat-video-shows-harsh-reality-2902677-2026-04-28,2026-04-29T02:52:55+00:00
India Today,5,Shashi Tharoor found himself 'twinning with a handsome fellow'. Here's the video,https://www.indiatoday.in/trending-news/story/shashi-tharoor-found-himself-twinning-handsome-fellow-peacock-here-is-the-video-2902698-2026-04-28,2026-04-29T02:52:55+00:00
India Today,6,Hyderabad woman claims man engaged in obscene act in front of her during morning run,https://www.indiatoday.in/trending-news/story/hyderabad-woman-claims-man-engaged-in-obscene-act-in-front-of-her-during-morning-run-2902634-2026-04-28,2026-04-29T02:52:55+00:00
India Today,7,Bengaluru auto driver makes passenger clean up their mess before leaving. Watch,https://www.indiatoday.in/trending-news/story/bengaluru-auto-driver-makes-passenger-clean-up-their-mess-before-leaving-watch-2902591-2026-04-28,2026-04-29T02:52:55+00:00
