source,rank,headline,link,collected_at_iso
LiveMint,80,Gold Rate in Delhi,https://www.livemint.com/gold-prices/delhi,2026-04-12T02:36:03+00:00
LiveMint,81,Gold Rate Hyderabad,https://www.livemint.com/gold-prices/hyderabad,2026-04-12T02:36:03+00:00
LiveMint,82,Silver Rate Today,https://www.livemint.com/silver-prices,2026-04-12T02:36:03+00:00
LiveMint,83,Silver Rate in Delhi,https://www.livemint.com/silver-prices/delhi,2026-04-12T02:36:03+00:00
LiveMint,84,Silver Rate in Bangalore,https://www.livemint.com/silver-prices/bangalore,2026-04-12T02:36:03+00:00
LiveMint,85,US Stock Market,https://www.livemint.com/market/us-market,2026-04-12T02:36:03+00:00
LiveMint,86,Terms of Use,https://www.livemint.com/terms-of-use,2026-04-12T02:36:03+00:00
LiveMint,87,Code of ethics,https://www.livemint.com/code-of-ethics,2026-04-12T02:36:03+00:00
LiveMint,88,Stock Market Today,https://www.livemint.com/market/stock-market-news/stock-market-today-sensex-today-nifty-gold-rate-today-silver-rate-today-crude-oil-prices-us-iran-war-trump-7-april-2026-11775527434110.html,2026-04-12T02:36:03+00:00
LiveMint,89,MCX Gold Rate,https://www.livemint.com/market/market-stats/commodity-mcx-gold-price,2026-04-12T02:36:03+00:00
LiveMint,90,MCX Silver Price,https://www.livemint.com/market/market-stats/commodity-mcx-silver-price,2026-04-12T02:36:03+00:00
LiveMint,91,Gold Price in Mumbai,https://www.livemint.com/gold-prices/mumbai,2026-04-12T02:36:03+00:00
LiveMint,92,Gold Price in Chennai,https://www.livemint.com/gold-prices/chennai,2026-04-12T02:36:03+00:00
LiveMint,93,Gold Price in Kolkata,https://www.livemint.com/gold-prices/kolkata,2026-04-12T02:36:03+00:00
LiveMint,94,Silver Price in Mumbai,https://www.livemint.com/silver-prices/mumbai,2026-04-12T02:36:03+00:00
LiveMint,95,Silver Price in Chennai,https://www.livemint.com/silver-prices/chennai,2026-04-12T02:36:03+00:00
LiveMint,96,Silver Price in Hyderabad,https://www.livemint.com/silver-prices/hyderabad,2026-04-12T02:36:03+00:00
LiveMint,97,Silver Price in Kolkata,https://www.livemint.com/silver-prices/kolkata,2026-04-12T02:36:03+00:00
LiveMint,98,Latest News Today,https://www.livemint.com/news,2026-04-12T02:36:03+00:00
LiveMint,99,US News Today,https://www.livemint.com/news/us-news,2026-04-12T02:36:03+00:00
LiveMint,100,Top Company Leader,https://www.livemint.com/companies/people,2026-04-12T02:36:03+00:00
LiveMint,101,personal loan emi calculator,https://www.livemint.com/loans/personal-loan-emi-calculator,2026-04-12T02:36:03+00:00
LiveMint,102,Personal Loan Interest Rate,https://www.livemint.com/loans/personal-loan-interest-rates,2026-04-12T02:36:03+00:00
LiveMint,103,Personal Loan Eligibility,https://www.livemint.com/loans/personal-loan-eligibility,2026-04-12T02:36:03+00:00
LiveMint,104,Instant Personal Loan,https://www.livemint.com/loans/instant-personal-loan,2026-04-12T02:36:03+00:00
LiveMint,105,Home Loan EMI Calculator,https://www.livemint.com/tools-calculators/home-loan-emi-calculator,2026-04-12T02:36:03+00:00
LiveMint,106,Car Loan EMI,https://www.livemint.com/tools-calculators/car-loan-calculator,2026-04-12T02:36:03+00:00
India Today,1,"Woman fired for 'no work' gets rehired to train replacements, internet goes huh?",https://www.indiatoday.in/trending-news/story/woman-fired-for-no-work-gets-rehired-to-train-replacements-internet-goes-huh-2894811-2026-04-11,2026-04-12T02:36:03+00:00
India Today,2,Mumbai woman shares how her boss sent mangoes after she mentioned missing them,https://www.indiatoday.in/trending-news/story/mumbai-woman-shares-how-her-boss-sent-mangoes-after-she-mentioned-missing-them-2894796-2026-04-11,2026-04-12T02:36:03+00:00
India Today,3,"Little girl proudly shows her medal on cycle ride with father, you'll definitely smile",https://www.indiatoday.in/trending-news/story/little-girl-proudly-shows-her-medal-on-cycle-ride-with-father-youll-definitely-smile-2894771-2026-04-11,2026-04-12T02:36:03+00:00
India Today,4,"Korean woman unboxes RCB jersey, her reaction is just too adorable to miss",https://www.indiatoday.in/trending-news/story/korean-woman-unboxes-rcb-jersey-her-reaction-is-just-too-adorable-to-miss-2894721-2026-04-11,2026-04-12T02:36:03+00:00
India Today,5,"Woman confronts roadside vendor over standing on books, internet weighs in",https://www.indiatoday.in/trending-news/story/woman-confronts-roadside-vendor-over-standing-on-books-internet-weighs-in-2894712-2026-04-11,2026-04-12T02:36:03+00:00
India Today,6,"Indian techie requests flexible hours to care for newborn, US manager's reply is viral",https://www.indiatoday.in/trending-news/story/indian-techie-requests-flexible-hours-to-care-for-newborn-us-managers-reply-is-viral-2894675-2026-04-11,2026-04-12T02:36:03+00:00
India Today,7,German man praises India's healthcare after getting free treatment for dog bite,https://www.indiatoday.in/trending-news/story/german-man-praises-indias-healthcare-after-getting-free-treatment-for-dog-bite-in-gujarat-2894660-2026-04-11,2026-04-12T02:36:03+00:00
India Today,8,"IndiGo pilot meets Kattappa actor at 35,000 ft, asks iconic Baahubali question",https://www.indiatoday.in/trending-news/story/indigo-pilot-meets-kattappa-actor-at-35000-ft-asks-iconic-baahubali-question-2894409-2026-04-10,2026-04-12T02:36:03+00:00
India Today,9,"Techie who started at Rs 10,000 as intern now runs company, shares salary growth",https://www.indiatoday.in/trending-news/story/techie-who-started-at-rs-10000-as-intern-now-runs-company-shares-salary-growth-2894465-2026-04-10,2026-04-12T02:36:03+00:00
India Today,10,Mumbai Police shares 'no 2.0 to life' message as BTS comeback trends online,https://www.indiatoday.in/trending-news/story/mumbai-police-shares-no-20-to-life-message-as-bts-comeback-trends-online-2894329-2026-04-10,2026-04-12T02:36:03+00:00
India Today,11,"Gurugram founder fires employee on WhatsApp, 'no-notice' policy sparks backlash",https://www.indiatoday.in/trending-news/story/gurugram-founder-fires-employee-on-whatsapp-no-notice-policy-sparks-backlash-2894320-2026-04-10,2026-04-12T02:36:03+00:00
India Today,12,Chopper nikal jaayega: Nagaland minister's reply to woman asking for pic is viral,https://www.indiatoday.in/trending-news/story/chopper-nikal-jaayega-nagaland-ministers-reply-to-woman-asking-for-pic-is-viral-2894304-2026-04-10,2026-04-12T02:36:03+00:00
India Today,13,Maharashtrian couple reveals baby's name Virat with RCB jersey. This is too adorable,https://www.indiatoday.in/trending-news/story/maharashtrian-couple-reveals-babys-name-virat-with-rcb-jersey-this-is-too-adorable-2894249-2026-04-10,2026-04-12T02:36:03+00:00
India Today,14,"Bangkok-India flight passengers leave mess behind, woman calls out their behaviour",https://www.indiatoday.in/trending-news/story/bangkok-india-flight-passengers-leave-mess-behind-woman-calls-out-their-behaviour-2894250-2026-04-10,2026-04-12T02:36:03+00:00
India Today,15,Ankur Warikoo's emotional post on watching parents grow old hits close to home,https://www.indiatoday.in/trending-news/story/ankur-warikoos-emotional-post-on-watching-parents-grow-old-hits-close-to-home-2894189-2026-04-10,2026-04-12T02:36:03+00:00
India Today,16,Hyderabad thief's face in challan photo of stolen vehicle leads to his arrest,https://www.indiatoday.in/trending-news/story/hyderabad-thiefs-face-in-challan-photo-of-stolen-vehicle-leads-to-his-arrest-2894158-2026-04-10,2026-04-12T02:36:03+00:00
India Today,17,"Samay Raina Challenge pushes children to say 'I love you, dad' in viral trend",https://www.indiatoday.in/trending-news/story/samay-raina-challenge-pushes-children-to-say-i-love-you-dad-in-viral-trend-emotional-videos-2894153-2026-04-10,2026-04-12T02:36:03+00:00
India Today,18,Copy-paste 'peacemakers': Internet spots pattern in Pakistan passport posts,https://www.indiatoday.in/trending-news/story/copy-paste-peacemakers-internet-spots-pattern-in-pakistan-passport-posts-2893989-2026-04-09,2026-04-12T02:36:03+00:00
India Today,19,Delhi shop becomes go-to spot after Dhurandhar's doodh soda goes viral,https://www.indiatoday.in/trending-news/story/delhi-shop-becomes-go-to-spot-after-dhurandhars-doodh-soda-goes-viral-2893982-2026-04-09,2026-04-12T02:36:03+00:00
India Today,20,UP restaurant sealed after cockroach found in biryani during birthday party,https://www.indiatoday.in/trending-news/story/up-restaurant-sealed-after-cockroach-found-in-biryani-during-birthday-party-2893926-2026-04-09,2026-04-12T02:36:03+00:00
India Today,21,"Love Horoscope Today for Sunday, April 12, 2026: Respect and affection will remain in Cancer relationships, know the status of your sign",https://www.indiatoday.in/horoscopes/love-horoscope/story/love-horoscope-today-for-sunday-april-12-2026-respect-and-affection-will-remain-in-cancer-relationships-know-the-status-of-your-sign-2894865-2026-04-12,2026-04-12T02:36:03+00:00
India Today,22,"Numerology Number 9 Prediction Today, April 12, 2026: Will Avoid Mutual Disputes, Will Maintain Magnanimity",https://www.indiatoday.in/horoscopes/numerology/story/number-9-numerology-prediction-today-april-12-2026-will-avoid-mutual-disputes-will-maintain-magnanimity-2894840-2026-04-12,2026-04-12T02:36:03+00:00
India Today,23,"Numerology Number 8 Prediction Today, April 12, 2026: Profits Will Increase Business, Industry Tasks Will Gain Momentum",https://www.indiatoday.in/horoscopes/numerology/story/number-8-numerology-prediction-today-april-12-2026-profits-will-increase-business-industry-tasks-will-gain-momentum-2894839-2026-04-12,2026-04-12T02:36:03+00:00
India Today,24,"Sunil Grover's Javed Akhtar act wins internet, leaves Raj Babbar in splits",https://www.indiatoday.in/movies/celebrities/story/sunil-grover-javed-akhtar-mimicry-screen-awards-2026-internet-praise-2892550-2026-04-07,2026-04-12T02:36:03+00:00
India Today,25,Tejas back in the skies. Did HAL waste years and crores to deliver a dud?,https://www.indiatoday.in/india/story/tejas-light-combat-aircraft-lca-crashes-iaf-landing-mishap-dubai-air-show-hal-challenges-resolved-2892120-2026-04-07,2026-04-12T02:36:03+00:00
India Today,26,Maha Kumbh fame IIT Baba Abhay visits Haryana's Jhajjar after marriage,https://www.indiatoday.in/india/haryana/story/abhay-iit-baba-marries-plans-shri-university-knowledge-spirituality-2892498-2026-04-07,2026-04-12T02:36:03+00:00
India Today,27,"Horoscope Today: Astrological prediction April 7, 2026 for all zodiac signs",https://www.indiatoday.in/horoscopes/story/horoscope-today-april-7-2026-astrological-prediction-all-zodiac-signs-aries-taurus-gemini-cancer-leo-virgo-libra-scorpio-sagittarius-capricorn-aquarius-pisces-2892321-2026-04-07,2026-04-12T02:36:03+00:00
TOI ETimes,1,Inside Rajasthan’s push for meaningful baby names: What you name your child matters more than you think,https://timesofindia.indiatimes.com/articleshow/130161079.cms,2026-04-12T02:36:03+00:00
TOI ETimes,2,"Quote of the day by Claude Shannon, the eponym of Claude AI: Information is the resolution of uncertainty",https://timesofindia.indiatimes.com/articleshow/130164653.cms,2026-04-12T02:36:03+00:00
TOI ETimes,3,Indian and American parenting and parental care: Viral social media clip highlights cultural differences,https://timesofindia.indiatimes.com/articleshow/130167532.cms,2026-04-12T02:36:03+00:00
TOI ETimes,4,When “first day of school” feels like a big goodbye: A viral video every parent will relate to,https://timesofindia.indiatimes.com/articleshow/130167652.cms,2026-04-12T02:36:03+00:00
TOI ETimes,5,Not your usual ID check: School video showcases students’ hilarious ‘ID card emotions’,https://timesofindia.indiatimes.com/articleshow/130169206.cms,2026-04-12T02:36:03+00:00
TOI ETimes,6,"This 15-second brain puzzle can sharpen your child’s focus, boost attention skills, and train the mind to notice the smallest details",https://timesofindia.indiatimes.com/articleshow/130169671.cms,2026-04-12T02:36:03+00:00
TOI ETimes,7,"‘Dhurandhar 2’ inches closer to Rs 1,700 cr worldwide in 24 days",https://timesofindia.indiatimes.com/articleshow/130201201.cms,2026-04-12T02:36:03+00:00
TOI ETimes,8,Blake Lively lists Ryan Reynolds as witness in trial against Justin Baldoni,https://timesofindia.indiatimes.com/articleshow/130201696.cms,2026-04-12T02:36:03+00:00
TOI ETimes,9,Sabrina Carpenter apologizes for the comment on fan’s Arabic chant,https://timesofindia.indiatimes.com/articleshow/130201622.cms,2026-04-12T02:36:03+00:00
TOI ETimes,10,Actor Meena’s Chennai home sold for Rs 100 crore - Reports,https://timesofindia.indiatimes.com/articleshow/130201495.cms,2026-04-12T02:36:03+00:00
TOI ETimes,11,Here’s why Labrinth quit ‘Euphoria 3’,https://timesofindia.indiatimes.com/articleshow/130201390.cms,2026-04-12T02:36:03+00:00
TOI ETimes,12,"Michael Jackson’s son, Bigi Jackson, promotes late father’s biopic",https://timesofindia.indiatimes.com/articleshow/130201396.cms,2026-04-12T02:36:03+00:00
TOI ETimes,13,"Kartik Aaryan, Shefali Shah & others shower love on their special buddies this National Pet Day",https://timesofindia.indiatimes.com/articleshow/130201231.cms,2026-04-12T02:36:03+00:00
TOI ETimes,14,Kunal Ganjawala shares a fun anecdote from Salman Khan's Dil Keh Raha Hai' song,https://timesofindia.indiatimes.com/articleshow/130201228.cms,2026-04-12T02:36:03+00:00
TOI ETimes,15,Rashmika Mandanna and Vijay Deverakonda get warm welcome on 'Ranabaali' sets; Newlyweds cut cake with team,https://timesofindia.indiatimes.com/articleshow/130201306.cms,2026-04-12T02:36:03+00:00
TOI ETimes,16,"‘Dhurandhar 2’ box office collection day 24: Ranveer Singh’s film soars high; inches closer to Rs 1,700 crore worldwide",https://timesofindia.indiatimes.com/articleshow/130201206.cms,2026-04-12T02:36:03+00:00
TOI ETimes,17,Meryl Streep approves of Karan Johar’s Rs 1.25 lakh shoes as he chats with her and Anne Hathaway ahead of 'The Devil Wears Prada 2',https://timesofindia.indiatimes.com/articleshow/130199000.cms,2026-04-12T02:36:03+00:00
TOI ETimes,18,When Asha Bhosle spoke about singing live on stage at the age of 90 and suriving through difficult times in her life,https://timesofindia.indiatimes.com/articleshow/130198263.cms,2026-04-12T02:36:03+00:00
TOI ETimes,19,'Dhurandhar 2' box office day 24 [LIVE]: Film inches towards Rs 1100 cr,https://timesofindia.indiatimes.com/articleshow/130185972.cms,2026-04-12T02:36:03+00:00
TOI ETimes,20,‘Dhurandhar 2’ earns Rs 6.70 crore on day 23,https://timesofindia.indiatimes.com/articleshow/130182439.cms,2026-04-12T02:36:03+00:00
TOI ETimes,21,'Dhurandhar 2' box office collection day 23 [Live],https://timesofindia.indiatimes.com/articleshow/130165382.cms,2026-04-12T02:36:03+00:00
TOI ETimes,22,'Dhurandhar 2' FAILS to break 'Dhurandhar' week 3 record,https://timesofindia.indiatimes.com/articleshow/130156099.cms,2026-04-12T02:36:03+00:00
TOI ETimes,23,'Dhurandhar 2' BO day 22 [LIVE]: Ranveer Singh film chases Rs. 1050 crore milestone,https://timesofindia.indiatimes.com/articleshow/130132935.cms,2026-04-12T02:36:03+00:00
TOI ETimes,24,Animal Preview: Ranbir Kapoor and Sandeep Reddy Vanga are set to shake up the box office hierarchy,https://timesofindia.indiatimes.com/articleshow/105615612.cms,2026-04-12T02:36:03+00:00
TOI ETimes,25,Tu Jhoothi Main Makkaar,https://timesofindia.indiatimes.com/articleshow/98272134.cms,2026-04-12T02:36:03+00:00
TOI ETimes,26,Rakhi Sawant Evicted: wild card exit adds Rs 7 lakh to prize money,https://timesofindia.indiatimes.com/articleshow/130198120.cms,2026-04-12T02:36:03+00:00
TOI ETimes,27,"Archana, Parmeet praise Samay’s Still Alive; call him rockstar",https://timesofindia.indiatimes.com/articleshow/130191912.cms,2026-04-12T02:36:03+00:00
TOI ETimes,28,Swati Rajput Announces Pregnancy: Actress shares maternity photos,https://timesofindia.indiatimes.com/articleshow/130194139.cms,2026-04-12T02:36:03+00:00
TOI ETimes,29,Sagar On Meaningful Roles: Actor picks impact over easy fame,https://timesofindia.indiatimes.com/articleshow/130190278.cms,2026-04-12T02:36:03+00:00
TOI ETimes,30,Karisma Kapooor returns to 'India's Best Dancer 5',https://timesofindia.indiatimes.com/articleshow/130184568.cms,2026-04-12T02:36:03+00:00
TOI ETimes,31,Indian Idol 16: Ex-contestant Myscmme Bosu returns as wildcard,https://timesofindia.indiatimes.com/articleshow/130197803.cms,2026-04-12T02:36:03+00:00
TOI ETimes,32,Karishma Tanna’s New Haircut: Actor debuts short look,https://timesofindia.indiatimes.com/articleshow/130194762.cms,2026-04-12T02:36:03+00:00
TOI ETimes,33,Kanwar Dhillon calls Udne Ki Aasha off-air talk baseless,https://timesofindia.indiatimes.com/articleshow/130194668.cms,2026-04-12T02:36:03+00:00
TOI ETimes,34,Korean proverb of the day: “Even a sheet of paper is lighter when two people lift it together”,https://timesofindia.indiatimes.com/articleshow/130199002.cms,2026-04-12T02:36:03+00:00
TOI ETimes,35,Peeling ginger with a spoon: The simple hack you need,https://timesofindia.indiatimes.com/articleshow/130184964.cms,2026-04-12T02:36:03+00:00
TOI ETimes,36,Personality test: Choose a house and it will reveal what's your priority in life,https://timesofindia.indiatimes.com/articleshow/130198366.cms,2026-04-12T02:36:03+00:00
TOI ETimes,37,Why dry rice in salt shakers beats moisture for clump-free spices,https://timesofindia.indiatimes.com/articleshow/130184962.cms,2026-04-12T02:36:03+00:00
TOI ETimes,38,"""Ab kha lun?"": This viral dadi moment is reminding everyone of their own grandparents",https://timesofindia.indiatimes.com/articleshow/130194847.cms,2026-04-12T02:36:03+00:00
TOI ETimes,39,The secret ingredient in your linen closet that is quietly perfecting your home-baked bread,https://timesofindia.indiatimes.com/articleshow/130184961.cms,2026-04-12T02:36:03+00:00
TOI ETimes,40,Optical illusion: Only 1 in 20 can crack this! Can you spot all 4 hidden animals in 15 seconds?,https://timesofindia.indiatimes.com/articleshow/130190271.cms,2026-04-12T02:36:03+00:00
TOI ETimes,41,Arriving on a horse for your baraat? Shantanu Naidu's viral video raises questions about animal cruelty in Indian weddings,https://timesofindia.indiatimes.com/articleshow/130189433.cms,2026-04-12T02:36:03+00:00
TOI ETimes,42,"Which Raja Ravi Varma painting is now India’s most expensive ever, and why can’t it leave the country?",https://timesofindia.indiatimes.com/articleshow/130188686.cms,2026-04-12T02:36:03+00:00
TOI ETimes,43,"The Sahara desert was once green and full of lakes and rivers: Cave reveals secrets from 8,000 years ago!",https://timesofindia.indiatimes.com/articleshow/130188418.cms,2026-04-12T02:36:03+00:00
TOI ETimes,44,What is the viral 'anxiety bag' and how it’s helping stressed Gen Z stay calm?,https://timesofindia.indiatimes.com/articleshow/130186848.cms,2026-04-12T02:36:03+00:00
TOI ETimes,45,"Battle for the Planet of the Apes: 200 chimpanzees locked in a 'civil war' in Uganda, reveals study",https://timesofindia.indiatimes.com/articleshow/130188091.cms,2026-04-12T02:36:03+00:00
TOI ETimes,46,Offset discharged from hospital post shooting incident,https://timesofindia.indiatimes.com/articleshow/130182642.cms,2026-04-12T02:36:03+00:00
TOI ETimes,47,BTS on early struggles: 'We were really in danger',https://timesofindia.indiatimes.com/articleshow/130128930.cms,2026-04-12T02:36:03+00:00
TOI ETimes,48,Xavier Trudeau talks about bond with Katy Perry,https://timesofindia.indiatimes.com/articleshow/130105009.cms,2026-04-12T02:36:03+00:00
TOI ETimes,49,Sabrina Carpenter reflects on working with her older sister,https://timesofindia.indiatimes.com/articleshow/130102865.cms,2026-04-12T02:36:03+00:00
TOI ETimes,50,Who is Ray Stevens?,https://timesofindia.indiatimes.com/articleshow/130102807.cms,2026-04-12T02:36:03+00:00
TOI ETimes,51,NASA replies to Travis Kelce’s old tweet,https://timesofindia.indiatimes.com/articleshow/130102760.cms,2026-04-12T02:36:03+00:00
TOI ETimes,52,Beyond Ebooks: The charm of bookstores endures,https://timesofindia.indiatimes.com/articleshow/101098088.cms,2026-04-12T02:36:03+00:00
TOI ETimes,53,It’s a curtain call: Sania Mirza bids adieu to tennis with ‘happy tears’,https://timesofindia.indiatimes.com/articleshow/98440670.cms,2026-04-12T02:36:03+00:00
TOI ETimes,54,A magical makeover for 17th Century stepwell: From neglected ruins to a glorious piece of history,https://timesofindia.indiatimes.com/articleshow/96557955.cms,2026-04-12T02:36:03+00:00
TOI ETimes,55,The city comes alive with Christmas fervour,https://timesofindia.indiatimes.com/articleshow/96406573.cms,2026-04-12T02:36:03+00:00
TOI ETimes,56,#BringRioHome: Pet parents launch search to find their kidnapped cat,https://timesofindia.indiatimes.com/articleshow/96334809.cms,2026-04-12T02:36:03+00:00
TOI ETimes,57,Adil Hussain’s 'Mercy' release date OUT: Film's first look to be attached with Ranveer Singh's 'Dhurandhar: The Revenge',https://timesofindia.indiatimes.com/articleshow/129843424.cms,2026-04-12T02:36:03+00:00
TOI ETimes,58,It’s the best time to be doing theatre: Juhi Babbar Soni,https://timesofindia.indiatimes.com/articleshow/129826631.cms,2026-04-12T02:36:03+00:00
TOI ETimes,59,"Anu Malik steps into theatre with Anupam Kher’s play, Calls it his most exciting challenge yet",https://timesofindia.indiatimes.com/articleshow/129729335.cms,2026-04-12T02:36:03+00:00
TOI ETimes,60,'Wicked' musical director John Stefaniuk on live music on the stage: 'It is so exciting to hear the orchestra whisk us away',https://timesofindia.indiatimes.com/articleshow/129610267.cms,2026-04-12T02:36:03+00:00
TOI ETimes,61,"'Wicked' stars Rebekah Lowings and Eve Shanu-Wilson on Elphaba-Glinda's bond: 'Friends challenge you, not just cheer you on'",https://timesofindia.indiatimes.com/articleshow/129607673.cms,2026-04-12T02:36:03+00:00
TOI ETimes,62,"Vijay Crishna, Shah Rukh Khan’s on-screen father in ‘Devdas,’ passes away at 81: Tributes pour in for theatre stalwart",https://timesofindia.indiatimes.com/articleshow/129016007.cms,2026-04-12T02:36:03+00:00
TOI ETimes,63,Raj Kundra and Shilpa Shetty's 15th Wedding Anniversary,https://timesofindia.indiatimes.com/articleshow/115563990.cms,2026-04-12T02:36:03+00:00
TOI ETimes,64,​Bigg Boss winners list from season 1 to 17​,https://timesofindia.indiatimes.com/articleshow/114277426.cms,2026-04-12T02:36:03+00:00
TOI ETimes,65,​Discover the bird with a prehistoric roar​,https://timesofindia.indiatimes.com/articleshow/114244474.cms,2026-04-12T02:36:03+00:00
TOI ETimes,66,Dia Mirza's ethnic wear,https://timesofindia.indiatimes.com/articleshow/114243410.cms,2026-04-12T02:36:03+00:00
TOI ETimes,67,​Incredible facts about ants you won’t believe​,https://timesofindia.indiatimes.com/articleshow/114243248.cms,2026-04-12T02:36:03+00:00
TOI ETimes,68,'Bigg Boss Marathi 5' nears grand finale​,https://timesofindia.indiatimes.com/articleshow/113936459.cms,2026-04-12T02:36:03+00:00
TOI ETimes,69,"ChatGPT’s Sam Altman home attacked with Molotov cocktail: CEO shares family photo, says, “I love them more than anything”",https://timesofindia.indiatimes.com/articleshow/130186660.cms,2026-04-12T02:36:03+00:00
TOI ETimes,70,Milgram’s electric shock experiment: The test that exposed dark side of human obedience to authority,https://timesofindia.indiatimes.com/articleshow/130195529.cms,2026-04-12T02:36:03+00:00
TOI ETimes,71,14-year-old boy selling postcards outside Angkor Wat who spoke 12 languages is now living an entirely different life,https://timesofindia.indiatimes.com/articleshow/130197303.cms,2026-04-12T02:36:03+00:00
TOI ETimes,72,Indian-origin MBA student breaks silence after viral clash with Nikhil Kamath: 'I grew up with privilege...',https://timesofindia.indiatimes.com/articleshow/130193502.cms,2026-04-12T02:36:03+00:00
TOI ETimes,73,Who was Sawai Madho Singh II? The Maharaja who carried his own water to the United Kingdom in the world's largest silverware,https://timesofindia.indiatimes.com/articleshow/130190590.cms,2026-04-12T02:36:03+00:00
TOI ETimes,74,What is Amanda Ungaro's link to Melania Trump? Meet the Brazilian model who has a connection with Epstein and claims to 'expose' everything she knows about the US First Lady,https://timesofindia.indiatimes.com/articleshow/130184673.cms,2026-04-12T02:36:03+00:00
TOI ETimes,75,"Who is Doreen Romel Shamow? ""Iraq's power queen"" and volleyball player going viral online for her adorable looks",https://timesofindia.indiatimes.com/articleshow/130176488.cms,2026-04-12T02:36:03+00:00
TOI ETimes,76,"Meet Nathan Byrd: The 18-year-old who dashed into a smoke-filled home, saved family and a dog",https://timesofindia.indiatimes.com/articleshow/130175208.cms,2026-04-12T02:36:03+00:00
TOI ETimes,77,Rare solar eclipse spotted on the never-before-seen side of the Moon: What unique phenomenon did Artemis II astronauts observe during their flyby beyond the Moon?,https://timesofindia.indiatimes.com/articleshow/130174023.cms,2026-04-12T02:36:03+00:00
TOI ETimes,78,What is Buzz Lightyear’s Space Ranger Spin? Iconic 90s Disney ride reopens with a facelift before Toy Story 5 release,https://timesofindia.indiatimes.com/articleshow/130173849.cms,2026-04-12T02:36:03+00:00
TOI ETimes,79,"He was 229 kg, his friend sent him fat-shaming texts for weeks, then he lost 130 kg",https://timesofindia.indiatimes.com/articleshow/130170915.cms,2026-04-12T02:36:03+00:00
TOI ETimes,80,Who is Jason Howe? The 26-year-old high school coach accused of assault after student’s brave complaint,https://timesofindia.indiatimes.com/articleshow/130170573.cms,2026-04-12T02:36:03+00:00
TOI ETimes,81,"Who is Rao Inderjeet Yadav? From luxury lifestyle posts to Dubai arrest claim, what we know so far",https://timesofindia.indiatimes.com/articleshow/130165704.cms,2026-04-12T02:36:03+00:00
